title,publishTime,category,intro,maxFreeChapter,newRating,free,price,cover
女性养生三步走：疏肝、养血、心要修,2019-01-01 00:00:00,医学健康-两性,女性养生可以分为三步：第一步疏肝气女性绝大多数疾病都是肝气郁结造成的，原因是压力大，爱生气，总憋屈，时间一长自然就憋出了病。肝气郁结，会由内而外、全面地损害女性的健康，所以，女性养生，疏肝气是头等大事。第二步养阴血女性是靠血来滋养的，血液一亏，百病丛生。由于月经、流产和分娩等很容易耗伤阴血，所以女性血虚和瘀血的情况非常普遍，这是造成许多妇科疾病的另一大原因。遇到这种情况，就可以通过补血和活血化瘀来治疗。第三步修心性很多女性患病并不是因为身体，而是因为心性。其实，肝气郁结很大一部分原因就在于心性不够宽广，遇事想不开，爱钻牛角尖。古人说：“祸福无门，唯人自召。”疾病也是一样，如果您心性好，站得高，看得远，想得开，活得透，肝气调和畅达，正气内存，疾病就不会找上您。,9,907,0,20.4,https://wfqqreader-1252317822.image.myqcloud.com/cover/854/33800854/s_33800854.jpg
身体由我：关于了不起的女性身体的一切,2021-11-08 00:00:00,医学健康-两性,"这是一部女性健康科普著作，图书出版后在德国医学界和科普界收获了一致盛赞，长踞《明镜》周刊畅销榜，领衔各大健康百科及女性健康图书榜单。
许多女性对自己身体所持的态度是不确定的，其实，子宫、乳房、卵巢、生理期，它们存在于世界上半数人的体内，它们与生命密切相连，它们的健康直接决定了女性的生命质量，因此，它们是应当“被看见”、“被了解”的。在认知身体的旅途中，女性将意识到，很多心理的变化和情绪的起伏，都由体内的荷尔蒙所掌控。对荷尔蒙系统的深入认知，能够帮助我们理解抵御衰老和守护健康的准则。而所有的知识储备升级，都将带领我们，找到更加广阔的那个自己。",7,910,0,48.3,https://weread-1258476243.file.myqcloud.com/weread/cover/93/3300018093/s_3300018093.jpg
女生呵护指南,2019-08-01 00:00:00,医学健康-两性,医学硕士，妇产科医生，女性健康领域知乎大V、女性健康自媒体“第十一诊室”创始人六层楼的暖心之作。一定要知道的关于女生的那些事儿：女性生理、妇科疾病、安全防护……这本书既是女生的私密宝典，也是了解和关爱女生的大百科，让你懂得如何呵护女生。轻松、幽默、贴心而又科学、严谨的内容会陪女生度过痛苦和迷茫的时刻，给予女生温暖的呵护。,23,845,0,56,https://wfqqreader-1252317822.image.myqcloud.com/cover/714/26087714/s_26087714.jpg
你的身体，是一切美好的开始,2015-03-01 00:00:00,医学健康-两性,卡梅隆˙迪亚茨将她在20年来的健康之旅中得到的建议、提示、技巧和有用的科学，与女性朋友们分享。她想让女士们明白，变健康永远比变瘦更重要。我们的身体永远是我们所能拥有的最好也是最重要的有形之物，只有了解她、接受她、呵护她，才能真正拥有自信、遇见美好。最好的东西都是不可能速成的，那种能让你一夜之间变得健健康康、快快乐乐的速效良方、魔力药丸，是根本不存在的。本书的目标是你未来的永远。你将得到的不是减掉几斤体重、缩小几寸腰围，而是全方位的身心健康。今天、明天，直到20年后，营养、运动、自律都是最值得你花时间去关注的问题，因为这些就是健康，而健康就是一切。,10,735,0,79.8,https://wfqqreader-1252317822.image.myqcloud.com/cover/444/917444/s_917444.jpg
夫妻性生活1000问,2012-01-02 00:00:00,医学健康-两性,全书以男人与性、女人与性、夫妻性生活、其他性问题等篇章分门别类地详细揭秘“性”，并在每个问题的后面附上“贴心小叮咛”，给读者一个心理按摩。,171,684,0,10.5,https://wfqqreader-1252317822.image.myqcloud.com/cover/410/679410/s_679410.jpg
脾虚的女人老得快：女中医师亲授新妇科公开课,2013-11-01 00:00:00,医学健康-两性,"    作者佟彤汇集了协和、中日友好、北京大学第一医院等三甲医院博导级妇科医师的最新临床精粹，围绕“脾虚的女人老得快”这样一个观点，细说了痛经、乳腺增生、卵巢囊肿等高发、频发的女人病，及黄褐斑、黑眼圈、游泳圈等女性常见的早衰烦恼，并从专业角度颠覆众了多健康养颜谬误、揭露广告背后的陷阱，全面呵护女性健康。《脾虚的女人老得快》全书权威、实用、易操作。
",2,782,0,17.99,https://wfqqreader-1252317822.image.myqcloud.com/cover/296/714296/s_714296.jpg
让孩子不发烧、不咳嗽、不积食（全新修订升级版）,2018-04-01 00:00:00,医学健康-两性,这是一本专门教父母用食疗和心理学方法对症调理孩子常见病的书。孩子生病了，什么时候该自己调理，用什么简单、安全的方法调理，什么时候该送医院？如何让孩子疾病不再复发？这本书里讲得清清楚楚，即便是一点儿医学知识都没有的家长，也能照方调理或举一反三。本书针对性强，能够帮助家长解决0~10岁孩子发烧、咳嗽、积食的常见病症。书中把孩子发烧、咳嗽、积食各个阶段的病因和症状讲得通俗、清晰，可以让任何家长都能及时发现孩子身体状况的变化，防患于未然。介绍的调理方法简单、安全，多为食疗及外治法，能提供给家长一系列可操作的解决方案。您知道孩子的大部分疾病都是源自脾虚吗？您知道家庭气氛不好，家长情绪不好是会造成孩子身体健康出现问题吗？您知道孩子舌苔脱落是因为脾胃受伤导致的吗？您知道孩子不长个、不长肉是因为脾虚吗？您知道孩子胃口差应该如何调理吗？您知道肥胖对孩子有多大的害处吗？您知道家长养心对孩子有多大的影响吗？如果您不知道孩子生病的根源，您只能茫然地面对孩子一次又一次的疾病，只能把孩子的健康寄希望于医院和药物。畅销育儿保健书《让孩子不发烧、不咳嗽、不积食》前传，告诉家长如何从根源上保护孩子不生病！,35,882,0,14.99,https://wfqqreader-1252317822.image.myqcloud.com/cover/321/25960321/s_25960321.jpg
沈氏女科600年：女人会养不会老,2017-01-01 00:00:00,医学健康-两性,不管是美丽的容颜还是健康的身体，都要靠养。而且“养”又分为“内养”和“外养”。只可惜，太多女人只肯花时间在“外养”上，犯了舍本逐末的错误。比如：女人对待皮肤松弛如临大敌，重金做美容取得的效果也只是暂时的。因为内养才是根本。想让自己的线条紧致、气色红润，你得保持脾气强健，从内部调养才是女性延缓衰老的根本办法。不管是脸色黯淡无光、长暗疮、色素沉着、皮肤差、气色差，还是长皱纹、腰酸背痛、骨质疏松以及各种疾病，预防它们的方法就在你自己的手中。只看你是否能够用心经营。从头到脚、由内而外、从体形到肤色，你都可以通过饮食调理、日常保健、情志调节来保持年轻美丽。,15,751,0,39.99,https://wfqqreader-1252317822.image.myqcloud.com/cover/578/30151578/s_30151578.jpg
只有医生知道！2,2013-11-01 00:00:00,医学健康-两性,协和张羽医生应广大读者要求，诚意奉上该系列第二本，生动讲述只有医生才知道的医学科普知识、求医问药之道。《只有医生知道！2》，精彩讲故事，明白说科普。教大家识别市面上几种妇产科最常见的过度医疗陷阱，告诉大家更多高效备孕、封山育林的妙方好招，用案例阐述不采取避孕措施的危险后果，最生动直观、效果极佳的性教育知识……更多读者最想知道的、普通女性都需要知道的健康知识，尽在《只有医生知道！2》。@协和张羽发给天下女性的又一封关爱私信。,2,876,0,9.99,https://wfqqreader-1252317822.image.myqcloud.com/cover/748/449748/s_449748.jpg
只有医生知道！3,2015-12-01 00:00:00,医学健康-两性,资深妇产科专家协和张羽继畅销百万册的《只有医生知道1》《只有医生知道2》后，暌违2年，系列第三本诚意回归！针对广大女性关注的孕育及健康问题进行深入阐述，以细腻真实的笔触，首次披露自身经历的剖宫产“倒霉遭遇”，再度挖掘鲜为人知的产房故事，特别针对漏尿、乙肝病人哺乳、外阴整形、二胎生育等热点问题进行详细解读。全书语言通俗易懂，极具亲和力和实用性，庞大的新鲜医学知识让你醍醐灌顶，澳门行医经历更让人大开眼界。,15,874,0,9.99,https://wfqqreader-1252317822.image.myqcloud.com/cover/61/790061/s_790061.jpg
脾虚的孩子不长个、胃口差、爱感冒（全新修订升级版）,2018-04-01 00:00:00,医学健康-两性,一本从调理脾胃和情绪入手，教会家长如何对症调理孩子常见病并祛除疾病根的书。书里介绍的各类调理方法已被无数受益的家长验证有效。山不在高，有仙则灵，本书介绍的食疗方和推拿方都是直接有效的，只要家长认真按书里介绍的辩证使用即可。在《脾虚的孩子不长个、胃口差、爱感冒》之前，还没有一本专门用食疗和中医外治方法帮助家长调理孩子瘦弱、不长个、胃口差、爱发脾气等一系列家长焦心的孩子生理和心理问题的书。随书附赠：让孩子长得高、胃口好、不感冒的特效推拿、食疗方速查速用全彩拉页。您知道孩子的大部分疾病都是源自脾虚吗？您知道家庭气氛不好，家长情绪不好是会造成孩子身体健康出现问题吗？您知道孩子舌苔脱落是因为脾胃受伤导致的吗？您知道孩子不长个、不长肉是因为脾虚吗？您知道孩子胃口差应该如何调理吗？您知道肥胖对孩子有多大的害处吗？您知道家长养心对孩子有多大的影响吗？如果您不知道孩子生病的根源，您只能茫然地面对孩子一次又一次的疾病，只能把孩子的健康寄希望于医院和药物。畅销育儿保健书《让孩子不发烧、不咳嗽、不积食》前传，告诉家长如何从根源上保护孩子不生病！,23,917,0,14.99,https://wfqqreader-1252317822.image.myqcloud.com/cover/461/25960461/s_25960461.jpg
女性90%的病是憋出来的：罗博士教你不憋屈，不上火，不生病,2020-03-01 00:00:00,医学健康-两性,憋屈会对女性的身体造成全面的损害，具体表现为“六郁”：气郁。简单来说，就是人受了气，想不通，憋屈在心中，没有排解出去，让身体承受压力的一种状态。血郁。长期生气，会导致气郁，而长期气郁，则会阻碍血的运行，导致气滞血瘀。火郁。想法太多，实现不了，人就会郁闷、生气；而太多的气憋屈在身体中，就会积热化火，出现火郁。湿郁。气运行不畅，除了导致气滞血瘀外，还会导致水湿代谢不出去，淤积在身体内，出现湿郁。湿郁就像身体中的水牢，困在其中，必然导致诸多问题。痰郁。湿郁产生后，身体里湿气变重，会凝聚成痰，而痰多了，不能及时化掉并排出，就会形成痰郁，导致很多大病和怪病。食郁。情绪不好，会直接影响肠胃，肠胃能消化食物，却无法消化忧愁、怨恨和愤怒，当这些情绪太多，憋屈在身体中，就会卡住吃下去的食物，导致食郁。而憋屈的原因则在于，遇事想不开，患上了认知上的“比较病”“应该病”“受害病”和“嫌弃病”。本书不仅介绍了身体内的六种郁结，告诉大家如何诊断，如何用相应的方子和方法及时进行调理，避免酿成重病、大病。当认知改变后，情绪就会变好，而情绪变好后，就能做到不憋屈，不上火，不生病。,23,897,0,20.4,https://wfqqreader-1252317822.image.myqcloud.com/cover/852/33800852/s_33800852.jpg
图解儿童舌诊,2019-07-25 00:00:00,医学健康-两性,现在，有太多家长缺乏正确的育儿知识，导致孩子生病后四处求医，也给医院增加了压力——现在很多儿科医生都处于压力极大的状态。即便如此，有些病还有可能治不好。如此，孩子会更加遭罪。这是一本通过观察孩子的舌象来及早发现孩子生病的内因（孩子的身体本身出了什么问题，实际上内因是基础），并通过食疗、推拿等方法调理孩子身心的中医家庭育儿健康书。希望每位家长平常多观察孩子的舌象，如果发现孩子的身体有偏颇，通过饮食、推拿等种种方法调整过来，这就是孩子的福音，也是家长的成功。相信孩子在您的呵护下一定会越来越健康。,16,893,0,20.97,https://wfqqreader-1252317822.image.myqcloud.com/cover/795/26309795/s_26309795.jpg
女性养生三法宝（上下册）,2020-09-24 00:00:00,医学健康-两性,现代女性在社会中的位置太重要了，一方面要考虑自身的工作学习、成长、生活，另一方面，还要考虑自己另一半的生活和双方的父母。女性的身心健康与否，直接影响着另一半的生活与工作的稳定。更重要的是，女性的身心是否健康，直接决定了她们孩子的身体是否健康；女性的心态是否良好，也直接决定了孩子将来接受教育的高度。在本书中，知名中医专家罗大伦博士一次讲透了女性健康之道，彻底从根源入手帮女性调理种种身心问题，既能让女性学会如何避免身心受伤，也能让女性学会如何尽快把已经出了问题的身心调整过来。可以说，本书是一套无论什么年纪的女性都适用的“自检自查自调”的健康宝典。,26,894,0,69,https://wfqqreader-1252317822.image.myqcloud.com/cover/635/33915635/s_33915635.jpg
沈氏女科600年：女人养颜先养肝,2021-03-01 00:00:00,医学健康-两性,女性要美容养颜，保持年轻态、健康态，养肝是关键。太多女性为了美容养颜，不惜花费大量时间、精力和金钱，但她们往往忘了，健康和美丽一定是自内而外的。脂粉可以修饰你的气色，但从眼睛里透出来的神采，以及整个人传递给他人的精气神，是任何护肤品和整容术都不能给你的。能给你这些的，是强健的身体，尤其是健康的肝。女性的很多生理活动都有耗血多的特点，养血就显得尤为关键。而肝主藏血，所以女人的保养应该以肝为先天。中医上讲的肝，不仅仅能排毒，还能滋养女性全身各系统。然而，很多人的日常行为对肝是相当不友好的。久视伤肝血，熬夜伤肝血，抑郁逆肝气，愤怒动肝火。所以，太多人需要养肝，尤其是女性。希望这本书可以使女性朋友树立养肝的意识，改掉日常生活中那些伤肝的坏习惯，重视身体发出的小信号并且及时调理，保证肝气畅通、肝血充盈。这样的话，不仅痛经、黄褐斑等小毛病会迎刃而解，而且整个人也能神采奕奕、自带光芒。,2,711,0,29.99,https://wfqqreader-1252317822.image.myqcloud.com/cover/569/39127569/s_39127569.jpg
简养：每个女人都能学会的四步养生法,2020-07-01 00:00:00,医学健康-两性,我国养生理念颇多，但为什么调理后不久又会复发，亦或是这里刚好，那里又出了问题？要知道，养生是个循序渐进的过程，不仅欲速则不达，而且环环相扣才更有效。女性养生四步曲：调气血——养生先养气，养颜先养血。气和血，生命的两大能量源头。养好阴——气血与阴液互生，气血足则阴足，阴足则体健。辨体质——气血和，阴平阳秘，搭配体质美容，冻龄易瘦不在话下！修好心——美由心生，修心助你进入养生的最高境界，解锁优雅又高贵的生活。,16,839,0,19,https://wfqqreader-1252317822.image.myqcloud.com/cover/809/31936809/s_31936809.jpg
42天经典月子餐（视频版）,2020-07-01 00:00:00,医学健康-两性,看视频，跟金牌月嫂学做月子餐！月子会所黄金套餐，坐月子一天一页照着吃。252道月子餐食谱，调体质不留月子病！坐月子一日三餐+产后恢复+新生儿护理一本搞定，超值附赠10节视频课！,19,857,0,14.94,https://wfqqreader-1252317822.image.myqcloud.com/cover/497/36800497/s_36800497.jpg
养好内分泌，女人气色佳、情绪好、病不找,2018-11-01 00:00:00,医学健康-两性,女人一生的健康，内分泌做主导。在很多人的印象中，内分泌失调，只不过是不值一提的皮毛和情绪问题。这可能是对内分泌最为普遍而又根深蒂固的误会了。女人身体的问题多是内分泌的问题。女性朋友从青春期发育到月经、怀孕、生子、更年期，每一件人生大事都跟内分泌密不可分。从月经失调、痛经、不孕不育、多囊卵巢综合征到泌乳素瘤、乳腺疾病、更年期综合征、绝经后的骨质疏松，不论哪一种都跟内分泌密切相关。不仅如此，要年轻抗衰老，内分泌平衡才是真正王道。本书是献给万千女性的内分泌自我保健书，拥有20余年临床经验的妇科内分泌医师以通俗的语言、真实的案例，让女性了解内分泌对身体的影响，并针对女性常见的内分泌问题和因此带来的疾病，为大家一一介绍。呵护好内分泌，女性想要的皮肤好、身材好、心情好、体力好、妇科好、家庭幸福，都可以如愿。,32,687,0,17.99,https://wfqqreader-1252317822.image.myqcloud.com/cover/814/25375814/s_25375814.jpg
范志红写给女人的美丽健康书,2016-05-01 00:00:00,医学健康-两性,本书是人气营养学家范志红教授特别奉献给中国女性的健康宝典。美丽是女人一生的修行。那么，开始宠爱自己，做健康美丽的智慧女人吧。在书中，范志红教授对女性所关注的美容、减肥、备孕、优生、抗衰老、三高防控等问题做了细致的论述。书中不仅有短小精悍的段子，还包括与网友的互动问答以及大量精彩博文。通过科学严谨而不乏温情的叙述，范志红将健康的理念传递给广大读者，告诉女性朋友们：要获得美丽的容颜，首先要有健康的身体，美丽一定是由内而外散发出来的气质美、健康美。美丽的女人，不仅需要储备充足的健康知识，更需要有足够的生活智慧。,6,723,0,27.99,https://wfqqreader-1252317822.image.myqcloud.com/cover/522/915522/s_915522.jpg
奇迹的28天子宫排毒,2021-05-01 00:00:00,医学健康-两性,姜明孜，1948年生于首尔。以名的成绩从庆熙大学韩医系毕业，1985年，成为韩国位获得韩医博士学位的女性。几十年来，一直潜心研究子宫健康问题。目前任庆熙大学外聘教授、韩方医院协会副会长、花村韩方医院院长。40余年来，治愈的不孕不育患者超过10000名，获得“三神奶奶”的称号，是此领域的权威专家。著作有《三神奶奶：关于女性不孕症，韩医学的诊断和处方》《用韩方治愈不孕》《一定要有孩子》等，已成功让更多的亚洲女性注意到了子宫健康这一问题。,10,521,0,17.99,https://wfqqreader-1252317822.image.myqcloud.com/cover/611/40055611/s_40055611.jpg
李军红说新妇科千金方（升级版）,2016-08-01 00:00:00,医学健康-两性,减肥、祛斑、祛皱、润唇、美肤、痛经、乳腺增生、阴道炎、盆腔炎......扫光妇科病、调理体质、健康美颜，少花钱，疗效好！1条轴决定女人体质：肾——天癸——冲任——胞宫，掌握轴心，身体不虚2大体液判断女人健康：月经：经迟、经早、痛经、闭经，断明病因好调理白带：白带、赤带、黄带、黑带，是湿是热食疗有对策3个要素影响女人健康：暖：手冷脚冷腰冷新也冷，女人一生要温补气：气虚、气郁、气滞，气顺气足的女人气质好新增47个药房里能买到的私家秘方：牛黄丸——清肺热祛口臭、调节便秘参桂鹿茸丸——调理体质，生出健康宝宝加味左金丸——调肝治肝良药七宝美髯丸——乌发、防脱发、白发连翘败毒丸——清热解毒，散风消肿益母草颗粒——调节月经参苓白术丸——治疗脾虚湿重,29,843,0,11.94,https://wfqqreader-1252317822.image.myqcloud.com/cover/841/840841/s_840841.jpg
协和专家说长高：含增高食谱（增订本）,2022-02-01 00:00:00,医学健康-两性,很多父母觉得，自己个子小，孩子注定长不高。事实上，遗传因素只能决定身高的70%，营养、睡眠、运动、情绪这些后天因素，对身高的影响能达到30%。别小看这30%，它意味着从1.6米到1.8米的巨大差距！北京协和医院矮小门诊教授、博士生导师潘慧，在本书中总结了大量长高案例，手把手教给父母关于孩子生长发育的知识和技巧。只要孩子没有停止长高，就有可能比预期多长10厘米以上。,21,702,0,39,https://wfqqreader-1252317822.image.myqcloud.com/cover/106/43014106/s_43014106.jpg
守护女性荷尔蒙：女医师教你如何老得慢 情绪好 不发胖,2020-05-01 00:00:00,医学健康-两性,女性一生中分泌的荷尔蒙，大约只有一茶匙的分量。不只是与怀孕、生产有关，女性荷尔蒙也是成就女性特有的体态，滑润紧致的肌肤，富有弹性和光泽的秀发，强壮的骨骼等，打造美丽、健康的身体的必备之物。女人的身体，正是由这一点点女性荷尔蒙守护着。35岁以后，女性荷尔蒙的分泌量会逐渐下降。如果想尽可能延缓下降速度，让美丽和健康更持久，就必须设法提升女性荷尔蒙力。所以，作者从生活习惯、药物、饮食、肌肉训练、女性常见疾病等方面为女性讲解提升健康、美丽的原理和方法，令女性延缓早衰，守护女性荷尔蒙！,22,520,0,29.95,https://wfqqreader-1252317822.image.myqcloud.com/cover/330/32073330/s_32073330.jpg
女人28天身体日历,2019-03-01 00:00:00,医学健康-两性,女人的美丽，来自健康。做健康的女人，要懂得身体的变化规律。本书针对中国女性特有的体质和生理规律，打造了一份详尽的28天身体呵护方案，告诉女性朋友在28天生理周期的每一天，应该做什么，不应该做什么，以及为什么有这些禁忌，这么做对调养身体有什么益处。无论是日常饮食指导、运动调养，还是清洁卫生、心理调适，或者是疾病治理、美容养颜等，女性关注的方方面面，在书中都有详细讲解，有如女性的贴心闺密，帮助女人轻轻松松、快快乐乐、健健康康地过好每一天！,129,628,0,21.99,https://wfqqreader-1252317822.image.myqcloud.com/cover/221/26189221/s_26189221.jpg
爱自己的女人会调养,2016-01-01 00:00:00,医学健康-两性,"    女性在家庭和社会中得到的关怀并不多，她们要工作奋斗，又要照顾丈夫、孩子和老人，往往忽视了自己的健康问题。为了让广大女性朋友学会爱自己、照顾自己，特编写此书。希望广大女性能从中受益。本书针对女性健康、女人与气血、女人和食物、女人和运动、女人的睡眠、女性的习惯、女性的经络调养、女性中药养生、女性的特殊时期等方面，对女性的养生问题逐一进行阐述，既分析了错误的方式方法，又提供了简单有效的方法，是女性健康养生必备的宝典。
",3,634,0,1.99,https://wfqqreader-1252317822.image.myqcloud.com/cover/850/841850/s_841850.jpg
协和孕产黄金食谱,2016-07-01 00:00:00,医学健康-两性,从备孕、怀孕到坐月子，协和专家全程悉心指导，看一本顶三本！关键营养怎么补？看食材营养排行榜，让孕妈妈长胎不长肉。孕前3个月营养计划，补叶酸、戒烟酒、控体重……备育爸爸也有份！跟着孕期时间线，每月重点营养素强化补，10种明星食材随意挑，一周科学食谱推荐，满足孕妈妈胃口与胎宝宝营养两不误。分娩当天到产后6周，妈妈宝宝有哪些新变化？顺产与剖宫产妈妈如何护理？哺乳与非哺乳妈妈饮食有什么区别？协和营养专家给你权威指导。孕吐、感冒、腿抽筋、妊娠纹、恶露不止……孕期、产后问题重重不用怕！照着书上吃，按照护理提示做，孕产期各种不适轻松应对！吃遍百味，补全营养，跟着本书，做个快乐幸福的孕妈妈！,20,0,0,11.94,https://wfqqreader-1252317822.image.myqcloud.com/cover/562/41733562/s_41733562.jpg
女人30不宫寒：气色好，形体美,2018-05-01 00:00:00,医学健康-两性,《女人30不宫寒：气色好，形体美》以中年女性的常见病症为主线，介绍防治这些常见病症的中医养生方法。作者杨力教授具有多年的临床经验，擅长治疗常见病多发病，能深入浅出地将中医养生保健方法教给患者。本书中的养生方法即为杨教授多年经验的总结，简便易行，适合大众读者阅读参考。0,15,701,0,19.99,https://wfqqreader-1252317822.image.myqcloud.com/cover/988/22623988/s_22623988.jpg
