title,publishTime,category,intro,maxFreeChapter,newRating,free,price,cover
产后美丽宝典,2009-01-01 00:00:00,医学健康-两性,"    《产后美丽宝典》把产后变化与恢复方法对应结合起来，把身心疾病与医疗预防、母体保健与健康哺乳结合起来，系统而全面，具有很强的实用性和指导性。使年轻的妈妈在产后重塑魅力与自信，教您产后如何成为一个既健康又漂亮的妈妈！
",4,0,0,4.06,https://wfqqreader-1252317822.image.myqcloud.com/cover/87/699087/s_699087.jpg
女人不生病的生活方式,2009-01-01 00:00:00,医学健康-两性,"    我们改变不了外部的环境，但可以改变自己，根据我们身体应遵循的基本原则，以不变应万变，按自己身体的实际状况去选择该吃的食物，去选择有利的生活方式。这样，才能在不断变化的环境中依然保持着科学的生活方式，才能健康地生存下来。如何做到保护自己，不让自己被疾病缠绕，就让我们一起走进看看吧。
",1,0,0,2.99,https://wfqqreader-1252317822.image.myqcloud.com/cover/734/699734/s_699734.jpg
女人的保健食谱,2011-06-01 00:00:00,医学健康-两性,《女人的保健食谱》介绍了年轻女性健康菜、中年女性强体菜、老年女性益寿菜等实例做法，全书讲解详细，步步分解，简单容易学，人人都会做，而且科学搭配，口味多种多样，味道不一般，味道美味又营养，书中还给我们介绍了做饭的小窍门，可以边学边做，方便又实用。,30,0,0,0.99,https://wfqqreader-1252317822.image.myqcloud.com/cover/388/576388/s_576388.jpg
会吃的女人更美丽,2015-06-01 00:00:00,医学健康-两性,"    《会吃的女人更美丽》一书主要包括女性如何吃出美丽、健康、活力等三个方面的内容，具体涵盖美颜塑身饮食攻略，身体基础饮食滋养攻略，卵巢乳房子宫私处食疗攻略，亚健康饮食攻略和四季养生饮食攻略。对于每个具体的问题，会有问题产生的原因与调理方法的解释，会提供一个科学的饮食攻略，会推荐两三道改善和调理的食疗方，内容详实全面，实用性非常强。
",2,0,0,12,https://wfqqreader-1252317822.image.myqcloud.com/cover/530/700530/s_700530.jpg
居家按摩师，健康不求人：图解宝贝健康成长按摩法,2014-07-01 00:00:00,医学健康-两性,"宝宝又哭闹了？宝宝又不肯睡觉了？宝宝又不想吃饭了？宝宝又生病了？照顾宝宝的过程中总是会出现许多小难题，很多妈妈遇到这些情况时往往都束手无策，但有的妈妈会发现，其实只要伸出双手，在宝宝身上按一按，摸一摸，许多问题就神奇地解决了。这是为什么呢？科学证实，按摩不仅能安抚宝宝的情绪还具有促进大脑发育、提升免疫功能、增强消化功能等多方面的作用。
本书由经验丰富的按摩专家编写，从0-3岁的抚触按摩法，到3-6岁的穴位按摩方，一步一步，让您科学、全面、直观地了解按摩的方法与益处，轻轻松松做宝宝的居家按摩师！",5,0,0,11.99,https://wfqqreader-1252317822.image.myqcloud.com/cover/572/700572/s_700572.jpg
居家按摩师，健康不求人：图解产妇瘦身塑形按摩法,2014-07-01 00:00:00,医学健康-两性,"现代女性时常被各种美容健康问题所困扰，其实通过按摩很多问题都可以迎刃而解。
按摩是一种无针、无痛、无创伤、无副作用的医学疗法，并且它不受时间、环境的限制，具有易学、易掌握、操作方便、见效快的优点。
本书由经验丰富的按摩专家倾情编写，从10大美颜按摩法到6大瘦身按摩方，让您科学、全面、直观地了解女性按摩的方法与益处，轻轻松松做自己的居家按摩师！",6,0,0,11.99,https://wfqqreader-1252317822.image.myqcloud.com/cover/573/700573/s_700573.jpg
居家按摩师，健康不求人：图解女性美颜塑身按摩法,2014-07-01 00:00:00,医学健康-两性,"头痛头晕？脱发？食欲不振？精神不济？男性往往是家庭的顶梁柱，工作量大，身体长期处于透支状态，并且对一些身体的小毛病不以为意，总觉得没时间，然而很多小毛病很可能就是重病的征兆。对于男性朋友这种两面难以顾全的状况，按摩乃两全良方。
按摩是一种无针、无痛、无创伤、无副作用的医学疗法，并且它不受时间、环境的限制，具有易学、易掌握、操作方便、见效快的特点。
本书由经验丰富的按摩专家倾情编写，从补肾要穴到消除男性常见病，再到日常疾病按摩法，一步一步，让您科学、全面、直观地了解男性按摩的方法与益处，轻轻松松做自己的居家按摩师！",6,0,0,11.99,https://wfqqreader-1252317822.image.myqcloud.com/cover/576/700576/s_700576.jpg
新婚生活知识手册,2009-05-01 00:00:00,医学健康-两性,本书主要包括服饰穿戴、饮食营养、睡眠住宿、运动保健、美容化妆、日常用品、社交处事、医疗用药以及不同人群的宜忌等，非常全面、系统，具有很强的科学性和实用性，非常易懂和易用，是广大读者用以指导现代生活、创造幸福家庭的良师益友。,3,0,0,6.99,https://weread-1258476243.file.myqcloud.com/weread/cover/27/3300014627/s_3300014627.jpg
儿童家庭用药小百科,2014-08-01 00:00:00,医学健康-两性,"    本书结合当前国内外关于青少年身心健康发展的诸多最新理念，从健康发展的6个方面--生长发育、必需的营养、体格锻炼、合理的生活作息和预防常见疾病，进行科学而合理的内容编排设计，构成《爱眼篇》《骨骼篇》《牙齿篇》《肠胃篇》《急救篇》和《用药篇》6部分内容。本书主要内容侧重于讲述青少年在成长发育过程中身体的各个重要部分眼睛、骨骼、牙齿、肠胃等常见的一些问题及处理措施，及在日常用药和出现突发事件的一些应急措施。语言通俗易懂，内容详实丰富。本书选用人们普遍易于接受和理解的生活实例，并融入相关知识，再加以艺术加工，分别构思成一个个有贯穿始终的人物、有一定曲折情节而又独立成篇的生动活泼的故事。
",2,0,0,7.99,https://wfqqreader-1252317822.image.myqcloud.com/cover/532/726532/s_726532.jpg
吃对食物女人健康100分,2015-07-01 00:00:00,医学健康-两性,新一代女性，要做智慧的女人、成功的女人、健康美丽的女人，先要学会用脑、用心吃饭，吃对食物，健康100分。知晓一些食疗（饮食疗法）食养（饮食养生）的基本知识；了解女性不同时期的生理特点和所需要的营养；掌握如何通过饮食呵护我们的身体和特殊的生理健康；懂得一些女性常见的疾病和食疗食养方法；更重要的是知道如何通过饮食让我们保持健康美丽的容颜，让魅力永存。,8,0,0,11.2,https://wfqqreader-1252317822.image.myqcloud.com/cover/85/728085/s_728085.jpg
一路美丽更年期：40岁后女人的健康美丽全书,2009-07-01 00:00:00,医学健康-两性,"    悉心调养捍卫身体健康，精心保养留住美丽风采，宁静心灵造就幸福人生。
",3,667,0,1.99,https://wfqqreader-1252317822.image.myqcloud.com/cover/169/798169/s_798169.jpg
女人28天身体养护全书（彩图精装）,2015-06-01 00:00:00,医学健康-两性,本书每位女性终生必备的28天身体呵护指南，详细地告诉你在28天生理周期的每一天应该做什么，不应该做什么，以及为什么有这些禁忌，这么做对调养身体有什么益处，随时帮助女性解疑答惑，科学对待自己的身体，打造健康体质。,9,0,0,5.96,https://wfqqreader-1252317822.image.myqcloud.com/cover/438/813438/s_813438.jpg
女性青春期小百科,2013-08-01 00:00:00,医学健康-两性,《女性青春期小百科》(作者梁淑敏、李兴春、王丽茹)分为青春期的生理发育、心理发育、营养需求、运动锻炼、服饰搭配、保健防病、性知识教育几个方面，全面阐述了女性青春期的生理、心理特点及生活、保健常识。《女性青春期小百科》为青春期女性的健康生活提供全方位的指导。,31,0,0,11,https://wfqqreader-1252317822.image.myqcloud.com/cover/663/27267663/s_27267663.jpg
宠爱自己，中医产后调养秘诀,2015-11-01 00:00:00,医学健康-两性,"本书从调理脏腑、通畅经络入手，着重讲解了与女性息息相关的肾经、肝经、脾经与任、督二脉的调理方法，帮助产后妈妈快速恢复身体，远离产后各种不适症状。
针对妈妈们出现的最典型的月子病——产后风湿痛，我们专门用了一个章节进行病因的深度解析和身体各部位疼痛治疗指导，帮助新妈妈们防患于未然，也帮助被风湿痛折磨的产妇脱离苦海。针对易产后出现面部变黄、脸部长斑、身材走样等常见现象，我们精心准备了行之有效的简单的外治法，帮助妈妈们恢复好气色、恢复好身材。
最后针对女性产后乳房松弛、下垂，产后妇科炎症，产后性冷淡等问题，本书也均给出了详细的自我调养的方法。
在编写这本书时，为了方便普通读者的理解与掌握，我们坚持深入浅出、简明扼要、通俗易懂，并采用图文并茂的形式，希望读者能够接受。衷心希望本书能够帮助更多的产后妈妈们调养好自己的身体，在快乐中享受健康生活。",11,0,0,19.99,https://wfqqreader-1252317822.image.myqcloud.com/cover/576/24270576/s_24270576.jpg
乳房健康，从改善生活方式开始,2015-10-01 00:00:00,医学健康-两性,本书结合国内外最近的乳腺知识，运用通俗易懂的语言进行讲解。此书是针对临床上许多乳腺病患者经常关心的问题，根据国内外有关专业文献，结合他们临床工作中的经验与体会完成的，它为广大女性朋友提供了乳房的生理病理、自我检查、诊断治疗、饮食调养、保健康复等基本科普知识，通俗易懂，不枯燥不乏味，不仅有知识点还有感人的生命故事。,23,0,0,3.99,https://wfqqreader-1252317822.image.myqcloud.com/cover/816/25077816/s_25077816.jpg
汤养女人，美丽一生,2018-08-01 00:00:00,医学健康-两性,本书主要讲述了适合女性健康的不同类型的汤的原料及做法，还根据汤的各种功能分类给出了对应汤谱，如常见病汤谱、健康小问题汤谱、不同年龄人群汤谱、不同职业人群汤谱、四季养生汤谱等。,19,0,0,18.32,https://wfqqreader-1252317822.image.myqcloud.com/cover/32/25559032/s_25559032.jpg
子宫好，美到老,2018-08-01 00:00:00,医学健康-两性,子宫与女性靓丽的容颜、健康的身心、幸福的生活息息相关，它是女性身体中最根本、最重要的器官。因为女性一生的问题，经、胎、带、产等几乎所有问题的根源都出在子宫上。《子宫好，美到老》是一本子宫健康书。围绕女性经、带、胎、产及美容、抗衰、妇科疾病的保健等方面，讲述子宫的保健及调理方法，具体内容包括子宫的重要性，伤害子宫的错误行为，如何通过饮食、运动、经络调理等调养子宫，子宫的求救信号，以及不同体质如何养护子宫等，让女性在任何时候都能轻轻松松地呵护子宫，健康一生。,10,0,0,18.32,https://wfqqreader-1252317822.image.myqcloud.com/cover/34/25559034/s_25559034.jpg
美女的内养方,2018-08-01 00:00:00,医学健康-两性,本书从调理脏腑、排毒养颜、补气养血、体质养颜、抗衰防老、顺时养颜等各个角度向读者介绍全面内调养颜方，涵盖饮食、运动、生活细节等多方面的内容，让女性的身体得到全面的内调外养，达到内外兼修，展现出女性的健康美。,21,0,0,18.32,https://wfqqreader-1252317822.image.myqcloud.com/cover/747/25559747/s_25559747.jpg
专家解答月经失调（谷臻小简·AI导读版）,2019-05-20 00:00:00,医学健康-两性,随着人们物质文化生活水平的提高，一旦生病，就不再满足于看病拿药了。人们希望了解自己的病是怎么得的？怎么诊断？怎么治疗？怎么预防？当然这也和疾病谱的变化有关。过去，患了大叶性肺炎，打几针青霉素，病就好了。患了夜盲症，吃些鱼肝油丸，也就没事了。至于怎么诊断、治疗，怎么预防，人们并不十分关心。因为病好了，没事了，事过境迁，还管它干嘛呢？可是现代的病不同了，许多的病需要长期治疗，有的甚至需要终生治疗。许多病不只需要打针服药，还需饮食治疗，心理调适。这样，人们自然就需要了解这些疾病的相关知识了。上海科学技术文献出版社有鉴于此，新出一套“挂号费丛书”。每册之售价恰为市级医院普通门诊之挂号费，故以名之。“挂号费丛书”尽选常见病、多发病，聘请相关专家编写该病的来龙去脉、诊断、治疗、护理、预防……，凡病人或家属可能之疑问，悉数详尽解述。每册十余万字，包括数百条目，或以问答方式，一问一答，十分明确；或分章节段落，一事一叙一日了解。而且作者皆是各科专家，病人或家属所需了解之事他们自然十分清楚，所以选题撰稿，必定切合需要。所谓珠联璧合，从内容到形式，“挂号费丛书”确有独到之处。我们相信病人或家属读了必能释疑解惑，健康的人读了亦必有助于防病强身。,1,0,0,0.99,https://wfqqreader-1252317822.image.myqcloud.com/cover/308/25598308/s_25598308.jpg
郎景和院士“关爱女性健康”系列：女人健康才美丽,2017-04-01 00:00:00,医学健康-两性,《女人健康才美丽》内容包括四部分。第一部分婚育期要健康：管好你的月经，妊娠期要防病，常见病也应积极治疗，新婚与生育，解决好性问题。第二部分笑对更年期：放慢脚步，先给自己做个身体检查，绝经了不用焦虑，潮热是可以控制的，雌激素是一把双刃剑，调整好性生活也是一种能力。第四部分揭秘妇产科：关于妇产科男医生，谈谈医患关系。,6,0,0,6.99,https://wfqqreader-1252317822.image.myqcloud.com/cover/39/25961039/s_25961039.jpg
暖暖的女人更美丽,2018-01-01 00:00:00,医学健康-两性,《暖暖的女人更美丽》女性身体属阴，再加上经、产、胎、带等各种生理活动，无时无刻不在消耗阳气；生活中不经意的习惯，如穿露肩装、露脐装、不穿袜子、喜吃冷饮等，也会让身体变寒凉，这就决定了女人的一生将需要更多的阳气来维持平衡，否则会加速衰老。本书正是针对当下女性普遍忽视的身体受寒问题展开。提醒广大女性留意身体的点滴变化，审视自己的生活方式，发现诸多不曾察觉的问题正侵蚀着自己的健康。然后用一点点小改变，一个个小妙招去化解，让身体变得暖暖的，让健康常在，美丽常在。本书针对每一种由身体受寒引发的问题，给出了相应的预防和补救措施，方法简便，随时能运用。,27,0,0,11.9,https://wfqqreader-1252317822.image.myqcloud.com/cover/834/25982834/s_25982834.jpg
父母是孩子更好的医生,2019-03-01 00:00:00,医学健康-两性,怎样在寒暑交替、减衣添食中，养出一个健康的孩子，是所有父母都关心的话题。孩子脏腑娇嫩、形气未充，很容易生病。这就要求父母要懂得一定的医学知识。一书在手，好父母胜过好医生。本书全面介绍了孩子成长发育、疾病防治、安全保护、心理健康等方面的问题，可使家长有足够的信心应对孩子身体、情绪发展过程的每一阶段，健康知识贴合中国家庭实际，让家长在照顾孩子时少一点手忙脚乱，少一点焦虑。读完这本书父母完全可以做好孩子的护理师、急诊师、营养师和按摩师，轻松成为孩子的私人医生。,141,0,0,21.99,https://wfqqreader-1252317822.image.myqcloud.com/cover/207/26189207/s_26189207.jpg
女性保健参照书（生活必备丛书）,2007-01-01 00:00:00,医学健康-两性,"    本书结合女性生理、心理特点介绍女性常见病的预防与治疗，指导女性合理饮食，选择合适的运动锻炼方法。
",4,0,0,0.99,https://wfqqreader-1252317822.image.myqcloud.com/cover/703/26263703/s_26263703.jpg
宝宝辅食添加营养计划,2019-06-01 00:00:00,医学健康-两性,本书以年龄段为划分，介绍了不同年龄段宝宝的营养需求、相对应的营养方案及有关的喂养知识，并跟踪拍摄了156道“金牌”辅食的制作过程。全书400余幅彩图，手把手指导妈妈们做出美味又可口的营养配餐。针对食材的选购问题，本书也提出了相关的指导意见，教妈妈们迅速辨别黑心食材、劣质食材，给宝宝挑选新鲜、安全、美味的食品。对于没有太多经验的年轻父母而言，本书一定会给你有益的指导，呵护宝宝健康成长。,13,0,0,19.92,https://wfqqreader-1252317822.image.myqcloud.com/cover/871/26796871/s_26796871.jpg
让孩子吃得香营养好不生病,2019-06-01 00:00:00,医学健康-两性,为什么孩子长得白白胖胖，体检还是不达标？为什么孩子的身高低于同龄人？营养专家详细为你解析。本书根据宝宝发育特点分4~6个月、7~9个月、10~12个月、13~16个月、19~36个月五大阶段给予全面的喂养指南。全书有20种营养素面面观，有愈100种营养美味食谱超详细做法，更有常见病饮食护理知识。在这里，专家会手把手教你如何荤素平衡，干稀交替，粗细合理搭配，从“喂饱”孩子到“喂好”孩子。,58,0,0,29.88,https://wfqqreader-1252317822.image.myqcloud.com/cover/928/26796928/s_26796928.jpg
别不信！女性养好气血美丽一生,2016-02-01 00:00:00,医学健康-两性,"本书主要针对女性最为关注的气血调养保健知识，囊括海量二维码，同步视频，为女性朋友打造一个气血满分的自己提供全面有效的指导。
本书从气血的功能及其与女性的关系开始阐释，分阶段、分疾病介绍对应的气血特点及对治食谱；并从饮食方式的调养上分别介绍药膳、零食、花茶补气血的方法；注重讲述生活中女性应注意的可调补气血的小细节；最后讲述如何运用中医疗法针对气虚、气郁、气淤进行调理。",15,0,0,18.99,https://wfqqreader-1252317822.image.myqcloud.com/cover/567/24270567/s_24270567.jpg
姨妈说：那些你不知道的事儿,2019-11-01 00:00:00,医学健康-两性,“女生来大姨妈前就是会长痘痘啊，肚子胀，感觉整个人胖一圈。”“来大姨妈肚子疼？多喝点红糖水，以后生完孩子就好了。”“大姨妈没有固定的周期？没事，这都很正常。”……但，事实果真如此吗？是时候，听听有20多年临床经验的妇产科医生怎么说了。这是一门专为女性打造的贴心课程，总结临床女性常见问题，数百小时精心打造，现在，只要1小时，你就能重新认识大姨妈，初步判断自己目前的情况，在专业医生的指导下，你还将学会如何科学应对大姨妈，从而提升学习和工作状态，自内而外，焕发光彩。用1小时的时间换来与陪伴你一生5万小时大姨妈的和平共处，用一包姨妈巾的价格给予你女性的自信和从容，何乐而不为呢？关爱自己，就是现在。,5,0,0,5.9,https://wfqqreader-1252317822.image.myqcloud.com/cover/292/27563292/s_27563292.jpg
小儿保健推拿视频书：孩子吃饭香，少生病，长得好,2019-03-01 00:00:00,医学健康-两性,1.本书主要是通过对宝宝日常进行小儿推拿的手法进行保健，促进宝宝的消化吸收，消化好，睡觉好，身体机能好，自然不容易生病。2.保健内容包括预防、轻微症状按摩保健、疾病后期按摩保健等。3.以往同类书只是给出了穴位处方，在具体操作细节上没有提及。本书会详细地给出操作细节，并温馨地提示操作过程中宝宝身体会出现哪些变化，妈妈该如何地护理。,11,0,0,40,https://wfqqreader-1252317822.image.myqcloud.com/cover/369/27614369/s_27614369.jpg
饮食中的老偏方 女人小病一扫光,2017-04-01 00:00:00,医学健康-两性,食物是最好的医生，本书立足药食同源的中医理论，从女性常见的健康烦恼出发，旨在解决女性朋友的健康困惑。书中针对女性在美容抗衰、乳房保养、子宫附件保养、月经问题、更年期综合征、职场压力等各个方面常见的病症及日常生活中的小毛病提供了多种治病食疗偏方。,7,0,0,15.99,https://wfqqreader-1252317822.image.myqcloud.com/cover/883/29975883/s_29975883.jpg
女人爱自己：让自己更年轻，打扮好自己,2009-09-01 00:00:00,医学健康-两性,每个女人都想要的美丽魔法书，从头到脚，由内到外，全方位的美丽蜕变！神奇化妆术，零失误穿搭法，精准保养秘诀，揭去女人的衰老面纱，让女人展露年轻光彩！,33,0,0,14,https://wfqqreader-1252317822.image.myqcloud.com/cover/379/30478379/s_30478379.jpg
女人不衰老的老偏方,2015-05-01 00:00:00,医学健康-两性,美丽是自己经营出来的，青春也是要自己守护的，眼、唇、颈、胸、皮肤和身材，都可以通过中医饮食和护理达到青春的状态。不要一听到保养和护理觉得很复杂，你要做的不是去美容院，更不是去整形医院，你只要轻松在家，接受传统中医的智慧并进行实践，就会有意想不到的惊喜！5000年的文明史为后人积淀下了丰富而珍贵的美容经验与方法，这些秘方大多取自天然，因此更具有健康的神奇魅力。请跟我一同去找寻古代美容悠久的历史足迹，一起去搜索有关美容的“古书秘籍”，走进她们的美丽世界……,21,0,0,12,https://wfqqreader-1252317822.image.myqcloud.com/cover/383/30478383/s_30478383.jpg
我最想要的子宫保养书（定制版）,2015-06-01 00:00:00,医学健康-两性,幸福生活，从呵护子宫开始！子宫是女性特有的器官，是女性体内独特的“第六脏器官”，更是孕育生命的摇篮。对一个女人来说，幸福的生活与子宫有太多关联。子宫孕育生命，给女人带来无数喜悦；子宫保持健康，让女人摆脱病痛烦恼；子宫滋养容颜，令女人一生光彩照人。子宫不仅是女人健康的关键所在，也是女人美丽的源泉，更是女人幸福的源泉。女人想要健康美丽，就一定要保养好子宫；女人想要幸福快乐，就一定要呵护好子宫！,34,0,0,12,https://wfqqreader-1252317822.image.myqcloud.com/cover/488/30478488/s_30478488.jpg
千万别做“好女人”：女性防癌抗癌新主张,2013-07-01 00:00:00,医学健康-两性,在我们的生活中，好女人总是那么得受欢迎。然而，研究成果显示，在我国城市女性癌症患者中，70%属于人们眼中的“好女人”！从某种角度讲，“好女人”的癌症发病率比男性更高。因为相较于男人，女人更容易产生压力，而不良的情绪常常是癌症的“催化剂”。作为知名的肿瘤专家，作者与女性癌症患者打了30多年的交道，很了解女性患者的心理。作者认为，作为女人，尤其是“好女人”不该活得如此委屈和劳累，不能只为别人活着，也要关心一下自己的健康。作者呼吁广大女性：千万别做“好女人”！,7,0,0,19.6,https://wfqqreader-1252317822.image.myqcloud.com/cover/272/31125272/s_31125272.jpg
家庭快速美颜塑身法,2010-05-10 00:00:00,医学健康-两性,本书汇集了当前流行的美容、瘦身资讯，帮你解决烦恼。皮肤清洁，就是要美白，让你白得自然；美丽、性感、浪漫从头始；运动减脂，跑步、游泳、瑜伽一个都不能少，除此之外还有一些日常简单易做的小动作，让你动一动就会瘦；身体可以通过运动加以适当的调理，让你瘦得美丽瘦得健康；饮食瘦身，为你量身订做几套饮食方案，辅助你的运动，让你放心地吃，想瘦哪里都可以。书中还为你提供温馨实用的生活小贴士，让你感觉温暖贴心。女人要美丽，适当的自我修饰变得非常重要，天生丽质还需要后天的保养。希望本书给你带来一些美的启示，同时也希望你可以用心去造完美的自己，因为最好的美容师就是你自己。,9,0,0,7.5,https://wfqqreader-1252317822.image.myqcloud.com/cover/57/31301057/s_31301057.jpg
黄帝内经女性美颜法,2010-08-23 00:00:00,医学健康-两性,"综合判定个人体质,量身秘制个性化美颜养生大法。体制不同,美颜方案千差万别,养得对才能养得美。180道养阴补血增阳气的食疗秘方:本书根据不同体质的特点,详述了每种食疗方的适宜体质,避免了“千人一方,万人同法”。300个快速见效的女性体质养生窍门:作者依照《黄帝内经》《本草纲目》等中医养颜养生大成之作,结合丙工中医实践加以改良,使其更适合现代女性。68套针对各种体质的养神冥想术、气功保健法:作者根据近40年的从医经验,介绍了最简单有效的保健功法,如静坐、耳功、擦面、夹脊功等。时常练习这些功法可以疏通人体经络、锻炼肮脏、增强元气。",21,0,0,5.97,https://wfqqreader-1252317822.image.myqcloud.com/cover/92/31301092/s_31301092.jpg
