title,publishTime,category,intro,maxFreeChapter,newRating,free,price,cover
会计基础（第4版）,2013-01-01 00:00:00,经济理财-财经,本书以财政部2009年颁布的最新《会计基础考试大纲》为依据，涵盖了大纲所要求的全部内容，以帮助考生通过会计从业资格考试为宗旨，侧重基础知识、基本技能和基本方法的掌握，并附有大量练习题及参考答案。本书以会计循环为主线，全书分10章，主要包括以下内容：总论、会计要素与会计科目、会计等式与复式记账、会计凭证、会计账簿、账务处理程序、财产清查、财务会计报告、会计档案、主要经济业务事项账务处理。本书主要供参加会计从业资格考试的人员学习使用，也可供会计学、财务管理等专业本、专科学生在学习相关课程时参考，以备毕业后参加会计从业资格考试。,65,853,0,21,https://wfqqreader-1252317822.image.myqcloud.com/cover/380/23912380/s_23912380.jpg
稳定获利3,2019-02-28 00:00:00,经济理财-财经,本书内容来自“中国第三届操盘手大会”嘉宾的演讲稿，本届大会邀请的嘉宾长期活跃在期货和股票市场的第一线，基本都曾获得过国内期货大赛的冠军，有部分嘉宾甚至参加过CCTV证券资讯栏目。本书共分8章，既有介绍坚持价值投资经验的，也有分享技术分析技巧的。这些经验和技巧并非学术探讨，都是他们在市场中历经多年的摸爬滚打后，亲身验证过的。就是凭借着这些经验和技巧，他们从股票或期货市场中获得了巨额利润。本书内容来自“中国第三届操盘手大会”嘉宾的演讲稿，这些嘉宾长期活跃在资本市场的第一线，大部分都曾获得过国内期货大赛的冠军，有部分人还参加过央视的证券资讯频道的栏目。本书较为详细地介绍了嘉宾们的成功经验和技巧——当机会来临时，他们当时是怎么想的，采用了哪些方法，怎样牢牢地把握住了这些机会。这些经验和技巧并非学术探讨，而是他们在市场中摸爬滚打后总结出来的。就是凭借着这些经验和技巧，他们从资本市场中获得了巨额利润。这些经验和技巧具有可复制性和较强的实战借鉴意义。,15,748,0,19.2,https://wfqqreader-1252317822.image.myqcloud.com/cover/909/26785909/s_26785909.jpg
心力：创业如何在事与难中精进,2020-05-01 00:00:00,经济理财-财经,创业，是带领一群未知的人，去一个未知的地方，干一件未知的事情。 面对充满“不确定”的未来，只具备解决已知问题的能力显然是不够的。 当代有竞争力的商业模式，一定都有一个完整的系统能力，即底层操作系统，支撑着企业不断更新迭代、不断适应外界变化。这个底层操作系统可拆解为两大方面：认知力和心力。 认知力是发现并解决未知问题的水平，心力是真正驱动人前行的内在感受和力量；认知力指引方向，心力决定边界；认知力决定到哪里去，心力决定能走多远。 成功的创业者，无疑拥有着更高版本的底层思维系统，不仅更新速度更快，走得也更远。 作为创业者的你，是否也检视过自己的底层操作系统，它有没有系统漏洞，需不需要升级版本呢？ 创业心学，就是一套旨在改善认知力、提高心力的哲学理论。 《心力》讲述了阳明心学如何具体指导创业，心学闭环如何与创业观照，以及企业成长如何形成连续的、螺旋向上的闭环，一步一步向更高阶跃迁。,9,805,0,34.5,https://wfqqreader-1252317822.image.myqcloud.com/cover/37/30944037/s_30944037.jpg
全球通胀与衰退,2022-02-01 00:00:00,经济理财-财经,通胀关系到国计民生，关系到社会安定。通胀一旦出现，长期代价不可避免。经过多年低通胀之后，全球通胀以新的形态卷土重来。美国等国家的消费者物价指数（CPI）创下近40年以来的新高，德国等国家的生产者价格指数（PPI）更是创70年来新高。世界各国面临的是长期通胀还是短期价格上扬？如何衡量货币冲击、供给冲击对经济增长动力和物价的影响？会不会在巨大的全球通胀“灰犀牛”背后，还跟着一只经济衰退的“黑天鹅”？全球通胀将对中国经济增长、生产者和消费者、资本和资产市场造成哪些影响？本书生动描述了从各国货币超发、资产价格上涨、过剩产能吸收到全球物价上涨的传导过程，并从能源原材料供给冲击、劳动供给冲击、全球供应链冲击、微观价格形成机制变化等不同角度，对后疫情时代的全球物价与增长做出了全方位的深入分析。书中提出的很多研究方法，既有学术创新价值，也为决策者、企业管理者和投资者提供了通俗易懂的新分析工具，揭示了新时期全球通货膨胀和经济衰退的形成机理和潜在风险。本书还结合作者20多年来从事宏观研究和金融投资的宝贵经验，提出了前瞻性预测景气周期、经济增长、物价涨跌、资产价格变动趋势的指标组合使用方法；从新供给经济学的视角，提出了让决策部门跳出“稳增长与控物价两难选择”的新思路；并为企业管理者如何在通胀与衰退交织的风险中独善其身，以及投资者和普通百姓如何实现资产的保值增值，提供了极具洞见的策略性建议。,8,879,0,59,https://wfqqreader-1252317822.image.myqcloud.com/cover/626/43178626/s_43178626.jpg
贫穷的本质：我们为什么摆脱不了贫穷,2013-04-19 00:00:00,经济理财-财经,"    《贫穷的本质:我们为什么摆脱不了贫穷》用大量实例，提出了一些实用性较强的建议，寻找那些经得起检验的扶贫方案，为政策制定者、慈善家、政治家及所有希望天下脱贫的人提供了重要指导。
",8,645,0,18,https://wfqqreader-1252317822.image.myqcloud.com/cover/20/636020/s_636020.jpg
隐秘帝国：美国工业经济和企业权力的兴衰,2021-05-01 00:00:00,经济理财-财经,美国科氏工业集团是一家业务遍及全球，营业额远超谷歌、高盛、脸书等知名公司的巨型企业，从原油开采、炼化、贸易、管道运输、农业和畜牧业、金融服务、道路沥青到婴儿纸尿裤、纸质餐具、树脂包装材料、防尘地毯、建筑材料、安全气囊、电子元件和医疗器械，科氏工业集团无处不在。由于科氏工业集团坚持不上市，所以其不为大众所熟知，但其却成了一个能够左右美国经济和政治的隐秘商业帝国。作者用六年时间完成了这部宏篇巨作，全面系统地介绍了这一隐秘商业帝国发展壮大的历史和经营战略，以及科赫家族如何掠夺自然资源，对抗工会，干预美国税收、节能减排、医保改革等一系列重大政策，资助舆论和政客，用各种基金会、媒体节目、智库、科研机构的名义去影响大众。阅读本书不仅有助于理解美国企业权力的崛起，还可以从科氏工业集团的发展史中观察过去50多年美国经济的发展和演化，洞悉美国资本巨头如何控制石油行业，干预美国能源经济，渗透美国政府，以及美国政治经济和司法制度的缺陷。本书将成为对美国资本主义核心腐朽现象的伟大记述之一。,8,833,0,68.6,https://wfqqreader-1252317822.image.myqcloud.com/cover/18/38088018/s_38088018.jpg
私募股权投资管理,2018-02-01 00:00:00,经济理财-财经,本书试图总结国际私募股权领域的先进经验，并分析中国基金业显著不同的操作模式，为读者介绍中国私募股权基金的管理模式，同时也从学术角度探讨私募股权对宏观经济的影响。本书的目标读者为学习私募股权基金管理的本科和研究生，以及新近加入股权投资业的基金管理人员。,24,868,0,41.6,https://wfqqreader-1252317822.image.myqcloud.com/cover/669/24275669/s_24275669.jpg
美国增长的起落,2018-05-01 00:00:00,经济理财-财经,此书将经济学与历史学相结合，既有对历史的生动叙述，也有对经济现象的深入分析，既从普通民众视角考察家庭日常生活和工作的细节，又以经济学家视角在经济增长这一更广阔的背景下解释这些细节，为读者呈现了一个“特殊世纪”的全景图。通过这样的分析，作者对上述两个问题的回答是：1870年至1970年的颠覆式经济变革及其创造的辉煌不可再现。在他看来，美国的生产率增长已经开始放缓，不平等加剧、教育停滞、人口老龄化、大学生债务和联邦政府债务不断增加，都将进一步阻碍生产率增长。走出困境必须找到新的办法。此书既是对过去一个世纪的彻底变革的致敬，也是对未来更艰难时代的预言。在当前关于经济增长前景的争论中，此书所做的分析不容忽视。,28,753,0,76.8,https://wfqqreader-1252317822.image.myqcloud.com/cover/601/22297601/s_22297601.jpg
债：5000年债务史,2021-03-01 00:00:00,经济理财-财经,这是一本由人类学家回应2008年以来金融危机和债务危机的著作。在书中，作者通过“债”这个切入点，以人类学、历史学、社会学的视角揭示5000年来（从文明的初始到全球负债时代）人类的行动规律，债、货币、工作、信用、增长和经济概念本身都是我们开始重新想象的基石。他认为，人类在5000年前已经使用复杂的信用体系而不仅是物物交换来进行商品交易。是金钱让责任和义务变成债务，价格概念和冷漠的市场吞噬了人类彼此关爱的本性。格雷伯推翻了很多债务领域的经典预设，将5000年的债务史划分出五个阶段：早期的农业帝国、轴心时代、中世纪、资本主义帝国时期和当今的金融世界。在这些不同的时期，格雷伯认为虚拟货币重复着“出现、消失、再出现、再消失”的状态。格雷伯认为，一旦我们从道德层面理解了债务的社会起源，就会从多角度处理债务问题，如抵押贷款、信用卡债务、学生贷款，还有国家的债务。作者提出了批判性的解决方案：免除所有国际间的和消费者的债务，并提醒人们还债并非道德核心。富人之间或者国家之间的债务常常会通过重新谈判解决，这几乎贯穿整个世界史。,14,818,0,69.3,https://wfqqreader-1252317822.image.myqcloud.com/cover/39/36968039/s_36968039.jpg
新工业时代：世界级工业家张毓强和他的“新石头记”,2019-08-01 00:00:00,经济理财-财经,在国家大力弘扬企业家精神，倡导实实在在、心无旁骛做实体经济的背景下，著名媒体人、人文财经观察家秦朔，深入世界“隐形冠军”企业、2018年中国工业大奖得主巨石集团有限公司，及其发起方振石控股集团有限公司，撰写了创始人张毓强艰难创业，不断创新，在工业领域勇攀世界水平，为打造世界知名中国工业企业努力奋斗的故事。 中国巨石是2B领域的“隐形冠军”，是央企混合所有制改革“国民共进”的亮丽样板，是“一带一路”投资的璀璨明珠。作为振石控股集团董事局主席、中国巨石总裁、巨石集团董事长兼CEO，张毓强被《福布斯》中文版评为“中国上市公司CEO”，其创办的振石控股集团也是一家多元化、国际化的企业，名列中国民营企业500强、中国制造业企业500强。 本书以张毓强的人生故事为主线，将振石、巨石的创业发展经历串联起来，为我们生动再现了世界“隐形冠军”企业的诞生历程，解读了一位中国工业家的精神谜语。,20,830,0,40.8,https://wfqqreader-1252317822.image.myqcloud.com/cover/489/26315489/s_26315489.jpg
3小时快学期权（第二版）,2020-06-04 00:00:00,经济理财-财经,本书结合了上交所产品创新中心部门数位期权培训讲师多年来丰富的讲课经验，并在传统的培训材料上化繁入简，凝练成“期权交易之独孤九剑”和“期权活用七字诀”，寓教于乐，方便读者记忆和掌握期权知识。第二版在原有的基础上，增加了2019年期权产品新上线的组合保证金和组合行权两大业务的相关知识，同时将增加期权新品种沪深300ETF期权的相关内容，并更新了相关的案例。,6,879,0,23.99,https://wfqqreader-1252317822.image.myqcloud.com/cover/63/35666063/s_35666063.jpg
世界上最伟大的致富圣经,2011-09-01 00:00:00,经济理财-财经,为什么这个世界上富人积累财富的能力这么强？是不是他们有什么秘密的法宝？这本书集合了世界上最经典的六本致富圣经。全方位为您揭秘获得财富的秘密。,51,732,0,3.99,https://wfqqreader-1252317822.image.myqcloud.com/cover/615/127615/s_127615.jpg
一本书读懂碳中和,2021-08-01 00:00:00,经济理财-财经,什么是碳中和？为什么要耗时40年之久？实现碳中和，对我们每个人来说到底意味着什么？大到跨国贸易，小到细胞呼吸，碳排放无处不在，与我们息息相关。气候变化可能是人类有史以来面临的最大威胁，任何一个个体都无法逃避全球变暖的现实。为应对这一巨大挑战，各国正在开展一场史无前例的大规模合作行动。基于此，我国提出“30·60”双碳目标（2030年前实现碳达峰，2060年前实现碳中和）对全球减排的战略意义重大。本书将从碳中和的提出背景开始，逐步为你讲解究竟什么是碳中和，实现碳中和的关键要素有哪些，我国各行业碳中和的实现路径与转变机遇是什么，以及政府、企业、个人该怎么做。让我们一起，探究中国经济社会未来40年的发展脉络，揭开碳中和的神秘面纱！,10,658,0,30,https://wfqqreader-1252317822.image.myqcloud.com/cover/201/40643201/s_40643201.jpg
世界是平的：21世纪简史,2008-07-01 00:00:00,经济理财-财经,托马斯·弗里德曼描述了当代世界发生的重大变化。科技和通信领域如闪电般迅速的进步，使全世界的人们可以空前地彼此接近——在印度和中国创造爆炸式增长的财富；挑战我们中的一些人，比他们更快占领地盘。本书3.0版新增两章，更新了报告和注释方面的内容，这些内容均采自作者考察世界各地特别是整个美国中心地带的见闻，在美国本土，世界的平坦化正在剧烈地改变人们的生活方式。,9,720,0,23.99,https://wfqqreader-1252317822.image.myqcloud.com/cover/346/860346/s_860346.jpg
价值投资常识,2019-12-06 00:00:00,经济理财-财经,《价值投资常识》是一本投资者学习和践行价值投资的实战技术指南。作者通过个人投资经历的总结和翔实的数据分析，系统总结和提炼投资者在价值投资实践中需要具备的投资理论和操作方法的关键点。本书可以帮助你从零开始学习价值投资：•基础认知：为什么选择价值投资•定性分析：发现具有投资价值的企业•定量分析：财报分析的关键点•估值分析：价值不仅仅是数字•仓位管理：价值投资的重要策略•安全边际：懂得风险才知进退•实战策略：8种价值投资实战应用•面对未来：寻找价值投资的制高点。从行业中，精准锁定合理估值和低估值的标的企业。独到的价值投资实战策略和估值线的使用，将帮助投资者在实践中找到建仓、加仓、减仓和清仓的有效时机和方法，从而实现在股市中获得更多的收益。,23,726,0,69.9,https://wfqqreader-1252317822.image.myqcloud.com/cover/830/32913830/s_32913830.jpg
中国分税制：问题与改革,2014-10-01 00:00:00,经济理财-财经,我国分税制是处理政府间财政关系的重要财税体制，它自1994年确立以来，对整个社会经济生活产生了巨大影响。在新的历史转折点上，改革分税制、构建“科学的财税体制”迫在眉捷。本报告对分税制的改革由来、制度基础、经济激励机制和经济影响进行深入研究，在此基础上，从政府间税权划分、事权划分、转移支付、省以下财政管理体制、地方政府债务、政府预算管理等多个角度探索了分税制改革之道，试图为建立现代财政制度奠定重要的制度基础。,18,897,0,29.4,https://wfqqreader-1252317822.image.myqcloud.com/cover/974/26244974/s_26244974.jpg
伏击涨停（修订升级版）,2020-11-01 00:00:00,经济理财-财经,本书在作者20多年实战操盘与教学实践的基础上，从“伏击涨停的四大定律”入手，揭示了从“量柱形态”发现涨停基因、从“量级变化”发现涨停前兆、从“量性转化”发现涨停先机的市场规律，总结出了十八种伏击涨停的系统战法。这些战法被《证券市场红周刊》誉为“令人耳目一新的实战系统”。本书构建了以“一个核心理念，两大系统工具，三个基本原理，四大涨停定律，十八种伏击技法”为主体的“PTALA”模型，即以伏击涨停为核心理念，以量柱量线为系统工具，以“卖在买先、价在量先、庄在散先”为基本原理，总结出四大涨停定律和十八种伏击涨停技法。本书是一本实战指导书，并与作者的《股市天经》丛书中可操作性极强的《涨停密码》《量柱擒涨停》《量线捉涨停》相互契合，为广大的证券投资人、投资机构、基金从业者提供从理念到方法的完整体系。这种建立在证券投资实践基础上的实战体系，将有更为持久的生命力，也将更受中外投资者的青睐。,33,784,0,61.6,https://wfqqreader-1252317822.image.myqcloud.com/cover/162/40375162/s_40375162.jpg
经济基础知识（中级）,2017-06-01 00:00:00,经济理财-财经,《经济基础知识（中级）》以全国经济专业技术资格考试教材为依据，对大纲进行了全面分析，重点突出，帮助考生把握重点，攻克难点，提高复习效率，是考生快速贯通考点、顺利通过考试的必备书籍。《经济基础知识（中级）》中的“大纲解读”对考情、考点进行了详细分析；“考点精讲”深入分析重点、难点，讲解清晰透彻，并针对考点，直击2013—2017年5年真题，提高考生应试能力；“同步自测”针对性强，贴近考题，有助于考生夯实基础知识，提高解题能力。,64,771,0,40.6,https://wfqqreader-1252317822.image.myqcloud.com/cover/812/23912812/s_23912812.jpg
荀玉根讲策略：少即是多,2021-09-01 00:00:00,经济理财-财经,海通证券首席经济学家兼首席策略分析师荀玉根博士拥有14年宏观策略研究经验，是新财富、水晶球、金牛奖等权威分析师评奖“全满贯”第一名，对资本市场有深刻的理解，本书是他长期研究的感悟。本书从管理欲望的人性角度切入，将作者的研究理念娓娓道来，即根据自己的投资哲学，构建投资策略和风险管理体系，并通过学习不断精进体系，做能力圈内的投资，知轻重、懂取舍，少即是多。本书以认识人与市场之间的关系为起点，从资金流向、盈利趋势、产业演变、市场特征等角度解析中国股市的内在规律和运行特征，进行了大量历史研究与分析，以及海内外市场的对比分析，逻辑严密、数据翔实，构建了有机统一的策略研究框架。书中作者还分享了日常研究中的思考。,15,747,0,40,https://wfqqreader-1252317822.image.myqcloud.com/cover/490/41103490/s_41103490.jpg
趋势投资：金融市场技术分析指南,2020-10-01 00:00:00,经济理财-财经,金融市场异常复杂，入场投资前，我们需要先看清楚市场大势，理解中期和短期趋势的变化逻辑，才能做到顺势而为、趋利避害、稳健获利。 《趋势投资：金融市场技术分析指南》从《易经》中的辩证思维模型出发，综合考虑金融市场长期与中短期趋势推动因素，构建了一整套趋势投资分析方法。作者将这一方法与蜡烛图分析工具相融合，化繁为简，使读者可以清晰地看到持续横盘走势、反转走势等复杂市场行情背后的本质，把握其中的关键事实，计算市场未来各种可能走向的概率，建立买入与卖出的原则和标准，采取合理的交易策略。《趋势投资：金融市场技术分析指南》搜集了过去数十年间来自股票、期货、外汇市场的大量图形案例，证明了这些分析方法可以广泛适用于不同的金融产品市场。 《趋势投资：金融市场技术分析指南》适合喜爱技术分析的个人投资者以及金融机构的操盘手、分析师阅读。,10,522,0,64.9,https://wfqqreader-1252317822.image.myqcloud.com/cover/294/34156294/s_34156294.jpg
价值发现,2020-07-01 00:00:00,经济理财-财经,市场上关于价值投资的图书多如牛毛，但绝大部分偏于理念阐述而缺乏实战案例，读者即便理解了价值投资理念，在实战中往往也不知如何下手。本书从方法论和投资案例入手，从理念、案例、感悟三个方面深入浅出地讲解价值投资之道，让你轻松拥有成功的投资人生！,34,706,0,40.6,https://wfqqreader-1252317822.image.myqcloud.com/cover/728/32463728/s_32463728.jpg
投资的怪圈：成为洞察人性的聪明投资者,2020-05-01 00:00:00,经济理财-财经,聪明人为何也难免愚蠢？大脑有着怎样的预期回路？为什么说记忆由金钱铸造的？如何修正预测？负面消息的代价是什么？墨菲定律与投资有着怎样的关系？……作为对格雷厄姆的投资理论领悟极深的人（另一人为巴菲特），作者基于神经学、经济学和心理学交叉领域——神经经济学的研究，力图让我们理解投资行为背后的驱动因素究竟是什么，如何才能做到正确投资，减少损失？为完成著作，作者探访了数十家全球知名神经经济学实验室，亲身参与大量现场实验，并把自己及105位专家的研究成果与生活中的奇闻逸事巧妙结合起来，让人们更全面地认识自己的投资本性，看到作为一名投资者，成功或失败背后的原因究竟是什么。与此同时，总结了投资决策中的种种教训，提供能给投资者带来真金白银的决策建议，并告诉投资者，如何在理性与感性之间做出合理的抉择。,12,750,0,37.2,https://wfqqreader-1252317822.image.myqcloud.com/cover/601/31517601/s_31517601.jpg
中国经济2021：开启复式时代,2021-01-01 00:00:00,经济理财-财经,原以为新冠疫情只是一场可以速战速决的“遭遇战”，却没想到在全球蔓延，成为影响世界经济最大的那只黑天鹅，加剧了百年未有之大变局的复杂程度。疫情有多长？衰退有多深？全球经济走向成谜。美国脱钩中国，网络将世界互联，脱钩与互联，谁将代表未来？全球集体“放水”，世界经济下探……逆全球化趋势下，中国开启内外双循环政策，经济安全岛权重逐渐上升。新冠疫情开启不确定性未来，复式危机全面爆发，但危机与机遇并存。本书旨在对疫情后的世界和中国经济进行全面剖析，并预测中国经济2021的走势，带领读者走出后疫情时代迷局，把握机遇，开拓未来发展新局！,29,622,0,38,https://wfqqreader-1252317822.image.myqcloud.com/cover/360/34889360/s_34889360.jpg
长期主义：关注短期业绩，更要投资长期增长,2021-10-01 00:00:00,经济理财-财经,霍尼韦尔前董事长、CEO，传奇CEO之一高德威的重磅著作。在充满挑战的时代，真正的长期主义者会在关注短期业绩的同时，努力投资长期增长，从而实现个人和公司的可持续发展。霍尼韦尔前CEO高德威深刻理解这一点。当他于2002年接手霍尼韦尔时，它正深陷困境。很多人只关注完成眼前的绩效，甚至不惜通过财务造假来达成目的。而当他于2018年离任时，这家公司复兴成为全球500强硬科技巨头，市值更是从原来的200亿美元飙升至1200亿美元，投资回报率达到了惊人的800%。高德威对公司管理思维、组织流程、企业文化、投资和增长模式、人事制度进行了一系列调整和优化，通过实践长期主义，实施短期和长期同时发展的战略，高德威成功扭转了全公司短期主义的行事模式，在使公司起死回生的同时，更是实现了高速增长。对于个人和企业管理者来说，了解长期主义的思维和决策模式，并将其应用到个人和企业活动中，具有重要的指导意义。,13,889,0,48.3,https://wfqqreader-1252317822.image.myqcloud.com/cover/393/41355393/s_41355393.jpg
失去的三十年：平成日本经济史,2022-01-01 00:00:00,经济理财-财经,本书主要从经济层面回顾整个平成时代。在这个时代，我们这代人度过了50～80岁的人生，而且与上一代人共同推动了平成时代的发展。对于昭和时代的经济人物，大部分人我只在书上了解过，见过面的人屈指可数。但是，平成时代的大部分经济人物都与我有着直接或间接的关系。因此，从这个意义上来说，本书并不是单纯分析数据和罗列资料，而是真实记述发生在我身边的事。,13,573,0,25,https://wfqqreader-1252317822.image.myqcloud.com/cover/268/43550268/s_43550268.jpg
