title,publishTime,category,intro,maxFreeChapter,newRating,free,price,cover
魔鬼经济学1：揭示隐藏在表象之下的真实世界（第二版）,2021-07-01 00:00:00,经济理财-财经,《魔鬼经济学》，有趣的烧脑奇书，畅销数十个国家的经济学通识读本，洞察行为的深层动机，像聪明人那样看世界。列维特和都伯纳取材日常生活，以经济学的方式来探索日常事物背后的世界：念书给婴儿听会不会使他日后成为一个好学生？游泳池比枪支还危险？贩毒集团的结构其实和麦当劳的组织很像；父母教养方式的差异对孩子影响不大……话题五花八门，却都与我们看待这个世界的方式有关。《魔鬼经济学1》确立了一个有悖于传统智慧的观点：如果说伦理道德代表了我们心目中理想的社会运行模式，那么经济学就是在向我们描述这个社会到底是如何运行的。同时，作者也展示了千方百计搜集来的各种数据——学校的考试成绩、日本著名相扑手的秘密证据、房地产经纪人的买卖记录，甚至还有卧底黑社会的秘密日记。通过对这些数据的巧妙分析，作者得出了种种令人跌破眼镜的结论。他们将教会你如何用数据分析你所看到的世界，告诉你真实的世界原来是这样的……《魔鬼经济学1》像一部侦探小说，只不过作者所要侦破的最终目标不是“找到凶手”，而是“揭开真实世界的伪装”。《魔鬼经济学1》书中的几乎每一个字都是对传统智慧的颠覆，许多发现甚至可以称得上惊世骇俗。,6,642,0,45.5,https://wfqqreader-1252317822.image.myqcloud.com/cover/598/40638598/s_40638598.jpg
半小时漫画经济学4：理财篇,2020-09-30 00:00:00,经济理财-财经,零基础搞懂九大理财方式的原理、优点及风险，理财不再盲目选！理财入门！一看就懂，一笑就会！没有复杂的公式，没有晦涩的知识，全是浅显易懂的漫画和段子。没有复杂的公式，没有晦涩的知识，全是浅显易懂的漫画和段子。翻开本书，零基础入门理财知识，半小时弄清理财方式！俗话说，你不理财，财不理你。看着别人钱生钱、利滚利，自己也手痒。可打开理财网站，眼花缭乱，实在是看不懂、不会选，更怕选不好还得赔钱。别慌！陈磊（混子哥）领衔的半小时漫画团队通过漫画和故事，帮你零基础搞懂九大理财方式的原理、优点及风险，理财不再盲目！,4,780,0,19.99,https://wfqqreader-1252317822.image.myqcloud.com/cover/144/33879144/s_33879144.jpg
中国崛起不可承受之错,2016-03-01 00:00:00,经济理财-财经,《中国崛起不可承受之错》，中国问题专家、高层智囊大声疾呼，警惕颠覆性错误，秉笔直书，向顽瘴痼疾开刀。国家主席习近平近年来多次强调，“中国是一个大国，决不能在根本性问题上出现颠覆性错误，一旦出现就无法挽回、无法弥补”。如果出现颠覆性的错误，那么少则改革停滞不前甚至倒退，多则已有的改革成果会付之东流。,8,805,0,28.8,https://wfqqreader-1252317822.image.myqcloud.com/cover/899/838899/s_838899.jpg
金融的本质：伯南克四讲美联储（中英双语版）,2017-05-01 00:00:00,经济理财-财经,《金融的本质》一书，即是伯南克以其擅长的通俗、直接的方式，汇集了伯南克关于美联储在应对金融危机时采取的诸多政策背后的金融思想，以及他的金融理念。《金融的本质》主要分为四部分，内容贯穿了美联储从1914年成立至此次金融危机期间90余年的历史，既是一本简短的关于美联储的中央银行金融史，也可以说是应对危机的金融政策演变史。,7,774,0,34.8,https://wfqqreader-1252317822.image.myqcloud.com/cover/186/908186/s_908186.jpg
光刻巨人：ASML崛起之路,2020-10-01 00:00:00,经济理财-财经,如何将一项毫无希望的研究和商业活动转变为价值数十亿美元的机器和世界领先的公司？荷兰企业ASML（阿斯麦）成功了，知名科技作家瑞尼·雷吉梅克（RenéRaaijmakers）在书中揭示了ASML是如何做到的。20世纪80年代，美国光刻机巨头Perkin-Elmer和GCA在芯片光刻市场上遭到了日本竞争对手佳能和尼康的猛烈攻击。结果，美国失去了对这项关键技术长达20年的垄断地位，而这正是摩尔定律背后的驱动力。与此同时，一家默默无闻、无足轻重的光刻机小公司在荷兰刚刚起步。这家公司就是ASML，它在今天获得了无与伦比的成功。作为世界上很大和很赚钱的光刻机制造商，ASML取得了70%~80%的光刻市场份额，并多年来在光刻技术上一骑绝尘，将佳能和尼康远远甩在后面。在《光刻巨人：ASML崛起之路》中，作者瑞尼·雷吉梅克带我们重返了晶圆步进光刻机的诞生地，和我们一起探索了ASML在全球获得令人瞩目的成功之根源所在。,20,807,0,69,https://wfqqreader-1252317822.image.myqcloud.com/cover/315/34232315/s_34232315.jpg
财富自由,2019-07-01 00:00:00,经济理财-财经,为什么富人开的车的平均价格只有35000美元，而丰田是他们最喜欢的品牌？为什么富人住的房子面积只有177平米，而普通人住的房子却超过220平米？为什么富人穿的牛仔裤价格不超过50美元、戴的手表不超过300美元？为什么80%的富豪都是白手起家、蓝领工人的后代最有可能成为富豪？为什么财富越多的富豪平均每天与配偶相处的时间越长？为什么收入越高的富豪交税比例反而越低？……全球富豪研究专家托马斯·J.斯坦利博士耗费40年心血，从衣、食、住、行等方面全方位刻画出超过100000名平民出身的富豪的7大典型特征、6个生活和工作的原则，照着做，任何人都可以走上属于自己的财富自由之路！,19,636,0,38.99,https://wfqqreader-1252317822.image.myqcloud.com/cover/992/25925992/s_25925992.jpg
未来三十年,2016-01-01 00:00:00,经济理财-财经,"    本书是中国问题专家郑永年立足国情、前瞻趋势之作。十八大绘就了全面深化改革的蓝图，两年多的时间里，取得了很多成效，也出现了新的问题，比如经济进入新常态，增速比我们想象的还要再低一些；运动式反腐，不断揪出大老虎，如何制度化，从而预防和遏制腐败，避免“亡党亡国”？目前的改革遇到了哪些新的风险？“一带一路”这个新战略的经济逻辑是什么，怎么有助于中国崛起？中国如何处理和周边国家的关系，美国重返亚洲，是在孤立中国吗？本书就是试图通过分析和回答这些新挑战、新矛盾、新力量出现的原因、目前的情势，以及应对的策略，对我们无法确定的未来给予更多的指导。
",15,739,0,27,https://wfqqreader-1252317822.image.myqcloud.com/cover/133/908133/s_908133.jpg
房债：为什么会出现大衰退，如何避免重蹈覆辙,2015-08-26 00:00:00,经济理财-财经,始于2007年的金融危机，导致美国800万人失业，400万家庭流离失所。这与美国从2000年到2007年住房抵押贷款翻番真的只是时间上的巧合吗？作者认为，当然不是！正是住房债务的大幅提升导致了次贷危机、大衰退乃至欧债危机。本书利用大量关于2008年金融危机和住房债务的数据，提出了一个杠杆化损失的分析框架，以此框架重新检视了美国家庭债务，主要是住房债务，与金融危机的关系，批评了美国在危机时期采取的政策，并提出了如何防止下一次衰退的政策建议。近年来，中国房价居高不下，住房抵押贷款从无到有，大规模增加，认为中国房地产市场存在泡沫的声音不绝于耳，本书对分析、判断中国房价到底有没有泡沫，如何防止房地产贷款积累冲击金融体系和实体经济，避免重蹈美国覆辙，也有重要的借鉴意义。,25,707,0,21.6,https://wfqqreader-1252317822.image.myqcloud.com/cover/604/833604/s_833604.jpg
从零开始学缠论：缠中说禅核心技术分类精解,2020-09-01 00:00:00,经济理财-财经,《从零开始学缠论：缠中说禅核心技术分类精解》是投资者学习缠论的普及读本，简单的方式，通俗易懂的语言，精心制作的图例是本书的亮点与特色。《从零开始学缠论：缠中说禅核心技术分类精解》分为4大篇，共11章。第1～2章是基础篇，包括缠论的理论基础及市场法则；第3～7章是形态篇，包括K线、分型、笔、线段、中枢等核心内容；第8～9章是动力篇，包括背驰、买卖点；第10～11章是工具篇，包括均线及MACD指标。本书循序渐进、详细有致地带投资者了解缠论的理论框架、核心思想体系、交易原则与操作技巧，帮助投资者快速理解缠论原文的核心内容，掌握相关要点，进而整合资源，建立属于自己的系统交易方法。《从零开始学缠论：缠中说禅核心技术分类精解》适合有一定炒股经验的投资者阅读，尤其适合证券投资专业人士学习。,13,712,0,24.8,https://wfqqreader-1252317822.image.myqcloud.com/cover/538/33717538/s_33717538.jpg
行为经济学系列（套装共9册）,2019-05-01 00:00:00,经济理财-财经,《怪诞行为学（套装共5册）》内容简介：《怪诞行为学.1，可预测的非理性》内容简介：我们为什么会浪费丰盛晚宴中的精致食物，却对一张优惠餐券念念不忘?在做生活中的各种决策时，我们总是以为自己正在做出明智的、理性的选择。但是事实真的是这样吗?在本书中，丹·艾瑞里带我们进入了行为经济学领域，通过一系列实验研究颠覆了人们曾经普遍认同的我们的行为是最理性的假设。《怪诞行为学.2，非理性的积极力量》内容简介：按照理性的观点，我们的一切决策应该符合我们的利益，我们应该辨别面临的各种选择并准确计算价值，做出符合我们利益的选择。同时，本书还将越过工作环境，深入检验我们在人际关系中的行为。,73,853,0,298.2,https://wfqqreader-1252317822.image.myqcloud.com/cover/615/27269615/s_27269615.jpg
反脆弱：从无序和不确定中获益,2014-01-01 00:00:00,经济理财-财经,本书涵盖了诸多议题，包括试错法、生活中的决策、政治、城市规划、战争、个人理财、经济体系和医学领域。除了布鲁克林的胖子托尼的市井智慧，源自古罗马、古希腊、闪米特与中世纪的声音和经验也如历史遗珠般贯穿全文，闪烁着令人深省的智慧之光。,15,783,0,7.99,https://wfqqreader-1252317822.image.myqcloud.com/cover/977/573977/s_573977.jpg
支付方法论,2021-01-01 00:00:00,经济理财-财经,这是一部从产品、运营、业务、技术4个维度全面讲解支付理论与实操的著作。详细阐述了如何通过支付系统建设支付能力，降低支付成本，降低支付风险、提高支付成功率与客户体验，完成支付的收益最大化。作者是京东支付产品专家，深耕支付行业10年，本书是对其在盛大、携程、蚂蚁金服、京东等企业所积累的丰富经验的总结，得到了卡组织、发卡行、网络转接服务商、支付服务商、第三方支付机构、大型商户如Visa、京东、平安、Credorax、Ingenico等国内外众多支付行业专家的一致好评。全书共7章，系统阐述了支付架构、支付工具、支付核心、支付支撑服务、支付渠道接入、支付清结算等核心模块。第1章介绍了支付业务的构成、支付演进历史、支付架构与常见的支付名词，帮助读者通过了解支付逻辑、概念、架构等功能模块，建立对支付的整体认知。第2章阐述了通道的结构与分类、内卡通道接入流程和通道接入确认点。第3章介绍了跨境支付背景与特点、展业资质、购结汇业务、外卡通道接入确认点。第4章讲解了路由如何进行收益管理以及引导路由和交易路由算法的构成。第5章总结了重试服务如何提高支付成功率，介绍其设计思想和系统实现方法。第6章介绍了BIN的含义与产生、BIN服务的多种设计方案和卡号校验算法。第7章讲解了清分与结算服务职能与模块功能，详细解释与展示了计费服务、账单服务、对账服务、会计服务与结算服务的系统设计。,26,875,0,59.4,https://wfqqreader-1252317822.image.myqcloud.com/cover/865/35971865/s_35971865.jpg
第一本经济学,2018-04-01 00:00:00,经济理财-财经,《第一本经济学》是第一本综合了奥地利学派与古典经济学精华的基础经济学读本，它在整体框架上沿袭了奥地利经济学派宗师米塞斯的经济学巨著《人的行动》和著名传承大师罗斯巴德的《人，经济与国家》。全书共包括四大部分，第一部分是全书的基础，主要分析人的行动的基本逻辑和本质特征，这是理解真实人的经济学的基础；后面3个部分分别阐述在3种不同的制度条件下，人的经济行为的表现后果——这充分体现了作者逻辑的严谨，与此同时，作者还通过插图、幽默的措辞以及讲故事的平实手法，将储蓄、公共建设工程、税收、信贷、就业与失业、关税、低工资、进出口、价格体系、房租管制、工会、低工资、利润、福利制度、禁毒、通货膨胀等热点话题有机融合至其论述框架之内。作者以浅显的文字取代高深的经济学术语与复杂的公式，让小至10岁左右的儿童可以入门学习，让未受过经济学训练的普通读者理解与他们息息相关的生活世界，让受过多年经济训练的专家学者都不觉对自以为熟悉的领域耳目一新！,9,746,0,23.6,https://wfqqreader-1252317822.image.myqcloud.com/cover/531/23410531/s_23410531.jpg
中国经济史,2013-12-01 00:00:00,经济理财-财经,"    1954至1955年期间，钱穆先生曾于香港新亚书院先后讲授“中国经济史”及“中国社会经济史”两门课程，扼要地讲述了由上古春秋战国至明清时代的经济情况及财政政策，并道出经济与政治、文化、社会、军事、法律、宗教之间的相互影响和联系，评价政策和朝代兴亡之关系。叶龙曾师从钱穆多年，详尽笔录及整理了先师两门课程的内容，对一些内容做出了补释，形成流畅易读的文章，在香港《信报》经评版陆续刊出后，受到了读者的热烈欢迎，最后集结出版形成本书。本书不仅填补了钱穆先生缺乏经济专门史著作的遗憾，更令读者能够通过阅读中国经济史加深对钱穆先生其他著作的理解，以体悟钱穆先生强调要在文化传统一体性中做研究的教诲。
",30,815,0,23.88,https://wfqqreader-1252317822.image.myqcloud.com/cover/818/279818/s_279818.jpg
繁荣与衰退,2019-06-01 00:00:00,经济理财-财经,《繁荣与衰退》沿着美国经济发展的时间脉络，用精彩凝练的语言讲述了每个历史时期推动经济发展的最重要的社会因素。这本书论述了美国经济史中的重要话题，无论是内战爆发前南方奴隶制发挥的作用，还是罗斯福新政带来的实际效应，甚至是全球化及其影响给民众带来的剧烈冲击，都给读者带来强烈的震撼。但最令人印象深刻的，应该是数百万普通美国民众释放出来的惊人的能量，正是这股能量推动着美国走向财富和力量的巅峰。根据两位作者的观点，美国之所以展现出与众不同的天赋，核心在于能够容纳创造性破坏带来的后果，破旧立新的潮流从未衰退，新人口、新观念总是不断带来进步。尽管创造性破坏往往会造成混乱的后果，但它使美国人的生活水平提升到前人无法想象的高度。作者认为，面对创造性破坏带来的损失，美国人总是愿意用牺牲换取收益，如果我们不能认清这个事实，就无法解释美国的崛起，也无法解释美国如何应对历次挑战。最近几十年间，美国的生产力止步不前，作者认为，这是汲取历史经验的佳时刻，美国是否还能保持其领先地位，还是将其拱手让人，应该从历史中找到答案。,5,793,0,52.8,https://wfqqreader-1252317822.image.myqcloud.com/cover/831/25746831/s_25746831.jpg
女士品茶：统计学如何变革了科学和生活,2016-08-01 00:00:00,经济理财-财经,"统计学之所以被滥用、误用，其实是因为它太有用，在某种程度上,可以说改变了世界上处理问题的方式。这是一部统计学的史诗。一百多年来，统计学从无到有，以至于蔚为壮观。一部统计学的发展史，就是一部不断革新现有科学体系的历史。本书深入浅出地描绘了这一历程，为读者奉献了一场思想的饕餮盛宴。这是一部关于叱咤风云的统计学学霸的传奇故事书。回望那段波澜壮阔的时代,一张张脸孔水一样掠过。在英国剑桥的某个午后，有位女士声称，把茶加到牛奶里，和把牛奶加到茶里，两种方法调出来的下午茶喝起来味道不同。在座的科学家都对她的说法嗤之以鼻，但有位来访的瘦小绅士，R.A.费希尔，提议要用科学的方法，来检验这位女士的假设……本书以这位喝下午茶的英国女士为起点，带领读者一一回顾“统计”这门应用范围最广的科学，了解若干重要理论的发展过程与应用，亲近那些隐身幕后的统计学家，看看统计究竟为今天这个世界，带来了什么样的改变。这是一部大数据时代不容错过的实用之书。大数据时代，一切以数据说话，如何解读数据便与每个人的日常生活息息相关。统计学的本质就在于解读数据，读懂了本书，你就是大数据时代的明白人。",39,843,0,28.8,https://wfqqreader-1252317822.image.myqcloud.com/cover/203/37349203/s_37349203.jpg
财务尽职调查：全流程方法与实务案例,2021-04-01 00:00:00,经济理财-财经,《财务尽职调查 全流程方法与实务案例》以案例为开篇，形象地说明投资过程中会面临的诸多问题，带领读者快速进入“财务的世界”。《财务尽职调查 全流程方法与实务案例》通过对理论及案例的经验解读，引出财务尽职调查过程中全流程的实践方式及方法。通过阅读《财务尽职调查 全流程方法与实务案例》，读者不仅能掌握财务尽职调查的一般性流程，还能了解财务尽职调查的底层逻辑及如何构建财务尽职调查的框架思维。《财务尽职调查 全流程方法与实务案例》共分为4篇，涵盖的内容有财务尽职调查的逻辑思维、财务尽职调查的业务流程、财务尽职调查的分析方法、财务尽职调查的实战演练。《财务尽职调查 全流程方法与实务案例》核心内容包括制订计划、关键访谈对象及其行为心理学、对财务报表的分析、企业的综合性调查、盈利预测与估值、财务尽职调查报告模板，半导体行业和医药行业的主要财务特点、财务尽职调查案例等。《财务尽职调查 全流程方法与实务案例》通俗易懂，案例丰富，实用性强。特别适合私募股权投资、风险投资等投资机构的财务尽职调查人员，会计师事务所的初级审计人员，以及其他对投资、财务分析感兴趣的人士阅读。,8,856,0,38.5,https://wfqqreader-1252317822.image.myqcloud.com/cover/655/38493655/s_38493655.jpg
半小时漫画经济学3：金融危机完结篇（独家定制版）,2020-04-01 00:00:00,经济理财-财经,【微信读书全网独家首发，独家定制版】用特别有趣的方式，讲清楚特别艰深的经济学原理。在大多数读者的心目中，经济学都是专业、晦涩的代名词，但陈磊（笔名：二混子）领衔的半小时漫画团队，却通过手绘漫画和段子，一边用历史上著名的金融危机事件抖包袱，一边一目了然地展现经济发展的规律：日本经济为何停滞了整整十年？原因不过是签了个字。索罗斯如何凭一己之力搞翻亚洲经济？其实他只用了三步。次贷危机为什么会爆发？原来都是被买房的压力逼出来的……没有枯燥乏味的数字堆砌，没有生涩难懂的专业术语，只用有趣的段子和一看就懂的漫画解答这些问题，为你理清它们背后那些让人蒙圈的经济学原理：做空、羊群效应、雁形模式、资产证券化……打破经济学在你心目中高高在上的印象，让你在哈哈大笑的同时，一不小心就看穿了经济发展的规律！翻开本书，一不小心就看穿了经济发展的规律。,9,838,0,17.91,https://wfqqreader-1252317822.image.myqcloud.com/cover/865/29845865/s_29845865.jpg
清华韩秀云讲经济,2019-05-01 00:00:00,经济理财-财经,韩秀云教授的经济课和她的研究一样，不只停留在经济学理论，更擅长通过分析当前经济形势，对未来的经济发展趋势做出精准判断。无论你是想了解经济学的求知者，还是想认清行业发展趋势的职场人士，或是想看清市场格局的理性投资者，在本书中，你不仅可以学习到专业的经济学知识，而且能读到你关心的股市、楼市、汇市分析，同时，你将学会运用经济学知识，在经济寒冬中让资产保值增值。,7,831,0,40.6,https://wfqqreader-1252317822.image.myqcloud.com/cover/40/38088040/s_38088040.jpg
证券业从业人员资格考试辅导教材：金融市场基础知识,2017-01-01 00:00:00,经济理财-财经,作为证券业从业人员资格考试考前辅导资料，《2017年证券业从业人员资格考试辅导教材金融市场基础知识》严格遵循证券业从业人员一般从业资格考试大纲中“金融市场基础知识”科目大纲，根据改革后历次考试特点架构知识体系，内容条理清晰，结构严谨。书中从基本的、重要的考点出发，深入浅出地向考生讲解了各个知识点，同时精选考试真题与典型习题，使考生在复习知识点的同时，熟悉考试真题的命题风格和特点，并通过典型习题的练习来巩固相关知识，增强应试能力。《2017年证券业从业人员资格考试辅导教材金融市场基础知识》以证券业从业人员资格考试的考生为主要读者对象，特别适合其考前复习使用；同时本书也可作为证券业从业人员资格考试培训机构的辅导教材，以及高等院校财经专业师生的学习参考用书。,16,0,0,19.5,https://wfqqreader-1252317822.image.myqcloud.com/cover/751/33528751/s_33528751.jpg
剧变：人类社会与国家危机的转折点,2020-04-01 00:00:00,经济理财-财经,《剧变》是一部恰逢其时的巨制。在个人与国家都对未来充满迷茫，危机接踵而至的当下，普利策奖得主、《枪炮、病菌与钢铁》作者贾雷德•戴蒙德再一次回归历史，尝试解答危机应对这一关乎人类未来的重要命题。 对个人而言，危机可以改变一个人的成长轨迹，如处理不当，终其一生会生活在负面情绪中。对整个人类社会而言，危机可使一种文明没落，使一个国家解体，使一个时代终结。但在戴蒙德看来，二者并无差异，国家甚至可以借鉴个人化解危机的逻辑框架以实现自救。就此，戴蒙德再一次跳脱了自然科学与社会科学互设的知识壁垒，重建自然状态与文明秩序相融的历史叙事线索，巡礼7个案例国家的危机应对历史。他以一位社会观察者的自谦视角，从社会学、心理学、政治学、经济学、进化生物学等多学科出发，给出了“危机应对12个步骤”。正如丘吉尔所言：“永远不要浪费一场好危机。”危机与剧变总是结伴而行。戴蒙德的危机应对方案或许可以帮助人类重塑危机意识，毕竟在瞬息万变的时代，个人、企业、国家乃至整个人类社会都要不断进行选择性变革。你做好准备了吗？这或许也是戴蒙德为我们设下的一个开放性思考题。,18,744,0,58.8,https://wfqqreader-1252317822.image.myqcloud.com/cover/385/30205385/s_30205385.jpg
止损：如何克服贪婪和恐惧,2016-06-01 00:00:00,经济理财-财经,亏损在真实的投资世界里是无法避免的，而控制亏损才是大师与庸人的区别所在。本书作者年纪轻轻就在芝加哥商业交易所升至董事的高位，却又因为一连串的骄纵自大，赔掉一切，包括他的财富、声誉和工作。在本书中，作者诚实、坦白地重新检视了导致自己做出灾难性决策的过程，深入探索了这些投资失策背后的心理因素。作者以自己的亲身经历告诉我们，应该如何建立一个简单的决策框架，从而在交易中避开常见的心理陷阱，保持清醒头脑，将可能的亏损控制在最低限度。,21,754,0,15.99,https://wfqqreader-1252317822.image.myqcloud.com/cover/104/35666104/s_35666104.jpg
