title,publishTime,category,intro,maxFreeChapter,newRating,free,price,cover
置身事内：中国政府与经济发展,2021-01-01 00:00:00,经济理财-财经,本书是复旦大学经济学院副教授兰小欢多年教学与研究内容的凝练，将经济学原理与中国经济发展的实践有机融合，以地方政府投融资为主线，深入浅出地论述了中国经济的发展，广泛采纳各领域学者全新研究成果。全书分上下两篇。上篇解释微观机制，包括地方政府的基本事务、收支、土地融资和开发、投资和债务等；下篇解释这些微观行为与宏观现象的联系，包括城市化和工业化、房价、地区差异、债务风险、国内经济结构失衡、国际贸易冲突等。最后一章通过对中国政治经济体系的论述，作者简明地刻画了地方政府进行经济治理的基本方式，指出中国政府通过深度介入工业化和城市化的进程，在发展经济的同时逐步推动了市场机制的建立和完善。,24,964,0,35,https://wfqqreader-1252317822.image.myqcloud.com/cover/543/40055543/s_40055543.jpg
怪诞行为学（全四册）（新版）,2017-12-01 00:00:00,经济理财-财经,你会心安理得地把办公室的铅笔拿回家给孩子用吗？“因为路上堵车，所以我迟到了”这样的借口是否常挂在你的嘴边？穿戴冒牌服饰会不知不觉降低我们的道德底线吗？面对诱惑，医生、专家、的意见还有几分可信？我们一贯倡导的团队合作会让我们更诚实还是更不诚实？这一次，行为经济学家丹·艾瑞里聚焦于人们欺骗行为的动因，带领读者走进非理性背后的诚实的真相。丹·艾瑞里通过大量的实验和例证在书中探究了那些导致我们不诚实的原因，以及我们如何能在为自身利益选择不诚实的同时还能维护自身形象。同时还研究了不诚实的社会动因，以及不诚实的行为是怎样发生作用的，并找出一些有趣的方法来克制和限制这种行为。,33,796,0,108,https://wfqqreader-1252317822.image.myqcloud.com/cover/592/924592/s_924592.jpg
原则：应对变化中的世界秩序,2022-01-01 00:00:00,经济理财-财经,自然界的发展是有规律的，而任何事物都按其固有的轨迹运行。人们能够用一定的方法去认识它、体验它、并按照客观规律改造它。从《原则》《债务危机》到《原则：应对变化中的世界秩序》，桥水投资公司创始人瑞·达利欧的研究角度涉及个体、组织、社会和世界。他想揭示的是个体的生活和工作原则、组织机构的运转原则、国家和社会的兴衰原则、世界秩序的变化原则。在这本书中，瑞·达利欧探究的是社会和世界的运行规律和原则，他考察了500年财富和权力的所有重大变化背后反复出现的模式和因果关系。他认为在这些变化背后存在着永恒普适的规律。通过考察许多相互关联的历史事件，可以看到这些变化的典型模式、规律、周期和因果关系，并以此为基础推断未来。达利欧认为，历史通常也是通过相对明确的生命周期、随着一代人向下一代人的过渡而逐步演进的。目前相对财富、权力和世界秩序正在发生典型的巨变，这将对所有国家的每个人都产生深远的影响……这本书的分析和探究建立在达利欧独创的债务大周期、历史大周期的基础之上，揭示的是变化背后的永恒和普遍的力量，以此展望未来，搞清世界的运行原理，总结出永恒普适的原则，从而妥善地应对当前形势。,8,915,0,135,https://wfqqreader-1252317822.image.myqcloud.com/cover/53/42689053/s_42689053.jpg
半小时漫画经济学系列（共4册）（独家定制版）,2020-09-01 00:00:00,经济理财-财经,全网1300万粉丝的漫画式科普开创者陈磊（混子哥）及其团队继《半小时漫画中国史》《半小时漫画唐诗》系列之后推出的又一科普大作！用特别有趣的方式，讲清楚特别艰深的经济学原理！零基础搞懂九大理财方式的原理、优点及风险，理财不再盲目选！用历史上著名的金融危机事件抖包袱，一目了然地展现经济发展规律：石油危机、黑色星期一、亚洲金融风暴、次贷危机、做空……通过手绘漫画和段子，将经济学与现实生活中安身立命的问题相结合,11,814,0,99.99,https://wfqqreader-1252317822.image.myqcloud.com/cover/836/26629836/s_26629836.jpg
贫穷的本质：我们为什么摆脱不了贫穷（修订版）,2018-09-01 00:00:00,经济理财-财经,他们曾被说成是白人的负担，是弱国劣政的牺牲者。 他们是最底层的10亿人，生活在每天0.99美元的贫困线之下。 数万亿美元的援助未能救他们于水火之中， 他们，依然深陷贫穷的陷阱，前路不明…… 5年以来，为了弄清为什么会贫穷，贫穷又会导致哪些特定问题，从而不断让穷人陷入无法逃离“贫穷陷阱”的怪圈，两位作者深入五大洲多个国家的穷人世界，调查贫困人群最集中的18个国家和地区，从穷人的日常生活、教育、健康、创业、援助、政府、NGO等生活的多个方面，探寻贫穷真正的根源。 同时，本书也对关于贫穷的一些流行观点进行了反思，比如援助越多穷人的依赖性越强，外部援助不起作用等等。他们指出，多年来的扶贫政策大都以失败而告终，原因就在于人们对于贫穷的理解不够深刻，好钢没有用在刀刃上。他们通过大量的实例，提出了一些实用性较强的建议，寻找那些经得起检验的扶贫方案，为政策制定者、慈善家、政治家及所有希望天下脱贫的人提供了重要指导。,7,674,0,34.8,https://wfqqreader-1252317822.image.myqcloud.com/cover/985/24275985/s_24275985.jpg
资本论（超值白金版）,2010-05-01 00:00:00,经济理财-财经,这是马克思花费40年的光阴，用毕生的心血写成的一部著作，它既是政治经济学的光辉巨著，也是马克思主义的百科全书。这部巨著第一次深刻地分析了资本主义的全部发展过程，阐述了资本主义商品生产、流通和分配的基本理论，揭示了经济发展的客观规律，具有划时代的历史意义。,20,824,0,14.99,https://wfqqreader-1252317822.image.myqcloud.com/cover/939/920939/s_920939.jpg
聪明的投资者（第4版，注疏点评版）,2016-03-01 00:00:00,经济理财-财经,《聪明的投资者》（第4版注疏点评版）首先明确了“投资”与“投机”的区别，指出聪明的投资者当如何确定预期收益。《聪明的投资者》（第4版注疏点评版）着重介绍防御型投资者与积极型投资者的投资组合策略，论述了投资者如何应对市场波动。《聪明的投资者》（第4版注疏点评版）还对基金投资、投资者与投资顾问的关系、普通投资者证券分析的一般方法、防御型投资者与积极型投资者的证券选择、可转换证券及认股权证等问题进行了详细阐述，为普通人在证券投资策略的选择和执行方面提供了重要指导股神巴菲特为本书撰写的序言和评论是这个版本的又一个亮点。,12,882,0,70.4,https://weread-1258476243.file.myqcloud.com/weread/cover/16/3300014116/s_3300014116.jpg
宏观经济通识课,2019-10-01 00:00:00,经济理财-财经,宏观经济究竟研究什么？通货膨胀到底是怎么来的？谁能为通货膨胀买单？中国经济回暖了吗？如何能让人人都能读懂经济学知识，发现经济学之美，是韩秀云教授三十五载清华讲堂上的一项艰巨任务。本书用幽默的语言、有趣的故事、独特的历史视角，帮助读者洞悉日常生活现象背后的经济思维，理解经济学基本理论与常识。没有枯燥的理论和无休止的图表，让经济学知识生动起来，让我们看清经济发展大趋势，透视复杂世界的真实逻辑。,8,903,0,40.6,https://wfqqreader-1252317822.image.myqcloud.com/cover/804/38259804/s_38259804.jpg
国富论,2014-11-01 00:00:00,经济理财-财经,《国富论》，原名《国民财富的性质和原因的研究》，是一部经济学专著，也是学术领域内颇具影响力的一部作品。本书共分五篇，总结了近代初期各国资本主义发展的经验，批判吸收了当时的重要经济理论，对整个国民经济的运动过程作了系统的描述，为经济学确定了完整的架构，奠定了资本主义自由经济的理论基础，第一次提出了市场经济会由“看不见的手”自行调节的理论。该书的问世成为了现代政治经济学研究的起点，使经济学成为了一门独立的科学。,30,862,0,2,https://wfqqreader-1252317822.image.myqcloud.com/cover/985/650985/s_650985.jpg
一本书读懂财报（全新修订版）,2019-06-12 00:00:00,经济理财-财经,本书是一部进行财报解读、财务分析的经典著作，被读者们誉为“读过的财务入门书里最好的一部”，同时也是中国大学MOOC平台最精品课“财务分析与决策”的配套参考书、喜马拉雅FM收听超500万次音频课的进阶版图书。自2014年首次出版以来，本书长年占据当当、京东经管类畅销书榜单，影响了无数财务行业初学者、投资人和企业管理层，被众多企业指定为中层及以上管理者必读图书。此次，清华大学经济管理学院教授、会计系系主任肖星老师对原版书做了全面修订，一方面使本书内容符合新会计准则要求，另一方面还补充了全新的案例，新内容占总篇幅的五分之一。全书从解读资产负债表、利润表、现金流量表三大财务报表和它们之间的关系出发，为你搭建财务报表骨架，剖析财务数据背后的秘密。读完本书，财务行业初学者将轻松掌握财务分析的方法与技巧，投资人能轻松判断企业的价值，企业管理者能轻松看穿企业的管理效率、盈利能力、抗风险能力和未来发展前景。秒通财报，就从本书开始。清华大学会计系系主任、喜马拉雅FM头部KOL肖星倾囊相授，专门为财务零基础的初学者和非财务专业人士编写，曾被读者誉为“读过的财务入门书里最好的一部”。中国大学MOOC平台精品课“财务分析与决策”的配套参考书、喜马拉雅平台收听超500万次音频课的进阶版图书。豆瓣评分8.9分，长年占据dangdang、jingdong经管类畅销书榜单，电子书销量位列kindle会计类图书首位。经久不衰的经典之作，按新会计准则全面修订，补充加入全新案例，新内容占全书总篇幅的五分之一。接地气、易上手的财报分析技巧，秒通财报就从本书开始。一本书让你吃透财务报表，看穿隐藏在数据背后的秘密；一本书让管理者管好企业，让投资人投对标的，让股东掌握企业的真相。肖星清华大学经济管理学院教授、会计系系主任，清华大学全球私募股权研究院执行院长，曾获得北京市师德先锋称号、清华大学“良师益友”奖、清华大学年度教学优秀奖。同时在MOOC平台讲授“财务分析与决策”课程，在喜马拉雅FM讲授“肖星的财务课：人人都需要财务思维”课程。兼任全国会计专业硕士学位教育指导委员会委员、教育部会计专业教学指导委员会委员。其主要研究领域为财务分析、财务管理、公司治理和资本市场会计问题，文章发表于一系列国内和国际顶尖学术期刊，有著作《上市公司财务问题及分析》和译著《财务报表分析——估值方法》。,21,883,0,22.99,https://wfqqreader-1252317822.image.myqcloud.com/cover/996/32440996/s_32440996.jpg
激荡四十年：中国企业1978—2018（全三册）,2017-12-01 00:00:00,经济理财-财经,本套装包含《激荡十年，水大鱼大》和《激荡三十年（上下册》），共三册。,15,871,0,88,https://wfqqreader-1252317822.image.myqcloud.com/cover/40/923040/s_923040.jpg
结构性改革,2020-08-01 00:00:00,经济理财-财经,恰逢百年未有之大变局，经济转型发展、中美贸易摩擦、新冠疫情暴发等问题交相叠加，无不考验着我国面对复杂问题的智慧和勇气，供给侧结构性改革的重要性与紧迫性空前凸显。这本书从基础性、结构性、机制性、制度性等多个维度，深入剖析我国供给侧关键矛盾并对症下药。 全书一共七章。第 一章详解如何紧抓供给侧结构性改革主线；第二章聚焦去杠杆与金融风险防范；第三章解读新时代下我国资本市场高质量发展之路；第四章讲述“数字化”如何重塑经济社会生态；第五章对房地产长效调控机制开出药方，并预判今后十年房地产行业六大趋势；第六章着眼于国有企业资本运作与地方政府营商环境改善；第七章阐释新局面、新特征下，我国对国际形势与中美关系的应对之道，深入剖析“双循环”新格局。,9,926,0,52.8,https://wfqqreader-1252317822.image.myqcloud.com/cover/49/33362049/s_33362049.jpg
分析与思考：黄奇帆的复旦经济课,2020-07-01 00:00:00,经济理财-财经,《分析与思考——黄奇帆的复旦经济课》是黄奇帆教授在复旦大学所做的关于中国经济的讲座合集。《分析与思考——黄奇帆的复旦经济课》共收录了12次讲座，根据主题分为“宏观调控”“基础货币”“资本市场”“房地产发展”“对外开放”“中美经贸”六个部分。除此之外，还收录了黄奇帆教授回顾他亲身参与改革开放40年经济发展中的重大事件的4篇文章作为附录。《分析与思考——黄奇帆的复旦经济课》所谈的都是改革开放进入新时期以来的重点、热点问题，从现实出发，运用经济学理论总结改革开放的经验，为推进新时期经济改革和扩大开放，提供了深入的思考。《分析与思考——黄奇帆的复旦经济课》的研究方法高屋建瓴，采用“问题—结构—对策”的方法，面对各种问题时，先研究问题、分析问题，找到问题结构性的、体制性的、机制性的、制度性的短板，通过改变问题的联系方式、边界条件，使得问题朝着理想的方向和预期的目标转化。全书深入浅出，既有学理上的深刻性，又有丰富的例证，表述生动，保持了演讲的特色，富有吸引力，可读性强，无论是专业研究者还是普通读者，都可以从中受益。,7,941,0,87.49,https://wfqqreader-1252317822.image.myqcloud.com/cover/944/34527944/s_34527944.jpg
怪诞行为学1：可预测的非理性,2017-11-01 00:00:00,经济理财-财经,我们为什么会浪费丰盛晚宴中的精致食物，却对一张优惠餐券念念不忘？ 在做生活中的各种决策时，我们总是以为自己正在做出明智的、理性的选择。但是事实真的是这样吗？ 在本书中，丹·艾瑞里带我们进入了行为经济学领域，通过一系列实验研究颠覆了人们曾经普遍认同的我们的行为是完全理性的假设。无论是咖啡、减肥，买一辆车还是谈恋爱，我们的决策行为中总是带有各种非理性。 找出存在于不同领域行为和决策背后的各种力量，针对影响我们个人、企业，以及公共生活的普遍问题，找出解决方法，这正是行为经济学所要做的。 非理性是人类的本能，是主宰人类行为和决策的隐性力量。然而，这些非理性的行为既不是随机的，也不是毫无意义的。它们是有系统的、可预测的。现在，就让我们一起走进这些可预测的非理性,11,751,0,28.8,https://wfqqreader-1252317822.image.myqcloud.com/cover/213/922213/s_922213.jpg
稀缺：我们是如何陷入贫穷与忙碌的,2014-11-01 00:00:00,经济理财-财经,哈佛大学终身教授、“麦克阿瑟天才奖”获得者塞得希尔·穆来纳森和普林斯顿大学心理学教授埃尔德·沙菲尔强强联合之作，继诺贝尔经济学奖获得者丹尼尔·卡尼曼《思考，快与慢》之后的又一部行为经济学重磅新作，《金融时报》2013年必读十佳商业图书。在长期研究穷人和扶贫的过程中，塞德希尔·穆来纳森发现他和穷人的焦虑竟然类似：穷人缺钱，他缺时间。在这一现象基础上，他与普林斯顿大学心理学教授埃尔德·沙菲尔进行了大量的实验室研究和现实调查，却发现了一个存在于世人中间的惊人真相：穷困之人会永远缺钱，而忙碌之人会永远缺时间。但是，进一步的研究证实：这些都是表面现象。因为即便是给穷人一笔钱，给拖延症患者一些时间，他们也无法变得富足和高效。实际上，在长期性的资源（钱、时间）稀缺中，人们已经形成了“管窥”之见，只能看到“管子”之中的事物，虽然这有可能为我们带来“专注红利”（短期的富裕或效率），但是从长远来看，这种“专心致志”反而会让我们产生“权衡式思维”，不断增加我们的带宽负担——当1元钱的价值在穷人与富人之间产生了巨大差异时，当印度金奈的街头小贩们陷入了无止境的借贷压力时，当每个人都处在多任务处理的“杂耍”状态中时……最理性的经济模型和行为方式都会变得不再符合自身的内在逻辑。最终，稀缺会俘获我们的大脑，渐渐让我们失去认知能力和执行控制力，变得更加愚笨和冲动。,9,709,0,18.99,https://wfqqreader-1252317822.image.myqcloud.com/cover/426/853426/s_853426.jpg
小岛经济学,2016-09-01 00:00:00,经济理财-财经,如何对经济领域的各种现象进行专业而又生动的分析，是一项艰巨的任务。如何让从9岁到90岁的读者都能通过一本书洞悉日常生活现象背后的经济规律，更是一项几乎不可能完成的任务。《小岛经济学》就是这样一本书，它通过插图、幽默的措辞以及讲故事的平实手法，将经济学从高不可攀的架子上取下来，放回到厨房的餐桌上。它本就该属于那个地方。这个关于鱼、渔网、存钱、借钱的故事揭示了经济是如何运行的，映射出当今经济体制与政策暗藏的漏洞。希夫兄弟以机智幽默的手法阐释了经济增长的根源，贸易、储蓄及风险三者的重要性，滞胀的根源，利率的影响，政府的刺激机制、消费信贷的破坏性本质等问题。这些问题经常被讨论，却常常被误解。对于那些想走出误区，理解经济学基本理论与常识的读者，这本书会带来惊喜。,10,793,0,35.4,https://wfqqreader-1252317822.image.myqcloud.com/cover/417/912417/s_912417.jpg
周期,2019-02-01 00:00:00,经济理财-财经,每个投资人都想弄清楚自己现在所处的周期位置。也就是说，人们渴望知道自己下一步应该追加投资，继续留在市场，还是应该果断卖出，离开市场。大家都知道市场周期起伏波动，然而，大部分投资人往往只想到市场周期的首层浅思维。这本书会带你进入市场周期的二层浅思维，教你看懂过去的周期规律，看清现在的周期位置，看透未来的周期趋势，获得少数赢家穿越金融危机、长期战胜市场的投资布局真经。霍华德▪马克斯是一位价值投资者。他将周期细分为经济周期、政府干预经济周期、企业盈利周期、投资人心理和情绪钟摆、风险态度周期、信贷周期、不良债权周期、房地产周期、市场周期，并对每种周期做了详细的阐述。其中，作者总结了自己50多年的投资经验，提出了一个鲜明的观点：人的决策对经济周期、企业周期、市场周期产生了巨大影响，而人做的决策，并不是科学的。他认为，人容易走极端的倾向，永远不会终止，因此，这些极端最终需要修正，而不是周期的发生会有改变。投资人需要警惕“这次不一样”的想法。这就意味着，投资人能够理解周期，就能够找到获得高回报率的良机。,7,768,0,52.8,https://wfqqreader-1252317822.image.myqcloud.com/cover/754/24925754/s_24925754.jpg
资本论,2014-10-01 00:00:00,经济理财-财经,《文化伟人代表作图释书系：资本论》是马克思主义的重要百科全书，更是研究资本主义社会经济形态的巅峰之作。《文化伟人代表作图释书系：资本论》创造了一个崭新的思想体系。马克思研究世界的方法源于德国哲学、早期社会主义理论和政治经济学。马克思在黑格尔辩证法的基础之上，颠覆了传统的“形而上学”唯物主义，建立了一个现实中得以实践的很大的思想体系，一个影响到地球50%以上人口的体系。资本和劳动的关系，是现代社会全部体系赖以运转的轴心。《文化伟人代表作图释书系：资本论》对这种关系头一次作出了科学的说明，而这种说明之透彻和精辟——只有一个德国人才能做到，这个人就是马克思，他攀登到了很高点，把现代社会关系的全部领域一览无余。,27,861,0,24,https://wfqqreader-1252317822.image.myqcloud.com/cover/820/38793820/s_38793820.jpg
百万富翁快车道,2017-05-01 00:00:00,经济理财-财经,《百万富翁快车道》破译了终生富足的密码，是解开致富快捷之路的密钥。 变更车道，找到你的爆炸性财富加速器，跳出财务平庸处境，脱离朝九晚五打工生活，缩短致富时间40年！ 大多数人都遵循以下三种财富路径： 人行道——月光族，今朝有酒今朝醉。人行道的终点是贫困。 慢车道——上班族，牺牲当下，投资未来（40~50年后）。慢车道的终点是普通人。 快车道——创业者，掌控自己，努力工作，专注于为客户带来价值。快车道有望在未来5~10年内变得富有。 你现在处于哪条道上？《百万富翁快车道》作者颠覆性地认为，投资复利并不是一个快速实现财务自由的好方法。本书通过很多故事并结合当前最热门的行业（如互联网、电商、自媒体等）描述了三种财富路径及其风险，同时提出你是否需要踏上快车道，并如何踏上财务自由之路——需要遵循哪些戒律、做出哪些决定、摆脱哪些错误思维、避免哪些风险、处理哪些问题等。 “用两天时间读读这本书，你的收获将比读两年商学院课程还要多，却只需花后者1%的费用。”,9,800,0,41.4,https://wfqqreader-1252317822.image.myqcloud.com/cover/605/34156605/s_34156605.jpg
日本蜡烛图技术：古老东方投资术的现代指南,2020-03-01 00:00:00,经济理财-财经,“K线之父”“蜡烛图泰斗”史蒂夫·尼森畅销近30年的金融投资技术分析经典，让大众熟知蜡烛图技术的开山之作。作者结合近年全球市场变化进行了全新修订，原书第2版。美国技术分析专家史蒂夫•尼森的技术分析代表作，对“日本蜡烛图技术”进行了全面实用的讲解。融合东西方金融分析理论和技巧的精华，运用典型生动的图表案例、条理清晰的文字解析，一本书让你掌握股票、债券、基金、期货等金融投资的策略和技巧，提升交易能力，降低波动风险。既适合初入股票、期货市场的新手，也对技术分析老手有很大裨益。,19,900,0,44.99,https://wfqqreader-1252317822.image.myqcloud.com/cover/436/32026436/s_32026436.jpg
转型中的地方政府：官员激励与治理(第二版),2017-08-01 00:00:00,经济理财-财经,中国在过去30年取得了经济增长的奇迹，其中，有些学者从政府的角度来解析经济发展之谜，尤其是关注于地方政府在发展中充当的角色以及地方政府与中央政府的博弈过程。然而当我们把目光转向发展中国家和转型国家时，不难发现许多国家的政府表现并不令人满意。为什么中国的地方政府有这么高的激励去推动地方经济的发展？中国是如何解决地方官员激励与政府作为问题的？但是，中国的高速经济增长也导致了一系列社会问题，如粗放型增长、收入分配不公、地区差异、环境污染、官员腐败、地方保护主义等等，这些问题如何与官员激励和政府治理模式联系在一起呢？本书从地方官员激励与政府治理视角出发，揭示了中国经济高速增长所依赖的政经条件和制度基础，提供了一种关于中国经济增长的政治经济学解释。,18,915,0,23.99,https://wfqqreader-1252317822.image.myqcloud.com/cover/961/30243961/s_30243961.jpg
以交易为生（原书第2版）,2017-07-01 00:00:00,经济理财-财经,本书将教你如何分析市场、从事交易、控制风险和处理好自己的想法。我可以向你提供知识，只要你自己对此充满渴望。技术分析也很重要。但要记住，当我们看图表时，我们仅需分析五种数据——开盘价、最高价、最低价、收盘价和成交量。在这五种数据之上，再堆加大量指标和图形只会徒增困扰。大道至简，如果你已经读过《以交易为生》第1版，你将看到我减少了技术章节的内容。与此同时，我增加了一些新的章节专门讲新工具——尤其是动力系统（impulse system）。我也增加了一些关于止损、止盈和其他实践细节的内容。,22,814,0,25,https://wfqqreader-1252317822.image.myqcloud.com/cover/872/908872/s_908872.jpg
