title,publishTime,category,intro,maxFreeChapter,newRating,free,price,cover
Salesforce传奇,2021-06-01 00:00:00,经济理财-商业,Salesforce是20年前软件领域的行业黑马，而今天已经成为引领行业发展的骏马。《Salesforce传奇》是Salesforce创始人马克·贝尼奥夫的颠覆性佳作，记述了他自身创业的心智与历程。为你揭开Salesforce高速发展背后的9大关键法则：如何把一个简单的想法转化成高速成长的企业、如何选对差异化赛道驱动品牌增长破圈、如何将每一场活动都转化成口碑升级的机会、如何打造一支专属于你的百万量级的销售大军、如何以长期视角打造出助力用户不断增长的伟大产品、如何不让你的公司只为了商业利益而运转、如何才能将你的商业模式推广到全新市场、如何用进化的眼光衡量你的公司是否在向上发展，以及如何赋能优秀的人才与资源助推公司的快速成长。从《Salesforce传奇》中，我们可以看到一个创业者颠覆传统行业的意志和坚持，上述9大关键法则更是极具创新力的产业变革者Salesforce一路“从0到100”的真正原因。特别是，企业创建之初就建立了回馈社会的机制，值得我们中国创业者进行思考与借鉴。Salesforce是一个逆势增长的传奇企业，而它的成功之道也是一个尚未被人知晓的传奇故事。,23,719,0,67.43,https://wfqqreader-1252317822.image.myqcloud.com/cover/732/39888732/s_39888732.jpg
万店盈利：餐饮连锁盈利模式30讲,2021-01-01 00:00:00,经济理财-商业,我国餐饮食品行业规模巨大，合计约10万亿市场规模（占总GDP11%），规模化的法人企业数量超过4万家，企业及个体经营总数超过300万家；从业人员超过3000万人；目前保持一直保持8%的复合增长率，未来将有很大的持续发展空间。本书作者主要研究了餐饮企业的成长之道，并从标准化、连锁化、外卖化、品牌化等十个方面集中总结了餐饮企业的发展规律，帮助餐饮企业在认清自身的情况下，以不同阶段应施以不同对策为考量，通过不断达成小目标，一步步走向做大、做强的最终目标。在本书的最后，作者结合自己多年的实践经验，对我国的餐饮行业发展趋势做出了前瞻性的预判。,18,765,0,70.9,https://wfqqreader-1252317822.image.myqcloud.com/cover/438/35905438/s_35905438.jpg
让创意更有黏性：创意直抵人心的六条路径（希思作品系列）,2014-01-01 00:00:00,经济理财-商业,很多人相信能在太空中看到万里长城，很多人深信可乐能腐蚀人的骨骼，但是，只要我们稍加思考就会明白这些都是无稽之谈。为什么这些荒谬的结论能深深印在我们脑海，并且广为流传？而我们对一些不该遗忘的事却轻易忘记：一个生物老师花一个小时来解释有丝分裂，一星期后只有三个学生记得那是什么。一位经理在演讲中介绍了一套新的战略方案，员工们都在热情地点头称是，然而第二天我们发现坐在前排的员工仍无动于衷地执行旧的战略。为什么有些事情能铭刻在他人脑海，有些却不能？现任斯坦福大学商学院组织行为学教授奇普?希思和他的兄弟丹?希思在他这本充满奇思妙想的书中，揭示了其中的奥秘，那便是能让人们过目不忘的事情往往具有“黏性”，例如克林顿竞选时的口号、好莱坞大片跌宕起伏的情节设计、治疗胃溃疡新药的有效推广。它们都遵循着让创意更有黏性的原则。只要你掌握了这些原则，不管你的天生创造力如何，只要多付出一点点的努力，你几乎所有观点都能够更具黏性，紧紧粘住别人的心。,6,762,0,7.35,https://wfqqreader-1252317822.image.myqcloud.com/cover/301/847301/s_847301.jpg
亚马逊编年史,2021-08-01 00:00:00,经济理财-商业,《亚马逊编年史》一书，以编年的形式，搜集整理了亚马逊自1994年创立至2020年发展过程中的关键事件，同时配合贝佐斯给股东的信的内容，加上宁老师的点评，是目前国内外市场上少见的比较详实的记录亚马逊发展历程的作品，具有长久的管理参考以及企业研究参考的价值。,9,860,0,61.6,https://wfqqreader-1252317822.image.myqcloud.com/cover/582/40638582/s_40638582.jpg
无价：洞悉大众心理玩转价格游戏,2011-01-01 00:00:00,经济理财-商业,《无价:洞悉大众心理玩转价格游戏》简介：为什么免费的巧克力让我们疯狂？为什么百老汇剧场里价格越高的位置卖得越火？为什么100万美元带来的愉悦感，400万美元才能让它翻倍？为什么议价时，一定要抢先报价，而且一定要“狮子大开口”？威廉?庞德斯通告诉我们答案：价格只是一场集体幻觉。在心理学实验里，人们无法准确地估计“公平价格”，反而受到无意识、不理性、政治等不正确因素的强烈影响。营销专家们很快就把这些发现应用了起来。,14,758,0,24.99,https://wfqqreader-1252317822.image.myqcloud.com/cover/112/622112/s_622112.jpg
运营管理（原书第15版）,2019-07-01 00:00:00,经济理财-商业,本书是生命之树常青的经典教科书，它的价值在于取材于企业的实践，经过理论的研究和升华，又回到了实践，为我们有效地整合战略、人员、技术与运营流程这四个要素提供了指导，是一本运营执行力的必备工具书。本书在介绍和阐述运营管理的体系架构、跟踪和研究不断出现与发展的新话题以及结合企业实践的案例研究等方面，充分体现了作者在运营管理领域教学与研究上的匠心独运。,91,829,0,69.3,https://wfqqreader-1252317822.image.myqcloud.com/cover/0/32436000/s_32436000.jpg
浪潮式发售,2016-03-01 00:00:00,经济理财-商业,10天时间，4种发售路径，让你的产品一上架就被秒杀！a.投资失败的个体户，怎样让长期积压的库存，变成众人抢购的稀缺品，最终敲开财富之门？b.只有一腔热血的大学毕业生，怎样将原本无人问津的网球课程，发售成价值45万美元的专业教程？c.长期脱离社会的全职主妇，如何白手起家，创造出自己的第一款爆品，并挽救即将破碎的家庭？改变上述人士命运的是同一件法宝——产品发售方程式。互联网营销大师杰夫·沃克针对微小型企业资源有限的情况，创造出种子式发售、联营式发售、PLF和PLF2.0四条发售路径，为产品上市充分造势，进而像浪潮一样席卷消费者，掀起抢购风暴。不论你卖的是电子产品、衣服鞋帽，还是手机软件、网络视频，都一定会在本书中找到最适合的发售路径，以最快的速度风靡市场，狂销疯卖！,23,814,0,20.99,https://wfqqreader-1252317822.image.myqcloud.com/cover/779/37699779/s_37699779.jpg
电商产品经理宝典：电商后台系统产品逻辑全解析,2017-10-01 00:00:00,经济理财-商业,本书围绕“电商后台产品”，从电商的整体产品架构入手，逐步剖析各支撑子系统。通过学习电商产品后台的架构和逻辑，可以让读者从庞大的后台产品体系中，慢慢学会从整体去思考系统定位，判断功能的优先级，或者从系统层面去思考功能的价值，从而成长为优秀的电商产品经理。建议各行业的产品经理们，以及电商行业的程序员、运营人员，都应该了解研究电商后台。,22,697,0,19.6,https://wfqqreader-1252317822.image.myqcloud.com/cover/619/22671619/s_22671619.jpg
冲突（第2版）,2020-03-23 00:00:00,经济理财-商业,营销的理论越来越多，营销却越来越难，是因为大多数理论偏离了营销的本质。市场营销的本质是什么？是洞察需求，而需求从哪里来，从冲突中来。……必需和需要是有冲突的，爱情和金钱是有冲突的，美食和身材是有冲突的，事业和家庭是有冲突的……这些都是冲突。因为有冲突，所以才有需求，这就是营销的根本所在。冲突是无处不在的，把冲突研究清楚，实际上就把市场营销的需求搞清楚了。,33,772,0,69.9,https://wfqqreader-1252317822.image.myqcloud.com/cover/482/32742482/s_32742482.jpg
本质,2019-01-01 00:00:00,经济理财-商业,改革开放40年，恰如一部四部曲的年代大戏。技术突变、产品迭代、产业升级、资本对接，商业持续创新，社会也持续进步。40年，有哪些人值得铭记？40年，有哪些思想值得品读？在浩荡的烟海中，我们遴选了40位代表人物，每个人再精选出一篇代表作。通过这40篇文章，我们可以感受到历史的风云变幻，触摸中国商业的脉搏，并读懂中国商业的本质。,15,737,0,55,https://wfqqreader-1252317822.image.myqcloud.com/cover/61/25058061/s_25058061.jpg
激荡三十年：中国企业 1978—2008（十年典藏版·下）,2017-12-01 00:00:00,经济理财-商业,激荡三十年：中国企业1978-2008（下）：作者不是将一些事件、人物孤立地展现在读者面前，他笔下的历史是可以触摸的，是可以被感知的，它充满了血肉、运动和偶然性。他把人物和事件放在一个国际和国内的政策、社会和当时的现实这样的大背景中，以整体和个别相结合的描述手法，将一部中国企业的曲折发展历程清晰地呈现在读者面前。过去的三十年是如此的辉煌，特别对于沉默了百年的中华民族，它承载了太多人的光荣与梦想，它是几乎一代人共同成长的全部记忆。,7,850,0,38,https://wfqqreader-1252317822.image.myqcloud.com/cover/635/920635/s_920635.jpg
营销心理战：掌握36种购买心理，直击客户内心,2020-04-01 00:00:00,经济理财-商业,美国销售大师甘道夫曾提出，销售是98％的了解人性+2％的产品知识。在销售领域，有一个非常重要的底层逻辑，也是核心本质——洞察用户心理。本书将用户的购买行为分成6个心理阶段，提出36种影响用户购买决策的关键心理。针对每一个心理效应，作者都从“What-Why-How”三个逻辑层面进行精准剖析，助力营销人员找到让用户下单的关键按钮。无论是负责品牌营销、产品运营的从业者，还是普通读者，相信读完这本书后都能练就一双洞察人心的慧眼。,13,753,0,29,https://wfqqreader-1252317822.image.myqcloud.com/cover/576/29558576/s_29558576.jpg
让大象飞,2016-06-01 00:00:00,经济理财-商业,堪称《从0到1》实践版，给创业者提供最直接的答案！硅谷重量级创业教父、天使投资人、《福布斯》杂志排名第一的创业孵化器Founders Space创始人“霍夫曼船长”作品。优客工场毛大庆倾情作序，多位创投圈大咖鼎力推荐！这是一本为中国创业者量身定做的创业指南，将帮助创业者理解创新的基本方法、模式和硅谷的创业理念。作者霍夫曼频繁地穿梭于中美两地，与不同的创业者、投资人、政府负责人进行对话，积累了大量的来自中国创业者的老手经验。在这本书里，从创业团队的人员配备到创业融资的成败再到团队的高效管理，从创业者的心理素质到创业者的独到眼光再到企业赖以生存的根本，360度无死角地呈现了一家公司从初创到惊艳到立足再到稳定的全过程，可谓《从0到1》的实践版。这更是来自硅谷的创业教父在创业寒冬时要对创业者说的话，当人人都在感叹创业不易、创新更难时，他却说，资本寒冬正好能让市场回归理性。霍夫曼从一个白手起家的创业者角度，也从一个资深投资人的角度，重新审视创新，有力地向我们证明了，对所有企业来说，创新不再是一种选择，而是进入商业世界的敲门砖。鲜有一本书详细解析了在硅谷孵化期内的创业公司的整个创新过程以及它们所使用的方法论，也没有任何一本书讲到了该如何将这些创新技巧应用于大到全球性的跨国公司、小到那些在车库里的初创企业，《让大象飞》做到了。当创业环境好的时候，风口之上，一切皆有可能；当风口没了的时候，大象还能飞吗？,10,794,0,34.9,https://wfqqreader-1252317822.image.myqcloud.com/cover/819/855819/s_855819.jpg
华与华超级符号案例集,2020-12-01 00:00:00,经济理财-商业,同一个创意套路诞生上百个经典案例，19年来不断颠覆中国各个行业！完整揭秘新东方、洽洽、老娘舅等企业运用超级符号方法做出的超级创意！从8个方面完整讲透企业如何做出超级创意，解决品牌战略和市场营销难题！单项咨询费过千万！中国本土传奇公司华与华揭秘横扫中国市场19年的秘密！19年来，华与华打造了海底捞、西贝、老娘舅、华莱士、厨邦酱油、洽洽、小鸟燕窝、绝味鸭脖、汉庭酒店、足力健、蜜雪冰城、得到、奇安信、葵花儿童药、立高、新东方等一系列经典案例。《人民日报》推荐的“市场营销”入门图书，“超级符号方法”作为本土营销代表，现已输出海外，登陆英美！口碑爆棚，98%的读者好评率，《华与华方法》豆瓣读者评分高达9分！,19,833,0,39.99,https://wfqqreader-1252317822.image.myqcloud.com/cover/265/35172265/s_35172265.jpg
爆款抖音短视频,2021-07-28 00:00:00,经济理财-商业,做出爆款抖音短视频的关键是什么？是拍摄？是剪辑？还是后期制作？其实是内容。本书作者在内容行业从业多年，有着丰富的抖音运营经验。全书重点从算法、定位、人设、选题、内容结构、标题、评论、实用工具等方面手把手教你如何打造爆款抖音短视频，并对抖音变现的方法进行了介绍。本书适合自媒体运营人员、新媒体平台工作人员，以及想通过抖音进行营销的淘宝卖家、个体店家等阅读和学习。,16,551,0,46.9,https://wfqqreader-1252317822.image.myqcloud.com/cover/963/40680963/s_40680963.jpg
小米生态链战地笔记,2017-01-01 00:00:00,经济理财-商业,《小米生态链战地笔记》以小米生态链内部视角，全面记录、梳理了小米生态链的萌生、发展、壮大过程，以及如何以极致的产品杀入不同领域的故事。本书分为上下两篇。上篇为生态链篇，阐述小米硬件生态系统的搭建、布局、管理、发展和奔跑之中的思考；下篇为产品篇，阐述小米生态链产品从产品定义，到设计研发定价等各个维度中总结出的经验和教训。,6,765,0,33.6,https://wfqqreader-1252317822.image.myqcloud.com/cover/830/906830/s_906830.jpg
和中国营销专家一起学营销,2018-12-12 00:00:00,经济理财-商业,《营销的16个关键词》剖析“营销”一词真意，少不得拆文解字，营乃经营，销自是销售。合并解读，营销就是一门学习如何把东西卖好的学问，涉及产品、价格、渠道和推广（4P）的各个阶段，各个方面。人人皆知营销二字，可谁人又能真切地洞悉如何营销？何为营销？叶茂中营销策划机构，携25年营销经验，3年之力，全心推出最新著作《营销的16个关键词》，从不同方面、不同切入点解析营销，玩转营销，以飨读者。有人笑称说服亚当偷食禁果的夏娃是最早的营销人员，不过细细想来，夏娃最多只算个促销员，营销大师这个称号应该属于说服了夏娃把禁果推销给亚当的蛇。《营销的16个关键词》，也正是想告诉大家，如何卖好苹果的道理。营销乱如麻，16个关键词让你理清中国营销。《先胜后战.营销战略》本书包涵三章，分别为营销大思维、营销大智慧、营销互联网+，通过对营销定律、营销战略、切割营销、产品营销、渠道营销、互联网营销、商业模式、区域营销、行业营销、营销智慧、节日特刊十一个模块对营销战略进行了深入系统的分析，观点独特，内容翔实，表达有趣，对企业品牌战略人士有较大帮助。《成瘾：如何设计让人上瘾的产品、品牌和观念》为什么同样的东西已经拥有了，却还想要？为什么同样的东西，想要这个不想要那个？为什么想要那些可有可无的东西？是什么激起了用户想要的冲动，非要不可？未来的商业是个争夺大脑资源的商业！破解在人们看似不假思索的需求背后，有怎样的运作模式和运作机制。作者将深入分析人脑对什么东西上瘾，终揭晓成瘾公式，人们可以随时按动开关让消费者在匮乏与欲望中切换，让消费者对你的产品、品牌或观念产生依赖，为企业打造超级品牌提供新思路，为产品营销开启新境界。《成交高于一切：大客户销售十八招（全新修订版）》没有成交，何谈销售？成交是销售的目的，也是企业经营的命脉。在销售活动中，存在两个硬道理：卖出去；卖上价。本书围绕“成交”这一概念，运用四维成交法，介绍大客户销售18招，招招紧扣“成交”，招招落到实处。其目的就在于帮助销售人员切实练好基本功，真正做到用业绩说话，同时书中介绍的方法有力地解决销售人员在销售过程中普遍存在的“中场盘带过多，欠缺临门一脚”的问题。,10,798,0,210,https://wfqqreader-1252317822.image.myqcloud.com/cover/7/27185007/s_27185007.jpg
华为内训书系·华为管理三部曲（套装全三册）,2019-10-01 00:00:00,经济理财-商业,“华为内训书系·华为管理三部曲”包含了由华为官方授权的三本管理者培训教材，该系列教材传承于《华为公司基本法》，是华为管理25年实践的总结，由《华为公司基本法》起草者、高级管理顾问与管理科学家共同编写，主编团队历时5年整理，解读华为人力资源管理、业务管理、财经管理之精髓，周其仁、柳传志、吴晓波、秦朔等联袂力荐！,10,872,0,122.4,https://wfqqreader-1252317822.image.myqcloud.com/cover/61/32943061/s_32943061.jpg
马云：未来已来,2017-04-01 00:00:00,经济理财-商业,    本书全面阐释了马云对电子商务、数据时代、未来技术以及社会变革的思考和畅想，详细解读了阿里巴巴未来十年乃至未来三十年的战略规划和发展前景。除了阿里巴巴的发展前景，马云还对未来十年中国乃至世界的产品升级、产业升级和人的智慧升级做出了全面分析和惊人预测。在展望未来之余，马云还多维地分享了他关于公益活动、女性权益、环境保护、农村脱贫、打击假货等社会热点话题的观点和看法。,15,767,0,17.99,https://wfqqreader-1252317822.image.myqcloud.com/cover/243/857243/s_857243.jpg
价值为纲：华为公司财经管理纲要,2017-09-01 00:00:00,经济理财-商业,作为华为公司内训系列丛书的第三部，本书将阐述华为公司财经管理作为一个价值整合者，如何服务和监管业务扩张及价值创造的理念、政策和规则。《价值为纲：华为公司财经管理纲要》的所有内容均摘自华为公司内部公开的高管讲话、文章以及经营管理团队（EMT）和华为财经体系的文件，并一一注明了出处。同样，各章内容的编排，在每一个标题下，遵循历史的顺序，时间跨度从公司成立到2017年6月。这样的编排方式有助于读者研究华为公司财经管理哲学的演进及其内在一致性。,11,812,0,40.8,https://wfqqreader-1252317822.image.myqcloud.com/cover/803/920803/s_920803.jpg
零售心理战,2015-05-01 00:00:00,经济理财-商业,"    全球最大便利店连锁公司7-Eleven的创始人——铃木敏文，结合40多年的零售经验，为您讲述洞察顾客心理的成功秘诀：不要为顾客着想，而是要站在顾客的立场上思考；比起优点，顾客往往更容易记住卖家的缺点；消费市场处于饱和状态时，只有当消费者亲眼看到具象的产品，才能察觉自身的潜在需求；顾客并非不愿购买，他们只是期待产品能够带来“合理化购买的理由”。通过引述日本各行业一线成功人士——包括AKB48制作人秋元康、优衣库品牌设计师佐藤可士和、JR东日本Ecute创始人镰田由美子等人的经营理念及案例，铃木敏文将为您献上一系列最经典、最全面、最实用、最通俗易懂的零售实践课。
",2,757,0,9.99,https://wfqqreader-1252317822.image.myqcloud.com/cover/383/635383/s_635383.jpg
爆款文写作指南：手把手教你写出快速变现的好文章,2020-09-01 00:00:00,经济理财-商业,《爆款文写作指南：手把手教你写出快速变现的好文章》围绕新媒体文章的选题、结构、大纲、素材、排版等对新媒体写作进行了详细的解析，并辅以案例进行阐述，具有较强的实操性。此外，《爆款文写作指南：手把手教你写出快速变现的好文章》针对新媒体文章的不同类型，如情感类文章、亲子类文章、职场类文章、励志类文章等，以及从如何开始准备到完稿的整体步骤都一一进行了介绍，对初学写作者更有针对性，让零基础写作水平的人也能掌握新媒体写作的技巧，并从中受益。 《爆款文写作指南：手把手教你写出快速变现的好文章》涵盖了目前较火的短视频、朋友圈、小红书、卖货等方面的文案写作，是一本实用性较强的变现工具书。,8,821,0,37.99,https://wfqqreader-1252317822.image.myqcloud.com/cover/926/34644926/s_34644926.jpg
价值共生：数字化时代的组织管理,2021-03-01 00:00:00,经济理财-商业,《价值共生》以数字化生存为背景，尝试梳理数字技术带来变化的场景下，完整呈现新的组织管理体系，深入探索组织价值重构的未来。从个人角度，给身处数字化时代的职场人提供了详细的职业规划解决方案，从工作内容到工作方式上都落脚在通过企业给自我赋能的基点上。通过对数字化时代的管理的解读，让读者认知到数字化时代超级个体，所需的基础能力。也充分说明了“个体”对于组织的价值，在数字化时代的组织发展中将成为关键。从企业管理角度，针对数字化转型的困难，从工作环境、组织、目标3个方向，对企业管理者提出了：管理层需要做好四个改变、对管理层的三个要求、管理者要做好四件事。帮助企业管理者更好的把握数字化转变的4个关键节点：从管控到赋能、从科层固化到平台利他、从分工到协同共生、从实现组织目标到兼顾人的意义，促使企业完成数字化过程中的新功能、新结构、新能力、新目标的转变。本书针对数字化时代的管理真问题进行深入研究，既有最新理论的阐述，让大家对企业组织受到的冲击有新的认识，还依托持续跟踪研究华为、腾讯、海尔、新希望六和等50多家中国优秀企业，提出了切实可执行性的解决方案。,6,806,0,46.8,https://wfqqreader-1252317822.image.myqcloud.com/cover/837/37178837/s_37178837.jpg
三精管理,2022-04-01 00:00:00,经济理财-商业,“三精管理”——“组织精健化、管理精细化、经营精益化”是宋志平的核心经营管理思想，全面概括和总结了他将企业带上健康成长之路的经营管理理念和方法。,20,951,0,40,https://wfqqreader-1252317822.image.myqcloud.com/cover/325/43741325/s_43741325.jpg
什么是营销,2020-08-01 00:00:00,经济理财-商业,本书源自科特勒的营销管理理论，从理解营销、洞察营销机会、创造顾客价值、整合营销渠道、传播认知价值5个维度梳理了营销的关键思想和关键方法，并辅助以国内外的典型案例以及营销实践中的反思与洞察。本书可以成为未受过营销系统训练的人认识营销的第一本图书。,31,852,0,30,https://wfqqreader-1252317822.image.myqcloud.com/cover/55/33381055/s_33381055.jpg
信息流广告入门,2020-10-01 00:00:00,经济理财-商业,信息流广告是一种新的广告形式，主要在内容流中穿插展现，近年来从业人员激增。本书是为即将入行以及刚入行的从业者量身定制的“入门操作手册”，从零开始介绍信息流广告的行业知识和优化师的日常工作。本书讲解了信息流广告的概念、广告投放的基本流程及其基本原理，介绍了字节跳动、腾讯和百度这三个信息流广告媒体后台的使用方法，带领大家学习广告创意的基本思路和数据分析的方法，最后分析了实际投放案例。本书语言简练，通俗易懂，没有互联网和广告基础知识的朋友也能读懂，比如大学生或想转到互联网行业的朋友。,5,591,0,49.5,https://wfqqreader-1252317822.image.myqcloud.com/cover/316/37480316/s_37480316.jpg
