title,publishTime,category,intro,maxFreeChapter,newRating,free,price,cover
干法,2015-05-01 00:00:00,经济理财-商业,本书的内容不过是从我粗浅的人生经验和思索中所产生的质朴的“劳动观”。但同时，它又是从我70余年的切身经历中所获得的不可动摇的“信念”，也可以说它是被实践证明了的正确的“哲学”。,16,820,0,7.99,https://wfqqreader-1252317822.image.myqcloud.com/cover/970/649970/s_649970.jpg
硅谷钢铁侠：埃隆·马斯克的冒险人生,2016-04-01 00:00:00,经济理财-商业,"    特斯拉之父——埃隆·马斯克全球唯一授权采访自传。 埃隆·马斯克是谁？他是继乔布斯之后，硅谷最受关注的创业家和实业家。他的特斯拉电动车正在翻转全球汽车工业，目前世界上能让航空器发射再返航的只有四个：美国、俄罗斯、中国和埃隆·马斯克。 《纽约时报》、《经济学人》、亚马逊年度最佳商业图书。 罗永浩、周鸿祎、王小川、张鹏、余晨、周航撰文致敬。 你准备好读到最完整最真实的马斯克了吗？
",15,794,0,18,https://wfqqreader-1252317822.image.myqcloud.com/cover/728/815728/s_815728.jpg
销售就是要玩转情商：99%的人都不知道的销售软技巧,2015-09-01 00:00:00,经济理财-商业,本书从情商出发，将销售行业中常见的销售渠道、客户心理、客户维护、谈判技巧、团队管理等问题都做了详尽的阐述，并给出了行之有效的指导方法。,17,780,0,9.9,https://wfqqreader-1252317822.image.myqcloud.com/cover/423/915423/s_915423.jpg
激荡三十年：中国企业1978—2008（十年典藏版）（全2册）,2017-12-01 00:00:00,经济理财-商业,吴晓波没有用传统的教科书或历史书的方式来写作这部著作，而是站在民间的角度，以真切而激扬的写作手法描绘了中国企业在改革开放年代走向市场、走向世界的成长、发展之路。改革开放初期汹涌的商品大潮；国营企业、民营企业、外资企业，这三种力量此消彼长、互相博弈的曲折发展；整个社会的躁动和不安……整部书稿中都体现得极为真切和实在。作者用激扬的文字再现出人们在历史创造中的激情、喜悦、呐喊、苦恼和悲愤。改革开放的这三十年是如此的辉煌，特别对于沉默了百年的中华民族，它承载了太多人的光荣与梦想，它是几乎一代人共同成长的全部记忆。,13,865,0,58,https://wfqqreader-1252317822.image.myqcloud.com/cover/636/920636/s_920636.jpg
定位：有史以来对美国营销影响最大的观念,2013-12-01 00:00:00,经济理财-商业,"美国史上百本最佳商业经典第一名, 美国CEO最怕被竞争对手读到的商界奇书,有史以来对美国营销营销最大的观念。本书是特劳特成名作，深入阐述了定位理论和操作方法，并配有丰富的实战案例解析，指导企业家成功企业定位，获取商业成功。",58,752,0,18,https://wfqqreader-1252317822.image.myqcloud.com/cover/706/602706/s_602706.jpg
爆款小红书：从零到百万粉丝的玩赚策略,2022-02-01 00:00:00,经济理财-商业,怎样做好账号定位？ 什么样的笔记更吸引用户眼球? 怎么做才能精准加粉？ 遇到账号瓶颈期怎么办？ 如何引流变现？ ……   本书作者从八大维度深度剖析了小红书的运营策略，包括：爆款逻辑、账号定位、号设化、内容创作、运营方式、复盘、引流变现、团队化运作等。为验证这些方法的实操性和可复制性，作者在12周之内，亲自将全新账号“吕白聊内容”做到了3万粉丝，且成功变现40万元。希望这本书可以帮你在众多博主中脱颖而出，迅速涨粉变现，成为一个赚钱的小红书博主。,6,643,0,37.99,https://weread-1258476243.file.myqcloud.com/weread/cover/36/3300010436/s_3300010436.jpg
雪球特别版：段永平投资问答录（投资逻辑篇）,2020-12-04 00:00:00,经济理财-商业,段永平：著名企业家，小霸王品牌缔造者，步步高创始人，vivo和OPPO联合创始人，网易丁磊生命中的贵人，拼多多黄峥的人生导师。段永平同时也是著名投资人，早期投资网易获100倍以上回报，目前重仓茅台、苹果等优质公司。不管是作为管理者，还是作为投资人，段永平都是非常成功的，本期雪球专刊精选出段永平关于投资逻辑的问答录，阅读本文能领略段永平对于投资的深刻理解，希望各位通过这本书能读懂段永平的投资智慧，对各位的工作学习投资能有所帮助。,13,917,0,0.1,https://wfqqreader-1252317822.image.myqcloud.com/cover/924/35679924/s_35679924.jpg
雪球特别版：段永平投资问答录（上册·商业逻辑篇）,2020-09-21 00:00:00,经济理财-商业,段永平：著名企业家，小霸王品牌缔造者，步步高创始人，vivo和OPPO联合创始人，网易丁磊生命中的贵人，拼多多黄峥的人生导师段永平同时也是著名投资人，早期投资网易获100倍以上回报，目前重仓茅台、苹果等优质公司。不管是作为管理者，还是作为投资人，段永平都是非常成功的，本期雪球精选出段永平关于商业逻辑的问答录，阅读本文能领略段永平对于商业的深刻理解，希望各位通过这本书能读懂段永平的商业智慧，对各位的工作学习投资能有所帮助。,14,906,0,0.1,https://wfqqreader-1252317822.image.myqcloud.com/cover/817/34560817/s_34560817.jpg
运营之光：我的互联网运营方法论与自白,2016-09-01 00:00:00,经济理财-商业,在互联网行业内，“运营”这个职能发展到一定阶段后，往往更需要有成熟的知识体系和工作方法来给予行业从业者们以指引。《运营之光：我的互联网运营方法论与自白》尤其难得之处在于：它既对“什么是运营”这样的概念认知类问题进行了解读，又带有大量实际的工作技巧、工作思维和工作方法，还包含了很多对于运营的思考、宏观分析和建议，可谓内容完整而全面，同时书中加入了作者亲历的大量真实案例，让全书读起来深入浅出、耐人寻味。,13,778,0,19.99,https://wfqqreader-1252317822.image.myqcloud.com/cover/893/850893/s_850893.jpg
增长黑客,2018-01-01 00:00:00,经济理财-商业,脸谱网如何从默默无闻到坐拥二十几亿用户？爱彼迎、优步何以在短短时间估值超过百亿美元？领英怎样跨步成为全球的职业社交平台?这些初创公司实现爆发式成长的共同奥秘就是增长黑客。增长黑客是硅谷当下热门的新商业方法论，其精髓在于通过快节奏测试和迭代，以极低甚至零成本获取并留存用户。作为早提出“增长黑客”概念的理论先驱、带领Dropbox实现500增长的实战领军人物，作者在书中分享了如何跨部门搭建增长黑客团队，以及实现用户和利润双增长的具体行动指南。该书一经出版，便被科技公司奉为运营圭臬。,10,816,0,35.4,https://wfqqreader-1252317822.image.myqcloud.com/cover/228/922228/s_922228.jpg
从零开始做运营,2015-12-01 00:00:00,经济理财-商业,"运营是什么？怎样做运营？产品和运营是什么关系？我是否适合从事互联网运营？《从零开始做运营》涵盖了互联网运营的精髓与核心内容，从运营是什么讲起，涉及内容运营、用户运营、活动运营、数据分析等多个方面，涵盖互联网运营的全部环节，张亮结合自身经验，讨论了大量经典运营案例，以便读者更好地掌握运营的精神。
除了为互联网运营人员提供有关全面而科学的运营知识与案例，《从零开始做运营》也为那些徘徊于互联网行业大门外的年轻人指明方向，在互联网大热的今天，互联网运营成为一个越来越重要的岗位。很多年轻人带着对互联网的热情投身到这个行业，却发现自己对这个行业所知甚少，对互联网运营更加陌生，甚至有一些有志于从事互联网运营的人，因为对其缺乏了解而难以确定职业发展方向，《从零开始做运营》将为他们开启一扇从学校到社会、从入门到入行的窗。
通过《从零开始做运营》，你可以全面了解运营工作的范围、职责、核心，确立科学的运营观念和思路，掌握精妙的运营技巧与策略，并更好地规划职业发展方向。读了这本《从零开始做运营》，你将不再是一个运营新手，而是一个拥有成熟的运营逻辑体系的运营人。",14,727,0,4.99,https://wfqqreader-1252317822.image.myqcloud.com/cover/819/812819/s_812819.jpg
腾讯传1998-2016：中国互联网公司进化论,2017-01-01 00:00:00,经济理财-商业,"★腾讯官方唯一授权的权威传记
★著名财经作家吴晓波倾力之作
★当市值最高的中国互联网公司，遇上中国财经界最冷静的一双眼睛。

读懂腾讯，读懂中国互联网！本书全景式地记录了腾讯崛起的经历，并以互联网的视角重新诠释了中国在融入全球化进程中的曲折与独特性。
从1998年开始创业到成为世界级互联网巨头，腾讯以即时通信工具起步，逐渐进入社交网络、互动娱乐、网络媒体、电子商务等领域，在超高速发展的同时亦饱受争议，在“3Q大战”的激烈冲突之后又进一步走向开放……
腾讯的发展路径，亦是中国互联网企业成长的缩影。我们可以看到，中国的互联网人在应用性迭代和对本国消费者的行为了解上，找到了自己的办法，并开始领跑全球。",15,781,0,38,https://wfqqreader-1252317822.image.myqcloud.com/cover/471/432471/s_432471.jpg
传神文案：文案写对，营销才能做对,2021-02-25 00:00:00,经济理财-商业,市面上的文案书，通常面向广告公司的文案人员，或是企业负责新媒体、要写产品推文的运营人员。而实际上不管在哪个行业，只要你从事营销与品牌运营工作，如今都需要具备一定的文案功底。所以我把本书视为一本讲透品牌营销的文案书，它以文案为切入点，以品牌营销为落脚点，来阐释如何通过文案来打造品牌、制订市场方案，真正将纸上的策略转化成对消费者心智、行为的实质影响与改变。而这一切，最终都要靠文案的创作来实现。,26,887,0,40,https://wfqqreader-1252317822.image.myqcloud.com/cover/276/36583276/s_36583276.jpg
运营之光：我的互联网运营方法论与自白3.0,2022-06-01 00:00:00,经济理财-商业,2016年出版的《运营之光》，是影响了一代互联网人的教科书级著作。很多年过去，在产业互联网、超级个体户、短视频和全域流量时代，运营已经成为值得每个人了解、掌握的重要能力。全新出版的《运营之光3.0》，是《运营之光》系列的收官之作。作者黄有璨，也借本书完成了自我颠覆，《运营之光3.0》仅保留了前作中不到20%的内容，在前沿性、系统性等方面都有了极大的提升。全书3大亮点：·系统梳理中国互联网流量-变现格局的演化、底层规律和未来，也尝试为每一个互联网从业者指明新时代的前行方向。·结合短视频、直播、私域流量等前沿变化和打法，更系统地对运营、流量、用户增长等进行梳理和总结，在“呈现运营的完整知识体系+底层规律”方面，有颠覆式的提升。·一如既往，全书不仅有详尽的实战讲解，也在很多地方传递出作者作为一个15年互联网老兵的价值坚守和“唯有爱与用户不可辜负”的善意。对很多从业者来说，也许可以从中获得许多感动、信念与力量。强烈建议所有具有0～8年从业经验的泛互联网运营、营销、新媒体从业者，以及具有3年以下经验的中小创业者、企业管理者反复阅读本书。,11,619,0,64.8,https://weread-1258476243.file.myqcloud.com/weread/cover/91/3300020691/s_3300020691.jpg
决胜B端：产品经理升级之路,2019-05-01 00:00:00,经济理财-商业,本书试图提炼了互联网B端产品设计和管理的通用思路和方法，全书分为4篇。“概述篇”分析了互联网行业的盈利模式及发展趋势，并阐明市场对B端产品经理的需求将持续旺盛。后3篇贯穿了一个实践性很强的案例：在“设计篇”和“管理篇”中，我们为一家成熟的集团企业搭建了一套完整的分销业务平台，带领读者逐步设计、实现一个B端产品，并讲述每个环节的方法、技巧、注意事项；在“进阶篇”中，讲述了这家集团企业是如何从小门店一步步发展起来的，帮助读者从更宏观的角度思考产品，站在企业经营管理和发展的视角，重新审视互联网产品体系架构的设计原则和方法论。,23,778,0,48.3,https://wfqqreader-1252317822.image.myqcloud.com/cover/882/26297882/s_26297882.jpg
从零开始做内容：爆款内容的底层逻辑,2020-09-28 00:00:00,经济理财-商业,内容是什么？如何做内容？你是否适合从事内容方面的工作？微信公众号火完，头条火，头条火完，抖音、快手、小红书火……从文字时代到视频时代，传播内容的媒介和载体变得很快，但内容的本质从未改变。《从零开始做内容：爆款内容的底层逻辑》是作者在内容行业从业多年实战经验的总结，涵盖了内容运营的精髓与核心，从什么是内容讲起，提炼出爆款内容的底层逻辑、策略与方法，并拆解了大量经典案例及自身操盘的案例，以便读者更好地应用。,11,717,0,69.8,https://wfqqreader-1252317822.image.myqcloud.com/cover/266/34128266/s_34128266.jpg
秒赞：文案女王20年创作技巧与心法,2021-01-01 00:00:00,经济理财-商业,好文案就要直击人心，令人秒赞。奥美前首席文案，被誉为“文案女王”的林桂枝倾力相授，浓缩众多爆款文案背后的创作技巧与心法，详解对于文案和时代的深刻理解和洞察，并辅以大量的文案创作实例，手把手教你写出秒赞好文案。无论是写作社交媒体文案、视频文案、海报文案、电商文案、品牌文案，亦或其他类型的文案，都可以将本书作为一本随时可以拿来翻阅，随时学习的工具书。本书内容你既可以现学现卖，也可以花精力深度学习，进而增长文案功力。,11,651,0,41.3,https://wfqqreader-1252317822.image.myqcloud.com/cover/428/36798428/s_36798428.jpg
朱江洪自传：我执掌格力的24年,2017-06-01 00:00:00,经济理财-商业,本书是格力电器前董事长朱江洪先生的自传。全书共15章，21万字，主要内容为自作者华南工学院（现华南理工大学）毕业后参加工作，直到调回珠海，任冠雄和海利两个（格力前身）公司的总经理，艰苦创业，并想方设法在政策的缝隙中上马空调，且通过技术创新、市场开拓与队伍建设等，一举确立空调业龙头老大的奋斗历程。本书澄清了大量江湖传言，并穿插了相当丰富的管理真经，是一部格力电器1988至2012年的“信史”，更是一本不可多得的企业管理教材。,7,926,0,33,https://weread-1258476243.file.myqcloud.com/weread/cover/71/3300022471/s_3300022471.jpg
商业的本质,2016-04-01 00:00:00,经济理财-商业,1. “全球第一CEO”杰克·韦尔奇，继管理圣经《赢》之后潜心10年，封笔之作，致敬工业时代，回归商业本质。 2.杰克·韦尔奇专文中文版序言，吴晓波、领英中国总裁沈博阳、搜狗CEO王小川赞赏推荐。香港中文大学商学院马旭飞教授、中国人民大学工商管理学院徐二明教授、德勤中国首席经济学家许思涛先生深刻解读！ 3.面对经济增长放缓，管理巨匠韦尔奇提供应对经济低迷的6大突破口，特别分析了中国的经济发展及前景，为广大读者支招。 2005年全球畅销书《赢》出版后，经历了剧烈变革的10年，也是互联网蓬勃发展的10年。这期间，杰克·韦尔奇访问了世界各地不同大小、不同行业的公司，提供商业领域的教学和咨询服务，深度接触了数百家企业。 《商业的本质》是杰克·韦尔奇对过去十几年商业变革的反思和总结。他指出，科技革命给市场带来了巨大变化和诸多杂音，但作为管理者，不能迷失商业中最核心的东西。在当今的新商业环境下，要想“赢”，就必须遵从商业的规则，回归商业的本质。 《商业的本质》不谈空洞的理论和概念，因为在现实中，商业成功的关键在于妥善解决那些层出不穷、生死攸关、不可避免的窘境。韦尔奇在《商业的本质》中结合大量企业的现实案例和经营困境，给出了切实的解决方案，特别是针对经济低迷时期，提出了企业实现快速增长的六大突破口，包括：协同力、领导力、影响业绩和成本的关键数据、快速敏捷的战略制定流程、组织结构优化和领导者的心理素质。同时，韦尔奇还在书中专门分析了中国的经济状况，对中国企业的发展做出了点评和展望。,7,780,0,29.4,https://wfqqreader-1252317822.image.myqcloud.com/cover/574/815574/s_815574.jpg
沸腾新十年：移动互联网丛林里的勇敢穿越者（套装共2册）,2021-08-01 00:00:00,经济理财-商业,"邬贺铨 陈宗周 作序力荐，沈南鹏、雷军、徐小平、江南春、吴晓波、胡泳、高文、俞军 联合力荐！

   200余次大咖对话
   500余个场景还原
   600余位业者留名
 移动互联网十年全景记录，数字化社会范式转换洞察
“商战真相集× 江湖恩仇录× 野蛮创新史”

内容简介：
       中国互联网的发展，呈现出了清晰的时间线。2010年之前，是中国PC互联网崛起和百度、阿里巴巴、腾讯三巨头的发家史；2010年之后，中国移动互联网呼啸而来，业界以为的既定局面开始涌现无限可能，美团、快手、抖音、今日头条、拼多多……许多新鲜面孔开始挑战三巨头的权威，催逼这个行业进行更多的技术变革。
       技术、商业、竞争、资本、并购等，开始逐渐成为新十年的主题。
       本书采用了编年体体例，回顾了2007—2009年中国互联网的历史，深度记录了中国互联网2010—2020年狂飙突进的新十年，是一部中国互联网的“江湖群侠传”。十年间，众多人、事、物或昙花一现，或峰回路转，或强者愈强。中国互联网的历史，在纷繁的人物沉浮、企业兴衰、资本博弈之中书写。本书介绍了十年间中国互联网江湖中的著名事件、典型企业，以及颇具影响力的人物。阅读本书，能让我们站在前浪的肩头，用长远的眼光，更好地谋划个人与企业的发展，学会通行世界的商业语言，甚至推动国家更进一步的繁荣与开放。",17,889,0,96,https://wfqqreader-1252317822.image.myqcloud.com/cover/216/40643216/s_40643216.jpg
赢（尊享版）,2017-07-01 00:00:00,经济理财-商业,赢，是所有人都在追求的目标——在商业竞争中赢得机会，在管理中赢得信任，在工作中赢得尊重，在人生历程中赢得价值感。为了分享赢的智慧，管理巨匠杰克·韦尔奇在《赢》中不惜笔墨地总结了自己的管理心得，从企业中泛滥而空洞的“使命”到每家公司都会面临的危机管理，再到预算管理、员工招聘、求职、工作与生活的平衡等诸多日常问题，韦尔奇逐一提出了自己独特的解决方案，并与广大读者分享了他作为成功管理者的思维方式，帮助你更从容地应对未来的挑战。,10,862,0,34.8,https://wfqqreader-1252317822.image.myqcloud.com/cover/461/184461/s_184461.jpg
文案的基本修养,2019-11-01 00:00:00,经济理财-商业,这本书撰写时预设的读者是那些刚刚入行，或从事文案、创意工作时间不长，对于很多业务问题及相关名词、知识还心存困惑的初级创意从业人员。 书中所谈的，是那些可能会构成一个广告创意人员基本修养的基本认识。是“认识”，所以更偏重道理，而非技巧。是“道”，而非“术”。 有了这些基本的认识，才有可能把事情做对，才知道什么是对，什么是错，什么是好，什么是坏。这些，就是所谓“基本修养”了。 修养是基础，但并不只是基础。有时候一件事做到高级，比的还是修养。面对同一个问题时，是不是能比别人有更多的角度、更丰富的素材、更深入的思考，让你有一些更快速、更准确的分析和判断，靠的可能就是这种“认识”，这种“修养”。,13,791,0,40.8,https://wfqqreader-1252317822.image.myqcloud.com/cover/572/26956572/s_26956572.jpg
世界上最伟大的推销员（全新修订版）,2014-06-01 00:00:00,经济理财-商业,本书记载了一个创富的传奇故事，讲述了一个出身贫寒的牧童如何通过个人奋斗，建立起了一个庞大的商业帝国。这个牧童是如何成功的呢？本书告诉您振奋人心的答案。本书自问世以来，已被翻译成数十种语言文字，在全球的总销量达到数千万册。各行业的无数有志者从本书中找到了神奇的力量，并藉此改变了自己的命运！本书充满智慧、激情与灵感，适合任何读者阅读，是难得的“心灵鸡汤”与潜力挖掘器。无论您处境怎样，本书都可以给您带来奇异的激励效果，并激发出生命的正能量，从而更好地改进您的工作、学习和生活！,6,778,0,12.99,https://wfqqreader-1252317822.image.myqcloud.com/cover/37/832037/s_832037.jpg
人人都能学会的刷屏文案写作技巧,2019-09-01 00:00:00,经济理财-商业,“后来的我们，为了谁四处迁徙，为了谁回归故里？” 真奇怪，这些字每一个都认识，每一个都会写，可是怎么就写不出这样触动人心的文案呢？！ 没关系！现在就有高手来教你写出刷屏文案！前微信大号副主编、数十篇10万+爆款文案作者吕白将其多年文案写作经验总结成模板和套路，让你无须再为写文案而愁秃头啦！ 《人人都能学会的刷屏文案写作技巧》主要通过介绍标题、选题、开头、结构、故事、金句、结尾7个方面的写作技巧近50多个方法，告诉读者如何快速写出阅读量达到10万+的新媒体爆款文章，以及如何通过提升写作技巧来提高自己的收入。作者还在书中介绍了自己的很多亲身经历，也是一本很好的职场励志书籍。,7,740,0,29.4,https://wfqqreader-1252317822.image.myqcloud.com/cover/153/26454153/s_26454153.jpg
上瘾：让用户养成使用习惯的四大产品逻辑,2017-05-01 00:00:00,经济理财-商业,为什么有些产品能抓住我们的注意力，而其他的产品却不能？是什么让我们出于习惯而建立与产品的联系？是否有一种潜在模式能让技术将我们紧紧吸引，欲罢不能？《上瘾》揭示了很多让用户上瘾、形成使用习惯的互联网产品和服务背后的基本设计原理，告诉你怎样打造让人们欲罢不能的产品。作者在多年研究、咨询及实际经验总结的基础上，提出了新颖而实用的“上瘾模型”（HookModel），即通过4个步骤来养成用户的使用习惯。通过连续的“钩循环”，让用户成为“回头客”，进而实现循环消费的终极目标——而不是依赖于高昂的广告投入或泛滥粗暴的信息传播。本书专为产品经理、设计师、市场销售人员、创业者打造，每一位想了解消费者行为的读者从中也会对自己、对当前的热门产品有更深刻的认识。你将会看到：·创造用户粘性习惯的实际见解·创造人们喜爱产品的可操作计划·Twitter、Instagram、Pinterest等国际知名互联网产品常用的用户行为技术解析,5,699,0,13.99,https://wfqqreader-1252317822.image.myqcloud.com/cover/316/857316/s_857316.jpg
零售的哲学,2014-11-01 00:00:00,经济理财-商业,"    全球最大的便利店连锁公司创始人——铃木敏文，结合40多年零售经验，为你讲述击中消费心理的零售哲学。铃木敏文的很多创新，现在已经成为商界常识，本书把那些不可思议的零售创新娓娓道来。关于零售的一切：选址、订货、销售、物流、管理……他一次又一次地在一片反对声中创造出零售界的新纪录。翻开本书，看铃木敏文如何领导7-11冲破层层阻碍，成为世界第一的零售哲学。
",3,778,0,24.7,https://wfqqreader-1252317822.image.myqcloud.com/cover/468/563468/s_563468.jpg
吴晓波企业史（套装9册）,2018-01-01 00:00:00,经济理财-商业,吴晓波企业史套装9册，包含《激荡十年，水大鱼大》、《激荡三十年》、《跌荡一百年》、《浩荡两千年》、《历代经济变革得失》、《大败局》。,26,881,0,266,https://wfqqreader-1252317822.image.myqcloud.com/cover/558/924558/s_924558.jpg
