title,publishTime,category,intro,maxFreeChapter,newRating,free,price,cover
华为财经密码：商业成功与风险制衡,2021-09-01 00:00:00,经济理财-商业,华为成功真正的核心点，除了人力资源体系，还有财经体系。华为财经管理的核心思想和商业逻辑主要表现为：追求长期有效增长；追求有利润的收入，有现金流的利润；业务为主导，财经为监督；成为值得信赖的伙伴和价值整合者。具体到管理方法，华为构建了集成作战的计划、预算、核算体系，打破了法人实体概念的责任中心管理系统，以及防腐败促经营的内控系统。对于企业人力资源经理不懂财务、财务经理不懂人力资源的现象，本书可以帮助读者明白财经管理的本质，理解业务和财经的关系，从而做到业财融合。,18,864,0,40,https://wfqqreader-1252317822.image.myqcloud.com/cover/690/40935690/s_40935690.jpg
精通区块链编程：加密货币原理、方法和应用开发（原书第2版）,2019-05-01 00:00:00,经济理财-商业,区块链的热度无须赘言。该书从基础技术层面解读开放区块链编程技术在金融领域的应用原理、实践及趋势。本书主要面向程序员，书中详细介绍了加密货币的原理、使用方法，以及如何开发与之相关的软件。对希望理解比特币及加密货币内在工作机制的非程序员读者们，本书前几章还深入介绍了比特币概念及其原理。,66,811,0,60,https://wfqqreader-1252317822.image.myqcloud.com/cover/668/25574668/s_25574668.jpg
拼多多运营实战手册：开店装修、营销推广、爆款打造一本通,2020-01-07 00:00:00,经济理财-商业,"拼多多以社交电商起家,与其他电商平台相比,具有门槛低、流量大、推广快、成本低等优势。如果你想开启自己的电商事业，不妨从拼多多开始；如果你想打造好拼多多店铺，不妨打开本书，从零开始学习运营吧！本书是一本拼多多店铺运营手册，其中包含平台介绍、新店开店指南、日常运营、推广引流、店铺优化、爆款打造、售后服务等多个板块，每个板块都配有实用的解决方案和手把手的操作步骤图，即使你从来没有接触过电商运营，也能够轻松上手。本书的语言通俗易懂，图表生动直观，方法步骤详细易学，提供了大量新的店铺运营技巧和操作实例。本书力求把核心、实操的内容直接呈现给读者，让读者在运营拼多多的道路上少走弯路。",12,615,0,39.9,https://wfqqreader-1252317822.image.myqcloud.com/cover/817/30060817/s_30060817.jpg
营销：人人都需要的一门课,2016-01-01 00:00:00,经济理财-商业,说到营销，很多人都会不以为然，甚至会觉得档次低。在过去很长的一段时间里，中国企业对营销存在很大的误解。很多企业把营销误认为就是做广告、办活动、做事件营销、请代言人、炒作自己，或者认为营销是忽悠顾客。这些认识无疑是非常低层次和目光短浅的。然而，在美国留学和工作的8年里，我看到美国优秀企业的营销并非如此。例如，消费者如果不满意梅西（Macy’s）百货商店里的一件衣服，可以3个月内无理由退货；如果不满意好市多（Costco）仓储式超市里的一个西瓜，竟然也可以用“不甜”这样的理由退货……,10,660,0,20,https://wfqqreader-1252317822.image.myqcloud.com/cover/333/812333/s_812333.jpg
区块链：分布式商业与智数未来,2020-11-01 00:00:00,经济理财-商业,目前，区块链技术已经成为世界各国争相研究的新兴技术，政府机构、国际组织以及各行各业的重点参与者都对其进行了战略性布局。自2015年发起成立万向区块链实验室以来，肖风博士对区块链产业发展的设想一直被视为行业发展的风向标。在本书中，肖风博士就区块链在金融科技、数字经济、产业应用探索、治理机制、物联网、公共事务和法定数字货币等领域的应用场景进行了探讨，对区块链相较于传统互联网在隐私保护、促进协作等方面的优势展开分析，描绘了由区块链赋能的分布式商业形态和大规模协作网络的未来发展方向。期待本书能为区块链、金融、互联网及监管等行业的参与者带来新的思考，促进区块链应用场景的进一步探索。,9,740,0,41.4,https://wfqqreader-1252317822.image.myqcloud.com/cover/625/34872625/s_34872625.jpg
赚钱其实没那么难,2015-11-01 00:00:00,经济理财-商业,本书精选作家迩半坡先生在各个名刊上发表的文章40余篇，其中多篇被大量转载和入选进各种书籍，篇篇文章以当下国内外的创业明星为榜样，以时尚前沿的商业模式为蓝本，截取最新锐热点事件和现象，通过系统化研究，揭示创意创业、实现梦想和改造世界等过程中的核心竞争力，囊括富有鲜活动力的人物精神和创新意识，揭秘创意创业的商业智慧，带给你全新的启迪借鉴意义和实战经验价值。,2,727,0,8.99,https://wfqqreader-1252317822.image.myqcloud.com/cover/705/827705/s_827705.jpg
科特勒《营销管理》（第14版）讲义与视频课程【38小时高清视频】,2019-07-12 00:00:00,经济理财-商业,本书特别适用于参加研究生入学考试指定考研参考书目为科特勒《营销管理》的考生，也可供各大院校学习科特勒《营销管理》的师生参考。工商管理经典译丛《市场营销原理》（第13版，菲利普·科特勒、加里·阿姆斯特朗著，中国人民大学出版社）是我国高校广泛采用的市场营销原理权威教材之一，也被众多高校（包括科研机构）指定为考研考博专业课参考书目。为了帮助考生复习该教材，我们根据各类考试和考研的命题规律精心编写了科特勒《市场营销原理》的配套辅导书（提供免费下载，免费升级）：科特勒《市场营销原理》（第14版）讲义与视频课程【38小时高清视频】本书是的科特勒《市场营销原理》教材的配套电子书，主要包括以下内容：（1）整理名校笔记，浓缩内容精华。本书每章的复习笔记均对该章的重难点进行了整理，并参考了国内名校名师讲授该教材的课堂笔记。因此，本书的内容几乎浓缩了该教材的所有知识精华。（2）解析课后习题，提供详尽答案。本书参考大量市场营销原理相关资料对科特勒《市场营销原理》的课（章）后习题进行了详细的分析和解答，并对相关重要知识点进行了延伸和归纳。另外，本书每章均附有英文参考答案。（3）最新补充内容，可免费升级获得。本书后期会进行修订完善，对于最新修订完善的内容，均可以免费升级获得。,13,0,0,200,https://wfqqreader-1252317822.image.myqcloud.com/cover/333/27039333/s_27039333.jpg
电话销售中的成交技巧与拒绝处理,2017-08-01 00:00:00,经济理财-商业,电话销售作为一种销售模式，本质是在为客户提供有价值的服务，起码可以传递有益的信息。为此，本书从销售实战的角度出发，深入浅出、系统详尽地剖析电话销售中如何有效实现成交和处理客户的拒绝，从而增强电话销售从业者的开单能力。书中共分3篇，计12章，全书内在体系逻辑严谨，用语自然亲切，融入了大量实战案例，是从事营销、咨询、推广等业务的销售人员学习的指导手册。,30,704,0,11.94,https://wfqqreader-1252317822.image.myqcloud.com/cover/96/911096/s_911096.jpg
秋叶特训营：个人品牌7堂课,2020-10-01 00:00:00,经济理财-商业,《秋叶特训营 个人品牌7堂课》以7堂课的形式，系统地总结了建立和运营个人品牌所需的7种思维——平台思维、赛道思维、定位思维、团队思维、产品思维、渠道思维和运营思维。《秋叶特训营 个人品牌7堂课》所讲述的内容有高度的实操性，能帮助读者选对平台，选对方向，避免走弯路；从0到1搭建好团队；规划变现产品；做好粉丝留存，并持续运营产品和用户；规划好品牌的发展路径。《秋叶特训营 个人品牌7堂课》适合培训师、知识IP、新媒体运营者、企业管理者、电商网红等阅读。通过学习本书，读者可以学会打造有温度的个人品牌，从赋能自己到赋能别人，从赋能产品到赋能产业，提升自己的品牌价值。,8,783,0,29.9,https://wfqqreader-1252317822.image.myqcloud.com/cover/753/35621753/s_35621753.jpg
硅谷蓝图,2019-04-01 00:00:00,经济理财-商业,《硅谷蓝图》是硅谷销售加速领域教父雅各·范德库伊，基于全球220多家领先B2B企业和SaaS企业的销售实战经验，提炼出来的一套能够成功落地的销售方法论。首先站在战略高度对销售中的每个环节做设计，然后通过教练方式将设计转化成战术迅速落地固化，帮助企业搭建科学的销售体系。《硅谷蓝图》的内容结构是13幅蓝图+13个案例分析，清晰简明，涵盖了销售设计和细节执行的方方面面，是一套拿来就用的销售管理实战手册，帮助SaaS企业和B2B企业应对当下面对的各种挑战，实现稳健、快速、规模化增长。如今，SaaS商业模式正在改变B2B销售，新一代销售管理正在改变传统销售管理。如何改变？如何落地？一旦初创公司完成从0到1地积累，如何走好从1到100的高速规模化发展阶段？本书给出了具体的模式和执行路径。,7,760,0,47.99,https://wfqqreader-1252317822.image.myqcloud.com/cover/843/25178843/s_25178843.jpg
品类战略（十周年实践版）,2017-05-01 00:00:00,经济理财-商业,《品类战略》系统地介绍了“品类战略”这一革命性的前沿营销思想，并结合国内外众多大企业的成功与失败案例，具体分析了品类战略在企业发展和品牌创立过程之中的核心战略地位，解析可口可乐、宝洁、丰田、格力等企业的成功之道，使你的品牌起步就是领导者。今天，与“营销”有关的图书、文章和演讲都在谈论建立“品牌”的必要性。你所能见之处，无不是“品牌、品牌、品牌”。当然，建立一个强大的品牌是营销战略的终极目标。但是，如何建立强大的品牌？显然不能只立足于品牌本身。只有通过思考品类才能建立强大品牌，品牌只是营销中直观可见的一个方面而已，它就像是冰山露出水面的尖角。每个强大品牌底下都有一个具有前景的品类在支撑，就像冰山尖角下面才是冰山的主体，品牌下面的主体是品类，一个品牌的强大和品类本身的强大密不可分。,28,761,0,18,https://wfqqreader-1252317822.image.myqcloud.com/cover/207/858207/s_858207.jpg
价值竞争：以客户为中心的销售转型,2017-07-01 00:00:00,经济理财-商业,本书是作者在几十年的销售职业生涯中工作、学习和培训的经验总结。得益于丰富的工作经历，作者写出了以销售为背景的百万级畅销书《输赢》，而本书则是《输赢》的理论版。本书从销售的历史演进，以及互联网对销售的影响入手进行分析，提出了价值竞争——以客户为中心的销售方法论，并分别针对客户管理和孵化、建立信任、激发需求、促成立项、建立购买标准、屏蔽对手、成交、管理期望、收款、销售指挥体系、赋能等12个方面提出了一揽子的解决方案。本书既有对销售本质的深刻洞察，也有针对各种问题的解决方案。本书以大量的图表、生动的语言、丰富的案例为读者奉上一道关于销售的“思想大餐”。,24,838,0,20,https://wfqqreader-1252317822.image.myqcloud.com/cover/361/908361/s_908361.jpg
华为管理法：任正非的企业管理心得,2017-01-01 00:00:00,经济理财-商业,为中国号召力、影响力和领导力的企业家，华为创始人任正非已经成为国内外企业管理界竞相学习的标杆。任正非管理思想的独到之处，更是被华为近30年持续高速的发展而证实.任正非在创办华为前，一无管理企业的经验，二无充裕的资金，创业资金不过2万余元，三无自己的产品，刚开始只是一家代理商；在任正非的带领下，华为成为世界通信行业领先企业。了解任正非的管理思想，学习任正非的管理能力，对当今很多企业管理者都有着重要的现实意义。,22,789,0,13.5,https://wfqqreader-1252317822.image.myqcloud.com/cover/959/906959/s_906959.jpg
品牌洗脑（珍藏版）,2016-07-01 00:00:00,经济理财-商业,"    全球知名品牌营销大师马丁·林斯特龙有一天突然对品牌感到厌倦，他决定以一个普通消费者的身份对品牌进行为期一年的“戒毒”——不购买新的品牌商品。但是，在坚持了6个月之后，他失败了。懊悔之余，他决定来一个大揭秘，全面披露世界著名品牌只做不说的营销秘密。马丁·林斯特龙将营销中最隐蔽却又最实用的手段称之为隐形说客，正是这些隐形说客，让消费者彻底放弃了理性。利用恐惧、性、名人、怀旧情绪，企业向消费者兜售安全、梦想和渴望；通过同侪压力、口碑营销，消费者不知不觉就陷入购物狂潮；大数据更是企业收集、分析消费者购买行为的利器。
",31,678,0,24.99,https://wfqqreader-1252317822.image.myqcloud.com/cover/333/843333/s_843333.jpg
爆发式赢单：金牌销售实战手记,2019-02-01 00:00:00,经济理财-商业,金牌销售倪建伟将其20余年大客户销售实战经验和多年的培训管理技巧浓缩成这本书，将和你分享顶级销售精英一直在用的实战销售硬技巧；大客户销售如何布局、抢单、控单、赢单的软谋略；普通销售员如何实现爆发式成长，快速晋级为销售总监；以及销售总监、销售总经理管理的道与术；销售管理层如何实现个体价值升级等，希望能以最快的速度帮你打开视野、突破思维僵局、提升实战技能，助你迅速成为一名顶级销售精英。,16,756,0,19.99,https://wfqqreader-1252317822.image.myqcloud.com/cover/338/25506338/s_25506338.jpg
程序化广告：个性化精准投放实用手册,2017-10-01 00:00:00,经济理财-商业,《程序化广告 个性化精准投放实用手册》从互联网广告的发展历史讲起，深入探索了中国程序化广告的发展历程，围绕程序化广告的参与者、交易模式、核心流程和相关技术原理，详细阐述了程序化广告的投放逻辑、优化思路、竞价原理、数据分析等内容，并通过系统实例真实呈现了程序化广告生态体系中的产品形态。,12,745,0,31.6,https://wfqqreader-1252317822.image.myqcloud.com/cover/147/22692147/s_22692147.jpg
公司控制权：用小股权控制公司的九种模式（第2版）,2021-05-01 00:00:00,经济理财-商业,本书共五部分。首先介绍公司控制权的基础，分别介绍了企业的主要类型、九条股权生命线、以及方“野蛮人”的七大招数；第二部分介绍用小股权控制公司的九种模式；第三部分介绍如何从六个层面掌握公司的控制权，包括从股权层面、股东会层面、董事会层面、董事长层面、管理层层面、法定代表人层面；第四部分介绍了三种控制公司的工具，分别是股东协议、公司章程和股东会和董事会会议；第五部分是对公司控制权的综述，分别介绍了公司章程与股东协议、股权结构与公司控制权、顶层架构与公司控制权。,31,0,0,40,https://wfqqreader-1252317822.image.myqcloud.com/cover/178/38335178/s_38335178.jpg
战略解码：跨越战略与执行的鸿沟,2021-02-01 00:00:00,经济理财-商业,本书论述了“让战略规划与战略执行有效衔接”的方法论和应用实践。作者基于多年的研究和在不同企业的实践，在书中全景式地将战略解码的原理、方法和应用展示给读者。战略解码是化战略为行动、变愿景为现实的利器。它通过团队共创的方式，对企业战略进行澄清诠释，助企业明晰路径、明确硬仗、分解任务，助企业的战略规划转化为一线员工能够理解的语言，并落实为绩效承诺，输出为绩效结果，助企业实现“上下同欲”“左右协同”“力出一孔”“使命必达”的局面。,21,743,0,40,https://wfqqreader-1252317822.image.myqcloud.com/cover/286/36583286/s_36583286.jpg
销售就是玩转情商,2017-06-01 00:00:00,经济理财-商业,"成功的销售员都知道，销售拼的不仅是硬技巧，更需要玩转情商！本书将为你提供真实的高情商销售案例，让你更精准理解销售大师的“王牌销售术”，将告诉你：如何读懂顾客“潜台词”？如何掌握最佳销售时机？如何把握与顾客沟通的尺度？如何在被拒绝时绝处逢生？如何妥善应对顾客投诉？如何巧妙躲过销售雷区？让读者看清销售误区，从自身情绪管控入手，改变目前的销售现状，让顾客心甘情愿买单，成就销售辉煌。
",30,770,0,7.99,https://wfqqreader-1252317822.image.myqcloud.com/cover/866/918866/s_918866.jpg
视觉锤,2012-12-13 00:00:00,经济理财-商业,定位理论的传承和发展定位就是在消费者心智中找到一个空位，然后植入一颗钉子。视觉时代，抢占消费者心智的最好方法并非只用“语言的钉子”，还要运用强有力的“视觉锤”，视觉形象就像锤子，可以更快、更有力地建立定位并引起顾客共鸣。视觉形象和语言信息的关系好比锤子与钉子：要用视觉形象这把锤子，把你的语言钉子植入消费者的心智中。,8,672,0,20,https://wfqqreader-1252317822.image.myqcloud.com/cover/186/603186/s_603186.jpg
大话区块链,2019-11-01 00:00:00,经济理财-商业,本书分为两篇，理论与实战并重、通俗易懂又不失专业。第1篇为区块链技术指南（第1～ 3章），主要讲解了区块链概念、区块链应用，以及比特币、以太坊、超级账本、EOS等主流区块链技术。通过第1篇的学习，读者可以全面理解主流区块链技术实现的原理，并了解区块链未来的发展趋势。第2篇为区块链开发实战（第4～5章），主要从区块链的基本技能开始学习，模拟真实区块链项目开发的过程，详细讲解了智能合约和DAPP的设计、开发以及部署的过程。通过第2篇的学习，读者可以掌握区块链开发的方法。本书适合对区块链感兴趣的人群，尤其适合希望学习区块链开发的技术人员阅读。,12,870,0,41.3,https://wfqqreader-1252317822.image.myqcloud.com/cover/471/34061471/s_34061471.jpg
有序创业24步法：创新型创业成功的方法论,2017-08-01 00:00:00,经济理财-商业,本书致力于提供一套整合式的创业工具箱，帮助那些希望通过提供新的创新产品创办伟大企业的初次创业者或者连续创业者获得成功。即使对于那些在特定领域或行业经验丰富的连续创业者来说，本书介绍的24步创业法也颇有裨益，能够帮助他们高效开发出适合市场需要的产品。,15,780,0,30,https://wfqqreader-1252317822.image.myqcloud.com/cover/74/912074/s_912074.jpg
数字时代的营销战略,2017-01-01 00:00:00,经济理财-商业,这是一个转型与变革共存的时代，迈克尔·波特话语体系中的“竞争优势”一词似乎变成了理论幻象，流行互联网焦虑症让很多企业家寝食难安。互联网+，社交媒体，大数据，社群，VR，很多概念、理论、科技应用不断被抛出，我们既需要思维宏大、叙事版的转换，又需要实操的工具和可以“落地”的武器。数字化转型，转什么，向哪儿转，如何设计路线图？互联网+，加什么，减什么，如何计算？,20,789,0,30,https://wfqqreader-1252317822.image.myqcloud.com/cover/555/851555/s_851555.jpg
亚马逊跨境电商运营从入门到精通,2018-10-01 00:00:00,经济理财-商业,跨境电商是我国政府支持，且极具潜力的实体投资项目，是未来几年中国企业走出国门的重要渠道。亚马逊是目前最成熟，也最具代表性的外贸电商平台，是新卖家从事跨境电商的首选平台，本书就是在这个背景下撰写的。《亚马逊跨境电商从入门到精通》内容包括亚马逊卖家账户的注册、选品、运营、上架、站内广告、FBA发货、国际物流、第三方收款、海外税务，以及售后服务等，详细分析了亚马逊各个站点，帮助卖家提前布局蓝海市场，并且结合抖音海外版让卖家可以在第一时间抢占海外市场先机。本书以图文并茂的形式讲解，帮助读者以最低的成本快速开启海外掘金之路。,30,770,0,23.6,https://wfqqreader-1252317822.image.myqcloud.com/cover/107/23735107/s_23735107.jpg
任天堂的体验设计：创造不知不觉打动人心的体验,2021-09-01 00:00:00,经济理财-商业,本书具体介绍任天堂游戏的体验设计：如何不知不觉让打动游戏玩家的直觉·惊喜·故事设计。任天堂游戏的设计为何会这么吸引人，让玩家着迷并愿意分享给朋友？这就是体验设计，从直觉上设计，让游戏玩家觉得不是游戏本身而是自己很棒获得成就感；惊喜设计：为什么玩家会不知不觉对游戏入迷；故事设计：如何能让玩家主动和别人“安利”你的游戏。通过三种设计，借助任天堂的游戏页面和请接收设计，让设计者和读者了解如何设计游戏，揭秘游戏如何吸引人。体验设计：从“体验”到“感情”到“记忆”,13,745,0,40.8,https://wfqqreader-1252317822.image.myqcloud.com/cover/977/41202977/s_41202977.jpg
一本书读懂客户心理：挖掘客户需求痛点，七步成交,2014-10-01 00:00:00,经济理财-商业,如何让客户爽快答应和我见面？如何找到客户感兴趣的话题？如何让客户对我情有独钟？如何引导客户按照我的思路走？如何消除客户的顾虑？客户说不需要，怎么办？客户跟我讨价还价，怎么办？……,5,826,0,9,https://wfqqreader-1252317822.image.myqcloud.com/cover/296/858296/s_858296.jpg
销售团队就该这样管：五星评定销售管理实战指南,2021-06-01 00:00:00,经济理财-商业,适合中国本土实战的销售管理系统工具书本书站在经营者的视角，结合中国本土企业的管理实践，打开了企业销售管理的“魔法盒”，层层解析了当下企业销售管理过程中存在的认知和行为误区，给出了一套销售管理的系统框架和落地工具，独创性地提出了“五星评定”这一管理系统，并给出了系统当中每一个子模块的设计逻辑、原则、方法及工具。本书共分为两部分。第一部分讲述了五星评定管理法是如何在销售管理实践中一步步提炼总结出来的，并进一步阐述了五星评定管理法对于企业经营的意义；第二部分讲述了企业应该如何设计五星评定管理系统以及该方法如何有效落地。作者以企业中很重要的销售岗为例，回到销售管理的本质，解读了五星评定管理系统是如何解决销售管理基本面的六大问题的，其中包括业绩指标设计、过程管理设计、通关培训设计、销售秘籍设计、薪酬机制设计、人才通道设计。在本书结语部分，作者结合过去多家企业在导入五星评定管理法过程中出现的问题，提出了有效导入五星评定管理系统的四大步骤。,6,921,0,48.3,https://wfqqreader-1252317822.image.myqcloud.com/cover/149/39628149/s_39628149.jpg
淘宝技术这十年,2013-05-01 00:00:00,经济理财-商业,本书从工程师的角度讲述淘宝这个超大规模互联网系统的成长历程，及其所有主动和被动的技术变革的前因后果。书中有幕后故事、产品经验、架构演进、技术启蒙，也有大牛成长、业内八卦、失败案例、励志故事。全书文风流畅，有技术人员特有的幽默感；内容积极正面，有现场感，全部是作者亲身经历。,7,730,0,18,https://wfqqreader-1252317822.image.myqcloud.com/cover/318/680318/s_680318.jpg
管理品牌资产（珍藏版）,2019-01-01 00:00:00,经济理财-商业,本书解释了“品牌资产”这一概念，用研究成果和直观案例证明，营销决策或环境事件可以提升品牌、创造价值（或者相反）；并且讨论了品牌资产的管理方法，提出了若干问题供读者思考。,26,772,0,40,https://wfqqreader-1252317822.image.myqcloud.com/cover/615/24027615/s_24027615.jpg
