title,publishTime,category,intro,maxFreeChapter,newRating,free,price,cover
大话云计算：从云起源到智能云未来,2020-10-15 00:00:00,计算机-理论知识,《大话云计算：从云起源到智能云未来》旨在以简明的形式、通俗易懂的文字，让读者快速了解时下很受关注的IT新技术—云计算。《大话云计算：从云起源到智能云未来》不仅回答了“什么是云”这一关键问题，还层层解耦、抽丝剥茧，从数据中心结构、服务设计方法，到安全及合规性，再到自动化云端工具，多个角度详细介绍了云计算平台的构成和使用。同时，本书作者还运用自己丰富的实战经验，以动手实验的方式带领读者尝试使用云端服务。本书还对未来世界做出了展望，整本书体系完整，内容丰富，有助于广大读者理解整个IT产业今后发展的大脉络。《大话云计算：从云起源到智能云未来》可以作为想了解云计算概念的非技术读者、希望使用云计算的IT决策者，或希望使用云计算进行创新的创业者的入门指南，也可以作为云计算行业专业人士的参考书。,19,0,0,59.9,https://wfqqreader-1252317822.image.myqcloud.com/cover/502/37323502/s_37323502.jpg
Axure RP 9 高保真原型设计实例教程,2020-07-01 00:00:00,计算机-理论知识,本书实际上是一套关于Axure“从入门到精通、从理论到实践、从传统静态线框原型到动态交互高保真原型”的整体解决方案。作者想通过本书传达给读者的是，想要在“自个儿的圈子里”做得更好，掌握高保真原型的设计思路、方法以及制作、设计技巧，不失为一种聪明的做法。 本书共分为4章。第1章，作者对线框图和高保真图做了简单介绍，并总结了制作产品原型的设计思路；第2章，较详细地介绍了Axure RP 9的基础操作；第3章，App端实战练习，介绍了14个移动客户端的案例；第4章，Web端实战练习，共有16个Web端的案例。 通过本书的历练，读者不仅能收获高保真原型的快速建模能力，还能提高App端和Web端产品的界面及交互设计能力。一次学习，终身受用！,16,0,0,55.3,https://wfqqreader-1252317822.image.myqcloud.com/cover/43/33381043/s_33381043.jpg
ASP.NET MVC企业级实战,2017-04-01 00:00:00,计算机-理论知识,ASP.NET MVC 是微软官方提供的以MVC模式为基础的ASP.NET Web应用程序框架。MVC 将一个Web应用分解为Model、View和Controller，有助于管理复杂的应用程序，并简化了分组开发，使得复杂项目更易维护。 本书共分为12章，以符合初学者思维的方式系统地介绍ASP.NET MVC的应用技巧，并结合实际项目详细地介绍如何基于ASP.NET MVC构建企业项目。通过本书的学习，读者可以全面掌握ASP.NET MVC的开发，并从代码中获取软件开发与架构设计的经验与灵感。 本书具有很大的参考价值，既适合ASP.NET MVC开发初学者阅读，也适合有一定基础的ASP.NET MVC开发人员进行技术强化和经验积累，同时还适合作为高等院校和培训学校相关专业的教学参考书。,25,0,0,62.3,https://wfqqreader-1252317822.image.myqcloud.com/cover/858/26943858/s_26943858.jpg
从实践中学习Nmap渗透测试,2021-06-01 00:00:00,计算机-理论知识,随着信息技术的发展，网络广泛应用于人们的日常生活和工作之中，各式各样的设备都需要连接网络才能正常使用。为了保障网络安全，安全人员需要对网络进行各种安全审计。Nmap是知名的网络安全审计工具，可以帮助安全人员发现设备，探测设备开启的端口号，分析设备使用的操作系统和开启的服务，探测设备存在的漏洞。本书详细介绍如何使用Nmap工具实施渗透测试。本书共19章，分为2篇。第1篇“Nmap环境配置与网络扫描”，主要介绍Nmap的环境配置，以及确定目标、发现主机、扫描端口、服务与系统探测、扫描优化、规避防火墙和IDS、保存和输出Nmap信息等基础知识；第2篇“Nmap脚本实践”，涵盖探测网络基础环境、探测网络基础服务、探测Web服务、探测远程登录服务、探测数据库服务、探测应用程序及探测苹果操作系统等内容。本书特别适合渗透测试人员、网络维护人员、信息安全爱好者阅读。通过阅读本书，读者可以了解和掌握网络运行的机制，熟悉网络扫描和探测的原理，并掌握大量Nmap脚本的使用方法，从而保障网络信息的安全。,42,0,0,71.4,https://wfqqreader-1252317822.image.myqcloud.com/cover/95/38507095/s_38507095.jpg
区块链技术指南,2016-11-01 00:00:00,计算机-理论知识,VMware中国研发中心云原生应用首席架构师，西蒙弗雷泽大学计算机科学硕士，多年软件全栈开发经验，Harbor企业级容器Registry开源项目负责人，Cloud Foundry中国社区最早的技术布道师之一，国内最早的iOS开发者。在VMware公司先后负责开源PaaS平台Cloud Foundry、大数据虚拟化、软件定义存储VSAN等领域的技术布道和解决方案推广。目前着重关注区块链、容器和云计算等领域的研究和开发工作。之前曾担任IBM资深软件工程师、Sun公司资深解决方案架构师等职务。,10,702,0,25,https://wfqqreader-1252317822.image.myqcloud.com/cover/298/847298/s_847298.jpg
51单片机工程师是怎样炼成的：基于C语言+Proteus仿真,2012-01-01 00:00:00,计算机-理论知识,本书完整展现了一个51单片机工程师成长的经历。51单片机共有21个特殊功能寄存器，而需要重点掌握的只有6个（需要熟练掌握对其位的操作），因而学习单片机其实很简单：学会6个寄存器就学会了单片机程序设计。这样如果一天掌握一个寄存器，那么6天就能学会单片机。本书适用于51单片机的初学者和使用51单片机从事项目开发的技术人员参考，还可作为大学本、专科单片机课程教材。,14,0,0,23.2,https://wfqqreader-1252317822.image.myqcloud.com/cover/734/680734/s_680734.jpg
ZEMAX光学设计超级学习手册,2014-04-01 00:00:00,计算机-理论知识,《ZEMAX光学设计超级学习手册》以ZEMAX 2010作为软件平台，详细讲解了ZEMAX在光学设计中的使用方法与技巧，帮助读者尽快掌握ZEMAX这一光学设计工具。 结合作者多年的使用和开发经验，通过丰富的工程实例将ZEMAX的使用方法详细介绍给读者。全书共分为11章，主要讲解了ZEMAX的使用界面和基本功能，光学像差理论和成像质量的评价，以及各种透镜和目镜、显微镜、望远镜等目视光学系统的设计。 注重基础，内容详实，突出实例讲解，既可以作为光学设计人员、科研人员等相关专业人士的工具书，也可以作为相关专业高年级本科生、研究生的学习教材。,18,0,0,35.4,https://wfqqreader-1252317822.image.myqcloud.com/cover/523/729523/s_729523.jpg
未来架构：从服务化到云原生,2019-03-01 00:00:00,计算机-理论知识,互联网架构不断演化，经历了从集中式架构到分布式架构，再到云原生架构的过程。云原生因能解决传统应用升级缓慢、架构臃肿、无法快速迭代等问题而成了未来云端应用的目标。本书首先介绍架构演化过程及云原生的概念，让读者对基础概念有一个准确的了解，接着阐述分布式、服务化、可观察性、容器调度、Service Mesh、云数据库等技术体系及原理，并介绍相关的SkyWalking、Dubbo、Spring Cloud、Kubernetes、Istio等开源解决方案，最后深度揭秘开源分布式数据库生态圈ShardingSphere的设计、实现，以及进入Apache基金会的历程，非常适合架构师、云计算从业人员阅读、学习。,15,583,0,69.3,https://wfqqreader-1252317822.image.myqcloud.com/cover/755/25449755/s_25449755.jpg
苦旅寻真：求索中国仿真解困之道,2020-08-01 00:00:00,计算机-理论知识,本书指出了中国仿真技术存在的三大困局，分析了仿真困局的成因，最后给出了仿真技术解困方案。全书共分四篇：第一篇维谷叩天：仿真困局求解；第二篇迷途破晓：仿真体系修炼；第三篇云桥飞架：仿真生态衍进；第四篇天路漫漫：仿真自主征途。第一篇综合讨论中国仿真面临的三个困局，并综述性地提出三项破冰方案。后面三篇就这三个困局及其破冰方案分三个专题展开介绍：第二篇就如何在大企业建立仿真能力体系提出一套方法论，以提升大企业的仿真效益；第三篇针对降低中小企业仿真应用门槛，提出仿真生态理念，论述如何开发一个仿真云平台和如何进行生态衍进；第四篇围绕中国仿真软件自主研发，测量了国际仿真“珠峰”的高度，提出了我们攀登“珠峰”的路径和节奏。,41,0,0,40,https://wfqqreader-1252317822.image.myqcloud.com/cover/63/33381063/s_33381063.jpg
小小黑客之路,2011-01-01 00:00:00,计算机-理论知识,信息安全是一面双扇的门，左边写着“黑客”，右边写着“安全”。你推开“黑客”，看见一条路，笑了；他推开“安全”，看见你，也笑了。这就是你的小小黑客之路。本书正如一幅黑客世界的探险地图，由入门、进阶、高级和综合四个层次组成，以C/C++语言和Windows API为平台，并配合由浅入深、由易到难的各种案例，绘制而成。地图中的每一部分都配有生动有趣的情景故事，帮助你理解各种实际发生的现象和应对的方法，帮助你深入探寻各种热门的黑客工具的原理及编写技巧，帮助你在轻松幽默的氛围中顺利成长。,6,0,0,23.6,https://wfqqreader-1252317822.image.myqcloud.com/cover/888/680888/s_680888.jpg
B端产品设计精髓：从0到1构建企业级的数智化产品,2020-05-01 00:00:00,计算机-理论知识,本书以B端产品设计的标准流程为核心结构，全面介绍如何从0到1构建企业级的数智化产品，共分为4部分。第1部分重点介绍了B端产品的客户、用户与产品等，还介绍了其独有的特征，这也是把产品做成功的关键。第2部分讲解从业务需求到设计，通过场景化的方法，结合原型设计，把需求更为可视化地表达出来，并不断地通过用户进行验证，来不断地完善和驱动设计。第3部分是经典的B端设计模式介绍，总结和提炼了很多固化的设计模式，可以直接引用。第4部分以人工智能的视角，介绍智能服务的设计探索，具有很强的前沿性和拓展性。,23,374,0,48.3,https://wfqqreader-1252317822.image.myqcloud.com/cover/673/31486673/s_31486673.jpg
计算机网络基础（第3版）,2017-08-01 00:00:00,计算机-理论知识,根据高职高专教育的培养目标、特点和要求，本书在内容上遵循“宽、新、浅、用”的原则，较全面地介绍了计算机网络的基础知识和基本技术。全书共分为11章，内容包括计算机网络概述、数据通信基础、计算机网络体系结构、TCP/IP协议集、局域网技术、网络互连、广域网技术、Internet基础与应用、常见的网络故障排除、计算机网络安全技术以及实际技能训练。本书在结构上采取“问题引入—知识讲解—知识应用”的方式，充分体现了启发式教学和案例教学的思想，并以提示的方式对重点知识、常见问题和实用技巧等进行补充介绍，从而加深理解，强化应用，提高实际操作能力。本书可作为高职高专各专业计算机网络技术基础课程的教材，也可作为计算机网络培训班的培训教材和计算机网络爱好者的自学参考书。,11,0,0,28.8,https://wfqqreader-1252317822.image.myqcloud.com/cover/571/35449571/s_35449571.jpg
HIS内核设计之道：医院信息系统规划设计系统思维,2021-08-01 00:00:00,计算机-理论知识,本书详细阐述了新一代医院核心业务信息系统规划与设计的系统思维模型，并在诸多方面给出了具体方法、工具、案例与适用场景。本书内容包括绪篇、核心篇及续篇三大部分。其中，绪篇重点阐述在医院信息系统设计中运用系统科学理论的必要性、重要性及方法论；核心篇涵盖了核心系统设计关键环节，包括医院核心业务系统的定义、需求分析、数据架构、应用架构、集成规范及交互体验设计；续篇给出了在核心业务系统基础上扩展应用的规划设计理念和案例。通过阅读本书，读者可以深刻理解医疗信息化的原理，有利于促进医疗信息化行业群体的认知升级；帮助相关企业人员认清医疗信息化本质，以提升信息系统的综合分析能力与创新设计能力；指导和帮助医疗机构相关人员提升规划建设与应用水平。本书深度阐述了医院信息系统的设计之道，适合作为高等院校相关专业师生的参考教材。,24,0,0,61.6,https://wfqqreader-1252317822.image.myqcloud.com/cover/173/40795173/s_40795173.jpg
数字孪生实战：基于模型的数字化企业（MBE）,2019-10-01 00:00:00,计算机-理论知识,2015年我们组织出版了《工业4.0实战：装备制造业数字化之道》一书，该书受到了广大读者的热烈欢迎。大家普遍反映，书中描述的愿景代表了数字化工业的方向，对企业数字化转型战略规划工作非常有帮助，其基于模型的数字化企业（MBE）技术解决方案和实践案例对制定实施路线图提供了很有价值的参考。鉴于近期西门子数字化工业软件在建立“从芯片到城市”数字孪生的战略愿景指导下，尤其是并购了世界首屈一指的EDA技术供应商——MentorGraphics公司，成为第一家能够整合PLM和EDA的技术公司，从而进一步加强了其在工业软件领域的全球领导地位，在数字化工业创新型实践案例方面也取得了一系列重要进展，为了反映日新月异的数字化工业领域创新，我们决定组织编写本书。&lt;br/&gt;关于本书，除了更新《工业4.0实战：装备制造业数字化之道》中的先进内容，西门子数字化工业软件有关专家还增加了MBE技术的最新进展，包括基于模型的电子电气解决方案、基于模型的产品型谱化和模块化管理方案、基于模型的软件全生命周期管理方案、基于模型的产品成本管理方案、基于模型的工艺与虚拟验证解决方案以及基于模型的闭环制造解决方案，同时增加了一系列典型案例，目的是为中国大型装备制造业数字化的领导和技术专家提供有价值的、可落地实施的参考思路、方法和工具。,7,611,0,45,https://wfqqreader-1252317822.image.myqcloud.com/cover/995/27184995/s_27184995.jpg
企业互联网架构原理与实践,2021-05-11 00:00:00,计算机-理论知识,本书主要讲解互联网架构的设计初衷、原理和模式。全书介绍了互联网架构的演变过程与分层、分割、分片、缓存、并行、异步、隔离、容错、安全、治理等设计模式的应用场景和作用，还介绍了前端应用层、接入层、服务层、服务治理、分布式锁、分布式ID、分布式事务、分布式消息队列、分布式缓存、数据持久化以及DevOps等技术的组成结构、运行原理和应用方案。本书使用的是Java语言相关的技术生态，适合希望掌握互联网架构的IT开发工程师和架构师阅读。通过本书，读者可以对互联网分布式架构有较全面的了解。,18,0,0,89.99,https://wfqqreader-1252317822.image.myqcloud.com/cover/48/40108048/s_40108048.jpg
AutoCAD 2014中文版从入门到精通,2015-01-01 00:00:00,计算机-理论知识,本书在编写过程中遵循的原则是：除详细讲解基本的绘图知识外，还介绍了各个行业制图的差异。本书在实际应用部分设置了AutoCAD在机械设计、建筑设计、室内设计和电气设计等方面的应用，几乎包含了AutoCAD在所有设计行业中的应用，读者在掌握绘图技巧的同时，也可以对设计行业有一个大致的了解。,8,0,0,30,https://wfqqreader-1252317822.image.myqcloud.com/cover/986/621986/s_621986.jpg
企业级云原生架构：技术、服务与实践,2021-06-01 00:00:00,计算机-理论知识,本书较为全面、系统地介绍了云原生架构相关的方法论与技术产品，并结合作者多年的大型项目建设实施经验，阐述了分布式环境下面向云原生的架构设计最佳实践。本书主要分为4个部分，分别是云原生概述、云原生技术、云原生服务、云原生架构实践。本书兼顾理论、技术与实践，对从事相关行业的读者具有很好的学习指导意义。本书面向的读者对象为互联网行业的业务咨询师、系统架构师，以及相关领域的技术开发人员。,18,0,0,70.21,https://wfqqreader-1252317822.image.myqcloud.com/cover/34/40870034/s_40870034.jpg
程序员必读经典：算法基础+计算机系统,2019-12-20 00:00:00,计算机-理论知识,《算法基础：打开算法之门》 本书介绍了什么是计算机算法，如何描述它们，以及如何来评估它们。这些计算机算法将提供：利用计算机搜索信息的简单方式；解决各种排序问题的方法；利用有向无环图和最短路径法来解决基本问题的方法(可用于建模公路网络，任务间的依赖及金融关系)；解决字符串(例如DNA结构)问题的方法；密码学背后的基本原理；数据压缩的基础知识；以及甚至一些没有人能够理解如何在计算机上用相当长的时间来解决的问题。本书适合作为计算机专业本科生“算法设计与分析”课程的教材，也适合相关专业人员阅读。《计算机系统：基础概念及编程实践》 本书融合计算机学科的“计算机组成原理”“微机原理”和“汇编语言程序设计”课程的基本内容，同时补充“数字逻辑”课程基础知识，延伸“计算机系统结构”课程核心概念，结合C语言和汇编语言编程实践，从软件角度理解计算机系统的工作原理。本书可以作为“计算机系统基础”或“计算机硬件技术基础”课程的教材或参考书，也就是适合综合“计算机组成原理”与“汇编语言”等教学内容的课程，该课程还可以替代“汇编语言”课程，或者作为“计算机组成与结构”“嵌入式系统”等需要硬件基础知识的前导课程。本书具有以“软”带“硬”、浅显易懂、突出实践等特点，也满足计算机应用开发人员对计算机硬件核心知识的要求。,28,0,0,75,https://wfqqreader-1252317822.image.myqcloud.com/cover/32/32460032/s_32460032.jpg
虚拟化与网络存储技术,2019-08-01 00:00:00,计算机-理论知识,本书较为全面地介绍了虚拟化技术、Qemu-KVM、Libvirt、Virt-Manager、网络虚拟化、传统的存储技术（RAID、LVM、NFS、ISCSI）、常见的分布式存储（HDFS、GlusterFS、Lustre、MooseFS、Ceph）、Docker技术。除第1章外，每章都配有详细的实验案例，内容设计丰富，便于读者理解和掌握。,15,0,0,34.8,https://wfqqreader-1252317822.image.myqcloud.com/cover/982/30004982/s_30004982.jpg
Web安全漏洞原理及实战,2020-09-01 00:00:00,计算机-理论知识,本书主要介绍Web安全理论及实战应用，从Web安全基础入手，深入剖析Web安全漏洞的原理，并通过实战分析对Web安全漏洞的原理进行深度刻画，加深读者对Web安全漏洞原理的认识，进而帮读者全方位了解Web安全漏洞原理的本质。本书以独特的角度对Web安全漏洞的原理进行刻画，使读者能融会贯通、举一反三。本书主要面向高校计算机专业、信息安全专业、网络空间安全专业的学生及热爱网络安全的读者。,17,0,0,36.6,https://wfqqreader-1252317822.image.myqcloud.com/cover/231/33281231/s_33281231.jpg
软硬件融合：超大规模云计算架构创新之路,2021-05-01 00:00:00,计算机-理论知识,物联网、大数据以及人工智能等新兴技术，推动着云计算持续快速发展，底层硬件越来越无法满足上层软件的发展和迭代。本书通过探寻软硬件的技术本质，寻找能够结合软件灵活性和硬件高效性的解决方法。帮助有软件背景的读者更深刻地认识硬件，加深对软硬件之间联系的理解，并且更好地驾驭硬件；同时也帮助有硬件背景的读者，有一个更全面的视角，更加宏观地看待问题，理解需求、产品、系统、架构等多方面问题的权衡。本书共9章内容：第1章介绍了云计算面临的底层技术挑战，接着第2、3章介绍了软硬件相关的概念和计算机基础知识，并引出了软硬件融合的概念。第4~7章分别介绍了软硬件融合的四类技术：软硬件接口、算法加速和任务卸载、虚拟化的硬件加速、异构计算。第8章介绍应用这些技术的综合案例。第9章则是具体实现方面的思考。本书立意新颖，结合业界最新案例，内容从浅入深，并且展望未来。帮助广大互联网及IT行业的软硬件工程师，更好地理解软件、硬件以及软硬件之间的内在联系，也可以作为计算机相关专业本科高年级以及研究生的技术拓展读物。,18,0,0,62.3,https://wfqqreader-1252317822.image.myqcloud.com/cover/713/38209713/s_38209713.jpg
51单片机逆向学习实战教程（电子设计与嵌入式开发实践丛书）,2016-07-01 00:00:00,计算机-理论知识,本书根据作者学习单片机的经验和笔记整理而成，从实战出发，以制作简易信号发生器为主线，以学习51单片机为目的。从点亮一个发光二极管开始，到显示、输出一个完整的波形，逐步引导读者进行思考、尝试、犯错、修正以及优化，最终不仅学会51单片机，更掌握学习的方法，在使用其他单片机时快速入门。本书共分3个部分。第1部分是对单片机的初步介绍和学习前的准备工作；第2部分是学习单片机，并制作简易信号发生器的过程，同时在里面添加了关于电源的内容；第3部分注重能力的提升，讲解了一些常用器件的使用方法，以及在遇到问题时该如何求助，向谁求助。本书可作为自动化、电子信息科学与技术、智能仪器、电子技术、机电一体化和物联网等相关专业高年级本科生学习单片机时的入门教材，也可作为单片机爱好者的学习手册。,10,0,0,34.3,https://wfqqreader-1252317822.image.myqcloud.com/cover/130/27111130/s_27111130.jpg
OptiStruct结构分析与工程应用,2021-08-16 00:00:00,计算机-理论知识,《OptiStruct结构分析与工程应用》共28章，主要介绍了OptiStruct的线性分析、非线性分析、频率响应分析、动力学分析、复合材料分析、疲劳分析、热传导分析等功能。线性分析有常用的线性静力学分析、模态分析、线性屈曲分析、惯性释放分析等;非线性分析有材料非线性分析、几何非线性分析、接触非线性分析等；疲劳分析有高周、低周、焊接、振动等。全书在简要讲解相关理论的基础上，较全面地阐述了OptiStruct各结构分析功能模块的使用方法，并包含丰富的航空航天、汽车等行业的工程应用实例。《OptiStruct结构分析与工程应用》可作为机械、汽车、航空航天、船舶、军工、电子及家电等相关行业工程技术人员的自学或参考用书，也可作为理工院校相关专业师生的教学用书。,52,0,0,99.9,https://wfqqreader-1252317822.image.myqcloud.com/cover/690/41398690/s_41398690.jpg
CATIA V5R21中文版基础教程,2013-12-01 00:00:00,计算机-理论知识,《CATIA V5R21中文版基础教程》以手把手的教学模式，详细讲解CATIA V5R21软件的机械设计基础与制图技巧，内容丰富、讲解细致。从机械与产品设计的初始设置，到完成设计的整个流程进行讲解，前后呼应，内容搭配合理。,87,0,0,29.88,https://wfqqreader-1252317822.image.myqcloud.com/cover/168/730168/s_730168.jpg
数字信号处理及MATLAB实现,2021-08-31 00:00:00,计算机-理论知识,本书内容深入浅出，每章基本按照“理论知识—例题讲解—案例分析”的模式编写，突出理论知识指导实际应用。为便于读者快速掌握数字信号处理的实践能力，很多例题给出了MATLAB源码，并提供这些源码的下载资源，读者可直接粘贴在MATLAB命令窗口，观看运行结果。同时，书中提供了大量经过精心设计的习题，帮助读者掌握课程内容。本书可作为普通高等学校电子信息类专业和相近专业的本科生或专科生教材，也可供相关专业的技术人员参考。本书配套有免费教学课件PPT、教案和教学大纲，欢迎选用本书做教材的老师登录www.cmpedu.com下载或发邮件到lixiaoping91142@163.com索要。,21,0,0,46.9,https://wfqqreader-1252317822.image.myqcloud.com/cover/677/41398677/s_41398677.jpg
