title,publishTime,category,intro,maxFreeChapter,newRating,free,price,cover
云计算安全实践：从入门到精通,2021-07-01 00:00:00,计算机-理论知识,本书将云计算安全能力建设对应到NISTCSF中，从云计算安全能力建设的角度由浅入深地总结云计算安全产业实践的基本常识、云安全能力构建的基础实验与云计算产业安全综合实践。在简单介绍基本原理的基础上，以云计算应用安全能力建设为主，重点介绍在云安全能力建设中的典型案例与实验。其中实验部分又分为基础篇、提高篇和综合篇，通过动手实验可以让你快速学习基本的安全策略、安全功能、安全服务及最佳实践，深度体验云上安全能力的建设设计与实现，最终完成自定义安全集成和综合安全架构的设计与实现。,22,0,0,103.6,https://wfqqreader-1252317822.image.myqcloud.com/cover/807/40107807/s_40107807.jpg
物联网安全与隐私保护,2020-09-01 00:00:00,计算机-理论知识,本书从物联网的安全需求出发，参照物联网工程专业规范与国家标准要求，深入浅出地阐述了物联网安全与隐私保护的技术内涵、体系架构、关键技术，涵盖物联网感知安全、物联网数据安全、物联网接入安全、物联网系统安全与物联网隐私保护等诸多内容。通过学习上述内容，读者可以强化自己对物联网安全与隐私保护技术的“认知”“理解”以及“实践”。本书可作为普通高等院校物联网工程、计算机科学与技术、信息安全、网络工程等专业的“物联网信息安全”“网络与信息安全”“物联网安全与隐私保护”等课程的教材，也可作为网络工程师、信息安全工程师、计算机工程师、物联网工程师、网络安全用户以及互联网爱好者的学习参考用书或培训教材。,20,0,0,30.9,https://wfqqreader-1252317822.image.myqcloud.com/cover/604/33783604/s_33783604.jpg
网络安全技术及应用（第3版）,2020-08-27 00:00:00,计算机-理论知识,《网络安全技术及应用第3版》主要内容包括：网络安全基础、网络安全技术基础、网络安全体系及管理、黑客攻防与检测防御、密码与加密技术、身份认证与访问控制、计算机及手机病毒防范、防火墙应用技术、操作系统及站点安全、数据库及数据安全、电子商务安全、网络安全新技术及解决方案等。包括“攻（攻击）、防（防范）、测（检测）、控（控制）、管（管理）、评（评估）”等多方面的基本理论和实用技术。《网络安全技术及应用第3版》为“十三五”国家重点出版物出版规划项目暨上海市普通高校精品课程特色教材，体现“教、学、练、做、用一体化和立体化”，突出“实用、特色、新颖、操作性”。《网络安全技术及应用第3版》由上海市高校精品课程网站提供多媒体课件、动画视频、教学大纲及教案、同步实验，以及课程设计指导及练习等资源，并有配套的学习与实践指导。《网络安全技术及应用第3版》可作为高等院校计算机类、信息类、电子商务类、工程和管理类专业的网络安全相关课程的教材，也可作为培训及参考用书。高职院校可对“*”内容选用。《网络安全技术及应用第3版》配套授课电子课件，需要的教师可登录www.cmpedu.com免费注册，审核通过后下载，或联系编辑索取。QQ：2850823885，电话：010-88379739。,32,0,0,39.99,https://wfqqreader-1252317822.image.myqcloud.com/cover/879/33892879/s_33892879.jpg
网络安全态势感知,2020-09-01 00:00:00,计算机-理论知识,本书首先介绍网络安全态势感知的研究背景， 阐述网络安全态势感知系统的功能结构和关键技术， 然后基于资产、漏洞、威胁三个维度， 阐述网络安全态势感知的数据采集、认知模型、本体模型、网络安全度量指标体系、评估方法、态势预测和攻击溯源等技术，最后讲解网络安全态势可视化技术。本书具有前瞻性、理论性和实践性， 适合网络安全领域的研究、教学以及开发人员阅读。,20,0,0,89.6,https://wfqqreader-1252317822.image.myqcloud.com/cover/610/34171610/s_34171610.jpg
VRML虚拟现实应用技术,2010-08-01 00:00:00,计算机-理论知识,本书系统地介绍了虚拟现实建模语言(VRML)的基础知识、各节点详细的使用方法和应用，并给出了大量实例。全书共分为8章，分别介绍了虚拟现实概述、虚拟现实软件及三维立体造型、造型的其他相关操作、虚拟现实环境设计、动画效果与交互节点、虚拟现实的高级应用、虚拟现实与MATLAB接口应用、VRML脚本语言与编程等内容。,39,0,0,18,https://wfqqreader-1252317822.image.myqcloud.com/cover/952/687952/s_687952.jpg
C语言程序设计与项目实践,2011-06-01 00:00:00,计算机-理论知识,本书一共分为两个部分，共14章，其中第1章到第9章为第一部分，第1章介绍了C语言开发的基本环境和工具，第2章到第9章介绍了C语言中的一些常见的基本问题的处理方法，包括数据问题、运算问题、数学问题、实际问题、文件管理、图形处理、链表和输入输出以及鼠标声音等的处理，第2部分为第10章到第14章，分别介绍了基本算法问题的实现；游戏程序的实现；棋牌类游戏程序的实现；管理系统的实现和一些其他的特殊问题的实现。,20,0,0,26,https://wfqqreader-1252317822.image.myqcloud.com/cover/968/680968/s_680968.jpg
走进新安全：读懂网络安全威胁、技术与新思想,2021-01-01 00:00:00,计算机-理论知识,本书从作者在网络安全产业研究中多年积累的实践经验出发，深入浅出地介绍网络安全领域的基础知识和发展现状。本书主要分为安全基础、安全建设和安全发展三部分，共9章，内容包括网络安全简史，网络威胁的形式与影响，网络安全常用的关键技术，现代网络安全观与方法论，网络安全体系的规划、建设与运营，网络安全实战攻防演习，网络安全人才培养，网络安全发展的热点方向，网络安全拓展阅读，以期帮助读者读懂网络安全威胁、技术与新思想。本书是一本面向企业管理人员和网络安全爱好者的网络安全科普读物，不涉及复杂的网络安全问题与技术细节，主要介绍网络安全相关现象、应用和特点。因此，读者无须具备通信、计算机或网络安全方面的专业知识，也可顺畅地阅读本书的大部分内容。,18,0,0,48.3,https://wfqqreader-1252317822.image.myqcloud.com/cover/682/35808682/s_35808682.jpg
程序员健康指南,2014-09-10 00:00:00,计算机-理论知识,众所周知，程序员工作压力大、无暇照顾自己，去健身房更是奢侈行为。颈椎病、手腕疼痛、干眼症等问题困扰着几乎所有程序员和长期伏案的工作人员。在久坐不动的室内工作中，在没有大块时间去健身的客观条件下，如何保持身体健康？本书在科学研究和实践的基础上，总结了一些简单易行的健康指导，帮助读者从周身病痛、病弱且极有可能脾气暴躁的黑客，蜕变为快乐、高效的程序员。 保持健康没有想象的那么难，更不需要放弃现在的生活。重构健康，从本书开始。,19,0,0,18,https://wfqqreader-1252317822.image.myqcloud.com/cover/885/26211885/s_26211885.jpg
中小型计算机网络设计、维护与管理,2009-01-01 00:00:00,计算机-理论知识,是一本专门为中小企业的网络管理员和网络工程师撰写的介绍计算机网络设计、维护与管理技术的参考书，其内容包括网络规划设计、综合布线、网络硬件设备、网络操作系统、搭建各种服务器、网络安全以及网络维护等实用技术。读者通过对本书的学习，可以掌握作为一个优秀的网络管理员所需要的各方面技能。,14,0,0,15.2,https://wfqqreader-1252317822.image.myqcloud.com/cover/578/657578/s_657578.jpg
防火墙技术与应用（第2版）,2021-01-30 00:00:00,计算机-理论知识,《防火墙技术与应用第2版》分为4篇，共10章内容，分别从技术原理和应用实践的角度，系统地介绍了防火墙的工作原理，开发与测试标准，防火墙开发基本技术，个人防火墙及商用防火墙的选购、部署及应用等内容，帮助读者构建系统化的知识和技术体系，培养正确应对网络安全问题的能力。《防火墙技术与应用第2版》紧跟防火墙技术动态，遵循国家标准，强化应用实践能力。全书提供了16个应用示例、22个例子、10张思维导图、100多道思考与实践题、10张学习目标自测表格以及大量的拓展阅读书目以供读者巩固知识与拓展应用。《防火墙技术与应用第2版》可以作为高等院校网络空间安全专业、信息安全专业等计算机类专业相关课程的教材，也可作为信息安全工程师、国家注册信息安全专业人员以及相关领域专业人员的参考书。,21,0,0,36.9,https://wfqqreader-1252317822.image.myqcloud.com/cover/999/40680999/s_40680999.jpg
新编计算机导论（基于计算思维）,2013-05-01 00:00:00,计算机-理论知识,本书从培养学生计算思维出发，介绍计算机专业主要课程体系和主要内容、基本关系和学习方法，同时包含当前IT领域的新知识、新技术和新产品。硬件系统在基本原理的基础上主要介绍实物构成。软件在基本方法的基础上介绍流行软件开发平台和方法。数据包括数值数据、字符汉字、图形、图像、声音、动画、视频、音乐等。把数值数据组织成数据结构，介绍常用操作方法。以多媒体组织内容和介绍其操作方法，操作系统从原理的角度理解常用功能。计算机网络原理和应用结合，数据库在介绍基本功能的基础上重点是开发和应用。,17,640,0,11.8,https://wfqqreader-1252317822.image.myqcloud.com/cover/111/657111/s_657111.jpg
Practical Mobile Forensics,2020-04-09 00:00:00,计算机-理论知识,"Mobile phone forensics is the science of retrieving data from a mobile phone under forensically sound conditions. This updated fourth edition of Practical Mobile Forensics delves into the concepts of mobile forensics and its importance in today&apos;s world.The book focuses on teaching you the latest forensic techniques to investigate mobile devices across various mobile platforms. You will learn forensic techniques for multiple OS versions, including iOS 11 to iOS 13, Android 8 to Android 10, and Windows 10. The book then takes you through the latest open source and commercial mobile forensic tools, enabling you to analyze and retrieve data effectively. From inspecting the device and retrieving data from the cloud, through to successfully documenting reports of your investigations, you&apos;ll explore new techniques while building on your practical knowledge. Toward the end, you will understand the reverse engineering of applications and ways to identify malware. Finally, the book guides you through parsing popular third-party applications, including Facebook and WhatsApp.By the end of this book, you will be proficient in various mobile forensic techniques to analyze and extract data from mobile devices with the help of open source solutions.",97,0,0,71.93,https://wfqqreader-1252317822.image.myqcloud.com/cover/164/36698164/s_36698164.jpg
让DB2跑得更快：DB2内部解析与性能优化,2013-10-01 00:00:00,计算机-理论知识,本书以优化为主题，根据数据库内部原理将DB2数据库对SQL语句及其他操作的内部机制进行详细剖析，并将RDS、DMS、IXM、BPS等DB2内部组件不为人知的一面展现给大家，以期做到数据库的调优过程知其然并知其所以然。同时本书结合响应时间与资源瓶颈两种性能问题的现象，对数据库调优的整体思路进行详细讲解，对原来老式的调优思路进行整理和改动，结合了DB2 V10.1版本的一些新的监控工具及特性，以一种全新的方式阐述DB2数据调优的基本思路及概况。,13,0,0,31.6,https://wfqqreader-1252317822.image.myqcloud.com/cover/180/656180/s_656180.jpg
计算机应用技术基础,2010-06-01 00:00:00,计算机-理论知识,本书内容包括计算机信息输入和编码、计算机硬件、计算机软件、文档处理、网络应用基础、多媒体基础、数据库技术、企业信息基础与应用。,7,0,0,11.6,https://wfqqreader-1252317822.image.myqcloud.com/cover/509/655509/s_655509.jpg
大学计算机：计算思维导学,2018-08-01 00:00:00,计算机-理论知识,本书采用对比联想式、场景理解与模拟、习练式的方式，旨在提高学生理解程序执行、理解复杂系统计算思想的能力。全书分为10章，内容包括什么是计算思维，计算思维基础：0和1与逻辑，计算思维基础：0和1与机器程序，机器程序的执行，程序构造是一种计算思维，程序的基本构造手段：递归与迭代，程序编写：计算思维与计算机语言，理解复杂计算环境：计算思维与管理维等。,20,0,0,30.9,https://wfqqreader-1252317822.image.myqcloud.com/cover/342/27112342/s_27112342.jpg
NTFS文件系统扇区存储探秘,2012-10-01 00:00:00,计算机-理论知识,"　　《NTFS文件系统扇区存储探秘》主要内容包括：介绍NTFS文件系统优越的性能特征；介绍作者为了探索NTFS文件系统的存储特点编写的21个WIN32工具程序；使用作者编写的WIN32工具程序，探秘NTFS文件系统的扇区存储规律。
　　全书分3篇，共计17章。第1章至第3章是“基础篇”，重点介绍了NTFS文件系统的性能和存储特点，同时也辅助性地介绍了FAT16和FAT32两种文件系统；第4章至第5章是“工具篇”，介绍了作者编写的工具程序；第6章至第17章是“探秘篇”，使用工具程序对NTFS文件系统的扇区存储规律进行了探索。
　　《NTFS文件系统扇区存储探秘》附送的光盘里收录了书中使用的全部工具程序，读者可以使用这些工具程序对硬盘扇区数据进行各种读写与分析。
　　《NTFS文件系统扇区存储探秘》可作为从事数据恢复和硬盘维修的技术人员参考用书，也可供研究文件系统和进行扇区数据分析的爱好者参考使用。",8,0,0,35.4,https://wfqqreader-1252317822.image.myqcloud.com/cover/294/731294/s_731294.jpg
Becoming the Hacker,2019-01-31 00:00:00,计算机-理论知识,"Becoming the Hacker will teach you how to approach web penetration testing with an attacker&apos;s mindset. While testing web applications for performance is common, the ever-changing threat landscape makes security testing much more difficult for the defender.There are many web application tools that claim to provide a complete survey and defense against potential threats, but they must be analyzed in line with the security needs of each web application or service. We must understand how an attacker approaches a web application and the implications of breaching its defenses.Through the first part of the book, Adrian Pruteanu walks you through commonly encountered vulnerabilities and how to take advantage of them to achieve your goal. The latter part of the book shifts gears and puts the newly learned techniques into practice, going over scenarios where the target may be a popular content management system or a containerized application and its network.Becoming the Hacker is a clear guide to web application security from an attacker&apos;s point of view, from which both sides can benefit.",27,0,0,73.02,https://wfqqreader-1252317822.image.myqcloud.com/cover/961/36698961/s_36698961.jpg
seo艺术（第3版）,2019-11-01 00:00:00,计算机-理论知识,在本书中，作者跟随最新的变化，简明扼要地讲解了所有高级搜索引擎优化（SEO）的策略，提供了先进、方便理解、充满技巧的知识。主要内容包括：探索SEO基本理念以及实践性，阐明社交媒体的角色、用户数据以及Google熊猫和企鹅的算法，发现追踪结果、测量成功、其他第三方工具，寻找移动化、本地化以及垂直领域SEO机会，创建一支有明确角色分配的SEO高效团队，以及描绘搜索引擎优化的未来。读完此书，你会更加了解搜索引擎的效用机制以及如何高效地优化你的网站。,47,0,0,149.69,https://wfqqreader-1252317822.image.myqcloud.com/cover/243/27741243/s_27741243.jpg
零基础学算法第2版,2012-03-26 00:00:00,计算机-理论知识,本书分为上、下两篇，共10章，上篇用5章的篇幅介绍了算法和数据结构的基础知识，包括基础算法思想、简单数据结构、复杂数据结构、排序和查找算法等内容；下篇用5章的篇幅介绍了用数据结构解决实际问题的相关程序，包括解决数学问题、数据结构问题、算法经典问题等内容以及信息学奥赛部分试题的程序，最后一章介绍了与算法和数据结构相关的常见面试题。,72,762,0,25,https://wfqqreader-1252317822.image.myqcloud.com/cover/15/603015/s_603015.jpg
云原生安全与DevOps保障,2020-04-01 00:00:00,计算机-理论知识,本书主要介绍了DevOps实践中最容易被忽视的一环——安全，并且对云原生服务的安全保障也做了全面的阐述。书中详细介绍了Web攻击防范、权限验证、日志监控、入侵检测、网络安全协议等老生常谈的话题在云原生基础设施上的变化。书中还提出了适应DevOps文化的持续安全、测试驱动安全、基础设施与流水线保证、轻量风险评估等颇具新意的观点和实践。本书通过一个Web应用示例展示了ZAP、pineapple、Hindsight、GRR、MIG、osquery和Suricata等工具的使用方法。本书最后总结了一份实施持续安全的三年路线图，指导组织全面提升安全实践和安全意识。本书适合DevOps实践者阅读，包括参与其中的安全工程师、软件开发人员、基础设施运维人员及项目管理人员等。,30,0,0,54,https://wfqqreader-1252317822.image.myqcloud.com/cover/573/39479573/s_39479573.jpg
CAXA CAD 2021电子图板与实体设计自学速成,2022-01-01 00:00:00,计算机-理论知识,本书结合具体实例由浅入深、从易到难地讲述了CAXA CAD 2021电子图板与实体设计知识的精髓，并详细讲解了CAXA CAD 2021电子图板与实体设计在工程设计中的应用。本书按知识结构分为两篇（共14章）。其中，第1篇主要介绍CAXA CAD电子图板2021的相关知识，包括CAXA CAD电子图板2021入门、系统设置与界面定制、绘图命令、图形编辑、辅助工具、块操作与库操作、工程标注与标注编辑、减速器二维设计综合实例等；第2篇主要讲解CAXA3D实体设计2021的相关知识，包括CAXA3D实体设计2021基础知识、二维截面的生成、实体特征的创建、实体特征的编辑、零件的定位及装配、减速器实体设计综合实例等。,29,0,0,63.9,https://wfqqreader-1252317822.image.myqcloud.com/cover/830/42681830/s_42681830.jpg
从实践中学习密码安全与防护,2021-06-01 00:00:00,计算机-理论知识,当前，大部分IT设备和服务都采用密码口令的方式进行用户身份认证。相应地，也出现了大量针对密码口令的攻击手段和实施工具。密码攻击是黑客攻击的重要手段，安全人员必须要熟悉这些手段和工具，才能有针对性地进行安全评估，做好各类防护措施。本书基于渗透测试的方式，详细介绍如何使用Kali Linux提供的工具模拟密码攻击，并给出防护措施。本书共12章，分为3篇。第1篇“准备工作”，主要涵盖信息搜集、密码分析、密码字典构建和哈希密码分析等内容；第2篇“服务密码攻击与防护”，主要涵盖网络嗅探、服务欺骗和暴力破解等内容；第3篇“非服务密码攻击与防护”，主要涵盖Windows密码、Linux密码、无线密码、文件密码和其他密码的攻击方式与防护措施。本书适合渗透测试人员、网络维护人员和信息安全爱好者阅读。通过阅读本书，读者可以系统地了解和掌握密码口令的应用范围，熟悉服务密码和非服务密码的破解方式以及相应的密码防护策略，从而保障网络信息的安全。,19,0,0,53.4,https://wfqqreader-1252317822.image.myqcloud.com/cover/97/38507097/s_38507097.jpg
End to End GUI Development with Qt5,2018-11-14 00:00:00,计算机-理论知识,"Qt 5.9 is an application development framework that provides a great user experience and develops full-capability applications with Qt Widgets, QML, and even Qt 3D. This learning path demonstrates the power and flexibility of the Qt framework for desktop application development and shows how you can write an application once and deploy it to multiple operating systems. It will address all the challenges while developing cross-platform applications with the Qt framework.This course will give you a better understanding of the Qt framework and tools to resolve serious issues such as linking, debugging, and multithreading. It will also upskill you by explaining how to create a to-do-style app and taking you through all the stages in building a successful project. You will build a suite of apps; while developing these apps, you’ll deepen your knowledge of Qt Quick's layout systems, and see Qt 3D and widgets in action. The next project will be in the industrial and agricultural sectors: making sense of sensor data via a monitoring system. Your apps should run seamlessly across devices and operating systems such as Android, iOS, Windows, or Mac, and be cost-effective by integrating with existing web technologies. You take the role of lead developer and prototype a monitoring system. In doing so, you’ll get to know Qt's Bluetooth and HTTP APIs, as well as the Charts and Web Engine UI modules. These projects will help you gain a holistic view of the Qt framework.",141,0,0,179.84,https://wfqqreader-1252317822.image.myqcloud.com/cover/196/36699196/s_36699196.jpg
计算思维与算法设计,2015-09-01 00:00:00,计算机-理论知识,本书以计算思维能力培养为主线，以算法设计为依托，以介绍计算机基础和算法设计为主要目标，主要内容包括计算与计算模型、计算机基础知识、算法设计、算法评测与分析、软件测试基础等。通过学习本书，学生可以了解与现代计算机相关的计算理论基础，了解算法设计与问题求解的关系，体会计算在现代生活中的重要性和普适性，进而为今后利用计算机解决专业问题打下良好基础。本书可作为高等院校计算机基础课程相关的教材，也可以作为计算机基础知识及算法设计培训、自学的参考用书。,13,0,0,15.5,https://wfqqreader-1252317822.image.myqcloud.com/cover/882/31151882/s_31151882.jpg
一本书读透金融科技安全,2021-04-01 00:00:00,计算机-理论知识,本书深入探讨了金融科技时代金融机构的安全管理常见现象、典型问题和应对策略、重点技术层面问题和策略、金融科技安全商业模式。全书通过案例结合理论的形式对法律要求和最佳实践进行深入阐述，并给出了应对典型问题相应策略、实操层面的解决方案等。本书分为三部分：第1部分（第1章），对金融科技时代的网络安全问题进行整体介绍；第二部分（第2~9章）介绍安全相关的策略、政策，包括安全的价值、安全生命周期管理、安全的用户体验、监管合规、业务安全、数据安全、移动安全等内容；第三部分（第0章）对相关威胁、政策、应对措施进行展望。,27,0,0,53.4,https://wfqqreader-1252317822.image.myqcloud.com/cover/671/37445671/s_37445671.jpg
初识量子计算,2020-10-01 00:00:00,计算机-理论知识,量子计算基于量子力学原理，描述的是非常小的粒子（原子和亚原子）的行为。由于这些粒子的运动方式，量子计算机的运算速度比传统计算机快很多。在过去的20年里，量子计算已经发展为物理学家、计算机科学家和电气工程师的主要研究领域。本书旨在对量子计算做简单的介绍，主要涵盖量子计算系统的概念及其工作方式，读者无须具备电气工程、计算机科学或物理学相关的高级专业知识。本书的主要目标是在无须关注过多数学细节的情况下以一种通俗易懂的方式呈现量子力学的内容。也就是说，本书不要求过多的高级知识储备，所有必要的预备知识都会在适当的位置提供给读者。,30,0,0,25,https://wfqqreader-1252317822.image.myqcloud.com/cover/491/38458491/s_38458491.jpg
Spring Security（Third Edition）,2017-11-28 00:00:00,计算机-理论知识,"This book is intended for Java Web and/or RESTful webservice developers and assumes a basic understanding of creating Java 8, Java Web and/or RESTful webservice applications, XML, and the Spring Framework. You are not expected to have any previous experience with Spring Security.",155,0,0,90.46,https://wfqqreader-1252317822.image.myqcloud.com/cover/477/36700477/s_36700477.jpg
