title,publishTime,category,intro,maxFreeChapter,newRating,free,price,cover
黑客攻防从入门到精通（黑客与反黑工具篇·全新升级版）,2018-01-01 00:00:00,计算机-理论知识,本书由浅入深、图文并茂地再现了网络入侵与防御的全过程，内容涵盖：黑客必备小工具、扫描与嗅探工具、注入工具、密码攻防工具、病毒攻防工具、木马攻防工具、网游与网吧攻防工具、黑客入侵检测工具、清理入侵痕迹工具、网络代理与追踪工具、局域网黑客工具、远程控制工具、QQ聊天工具、系统和数据的备份与恢复工具、系统安全防护工具等一些应用技巧，并通过一些综合应用案例，向读者讲解了黑客与反黑客工具多种应用的全面技术。,36,0,0,47.2,https://wfqqreader-1252317822.image.myqcloud.com/cover/491/33706491/s_33706491.jpg
新手学Creo Parametric 1.0工业设计,2013-03-01 00:00:00,计算机-理论知识,本书全部采用实例操作的方式，全面介绍了PTCCreo的所有知识点，内容涵盖了PTCCreo软件的基础操作、参数化草绘、自由曲面，工程图设计和产品装配等知识。全书共分为13章，每章内容中都以应用案例的方式进行讲解。通过对本书的学习，读者可以完全掌握PTCCreo软件的操作和应用，并能够进行相应的产品设计。,17,0,0,19.92,https://wfqqreader-1252317822.image.myqcloud.com/cover/798/773798/s_773798.jpg
Hands-On Spring Security 5 for Reactive Applications,2018-07-31 00:00:00,计算机-理论知识,"Security is one of the most vital concerns for any organization. The complexity of an application is compounded when you need to integrate security with existing code, new technology, and other frameworks. This book will show you how to effectively write Java code that is robust and easy to maintain.Hands-On Spring Security 5 for Reactive Applications starts with the essential concepts of reactive programming, Spring Framework, and Spring Security. You will then learn about a variety of authentication mechanisms and how to integrate them easily with the Spring MVC application. You will also understand how to achieve authorization in a Spring WebFlux application using Spring Security.You will be able to explore the security confgurations required to achieve OAuth2 for securing REST APIs and integrate security in microservices and serverless applications. This book will guide you in integrating add-ons that will add value to any Spring Security module.By the end of the book, you will be proficient at integrating Spring Security in your Java applications.",95,0,0,69.75,https://wfqqreader-1252317822.image.myqcloud.com/cover/594/36699594/s_36699594.jpg
计算机网络安全,2020-04-20 00:00:00,计算机-理论知识,《计算机网络安全》主要介绍计算机网络安全相关技术。全书共16章，分别讲述了网络安全概述、密码学简介、计算机网络模型、常用的网络服务与网络命令、网络扫描与网络监听、网络攻击技术、恶意代码与计算机病毒、计算机网络环境安全、防火墙技术、入侵检测技术、虚拟专用网技术、网络安全协议、Windows操作系统安全配置、网络信息安全风险评估、网络信息系统应急响应、网络安全前沿技术。书中包含大量图片与实例。《计算机网络安全》可作为信息安全、网络空间安全、计算机类、电子信息类专业的教材，也适合从事信息安全工作的专业技术人员或爱好者参考和使用。,33,0,0,39.99,https://wfqqreader-1252317822.image.myqcloud.com/cover/47/33893047/s_33893047.jpg
Altium Designer（Protel）原理图与PCB设计精讲教程,2017-03-01 00:00:00,计算机-理论知识,本书通过众多实例，由浅入深、从易到难地讲述了Altium Designer 16.0的知识精髄，使读者能快速掌握使用该软件进行设计的技巧。 本书按知识结构分为17章，主要包括Altium Designer 16.0概述、电路原理图设计基础、层次化原理图设计、电路原理图的后续处理、PCB设计基础、创建元器件库、PCB设计规则的设置、元器件封装的制作与管理、PCB元器件库的管理、信号完整性、原理图与PCB图的交互验证、PCB的后续处理、PCB的高级设计、电路仿真设计等内容，最后通过三个综合实例，详细介绍了使用Altium Designer 16.0的设计过程。 本书提供网络下载资源，内容包括书中所有实例的源文件和结果文件，以及实例操作过程的视频文件。 本书入门简单、层次清楚、内容翔实、图文并茂、由浅入深，不仅可用作本科、高职等院校相关专业的教材，而且也适合Altium Designer 16.0的初、中级学习者作为自学教材使用。,32,0,0,46.2,https://wfqqreader-1252317822.image.myqcloud.com/cover/986/26943986/s_26943986.jpg
从实践中学习Fiddler Web应用分析,2020-09-01 00:00:00,计算机-理论知识,Web应用是通过网络访问Web服务器的一类应用。这类应用使用HTTP和HTTPS协议进行数据传输，如网站和各类手机App。为了验证软件工作状态，开发人员、渗透测试人员、网络维护人员往往需要对其传输的数据进行分析验证。Fiddler是业内知名的HTTP/HTTPS调试工具。它不仅提供强大的HTTP代理和分析功能，还具备针对数据传输的双向调试功能。本书共10章，主要内容包括Fiddler基础知识、认识Sessino、捕获数据、Session过滤和搜索、HTTP请求、HTTP响应、缓存、Cookie、常见类型会话分析、修改会话。本书适合软件测试人员、网站开发人员、渗透测试、网络维护人员、信息安全爱好者阅读。通过本书，可以帮助读者了解和掌握HTTP数据传输特点和捕获会话方式，熟练分析HTTP会话各项内容，并掌握会话修改技巧，从而完成HTTP应用调试。,18,0,0,40,https://wfqqreader-1252317822.image.myqcloud.com/cover/508/33902508/s_33902508.jpg
网络攻防实战研究：MySQL数据库安全,2020-09-01 00:00:00,计算机-理论知识,数据库是信息系统的核心，存储着大量高价值的业务数据和客户信息，在众多黑客攻击案例中，数据库一直是黑客攻击的终极目标，因此，数据库攻防研究已经成为企事业单位网络安全工作的重点和难点。本书从MySQL渗透测试基础、MySQL手工注入分析与安全防范、MySQL工具注入分析与安全防范、MySQL注入Payload原理分析、phpMyAdmin漏洞利用分析与安全防范、MySQL高级漏洞利用分析与安全防范、MySQL提权漏洞分析与安全防范、MySQL安全加固八个方面，对MySQL数据库攻防技术进行全方位研究和分析，实用性强。,18,0,0,69.3,https://wfqqreader-1252317822.image.myqcloud.com/cover/600/34171600/s_34171600.jpg
ANSYS Workbench 17.0有限元分析从入门到精通,2017-04-01 00:00:00,计算机-理论知识,本书通过理论结合实践的讲解方式，全面、系统地介绍了ANSYS Workbench 17.0在有限元分析领域内的具体应用，涵盖了绝大部分用户需要使用的功能。本书按照从简单到复杂、从单场到多场分析的逻辑编排，每章均采用实例描述，内容完整且各章相对独立，是一本详细的ANSYS Workbench参考书。 全书共19章，详细介绍了创建几何模型、网格划分、结果后处理等基本操作，同时也结合工程案例详细讲解了线性静态结构分析、谐响应分析、响应谱分析、随机振动分析、瞬态动力学分析、显式动力学分析、热分析、线性屈曲分析、结构非线性分析、接触问题分析、优化设计、流体动力学分析、电磁场分析及多物理场耦合分析等。 本书工程实例丰富、讲解详尽，内容安排循序渐进、深入浅出，适合不同基础的读者。本书适合理工院校土木工程、机械工程、力学、电气工程等相关专业的本科生、研究生及教师使用，同时也可作为工程技术人员从事工程研究的参考书。,33,0,0,48.3,https://wfqqreader-1252317822.image.myqcloud.com/cover/888/26943888/s_26943888.jpg
Hands-On Penetration Testing on Windows,2018-07-30 00:00:00,计算机-理论知识,"Windows has always been the go-to platform for users around the globe to perform administration and ad hoc tasks, in settings that range from small offices to global enterprises, and this massive footprint makes securing Windows a unique challenge. This book will enable you to distinguish yourself to your clients.In this book, you'll learn advanced techniques to attack Windows environments from the indispensable toolkit that is Kali Linux. We'll work through core network hacking concepts and advanced Windows exploitation techniques, such as stack and heap overflows, precision heap spraying, and kernel exploitation, using coding principles that allow you to leverage powerful Python scripts and shellcode.We'll wrap up with post-exploitation strategies that enable you to go deeper and keep your access. Finally, we'll introduce kernel hacking fundamentals and fuzzing testing, so you can discover vulnerabilities and write custom exploits. By the end of this book, you'll be well-versed in identifying vulnerabilities within the Windows OS and developing the desired solutions for them.",109,0,0,78.47,https://wfqqreader-1252317822.image.myqcloud.com/cover/612/36699612/s_36699612.jpg
计算机操作系统固化嵌入式设计与实现,2016-05-01 00:00:00,计算机-理论知识,本书以固化操作系统、多媒体教室软件、系统保护卡三者整合成为一体的PCI卡作为开发项目，从项目的来源、设想入手，以实验为基础，翔实地论述了教学用计算机嵌入式系统软硬实例开发过程。根据本书研究内容，分成三个模块化渐进研究阶段，细分成7章论述，第1章绪论部分，对为什么编写本书做了说明。第2章研究内容概述，对研究内容和范围进行详细说明。第3章研究项目的实现理论分析，从项目开发研究内容出发，对应做哪些重要工作进行论述。从第4章到第6章，根据项目所实现的总体目标，突出重点进行分述。为方便撰写，提高可读性，以研究中要解决的关键问题为撰写点，结构简洁、清楚、明了。对基于固化操作系统的机房教学用计算机系统设计与实现进行试验、论证、分析、设计，突出研究的三个部分，一是固化操作系统，二是教学系统，三是保护系统，这三个部分形成三个相互联系的模块。第7章计算机应用嵌入式PCI卡实验分析设计，是综合了三个模块的功能在一块PCI卡上具体的实现过程，作为研究的综合阐述部分。最后通过后记，对全书主体研究工作进行总结。 本书可作为操作系统研究者的参考书，也可作为嵌入式系统开发的一个应用实例，供广大计算机爱好者应用。,13,0,0,20.3,https://wfqqreader-1252317822.image.myqcloud.com/cover/828/27110828/s_27110828.jpg
单片机应用技术项目教程（微课版）,2019-02-01 00:00:00,计算机-理论知识,本书基于应用最广泛、高速、低功耗、超强抗干扰的新一代8051单片机——STC系列单片机展开介绍，共设置有11个项目30个任务以及2个课程设计范例。采用“项目引导、任务驱动”的模式，突出“做中学”的基本理念。本书依据“任务驱动、做中学”的编写思路，每个任务均将相关知识和职业岗位基本技能结合在一起，把知识、技能的学习融入任务完成过程中。本书提供微课教学资源、单片机开发套件以及单片机典型应用项目，既可作为高职高专院校嵌入式技术与应用、物联网应用技术、智能控制技术、计算机应用技术、电子信息等相关专业单片机应用技术课程的教材，也可作为广大电子产品制作爱好者的自学用书。,15,0,0,37.2,https://wfqqreader-1252317822.image.myqcloud.com/cover/11/25916011/s_25916011.jpg
水射流技术及工程应用,2017-04-01 00:00:00,计算机-理论知识,本书对水射流技术的理论及其在机械工程中的应用做了较全面的论述。全书共分八章，第1章水射流技术概论，主要讲述水射流技术原理、水射流技术发展历程、国内外研究动态以及水射流技术的应用；第2章讲述纯水射流技术理论基础、系统组成、水射流结构特征与基本参数、水射流打击力模型和水射流冲击破坏理论；第3章讲述水射流打击力增强技术，包括减阻液水射流、空化水射流、脉冲水射流、磨料水射流等技术；第4章涉及磨料水射流切割技术，包括磨料水射流切割的一般特征、磨料水射流切割过程中的温度分布、磨料水射流切割工艺参数、磨料水射流切割理论等；第5章涉及磨料水射流精密切割控制技术，包括磨料水射流精密切割表面质量控制技术、磨料水射流精密切割几何精度控制、磨料水射流精密切割的运动控制和磨料水射流精密切割的优化处理技术等；第6章涉及磨料水射流精密特种加工技术，包括磨料水射流精密切割厚材料、磨料水射流精密钻孔加工、四轴联动精密切割加工异形零件、磨料水射流车削加工、磨料水射流铣削加工、磨料水射流超精密磨削加工和磨料水射流抛光技术等；第7章介绍了水射流技术在机械工程中的典型和创新应用；第8章介绍了水射流技术在军工和国防领域的应用。本书可以作为从事水射流技术研究、开发及其他相关工程技术人员的参考用书，也可以作为高等院校本科生、研究生开设相关课程的教学参考用书。,17,0,0,63.99,https://wfqqreader-1252317822.image.myqcloud.com/cover/714/29975714/s_29975714.jpg
AVR单片机很简单：C语言快速入门及开发实例,2017-04-01 00:00:00,计算机-理论知识,本书以ATmega128为蓝本，结合作者多年的技术开发和教学积累，透彻讲解了AVR单片机C语言开发必备的基础知识和实例、工具，全面系统地讲解主要包括AVR单片机的基础知识、硬件结构、各典型接口应用以及多个综合系统应用的设计和分析等。书中C语言编程基础介绍简明精炼，通俗易懂，大量典型的应用实例（如AVR单片机在串口通信、传感器、机床电气控制、嵌入式等的应用）可靠实用，帮助读者轻松入门并快速提高开发技能。本书可供单片机开发及电子爱好者、初学者、技术人员阅读，也可供电子相关专业师生参考。,18,0,0,63.99,https://wfqqreader-1252317822.image.myqcloud.com/cover/188/29975188/s_29975188.jpg
Real-World SRE,2018-08-31 00:00:00,计算机-理论知识,"Real-World SRE is the go-to survival guide for the software developer in the middle of catastrophic website failure. Site Reliability Engineering (SRE) has emerged on the frontline as businesses strive to maximize uptime. This book is a step-by-step framework to follow when your website is down and the countdown is on to fix it.Nat Welch has battle-hardened experience in reliability engineering at some of the biggest outage-sensitive companies on the internet. Arm yourself with his tried-and-tested methods for monitoring modern web services, setting up alerts, and evaluating your incident response.Real-World SRE goes beyond just reacting to disaster—uncover the tools and strategies needed to safely test and release software, plan for long-term growth, and foresee future bottlenecks. Real-World SRE gives you the capability to set up your own robust plan of action to see you through a company-wide website crisis.The final chapter of Real-World SRE is dedicated to acing SRE interviews, either in getting a first job or a valued promotion.",26,0,0,69.75,https://wfqqreader-1252317822.image.myqcloud.com/cover/442/36699442/s_36699442.jpg
Hands-On Bug Hunting for Penetration Testers,2018-09-12 00:00:00,计算机-理论知识,"Bug bounties have quickly become a critical part of the security economy. This book shows you how technical professionals with an interest in security can begin productively—and profitably—participating in bug bounty programs.You will learn about SQli, NoSQLi, XSS, XXE, and other forms of code injection. You’ll see how to create CSRF PoC HTML snippets, how to discover hidden content (and what to do with it once it’s found), and how to create the tools for automated pentesting workflows.Then, you’ll format all of this information within the context of a bug report that will have the greatest chance of earning you cash. With detailed walkthroughs that cover discovering, testing, and reporting vulnerabilities, this book is ideal for aspiring security professionals. You should come away from this work with the skills you need to not only find the bugs you're looking for, but also the best bug bounty programs to participate in, and how to grow your skills moving forward in freelance security research.",102,0,0,69.75,https://wfqqreader-1252317822.image.myqcloud.com/cover/440/36699440/s_36699440.jpg
Burp Suite Cookbook,2018-09-26 00:00:00,计算机-理论知识,"Burp Suite is a Java-based platform for testing the security of your web applications, and has been adopted widely by professional enterprise testers.The Burp Suite Cookbook contains recipes to tackle challenges in determining and exploring vulnerabilities in web applications. You will learn how to uncover security flaws with various test cases for complex environments. After you have configured Burp for your environment, you will use Burp tools such as Spider, Scanner, Intruder, Repeater, and Decoder, among others, to resolve specific problems faced by pentesters. You will also explore working with various modes of Burp and then perform operations on the web. Toward the end, you will cover recipes that target specific test scenarios and resolve them using best practices.By the end of the book, you will be up and running with deploying Burp for securing web applications.",90,0,0,78.47,https://wfqqreader-1252317822.image.myqcloud.com/cover/419/36699419/s_36699419.jpg
网络空间安全与关键信息基础设施安全,2020-10-01 00:00:00,计算机-理论知识,本书以关键信息基础设施为对象，讨论合规前提下的关键信息基础设施安全。本书共16章，主要内容包括：网络安全法、网络安全审查、网络安全等级保护、关键信息基础设施安全保护条例、网络安全等级保护条例、工业控制系统安全、工业互联网安全、个人信息安全、数据安全、密码安全、关键信息基础设施安全建设、关键信息基础设施安全事件管理、新基建安全等法律法规标准规范，从基本概念、作用地位、合规要求解读和合规安全建设角度剖析关键信息基础设施安全。本书主要面向关键信息基础设施主管部门、运营部门、建设使用部门学习国家系列法律法规和政策的人员；面向关键信息基础设施提供网络产品和服务的人员；面向网络安全相关部门开展监督管理、执法检查和安全规划建设工作的人员；也可供网络安全管理人员，网络安全专业人员，网络安全服务人员以及网络空间安全专业本科生等使用。,25,0,0,48.3,https://wfqqreader-1252317822.image.myqcloud.com/cover/495/34667495/s_34667495.jpg
ANSYS Workbench基础教程与工程分析详解,2017-07-01 00:00:00,计算机-理论知识,本书以ANSYS Workbench 14.5软件为操作平台，结合三维软件的建模配合对大量的案例进行分析，详细介绍了该软件的工作流程与工程应用，阐述了14.5版本增加的新功能，大大提升了在复杂系统与多物理场中综合仿真的能力。全书共11章，主要内容有ANSYS Workbench背景概述、线性静力学结构分析、动力学分析、显式动力学分析、屈曲分析、结构非线性分析、疲劳分析、电磁场分析、流体动力学分析及Workbench多物理耦合分析。随着ANSYS版本的不断升级，在Workbench界面下进行多物理场耦合分析的功能和操作的易用性都在不断增强，分析精度不断提升。 　　本书实例分析丰富，操作步骤介绍详细，主要以案例讲解为主，同时也有基础理论的引导，使读者能够在理解的基础上完成案例的操作分析，也能掌握实际工程应用中问题的分析方法及思路。 　　本书可供建筑、交通车辆、机械、土木、电气工程、航空航天、工程力学等专业的本科生、研究生以及相关专业的教师使用，同时也可为从事相关工作的仿真分析人员提供参考。,16,0,0,48.3,https://wfqqreader-1252317822.image.myqcloud.com/cover/643/26943643/s_26943643.jpg
Wireshark 2 Quick Start Guide,2018-06-27 00:00:00,计算机-理论知识,"Wireshark is an open source protocol analyser, commonly used among the network and security professionals. Currently being developed and maintained by volunteer contributions of networking experts from all over the globe. Wireshark is mainly used to analyze network traffic, analyse network issues, analyse protocol behaviour, etc. - it lets you see what&apos;s going on in your network at a granular level. This book takes you from the basics of the Wireshark environment to detecting and resolving network anomalies.This book will start from the basics of setting up your Wireshark environment and will walk you through the fundamentals of networking and packet analysis. As you make your way through the chapters, you will discover different ways to analyse network traffic through creation and usage of filters and statistical features. You will look at network security packet analysis, command-line utilities, and other advanced tools that will come in handy when working with day-to-day network operations.By the end of this book, you have enough skill with Wireshark 2 to overcome real-world network challenges.",32,0,0,50.13,https://wfqqreader-1252317822.image.myqcloud.com/cover/753/36699753/s_36699753.jpg
Binary Analysis Cookbook,2019-09-20 00:00:00,计算机-理论知识,"Binary analysis is the process of examining a binary program to determine information security actions. It is a complex, constantly evolving, and challenging topic that crosses over into several domains of information technology and security. This binary analysis book is designed to help you get started with the basics, before gradually advancing to challenging topics. Using a recipe-based approach, this book guides you through building a lab of virtual machines and installing tools to analyze binaries effectively. You&apos;ll begin by learning about the IA32 and ELF32 as well as IA64 and ELF64 specifications. The book will then guide you in developing a methodology and exploring a variety of tools for Linux binary analysis. As you advance, you&apos;ll learn how to analyze malicious 32-bit and 64-bit binaries and identify vulnerabilities. You&apos;ll even examine obfuscation and anti-analysis techniques, analyze polymorphed malicious binaries, and get a high-level overview of dynamic taint analysis and binary instrumentation concepts. By the end of the book, you&apos;ll have gained comprehensive insights into binary analysis concepts and have developed the foundational skills to confidently delve into the realm of binary analysis.",123,0,0,63.21,https://wfqqreader-1252317822.image.myqcloud.com/cover/434/36698434/s_36698434.jpg
Learn Computer Forensics,2020-04-30 00:00:00,计算机-理论知识,"A computer forensics investigator must possess a variety of skills, including the ability to answer legal questions, gather and document evidence, and prepare for an investigation. This book will help you get up and running with using digital forensic tools and techniques to investigate cybercrimes successfully. Starting with an overview of forensics and all the open source and commercial tools needed to get the job done, you&apos;ll learn core forensic practices for searching databases and analyzing data over networks, personal devices, and web applications. You&apos;ll then learn how to acquire valuable information from different places, such as filesystems, e-mails, browser histories, and search queries, and capture data remotely. As you advance, this book will guide you through implementing forensic techniques on multiple platforms, such as Windows, Linux, and macOS, to demonstrate how to recover valuable information as evidence. Finally, you&apos;ll get to grips with presenting your findings efficiently in judicial or administrative proceedings. By the end of this book, you&apos;ll have developed a clear understanding of how to acquire, analyze, and present digital evidence like a proficient computer forensics investigator.",36,0,0,63.21,https://wfqqreader-1252317822.image.myqcloud.com/cover/132/36698132/s_36698132.jpg
