title,publishTime,category,intro,maxFreeChapter,newRating,free,price,cover
计算机是怎样跑起来的,2015-05-01 00:00:00,计算机-理论知识,本书倡导在计算机迅速发展、技术不断革新的今天，回归到计算机的基础知识上。通过探究计算机的本质，提升工程师对计算机的兴趣，在面对复杂的最新技术时，能够迅速掌握其要点并灵活运用。本书以图配文，以计算机的三大原则为开端、相继介绍了计算机的结构、手工汇编、程序流程、算法、数据结构、面向对象编程、数据库、TCP/IP 网络、数据加密、XML、计算机系统开发以及SE 的相关知识。图文并茂，通俗易懂，非常适合计算机爱好者和相关从业人员阅读。,17,725,0,29.9,https://wfqqreader-1252317822.image.myqcloud.com/cover/760/907760/s_907760.jpg
Kubernetes权威指南：从Docker到Kubernetes实践全接触（第4版）,2019-05-01 00:00:00,计算机-理论知识,Kubernetes是由谷歌开源的Docker容器集群管理系统，为容器化的应用提供了资源调度、部署运行、服务发现、扩容及缩容等一整套功能。本书从架构师、开发人员和运维人员的角度，阐述了Kubernetes的基本概念、实践指南、核心原理、开发指导、运维指南、新特性演进等内容，图文并茂、内容丰富、由浅入深、讲解全面；并围绕在生产环境中可能出现的问题，给出了大量的典型案例，比如安全配置方案、网络方案、共享存储方案、高可用方案及TroubleShooting技巧等，有很强的实战指导意义。本书内容随着Kubernetes的版本更新不断完善，目前涵盖了Kubernetes从1.0到1.14版本的主要特性，努力为Kubernetes用户提供全方位的Kubernetes技术指南。本书源码已上传至GitHub的kubeguide/K8sDefinitiveGuide-V4-Sourcecode目录，可自行下载本书源码进行练习。无论是对于软件工程师、测试工程师、运维工程师、软件架构师、技术经理，还是对于资深IT人士，本书都极具参考价值。,29,821,0,117.6,https://wfqqreader-1252317822.image.myqcloud.com/cover/916/26297916/s_26297916.jpg
Linux系统命令及Shell脚本实践指南,2015-01-01 00:00:00,计算机-理论知识,《Linux系统命令及Shell脚本实践指南》由浅入深、全面、系统地介绍了Linux系统的基础命令和Shell脚本的开发。作为一本面向Linux入门用户的书籍，本书力求语言通俗易懂，用例简单明了，便于读者阅读领会。同时，全书穿插了不少要求读者动手实践的内容，不但可加深读者对内容的理解和消化，同时也可通过动手实践激发读者对Linux系统和Shell编程的兴趣，从而更好地驱动读者学习。共计18章，从知识结构上分为三部分。第一部分为前8章，全面介绍了Linux的基础知识和常用命令；第二部分为第9章和第10章，主要是Linux下交互和非交互编辑器的使用；第三部分为第11～18章，主要是Shell脚本开发。这三部分内容各有偏重，读者可以根据实际需要选择阅读。,38,719,0,25,https://wfqqreader-1252317822.image.myqcloud.com/cover/934/621934/s_621934.jpg
普林斯顿计算机公开课,2018-03-01 00:00:00,计算机-理论知识,从1999年开始，作者在普林斯顿大学开设了一门名叫“我们世界中的计算机”的课程（COS 109：Computers in Our World），这门课是向非计算机专业的学生介绍计算机基本常识的，多年来大受学生追捧。除了向学生讲解计算机理论知识，这门课还有相应的实验课——学生可以试着用流行的编程语言写几行代码，大家一起讨论苹果、谷歌和微软的技术如何渗入日常生活的每个角落。本书就是以这门课程的讲义为主要内容重新编写而成，它解释了计算机和通信系统的工作原理，并讨论了新技术带来的社会、政治和法律问题。,30,856,0,30,https://wfqqreader-1252317822.image.myqcloud.com/cover/474/26677474/s_26677474.jpg
CPU通识课,2022-01-01 00:00:00,计算机-理论知识,中央处理器（CPU）是计算机中最重要的芯片。CPU的设计和制造水平是一个国家信息技术实力的象征，产业生态的构建需要培养更多掌握CPU技术原理的高端人才。本书基于龙芯CPU团队在20年间积累的技术和经验，从CPU概览篇、CPU术语篇、CPU原理篇、CPU生产制造篇、CPU生态篇、CPU家族篇、中国CPU篇等七大板块剖析CPU，生动有趣地讲解CPU的基础概念、核心原理、生产制造及产业生态，更解读了龙芯CPU的研发历史、核心特色和生态建设经验，让读者循序渐进地进入CPU的殿堂。,12,935,0,51.5,https://wfqqreader-1252317822.image.myqcloud.com/cover/597/43134597/s_43134597.jpg
深入浅出Vue.js,2019-03-01 00:00:00,计算机-理论知识,本书从源码层面分析了Vue.js。首先，简要介绍了Vue.js；然后详细讲解了其内部核心技术“变化侦测”，这里带领大家从0到1实现一个简单的“变化侦测”系统；接着详细介绍了虚拟DOM技术，其中包括虚拟DOM的原理及其patching算法；紧接着详细讨论了模板编译技术，其中包括模板解析器的实现原理、优化器的原理以及代码生成器的原理；最后详细介绍了其整体架构以及提供给我们使用的各种API的内部原理，同时还介绍了生命周期、错误处理、指令系统与模板过滤器等功能的原理。 本书适合前端开发人员阅读。,9,835,0,39.5,https://wfqqreader-1252317822.image.myqcloud.com/cover/761/37683761/s_37683761.jpg
嵌入式C语言自我修养：从芯片、编译器到操作系统,2021-04-01 00:00:00,计算机-理论知识,这是一本专门为嵌入式读者打造的C语言进阶学习图书。本书的学习重点不再是C语言的基本语法，而是和嵌入式、C语言相关的一系列知识。作者以C语言为切入点，分别探讨了嵌入式开发所需要的诸多核心理论和技能，力图帮助读者从零搭建嵌入式开发所需要的完整知识体系和技能树。本书从底层CPU的制造流程和工作原理开始讲起，到计算机体系结构，C程序的反汇编分析，程序的编译、运行和重定位，程序运行时的堆栈内存动态变化，GNU C编译器的扩展语法，指针的灵活使用，C语言的面向对象编程思想，C语言的模块化编程思想，C语言的多任务编程思想，进程、线程和协程的概念，从底层到上层，从芯片、硬件到软件、框架，几乎涵盖了嵌入式开发的所有知识点。,31,914,0,82.6,https://wfqqreader-1252317822.image.myqcloud.com/cover/248/37669248/s_37669248.jpg
白帽子讲Web安全（纪念版）,2014-06-01 00:00:00,计算机-理论知识,本书根据安全宝副总裁吴翰清之前在互联网公司若干年的实际工作经验而写成，在解决方案上具有极强的可操作性；深入分析诸多错误的方法及误区，对安全工作者有很好的参考价值；对安全开发流程与运营的介绍，同样具有深刻的行业指导意义。《纪念版》与前版内容相同，仅为纪念原作以多种语言在全球发行的特殊版本，请读者按需选用。,7,833,0,27.6,https://wfqqreader-1252317822.image.myqcloud.com/cover/273/851273/s_851273.jpg
性能之巅：洞悉系统、企业与云计算,2015-08-01 00:00:00,计算机-理论知识,大型网络、云计算、大数据和虚拟计算机系统的快速部署已经为性能优化带来了新的挑战。本书为此提供了解决方案。国际知名的性能优化专家Brendan Gregg汇集了最先进的技术和工具来分析调优大型网络或云计算的环境。本书的内容包括现代化的性能分析和容量规划；与云计算相关的新性能和可靠性挑战；方法、概念、术语、工具和指标；负载与结构问题的权衡；调整操作系统、CPU、内存、文件系统、磁盘、网络和总线；调整虚拟系统；性能相关的编程语言问题，对C、 C++、 Java和node.js编写的应用程序分析。,41,851,0,25.6,https://wfqqreader-1252317822.image.myqcloud.com/cover/25/33381025/s_33381025.jpg
简约至上：交互式设计四策略,2011-01-01 00:00:00,计算机-理论知识,国际知名交互式设计专家力作，UI设计经典教程，从策略看设计心理学，经典的产品经理沉思录！本书介绍交互式设计的技术与技巧，讲述如何从目标用户的需求和期望出发，结合人类本身的心理特征和行为特点，用最简单的方法创建易用、有效而且让用户愉悦的设计。书中阐释了合理删除、分层组织、适时隐藏和巧妙转移这四个令交互式设计成果最大程度简单易用的策略。本书适合Web应用、互联网产品、移动应用及其他交互设计人员阅读。,12,759,0,12,https://wfqqreader-1252317822.image.myqcloud.com/cover/772/907772/s_907772.jpg
计算机：一部历史,2015-03-01 00:00:00,计算机-理论知识,"    《计算机：一部历史》，给大众读者写的计算机科普读物，零门槛入门计算机科学。讲述计算机背后鲜为人知的故事，普及关于计算机和互联网，你不得不了解的知识。在过去数十年里，除非你一直与世隔绝，否则就不可能不受到信息革命的影响。我们身处技术演进史上的计算机时代，无论你是计算机和互联网的拥护者、反对者还是旁观者，无论你是否具备计算机专业背景，只要你使用计算机，这本书就是你的案头必备。
",3,733,0,18,https://wfqqreader-1252317822.image.myqcloud.com/cover/751/717751/s_717751.jpg
爱上单片机（第4版）,2018-08-01 00:00:00,计算机-理论知识,本书是一本生动、有趣的单片机入门书籍。全书摆脱教科书式的刻板模式和枯燥叙述方式，用诙谐的语言、生动的故事、直观的实物照片和详尽的制作项目，让读者在轻松、愉快的氛围中学习单片机知识。书中的内容从单片机的创新制作实例开始，为读者提供了单片机硬件设计、软件编程和行业发展等方面的实用入门信息，并以亲切的问答形式为读者深入学习单片机提供了有益的建议。本书适合刚刚接触单片机的初学者自学阅读，又可作为各类院校电子技术相关专业师生的教学辅导手册，同时对电子行业的从业技术人员也有一定的参考价值。,13,896,0,83.4,https://wfqqreader-1252317822.image.myqcloud.com/cover/927/24981927/s_24981927.jpg
大型网站技术架构,2013-09-01 00:00:00,计算机-理论知识,本书通过梳理大型网站技术发展历程，剖析大型网站技术架构模式，深入讲述大型互联网架构设计的核心原理，并通过一组典型网站技术架构设计案例，为读者呈现一幅包括技术选型、架构设计、性能优化、Web安全、系统发布、运维监控等在内的大型网站开发全景视图。,15,785,0,23.6,https://wfqqreader-1252317822.image.myqcloud.com/cover/202/773202/s_773202.jpg
黑客攻防技术宝典：Web实战篇(第2版),2012-07-03 00:00:00,计算机-理论知识,本书是探索和研究Web 应用程序安全漏洞的实践指南。作者利用大量的实际案例和示例代码，详细介绍了各类Web 应用程序的弱点，并深入阐述了如何针对Web 应用程序进行具体的渗透测试。本书从介绍当前Web 应用程序安全概况开始，重点讨论渗透测试时使用的详细步骤和技巧，最后总结书中涵盖的主题。每章后还附有习题，便于读者巩固所学内容。第2 版新增了Web 应用程序安全领域近年来的发展变化新情况，并以尝试访问的链接形式提供了几百个互动式“漏洞实验室”，便于读者迅速掌握各种攻防知识与技能。本书适合各层次计算机安全人士和Web 开发与管理领域的技术人员阅读。,23,944,0,50,https://wfqqreader-1252317822.image.myqcloud.com/cover/899/26211899/s_26211899.jpg
计算机组成原理教程,2013-09-01 00:00:00,计算机-理论知识,计算机硬件组成包括运算器、控制器、存储器、输入设备和输出设备五大部件，《计算机组成原理教程/应用型本科信息大类专业“十二五”规划教材·21世纪普通高等教育优秀教材》即围绕这五大部件展开讨论。全书共分9章：第1章为计算机系统概论；第2章为计算机中的数制及编码；第3章为总线系统；第4章为中央处理器；第5章为指令系统；第6章为运算方法和运算器；第7章为存储器系统及其层次结构；第8章为输入输出系统；第9章为计算机外部设备。,17,719,0,11.4,https://wfqqreader-1252317822.image.myqcloud.com/cover/706/819706/s_819706.jpg
程序员的自我修养,2017-05-01 00:00:00,计算机-理论知识,程序员作为一个职业、也作为一个群体，正逐渐从幕后走向前台，并以他们自己的能力加速改变着世界，也改变着人们生活的方方面面。然而，对于程序员，特别是年轻程序员们来说，如何理解自己的职业与发展，如何看待自己的工作与生活，这些问题往往比那些摆在面前的技术难题更让他们难以解答。这本书从一个成熟程序员、一名IT管理者的角度，以杂记的形式为大家分享关于国内程序员职业生涯、个人发展、编程中的实践与认知乃至自学设计等方面的经验方法与思考感悟。其中每一篇文章都涉及一个与程序员息息相关的话题，无论你是即将走上程序员岗位的在校大学生，是刚刚成为程序员的职场新人，还是有一定经验的程序员，这本书都会给你带来启发。,12,580,0,31.85,https://wfqqreader-1252317822.image.myqcloud.com/cover/691/920691/s_920691.jpg
数据安全架构设计与实战,2019-09-01 00:00:00,计算机-理论知识,在互联网和新兴技术高速发展的今天，数据信息充斥在各行各业中，并发挥着重要的作用。然而，在享受信息化时代带来便利的同时，数据安全问题也成为大家关注的焦点。无论是从toG、toB、toC的各业务场景来看，还是从网络安全（CyberSecurity）的架构来看，数据安全（DataSecurity）都是一个主要的组成部分，而且在新兴技术日新月异的数据时代变得越来越重要，范围也越来越大。,10,807,0,60,https://wfqqreader-1252317822.image.myqcloud.com/cover/676/26785676/s_26785676.jpg
HBase原理与实践,2019-08-01 00:00:00,计算机-理论知识,HBase项目自2006年提交第一行代码以来，经历了13年的蓬勃发展。现在已经有大量企业采用HBase来存储和分析飞速增长的业务数据。从全球范围来看，国内HBase的关注度更是高居榜首，这得益于国内互联网、移动互联网、物联网等领域庞大的数据体量。诸多国内大型科技公司，如阿里巴巴、小米、腾讯、网易、华为、滴滴、快手、中国移动等，都已经把HBase作为极重要的基础设施，很多公司对HBase社区也有长期的投入。截至2019年8月，HBase全球社区已经拥有了83位HBase Committer，而国内就有20位左右的Committer，占了近1/4的比例。近一两年，HBase在国内更是得到了长足的发展，2018年中国HBase技术社区成立，一年时间里社区在多个城市相继组织了9次线下技术沙龙活动，为HBase更好地在国内各公司茁壮成长做出了卓越的贡献。,25,899,0,65,https://wfqqreader-1252317822.image.myqcloud.com/cover/349/26391349/s_26391349.jpg
数据分析之道：用数据思维指导业务实战,2022-02-01 00:00:00,计算机-理论知识,本书以数据思维为主题，以数据分析全流程为主线，融合了编程语言、统计学基础及案例分析等内容，全书分为4 篇，囊括了数据思维的概念和培养方法、数据来源及体系建设、数据分析三大思维方式及用户流失、用户转化实战等共11 章的内容。本书囊括了数据分析中常用的分析方法，包括经典的海盗(AARRR) 模型、麦肯锡的MECE 模型、逻辑树、漏斗分析、路径分析、对比分析、A/B 试验、RFM 模型、K-Means 算法、5W2H等分析方法，还包括各类方法的实践案例及Python 实操项目。可以说本书是数据分析方法论与统计学知识、编程语言及应用案例的完美结合。,8,0,0,74.2,https://weread-1258476243.file.myqcloud.com/weread/cover/65/3300017965/s_3300017965.jpg
从0到1：CTFer成长之路,2020-09-01 00:00:00,计算机-理论知识,本书主要面向CTF入门者，融入了CTF比赛的方方面面，让读者可以进行系统性的学习。本书包括13章的内容，技术介绍分为线上赛和线下赛两部分。线上赛包括10章，涵盖Web、PWN、Reverse、APK、Misc、Crypto、区块链、代码审计。线下赛包括2章，分别为AWD和靶场渗透。第13章通过Nu1L战队成员的故事和联合战队管理等内容来分享CTF战队组建和管理、运营的经验。,28,969,0,110.6,https://wfqqreader-1252317822.image.myqcloud.com/cover/885/35276885/s_35276885.jpg
零基础学51单片机（C语言版）,2018-06-01 00:00:00,计算机-理论知识,本书用实例详解并辅以视频的方式介绍51单片机与C语言编程，主要内容有单片机快速入门、单片机基础电路、数制与C51语言入门、51单片机的硬件系统、51单片机编程软件的使用、单片机驱动LED（发光二极管）的电路及编程、单片机驱动LED数码管的电路及编程、中断与中断编程、定时器/计数器的使用及编程、按键输入电路及编程、点阵和液晶显示屏的使用及编程、步进电机的使用及编程、串行通信的使用及编程、I2C总线通信的使用及编程、A/D与D/A转换电路及编程、STC89C5x系列单片机介绍。本书具有起点低、由浅入深、语言通俗易懂的特点，内容结构安排符合学习认知规律。本书适合作没有任何基础的初学者学习51单片机及编程的自学图书，也适合作职业院校电类专业的单片机教材。,10,872,0,41.4,https://wfqqreader-1252317822.image.myqcloud.com/cover/673/24981673/s_24981673.jpg
穿越计算机的迷雾（第2版）,2018-03-01 00:00:00,计算机-理论知识,本书从最基本的电学知识开始，带领读者一步一步、从无到有地制造一台能全自动工作的计算机。在这个过程中，读者可以学习到大量有趣的电学、数学和逻辑学知识，了解到它们是如何为电子计算机的产生创造条件，并促使它不断向着更快、更小、更强的方向发展。通过阅读本书，读者可以很容易地理解自动计算实际上是如何发生的，而现代的计算机又是怎么工作的。以此为基础，在本书的后面集中介绍了现代计算机的组成和主要功能，以及计算机核心与外部设备的接口，并对以操作系统为核心的软件进行了介绍。,23,827,0,28.8,https://wfqqreader-1252317822.image.myqcloud.com/cover/546/23914546/s_23914546.jpg
CSS新世界,2021-08-01 00:00:00,计算机-理论知识,本书是“CSS世界三部曲”的最后一部。这是一本关于CSS的进阶读物，专门讲CSS3及其之后版本的新特性。在本书中，作者结合自己多年的从业经验，讲解CSS基础知识，并充分考虑前端开发者的需求，以CSS新特性的历史背景为线索，去粗取精，注重细节，深入浅出地介绍了上百个CSS新特性。此外，作者专门还为本书开发了配套网站，用于书中实例效果的在线展示和问题答疑。本书的所有内容都是作者经过深入思考和探索后提炼出来的，知识点多且内容丰富，注重技术细节、经验分享和解决问题的思路。本书的主要目标是帮助前端开发者突破CSS技能提升的瓶颈，非常适合具有一定CSS基础的前端开发者阅读。,19,900,0,83.14,https://wfqqreader-1252317822.image.myqcloud.com/cover/13/40870013/s_40870013.jpg
社会工程：安全体系中的人性漏洞,2013-11-01 00:00:00,计算机-理论知识,本书首次从技术层面剖析和解密社会工程手法，从攻击者的视角详细介绍了社会工程的所有方面，包括诱导、伪装、心理影响和人际操纵等，并通过凯文·米特尼克等社会工程大师的真实故事和案例加以阐释，探讨了社会工程的奥秘。主要内容包括黑客、间谍和骗子所使用的欺骗手法，以及防止社会工程威胁的关键步骤。本书适用于社会工程师、对社会工程及信息安全感兴趣的人。,12,763,0,29.99,https://wfqqreader-1252317822.image.myqcloud.com/cover/957/22806957/s_22806957.jpg
云计算原理与实践,2018-08-01 00:00:00,计算机-理论知识,本书系统地讲解了云计算的知识框架，包括云计算的三大认识角度（商业模式、计算范式、实现方式）、四个关键技术（计算、存储、网络、安全）、四种开发运维维度（云原生应用、云操作系统、云端软件、云运维），以及三大应用场景（云桌面、开发云、大数据与人工智能）。本书在大部分的章中安排了一个或多个基于开源软件的实训内容，以帮助读者更有效地动手实践，包括GitHub、Hadoop、OpenStack、KVM、Docker、Ceph、Mininet、Mesos、Kubernetes等。,24,827,0,39,https://wfqqreader-1252317822.image.myqcloud.com/cover/781/24981781/s_24981781.jpg
Wireshark网络分析从入门到实践,2019-04-01 00:00:00,计算机-理论知识,Wireshark是一款开源网络协议分析器，能够在多种平台（例如Windows、Linux和Mac）上抓取和分析网络包。本书将通过图文并茂的形式来帮助读者了解并掌握Wireshark的使用技巧。本书由网络安全领域资深的高校教师编写完成，集合了丰富的案例，并配合了简洁易懂的讲解方式。全书共分17章，从Wireshark的下载和安装开始讲解，陆续介绍了数据包的过滤机制、捕获文件的打开与保存、虚拟网络环境的构建、常见网络设备、Wireshark的部署方式、网络延迟的原因、网络故障的原因，并介绍了多种常见的攻击方式及应对策略，除此之外，本书还讲解了如何扩展Wireshark的功能以及Wireshark中的辅助工具。本书实用性较强，适合网络安全渗透测试人员、运维工程师、网络管理员、计算机相关专业的学生以及各类安全从业者参考阅读。,24,780,0,37.76,https://wfqqreader-1252317822.image.myqcloud.com/cover/509/25916509/s_25916509.jpg
零信任网络：在不可信网络中构建安全系统,2019-08-01 00:00:00,计算机-理论知识,《零信任网络：在不可信网络中构建安全系统》分为10章，从介绍零信任的基本概念开始，描述了管理信任，网络代理，建立设备信任、用户信任、应用信任以及流量信任，零信任网络的实现和攻击者视图等内容。《零信任网络：在不可信网络中构建安全系统》主要展示了零信任如何让读者专注于构建强大的身份认证和加密，同时提供分区访问和更好的操作敏捷性。通过阅读《零信任网络：在不可信网络中构建安全系统》，读者将了解零信任网络的架构，包括如何使用当前可用的技术构建一个架构。《零信任网络：在不可信网络中构建安全系统》适合网络工程师、安全工程师、CTO以及对零信任技术感兴趣的读者阅读。本书适合网络工程师、安全工程师、CTO以及对零信任技术感兴趣的读者阅读。,12,772,0,37.76,https://wfqqreader-1252317822.image.myqcloud.com/cover/982/26472982/s_26472982.jpg
C++Templates中文版,2013-04-01 00:00:00,计算机-理论知识,《C++ Templates中文版》是C++模板编程的完全指南，旨在通过基本概念、常用技巧和应用实例三方面的有用资料，为读者打下C++模板知识的坚实基础。全书共22章。第1章全面介绍了《C++ Templates中文版》的内容结构和相关情况。第1部分(第2～7章)以教程的风格介绍了模板的基本概念，第2部分(第8～13章)阐述了模板的语言细节，第3部分(第14～18章)介绍了C++模板所支持的基本设计技术，第4部分(第19～22章)深入探讨了各种使用模板的普通应用程序。,12,864,0,56.96,https://wfqqreader-1252317822.image.myqcloud.com/cover/394/22691394/s_22691394.jpg
FreeRTOS内核实现与应用开发实战指南：基于STM32,2019-02-01 00:00:00,计算机-理论知识,本书第1章介绍了信息安全人员做安全评估、渗透测试常用的系统环境与网络环境配置。第2章介绍了黑客入门基础—社会工程学。第3章介绍了密码学理论和开源工具GnuPG与OpenSSL的配置与使用。第4章介绍了一些常用的黑客手法，然后引出相对应的防护策略，并且介绍了一款开源漏洞扫描工具。第5章介绍了三种常见的Web安全问题：欺骗攻击、数据库注入与XSS跨站攻击。第6章介绍了入侵检测工具Snort和开源蜜罐体系Honeyd。第7章介绍了WiFi中WEP和WPA/WPA2的破解方法以及无线路由中常见的UPnP带来的安全隐患。第8章介绍了国家推动信息安全战略的依据及测评流程，并针对与真实测评一致的部分内容进行模拟测评。本书既可作为面向计算机工程、软件工程、信息工程等IT相关学科的信息安全实训教材，还可作为信息安全相关人员的培训教材。,11,902,0,49,https://wfqqreader-1252317822.image.myqcloud.com/cover/59/25058059/s_25058059.jpg
