title,publishTime,category,intro,maxFreeChapter,newRating,free,price,cover
2020年西方哲学史考点归纳与典型题（含考研真题）详解,2016-05-06 00:00:00,教育学习-考试,2020年西方哲学史考点归纳与典型题（含考研真题）详解,6,0,0,20,https://wfqqreader-1252317822.image.myqcloud.com/cover/627/27039627/s_27039627.jpg
王道俊《教育学》（第7版）配套题库【考研真题＋课后习题＋章节题库＋模拟试题】,2019-07-17 00:00:00,教育学习-考试,不同一般意义的传统题库，本题库是详解研究生入学考试指定考研参考书目为王道俊《教育学》（第7版）的专业课复习题库，包括考研真题、课后习题、章节题库和模拟试题四大部分。具体来说包括以下四部分：第一部分为考研真题。精选历年考研教育学真题，每道真题均提供详细解析，考生可以通过真题部分的练习来熟悉考研真题的特点，并测试自己的水平。第二部分为课后习题。本书参考大量教育学相关资料对该教材的课（章）后习题进行了详细的分析和解答，并对相关重要知识点进行了延伸和归纳。第三部分为章节题库。遵循王道俊《教育学》（第7版）的章目编排，精选详析了部分名校近年的考研真题，同时针对该教材的重难点相应整理了典型题，并对题库中的部分重难点试题进行详细解析，帮助考生掌握各类答题技巧。第四部分为模拟试题。根据考研真题的命题规律及热门考点精选模拟试题，其试题难度、试题风格力争与考研真题保持一致。通过模拟试题的练习，学员既可以检测学习该考试科目的效果，又可以提升自己对考试的整体把握能力。,12,0,0,50,https://wfqqreader-1252317822.image.myqcloud.com/cover/695/27054695/s_27054695.jpg
学生心理辅导咨询案例集,2012-09-21 00:00:00,教育学习-考试,心理咨询师职业资格考试辅导用书。本书将所有的案例分为与学生心理教育的现实紧密相关的三个专辑：1.对学生的精神创伤、暴力、自杀、噩梦等心理危机进行紧急干预的方法；2.学生身心发育过程中各个阶段的心路历程；3.对自闭症、情绪障碍以及学生的强迫症和抑郁症等进行矫治的心理学技术和策略。,10,822,0,18.74,https://wfqqreader-1252317822.image.myqcloud.com/cover/166/23757166/s_23757166.jpg
2019年广播电视编辑记者、播音员主持人《广播电视业务》复习全书【核心讲义＋过关练习】,2019-04-19 00:00:00,教育学习-考试,本书特别适用于参加广播电视编辑记者、播音员主持人考试的考生。为了帮助考生顺利通过广播电视编辑记者、播音员主持人资格考试，我们根据最新考试大纲、考试用书和相关法律法规编写了广播电视编辑记者、播音员主持人资格考试辅导资料：广播电视编辑记者、播音员主持人《广播电视业务》复习全书【核心讲义＋过关练习】本书是广播电视编辑记者、播音员主持人资格考试科目《广播电视业务》的复习全书【核心讲义＋过关练习】。本书根据最新《全国广播电视编辑记者、播音员主持人资格考试大纲》中“广播电视业务”的内容和要求编写而成，共5章。每章均包括考试大纲、核心讲义和过关练习三大内容。第一部分为考试大纲，明确考试要求；第二部书为核心讲义，由圣才名师根据多年的考试辅导经验，浓缩整理而成。该讲义按最新考试大纲编排，包括大纲要求的主要内容，基本覆盖了考试的所有命题点，并对重难点内容进行了相应的归纳和拓展。第三部书为过关练习，根据考试大纲及考点按章精心编写了过关练习题，以方便考生检测学习效果，评估应试能力。,9,0,0,30,https://wfqqreader-1252317822.image.myqcloud.com/cover/514/27043514/s_27043514.jpg
郑杭生《社会学概论新修》笔记和课后习题（含考研真题）详解（第4版）,2013-10-01 00:00:00,教育学习-考试,国内外经典教材辅导系列是一套全面解析当前国内外各大院校权威教科书的学习辅导资料。郑杭生主编的《社会学概论新修》（第4版，中国人民大学出版社）是国内最受欢迎的标准社会学教材之一。本书遵循第4版的章目编排，共分为25章，每章由三部分组成：第一部分为复习笔记，总结本章的重难点内容；第二部分为课（章）后习题详解，对第3版的所有习题都进行了详细的分析和解答；第三部分为考研真题详解，精选部分名校近年考研真题，并提供了详细的参考答案。,10,754,0,20,https://wfqqreader-1252317822.image.myqcloud.com/cover/961/844961/s_844961.jpg
英语四级词汇速成：构词+联想记忆法（附送六级词汇）,2014-03-10 00:00:00,教育学习-考试,全书根据大学英语教学大纲编写而成，采用词根+词缀的拼写方式，帮助考生有效记忆大学英语四级考试的词汇。从而达到高效记忆、攻克四六级考试的目的。,15,0,0,32,https://wfqqreader-1252317822.image.myqcloud.com/cover/285/35135285/s_35135285.jpg
吴于廑《世界史·古代史编（上卷）》笔记和典型题（含考研真题）详解,2019-02-19 00:00:00,教育学习-考试,本书特别适用于参加研究生入学考试指定考研参考书目为吴于廑《世界史·古代史编（上卷）》的考生。也可供各大院校学习吴于廑《世界史·古代史编（上卷）》的师生参考。《世界史》（吴于廑主编、高等教育出版社出版）一直被用作高等院校历史专业教材，并被大部分院校指定为历史专业硕士研究生入学考试的参考教材。但由于该教材信息量大，知识面宽，具有一定的广度和深度，这给学生在学习该教材的过程中带来一定的困难。为了帮助学生系统、高效的掌握该教材内容，我们根据教学大纲和名校考研真题的命题规律，精心编制了吴于廑主编的六卷本《世界史》的辅导用书：1．[电子书]吴于廑《世界史·古代史编（上卷）》笔记和典型题（含考研真题）详解2．[电子书]吴于廑《世界史·古代史编（上卷）》配套题库【名校考研真题＋章节题库＋模拟试题】3．[电子书]吴于廑《世界史·古代史编（下卷）》笔记和典型题（含考研真题）详解4．[电子书]吴于廑《世界史·古代史编（下卷）》配套题库【名校考研真题＋章节题库＋模拟试题】5．[电子书]吴于廑《世界史·近代史编（上卷）》（第2版）笔记和典型题（含考研真题）详解6．[电子书]吴于廑《世界史·近代史编（上卷）》（第2版）配套题库【名校考研真题＋章节题库＋模拟试题】7．[电子书]吴于廑《世界史·近代史编（下卷）》（第2版）笔记和典型题（含考研真题）详解8．[电子书]吴于廑《世界史·近代史编（下卷）》（第2版）配套题库【名校考研真题＋章节题库＋模拟试题】9．[电子书]吴于廑《世界史·现代史编（上卷）》笔记和典型题（含考研真题）详解10．[电子书]吴于廑《世界史·现代史编（上卷）》配套题库【名校考研真题＋章节题库＋模拟试题】11．[电子书]吴于廑《世界史·现代史编（下卷）》笔记和典型题（含考研真题）详解12．[电子书]吴于廑《世界史·现代史编（下卷）》配套题库【名校考研真题＋章节题库＋模拟试题】作为吴于廑主编的六卷本《世界史》的配套辅导书，本书具有以下几个方面的特点：1．整理教材笔记，浓缩知识精华。本书每章的复习笔记均对本章的重难点进行了整理，并参考了国内名校名师授课的课堂笔记。因此，本书的内容基本上浓缩了该教材的所有知识精华。2．遴选考研真题，详析解答思路。本书遴选了部分名校近年来的相关考研真题（部分真题为考生回忆版）并予以详细解析，有利于强化对重要知识点的理解。3．精编典型例题，巩固重点难点。本书针对每章的内容精选了典型例题，所选典型题基本涵盖了各个章节的重点和难点，针对性强，解析详尽，并注意对相关知识点的扩充。,8,0,0,20,https://wfqqreader-1252317822.image.myqcloud.com/cover/736/27032736/s_27032736.jpg
2019年12月大学英语四级阅读理解高分特训100篇【命题分析＋答题攻略＋强化训练】,2017-08-03 00:00:00,教育学习-考试,本书特别适用于参加大学英语四级考试的考生。《大学英语四级阅读理解高分特训100篇》按照最新大学英语四、六级考试调整说明的要求，并分析总结自题型调整以来大学英语四级考试阅读题型，将阅读分为篇章词汇阅读、长篇匹配阅读和篇章仔细阅读这三部分进行专项练习，其中篇章词汇阅读20篇，长篇匹配阅读20篇，篇章仔细阅读60篇。每一专项阅读又按照难易程度，分为基础篇、标准篇、能力篇，循序渐进地提高阅读水平。因篇章仔细阅读在考试时涵盖面很广，本书选材时，将其分为文化教育类、商业经济类、科技科普类、社会生活类、自然环境类等，对于阅读考试具有很强的针对性和实用性。本书文章均选自国外知名期刊、报纸杂志，如：TheGuardian《卫报》、NewScientist《新科学家》、Newsweek《新闻周刊》、TheNewYorkTimes《纽约时报》、Time《时代周刊》、TheWashingtonPost《华盛顿邮报》、USAToday《今日美国》、TheEconomist《经济学人》等。本书在每篇阅读之后都有关于文章大意的介绍，还附有文章中的重点、难点词汇，帮助考生扩大词汇量，更好地理解文章，掌握阅读技巧，提高阅读水平。,10,0,0,20,https://wfqqreader-1252317822.image.myqcloud.com/cover/203/27048203/s_27048203.jpg
2020年临床医学检验技术（师）考试过关必做2000题（含历年真题）,2017-08-03 00:00:00,教育学习-考试,本书特别适用于参加临床医学检验技术（师）考试的考生。为了帮助考生省时、省力、高效地做好复习，依据最新考试大纲要求，以及历年真题题型与数量在各科目、章节中分布情况，我们组织专家根据最新《全国卫生专业技术资格考试大纲》和指定参考教材精心编写了本书——临床医学检验技术（师）考试过关必做2000题（含历年真题）。本书共分7篇149章2000余题，内容涵盖考试大纲全部考点。本书主要供广大参加临床医学检验技术（师）考试的考生使用，同时，也是在校生期末（中）考试不可多得的辅导书。,39,0,0,20,https://wfqqreader-1252317822.image.myqcloud.com/cover/80/27047080/s_27047080.jpg
喻国明《传媒经济学教程》笔记和课后习题（含考研真题）详解,2017-08-05 00:00:00,教育学习-考试,本书特别适用于参加研究生入学考试指定考研参考书目为喻国明《传媒经济学教程》的考生。也可供各大院校学习喻国明《传媒经济学教程》的师生参考。普通高等教育“十二五”国家级规划教材《传媒经济学教程》（喻国明等编著，中国人民大学出版社）是我国高校广泛采用的传媒经济学权威教材之一，也被众多高校（包括科研机构）指定为“传媒经济学”考研考博专业课参考书目。为了帮助考生复习该教材，我们根据教材和名校考研真题的命题规律精心编写了喻国明《传媒经济学教程》的辅导用书（均提供免费下载，免费升级）。本书主要包括以下内容：（1）整理名校笔记，浓缩内容精华。本书每章的复习笔记均对该章的重难点进行了整理，并参考了国内名校名师讲授该教材的课堂笔记。因此，本书的内容几乎浓缩了该教材的所有知识精华。（2）解析课后习题，提供详尽答案。本书参考大量传媒经济学相关辅导资料，对该教材的课（章）后习题进行了详细的分析和解答，并对相关重要知识点进行了延伸和归纳。（3）考研真题详解，巩固重难点知识。为了强化对重要知识点的理解，本书精选了中国传媒大学近年的传媒经济学考研真题，并提供了详细的分析和解答，供读者巩固知识、学以致用。（4）最新更新内容，可免费升级获得。本书每年都会进行修订完善，最新补充的内容，均可免费升级获得。,10,0,0,30,https://wfqqreader-1252317822.image.myqcloud.com/cover/539/27046539/s_27046539.jpg
解密GRE写作论证思维,2018-09-20 00:00:00,教育学习-考试,本书目标是使GRE考生在短期内分析性写作达到4分，以及为想要提升学术分析性写作的同学提供帮助。全书共分为六大部分。前两部分详细讲解了GRE写作考试两个部分（Analyze an Issue与Analyze an Argument）的备考技巧和方法。后四部分提供了官方题库Issue和Argument写作所有题目的详细思路分析，其中Issue部分包含两个版本的思路：4分简化版思路和追求更高分数的更充分的思路；Argument部分提供了题目译文、文章结构图和各步推理分析思路。在帮助考生拓展思路的基础上，书中还提供了Issue与Argument各20道题的范文，每道题配两篇范文，一篇定位在4~5分，一篇定位在5.5~6分，共计80篇范文。其中，Issue部分的高分范文还配有针对重要语言点的音频讲解，以帮助大家切实有效地提升语言能力。,15,0,0,61.99,https://wfqqreader-1252317822.image.myqcloud.com/cover/2/26308002/s_26308002.jpg
王桧林《中国现代史（下册）》（第3版）笔记和课后习题（含考研真题）详解,2019-02-18 00:00:00,教育学习-考试,本书特别适用于参加研究生入学考试指定考研参考书目为王桧林《中国现代史（下册）》（第3版）的考生。也可供各大院校学习王桧林《中国现代史（下册）》（第3版）的师生参考。王桧林主编，由高等教育出版社出版的《中国现代史》一直被用作高等院校历史专业教材，并被大部分院校指定为历史专业硕士研究生入学考试的参考教材。为了帮助学生系统、高效的掌握该教材内容，我们根据教学大纲和名校考研真题的命题规律，精心编制了王桧林主编的《中国现代史》的辅导用书：1．[电子书]王桧林《中国现代史（上册）》（第3版）笔记和课后习题（含考研真题）详解2．[电子书]王桧林《中国现代史（上册）》（第3版）配套题库【名校考研真题＋章节题库＋模拟试题】3．[电子书]王桧林《中国现代史（下册）》（第3版）笔记和课后习题（含考研真题）详解4．[电子书]王桧林《中国现代史（下册）》（第3版）配套题库【名校考研真题＋章节题库＋模拟试题】作为王桧林主编的《中国现代史》的配套辅导书，本书具有以下几个方面的特点：1．整理教材笔记，浓缩知识精华。本书每章的复习笔记均对本章的重难点进行了整理，并参考了国内名校名师授课的课堂笔记。因此，本书的内容基本上浓缩了该教材的所有知识精华。2．详解课后习题，巩固重点难点。本书参考大量相关辅导资料，对王桧林主编的《中国现代史》的课后思考题进行了详细的分析和解答，并对相关重要知识点进行了延伸和归纳。3．遴选考研真题，详析解答思路。本书遴选了部分名校近年来的相关考研真题（部分真题为考生回忆版）并予以详细解析，有利于强化对重要知识点的理解。,5,0,0,25,https://wfqqreader-1252317822.image.myqcloud.com/cover/358/27032358/s_27032358.jpg
考研单词：世界记忆大师教你高效记忆,2021-03-01 00:00:00,教育学习-考试,快速记住单词，是绝大多数考研人的追求。《考研单词：世界记忆大师教你高效记忆》的核心目标，就是帮助你以“高效、轻松、自然、贴切”的方式记住考研单词。首先，为了更好的客户体验感，作者在创作过程中，亲自参与了考研英语的全过程，在英语（一）考试中轻松获得82分。其次，《考研单词：世界记忆大师教你高效记忆》始终基于考研学子的需求和人类大脑的习性，从左脑逻辑思维和右脑图景思维两大角度，结合单词本身的“音形义”特性，选取和运用了4个类别共10种记忆方法和方式。《考研单词：世界记忆大师教你高效记忆》创造性地按方法类别编排，极大提升记忆效率，实践表明，40～70小时就可完成考研单词的记忆目标。还有，作者长期从事“高效学习力”的教学和研究，这些系统的学习策略、复习策略、目标策略、资源管理策略等，毫不保留地放入《考研单词：世界记忆大师教你高效记忆》，助力各位学子高效、充实、顺利地走过整个考研过程。,11,0,0,25.12,https://wfqqreader-1252317822.image.myqcloud.com/cover/307/41600307/s_41600307.jpg
陈孝彬《教育管理学》（第3版）课后习题详解,2017-08-11 00:00:00,教育学习-考试,本书特别适用于参加研究生入学考试指定考研参考书目为陈孝彬所著的《教育管理学》（第3版）的考生，也可供各大院校学习教育管理学的师生参考。陈孝彬、高洪源主编的《教育管理学（第3版）》是我国高校采用较多的教育管理学权威教材。为了帮助参加研究生入学考试指定考研参考书目为陈孝彬主编的《教育管理学》（第3版）的考生复习专业课，我们根据教材和名校考研真题的命题规律精心编写了陈孝彬《教育管理学》辅导用书（均提供免费下载，免费升级）：1．陈孝彬《教育管理学》（第3版）笔记和课后习题（含考研真题）详解2．陈孝彬《教育管理学》（第3版）课后习题详解3．陈孝彬《教育管理学》（第3版）配套题库【名校考研真题+课后习题+章节题库+模拟试题】本书是陈孝彬《教育管理学》（第3版）教材的配套e书，参考大量教育管理学相关资料，对陈孝彬《教育管理学》（第3版）教材每章的课后习题进行了详细的分析和解答，并对个别知识点进行了扩展。课后习题答案久经修改，质量上乘，非常标准，特别适合应试作答和临考冲刺。,6,0,0,20,https://wfqqreader-1252317822.image.myqcloud.com/cover/285/27030285/s_27030285.jpg
托福写作真题范文精练120,2018-10-01 00:00:00,教育学习-考试,针对托福写作提分难、语言素材的积累更难的问题，这本《托福写作真题范文精练120》应运而生。近5年来，TestDaily整理了接近150场托福考试的考情回顾，从中大致窥探出ETS的出题规律。本书收录了100多篇独立写作和综合写作范文，并根据话题进行分类。每类话题均附上常用写作思路，帮助考生快速突破思维障碍，且能举一反三，触类旁通。每道真题都有完备的“头脑风暴”帮助考生理解题目要点，并分析选项利弊，充分拓宽思路；“范文思路”部分有助于考生更快掌握高分文章的逻辑思路走向，多加模仿能够快速提升文章逻辑性；“范文文本”部分给考生提供最佳模仿和积累素材；范文后更有“语料积累”充实考生的知识库。高密度的高质量干货，值得考生悉心研究学习。,32,0,0,23.88,https://wfqqreader-1252317822.image.myqcloud.com/cover/272/26245272/s_26245272.jpg
基金法律法规、职业道德与业务规范考点归纳与真题详解,2017-01-01 00:00:00,教育学习-考试,本书是基金从业资格考试辅导用书之一，针对基金从业资格考试的特点进行了科学的编排，将基金法律法规、职业道德与业务规范部分编为一册。每一章首先分析考情，并给出整章知识结构图；其次对照该章的知识框架结构，对重点难点进行了详细梳理，并以例题的形式进行演示讲解，同时提供了针对考试预测特点的模拟训练题，使考生能得到充分的复习训练；最后，提供近几次考试真题，并提供了标准答案和详细解析。本书内容全面，针对性强，重难点突出，适合参加基金从业资格考试的人员使用，可获得较好的复习效果。本书配备3D电子书和题库（电脑版和手机版），提高读者学习的便易度、实效性，另外读者可以与编者通过手机电子书进行互动，如有疑问，会有专人及时解答。,8,0,0,33.99,https://wfqqreader-1252317822.image.myqcloud.com/cover/957/916957/s_916957.jpg
BEC词汇词根+联想（乱序版）,2015-11-01 00:00:00,教育学习-考试,本书是专用于BEC剑桥商务英语考试（BusinessEnglishCertificate）的词汇用书，将BEC初、中、高级词汇三合为一，且对三个级别的词汇明确划分，集综合学习和针对性备考于一体。本书延续“红宝书”系列特点，采用早已为广大读者认可的实用高效的“词根+联想记忆法”，并打破了常规的字母顺序，按照乱序编排。此外，本书在收录了较为重要且常考的普通词义的同时，还针对BEC考试特点，为考生重点标注词汇的商务词义，增加了商务短语和例句，力求为考生减轻负担，让考生做到有的放矢。本书配备可免费下载的MP3录音，辅助记忆单词。本书含词汇量：3500。,13,0,0,5.99,https://wfqqreader-1252317822.image.myqcloud.com/cover/849/22595849/s_22595849.jpg
吴志宏《新编教育管理学》配套题库【名校考研真题＋课后习题＋章节题库＋模拟试题】,2017-08-10 00:00:00,教育学习-考试,本书特别适用于参加研究生入学考试指定考研参考书目为吴志宏所著的《新编教育管理学》的考生，也可供各大院校学习教育管理学的师生参考。吴志宏著《新编教育管理学》是我国高校采用较多的教育管理学权威教材。为了帮助参加研究生入学考试指定考研参考书目为吴志宏《新编教育管理学》的考生复习专业课，我们根据教材和名校考研真题的命题规律精心编写了配套复习辅导用书。不同一般意义的传统题库，本题库包括以下四部分：第一部分为名校考研真题。精选名校考研真题，每道真题均提供答案解析。学员可以通过真题部分的练习来熟悉考研真题的特点，并测试自己的水平。第二部分为课后习题。本书参考大量教育管理学相关资料对该教材的课（章）后习题进行了详细的分析和解答，并对相关重要知识点进行了延伸和归纳。第三部分为章节题库。遵循吴志宏《新编教育管理学》的章目编排，精选详析了部分名校近年的考研真题，同时针对该教材的重难点相应整理了典型题，并对题库中的试题进行详细解析。第四部分为模拟试题。根据历年考研真题的命题规律及热门考点进行押题，其试题数量、试题难度、试题风格与研究生入学考试真题完全一样。通过模拟试题的练习，学员既可以用来检测学习该考试科目的效果，又可以用来评估对自己的应试能力。,12,0,0,50,https://wfqqreader-1252317822.image.myqcloud.com/cover/113/27037113/s_27037113.jpg
全国名校文学理论考研真题及详解（含北大、北师等）,2017-08-14 00:00:00,教育学习-考试,通过分析众多院校历年文学理论考研真题，可以看出不同院校的考研真题相似性很高，甚至部分考题完全类同。因此，建议考生在复习备考过程中一定要认真研究其他水平相当院校的历年考研真题。本书是为参加全国各高校“文学理论”考试科目及包含文学理论知识的文学综合类考试科目的考生精心编写的复习备考辅导用书。本书汇集了北大、北师、中传、首师4所高校2010～2014年间的14套考研真题，并提供详细答案解析。本书历年真题的答案及解析由高分考生根据本科目考研的参考教材和相关教师的授课讲义等精心编写而成，解题思路清晰、答案翔实，突出难度分析，对常考知识点进行了归纳整理。此外，本书还收集了央财、中山等名校的9套考研真题，以供考生复习参考。,11,0,0,30,https://wfqqreader-1252317822.image.myqcloud.com/cover/227/27033227/s_27033227.jpg
CFA三级中文精讲③,2019-01-01 00:00:00,教育学习-考试,本书从考生的角度出发，集作者多年CFA培训经验于一体，力邀国内外众多金融投资专业人士精心打造，体现了当今国内CFA考试中文解析的高水准。本书完全参照CFA协会官方指定用书编写，囊括全部核心内容和重要内容，契合中国考生的实际情况，有利于考生快速阅读、备考。本书具有专业性、前沿性、全面性、实用性和效率性等特点，适合作为考生备考CFA三级的参考书。,20,0,0,49,https://wfqqreader-1252317822.image.myqcloud.com/cover/214/23841214/s_23841214.jpg
