title,publishTime,category,intro,maxFreeChapter,newRating,free,price,cover
老夏说公务员面试：助你顺利考上公务员,2019-07-01 00:00:00,教育学习-考试,1.面试世界观。主要从底层塑造考生对公考的认知，回归到依靠努力、成长获得成功。2.面试方法论。讲解面试答题的基本方法，包括回归生活和工作、纵横十字、面试卡片、常用框架等。3.真题。5种常见公考题型每种10道例题，掰开揉碎，起到举一反三、闻一知十的作用。4.答疑、考前必读等内容。,6,883,0,46.2,https://wfqqreader-1252317822.image.myqcloud.com/cover/666/26125666/s_26125666.jpg
考研英语必备手册：大纲词汇5500,2016-03-01 00:00:00,教育学习-考试,《考研英语必备手册：大纲词汇5500》这本符合实战需要的考研英语词汇学习手册可所收录词汇的释义都是其最核心、最常用的意思，简明精准，使背诵更高效，印象记忆深刻。同时，本书还将考研中常考到的词汇作了明确标注，重点突出，有效提升单词记忆效率。本书对词汇没有复杂的讲解，非常适合考生快速完成自学，然后投入精力去研究历年真题。本书配有单词自测红膜，覆盖红膜可以遮挡页面上的中文释义，方便考生检验记忆效果，及时发现没有掌握的单词。与厚重的词汇书不同，这本词汇手册小巧轻便，考生可以把它作为一本口袋书，随时随地背单词。,8,809,0,6.99,https://wfqqreader-1252317822.image.myqcloud.com/cover/447/22975447/s_22975447.jpg
钱理群《中国现代文学三十年》（修订本）笔记和考研真题详解,2019-10-17 00:00:00,教育学习-考试,钱理群所著的《中国现代文学三十年》（修订本，北京大学出版社）被列为教育部“九五”、国家“十一五”重点图书，是我国高校采用较多的现代文学优秀教材，也被众多高校指定为“现代文学”专业考研参考书目。作为该教材的辅导书，本书具有以下几个方面的特点：1．整理名校笔记，浓缩内容精华。在参考了国内外名校名师讲授钱理群《中国现代文学三十年》的课堂笔记基础上，本书每章的复习笔记部分对该章的重难点进行了整理，同时对重要知识点进行点拨，因此，本书的内容几乎浓缩了配套教材的知识精华。2．精选考研真题，巩固重难点知识。为了强化对重要知识点的理解，本书精选了部分名校近几年的现代文学考研真题，这些高校大部分以该教材作为考研参考书目。所选考研真题基本涵盖了各个章节的考点和难点，特别注重联系实际，凸显当前热点。3．归纳典型试题，强化知识考点。为了进一步巩固和强化各章知识难点的复习，特针对该教材的重难点相应整理了典型常考题，并对相关知识点进行归纳和延伸，梳理知识点逻辑关系，以达到高效复习的目的。,17,972,0,10,https://wfqqreader-1252317822.image.myqcloud.com/cover/494/27051494/s_27051494.jpg
童庆炳《文学理论教程》（第5版）笔记和课后习题（含考研真题）详解,2019-10-17 00:00:00,教育学习-考试,童庆炳著《文学理论教程》（第5版）是我国高校采用较多的文学理论权威教材。为了帮助参加研究生入学考试指定考研参考书目为童庆炳《文学理论教程》（第5版）的考生复习专业课，我们根据教材和名校考研真题的命题规律精心编写了配套复习辅导用书。本书具有以下几方面特点：1．整理名校笔记，浓缩内容精华。在参考了国内外名校名师讲授童庆炳《文学理论教程》的课堂笔记基础上，本书每章的复习笔记部分对该章的重难点进行了整理，同时对重要知识点进行点拨，并对教材知识点作适当的引申，因此，本书的内容几乎浓缩了配套教材的知识精华。2．解析课后习题，提供详尽答案。本书参考大量文学理论相关资料对该教材的重难点课（章）后习题进行了详细的分析和解答，并对相关重要知识点进行了延伸和归纳。3．精选考研真题，巩固重点知识。为了强化对重要知识点的理解，本书精选了部分名校近几年的文学理论考研真题，这些高校大部分以该教材作为考研参考书目。所选考研真题基本涵盖了各个章节的考点和难点，特别注重联系实际，凸显当前热点。4．归纳典型试题，强化应试能力。为了进一步巩固和强化各章知识难点的复习，特针对该教材的重难点相应整理了典型常考题，并对相关知识点进行归纳和延伸，梳理知识点逻辑关系，以达到高效复习的目的。,16,886,0,10,https://wfqqreader-1252317822.image.myqcloud.com/cover/90/27054090/s_27054090.jpg
彭聃龄《普通心理学》（第5版）笔记和课后习题（含考研真题）详解,2019-10-17 00:00:00,教育学习-考试,本书是彭聃龄主编的《普通心理学》（第5版）的配套辅导书（电子书），主要具有以下几个方面的特点：（1）梳理知识脉络，浓缩学科精华。本书每章的复习笔记均对该章的重难点进行了整理，并参考了国内名校名师讲授该教材的课堂笔记。因此，本书的内容几乎浓缩了该教材的所有知识精华。（2）详解课后习题，巩固重点难点。本书参考大量相关辅导资料，对该教材的课后思考题进行了详细的分析和解答，并对相关重要知识点进行了延伸和归纳。（3）精编考研真题，培养解题思路。本书精选部分参考价值较高的考研真题（含全国统考和高校自主命题），及该学科相关经典习题，并提供详细解答。这些题目基本体现了各个章节的考点和难点。,12,909,0,10,https://wfqqreader-1252317822.image.myqcloud.com/cover/471/27054471/s_27054471.jpg
《马克思主义基本原理概论》（2018年版）笔记和课后习题（含考研真题）详解,2019-10-17 00:00:00,教育学习-考试,本书是《马克思主义基本原理概论》（2018年版）教材的配套辅导用书，主要包括以下内容：（1）整理名校笔记，浓缩内容精华。本书每章的复习笔记均对该章的重难点进行了整理，并参考了国内名校名师讲授该教材的课堂笔记。因此，本书的内容几乎浓缩了该教材的所有知识精华。（2）解析课后习题，提供详尽答案。本书参考大量马克思主义基本原理相关资料，对该教材的课（章）后习题进行了详细的分析和解答，并对相关重要知识点进行了延伸和归纳。（3）精选考研真题，巩固重难点知识。为了强化对重要知识点的理解，本书精选了部分名校近几年的马克思主义基本原理概论考研真题，这些高校大部分以该教材作为考研参考书目。所选考研真题基本涵盖了各个章节的考点和难点，特别注重理论联系实际，凸显当前热点。,7,908,0,40,https://wfqqreader-1252317822.image.myqcloud.com/cover/763/27052763/s_27052763.jpg
笔杆子是怎样炼成的：公文写作实战,2021-07-01 00:00:00,教育学习-教材,可以说，市面上还没有这样一本公文写作书。 它对文稿起草的全过程原原本本进行复盘（比如对代拟省长讲话稿等文稿进行实战复盘），给人以直观启发和感悟；它对作者日常公文写作积累进行了程序化分解，讲解平时应如何聚焦实战进行广泛积累储备；它对机关公文常用词句进行了分类呈现，供笔杆子们在谋篇布局、开拓思路、搭建框架时查阅，以节省遣词造句时间。 这本书的特色就是实战性强，它不讲太多大道理，主要是复盘一线写手的原生态实战过程和技法。它适用于机关、企事业单位等从事文字工作的人员，高校等科研院所从事公文研究的专家学者，备考机关公务员、事业单位、国企笔（面）试的考生。 希望正浏览本书的你，早日成为一域一地的笔杆子！,8,0,0,55.3,https://weread-1258476243.file.myqcloud.com/weread/cover/0/3300013600/s_3300013600.jpg
经济师《经济基础知识（中级）》教材精编（2016）,2016-01-16 00:00:00,教育学习-考试,本书是全国经济专业技术资格考试科目《经济基础知识（中级）》的历年真题与模拟试题详解。全书由两部分组成：第一部分为历年真题详解，精选了2010年至2015年的6套真题，并对全部真题的答案进行了详细的分析和说明；第二部分为模拟试题详解，按照最新考试大纲及近年的命题规律精心编写了4套模拟试题，并根据最新指定教材和法律法规对所有试题进行了详细的分析和说明。,11,855,0,10,https://wfqqreader-1252317822.image.myqcloud.com/cover/937/844937/s_844937.jpg
洪子诚《中国当代文学史》（修订版）笔记和考研真题详解,2019-10-17 00:00:00,教育学习-考试,洪子诚所著的《中国当代文学史》（修订版，北京大学出版社）被列为国家“十一五”重点图书，是我国高校采用较多的当代文学优秀教材，也被众多高校指定为“当代文学”专业考研参考书目。作为该教材的辅导书，本书具有以下几个方面的特点：1．整理名校笔记，浓缩内容精华。在参考了国内外名校名师讲授洪子诚《中国当代文学史》的课堂笔记基础上，本书每章的复习笔记部分对该章的重难点进行了整理，同时对重要知识点进行点拨，因此，本书的内容几乎浓缩了配套教材的知识精华。2．精选考研真题，巩固重难点知识。为了强化对重要知识点的理解，本书精选了部分名校近几年的当代文学考研真题，这些高校大部分以该教材作为考研参考书目。所选考研真题基本涵盖了各个章节的考点和难点，特别注重联系实际，凸显当前热点。3．归纳典型题，强化知识考点。为了进一步巩固和强化各章知识难点的复习，特针对该教材的重难点相应整理了典型常考题，并对相关知识点进行归纳和延伸，梳理知识点逻辑关系，以达到高效复习的目的。,16,958,0,10,https://wfqqreader-1252317822.image.myqcloud.com/cover/623/27051623/s_27051623.jpg
国家公务员录用考试专用教材：行政职业能力测验（2021升级版）,2018-12-01 00:00:00,教育学习-考试,双色印刷，考点突出，视频讲解，移动课堂。本教材是依据上海公务员考试大纲和历年真题编写，使用全新的知识体系和结构，逐一分类、分层讲解，更能适应当下的考试趋势和形势，兼具实用性和高效性。在正文里既有详尽的理论知识讲解，又有细致深入的典型真题分析，全方位补齐考生的知识短板，帮助考生熟练掌握高分绝技。,42,885,0,8,https://wfqqreader-1252317822.image.myqcloud.com/cover/616/33064616/s_33064616.jpg
美国生活英语,2017-01-01 00:00:00,教育学习-考试,见到老外就冷汗直冒，听不懂说不出，只能用Sorry来应付？虽能勉强表达自己的意思，却不是地道的说法，自己说得吃力，老外听得别扭？让本书来帮你解决这些问题吧！本书紧贴生活，通过永俊和志燕一家人的日常对话，为你营造出真实的生活场景，帮你轻松理解并记忆每一句话。多到目不暇接的话题，全到不能再全的会话，还有重要语言点讲解和语音纯正的MP3光盘，想学不好英语口语都难！,7,758,0,14.99,https://wfqqreader-1252317822.image.myqcloud.com/cover/958/22787958/s_22787958.jpg
大学英语六级经典必背500句,2016-09-01 00:00:00,教育学习-考试,《大学英语六级经典必背500句》适用于备战六级新题型考试，共收录103个听力口语关键句、227个攻克阅读关键句、70个翻译语法关键句和100个写作锦囊关键句。通过对每一个句子的分析、讲解与归纳，考生不仅可将六级考试的所有重要考查点一一攻克，还可以了解一些出题规律及考试精髓，从而更从容地应对考试。通过学习本书精选的句子，考生还可以进一步充实相关的语法和词汇知识，掌握有效的复习思路，在了解六级试题特点的基础上，提升英语水平。,4,836,0,7.99,https://wfqqreader-1252317822.image.myqcloud.com/cover/808/22595808/s_22595808.jpg
事业单位考试公共基础知识高分笔记,2019-10-01 00:00:00,教育学习-考试,《事业单位考试公共基础知识高分笔记》（以下简称“公基笔记”）是笔者根据自己的备考经验，以及成功进入公务员队伍后从事公考事业编笔记整理工作的心得，通过大量的市场调研，结合个人对公共基础知识考试的理解，研究整理而成。,7,0,0,27,https://wfqqreader-1252317822.image.myqcloud.com/cover/411/37550411/s_37550411.jpg
《毛泽东思想和中国特色社会主义理论体系概论》（2018年版）笔记和课后习题（含考研真题）详解,2019-10-17 00:00:00,教育学习-考试,本书是《毛泽东思想和中国特色社会主义理论体系》（2018年版）教材的配套辅导用书，主要包括以下内容：（1）整理名校笔记，浓缩内容精华。本书每章的复习笔记均对该章的重难点进行了整理，并参考了国内名校名师讲授该教材的课堂笔记。因此，本书的内容几乎浓缩了该教材的所有知识精华。（2）解析课后习题，提供详尽答案。本书参考大量毛泽东思想和中国特色社会主义理论体系相关资料，对该教材的所有课（章）后习题进行了详细的分析和解答，并对相关重要知识点进行了延伸和归纳。（3）精选考研真题，巩固重难点知识。为了强化对重要知识点的理解，本书精选了部分名校近几年的毛泽东思想和中国特色社会主义理论体系考研真题，这些高校大部分以该教材作为考研参考书目。所选考研真题基本涵盖了各个章节的考点和难点，特别注重理论联系实际，凸显当前热点。,13,841,0,40,https://wfqqreader-1252317822.image.myqcloud.com/cover/755/27052755/s_27052755.jpg
北外高翻笔译课（英译汉）,2020-05-01 00:00:00,教育学习-考试,本书首次全面呈现了北京外国语大学高级翻译学院教学团队积十余年之功建立的笔译教学框架。北外高翻笔译课共两个学期，第一学期教学旨在发展学生各项基础能力；第二学期侧重培养学生在各专业领域的综合实践能力。本书编写据此分为两大部分，忠实反映了北外高翻学院笔译课堂的整体面貌。作者精选了2017—2019学年英汉笔译教学材料及附带详细注释的参考译文，通过重现教师、助教、同学切磋译文等形式，生动呈现了翻译训练（译文优化）的全过程，具有很强的实践指导意义。本书内容角度新颖，不落窠臼，填补了翻译实操类图书的空白，适合广大翻译学习者、研究者和爱好者学习研读。,13,969,0,28,https://wfqqreader-1252317822.image.myqcloud.com/cover/691/34232691/s_34232691.jpg
英语词汇速记大全,2016-07-01 00:00:00,教育学习-考试,寻根+解构，1064个词根词缀迅速扩大你的词汇量，群组记忆更给力！优化+分类，8250个词汇涵盖各类英语考试，想忘都不容易！3大超值附赠：200节逐词精讲课+150分钟导学视频+405分钟音频，二维码随扫随学！,324,826,0,15.99,https://wfqqreader-1252317822.image.myqcloud.com/cover/820/22787820/s_22787820.jpg
方向比努力更重要：名师张雪峰考研通关攻略,2021-04-27 00:00:00,教育学习-考试,本书是500+学校特级主讲师，从业十余年，100万人称他 “考研神嘴”，红遍全网的考研名师张雪峰考研通关攻略。全书分为五个部分，第一部分全面解读新政策下的考研趋势。第二部分，详细分析如何选择学校，如何确定专业。第三部分，教大家如何去互联网上搜寻对自己考试有帮助的信息。第四个部分，针对多同学比较关心的院校专业选择的问题详细的给大家做一些解答。第五部分，教大家如何能够把考研这个事情给坚持下去。关于考研你想知道的问题都在这本书里。,9,764,0,33,https://wfqqreader-1252317822.image.myqcloud.com/cover/332/37698332/s_37698332.jpg
申论（公务员录用考试专用教材）,2014-05-01 00:00:00,教育学习-考试,申论备考是一项系统的工程，很多考生为之刻苦不已，效果却不尽如人意。我认为，这其中的原因就在于没有找到正确的门道。本书试图和考生一起探讨这个问题，力争为考生的备考起一些必要的帮助。,10,783,0,14.4,https://wfqqreader-1252317822.image.myqcloud.com/cover/89/25030089/s_25030089.jpg
剑桥商务英语（BEC）初级词汇精选（乱序版）,2014-07-01 00:00:00,教育学习-考试,本书精选BEC初级考试高频商务词汇，专门制订30天学习计划，帮助考生迅速掌握商务词汇，有效扩大词汇量，提高考试成绩。参考历年真题，精选BEC初级考试高频核心词，释义详尽准确。采用“词根+联想记忆法”，记忆方法科学，记忆效果显著。给出词汇的商务例句、搭配、派生词等丰富实例，加深理解，应用广泛。设置听说小站、写作小站，将词汇应用于商务场景，学以致用，全面备考。免费赠送英音录音，可扫描二维码在线试听，也可登录网站下载，用手机、电脑、MP3播放器播放，边听边学，效果加倍。采用“乱序”编排，帮助考生摆脱记忆单词的枯燥感和挫败感。,11,880,0,6.99,https://wfqqreader-1252317822.image.myqcloud.com/cover/828/22595828/s_22595828.jpg
四级英语新大纲词汇表,2016-11-01 00:00:00,教育学习-考试,《四级英语新大纲词汇表》以教育部最新颁布的《大学英语教学大纲》和《大学英语课程教学要求》为依据，完整收录了大学英语四级考试大纲要求的4120个核心词汇，并收录派生词（考生可从网上自行下载）。本书核心词部分分为20个WordList，方便考试根据自己的实际情况合理安排复习时间。词汇的词义注释参考权威英语词典，甄选其核心、常用的意思，简明易懂，精准地道。同时，还提供实用的赠品——四级单词“手记”；单词“手记”将书中所有核心词汇按音节划分好，用较淡的颜色和适合手写的字体、字号排版；考生可以从网上自行下载、打印、描红，分音节记忆单词。,7,831,0,3.99,https://wfqqreader-1252317822.image.myqcloud.com/cover/990/22787990/s_22787990.jpg
国家教师资格证考试：综合素质（中学）,2018-03-01 00:00:00,教育学习-考试,作为教师职业资格统考中重要的基础科目，综合素质共分为5个模块。与注重教育学、心理学知识的教育教学知识与能力不同，本科目注重考察作为教师的基本素养，包括：价值观、法律意识、道德、基本文化常识以及基本能力。从综合素质学科的章节安排来看，本学科注重考查的是考生作为一名人民教师的基本职业素养。本书以国家教师资格考试大纲为主要编写依据，从“职业理念”“教育法律法规”“教师职业道德”“文化素养”“基本能力”五个模块对“综合素质（中学）”考试科目的考试目标、考试情况、考试题型、考试重难点、出题思路进行了较为全面的分析和阐述。本书通过对各模块的考情分析，使每个模块的考试重难点一目了然，尤其是本书配备的树状知识图谱，更有利于考生学前理清各大模块知识点和重难点之间的内在逻辑关系，从而对本考试科目要求掌握的内容建立起便于理解和记忆的结构化知识体系。,24,897,0,30,https://wfqqreader-1252317822.image.myqcloud.com/cover/459/26244459/s_26244459.jpg
国家教师资格证考试：教育知识与能力（中学）,2018-06-22 00:00:00,教育学习-考试,本书从教育基础知识和基本原理、中学课程、中学教学、中学生学习心理和中学教育五个方面讲解了“教育知识与能力（中学）”考试科目的单项选择题、辨析题和材料分析题的解题思路和答题技巧。本书对过去11次考试，特别是对最近5次考试进行了详尽分析，便于考生把握知识点出题频率、占分比例、考查方式，并利于考生根据以上信息，预测下一次考试内容及方式、确定恰当的复习方法。本教材同市面上的其他同类型考试用书有所不同，每个模块前都呈现了知识结构、考情分析，内容部分每个知识点都配以相关的真题，帮助大家能更好地理解考试规律与掌握相关知识点。,16,825,0,36,https://wfqqreader-1252317822.image.myqcloud.com/cover/559/26923559/s_26923559.jpg
结构化面试高分一本通,2016-03-01 00:00:00,教育学习-考试,本书由面试教研、辅导一线的老师根据自身教研感悟和大量考生实际经验教训总结编写而成，具有针对性和指导性。本书从实际和考生需求出发，注重面试解题技巧、思维启发和拓展的训练，能够真正实现个性化答题，走出套路化培训误区。 本书有三个显著特点： 新颖性，全新的解题思路、全新的编写体例，让读者耳目一新，面试训练效果事半功倍；通俗化，本书语言通俗易懂，语言风格诙谐幽默，能让读者有快乐学习的感受，在轻松环境中快速提高面试能力；互动性，读者在阅读学习本书过程中的疑问，可以联系作者进行答疑（作者新浪微博：@许大可xk）。 本书适用于备战面试的考生、面试教学辅导教师及对面试感兴趣的读者。,16,0,0,33.6,https://wfqqreader-1252317822.image.myqcloud.com/cover/486/27110486/s_27110486.jpg
CFA一级中文精讲②（第3版）,2020-03-01 00:00:00,教育学习-考试,本书参照CFA协会官方教材编写，囊括全部核心内容和重点知识点，契合中国考生的实际情况，有利于考生快速阅读、备考。本书具有专业性、前沿性、实用性和有效性等特点，适合作为考生备考CFA一级的参考书。本书在第2版的基础上，根据CFA最新考纲纳入Fintech、大数据、人工智能、机器学习和区块链等内容，体现了协会与时俱进的方针，新增内容大大提升了整本书的趣味性和全面性。,43,942,0,49,https://wfqqreader-1252317822.image.myqcloud.com/cover/964/30762964/s_30762964.jpg
郭庆光《传播学教程》（第2版）【教材精讲＋考研真题解析】讲义与视频课程【20小时高清视频】,2019-08-21 00:00:00,教育学习-考试,不同于一般意义的传统图书，本书是一种包含高清视频课程的可互动学习的“图书”，是用“高清视频”和“传统电子书”两种方式结合精讲郭庆光《传播学教程》教材和名校考研真题的电子书【电子书＋高清视频课程（20小时）】。本书提供视频课程（教材和考研真题解析）的讲义内容，同时也提供教材的高清视频讲解。本书每章均由三部分组成：第一部分为知识框架图与重点导读，知识框架图勾勒本章所有知识点的结构脉络，本章重点则指出本章的重难点及出题点，帮助考生更好地从总体上把握知识脉络。第二部分为本章要点详解【20小时视频讲解】，完整讲述郭庆光《传播学教程》教材15章内容。该部分精讲详析本章重要知识点，介绍复习方法，透析核心考点。第三部分为配套考研真题解析，精选指定郭庆光《传播学教程》教材为考研参考书目的名校考研真题，并提供详尽答案，帮助考生强化训练以巩固本章知识点并学会灵活运用。并针对每章的重难点补充整理了典型题，并给出了详细的分析和解答。,18,0,0,200,https://wfqqreader-1252317822.image.myqcloud.com/cover/325/27039325/s_27039325.jpg
200个一定要学的英文词根词缀,2015-08-01 00:00:00,教育学习-考试,本书共收录100个常用英文词根、50个常用英文前缀和50个常用英文后缀，追本溯源，深度剖析了这些词根、词缀的起源及含义，并通过拆解例词、给出精到例句帮助读者理解和记忆。所选词汇为四六级难度，刚需又实用。还有拓展词汇和阶段检测题，有助于巩固所学知识。新东方人气讲师亲授配套网络课程，另配有标准美音朗读的音频，学习更加方便、轻松、高效。,60,726,0,5.99,https://wfqqreader-1252317822.image.myqcloud.com/cover/854/22595854/s_22595854.jpg
