title,publishTime,category,intro,maxFreeChapter,newRating,free,price,cover
田自秉《中国工艺美术史》配套题库【名校考研真题＋章节题库＋模拟试题】,2018-04-16 00:00:00,教育学习-考试,田自秉著《中国工艺美术史》是我国高校采用较多的美术类权威教材之一。为了帮助参加研究生入学考试指定考研参考书目为田自秉《中国工艺美术史》的考生复习专业课，我们根据该教材的名师课堂笔记及名校考研真题的命题规律精心编写了配套复习辅导用书。本题库包括以下三部分：第一部分为名校考研真题。精选名校考研真题，按照主要题型编排。每道真题均提供答案或解析。学员可以通过真题部分的练习来熟悉考研真题的特点，并测试自己的水平。第二部分为章节题库。遵循田自秉《中国工艺美术史》的章目编排，每一章都精心挑选经典常见考题，并予以详细解答。熟练掌握本书考题的解答，有助于学员理解和掌握有关考点，并提高解题能力。第三部分为模拟试题。根据历年考研真题的命题规律及热门考点进行押题，其试题数量、试题难度、试题风格与研究生入学考试真题基本保持一致。通过模拟试题的练习，学员既可以用来检测学习该考试科目的效果，又可以用来评估对自己的应试能力。,5,0,0,50,https://wfqqreader-1252317822.image.myqcloud.com/cover/650/27051650/s_27051650.jpg
2016年5月心理咨询师（三级）理论知识复习全书【核心讲义＋历年真题详解】,2016-12-01 00:00:00,教育学习-考试,圣才电子书产品内容全面，涵盖考研考博教辅图书；国内外经典教材辅导系列；证券金融类、工程类等各种资格考试辅导用书；各种职称考试辅导图书；外语、经济、理工类等相关考试辅导图书。,8,864,0,2.99,https://wfqqreader-1252317822.image.myqcloud.com/cover/735/848735/s_848735.jpg
CFA二级中文精讲②,2018-09-01 00:00:00,教育学习-考试,本书是CFA二级的辅导书，共包括道德规范和专业行为准则、数量分析、经济分析、财务报告与分析、公司理财、权益投资、固定收益、金融衍生产品、另类投资、组合管理10门学科的内容，每门学科内容都根据考纲展开了详细介绍，希望给广大考生提供帮助。,35,0,0,49,https://wfqqreader-1252317822.image.myqcloud.com/cover/453/23070453/s_23070453.jpg
公务员录用考试快速提分系列：面试精彩作答101例（2016移动互联版）,2016-01-01 00:00:00,教育学习-考试,"本书为即将走向面试考场的考生提供了一些切实可行的方法指导和理论补充,并搭配精彩作答范例帮助考生理解巩固，以使考生能够快速了解公务员结构化面试,丰富语言表达,拓展思维空间。总的来说,本书具有以下几个方面的特色:第一,思路细化、优化。为使考生能清晰地掌握答题的思路,本书对结构化面试的题型进行了进一步细化,每一个大题型中不同的分类都归纳了不同的思路，以更加贴近答题的需要。第二,更多知识“码”上学。一个个方方正正的二维码是本书又一道亮丽的“风景”，考生只要扫一扫二维码,便可免费聆听名师对对应知识点和经典例题的精彩讲解。第三,实战与面试真题精选。本书精心汇编了2015年国家及各地公务员面试真题,以便考生能够通过练习,更真切地体会到面试的精髓,掌握其中的实质。",6,0,0,5,https://wfqqreader-1252317822.image.myqcloud.com/cover/655/829655/s_829655.jpg
陈力丹《新闻理论教程》笔记和课后习题（含考研真题）详解,2019-04-24 00:00:00,教育学习-考试,本书特别适用于参加研究生入学考试指定考研参考书目为陈力丹《新闻理论教程》的考生。也可供各大院校学习陈力丹《新闻理论教程》的师生参考。21世纪远程教育精品教材·新闻与传播学系列《新闻理论教程》（陈力丹等著，中国人民大学出版社）是我国高校广泛采用的新闻理论权威教材之一，也被众多高校（包括科研机构）指定为“新闻理论”考研考博专业课参考书目。为了帮助参加研究生入学考试指定考研参考书目为陈力丹著的《新闻理论教程》的考生复习专业课，我们根据教材和名校考研真题的命题规律精心编写了陈力丹《新闻理论教程》辅导用书：陈力丹《新闻理论教程》笔记和课后习题（含考研真题）详解本书是陈力丹《新闻理论教程》教材的配套电子书，主要包括以下内容：（1）整理名校笔记，浓缩内容精华。本书每章的复习笔记均对该章的重难点进行了整理，并参考了国内名校名师讲授该教材的课堂笔记。因此，本书的内容几乎浓缩了该教材的所有知识精华。（2）精选考研真题，巩固重难点知识。为了强化对重要知识点的理解，本书精选了部分名校近年的新闻理论考研（博）真题，这些学校均以该教材作为考研（博）参考教材。所选考研（博）真题基本涵盖了每章的考点和难点，特别注重理论联系实际，凸显当前热点。（3）解析课后习题，补充典型题。本书参考大量新闻理论相关辅导资料，对该教材的课（章）后习题进行了详细的分析和解答，并针对每章的重难点补充整理了典型题，对相关重要知识点进行了延伸和归纳。,8,0,0,20,https://wfqqreader-1252317822.image.myqcloud.com/cover/281/27043281/s_27043281.jpg
2020年河南省事业单位招聘考试《公共基础知识》考点精讲及典型题（含历年真题）详解,2018-06-03 00:00:00,教育学习-考试,本书特别适用于参加河南省事业单位招聘考试的考生。本书遵循《河南省事业单位招聘考试大纲》对公共基础知识的考查要求，共分为11章，包括事业单位概况与职业道德、地理国情、政治、法律、经济、管理、公文知识、科技生活、历史人文、计算机知识以及主观材料题。每章都由两部分组成：第一部分为考点精讲，梳理核心知识点，建立系统而准确的知识脉络，方便备考者记忆。第二部分为典型题（含历年真题）详解，有针对性地精选了近年来河南省事业单位招聘考试的部分真题及典型模拟题，并作出了详尽解析，对考生掌握命题人的出题思路、形成良好的思维方式大有裨益；另外我们还精选了大量典型例题，也给出了解析，这对备考者巩固知识点，提升解题技巧，掌握未来考试方向大有帮助和启发。,18,0,0,20,https://wfqqreader-1252317822.image.myqcloud.com/cover/999/27046999/s_27046999.jpg
2020年河北省事业单位招聘考试《公共基础知识》考点精讲及典型题（含历年真题）详解,2018-06-03 00:00:00,教育学习-考试,本书特别适用于参加河北省事业单位招聘考试的考生。本书遵循《河北省事业单位招聘考试大纲》对公共基础知识的考查要求，共分为11章，包括事业单位概况与职业道德、地理国情、政治、法律、经济、管理、公文知识、科技生活、历史人文、计算机知识以及主观材料题。每章都由两部分组成：第一部分为考点精讲，梳理核心知识点，建立系统而准确的知识脉络，方便备考者记忆。第二部分为典型题（含历年真题）详解，有针对性地精选了近年来河北省事业单位招聘考试的部分真题及典型模拟题，并作出了详尽解析，对考生掌握命题人的出题思路、形成良好的思维方式大有裨益；另外我们还精选了大量典型例题，也给出了解析，这对备考者巩固知识点，提升解题技巧，掌握未来考试方向大有帮助和启发。,18,0,0,20,https://wfqqreader-1252317822.image.myqcloud.com/cover/975/27046975/s_27046975.jpg
中国政法大学法学考研专业课真题详解（2007—2021）,2021-04-01 00:00:00,教育学习-考试,编写和正式出版本书的目的即为所有报考法大法学硕士的考生能有一本使用方便、最新更新的真题，因此是适合“701法学综合”使用的。由于2015年以前考查的一些科目，如行政法与行政诉讼法、三国法、刑事诉讼法等，现在并不是统考内容，也就是很多考生是不考的，因此我们在编写这本真题的时候，为了让考生使用更加方便，更适应现在的考试模式，对2015年及以前的真题进行了重新整理和编排。本书按照现在“701法学综合”的考查模式，整理出了2007年-2015年法大考研真题中的法理学、宪法学、民法学、民事诉讼法学、刑法学试题中的主观题并附加参考答案及评析标准。同时包含2016年-2021年法大法学硕士考研“701法学综合”的全部题目并附加参考答案及评析标准。,7,0,0,20.99,https://weread-1258476243.file.myqcloud.com/weread/cover/18/3300021918/s_3300021918.jpg
托福写作白皮书,2014-12-01 00:00:00,教育学习-考试,《托福写作白皮书》凝聚了两位作者近十年的托福教学精华：透析写作评分标准，挖掘托福写作评分要领；根据教学经验和考生反馈，提供最实用、最具实战性的托福综合写作和独立写作方法，并首创速记表、个性化模板以及“三招六式”扩思路法，根据历年机经重点话题精心编写30余篇范文，以便考生深切领会方法精髓；范文经外籍专家审校，与托福写作高分标准极为契合。本书有助于帮助托福写作零基础考生夺取高分，实现从“菜鸟”到“写作达人”的逆袭。,13,0,0,6.99,https://wfqqreader-1252317822.image.myqcloud.com/cover/251/22866251/s_22866251.jpg
罗斯《公司理财》（第9版）笔记和课后习题（含考研真题）详解[视频讲解],2017-08-12 00:00:00,教育学习-考试,本书特别适用于参加研究生入学考试指定考研参考书目为罗斯《公司理财》的考生，也可供各大院校学习罗斯《公司理财》的师生参考。罗斯主编的《公司理财》（第9版）（机械工业出版社）是我国众多高校采用的公司理财优秀教材，也被众多高校（包括科研机构）指定为“金融类”专业考研参考书目。作为该教材的学习辅导书，本书具有以下几个方面的特点：1．整理名校笔记，浓缩内容精华。在参考了国内外名校名师讲授罗斯主编的《公司理财》的课堂笔记基础上，本书每章的复习笔记部分对该章的重难点进行了整理，因此，本书的内容几乎浓缩了配套教材的知识精华。2．解析课后习题，提供详尽答案。本书以罗斯主编的《公司理财》为基本依据，参考了该教材的国内外配套资料和其他公司理财教材的相关知识对该教材的课（章）后习题进行了详细的分析和解答，并对相关重要知识点进行了延伸和归纳。3．精选名校真题，囊括所有考点。本书所选考研真题基本来自指定罗斯主编的《公司理财》为考研参考书目的院校，并对每道题（包括概念题）都尽可能给出详细的参考答案，条理分明，便于记忆。精选部分考研真题进行视频讲解。4．补充难点习题，强化相关知识。为了进一步巩固和强化各章知识难点的复习，每章参考了名校题库、众多教材及相关资料，精选了部分难题，并对相关重要知识点进行了延伸和归纳。可以说本书的试题都经过了精心挑选，博选众书，取长补短。本书按照教材内容进行编写，共分31章，每章由三部分组成：第一部分为复习笔记，总结本章的重难点内容；第二部分是课（章）后习题详解，对课后习题进行了详解的分析和解答；第三部分为考研真题与典型题详解，精选近年考研真题，并提供了详细的解答。,28,0,0,80,https://wfqqreader-1252317822.image.myqcloud.com/cover/377/27039377/s_27039377.jpg
2020年安徽省事业单位招聘考试《公共基础知识》考点精讲及典型题（含历年真题）详解,2019-01-03 00:00:00,教育学习-考试,本书特别适用于参加安徽省事业单位招聘考试的考生。本书遵循《安徽省事业单位招聘考试大纲》对公共基础知识的考查要求，共分为11章，包括事业单位概况与职业道德、地理国情、政治、法律、经济、管理、公文知识、科技生活、历史人文、计算机知识以及主观材料题。每章都由两部分组成：第一部分为考点精讲，梳理核心知识点，建立系统而准确的知识脉络，方便备考者记忆。第二部分为典型题（含历年真题）详解，有针对性地精选了近年来安徽省事业单位招聘考试的部分真题及典型模拟题，并作出了详尽解析，对考生掌握命题人的出题思路、形成良好的思维方式大有裨益；另外我们还精选了大量典型例题，也给出了解析，这对备考者巩固知识点，提升解题技巧，掌握未来考试方向大有帮助和启发。,18,0,0,50,https://wfqqreader-1252317822.image.myqcloud.com/cover/857/27038857/s_27038857.jpg
词汇（英语专业八级考试培训教程）,2012-08-01 00:00:00,教育学习-考试,本书是针对英语专业八级考试的专项词汇书。本书依照《高校英语专业八级考试大纲》（2004年新版）的有关规定、根据《高等学校英语专业英语教学大纲》的要求、参照《高等学校英语专业全程通用词汇表》。,22,0,0,16.8,https://wfqqreader-1252317822.image.myqcloud.com/cover/601/26244601/s_26244601.jpg
2020年现代汉语考点归纳及典型题（含考研真题）详解,2019-01-05 00:00:00,教育学习-考试,本书主要具有以下几个方面的特点：1．归纳考研重点，浓缩知识精华。本书综合了现代汉语多个版本的经典教材，根据各高校的教学大纲、考试大纲等设计章节，每章的考点归纳均对该章的重难点进行了整理，并参考了国内名校名师讲授该教材的课堂笔记。因此，本书的内容几乎浓缩了该学科的所有知识精华。2．精编考研真题，直击命题规律。本书精选详析了部分名校近年来的相关考研真题。所选考研真题基本涵盖了每章的考点和难点，考生可以据此了解考研真题的命题风格和难易程度，并检验自己的复习效果。3．详解典型试题，培养解题思路。本书精选了大量具有很强代表性的典型题，通过这些试题及其详解，读者可以在很大程度上判断和把握相关院校考研的出题特点和解题要求等，反复练习还可以培养敏捷的解题思路，巩固重点难点知识。,4,0,0,40,https://wfqqreader-1252317822.image.myqcloud.com/cover/110/27054110/s_27054110.jpg
2019年助理统计师《统计专业知识和实务（初级）》复习全书【核心讲义＋历年真题详解】,2018-12-25 00:00:00,教育学习-考试,本书是全国统计专业技术资格考试——助理统计师考试科目“统计专业知识和实务（初级）”的复习全书，参考多本统计学经典教材和复习资料精心编写而成，包括四部分内容：第一部分对助理统计师考试、复习策略进行解读；第二部分严格按照“考试大纲”中所列的考试内容，全面讲解考试重点、难点内容，有助于学员在学习教材知识的同时了解与教材相关的真题出题点、命题规律，并掌握解题思路（注意：章节中用“*”标示的内容初级不作考试要求）；第三部分为历年真题及详解。根据最新指定教材和考试大纲的要求及相关法律法规，对历年真题的试题从难易程度、考察知识点等方面进行全面、细致的解析；第四部分为模拟试题及详解，按照最新考试大纲及近年的命题规律精心编写了模拟试题，并根据指定教材和法律法规对大部分试题进行了详细的分析和说明。,6,0,0,30,https://wfqqreader-1252317822.image.myqcloud.com/cover/288/27053288/s_27053288.jpg
2020年同等学力申硕《公共管理学科综合水平考试大纲及指南》（第3版）课后习题和考研真题（含典型题）详解,2016-09-20 00:00:00,教育学习-考试,2020年同等学力申硕《公共管理学科综合水平考试大纲及指南》（第3版）课后习题和考研真题（含典型题）详解,34,0,0,30,https://wfqqreader-1252317822.image.myqcloud.com/cover/431/27042431/s_27042431.jpg
《跟单信用证统一惯例》（UCP600）中英文对照版,2016-12-01 00:00:00,教育学习-考试,圣才电子书产品内容全面，涵盖考研考博教辅图书；国内外经典教材辅导系列；证券金融类、工程类等各种资格考试辅导用书；各种职称考试辅导图书；外语、经济、理工类等相关考试辅导图书。,12,0,0,2.99,https://wfqqreader-1252317822.image.myqcloud.com/cover/752/848752/s_848752.jpg
2019年统计师《统计工作实务（中级）》复习全书【核心讲义＋历年真题详解】,2018-09-19 00:00:00,教育学习-考试,本书是全国统计专业技术资格考试——中级统计师考试科目“统计工作实务（中级）”的复习全书，参考多本统计学经典教材和复习资料精心编写而成，包括四部分内容：第一部分对中级统计师考试、复习策略进行解读；第二部分严格按照“考试大纲”中所列的考试内容，全面讲解考试重点、难点内容，有助于学员在学习教材知识的同时了解与教材相关的真题出题点、命题规律，并掌握解题思路；第三部分为历年真题名师详解。根据最新指定教材和考试大纲的要求及相关法律法规，对历年真题从难易程度、考察知识点等方面进行全面、细致的解析；第四部分为模拟试题，按照最新考试大纲及近年的命题规律精心编写了模拟试题，并根据指定教材和法律法规对所有试题进行了详细的分析和说明。,11,0,0,30,https://wfqqreader-1252317822.image.myqcloud.com/cover/202/27053202/s_27053202.jpg
黄桦《税收学》（第4版）笔记和课后习题（含考研真题）详解,2019-06-01 00:00:00,教育学习-考试,黄桦主编的《税收学》（第4版）（中国人民大学出版社）被列为普通高等教育“十二五”国家级规划教材，是我国众多高校采用的税收学优秀教材，也被众多高校（包括科研机构）指定为税务专业考研参考书目。作为该教材的学习辅导书，本书具有以下几个方面的特点：1．整理名校笔记，浓缩内容精华。在参考了国内外名校名师讲授黄桦主编的《税收学》的课堂笔记基础上，本书每章的复习笔记部分对该章的重难点进行了整理，因此，本书的内容几乎浓缩了配套教材的知识精华。2．解析课后习题，提供详尽答案。本书以黄桦主编的《税收学》（第4版）为基本依据，参考了该教材的配套资料和其他税收学教材的相关知识对该教材的课（章）后习题进行了详细的分析和解答，并对相关重要知识点进行了延伸和归纳。3．精选名校真题，囊括所有考点。本书各章节后均附有各大名校的历年考研真题，第4版在原有基础上补充了近三年的考研真题，同时结合教材内容和最新政策，对原有题目及答案进行了更新，方便读者掌握最新的考试动向和政策内容。4．补充难点习题，强化相关知识。为了进一步巩固和强化各章知识难点的复习，每章参考了名校题库、众多教材及相关资料，精选了部分难题，并对相关重要知识点进行了延伸和归纳。可以说本书的试题都经过了精心挑选，博选众书，取长补短。本书严格按照教材内容进行编写，共分15章，每章由三部分组成：第一部分为复习笔记，总结本章的重难点内容；第二部分是课（章）后习题详解，对第4版的所有习题都进行了详解的分析和解答；第三部分为考研真题与典型题详解，精选近年考研真题，并提供了详细的解答。,13,0,0,30,https://wfqqreader-1252317822.image.myqcloud.com/cover/469/27054469/s_27054469.jpg
2020年全国硕士研究生招生考试临床医学综合能力（中医）中医基础理论考点归纳与历年真题详解,2017-06-24 00:00:00,教育学习-考试,"本书特别适用于参加研究生入学考试的考生，也可供各大院校师生学习参考。为了帮助参加考研临床医学综合能力考试的考生深入把握考点，提高专业课成绩，我们根据国家教育部考试中心颁布的《全国硕士研究生招生考试临床医学综合能力（中医）考试大纲》的要求，认真研究了临床医学综合能力（中医）的历年考研真题，并参考了大量中医专业相关资料和文献，编写了临床医学综合能力（中医）辅导系列：1．全国硕士研究生招生考试临床医学综合能力临床医学人文精神考点归纳与典型题详解2．全国硕士研究生招生考试临床医学综合能力（中医）中医基础理论考点归纳与历年真题详解3．全国硕士研究生招生考试临床医学综合能力（中医）中医诊断学考点归纳与历年真题详解4．全国硕士研究生招生考试临床医学综合能力（中医）中药学考点归纳与历年真题详解5．全国硕士研究生招生考试临床医学综合能力（中医）方剂学考点归纳与历年真题详解6．全国硕士研究生招生考试临床医学综合能力（中医）中医内科学考点归纳与历年真题详解7．全国硕士研究生招生考试临床医学综合能力（中医）针灸学考点归纳与历年真题详解8．全国硕士研究生招生考试临床医学综合能力临床医学人文精神配套题库【章节题库＋模拟试题】9．全国硕士研究生招生考试临床医学综合能力（中医）中医基础理论配套题库【历年真题＋章节题库＋模拟试题】10．全国硕士研究生招生考试临床医学综合能力（中医）中医诊断学配套题库【历年真题＋章节题库＋模拟试题】11．全国硕士研究生招生考试临床医学综合能力（中医）中药学配套题库【历年真题＋章节题库＋模拟试题】12．全国硕士研究生招生考试临床医学综合能力（中医）方剂学配套题库【历年真题＋章节题库＋模拟试题】13．全国硕士研究生招生考试临床医学综合能力（中医）中医内科学配套题库【历年真题＋章节题库＋模拟试题】14．全国硕士研究生招生考试临床医学综合能力（中医）针灸学配套题库【历年真题＋章节题库＋模拟试题】15．全国硕士研究生招生考试临床医学综合能力（中医）过关必做3000题（含历年真题）16．全国硕士研究生招生考试临床医学综合能力（中医）题库【历年真题＋模拟试题】本书严格遵循最新的《全国硕士研究生招生考试临床医学综合能力（中医）考试大纲》关于“中医基础理论”部分的要求，共分为8章，每章均对大纲规定考点进行了详尽解析,相关考点插入往年真题。具体来说，有以下特色：（1）归纳考点：根据考纲要求，系统地梳理了核心知识点，建立起系统而精确的知识脉络，可方便考生快速有效地掌握考试要点，达到事半功倍的效果。（2）详解真题：精选近年考研临床医学综合能力（中医）“中医基础理论”部分的真题，并作出了详尽解析，插入到相应考点后面，对考生了解某一考点的出题情况、掌握命题者的出题思路、巩固重难点知识都大有裨益。（3）免费更新：本书定期会进行修订完善，补充最新的考研真题及详解。对于最新补充的内容，均可以免费升级获得。 ",5,0,0,30,https://wfqqreader-1252317822.image.myqcloud.com/cover/476/27048476/s_27048476.jpg
闫佳《毛泽东思想和中国特色社会主义理论体系概论》笔记和课后习题（含考研真题）详解,2019-01-24 00:00:00,教育学习-考试,高等学校马克思主义理论与思想政治教育推荐教材《毛泽东思想和中国特色社会主义理论体系概论》（闫佳主编，高等教育出版社）是我国高校广泛采用的毛泽东思想和中国特色社会主义理论体系概论权威教材之一，也被众多高校（包括科研机构）指定为考研考博专业课参考书目。为了帮助参加研究生入学考试指定考研参考书目为闫佳主编的《毛泽东思想和中国特色社会主义理论体系概论》的考生复习专业课，我们根据教材和名校考研真题的命题规律精心编写了闫佳《毛泽东思想和中国特色社会主义理论体系概论》的配套辅导书。,13,0,0,50,https://wfqqreader-1252317822.image.myqcloud.com/cover/561/27029561/s_27029561.jpg
