title,publishTime,category,intro,maxFreeChapter,newRating,free,price,cover
植物大战僵尸之武器秘密之你问我答科学漫画：昆虫卷,2014-06-01 00:00:00,童书-漫画卡通,昆虫是世界上非常繁盛的动物类群，形态多样，遍布全球。昆虫世界里的知识浩瀚广博、精彩纷呈、千奇百怪。笑江南创作的《科学漫画·昆虫卷》通过一个个轻松诙谐的漫画故事，讲述常见昆虫和珍稀昆虫的77个有趣的知识点，从而揭开昆虫世界的小小一角，让小读者感受昆虫世界的奇妙，初步了解生物进化、自然选择的神奇和科学的力量，并由此激发出满怀着“十万个为什么”的好奇心，进入更为广阔、妙趣横生的科学世界。本书为“植物大战僵尸2武器秘密之你问我答科学漫画系列”的其中一本。,25,807,0,12.99,https://wfqqreader-1252317822.image.myqcloud.com/cover/325/30006325/s_30006325.jpg
植物大战僵尸2武器秘密之你问我答科学漫画：数学卷,2016-09-01 00:00:00,童书-漫画卡通,数学是什么？学了一辈子数学的人或许也无法给出问题的答案。但我们生活的每一天都与数学息息相关，生活中，一些稀松平常的细节中，往往蕴藏着不易被人察觉的数学智慧。本书从日常生活出发，通过一个个轻松诙谐的漫画故事，讲述了46个有趣的数学知识和文化掌故，让小读者在阅读中爱上数学，从而激发进一步探索数学的兴趣。本书为“植物大战僵尸2武器秘密之你问我答科学漫画系列”的其中一本。,16,857,0,12.99,https://wfqqreader-1252317822.image.myqcloud.com/cover/367/30006367/s_30006367.jpg
植物大战僵尸2武器秘密之你问我答科学漫画：极地与冰川,2016-05-01 00:00:00,童书-漫画卡通,憨态可掬的企鹅，高大威猛的北极熊；美丽壮观的冰山，变幻莫测的极光……位于地球两端的南北极，拥有无穷的魅力，也珍藏着无数的秘密。数百年来，人们从未停止过探索南北极的脚步。对于南北极，你了解多少呢？本书通过一个个轻松诙谐的漫画故事，讲述了49个有关极地与冰川的知识点，让小读者初步了解南北极，并由此激发出对自然科学的好奇心，努力去探索更为广阔、妙趣横生的科学世界。本书为“植物大战僵尸2武器秘密之你问我答科学漫画系列”的其中一本。,16,878,0,12.99,https://wfqqreader-1252317822.image.myqcloud.com/cover/340/30006340/s_30006340.jpg
鸭子的假期,2016-09-01 00:00:00,童书-漫画卡通,一只鸭子到海岛度假，它渴望无人打扰的悠闲假期。但是有人居然翻开了这本书，随着一页一页地翻看，鸭子的假期开始变得有趣了（遇到了越来越糟糕的事情）。而这一切仿佛都是翻书人的错，鸭子开始的时候好言相劝，后来爱答不理，最后只能气愤而无奈地说：“你翻吧，我要离开这本书。”结果一群搞不清楚状况的海盗出现了……,5,789,0,21,https://wfqqreader-1252317822.image.myqcloud.com/cover/11/921011/s_921011.jpg
植物大战僵尸2武器秘密之你问我答科学漫画：世界之最卷,2014-06-01 00:00:00,童书-漫画卡通,“世界之最”是人们津津乐道、常谈不衰的话题，如：最大的沙漠在哪里？最高的山峰有多高？还有最毒的树种、最古老的文字、最早的天文望远镜等等。本书通过一个个轻松诙谐的漫画故事，讲述65个“世界之最”的问题，从而揭开大千世界的小小一角，让小读者初步了解妙趣横生的自然极限，感受人类社会以及科学文化发展的一个又一个奇迹，并由此激发出“十万个为什么”的好奇心，去探索更为神奇的世界奥秘。本书为“植物大战僵尸2武器秘密之你问我答科学漫画系列”的其中一本。,23,869,0,12.99,https://wfqqreader-1252317822.image.myqcloud.com/cover/365/30006365/s_30006365.jpg
植物大战僵尸之武器秘密之你问我答科学漫画：地理卷,2015-04-01 00:00:00,童书-漫画卡通,人类居住的地球是一个古老、奇妙的天体，它地貌多样，气候多变，资源丰富。地球的变化万千和无穷奥秘，让一代代人为之着迷，不断探究。本书通过一个个轻松诙谐的漫画故事，讲述了有关自然地理和人文地理的77个有趣的知识点，从而揭开神秘地理现象的小小一角，让小读者关注地球环境、学习地理知识，初步了解地理世界的奇妙，并由此激发出满怀着“十万个为什么”的好奇心，进入更为广阔、妙趣横生的科学世界。本书为“植物大战僵尸2武器秘密之你问我答科学漫画系列”的其中一本。,24,913,0,12.99,https://wfqqreader-1252317822.image.myqcloud.com/cover/316/30006316/s_30006316.jpg
植物大战僵尸2武器秘密之你问我答科学漫画：体育与运动卷,2016-03-01 00:00:00,童书-漫画卡通,体育与运动，能增强个人的身体素质，促进身心健康；能丰富社会的文化生活，形成和谐氛围；能提高国家的向心力和凝聚力，促进民族团结。参与体育运动，意味意味着自我挑战、自我完善、自我教育的开始。今天，你运动了吗？本书通过一个个轻松诙谐的漫画故事，讲述了64个体育与运动相关的知识点，让小读者初步了解到体育的魅力，以更为健康的身心，更为积极的态度，去探索更为广阔、妙趣横生的科学世界。本书为“植物大战僵尸2武器秘密之你问我答科学漫画系列”的其中一本。,21,910,0,12.99,https://wfqqreader-1252317822.image.myqcloud.com/cover/369/30006369/s_30006369.jpg
麦克的小鱼,2017-08-01 00:00:00,童书-漫画卡通,麦克生日的时候，妈妈给他买了两条鱼。大点的叫大红，小点的叫小红。麦克兴高采烈地喂养小鱼，并带着他们玩耍，和他们聊天，着急地盼着他们快快长大。大红怀孕了，据说要生很多小小鱼。麦克激动地给他们喂多了鱼食。第二天，大红、小红都变得蔫头耷脑的，鱼缸里的水也浑浊起来。结果会怎么样呢？大红、小红会死吗？大红能够挺过难关，最终生下一群小小鱼吗？,4,759,0,13.99,https://wfqqreader-1252317822.image.myqcloud.com/cover/268/937268/s_937268.jpg
妈妈让我卖茄子,2018-04-01 00:00:00,童书-漫画卡通,我那温柔的妈妈，有一天突然变得像鬼一样厉害，让我一个人去卖茄子。这一切究竟是为什么呢？四十年前发生在日本乡村小镇的故事，今天仍可以感动千万人。,4,764,0,17.88,https://wfqqreader-1252317822.image.myqcloud.com/cover/900/22739900/s_22739900.jpg
新黑猫警长第一辑：时空奇案,2016-12-31 00:00:00,童书-漫画卡通,眼睛瞪得像铜铃，射出闪电般的机灵；耳朵竖得像天线，能听见一切可疑的声音！对了，我就是黑猫警长！我用智慧、果敢和卓越的领导才能，带领着白猫警士们消灭一切来犯之敌，侦破一个又一个案件，誓死保卫森林市的安全！黑猫警长的形象和故事已经在中国少年儿童的心中深深地扎下了根。经典不会随时间的磨砺而黯然失色，只会在岁月的砺炼中愈加璀璨！你瞧！黑猫警长又出发了！全新的黑猫警长系列情节更加曲折、引人入胜，大家将会领略到黑猫警长利用高科技破案的风采，在错综复杂的故事中增长知识和智慧！,4,880,0,7.52,https://wfqqreader-1252317822.image.myqcloud.com/cover/54/23730054/s_23730054.jpg
植物大战僵尸2武器秘密之你问我答科学漫画：森林与湖泊卷,2016-09-01 00:00:00,童书-漫画卡通,森林与湖泊是人类的重要生存环境，关系着人类的繁衍生息和社会发展。如何保护、利用森林与湖泊资源，实现人类与自然生态系统的协调发展，是我们一直在努力探究的重要命题。本书通过一个个轻松诙谐的漫画故事，讲述了关于森林与湖泊的60个知识点，让小读者初步了解森林与湖泊的概括和现状，并由此激发出“十万个为什么”的好奇心，进入更为广阔的、妙趣横生的科学世界。本书为“植物大战僵尸2武器秘密之你问我答科学漫画系列”的其中一本。,19,872,0,12.99,https://wfqqreader-1252317822.image.myqcloud.com/cover/359/30006359/s_30006359.jpg
植物大战僵尸2武器秘密之你问我答科学漫画：人体卷,2014-02-01 00:00:00,童书-漫画卡通,人体是一台很复杂的“机器”，组成它的各种“零件”就是人体的各个器官。这台精妙的“机器”以天衣无缝的配合使我们能听到美妙的音乐，看到缤纷的画面，感受精彩的大千世界。本书通过一个个轻松诙谐的漫画故事，讲述了有关人体的77个有趣的知识点，从而揭开人体世界的小小一角，让小读者感受人体的奇妙，初步了解自己的身体，并由此激发出满怀着“十万个为什么”的好奇心，进入更为广阔、妙趣横生的科学世界。本书为“植物大战僵尸2武器秘密之你问我答科学漫画系列”的其中一本。,25,878,0,12.99,https://wfqqreader-1252317822.image.myqcloud.com/cover/329/30006329/s_30006329.jpg
植物大战僵尸之武器秘密之你问我答科学漫画：发明与发现卷,2014-05-01 00:00:00,童书-漫画卡通,世界上有许多神奇的事物和现象，令人叹为观止。通过一代代人的发明与发现，人类一直在竭力探究这个神奇的世界。微波炉是谁发明的？为什么人们要发明榨汁机？粉笔是怎么发明出来的？……本书通过一个个轻松诙谐的漫画故事，讲述了有关科普的77个有趣的知识点，从而揭开科普世界的小小一角，让小读者感受世界的奇妙，初步了解基本的科普知识，并由此激发出满怀着“十万个为什么”的好奇心，进入更为广阔、妙趣横生的科学世界。本书为“植物大战僵尸2武器秘密之你问我答科学漫画系列”的其中一本。,25,856,0,12.99,https://wfqqreader-1252317822.image.myqcloud.com/cover/320/30006320/s_30006320.jpg
植物大战僵尸2武器秘密之你问我答科学漫画：医学与疾病卷,2016-01-01 00:00:00,童书-漫画卡通,医学是一门从预防到治疗疾病的系统学科，以防治生理疾病和保障人体生理健康为目的，与人类的工作、学习和生活密切相关。如何让人不生病、少生病，如何在生病后进行科学治疗，一直是人类在探究的重要问题。本书通过一个个轻松诙谐的漫画故事，讲述了关于医学与疾病的48个知识点，让小读者初步了解医学的基本常识，学习预防疾病的常见方法，并由此激发出“十万个为什么”的好奇心，进入更为广阔、妙趣横生的科学世界。本书为“植物大战僵尸2武器秘密之你问我答科学漫画系列”的其中一本。,16,843,0,12.99,https://wfqqreader-1252317822.image.myqcloud.com/cover/378/30006378/s_30006378.jpg
小学生安全漫画套装,2020-05-04 00:00:00,童书-漫画卡通,"真正能保护孩子一生的是从小建立正确强烈的安全意识！延续超级畅销书《小学生心理学漫画》的创作风格，运用趣味漫画的形式，场景化地讲述了孩子日常生活中会遇到的居家安全问题，有效帮助孩子认识到生活中的潜在危险,让孩子学会自我保护。小学生安全读本，漫画还原149个安全隐患，权威专家编写，从居家安全、出行安全、网络安全、校园安全等案例出发，给孩子的安全支招，循序渐进地提升孩子的安全意识和自护能力。",25,750,0,69.99,https://wfqqreader-1252317822.image.myqcloud.com/cover/225/31702225/s_31702225.jpg
植物大战僵尸2武器秘密之你问我答科学漫画：趣味实验卷,2016-09-01 00:00:00,童书-漫画卡通,柠檬可以发电，报纸可以爬墙，大头针可以制作成指南针，气球不用吹也能膨胀变大……生活中有太多的科学原理值得探索，有太多的趣味实验值得操作。为了提高孩子们的动手动脑能力，让他们更轻松地体验科学游戏的乐趣，本书通过一个个轻松诙谐的漫画故事，讲述了几十个科学实验的有趣的知识点，让小读者以发现的眼光审视四周，以探索的视角研究谜题，初步了解世界的丰富多彩、奇幻美妙，并由此激发出满怀着“十万个为什么”的好奇心，进入更为广阔、妙趣横生的科学世界。本书为“植物大战僵尸2武器秘密之你问我答科学漫画系列”的其中一本。,13,791,0,12.99,https://wfqqreader-1252317822.image.myqcloud.com/cover/387/30006387/s_30006387.jpg
你们好陌生人,2017-08-01 00:00:00,童书-漫画卡通,美丽森林的一棵大树上，住着小松鼠和他的妈妈。小松鼠刚生下来的时候，腿脚不太好，从树上下去不太方便。妈妈怕小松鼠一个人在家会孤单，就用松果壳给他做了个小电话。这样，妈妈出去工作的时候，小松鼠就可以和森林的陌生人聊聊天。小松鼠试着拿起了电话，说了一声：你好，陌生人。结果神奇的事情发生了，他在电话结识了一个这样的陌生人——这个陌生人，有长长的耳朵，长长的鼻子，长长的尾巴，强壮的角，肚皮雪白，后背漆黑，黑色眼睛外头还有一圈漂亮的黑色花纹，头上有红色的肉冠，早饭就能吃掉足球场那么大片的青草……他是谁呢？他的真相到底是什么样呢？小松鼠很好奇！,4,811,0,13.99,https://wfqqreader-1252317822.image.myqcloud.com/cover/254/937254/s_937254.jpg
新黑猫警长第四辑：废墟里的恶魔,2016-12-31 00:00:00,童书-漫画卡通,眼睛瞪得像铜铃，射出闪电般的机灵；耳朵竖得像天线，能听见一切可疑的声音！对了，我就是黑猫警长！我用智慧、果敢和卓越的领导才能，带领着白猫警士们消灭一切来犯之敌，侦破一个又一个案件，誓死保卫森林市的安全！黑猫警长的形象和故事已经在中国少年儿童的心中深深地扎下了根。经典不会随时间的磨砺而黯然失色，只会在岁月的砺炼中愈加璀璨！你瞧！黑猫警长又出发了！全新的黑猫警长系列情节更加曲折、引人入胜，大家将会领略到黑猫警长利用高科技破案的风采，在错综复杂的故事中增长知识和智慧！,4,868,0,7.52,https://wfqqreader-1252317822.image.myqcloud.com/cover/88/23730088/s_23730088.jpg
巫婆阿丽养了三个小家伙,2017-08-01 00:00:00,童书-漫画卡通,所有的巫婆都害怕小孩，因为他们会无休无止地吵闹。巫婆阿丽也一样，但是她养了三只小宠物。黑猫巴特是阿丽小时候的生日礼物。癞蛤蟆乌拉拉是阿丽中学毕业的纪念品。蜥蜴喳喳是阿丽不久前收养的小可怜。三个小家伙一见面就吵得不可开交，整天打打闹闹。家里那真是鸡飞狗跳。日子一天天鸡飞狗跳地过着，有时候出离愤怒的阿丽会夺门而出，出去躲躲清闲。有一天，阿丽实在忍无可忍，就念了一句咒语，将三个小家伙变成了雕像。三个成天打闹的小家伙，一动不动。第一天，阿丽终于松了口气；第二天，阿丽心情大好；第三天，阿丽觉得实在太轻松了。但是第四天，阿丽感觉有点空虚。此后好几天，感觉越来越糟糕……结果会怎么样呢？,4,732,0,13.99,https://wfqqreader-1252317822.image.myqcloud.com/cover/264/937264/s_937264.jpg
萌熊碎碎念,2020-09-01 00:00:00,童书-漫画卡通,《萌熊碎碎念》是一部青春治愈系漫画集，包含校园篇、家庭篇、出国游学篇 、疫情居家篇、熊熊小脑洞五个部分。主人公萌熊是一个天真可爱的小女孩，她爱观察，爱创作，时而脑洞大开，时而自嘲化解生活中的小尴尬。她在有爱的家庭里 ，有爱的校园里，发生了许多小糗事。她永远阳光，积极地努力生活着。作者杨悦晗是一个十四岁的初中学生 ，从小爱好绘画，她的作品风格充满童趣。漫画内容轻松可爱，带给读者软萌的治愈感。,4,692,0,12.8,https://wfqqreader-1252317822.image.myqcloud.com/cover/143/37699143/s_37699143.jpg
摘星星,2017-08-01 00:00:00,童书-漫画卡通,森林村的绵羊德德决定给整天忙着工作的爸爸妈妈准备一个礼物。翻遍了《森林全书》，德德最后决定摘一颗星星送给爸爸妈妈。他用铲子挖，用鱼竿钓……脑汁绞尽，还是根本够不着。有爱的孩子创意无限，德德很快就有了主意。他种下一颗种子，天天浇水、施肥、捉虫子，夜以继日。眼看着种子就长成了参天大树，星星就挂在树梢……结果呢——德德是否摘到了星星呢？爸爸妈妈又是否喜欢德德的礼物呢？,4,789,0,13.99,https://wfqqreader-1252317822.image.myqcloud.com/cover/276/22623276/s_22623276.jpg
植物大战僵尸2武器秘密之你问我答科学漫画：天文卷,2015-11-01 00:00:00,童书-漫画卡通,仰望天空，我们经常会被浩瀚无垠的宇宙所震撼。人类一直为探索宇宙奥秘、探究天文知识而不断努力着，并取得了很多成就。本书通过一个个轻松诙谐的漫画故事，讲述了与天文相关的68个知识点，让小读者了解各种天体现象和天文知识，初步学习基本的科普知识，并由此激发出满怀着“十万个为什么”的好奇心，进入更为广阔、妙趣横生的科学世界。本书为“植物大战僵尸2武器秘密之你问我答科学漫画系列”的其中一本。,22,861,0,12.99,https://wfqqreader-1252317822.image.myqcloud.com/cover/373/30006373/s_30006373.jpg
樊登漫画《孟子》,2022-05-01 00:00:00,历史-历史读物,"一套帮助少年儿童入门经典国学《孟子》的漫画书，让孩子从小立志、积极上进、爱学习！
      本书选取了《孟子》28段经典原句，覆盖小中高课本相关内容。以生动有趣的漫画故事为引子，生动演绎《孟子》原句的思想内涵，并配合原文和译文，帮助孩子轻松理解；另增设了“樊登讲孟子”“国学小课堂”两大版块，帮助孩子结合现实与自身运用国学智慧，增加历史见闻。
      本书内容部分改编自全网订阅量100万+人次、全网播放量2亿+的“樊登讲论语”“樊登讲孟子”视频课程。
      翻开本书，让孩子以古圣先贤为榜样，先人一步读懂《孟子》，先人一步立志成才！",6,760,0,49.9,https://weread-1258476243.file.myqcloud.com/weread/cover/96/3300016796/s_3300016796.jpg
植物大战僵尸2武器秘密之你问我答科学漫画：恐龙卷,2014-07-01 00:00:00,童书-漫画卡通,地球上曾经居住着一群奇特的动物——恐龙。它们称霸自然界超过1.6亿年之久。可是约6500万年前，它们突然全部消亡。曾经的地球霸主匆匆而神秘地退出了历史的舞台，给我们留下了一个又一个未解之谜。现在，就让我们一起走进那个异彩纷呈的远古世界，再现那段引人入胜的史前奇迹，一起认识一下这种传奇生物吧！本书通过一个个轻松诙谐的漫画故事，讲述了有关恐龙时代的77个有趣的知识点，从而揭开遥远史前世界的小小一角，让小读者跨越时空探索充满无限奥秘的恐龙世界，初步了解远古时代史前生物的奇妙，并由此激发出满怀着“十万个为什么”的好奇心，进入更为广阔、妙趣横生的科学世界。,25,805,0,12.99,https://wfqqreader-1252317822.image.myqcloud.com/cover/346/30006346/s_30006346.jpg
植物大战僵尸2武器秘密之你问我答科学漫画：能源与环境卷,2015-10-01 00:00:00,童书-漫画卡通,我们都有一个共同的家园，那就是地球。没有地球，我们将无法生存。然而，因为人类的活动，地球上的环境遭受了破坏，很多资源面临枯竭。本书借助活泼幽默的漫画故事，生动地介绍了一些环境与能源知识。通过这些故事，在使孩子们了解自己赖以生存的环境的同时，学会避开日常生活中可能出现的环境污染危害，习得保护环境的科普知识，一起来保护我们的地球妈妈。本书为“植物大战僵尸2武器秘密之你问我答科学漫画系列”的其中一本。,21,870,0,12.99,https://wfqqreader-1252317822.image.myqcloud.com/cover/350/30006350/s_30006350.jpg
新黑猫警长第一辑：重返童年,2016-12-31 00:00:00,童书-漫画卡通,眼睛瞪得像铜铃，射出闪电般的机灵；耳朵竖得像天线，能听见一切可疑的声音！对了，我就是黑猫警长！我用智慧、果敢和卓越的领导才能，带领着白猫警士们消灭一切来犯之敌，侦破一个又一个案件，誓死保卫森林市的安全！黑猫警长的形象和故事已经在中国少年儿童的心中深深地扎下了根。经典不会随时间的磨砺而黯然失色，只会在岁月的砺炼中愈加璀璨！你瞧！黑猫警长又出发了！全新的黑猫警长系列情节更加曲折、引人入胜，大家将会领略到黑猫警长利用高科技破案的风采，在错综复杂的故事中增长知识和智慧！,4,852,0,7.52,https://wfqqreader-1252317822.image.myqcloud.com/cover/56/23730056/s_23730056.jpg
新黑猫警长第一辑：病毒城市,2016-12-31 00:00:00,童书-漫画卡通,眼睛瞪得像铜铃，射出闪电般的机灵；耳朵竖得像天线，能听见一切可疑的声音！对了，我就是黑猫警长！我用智慧、果敢和卓越的领导才能，带领着白猫警士们消灭一切来犯之敌，侦破一个又一个案件，誓死保卫森林市的安全！黑猫警长的形象和故事已经在中国少年儿童的心中深深地扎下了根。经典不会随时间的磨砺而黯然失色，只会在岁月的砺炼中愈加璀璨！你瞧！黑猫警长又出发了！全新的黑猫警长系列情节更加曲折、引人入胜，大家将会领略到黑猫警长利用高科技破案的风采，在错综复杂的故事中增长知识和智慧！,4,824,0,7.52,https://wfqqreader-1252317822.image.myqcloud.com/cover/58/23730058/s_23730058.jpg
大宇神秘事件簿·第一季3：断手·夜半脚步声,2011-01-01 00:00:00,童书-漫画卡通,破窗而入的一只断手和解剖室里的夺命惊魂，操纵者？夜半脚步声独自一人走在放学的路上，阴森的树林深处传来的莫名脚步声，神秘跟踪者究竟是何来历？谜案的线索就藏在看似平静的表象之下。考验你的时候到了，欢迎加入大宇探案组！你就是不可缺少的后备队员！,4,0,0,4,https://wfqqreader-1252317822.image.myqcloud.com/cover/259/41867259/s_41867259.jpg
大宇神秘事件簿·第一季2：孤坟宝藏·课桌魔咒,2011-01-01 00:00:00,童书-漫画卡通,骷髅“自动”旋转，孤坟“暗吞”队员，究竟是有人暗中捣鬼，还是另有玄机？林平为何无故瘫痪？被施以“魔咒”的课桌如果是无辜的，那罪魁祸首又会是谁？谜案的线索就藏在看似平静的表象之下。考验你的时候到了，欢迎加入大宇探案组！你就是不可缺少的后备队员！,4,0,0,4,https://wfqqreader-1252317822.image.myqcloud.com/cover/256/41867256/s_41867256.jpg
小学生安全漫画2：校园安全,2020-05-01 00:00:00,童书-漫画卡通,"真正能保护孩子一生的是从小建立正确强烈的安全意识。原创漫画，图文并茂。延续超级畅销书《小学生心理学漫画》的创作风格，运用趣味漫画的形式，场景化地讲述了孩子日常生活中会遇到的校园安全问题，有效帮助孩子认识到生活中的潜在危险,让孩子学会自我保护。内容新颖，可读性强。结合时代背景与新颖的安全案例，讲述36个涉及校园安全的安全知识，全面提升孩子的安全意识。权威专家，领衔编写。通过“安全小漫画——可能发生的危险——安全隐患冷静分析——应对危险的方法——安全专家点评——安全小练习”等几个部分，循序渐进地提升孩子的安全知识，培养自护能力。本书是《小学生安全漫画（全4册）》中的一册，是一本适合7-12岁孩子阅读的安全读本。整本书以校园为场景，通过漫画的形式生动有趣地讲述了孩子生活中常见的36个校园安全隐患，例如不用笔打闹，不对同学恶作剧，不跟同学去见陌生人等，引导孩子在认知、预判危险的过程中，形成应对危险的能力。",14,0,0,19.99,https://wfqqreader-1252317822.image.myqcloud.com/cover/219/31702219/s_31702219.jpg
怕黑的麦克,2017-08-01 00:00:00,童书-漫画卡通,麦克有点怕黑，却偏偏碰上了停电。麦克害怕得睡不着觉，怎么办呢？妈妈带着麦克去朋友家找办法——小熊躺在妈妈的身上，就不怕黑了；小企鹅和妈妈一起躺在床上，周围都是熟悉的事物就不怕；小象听着妈妈讲关于黑夜王国的故事，就安心地睡着了……可是这些办法对麦克都不奏效。怎么办呢？,4,696,0,13.99,https://wfqqreader-1252317822.image.myqcloud.com/cover/284/22623284/s_22623284.jpg
