title,publishTime,category,intro,maxFreeChapter,newRating,free,price,cover
植物大战僵尸：食神争霸赛,2013-01-01 00:00:00,童书-漫画卡通,本系列书利用风靡全球的电脑游戏“植物大战僵尸2”中的素材，以四格漫画的形式全新演绎新一代植物与僵尸的爆笑故事。为了评选出最好吃的食物，植物和僵尸决定举行一场食神争霸赛。作为植物方的主力，充能柚子、棱镜草和激光豆历经千辛万苦，到处拜师学艺，闹出了很多笑话。而作为僵尸方代表的铁桶未来僵尸和未来僵尸也是毫不相让，一边到处搜集食材，一边往植物镇派遣卧底……终于，食神争霸赛开战了！比赛现场，双方各出奇招，难分高下。到底*终谁能俘获*的评委——疯狂戴夫的味觉，获得“食神”称号呢？这期间又会发生什么有趣的故事呢？一起去看看吧。,5,878,0,6.99,https://wfqqreader-1252317822.image.myqcloud.com/cover/301/30006301/s_30006301.jpg
神探狗狗1,2019-07-01 00:00:00,童书-漫画卡通,神探狗狗集人类与犬类的优点于一身，又强壮又聪明，是守护小镇的超级神探。彼蒂是一只邪恶的猫咪，坏点子层出不穷，但神探狗狗总是能凭借机智、勇猛（还有好运气）将坏彼蒂给小镇造成的危机一一化解。《神探狗狗1》作为系列漫画的第一本，讲述的就是神探狗狗与坏彼蒂斗智斗勇的日常。,5,890,0,23.88,https://wfqqreader-1252317822.image.myqcloud.com/cover/221/37349221/s_37349221.jpg
植物大战僵尸：植物僵尸好声音,2013-01-01 00:00:00,童书-漫画卡通,僵尸博士意外车祸，僵尸一致认为是植物的阴谋，决定通过举办“植物僵尸好声音”的歌咏大赛与植物一决胜负。植物也毫不示弱，村长大喷菇派出向日葵、豌豆射手和坚果三位大将，并请仙人掌当老师，对他们进行艰苦的训练。而僵尸一边，僵尸博士为了培训歌唱高手，*后竟然亲自出马培训僵尸。到了比赛的日子，超载的僵尸大巴摇摇晃晃上了路，而植物这边也派出了豌豆射手半路伏击。豌豆射手成功了吗？两派哪边获胜了呢？“好声音”的导师和学员们之间到底还有哪些令人捧腹的趣闻呢？一起来揭晓吧！,5,835,0,6.99,https://wfqqreader-1252317822.image.myqcloud.com/cover/267/30006267/s_30006267.jpg
植物大战僵尸：冰雪对抗赛,2013-01-01 00:00:00,童书-漫画卡通,本系列书利用风靡全球的电脑游戏“植物大战僵尸2”中的素材，以四格漫画的形式全新演绎新一代植物与僵尸的爆笑故事。一年一度的冰雪对抗赛即将开赛了。植物们和僵尸们为了赢得比赛，都使出浑身解数，笑料百出。植物们不顾严寒，苦练打雪仗技术，终于力挫僵尸，首局获胜。首局失利的僵尸们，刻苦训练，阴差阳错之下，凭借骑牛小鬼僵尸的出色发挥，赢得了滑雪比赛的胜利，与植物们战成了平局。决定胜负的冰雕比赛开始了！植物们和僵尸们又会有哪些奇招儿呢？疯狂戴夫又会给他们出什么难题呢？谁能赢得冰雪对抗赛的*终胜利呢？这期间还会发生什么有趣的故事呢？一起来看看吧。,5,836,0,6.99,https://wfqqreader-1252317822.image.myqcloud.com/cover/291/30006291/s_30006291.jpg
植物大战僵尸：星际大冒险,2013-01-01 00:00:00,童书-漫画卡通,本系列书利用风靡全球的电脑游戏“植物大战僵尸2”中的素材，以四格漫画的形式全新演绎新一代植物与僵尸的爆笑故事。菜问抽中了星际旅行团体票大奖，植物们兴高采烈地登上宇宙飞船，没想到刚启程不久，他们的飞船就遭到重创，迫降在一个不知名的星球上。为了寻找可以帮助他们返回家乡的愿望树，植物们开始了星际大冒险。途中他们遇到了美味的奶油面包果、发光的小兔子，还有神秘的地宫、守护宝藏的火麒麟……与此同时，僵尸们也在寻找这棵神奇的愿望树，并给植物们制造了重重麻烦。在这个星球上还会发生什么有趣的故事呢？一起去看看吧！,5,896,0,6.99,https://wfqqreader-1252317822.image.myqcloud.com/cover/314/30006314/s_30006314.jpg
植物大战僵尸：夺岛联盟大冒险,2013-01-01 00:00:00,童书-漫画卡通,本系列书利用风靡全球的电脑游戏“植物大战僵尸2”中的素材，以四格漫画的形式全新演绎新一代植物与僵尸的爆笑故事。一年一度的植物水上运动会就要开始了，坚果自告奋勇参加游泳比赛，尽管水性不佳，但在努力训练的间隙还不忘向充能柚子定制加速药水。可是就在比赛前夕，有消息传来，由于巨浪岛上的植物被僵尸们抓起来了，所以没法参加比赛，比赛也因此取消了。为了解救巨浪岛上的植物同胞们，植物镇的植物们经过一番策划，决定造船出海，前往巨浪岛开展营救行动。在茫茫大海上航行，他们会遇到危险吗？会发生哪些有趣的事情呢？他们最终能成功营救巨浪岛上的植物们吗？一起去看看吧。,5,856,0,6.99,https://wfqqreader-1252317822.image.myqcloud.com/cover/295/30006295/s_30006295.jpg
植物大战僵尸：疯狂橄榄球,2013-01-01 00:00:00,童书-漫画卡通,僵尸和植物的争战旷日持久，难以分出输赢。这次，豌豆射手、坚果和倭瓜又与僵尸狭路相逢，幸好睡莲大叔出面，才脱离险境。僵尸对这种连续作战烦不胜烦，所以提出以橄榄球比赛来决胜负，植物同意了。双方都开始了紧张的训练。植物这边负责训练的是火爆辣椒，队员有豌豆射手、坚果和倭瓜等，搞笑的是，从教练到队员，大家既不知道橄榄球比赛的规则，也不知橄榄球为何物，因而惹出了一个个小故事，而且，教练的无理要求和队员的投机取巧之间也摩擦出一个个小火花，令人啼笑皆非。最终，比赛开始了。疯狂戴夫作为中立人士成了裁判，他的疯狂为本来就热闹的赛场更增加了笑料。不同植物的各显身手和各种阴差阳错的巧合，使植物又一次获得了胜利！,5,839,0,6.99,https://wfqqreader-1252317822.image.myqcloud.com/cover/263/30006263/s_30006263.jpg
植物大战僵尸：火热篮球赛,2013-01-01 00:00:00,童书-漫画卡通,小鬼僵尸和豌豆射手同为篮球爱好者。在一次关于篮球的打赌中，豌豆射手输给了小鬼僵尸，被迫答应了小鬼僵尸的要求——在僵尸和植物阵营之间举办一场篮球比赛。为了在篮球比赛中获得胜利，植物和僵尸都组织了篮球训练营，但是，因为对篮球比赛的陌生，如不知道篮球比赛的基本规则，不知道篮球队的人数等，以及植物和僵尸各自的特点，如小鬼僵尸个头太小、植物大多没有脚，在训练过程中，双方都发生了一个又一个令人啼笑皆非的小故事……本漫画故事避开了“植物大战僵尸”游戏中植物和僵尸攻守的套路，以篮球比赛为线索，把之前之后植物与僵尸双方的动作串连起来，并在篮球比赛中达成整书的高潮。既有整体性，同时每一组四格又有一定独立性。,5,832,0,6.99,https://wfqqreader-1252317822.image.myqcloud.com/cover/273/30006273/s_30006273.jpg
植物大战僵尸：魔高一丈,2013-01-01 00:00:00,童书-漫画卡通,僵尸入侵植物餐厅，夺走了一本魔术书，这本书是大喷菇想作为传家宝传给小喷菇的。坚果和豌豆射手奉命到僵尸博士的密室去找书，结果与已经见到这本书的舞者僵尸和伴舞僵尸狭路相逢，双方决定，以魔术比赛决定这本书的归属。为了在魔术比赛中获胜，双方都展开了训练……但是，天生的惰性，加上魔术本身的各种特点，训练中，产生了层出不穷的笑料，植物和僵尸的个性也得到了充分的展示，植物的大义凛然中，有着一戳就破的滑稽，僵尸的义正词严中，也有着狡黠和可爱。,5,817,0,6.99,https://wfqqreader-1252317822.image.myqcloud.com/cover/277/30006277/s_30006277.jpg
植物大战僵尸：危险模仿秀,2013-01-01 00:00:00,童书-漫画卡通,植物取得了马拉松比赛的胜利，成功地把僵尸赶出了他们的世界。为了庆祝这一胜利，在大家的建议下，大喷菇村长决定拍摄一部艺术电影——《白雪公主和七个小矮人》。植物们为了能出演这部电影，个个摩拳擦掌，拼命表现，发生了一系列令人啼笑皆非的小故事。终于，电影开拍了！但是，没有表演经验的各位植物演员们，在同样毫无导演经验的大喷菇村长的指挥下，笑料百出，拍摄出了一部让人匪夷所思的电影……,5,821,0,6.99,https://wfqqreader-1252317822.image.myqcloud.com/cover/269/30006269/s_30006269.jpg
樊登漫画《论语》,2022-05-01 00:00:00,童书-漫画卡通,"一套帮助少年儿童入门经典国学《论语》的漫画书，让孩子从小立志、积极上进、爱学习！
       本书选取了《论语》28段经典原句，覆盖小中高课本相关内容。以生动有趣的漫画故事为引子，生动演绎《论语》原句的思想内涵，并配合原文和译文，帮助孩子轻松理解；另增设了“樊登讲论语”“国学小课堂”两大版块，帮助孩子结合现实与自身运用国学智慧，增加历史见闻。
      本书内容部分改编自全网订阅量100万+人次、全网播放量2亿+的“樊登讲论语”“樊登讲孟子”视频课程。
       翻开本书，让孩子以古圣先贤为榜样，先人一步读懂《论语》，先人一步立志成才！",6,825,0,49.9,https://weread-1258476243.file.myqcloud.com/weread/cover/98/3300016798/s_3300016798.jpg
植物大战僵尸：感冒病毒危机,2013-01-01 00:00:00,童书-漫画卡通,僵尸博士发明了感冒病毒粉，用来对付植物战士。他派出海鸥僵尸和小鬼僵尸将感冒病毒粉撒到植物镇的水塘里，许多植物战士得了感冒，浑身乏力，战斗力大大下降，就连军团长倭瓜也感染了病毒，植物镇陷入危机。植物镇能化解这场危机吗？他们用什么办法来治愈这场严重的病毒传染呢？谁来接替军团长率领大家渡过难关呢……悬念丛生，笑料百出。,5,827,0,6.99,https://wfqqreader-1252317822.image.myqcloud.com/cover/287/30006287/s_30006287.jpg
植物大战僵尸：神来之笔,2013-01-01 00:00:00,童书-漫画卡通,小喷菇无意中捡到了一支神笔。大喷菇村长很高兴，想尽办法，把神笔藏了起来。不料，神笔却被出来探听消息的小鬼僵尸偷走了。大喷菇村长很生气，立即派出由倭瓜、坚果和豌豆射手组成的“黄金组合”，夺回了神笔。得知消息的僵尸博士气急败坏，立志一定要自己创造出一支神笔。于是，他和助手小鬼僵尸开始了笑料百出的创造之旅。僵尸博士能成功吗？他创造的神笔会拥有什么功能呢？僵尸和植物之间还会发生哪些令人啼笑皆非的故事呢？一起来看看吧！,5,797,0,6.99,https://wfqqreader-1252317822.image.myqcloud.com/cover/271/30006271/s_30006271.jpg
植物大战僵尸：万圣节狂欢,2013-01-01 00:00:00,童书-漫画卡通,本系列书利用风靡全球的电脑游戏“植物大战僵尸2”中的素材，以四格漫画的形式全新演绎新一代植物与僵尸的爆笑故事。植物镇将迎来一年一度的万圣节游行庆典，游行活动中装扮最出色的植物将获得巴豆咖啡馆提供的奖品“黄金叶绿素”。为了得到奖品，植物们使出浑身解数，笑料百出。与此同时，海盗船长僵尸在植物镇附近安插了飞索僵尸和滚桶僵尸探听情报，还把据点改造成鬼屋掩人耳目。想到鬼屋学习万圣节装扮的植物们误打误撞，与僵尸们狭路相逢……究竟谁能获得“黄金叶绿素”呢？万圣节期间又会发生什么有趣的故事呢？一起去看看吧！,5,868,0,6.99,https://wfqqreader-1252317822.image.myqcloud.com/cover/310/30006310/s_30006310.jpg
植物大战僵尸：航海大冒险,2013-01-01 00:00:00,童书-漫画卡通,本系列书利用风靡全球的电脑游戏“植物大战僵尸2”中的素材，以四格漫画的形式全新演绎新一代植物与僵尸的爆笑故事。传说，海洋深处藏着神秘的宝藏。为了寻找这些宝藏，植物们和僵尸们分别开始了他们的海上冒险之旅。不料，植物们遇到了罕见的暴风雨，误打误撞地来到了传说中的亚特兰蒂斯遗迹。在这个神秘的海底世界，植物们遇到了美丽的美人鱼，体验了新奇的游乐园，还找到了大海里最珍贵的宝物……植物们能顺利地把宝物带回植物镇吗？僵尸们又会有什么奇招呢？期间又会发生什么有趣的故事呢？一起去看看吧。,5,875,0,6.99,https://wfqqreader-1252317822.image.myqcloud.com/cover/299/30006299/s_30006299.jpg
植物大战僵尸：劲爆足球,2013-01-01 00:00:00,童书-漫画卡通,豌豆射手无意中捡到一个足球，却不小心被气球僵尸偷走。为了夺回足球并把僵尸赶出城镇，植物组织起了一支足球队，开始了由预测世界杯全错的仙人掌担任教练的艰苦训练。在准备中发生了一系列笑料百出的趣事。另一边，僵尸也没闲着，僵尸博士亲自上阵执教，无心指导僵尸练习，却总是想着偷袭植物。足球比赛踢起来了吗？哪边赢了呢？植物把僵尸赶走了吗？快来看看吧。,5,863,0,6.99,https://wfqqreader-1252317822.image.myqcloud.com/cover/275/30006275/s_30006275.jpg
植物大战僵尸：夺宝奇兵,2013-01-01 00:00:00,童书-漫画卡通,雪橇车僵尸无意中得到了一张藏宝图，里面记载着远古僵尸留下的僵尸机器人的埋藏之地。但阴差阳错之下，这张藏宝图却落到了植物手中。于是，坚果、豌豆射手和向日葵兴高采烈地出发去寻找宝藏了。僵尸博士听说后很生气，派出小鬼僵尸和雪橇车僵尸去夺回藏宝图。不料，他们却半路逃跑，凭借着雪橇车僵尸的钓鱼“绝技”，开起了鱼店。可惜狠狠赚了一笔的他们还是被僵尸博士发现了，不得不继续去寻找宝藏……终于，植物和僵尸都到达了宝藏埋藏地。到底*终谁能拿到宝藏呢？僵尸机器人又有什么威力呢？其间又会发生什么有趣的故事呢？一起去看看吧！,5,852,0,6.99,https://wfqqreader-1252317822.image.myqcloud.com/cover/281/30006281/s_30006281.jpg
植物大战僵尸：水晶头骨,2013-01-01 00:00:00,童书-漫画卡通,矿工僵尸和小鬼僵尸无意中挖到一个宝箱，僵尸博士从宝箱中的电脑得知了水晶头骨的消息，兴致勃勃地前去寻宝。豌豆射手、坚果和向日葵在山中与僵尸博士一行偶遇，偷听到了水晶头骨的消息，鉴于水晶头骨能够催眠他人的重要性，决定抢夺水晶头骨。植物与僵尸斗智斗勇，各显神通，但结局令人啼笑皆非……,5,816,0,6.99,https://wfqqreader-1252317822.image.myqcloud.com/cover/279/30006279/s_30006279.jpg
大头兵·蜂群战术,2021-01-01 00:00:00,童书-漫画卡通,"“儿童爆笑军事漫画”系列是专为儿童创作的爆笑军事漫画。作品以硝烟弥漫的战场和多姿多彩的军营生活为背景，讲述了发生在大头兵和战友、大头兵和敌军之间的一系列紧张刺激又令人捧腹的幽默故事。书中，大头兵、博士、呆胖、敌军司令官为了赢取军事胜利，谋划了一次又一次令人啼笑皆非的军事行动。故事夸张、风趣，想象力奇特。漫画主人公大头兵形象诙谐，机智勇敢，不怕累 , 不怕输。幽默的故事中穿插着各种军事知识，让孩子在有趣的阅读中培养兴趣，形成良好的品质和正确的战争观。",9,878,0,6.99,https://wfqqreader-1252317822.image.myqcloud.com/cover/10/41721010/s_41721010.jpg
神探狗狗4：猫狗大战,2019-07-01 00:00:00,童书-漫画卡通,这天，一名打扮怪异的保姆敲响了神探狗狗家的大门，自称“怪可疑夫人”，是全世界最棒的猫咪保姆。看起来有点眼熟嘛……咦？“她”不就是……天啊，危险！可是此时，神探狗狗已经跑远了，他急着去电影《狗狗侠》的拍摄现场负责保卫工作。那是第一部以神探狗狗为原型改编的电影！“怪可疑夫人”到底是谁？“她”的阴谋会不会得逞？电影究竟能不能顺利拍摄？快快翻开书本，寻找答案吧！,5,913,0,23.88,https://wfqqreader-1252317822.image.myqcloud.com/cover/227/37349227/s_37349227.jpg
植物大战僵尸：功夫之王,2013-01-01 00:00:00,童书-漫画卡通,本系列书利用风靡全球的电脑游戏“植物大战僵尸2”中的素材，以四格漫画的形式全新演绎新一代植物与僵尸的爆笑故事。为了鼓励大家积极锻炼，增强体质，植物学校决定举行一场比武大会，选出“功夫之王”。倭瓜校长还拿出了传家之宝—绿宝石项链“植物之心”作为奖品。植物们为了得到美丽的项链，使出浑身解数，笑料百出。不料，功夫气功僵尸得到消息，抢走了“植物之心”。为了植物镇的荣誉，火葫芦、白萝卜、竹笋和仙桃组成的“转校生队”以及菜问、豌豆射手和向日葵组成的“夺宝大队”分别踏上了寻宝之路……他们能顺利地拿回“植物之心”吗？谁会成为“功夫之王”呢？期间又会发生什么有趣的故事呢？一起去看看吧！,5,841,0,6.99,https://wfqqreader-1252317822.image.myqcloud.com/cover/297/30006297/s_30006297.jpg
神探狗狗2：萌犬出笼,2019-07-01 00:00:00,童书-漫画卡通,这天是个大日子，警长的生日到了！警署里，警员们打算一起给警长送上生日礼物。但究竟什么才是警长最需要的东西呢？他丢三落四……他非常孤独……有了！欢乐的生日派对结束了，而接下来发生的事情，出乎所有人意料。街道上，一名神秘的陌生人正在明目张胆地实施抢劫。至于他抢劫的东西，实在是匪夷所思……身怀绝技的新罪犯、警长的生日礼物，这两者之间会有什么联系吗？这一次，神探狗狗到底能不能取得胜利？,5,966,0,23.88,https://wfqqreader-1252317822.image.myqcloud.com/cover/223/37349223/s_37349223.jpg
植物大战僵尸2武器秘密之你问我答科学漫画：大脑卷,2016-11-01 00:00:00,童书-漫画卡通,大脑是人体最重要的器官，也是意识、精神、语言、学习、记忆和智能等高级神经活动的物质基础。人的大脑主要包括左半脑和右半脑两部分，那么，左半脑与右半脑有什么不同？大脑内部为什么有那么多皱褶？人的记忆储存在大脑的什么部位？人为什么会日有所思、夜有所梦？智商也会遗传吗？怎样科学合理地运用我们的大脑？本书通过一个个轻松诙谐的漫画故事，讲述了关于大脑的42个知识点，让小读者初步了解大脑的构造和意识的特点，并由此激发出“十万个为什么”的好奇心，进入更为广阔的、妙趣横生的科学世界。本书为“植物大战僵尸2武器秘密之你问我答科学漫画系列”的其中一本。,14,824,0,12.99,https://wfqqreader-1252317822.image.myqcloud.com/cover/335/30006335/s_30006335.jpg
大头兵·马桶战队,2020-04-01 00:00:00,童书-漫画卡通,"“儿童爆笑军事漫画”系列是专为儿童创作的爆笑军事漫画。作品以硝烟弥漫的战场和多姿多彩的军营生活为背景，讲述了发生在大头兵和战友、大头兵和敌军之间的一系列紧张刺激又令人捧腹的幽默故事。书中，大头兵、博士、呆胖、敌军司令官为了赢取军事胜利，谋划了一次又一次令人啼笑皆非的军事行动。故事夸张、风趣，想象力奇特。漫画主人公大头兵形象诙谐，机智勇敢，不怕累 , 不怕输。幽默的故事中穿插着各种军事知识，让孩子在有趣的阅读中培养兴趣，形成良好的品质和正确的战争观。",10,881,0,6.99,https://wfqqreader-1252317822.image.myqcloud.com/cover/4/41721004/s_41721004.jpg
植物大战僵尸：向日葵失踪之谜,2013-01-01 00:00:00,童书-漫画卡通,正当菜问、豌豆射手和向日葵打算“桃园结义”的时候，向日葵却失踪了。大家张贴寻人启事，到向日葵经常去的地方查找，甚至还借用了戴夫的时光机，检查了向日葵的日记，可都没发现线索。而就在同一时刻，僵尸镇贴出了重金悬赏植物的告示。从报纸上看到向日葵失踪的消息的僵尸们，也开始蠢蠢欲动。菜问和豌豆射手终于在僵尸博士的实验室里找到了昏睡的向日葵，并把她带回了家。可是大家都没想到，这个向日葵却是一个经过伪装的监控记录仪。向日葵究竟在哪里呢？她都遭遇了哪些事情呢？一起去看看吧。,5,891,0,6.99,https://wfqqreader-1252317822.image.myqcloud.com/cover/312/30006312/s_30006312.jpg
植物大战僵尸：超级明星赛,2013-01-01 00:00:00,童书-漫画卡通,疯狂戴夫策划了一场排球超级明星赛，用丰厚的奖金诱惑僵尸和植物报名参赛。植物和僵尸分别组建了自己的排球队，并制定了一系列搞笑的训练计划。植物排球队的教练是菜问，僵尸排球队的教练又会是谁呢？听说植物排球队有一个非常厉害的“排球王”，僵尸们马上展开了偷球行动，结果会怎样呢？排球超级明星赛如期举行，可是比赛现场却发生了很多意想不到的状况。戴夫策划排球超级明星赛原来另有目的，排球比赛的结果也是出人意料。这到底是怎么回事呢？让我们一起来看看吧！,5,826,0,6.99,https://wfqqreader-1252317822.image.myqcloud.com/cover/285/30006285/s_30006285.jpg
神探狗狗5：跳蚤之王,2019-07-01 00:00:00,童书-漫画卡通,一次深入遥远记忆的心理治疗，竟是一场谋划多年的复仇的开端……一场前所未有的“父子谈话”，揭露了彼蒂不为人知的过去……史上最邪恶猫咪的内心深处，究竟隐藏着什么不可告人的秘密？拥有强力武器的新反派登场，城市又一次陷入危机！这一次，神探狗狗并不是孤身一人，他还获得了猫小子、闪电小哥……以及某位“不可能之人”的帮助……结果究竟会如何？让我们拭目以待吧！,6,973,0,23.88,https://wfqqreader-1252317822.image.myqcloud.com/cover/229/37349229/s_37349229.jpg
樊登漫画论语孟子（全2册）,2022-05-01 00:00:00,童书-漫画卡通,一套帮助少年儿童入门经典国学《论语》《孟子》的漫画书，让孩子从小立志、积极上进、爱学习！本书选取了《论语》《孟子》56段经典原句，覆盖小中高课本相关内容。以生动有趣的漫画故事为引子，生动演绎《论语》《孟子》原句的思想内涵，并配合原文和译文，帮助孩子轻松理解；另增设了“樊登讲论语”“国学小课堂”两大版块，帮助孩子结合现实与自身运用国学智慧，增加历史见闻。本书内容部分改编自全网订阅量100万+人次、全网播放量2亿+的“樊登讲论语”“樊登讲孟子”视频课程。翻开本书，让孩子以古圣先贤为榜样，先人一步读懂国学经典，先人一步立志成才！,10,939,0,99.8,https://weread-1258476243.file.myqcloud.com/weread/cover/59/3300016959/s_3300016959.jpg
植物大战僵尸：替身学员大比拼,2013-01-01 00:00:00,童书-漫画卡通,在镇长椰子加农炮的提议下，植物学校决定招收替身学员，成就*者可以获得一整年的学校免费午餐和寒暑假时期的国外旅行券。为了获得奖励，报名的植物们在向日葵的带领下接受了体能、语言和礼仪的训练，而后使出浑身解数，各显身手，执行了一系列替身任务……植物们能否顺利地完成替身任务？这期间发生了什么有趣的故事？谁又能最终获得“替身学员超级大奖”？一起去看看吧！,5,842,0,6.99,https://wfqqreader-1252317822.image.myqcloud.com/cover/305/30006305/s_30006305.jpg
大头兵·飞鹰战机,2020-04-01 00:00:00,童书-漫画卡通,"“儿童爆笑军事漫画”系列是专为儿童创作的爆笑军事漫画。作品以硝烟弥漫的战场和多姿多彩的军营生活为背景，讲述了发生在大头兵和战友、大头兵和敌军之间的一系列紧张刺激又令人捧腹的幽默故事。书中，大头兵、博士、呆胖、敌军司令官为了赢取军事胜利，谋划了一次又一次令人啼笑皆非的军事行动。故事夸张、风趣，想象力奇特。漫画主人公大头兵形象诙谐，机智勇敢，不怕累 , 不怕输。幽默的故事中穿插着各种军事知识，让孩子在有趣的阅读中培养兴趣，形成良好的品质和正确的战争观。",6,943,0,6.99,https://wfqqreader-1252317822.image.myqcloud.com/cover/0/41721000/s_41721000.jpg
