title,publishTime,category,intro,maxFreeChapter,newRating,free,price,cover
植物大战僵尸2武器秘密之你问我答科学漫画：食品与营养卷,2014-06-01 00:00:00,童书-漫画卡通,食品与营养是我们生活中不可缺少的一部分，如何吃才能吃得营养，吃得健康是很多人关注的焦点。本书通过一个个轻松诙谐的漫画故事，讲述了食品与营养方面的76个有趣的知识点，从而揭开食品与营养世界的小小一角，让小读者感受世界的奇妙，初步了解如何选择营养健康的食物，如何获得正确的膳食营养和食品安全知识，树立正确的饮食观念，并由此激发出满怀着“十万个为什么”的好奇心，进入更为广阔、妙趣横生的科学世界。本书为“植物大战僵尸2武器秘密之你问我答科学漫画系列”的其中一本。,24,895,0,12.99,https://wfqqreader-1252317822.image.myqcloud.com/cover/331/30006331/s_30006331.jpg
植物大战僵尸2武器秘密之你问我答科学漫画：两栖动物卷,2017-04-01 00:00:00,童书-漫画卡通,“娃娃鱼”是鱼吗？弹琴蛙会弹琴吗？无肺蝾螈用什么呼吸？蚓螈有没有眼睛？谁是蟾蜍中的贵族？谁是蛙类中的巨无霸？古老而神奇的两栖动物，有着众多不为人知的秘密和有趣的故事，快来和菜问、向日葵、坚果等“植物大战僵尸2”游戏中的小伙伴一起，展开奇妙的探索吧！本书通过轻松诙谐的漫画形式，讲述了53个关于两栖动物的故事，涉及两栖动物的普遍特点及个别物种的独有特征，引导小读者以探究的眼光发现这一族群的奥秘，由此激发出“十万个为什么”的好奇心，进入更为广阔、妙趣横生的科学世界。本书为“植物大战僵尸2武器秘密之你问我答科学漫画系列”的其中一本。,17,838,0,12.99,https://wfqqreader-1252317822.image.myqcloud.com/cover/348/30006348/s_30006348.jpg
植物大战僵尸：舞林大会,2013-01-01 00:00:00,童书-漫画卡通,僵尸和植物的争战旷日持久，难以分出胜负。于是，僵尸提出，召开一届“舞林大会”，用比赛舞蹈的方式一决雌雄。以大喷菇为首的植物不同意召开“舞林大会”，无奈豌豆射手、向日葵、坚果不慎落入僵尸之手，只好同意。为了在“舞林大会”上获得胜利，植物和僵尸都组织了舞蹈训练营，僵尸们的教练是舞者僵尸，植物们的教练是大蒜。在训练的过程中，双方发生了一个又一个令人啼笑皆非的故事。,5,856,0,6.99,https://wfqqreader-1252317822.image.myqcloud.com/cover/260/30006260/s_30006260.jpg
植物大战僵尸：电影明星梦,2013-01-01 00:00:00,童书-漫画卡通,本系列书利用风靡全球的电脑游戏“植物大战僵尸2”中的素材，以四格漫画的形式全新演绎新一代植物与僵尸的爆笑故事。世界著名导演疯狂戴夫筹拍新片，海选电影主角。为了能够顺利入选，植物们在火炬树桩老师的带领之下，来到山里进行集训。植物们从体能、表演等各方面进行强化训练。与此同时，也想参加拍摄的僵尸们在得知消息之后，开始对植物们的训练进行破坏。僵尸们拟定了让植物增肥的作战计划，却被植物们轻松化解，随后又试图偷走植物的表演秘籍……谁能够*终成为疯狂戴夫新片的主角？植物和僵尸斗智斗勇，中间又发生了怎样有趣的故事？一起去看看吧！,5,819,0,6.99,https://wfqqreader-1252317822.image.myqcloud.com/cover/293/30006293/s_30006293.jpg
植物大战僵尸：探险神秘岛,2013-01-01 00:00:00,童书-漫画卡通,菜问、豌豆射手和坚果在打扫卫生的时候触动机关，在洞穴里发现了一幅记载着神秘岛的图画，原来，这是小时候见过神秘岛的火炬树桩老师留下的。为了证明神秘岛的存在，火炬树桩老师带领植物们，登上自己发明的漂浮船，开始了神秘岛探险之旅。与此同时，得知消息的僵尸们也开始升级装备，准备前往神秘岛一探究竟。狭路相逢的植物和僵尸谁能获胜？他们如何闯过机关重重的神秘岛？在绝境面前，植物们和僵尸们能否携手合作？一起去看看吧！,5,869,0,6.99,https://wfqqreader-1252317822.image.myqcloud.com/cover/303/30006303/s_30006303.jpg
植物大战僵尸：海盗船来了,2013-01-01 00:00:00,童书-漫画卡通,在海边捡贝壳的闪电芦苇发现海面上飘来了一艘大船。他好奇地登上大船之后却神秘失踪了。原来这艘大船是被一帮海盗僵尸控制的海盗船。植物镇的镇长火炬树桩在全镇征集勇士，打算成立小分队去救出闪电芦苇并摧毁海盗船。很后菜问、豌豆射手、向日葵和坚果几个挺身而出，接受了这个危险的任务。小分队的成员们会遇到什么危险？可怕的海盗船长僵尸及他的手下会使出什么伎俩？他们之间又会展开怎样的殊死较量呢？让我们一起去看看吧。,5,853,0,6.99,https://wfqqreader-1252317822.image.myqcloud.com/cover/289/30006289/s_30006289.jpg
植物大战僵尸：决战马拉松,2013-01-01 00:00:00,童书-漫画卡通,为了将僵尸赶出植物世界，植物决定和僵尸来一场马拉松比赛，为此，双方都开始了紧张的准备工作。僵尸方请来了旅行家气球僵尸当教练，派出橄榄球僵尸、飞贼僵尸和雪橇车僵尸应战。植物方则派出了*夺冠潜力的胆小菇、豌豆射手和咖啡豆。在赛前的马拉松训练中，植物和僵尸各展所长，互不相让，发生了一个个有趣的小故事。终于，马拉松比赛开始了。被僵尸设计陷害的植物，经过一系列令人啼笑皆非的巧合，后来居上，打败了僵尸，又一次赢得了胜利！,5,834,0,6.99,https://wfqqreader-1252317822.image.myqcloud.com/cover/265/30006265/s_30006265.jpg
植物大战僵尸2武器秘密之你问我答科学漫画：考古卷,2016-07-01 00:00:00,童书-漫画卡通,考古是一门对古人遗留下来的实物资料进行研究的学问，涉及的研究对象包括遗物、遗迹、遗址和文化等。人类通过考古发现，可以了解人类不同发展阶段的社会风貌及其历史价值。本书通过一个个轻松诙谐的漫画故事，讲述了关于考古的64个知识点，让小读者初步了解考古发现的基本常识和人类社会的发展历程，并由此激发出“十万个为什么”的好奇心，进入更为广阔、妙趣横生的科学世界。本书为“植物大战僵尸2武器秘密之你问我答科学漫画系列”的其中一本。,21,849,0,12.99,https://wfqqreader-1252317822.image.myqcloud.com/cover/344/30006344/s_30006344.jpg
植物大战僵尸：大战机器怪,2013-01-01 00:00:00,童书-漫画卡通,几个植物战士——菜问、火龙草、向日葵和豌豆射手一起到美丽的螺蛳湖边游玩。当他们来到湖边之后，却遇到了一个从来没见过的、非常可怕的“大螺蛳”！原来这是僵尸博士新研制出的“无敌战神号”智能机器人。一场惊心动魄的战斗开始了……植物们会遭遇什么样的危险？大螺蛳机器人有什么特别的本事？僵尸博士还有什么秘密武器呢？让我们一起去看看吧。,5,834,0,6.99,https://wfqqreader-1252317822.image.myqcloud.com/cover/283/30006283/s_30006283.jpg
植物大战僵尸2武器秘密之你问我答科学漫画：机器人卷,2014-09-01 00:00:00,童书-漫画卡通,机器人是自动执行工作的机器装置，能够协助或取代人类进行工作。机器人的种类有很多，特点也不尽相同，非常智能，是人类的好帮手。本书通过一个个轻松诙谐的漫画故事，讲述了有关机器人的38个知识点，从而揭开机器人世界的小小一角，让小读者感受机器人的神奇，初步了解基本的科普知识，并由此激发出满怀着“十万个为什么”的好奇心，进入更为广阔、妙趣横生的科学世界。本书为“植物大战僵尸2武器秘密之你问我答科学漫画系列”的其中一本。,13,849,0,12.99,https://wfqqreader-1252317822.image.myqcloud.com/cover/327/30006327/s_30006327.jpg
植物大战僵尸2武器秘密之你问我答科学漫画：奇趣美食卷,2017-01-01 00:00:00,童书-漫画卡通,世界各地的美食数不胜数，各具特色。阅读这本书，你将和“植物大战僵尸2”热门游戏中的主角们一起，共享一顿美食盛宴：既有美味的北京烤鸭，也有神奇的印度飞饼；既有被誉为“无上上品”的满汉全席，也有被称为“西餐之首”的法国菜；既有像枕头一样的粽子，也有像镜子一样的蛋糕……看了这些奇趣美食后，你可别馋得垂涎三尺哟！本书通过轻松诙谐的漫画形式，讲述了关于中外美食的44个小故事，让小读者初步了解中外美食的特色及其蕴含的博大精深的饮食文化，并引导小读者养成健康的饮食和生活习惯，由此激发出“十万个为什么”的好奇心，进入更为广阔的、妙趣横生的科学世界。,15,925,0,12.99,https://wfqqreader-1252317822.image.myqcloud.com/cover/356/30006356/s_30006356.jpg
植物大战僵尸：挑战无极限,2013-01-01 00:00:00,童书-漫画卡通,为了增强同学之间的凝聚力，植物学校决定举办以“极限运动”为主题的团体夏令营，并选择了定向运动、滑翔伞和滑水三大运动，由火炬树桩老师带领大家进行训练。得知消息的僵尸们，悄悄潜入训练基地，对植物们进行突袭。狭路相逢的植物和僵尸无意中流落到一个荒岛上，又开始了另一番极限生存的挑战……植物能否躲开僵尸的突袭？他们*终能否离开荒岛？这其中发生了什么笑料百出的故事？一起去看看吧！,5,867,0,6.99,https://wfqqreader-1252317822.image.myqcloud.com/cover/307/30006307/s_30006307.jpg
大头兵·密码战士,2020-04-01 00:00:00,童书-漫画卡通,"“儿童爆笑军事漫画”系列是专为儿童创作的爆笑军事漫画。作品以硝烟弥漫的战场和多姿多彩的军营生活为背景，讲述了发生在大头兵和战友、大头兵和敌军之间的一系列紧张刺激又令人捧腹的幽默故事。书中，大头兵、博士、呆胖、敌军司令官为了赢取军事胜利，谋划了一次又一次令人啼笑皆非的军事行动。故事夸张、风趣，想象力奇特。漫画主人公大头兵形象诙谐，机智勇敢，不怕累 , 不怕输。幽默的故事中穿插着各种军事知识，让孩子在有趣的阅读中培养兴趣，形成良好的品质和正确的战争观。",9,921,0,6.99,https://wfqqreader-1252317822.image.myqcloud.com/cover/6/41721006/s_41721006.jpg
植物大战僵尸2武器秘密之你问我答科学漫画：世界之谜卷,2015-10-01 00:00:00,童书-漫画卡通,神秘的自然，总有人类无法解释的现象；广袤的大地，总有人类无法涉足的区域；深邃的宇宙，总有人类为之惊叹的奇观。尽管科学的力量无处不在，世界仍有难解的谜团！本书通过一个个轻松诙谐的漫画故事，讲述了有关世界之谜的32个有趣的知识点，从而揭开大千世界的小小一角，让小读者以发现的眼光审视四周，以探索的视角研究谜题，初步了解世界的丰富多彩、奇幻美妙，并由此激发出“十万个为什么”的好奇心，进入更为广阔、妙趣横生的科学世界。本书为“植物大战僵尸2武器秘密之你问我答科学漫画系列”的其中一本。,11,788,0,12.99,https://wfqqreader-1252317822.image.myqcloud.com/cover/363/30006363/s_30006363.jpg
植物大战僵尸2武器秘密之你问我答科学漫画：史前生物卷,2017-06-01 00:00:00,童书-漫画卡通,自从有生命以来，已经有5亿多种生物在地球上停留，从肉眼无法识别的真菌到高达6米的巨型蘑菇，从最早自海洋登上陆地的光蕨到“产煤大户”鳞木，从神秘消失的猛犸象到人类的祖先南方古猿，它们中的大部分已随环境的变迁而消亡，只有一小部分为了适应环境做出改变，成为今天的样子。但是，不管是此刻生活在地球上的生物，还是已经逝去的生物，每一种生物身上都携带着让我们重新认识地球的生命密码。本书以轻松幽默的漫画形式，从生命的源头开始追溯，讲述了58种具有代表性的史前生物的小故事，探究它们是如何捕食，如何防御敌人，为何消失的，从而激发小读者想要一探究竟的好奇心，在潜移默化间培养他们大胆怀疑、小心求证的科学精神。,19,864,0,12.99,https://wfqqreader-1252317822.image.myqcloud.com/cover/361/30006361/s_30006361.jpg
父与子（全集）,2017-08-01 00:00:00,童书-漫画卡通,《父与子》是德国漫画家卜劳恩的漫画合集。作品中一个个生动幽默的小故事实际上就是卜劳恩与儿子克里斯蒂安的真实生活写照。,12,832,0,16.99,https://wfqqreader-1252317822.image.myqcloud.com/cover/19/22720019/s_22720019.jpg
植物大战僵尸2武器秘密之你问我答科学漫画：鸟类卷,2015-09-01 00:00:00,童书-漫画卡通,在动物世界里，我们最容易见到的动物就是鸟类。它们既丰富多彩，又活泼可爱。这本书将告诉你更多的也许是你想知道却一直不知道的问题。比如，鸟为什么能在天上飞？鸟为什么叫？鸟类为什么会迁徙？鸭子为什么会游泳？鸡为什么要吃小石子？翠鸟为什么喜欢紧贴着水面飞行？蜂鸟为什么能在半空中停留？它简直就像一部鸟类版的百科全书。趣味漫画，轻松风趣；科学知识，一问一答。同学们可以追随“植物大战僵尸”中的植物战士的足迹，走过一次次或神奇有趣或爆笑滑稽的历程。本书为“植物大战僵尸2武器秘密之你问我答科学漫画系列”的其中一本。,24,835,0,12.99,https://wfqqreader-1252317822.image.myqcloud.com/cover/352/30006352/s_30006352.jpg
植物大战僵尸2武器秘密之你问我答科学漫画：电脑与网络卷,2016-01-01 00:00:00,童书-漫画卡通,从书信往来到电脑视频聊天儿；从现场授课到网络在线学习；从四处奔波选购生活物品到足不出户网络购物……电脑与网络已经深深渗透到人们生活的各个角落，在潜移默化中影响并改变着人们的生活方式。那么电脑与网络是如何发展起来的，将来又会发展成什么样？电脑与网络带给人们便利的同时，还造成了哪些负面影响？在电脑与网络时代出生、长大的孩子们，你们对电脑与网络了解多少呢？本书通过一个个轻松诙谐的漫画故事，讲述了40个有趣的电脑与网络知识，让小读者初步了解科学的力量，并由此激发出“十万个为什么”的好奇心，进入更为广阔、妙趣横生的科学世界。本书为“植物大战僵尸2武器秘密之你问我答科学漫画系列”的其中一本。,14,893,0,12.99,https://wfqqreader-1252317822.image.myqcloud.com/cover/337/30006337/s_30006337.jpg
星星饼干,2017-08-01 00:00:00,童书-漫画卡通,天黑了，月亮出来了，星星在夜空中调皮地眨着眼睛。这是栗子最开心的时刻，游戏时间到啦！他先造了一个四条腿的影子怪物，然后看了看窗外的树影妖怪，接着用对讲机和外星人聊天。这天他捡到一枚神奇的球形零件，放到对讲机里后，一个神奇的对讲机出现了。星星铺成的毯子一直伸到他的窗前，一个小外星人，邀请他一起去夜空玩耍。,4,744,0,13.99,https://wfqqreader-1252317822.image.myqcloud.com/cover/257/937257/s_937257.jpg
大头兵·乌龟铠甲,2020-04-01 00:00:00,童书-漫画卡通,"“儿童爆笑军事漫画”系列是专为儿童创作的爆笑军事漫画。作品以硝烟弥漫的战场和多姿多彩的军营生活为背景，讲述了发生在大头兵和战友、大头兵和敌军之间的一系列紧张刺激又令人捧腹的幽默故事。书中，大头兵、博士、呆胖、敌军司令官为了赢取军事胜利，谋划了一次又一次令人啼笑皆非的军事行动。故事夸张、风趣，想象力奇特。漫画主人公大头兵形象诙谐，机智勇敢，不怕累 , 不怕输。幽默的故事中穿插着各种军事知识，让孩子在有趣的阅读中培养兴趣，形成良好的品质和正确的战争观。",10,938,0,6.99,https://wfqqreader-1252317822.image.myqcloud.com/cover/8/41721008/s_41721008.jpg
大头兵·英雄难当,2020-04-01 00:00:00,童书-漫画卡通,"“儿童爆笑军事漫画”系列是专为儿童创作的爆笑军事漫画。作品以硝烟弥漫的战场和多姿多彩的军营生活为背景，讲述了发生在大头兵和战友、大头兵和敌军之间的一系列紧张刺激又令人捧腹的幽默故事。书中，大头兵、博士、呆胖、敌军司令官为了赢取军事胜利，谋划了一次又一次令人啼笑皆非的军事行动。故事夸张、风趣，想象力奇特。漫画主人公大头兵形象诙谐，机智勇敢，不怕累 , 不怕输。幽默的故事中穿插着各种军事知识，让孩子在有趣的阅读中培养兴趣，形成良好的品质和正确的战争观。",9,909,0,6.99,https://wfqqreader-1252317822.image.myqcloud.com/cover/2/41721002/s_41721002.jpg
植物大战僵尸2武器秘密之你问我答科学漫画：灾害与防护卷,2016-05-01 00:00:00,童书-漫画卡通,植物大战僵尸2中的植物和僵尸们要带领小读者展开一次科学之旅，去了解关于灾害和防护的知识。这些知识不仅有趣，而且非常实用。你知道暴雨来临之前有什么预兆吗？发生地震时怎样保护自己？遇上泥石流应该如何安全逃生？洪水来袭时如何科学自救？只有了解灾害，认识它给人类带来的威胁，掌握每种灾害发生时的应急措施，才能在灾害发生时更好地保护自己。本书内容丰富，构思巧妙，通过有趣的漫画、生动的语言来解释严谨的科学知识，非常适合小读者阅读。本书为“植物大战僵尸2武器秘密之你问我答科学漫画”系列中的一本。,18,834,0,12.99,https://wfqqreader-1252317822.image.myqcloud.com/cover/381/30006381/s_30006381.jpg
植物大战僵尸之武器秘密之你问我答科学漫画：海洋卷,2014-05-01 00:00:00,童书-漫画卡通,蔚蓝色的海洋浩瀚无垠、绚丽多姿、生生不息、气象万千。这里是生命的摇篮，是众多生物的家园，是气候的调节器，是地球的聚宝盆。本书通过一个个轻松诙谐的漫画故事，讲述了有关海洋的77个有趣的知识点，从而揭开神秘水世界的小小一角，让小读者感受海洋世界的丰富多彩、奇幻美妙，初步了解海洋世界深不可测而又井然有序的内在规律，并由此激发出满怀着“十万个为什么”的好奇心，进入更为广阔、妙趣横生的科学世界。本书为“植物大战僵尸2武器秘密之你问我答科学漫画系列”的其中一本。,25,861,0,12.99,https://wfqqreader-1252317822.image.myqcloud.com/cover/322/30006322/s_30006322.jpg
植物大战僵尸2武器秘密之你问我答科学漫画：宇宙卷,2014-10-01 00:00:00,童书-漫画卡通,广袤的宇宙充满了无穷的奥秘，它那浩瀚的时空涵盖了万事万物，它那璀璨的星图带给我们无尽的畅想和震撼，它那奇幻的天体奇观让人困惑又着迷……本书通过一个个轻松诙谐的漫画故事，讲述了有关宇宙的77个有趣的知识点，从而揭开神秘宇宙的小小一角，让小读者纵览太空奇景、追溯天体起源、关注未解之谜，初步了解自然世界的奇妙，并由此激发出满怀着“十万个为什么”的好奇心，进入更为广阔、妙趣横生的科学世界。本书为“植物大战僵尸2武器秘密之你问我答科学漫画系列”的其中一本。,25,847,0,12.99,https://wfqqreader-1252317822.image.myqcloud.com/cover/333/30006333/s_30006333.jpg
植物大战僵尸2武器秘密之你问我答科学漫画：健康生活卷,2016-12-01 00:00:00,童书-漫画卡通,生活中，每个人都有一位隐形的朋友，它叫作“健康”。当我们没有生病时，往往意识不到健康的重要性。阅读这本书，你将和“植物大战僵尸2”游戏中的主角们一起，踏上一场探寻“健康生活”的旅途。旅途中，你遇到的小伙伴有的不爱吃蔬菜，有的嗜饮料如命，有的熬夜写作业，有的患上了考前焦虑症，还有的不想去上学……或许，你已经从中看到了自己的影子，但却没有察觉这些事情对健康的损害。本书通过轻松诙谐的漫画形式，讲述了关于健康生活的36个小故事，带领小读者了解生理健康和心理健康方面的科学知识，提高维系健康生活的意识，为茁壮成长打好基础。本书为“植物大战僵尸2武器秘密之你问我答科学漫画系列”的其中一本。,12,927,0,12.99,https://wfqqreader-1252317822.image.myqcloud.com/cover/342/30006342/s_30006342.jpg
植物大战僵尸2武器秘密之你问我答科学漫画：农业与生态卷,2016-07-01 00:00:00,童书-漫画卡通,常言道：民以食为天。农业作为第一产业，为人们提供了稻谷、小麦等食物及农产品。随着生产和社会的发展，人们逐渐认识到传统农业和现代农业的生产方式会对生态、环境造成不小的破坏，进而探寻生态农业的发展之路。本书通过一个个轻松诙谐的漫画故事，讲述了关于农业与生态的51个知识点，让小读者初步了解农业生产和生态农业的基本概念，普及生态农业和爱护环境的理念，并由此激发出“十万个为什么”的好奇心，进入更为广阔、妙趣横生的科学世界。本书为“植物大战僵尸2武器秘密之你问我答科学漫画系列”的其中一本。,17,858,0,12.99,https://wfqqreader-1252317822.image.myqcloud.com/cover/354/30006354/s_30006354.jpg
装在口袋里的爸爸：纳米变形人,2022-04-27 00:00:00,童书-漫画卡通,杨歌意外得到一个由纳米机器人组成的粉色小球，纳米机器人由此进入杨歌的身体，使其身体发生了一系列不可思议的变形：有时变成长角的大甲虫，有时变成长腿巨人，有时长出三头六臂……通过爸爸发明的“意志力增强药水”等一系列药水，杨歌学会了控制纳米机器人，并利用它们制造出了变形金刚、纳米隐形人、超级英雄……不料，坏人猴子掌握了纳米机器人的技术，妄图利用纳米技术统治全世界。于是，正义与邪恶双方展开了一场恶战……,6,721,0,11.99,https://weread-1258476243.file.myqcloud.com/weread/cover/68/3300017468/s_3300017468.jpg
植物大战僵尸之武器秘密之你问我答科学漫画：动物卷,2014-02-01 00:00:00,童书-漫画卡通,动物是人类的朋友，地球上生存着成百上千万种动物，几乎遍布地球的每一个角落。动物世界里的知识浩瀚广博、精彩纷呈、千奇百怪。《科学漫画·动物卷》通过一个个轻松诙谐的漫画故事，讲述常见动物和珍稀动物的77个有趣的知识点，从而揭开动物世界的小小一角，让小读者感受动物世界的奇妙，初步了解生物进化、自然选择的神奇和科学的力量，并由此激发出满怀着“十万个为什么”的好奇心，进入更为广阔、妙趣横生的科学世界。本书为“植物大战僵尸2武器秘密之你问我答科学漫画系列”的其中一本。,25,850,0,12.99,https://wfqqreader-1252317822.image.myqcloud.com/cover/318/30006318/s_30006318.jpg
植物大战僵尸2武器秘密之你问我答科学漫画：植物卷,2015-08-01 00:00:00,童书-漫画卡通,植物世界是神奇而美妙的，人们用花红柳绿、姹紫嫣红等传神的词语来形容植物的美丽。植物也与人类的生活息息相关，它们或为人们提供氧气，或为人们提供食物，或为人们带来美的享受。本书通过一个个轻松诙谐的漫画故事，讲述了与植物相关的63个知识点，让小读者了解各种植物的习性特点和神奇之处，初步学习基本的科普知识，并由此激发出满怀着“十万个为什么”的好奇心，进入更为广阔、妙趣横生的科学世界。本书为“植物大战僵尸2武器秘密之你问我答科学漫画系列”的其中一本。,20,847,0,12.99,https://wfqqreader-1252317822.image.myqcloud.com/cover/385/30006385/s_30006385.jpg
植物大战僵尸2武器秘密之你问我答科学漫画：珍奇动植物卷,2017-03-01 00:00:00,童书-漫画卡通,大自然犹如一座没有围墙的殿堂，陈列着千姿百态、奇趣万千的动物和植物。你知道有一种蜥蜴眼睛会喷血吗？你知道有一种动物身上长着植物吗？大自然无奇不有，万千珍禽异兽、奇花异草等着你去发现！本书将带领你登上雪山，偶遇“雪山之王”；深入大海，寻找“水中大熊猫”；踏进非洲，品尝“树种之象”的巨型果实。一场珍奇动植物的邂逅之旅已经拉开帷幕！本书通过轻松诙谐的漫画形式，讲述了关于珍奇动植物的38个小故事，带领小读者了解自然界中珍稀而奇特的动物和植物，同时潜移默化地传递保护地球生态环境的理念。并由此激发小读者“十万个为什么”的好奇心，引领孩子进入更为广阔的、妙趣横生的科学世界。,13,864,0,12.99,https://wfqqreader-1252317822.image.myqcloud.com/cover/383/30006383/s_30006383.jpg
