title,publishTime,category,intro,maxFreeChapter,newRating,free,price,cover
拆解问题的技术：让工作、学习、人生难事变简单的30张思考图表,2019-08-01 00:00:00,个人成长-认知思维,过去我们常常依靠经验或者感觉来判断事情，做出决策，这无异于赌博，因为我们所凭借的依据无法量化，而人的感觉也会因为不同情境而有所改变，导致影响事情的变量日益增多，要做出正确的决定就越发困难。拆解的技术其实是解决问题的一种思维模式，即把问题拆解成可执行的步骤。在信息爆炸的当下，我们身处的环境有太多变数，遇到问题，一定要先把各个变量拆解分类，再通过第一性原理反复验证拿掉这个变量后事情是否无法推进，从而找出关键的核心元素。依据这个流程做出的判断与决策更为理性与精准，能够让人把精力聚焦于应该完成的事情上，产出高质量的成果。,12,419,0,19.12,https://wfqqreader-1252317822.image.myqcloud.com/cover/537/33091537/s_33091537.jpg
超级记忆与记忆宫殿法,2018-03-01 00:00:00,个人成长-认知思维,利玛窦成书于400多年的《记忆宫殿》，承接起源于公元前5世纪的古罗马记忆术，深远影响了现代记忆术的发展。《超级记忆与记忆宫殿法》继承《记忆宫殿》的经典思想，立足现代记忆术解说如何理解并应用宫殿记忆法，并结合具体的记忆实例重点论述了怎样进行空间位置的营造和图像转化、图像定位，从而快速牢固地记住任何你想记忆的内容。,9,654,0,15.92,https://wfqqreader-1252317822.image.myqcloud.com/cover/763/23914763/s_23914763.jpg
时间思维,2020-11-01 00:00:00,个人成长-认知思维,时间资本主义时代，如何管理时间，如何运用时间创造价值，进而管理好自己的人生，关键在于重建个人的底层思维，而需要建立的思维就是时间商。《时间思维》一书探索时间和生命的核心关系，从生命、认知、思维等方向切入“时间商”主题，进而从认识时间、管理时间、延长时间、转化时间的角度打破每个人原有的认知及价值体系，重建底层思维，帮助人们唤醒时间商，提出时间价值、格子理论、山后思维等方法，让我们能够用最好的方式思考、观察、记录、总结、分享和行动，用时间商去认知世界、思考世界，从而拥有自己的思想体系，去创造更多的价值。,13,680,0,46.99,https://wfqqreader-1252317822.image.myqcloud.com/cover/261/34158261/s_34158261.jpg
超级阅读力训练,2004-01-01 00:00:00,个人成长-认知思维,"    人生有许多乐趣来自于阅读。我们的生活是如此多彩，然而，我们亲自经历的事情却是有限的。通过阅读我们可以在有限的时间内学到无限丰富的知识，这就是阅读的魅力。阅读是人生的最大享受之一。通过阅读所体现的幸福主要体现在独处和索居时：通过阅读所养成的斯文主要体现在谈吐上；通过阅读所发展的才能主要表现在办事的决断和处理上。因为，经验丰富的人固然能做事，也许还能洞察细枝末节，但总体上的统领和运筹帷幄上的才干，则惟有出自于那些博学阅读的人士。
",2,645,0,9.9,https://wfqqreader-1252317822.image.myqcloud.com/cover/798/344798/s_344798.jpg
11堂极简系统思维课,2019-01-01 00:00:00,个人成长-认知思维,万维钢《精英日课》解读，并倾情作序，罗辑思维推荐。提升你的逻辑能力，更批判性地思考，运用系统思维解决问题，一切从翻开这本书开始。系统思维在帮助我们解决各种不同的复杂问题时非常有效。95%的人无法做到系统思考。在本书中，作者以简练的语言与真实的事例，介绍了什么是系统思维、系统思维的要素，系统是如何运行的，如何将系统思维运用到你的工作与生活中。在这11堂系统思维课里，谈到了绩效、商业竞争、政策制定、人际关系等。本书展示了一个观察和思考这个世界的不同方式，将帮助你超越简单的因果关系，考虑到影响问题的每个因素，找到战略性解决方案，提高你的批判性思维、分析能力、有效解决问题的能力。,5,520,0,19.02,https://wfqqreader-1252317822.image.myqcloud.com/cover/511/33091511/s_33091511.jpg
老狐狸经（历代经典文丛）,2008-11-01 00:00:00,个人成长-认知思维,"    狐狸总给人“狡猾”之意，但是书中给狐狸的定义是具有智慧的。学学像狐狸一样的为官、做人。《老狐狸经》不是在教读者诈，而是为读者介绍了为官之道、做人之道、创业之道、说话之道，是在指导读者如何更好地适应社会，适应生存，不断提升自己的说话能力，以寻找到发挥的舞台。
",3,0,0,3.99,https://wfqqreader-1252317822.image.myqcloud.com/cover/847/699847/s_699847.jpg
麦肯锡精英的思考习惯,2016-06-01 00:00:00,个人成长-认知思维,高杉尚孝说，过去大家都误会了，情绪问题其实不关乎情绪，而是一种思考的技术。职场中人不能仅依靠正向思考（想开点、对自己喊加油，是没用的），而是要区分好的负面思考与坏的负面思考，本书将告诉你如何处理职场中内疚、不安、悲伤等情绪，以及如何将这些情绪化解为更专业出色的表现。,5,570,0,21,https://wfqqreader-1252317822.image.myqcloud.com/cover/456/844456/s_844456.jpg
性格的塑造,2016-10-01 00:00:00,个人成长-认知思维,"《性格的塑造》是阿尔弗雷德·阿德勒59岁时候完成的一本名著，书前附有W.贝仁·吴尔夫医学博士的精彩导读。作者搜集了阿德勒诊所中的典型案例以及美国大城市学校和儿童指导中心的经典案例，通过缜密的观察来描绘并探索孩子的人格动态和心灵世界。本书抛弃了枯燥的理论构架，用充满温柔的同情和关怀指导孩子面对人生的苦涩、尴尬个彷徨。帮孩子塑造阳光、健康、良好的性格。
",4,742,0,5.9,https://wfqqreader-1252317822.image.myqcloud.com/cover/769/858769/s_858769.jpg
戒了吧，拖延症,2019-04-01 00:00:00,个人成长-认知思维,拖延和犹豫是失败的原因，行动和速度才是制胜的关键！进入互联网社会后，难以量化的工作特点和现代碎片化的生活方式，正在不断加剧拖延行为。每个人都或多或少被拖延所困扰，拖延的时候虽然内心饱受煎熬却又很难从中脱逃。本书正是为拖延症患者们准备的一剂“苦口良药”。在这本书里，从拖延症的行为模式到拖延的危害，再到拖延产生的深层次原因，我们为你解开了这些谜底。而如何战胜拖延症，书中也给出了详细且全面的策略。,27,690,0,17.99,https://wfqqreader-1252317822.image.myqcloud.com/cover/211/26189211/s_26189211.jpg
一学就会的宫殿记忆法（图文版）,2019-01-01 00:00:00,个人成长-认知思维,作者以小说的手法，以主人公恩的亲身经历为故事主线，由浅入深地讲解了目前公认的最科学的记忆方法——宫殿记忆法的原理、使用方法及训练要点。在有关图像处理的环节还配以生动形象的插图，使《一学就会的宫殿记忆法（图文版）》成为一本实用生动、有趣有料的记忆法提升秘籍。,6,587,0,19.2,https://wfqqreader-1252317822.image.myqcloud.com/cover/820/25559820/s_25559820.jpg
初中三年，提高学习成绩的窍门（第2版）,2021-03-01 00:00:00,个人成长-认知思维,同样的课本，同样的老师，同样用功，有的人可以成为学霸，有的人成绩总是不上不下，这是为什么呢？除了聪明与刻苦之外，或许你应该从学习方法上找找原因。本书针对初中学生的学习特点，综合诸多优等生的学习方法和实战经验，为苦于提高成绩而无门的学生总结出一系列简单实用的学习窍门，帮助初中生解开学习困惑，找到适合自己的学习方法，快速提升学习成绩。,32,0,0,16,https://wfqqreader-1252317822.image.myqcloud.com/cover/710/41718710/s_41718710.jpg
提高工作效率，从整理办公桌开始,2021-10-01 00:00:00,个人成长-认知思维,在日常工作中，你是否有过这样的经历：办公桌杂乱，重要会议在即，可是翻遍每一层抽屉都找不到急用的资料。电脑文件太多太杂，费力打开好几个文件夹，才能找到想要的文件。工作没有计划，任务安排没头绪，总是不自觉拖延。事实上，一个人办公桌上的有形物品，直接展示了他的工作方式、工作态度和思维模式。美国某咨询公司调查显示，职场人士平均花在找东西上的时间为150小时/年，而工作能力强、效率高的人大多办公桌整洁，手边的东西井然有序。在本书中，效率管理专家中野清人以提升工作的效率、质量和成效为目标，传授了诸多职场实用整理术。除了涵盖桌面、文件等物品的整理方法，书中还介绍了信息处理、日程管理、任务规划等提高工作效率的方法，以及如何有效地整理工作思路，从而帮助你节约工作上的时间成本，提高工作效率，轻松成为高效、低失误的职场达人！,29,478,0,29.99,https://wfqqreader-1252317822.image.myqcloud.com/cover/12/41287012/s_41287012.jpg
战胜拖延症,2019-08-01 00:00:00,个人成长-认知思维,拖延是人性的弱点之一，很多人在开始一项任务之前，总会找出一些冠冕堂皇的理由来说服自己拖延，心安理得地享受懒惰带来的放松；拖延有时是因为不够自信，对如何能做好事情有恐惧感，他们常常能找出一些不做的理由来安慰自己，不敢面对现实；有的人追求，为一点点小事没有办好就一直懊恼不已，进而拖延该做的事；有些人自制力很差，容易受外界，很可能屈服于眼前的欲望，而放弃对未来好的选择……本书正是为拖延症患者们准备的一剂“苦口良药”。在这本书里，从拖延症的行为模式到拖延的危害，再到产生拖延的深层次原因，我们为你解开了这些谜底。而如何面对拖延症，书中也给出了详细且全面的战拖策略。只要你阅读本书，从现在就开始行动起来，你可以轻松地宣告：战拖，soeasy！,27,639,0,15.99,https://wfqqreader-1252317822.image.myqcloud.com/cover/348/26562348/s_26562348.jpg
超级记忆术,2019-12-01 00:00:00,个人成长-认知思维,学习改变命运，知识成就未来，因此，拥有良好记忆显得非常重要。记忆是我们生存发展的需要，是我们智能的因素和学习的基础，也是完成各项工作和追求成功的基本保证。为此，本书教给您超级记忆术，让您获得神奇的记忆魔力！,8,0,0,6,https://wfqqreader-1252317822.image.myqcloud.com/cover/143/38134143/s_38134143.jpg
图解逻辑思维一学就会,2018-08-01 00:00:00,个人成长-认知思维,逻辑思维是让大脑更聪明、表达更清晰、推理更严密的思考方式，学习、工作、分析问题、沟通表达等都离不开逻辑和逻辑思维。本书采用“漫画+文字+图解”的模式，深入剖析逻辑思维。作者用一些小故事和通俗的趣味问题来展现逻辑的魅力。如果你经常被朋友或家人评价为“毫无逻辑”却不知道如何改进，那么这本书就正是你所需要的。说话做事有逻辑，任何场合都能让你赢得赞赏和支持。,20,677,0,7.99,https://wfqqreader-1252317822.image.myqcloud.com/cover/140/23723140/s_23723140.jpg
好习惯Get，时间Max！,2016-03-18 00:00:00,个人成长-认知思维,有没有觉得每天时间总是不够用？最大限度利用时间的最好办法，是养成好习惯并贯彻下来，这会帮你：充分利用每一天的时光，享受更富有成效的人生，有效率地达成更多人生目标，更有条理地生活，有更多时间做自己真正想做的事，本书会告诉你如何养成好习惯、如何高效率地利用从早起到晚上入睡之间的一天时光，最终一步步成为人生赢家！养成好习惯，从现在开始，为时不晚！作者介绍杰米的作品大多是谈论工作和生活方式方面的话题。,5,514,0,12.99,https://wfqqreader-1252317822.image.myqcloud.com/cover/59/858059/s_858059.jpg
拖延心理学,2011-06-01 00:00:00,个人成长-认知思维,"    从学生到科学家，从秘书到总裁，从家庭主妇到销售员，拖延的问题几乎会影响到每一个人。我们每个人都对自己是最了解的，你是否拖拉，你可以瞒过你的上司，瞒过你的同事，瞒过你的朋友或者家人，但是，你自己知道，你是否正在拖延的泥沼里挣扎，如果有，那么是时候解决这个问题了，打开这本书从众多心理咨询领域中汲取的丰富理论和经验，对拖延问题进行了一次仔细、详尽、有时也颇为幽默的探索。从科学里汲取力量，摆脱拖延，享受生活的轻松！
",4,549,0,1.99,https://wfqqreader-1252317822.image.myqcloud.com/cover/622/228622/s_228622.jpg
深度思考,2018-09-01 00:00:00,个人成长-认知思维,科学高度：深度思考，是深度工作与深度学习的本质，帮你打造解决问题的底层思考框架。思维广度：笔记思维×故事思维×过程思维×减法思维，四种思维让你告别“低水平勤奋”。新的时代：不要为了追求速度而放弃深度思考，你快不过机器。在人工智能时代，我们人类关键的思维优势，就是深度思考。透过现象、洞察本质、认知升级、心智跃迁，让每一个问题成为机会！成为解决复杂问题的高手！,3,508,0,16.99,https://wfqqreader-1252317822.image.myqcloud.com/cover/720/23722720/s_23722720.jpg
哈佛高效学习法：如何利用好凌晨四点半的理念,2021-02-01 00:00:00,个人成长-认知思维,本书旨在提高学生的学习效率，从实际上去解决“孩子虽然努力学习了，但成绩始终上不来”的问题。主要从时间管理浅显化，学习方法具体化，励志教育捆绑化，情商辅导针对化，经验介绍案例化切入。本书还提出“向每一秒钟要成绩”的概念，重点推荐来自哈佛的、适用于国内情况的“高效学习法”。为学生和家长提供好的指导和借鉴，帮助学生把“小时功”最大化。找对属于你的学习方法，突破学习瓶颈也不是难事。,4,0,0,11.99,https://wfqqreader-1252317822.image.myqcloud.com/cover/416/38552416/s_38552416.jpg
破解福尔摩斯思维习惯：印度数学,2015-05-28 00:00:00,个人成长-认知思维,于雷编写的《印度数学》整理总结了数十种的印度秘密计算法，不仅强化了我们的加减乘除的运算能力，还包括平方、立方、平方根、立方根、方程组以及神秘奇特的手算法和演算法。改变的不仅是孩子的数学成绩，更是孩子的思维方式，让孩子从一开始就站在一个不一样的起点上。对孩子来说，它可以提高他们对数学的兴趣，爱上数学，爱上动脑；对学生来说，它可以提高计算的速度和准确性，提高学习成绩；对成年人来说，它可以改变我们的思维方式，让你在工作和生活中出类拔萃、与众不同。如今，我们将印度数学的秘密计算法在本书中彻底公开。让我们进入印度数学的奇妙世界，学习魔法般神奇的计算法吧！,6,698,0,8.97,https://wfqqreader-1252317822.image.myqcloud.com/cover/281/834281/s_834281.jpg
思考力,2016-12-01 00:00:00,个人成长-认知思维,在这个瞬息万变的时代，如果仍然用旧有的观念和思路来思考问题、处理事情，显然已经不能跟上时代的脚步。要想跟上生活的节奏和适应多变的环境，我们必须进行一场大脑的革命，让我们的大脑打破一切常规、超越障碍、进行深度的思考，打造适应时代的思维模式。本书精选了哈佛大学的一整套打造系统化思维和实现思维透明化的思路和方法，帮你培养超强的思考力、打造超常规系统化思维的理论和方法，让你的思考方式变得更加有效、科学，前卫。,33,537,0,10.8,https://wfqqreader-1252317822.image.myqcloud.com/cover/797/23711797/s_23711797.jpg
哈佛博弈课,2014-06-01 00:00:00,个人成长-认知思维,"    这是一本关于哈佛博弈课的经管书，此书将博弈论层层剖析，结合生活中的例子，结合当今社会热点，将我们生活中可能用到的博弈做出讲解，有利于人们在生活中运用。读此书，让你“知己知彼”，了解对方的想法，了解他们知道些什么，是什么激励着他们，甚至他们是怎么看你的；读此书，让你“洞察先机”，让你的策略选择不能完全出于你的主观意愿，还能考虑到其他参与者如何行动；读此书，让你“影响对方”，扭转对方的思维，做到进可攻退可守，瞬间提高决断力，引导并利用他人的情绪，把胜利导向自己，扭转对方的思维，做到进可攻退可守。
",12,754,0,8.94,https://wfqqreader-1252317822.image.myqcloud.com/cover/37/807037/s_807037.jpg
图解超级记忆术,2017-06-01 00:00:00,个人成长-认知思维,人脑潜在的记忆能力是惊人的和超乎想象的，只要掌握了科学的记忆规律和方法，每个人的记忆能力都可以得到提高。记忆力得到提高，我们的学习能力、工作能力、生活能力也将随之提高，甚至可以改变我们的命运。世上没有记性不好这回事，你的记忆力远比想象的要好。斗南主编的《图解不错记忆术（全彩图解典藏版）》既是一把进入不错记忆王国的智能钥匙，又是个人推荐的挖掘大脑潜能的记忆指南。书中介绍的记忆方法和技巧不仅能帮你造就某一方面的出色记忆力——让你快速掌握一门外语，记住容易疏忽的细节，克服心不在焉的毛病；更能让你的记忆力在整体、在各方面都达到杰出水平，轻松记住想记住的事，让记忆更快更持久。随着记忆力的提高，你会发现自己的知识结构更加完善，处理问题更加得心应手；你会发现自己的自信心大大提高，在说话时更加有底，办事时更有效率；你还会发现自己的学习力、判断力、分析力、决策力等都随之得到了增强。,12,0,0,13.99,https://wfqqreader-1252317822.image.myqcloud.com/cover/438/26188438/s_26188438.jpg
一生气你就输了,2018-01-01 00:00:00,个人成长-认知思维,本书详尽分析了生气对人生各个方面的危害，如影响人际关系、阻碍事业发展、影响婚姻生活、使不良情绪无止境地蔓延、丧失积极进取的勇气等等，同时阐述了远离生气地各种方法，讲授了不生气的智慧，是一部个人改善自我、走向成功的心灵读本。,35,0,0,15.99,https://wfqqreader-1252317822.image.myqcloud.com/cover/553/26125553/s_26125553.jpg
超级记忆力养成计划,2019-09-01 00:00:00,个人成长-认知思维,拥有超级记忆力，工作学习更高效√更深入的理论养成√超有效的训练计划√多类型的记忆示例英国哲学家培根认为所有知识都源于记忆，记忆不仅能存储知识，更能实现知识的链接和丰富。掌握超级记忆法既有助于学习效率的提高，还有助人们掌握更多的知识。作者在本书向读者分享了十余年超级记忆法训练的方法、心得和经验，厘清了记忆训练可能遇到的困惑，提出了万能记忆公式。训练计划从超级记忆法的基础串联开始，逐步进阶到地点桩和文字桩、数字编码以及图像转化。作者还列举大量的学科知识，辅以超详实的解读和分析，保证读者能够举一反三，在实践中灵活运用超级记忆法。本书不仅有理论方法，更有实践训练，只要认真读完本书并踏实练习就一定能让记忆力提升200%！林彼得（实战派记忆导师）◎2010年开始从事超级记忆力培训，专研记忆术在工作、日常生活和考试方面的实际应用；◎指导过多位世界脑力锦标赛裁判、世界记忆大师、CCTV脑力挑战节目选手；◎辅导学员49秒速记一副扑克牌，1小时牢记200个英语单词，6天将《道德经》《易经》倒背如流，1个月通过建造师等级考试。,15,0,0,18,https://wfqqreader-1252317822.image.myqcloud.com/cover/730/32012730/s_32012730.jpg
7S倍速记忆法,2005-08-01 00:00:00,个人成长-认知思维,"本书可以为那些还在“学海”中苦苦挣扎的学子们和总抱怨自己记性不好的人们送去一叶带领他们脱离“苦海”的方舟！同时也顺便把那些勤奋上进，超越自我的人们捎到理想的彼岸！乘坐在“超级”号快轮上的人们都将迅速、顺利地到达目的地！本书集中了目前世界上最著名的记忆力提升训练专家们的最佳成果，根据他们的理念开发出最有效的提升训练方案，按照本书中的方法去行动，你将可以成倍提高记忆力。
",3,555,0,9.9,https://wfqqreader-1252317822.image.myqcloud.com/cover/954/344954/s_344954.jpg
中国人的95种性格及其命运,2009-07-01 00:00:00,个人成长-认知思维,本书从性格理论出发，从众多的性格类型中，列举了如中庸、狭隘、懦弱、懒惰、残暴、认真、自满、自负、大度、勤奋、诚信、正直、豪放、多疑、孤僻、乐观、自卑、进取、顽强、创新、敏感、逃避、自恋、自闭等性格特征来进行分析、阐述，使人们认识到：不仅要利用正面的性格，也要警惕负面的性格。,30,0,0,1.99,https://wfqqreader-1252317822.image.myqcloud.com/cover/854/507854/s_507854.jpg
纵横心法：鬼谷子的权谋与韬略,2019-05-15 00:00:00,个人成长-认知思维,鬼谷子是先秦时期的一个高人，他因隐居鬼谷而得名，他培养出的兵家庞涓、孙膑，改变了战国中期的军事格局；他教出的纵横家苏秦、张仪，终结了战国晚期的争霸局面。他因传授兵学，居住的“鬼谷”被称为“中国最早的军校”；他所流传的游说术，被称为纵横家的鼻祖；他长于修身养性，被道家奉为“古之真仙”；又善于占往察来，被阴阳学家奉若神明。这样一位充满神秘色彩的全才、奇才，留下了一本以他名字命名的《鬼谷子》，也是纵横学派留下的唯一典籍。本书通过对鬼谷子的解读，不仅向读者呈现了经典的魅力，更是提炼出了一套适合现代人的生存法则。,8,0,0,28,https://wfqqreader-1252317822.image.myqcloud.com/cover/726/37326726/s_37326726.jpg
产业互联网：全产业链的数字化转型升级,2021-01-01 00:00:00,个人成长-认知思维,数字经济时代下，企业面临数字化转型，产业互联网正在全面重构产业链。产业互联网是包含众多支撑技术及应用场景的综合体，其在实际应用中极具复杂性，因此，真正理解产业互联网并能将其用于工作中，也绝非易事。《产业互联网 : 全产业链的数字化转型升级》系统地阐述了产业互联网的发展背景、产业互联网的理论认知、产业互联网的顶层规划、产业互联网的转型实施，为产业互联网构建了完备的理论体系和实施的方法论。同时，展示了产业互联网不同领域的实践案例，以实证方法更为清晰地呈现了产业互联网的构建路径和实施效果。在落地实施方面，《产业互联网 : 全产业链的数字化转型升级》对IT解决方案也有详尽的介绍。《产业互联网 : 全产业链的数字化转型升级》是企业家、投资者研习产业互联网不可错过的案头书。,10,0,0,39.2,https://weread-1258476243.file.myqcloud.com/weread/cover/45/3300013745/s_3300013745.jpg
轻松搞定ZTD：终极简单的效率系统,2017-01-24 00:00:00,个人成长-认知思维,本书的精髓是简约，同时融合了多种有重要影响力的工作效率系统（如GTD、高效能人士的7个习惯等）的精华，教你学会：变得简约、高效、有条理，需要培养哪些关键习惯；培养这些关键习惯的方法；如何将这些习惯组建成一个简单的系统，提升效率；怎样简化待做事项，主要完成真正重要的事情。大量读者写信给里奥·巴伯塔，感谢他创建的ZTD系统极大地改变了他们，使他们的生活和工作更有条理，压力少了很多，做事效率大幅上升，变得更加快乐！你也值得去尝试，只要开始行动，你也能做到这些，成为更好的自己！,6,0,0,1.99,https://wfqqreader-1252317822.image.myqcloud.com/cover/332/36235332/s_36235332.jpg
