title,publishTime,category,intro,maxFreeChapter,newRating,free,price,cover
畅销书的诞生：经典案例分析,2021-12-01 00:00:00,个人成长-认知思维,畅销书产业发展迅速，本书主要对以近30年我国畅销书出版领域的经典案例进行系统分析，总结不同类型畅销书出版传播经验，为业界畅销书出版者提供借鉴。,11,0,0,33.6,https://weread-1258476243.file.myqcloud.com/weread/cover/98/3300014098/s_3300014098.jpg
如何快速阅读1000本书,2021-02-03 00:00:00,个人成长-认知思维,作者通过阅读1000本书的亲身经历，总结出10个阅读秘诀。如何在不打乱原有生活节奏的前提下，抓住99%的人忽视的阅读机会，让你的阅读力倍增，尽在本书揭晓。,5,285,0,15.9,https://wfqqreader-1252317822.image.myqcloud.com/cover/329/37444329/s_37444329.jpg
记忆达人教你神奇记忆术,2017-01-01 00:00:00,个人成长-认知思维,人的记忆习惯讲述了几种常用的记忆方法。第三章至第七章讲述了记忆法在语文、政治、历史等各学科中的运用，并针对每种不同的知识点详细地举了案例，讲解生动、深入浅出。第八章主要讲解了英语单词的记忆诀窍，针对每种方法都列举了案例。第九章是对记忆法的延伸，主要讲述了思维导图在学习和工作中的运用，思维导图心法及绘制技巧。整本书针对我们生活和学习中需要记忆的信息进行了划分，并且都列举了案例讲解，期待每一位读者都能开卷有益，快速炼就超级记忆力。,12,0,0,15.2,https://wfqqreader-1252317822.image.myqcloud.com/cover/230/924230/s_924230.jpg
时间是什么,2020-01-08 00:00:00,个人成长-认知思维,本书适合各年段人士，只要他们能够阅读并且有志于了解“时间是什么”的问题。本书讲述了人们为何认为时间是相对的，时间是什么，并向读者介绍各种时间测量装置，同时还讲解时间旅行为何不可能。如果你想更清晰地向孩子、朋友或学生讲述时间的概念，答案就在这里。,4,450,0,6.99,https://wfqqreader-1252317822.image.myqcloud.com/cover/457/29718457/s_29718457.jpg
关键词阅读术,2021-09-01 00:00:00,个人成长-认知思维,通过使用“关键词阅读术”进行阅读，我们可以做到时刻对想要的信息保持高度敏锐，即使身处海量文字中也不会遗漏丝毫信息，扎实地吸收所有想要的信息；学会挑选适合自己的书籍；能从不符合预期的书中依然吸收到有用的信息；学会合理分配精力，有选择地进行速读或泛读；学会有技巧地在社交软件上展示阅读成果，传播有用信息，得到认可和满足……最终，达到通过阅读改善工作和生活的效果。,2,0,0,19.9,https://wfqqreader-1252317822.image.myqcloud.com/cover/307/43296307/s_43296307.jpg
赢家逻辑,2016-01-01 00:00:00,个人成长-认知思维,"人生岁月总是充满了徘徊和迷茫，没关系，谁都曾经这样。沉下心来，你会发现，你比想象中更强大。研读以弱胜强的内在逻辑，在现实中找到看待自己优势与劣势的全新角度，挖掘内在超越强者的可能性。只要你掌握了正确的思考方式，你也能在最短的时间激发你内在的潜能，释放能量，改变命运，创造一个全新的未来！本书告诉我们，用崭新的眼光审视众多以弱胜强的故事，向弱势群体和不适应生活的人展示取胜的原因和方法，特别是在与强者的对决中，我们要表现出自己的态度，坚持自己的原则，适时让自己坚决、果断一些，给你以坚定的力量，让我们思考应该如何更积极地度过人生。
",17,0,0,9.84,https://wfqqreader-1252317822.image.myqcloud.com/cover/774/929774/s_929774.jpg
成才习惯大全集（优秀小学生必读）,2011-08-01 00:00:00,个人成长-认知思维,"    英国作家萨克雷说：“播种行为，可以收获习惯；播种习惯，可以收获性格；播种性格，可以收获命运。”对于小学生来说，拥有好习惯是成才的重要因素。《方洲新概念·优秀小学生必读：成才习惯大全集》用丰富多彩的故事和浅显易懂的道理告诉小学生如何培养好习惯，改掉坏习惯。它能让大家更好地了解自我、认识自我，堪称照亮成长之路的指明灯、打开成功之门的金钥匙。
",7,0,0,1.99,https://wfqqreader-1252317822.image.myqcloud.com/cover/174/506174/s_506174.jpg
半途而废自救指南：让坚持变轻松的 17 个日常练习,2022-03-01 00:00:00,个人成长-认知思维,埃里克·迈塞尔（Eric Maisel）博士被广泛认为是美国最重要的创造力教练，他是前心理治疗师，活跃的创造力教练和批判心理学的拥护者。 他为《今日心理学》撰写了《重新思考心理健康》博客，在国内和国际上均有演讲，并为国际心理心理学和精神病学学会以及美国心理健康咨询师协会等组织发表了主题演讲。此外他还在批判心理学，写作，创造力和创造生活领域撰写了50多本书，包括心理健康的未来、人道帮助、重新思考抑郁、无畏创造、掌握创造性焦虑、梵高蓝调、制作你的创意标记、有毒批评、睡眠思维、指导艺术家内部、终身创造力?等。他在欧洲多个知名城市举办深度写作研讨会，通过DailyOM在他的课程中教了成千上万的学生。,6,0,0,46.8,https://weread-1258476243.file.myqcloud.com/weread/cover/6/3300017806/s_3300017806.jpg
麻省理工学院最受推崇的创新思维课,2013-10-01 00:00:00,个人成长-认知思维,"    麻省理工学院，世界理工类高等学府中一枝独秀。建校130年来，为美国培养造就了大批科学家和工程技术人员。在这些著名人物的身上无不闪耀着思考与创新的光辉。身为创新的思想领袖，麻省理工学院为读者提供了一套完全原创的，并且经过实践检验的方法，来建立“创新文化”，给企业和个人带来更多的创新成果。
",6,0,0,7.99,https://wfqqreader-1252317822.image.myqcloud.com/cover/551/925551/s_925551.jpg
受益一生的北大思维课,2014-09-01 00:00:00,个人成长-认知思维,"    本书甄选了众多北大教授和著名北大学子的思想精髓、经验之谈，以及名人寻常而又非凡的成功经历等，提炼并归纳出了最适合现代中国青年人的思维方式，形象而深刻地展现了北大思想的精髓与魅力。
",28,0,0,7.99,https://wfqqreader-1252317822.image.myqcloud.com/cover/489/925489/s_925489.jpg
拆·解（第2版）,2022-01-01 00:00:00,个人成长-认知思维,"本书所介绍的方法不在于其全面的系统性和严格的逻辑性，而在于其通用的实践性和简单的易用性，""个性场景 + 结构方法”是本书所遵循的基本思路。书中的场景拆解导航图可以帮助读者结构化地解码他们所面临的烦恼或焦虑。本书由上下两篇组成，上篇通过""90 分钟的场景拆解课”这个主题，展现了场景拆解模型的核心要素。下篇精心挑选了 18 个生活中的真实场景故事，其目的是帮助读者快速学习与时俱进的经验，并加深对本书中方法模型的理解和应用。事实上，每个场景都是唯一的、独特的、未知的，只要参照场景拆解导航图拆解自己的场景，就能找到解码的密钥。",8,0,0,34.8,https://weread-1258476243.file.myqcloud.com/weread/cover/15/3300017815/s_3300017815.jpg
习惯的力量,2014-06-01 00:00:00,个人成长-认知思维,罗马不是一天建成的，成功更不是一步登天的神话。如果你喜欢看成功人士的故事，你会发现，他们的事业金字塔是由一块块考究的基石逐渐搭建而成的。这些基石，就是做人做事的习惯。美国成功学大师拿破仑·希尔说：习惯能够成就一个人，也能够摧毁一个人。习惯的力量是如此强大，让我们的人生有所不同。,33,588,0,1.99,https://wfqqreader-1252317822.image.myqcloud.com/cover/659/567659/s_567659.jpg
3分钟励志小丛书：习惯,2012-08-01 00:00:00,个人成长-认知思维,《3分钟励志小丛书·习惯：成大事者的12种好习惯》列举科学研究，若一个行为或动作每天都做，坚持21天，它就变成一种习惯；如果能坚持90天，它就差不多成了一种本能。而好的习惯，能给你带来一生的成功和富足。因此培养好习惯，是一个人一生中性价比最高的投资。,4,0,0,5.99,https://wfqqreader-1252317822.image.myqcloud.com/cover/464/27328464/s_27328464.jpg
如何有效阅读：文学大师的79堂阅读课,2020-10-01 00:00:00,个人成长-认知思维,"阅读想拿高分，挖空心思却不尽人意；想提高文学素养，绞尽脑汁却无从下手；想提高阅读能力与效率，费尽心机却不得其法……《如何有效阅读：文学大师的79堂阅读课》萃取夏丏尊、朱自清、老舍、梁启超、胡适等多位文学巨擘、语言大师、语文学家毕生的阅读经验与读书方法，打破你的阅读力“魔咒”，燃爆你的阅读力“小宇宙”，全面提升你的阅读力（认知力、理解力、鉴赏力、思考力、记忆力、想象力等）、表达力、文案力、创作力，让你发现阅读之乐，品味文学之美，快速选择好书，高效捕捉信息，有效抓取内容，阅读拿高分，学习记得牢，读书收获多。
《如何有效阅读：文学大师的79堂阅读课》全书共分为79讲，涵盖散文、诗歌、小说、戏剧等各种文学体裁，深入浅出地剖析了各种阅读经验与读书方法，详细解答了“何为读书？”“为何读书？”“读何种书”“如何读书？”等一系列大众关心的问题，帮助大家实现真正的有效阅读。作者权威博雅不浮夸，内容通俗有料不说教，方法实用高效不过时，无论你是想提高阅读分数的学生，还是想提升阅读教学水平的教师，抑或是整天与文字打交道的编辑、记者、写手、文艺青年，只要认真使用本书并勤加练习，一定会有意想不到的收获。",12,0,0,14,https://weread-1258476243.file.myqcloud.com/weread/cover/68/3300020568/s_3300020568.jpg
了解你的性格密码（套装共5册）,2020-03-01 00:00:00,个人成长-认知思维,本套装包括：《隐藏的人格》《性格的力量：哈佛、牛津大学双料心理学导师的性格优化指南！》《性格的重建：30天重塑自我，给人生一个重新出发的机会》《如何提升性格优势：9大维度解析性格的奥秘！》《大五人格心理学：心理学家公认的权威性格分析法》。,34,0,0,118,https://wfqqreader-1252317822.image.myqcloud.com/cover/31/30234031/s_30234031.jpg
思维模式决定成败：影响一生的20种思维,2012-09-01 00:00:00,个人成长-认知思维,本书将人类的思维模式分为两大类：有利于成功的思维模式和倾向于失败的思维模式，透过对“成功模式”和“失败模式”的系统性对比，论述了成功与失败的深层次原因，如同绿灯行（油门）、红灯停（刹车）的交通指令（操控系统），指导着我们启动“生产成功的流水线”以创造成功，提醒着我们关闭“生产失败的流水线”以规避失败。,4,794,0,1.99,https://wfqqreader-1252317822.image.myqcloud.com/cover/17/408017/s_408017.jpg
看到并看见：如何成为一个犀利的人,2017-10-01 00:00:00,个人成长-认知思维,"为什么你掌握的信息越多，反而越难看到事物本质？《看到并看见：如何成为一个犀利的人》一书通过对于洞见能力的阐述、提升方法和应用策略，帮助我们穿过纷繁与复杂的表象，看到事物的本质与趋势，做出精确与高效的判断，帮助读者撕开事物的伪装，在似是而非的选择题中发现正确的答案。
",14,662,0,11.99,https://wfqqreader-1252317822.image.myqcloud.com/cover/14/923014/s_923014.jpg
系统化思维：直击本质，洞察未来,2022-02-01 00:00:00,个人成长-认知思维,系统化思维是一种多维空间的思考方式，是从多角度追本溯源、寻求规律、探索更多可能的思考方式。通过系统化思维，我们可以洞察事物的本质，从而根治问题。本书主要介绍了系统化思维的认知与理解、系统化思维的方法与路径、系统化思维实现个人成长、系统化思维实现幸福人生、系统化思维应用场景等内容。本书从个人成长的角度出发，用通俗易懂的语言和被大部分人认知的理论和观点，解读系统化思维，旨在帮助个人建立系统化思维的思考模式。,7,0,0,41.4,https://weread-1258476243.file.myqcloud.com/weread/cover/10/3300017910/s_3300017910.jpg
气场魔鬼操纵术,2011-09-01 00:00:00,个人成长-认知思维,"    本书中的主人公毛豆会与你一起了解气场，修炼气场，掌握气场操纵术，一步步改变自己的生活、取得事业上的进步、拥有美满的爱情。
",4,0,0,3.99,https://wfqqreader-1252317822.image.myqcloud.com/cover/197/661197/s_661197.jpg
鬼谷子纵横智慧,2021-07-01 00:00:00,个人成长-认知思维,"一个人缺的永远不是钱，缺的是赚钱的智谋。一个人缺的永远不是团队，缺的是俘获追随者的能力。一个人缺的永远不是人们的爱戴和拥戴，缺的是领导统驭的智慧。被誉为智慧禁果的《鬼谷子》着重于辩证的实践方法，具有极完整的领导统御、策略学体系。
百家讲坛主讲人赵玉平、李晓，中国人民解放军国防大学教授戴旭，《鬼谷子的局》作者寒川子，修正药业集团董事长修涞贵 鼎力推荐。",12,0,0,43.8,https://weread-1258476243.file.myqcloud.com/weread/cover/85/3300018985/s_3300018985.jpg
如何提升专注力：手把手教你用7项改变打造10倍速效率人生,2021-06-01 00:00:00,个人成长-认知思维,专注力是你最宝贵的资源之一。它就像一个乘数因子，让时间的价值翻倍。全神贯注的一小时与心不在焉的一小时相比，前者的价值可能是后者的十倍。同时，专注力是一种可以培养的能力。在这本作品中，告诉读者如何从外因与内力2个维度打败分心：一方面如何排除网络年代的信息干扰、如何树立边界与友情回避无用社交，从而建立你的外部舒适区；另一方面如何进行注意力阶梯式训练、如何利用你的拖延症，从而探索你的内在原动力。,6,0,0,10.99,https://wfqqreader-1252317822.image.myqcloud.com/cover/765/39983765/s_39983765.jpg
别太有个性也别太没个性,2012-04-01 00:00:00,个人成长-认知思维,"    从校园进入社会，就需要转变思维，以“社会人”的标准要求自己，学会洞悉人情世故法则，通晓待人接物的技巧。别让自己满身棱角，也别让自己软弱可欺。个性有度，打磨好自己的个性，才能迅速融入社会。
",3,658,0,2,https://wfqqreader-1252317822.image.myqcloud.com/cover/489/696489/s_696489.jpg
为什么我总是无法说不,2020-09-01 00:00:00,个人成长-认知思维,为什么我们总是不敢拒绝，无法说“不”呢？我们害怕说“不”，一是怕伤害对方，二是怕拒绝别人之后不再受人欢迎。但究其本质，是我们没有为自己设定合理的界限。所谓界限，就是指心理边界，根据这个边界确定什么是我的，什么事是我应该负责任的，什么事是我可以拒绝的。没有人会因为我们的无条件服从，而选择更爱我们，更尊重我们；也没有人会因为我们的无条件妥协，而对我们刮目相看。要想获得成长，就要为自己树立界限，把自己的感受和需求放在重要的位置，这意味着我们开始懂得如何掌控自己的人生，明白了自我的发展才是与人和谐相处的根基。愿我们都能告别那个唯唯诺诺、不敢说“不”的自己，温和而坚定地表达自己真实的想法与感受，按照自己的意愿作选择，获得从容的、有界限的人生。,17,0,0,18,https://wfqqreader-1252317822.image.myqcloud.com/cover/33/38382033/s_38382033.jpg
高质量生活的好习惯,2007-08-01 00:00:00,个人成长-认知思维,《高质量生活的好习惯》从做人、做事、职场、生活、健康五个方面。列举了现代人在追求高质量生活的过程中，应该培养的好习惯和应该克服的坏习惯，结合丰富的事例与轻松的论述，让你在享受阅读的同时，获取战胜自己的力量！将优秀的行为固定成一种规律，这就是一种好习惯；将不良的行为渗透到细节中，这就是一种坏习惯。好习惯使人变得优秀，坏习惯使人变得平庸。,2,0,0,1.99,https://wfqqreader-1252317822.image.myqcloud.com/cover/966/316966/s_316966.jpg
魔幻记忆100%,2010-06-01 00:00:00,个人成长-认知思维,诺贝尔奖获得者都有着惊人的记忆力，这是他们成功的基石。一目十行，过目成诵，不是你所期望的吗？杰出诗人泰戈尔在幼年时记住了很多歌谣，4岁时便能读书，8岁时就能掌握4种语言；著名科学家卢瑟福，1岁半就能读书认字，5岁就能背出50多行的拉丁文诗歌；著名小说家罗曼·罗兰，对各式的花朵及食品，一嗅就能正确地分辨出它们的香味来。,5,640,0,1.99,https://wfqqreader-1252317822.image.myqcloud.com/cover/209/183209/s_183209.jpg
博弈论的智慧,2009-06-01 00:00:00,个人成长-认知思维,"    “博弈论”（Game Theory），亦称游戏论、运动论、竞赛论或对策论，原本是数学的一个分支，但由于它较好地解决了对竞争等问题的可操作性分析，从而发展成为经济学中的一个研究领域，并以其鲜明的特性改变了经济学的传统研究。至1928年，冯·诺伊曼系统证明了博弈论的基本原理，从而宣告了博弈论的正式诞生；1994年，纳什、海萨尼和泽尔腾三位经济学家曾因开创非合作博弈的均衡分析理论获得诺贝尔经济学奖；2005年，托马斯·谢林和罗伯特·奥曼获得诺贝尔经济学奖——这是博弈论学者再次夺得这一奖项。本书介绍了博弈论的基本原理，加你如何运用博弈论分析日常生活中的现象。
",33,550,0,6.99,https://wfqqreader-1252317822.image.myqcloud.com/cover/951/831951/s_831951.jpg
习惯陷阱：终身自我更新的15堂必修课,2020-11-01 00:00:00,个人成长-认知思维,比努力更重要的是正确的思维方式！清空错误观念，实现爆发式成长，为什么我们总是难以走出所谓的舒适区？为什么舒适区慢慢不再舒适，变成了习惯区？舒适区不可能永远舒适；而让我们感到痛苦的是，积习难改！在人生中的某些重要时刻，我们会碰到探索的天花板，感觉遇到了瓶颈，开始变得迷茫。这时，我们要如何自我更新，实现人生的跃迁呢？这种思维路径的转换，是否有章可循？答案是肯定的。《习惯陷阱 终身自我更新的15堂必修课》就是一本教你如何觉察并舍弃旧的惯性思维模式，真正实现思维转换的通关手册。只有不断更新自己的思维方式，我们才有从习以为常的表象中洞察本质、发现趋势的能力。《习惯陷阱 终身自我更新的15堂必修课》作者讲述的许多通过咨询改变人生的真实故事，帮助了无数陷入迷茫和困境的人，让他们恍然大悟：“这才是我想要的人生！”。,10,711,0,32.9,https://wfqqreader-1252317822.image.myqcloud.com/cover/634/34618634/s_34618634.jpg
简明逻辑学二十讲,2022-05-01 00:00:00,个人成长-认知思维,《简明逻辑学二十讲》是一本通俗易懂、引人入胜的智慧小书，是作者多年教学和研究的心血之作。作者采用了20堂公开课的形式，由浅入深、由易到难，通过的老师娓娓道来，用一个个轻松、幽默的小故事展现复杂的逻辑学。内容采用对话体，在老师与学生的交流、互动之中，辨析和掌握一个个逻辑学概念。本书是逻辑启蒙的经典读物。本书从情绪、专注、沟通、记忆、读写、习惯等多个维度讲述了日常生活中的思维误区，帮助读者建立起系统的思维逻辑。,3,0,0,18.9,https://weread-1258476243.file.myqcloud.com/weread/cover/5/3300016705/s_3300016705.jpg
终结拖延症：成为高效能的行动派,2019-10-01 00:00:00,个人成长-认知思维,这是一本帮助你战胜拖延、立刻着手行动的小书。作者除了挖掘拖延背后的真相，还分享了以下内容：想要成为高效能的行动派，先要立个不倒的flag，同时要摒弃完美主义观念，先把事情完成，再去要求完美；做事情不要蛮干，努力也要讲究方法，至少要事前思考，分清轻重缓急，化繁为简；虽然我们改变不了时间，但可以科学安排时间，充分利用空闲时间，把时间和精力用在最重要的事情上；拖延是持久战，正面情绪的力量不可忽视，及时褒奖自己，通过设置合理期望值减少负面体验都能有效唤醒积极高效的自己。即使你是重度拖延症，本书也能帮助你先从小的事情着手行动起来。这是一本帮助你战胜拖延、立刻着手行动的小书。作者除了挖掘拖延背后的真相，还分享了以下内容：想要成为高效能的行动派，先要立个不倒的flag，同时要摒弃完美主义观念，先把事情完成，再去要求完美；做事情不要蛮干，努力也要讲究方法，至少要事前思考，分清轻重缓急，化繁为简；虽然我们改变不了时间，但可以科学安排时间，充分利用空闲时间，把时间和精力用在最重要的事情上；拖延是持久战，正面情绪的力量不可忽视，及时褒奖自己，通过设置合理期望值减少负面体验都能有效唤醒积极高效的自己。即使你是重度拖延症，本书也能帮助你先从小的事情着手行动起来。舒湄国家二级心理咨询师，企业培训师，帮助在华外企和国际化的本土企业员工进行跨文化培训，客户包括阿里巴巴、华为等。,16,0,0,17.12,https://wfqqreader-1252317822.image.myqcloud.com/cover/692/32012692/s_32012692.jpg
聪明人都在用的时间管理法,2020-02-01 00:00:00,个人成长-认知思维,如果你以为巴菲特才需要管理时间，普通人用不上；时间管理就是做清单和列表；盲目模仿他人的时间管理习惯就够了，都是大错特错的！本书提供专注精简效能优先的时间管理法，一定能让你透过时间管理，让生命告别混沌和迷茫，处于自知的状态，能够认知自我，了解自我，明确目标，知道生命中什么东西是最重要的，并把精力和心智专注在最有价值的事情上。时间最无私公平，无论一个人贫穷还是富有，所拥有的时间永远都是一天24小时。然而，每个人真正感受到的，并不都是一天24小时，只有体现了价值的时间才是我们真正获得的，而那些随意浪费和挥霍的，就如飘过无痕的云烟。一天两天没什么差别，可五年十年下来，却会演绎出不同的人生。如何才能不虚度有限的时间？如何才能让时间真正体现出价值？如何才能让人生在时间的积累中变得厚重和精彩呢？本书要告诉你，一个人对待时间的态度，决定着人生的高度；它也会告诉你，做事只讲努力不讲方法，只讲战术不讲战略只会事倍功半；它还告诉你，什么是优先矩阵与精简思维；更能帮你战胜拖延，成为专注高手，以充沛的精力应对工作的挑战，享受惬意的生活。米苏心灵疗愈系畅销书作家长期致力于自我提升、心灵成长方面的研究“透过时间管理，我们要让生命告别混沌和迷茫，处于自知的状态，能够认知自我，了解自我，明确目标，知道生命中什么东西是最重要的，并把精力和心智专注在最有价值的事情上。透过时间管理，我们要找寻身心的平衡，从无效的忙碌和奔波中抽离，成为专注而高效的人，从而有精力和体力去享受更好的生活。”,19,0,0,17.12,https://wfqqreader-1252317822.image.myqcloud.com/cover/686/32012686/s_32012686.jpg
生产力规划,2020-06-01 00:00:00,个人成长-认知思维,美国著名时间效率管理专家达蒙·扎哈里亚德斯以30天为一个周期，指出了30个影响时间管理，降低工作效率的不良习惯，对这些习惯进行深入的分析的与解读，并为读者提供了近300种改变这种坏习惯的科学而实用的方法。比如给任务、项目和人际关系排个轻重缓急，如何快速做决定等。无论你是生意人，项目经理、自由职业者还是大学生都能从中获益，帮助你合理掌控时间，建立高效的生活方式，进一步提高生产力与工作效率，促成健康、高效的好习惯，战胜自我批判，重获自信。,9,0,0,9.99,https://wfqqreader-1252317822.image.myqcloud.com/cover/424/33586424/s_33586424.jpg
