title,publishTime,category,intro,maxFreeChapter,newRating,free,price,cover
人性的弱点,2014-09-01 00:00:00,个人成长-认知思维,本书作为一本实用的人际关系著作，从人性本质的角度，挖掘出潜藏在人们体内的弱点，使人们能够充分认识自己，并不断改造自己，从而能有所长进，直至取得最后的成功。在过去的77年里，戴尔·卡耐基的忠告带领着上千万名读者攀登上成功的阶梯，无论在事业方面还是个人生活上，他的箴言不断被一代代人实践与验证。在出版史上，本书创造了全世界图书销售空前的记录。在经济萧条时期之后，本书满足了普遍存在的人性的需要，触动了读者的神经，在当今社会依然有其特有的借鉴价值。,19,853,0,9.99,https://wfqqreader-1252317822.image.myqcloud.com/cover/205/522205/s_522205.jpg
高效能人士的七个习惯（30周年纪念版）（全新增订版）,2020-05-01 00:00:00,个人成长-认知思维,这是全新增订版。新增《纽约时报》畅销书作家肖恩·柯维对七个习惯学习、实践以及理解的全新观点，并作了内容修订。美团“四大名著”之一，吉姆·柯林斯作序推荐。这是一本能改变亿万人命运的奇书，影响力仅次于《圣经》。畅销30多年，销量超过4000万册。18位中国企业家和全球64位政企界人士重读本书再次真诚推荐。被誉为中国商界经典、著名的培训教材，世界500强企业装备培训课程。柯维“七个习惯”思想为我们揭示了一套让企业和个人永远立于不败之地的致胜法则，给中国快速成长的企业和领导者带来了新的启发和人生新感悟。全新升级的【PEQ效能测试2.0】为你全面评估效能现状，并提供行之有效的行动方案。,7,866,0,55.49,https://wfqqreader-1252317822.image.myqcloud.com/cover/600/33810600/s_33810600.jpg
刻意练习：如何从新手到大师,2016-11-01 00:00:00,个人成长-认知思维,本书是两位作者合作撰写的，一位是心理学家，另一位是科学作家。10多年前，我们开始经常探讨杰出人物和“刻意练习”这个主题，并在5年前开始认真地围绕这个主题写书。在那段时间，本书在我们两人的思想碰撞中慢慢成形，以至于我们现在都难以分辨，书中的哪一部分观点由谁提出。我们只知道，本书由我们两人合写，比由我们单独去写要好得多，也完全不同。,26,719,0,18,https://wfqqreader-1252317822.image.myqcloud.com/cover/464/843464/s_843464.jpg
底层逻辑：看清这个世界的底牌,2021-10-01 00:00:00,个人成长-认知思维,如果只教给你各行各业的“干货”（方法论），那只是“授人以鱼”，一旦环境出现任何变化，“干货”就不再适用。但如果教给你的是底层逻辑，那就是“授人以渔”，你可以通过不变的底层逻辑，推演出顺应时势的方法论。所以，只有掌握了底层逻辑，只有探寻到万变中的不变，才能动态地、持续地看清事物的本质。在这本书中，我把在《5分钟商学院》中讲述的底层逻辑的内容进行了总结，与你分享是非对错、思考问题、个体进化、理解他人、社会协作五个方面的底层逻辑，带你看清世界的底牌。,11,677,0,40,https://weread-1258476243.file.myqcloud.com/weread/cover/22/3300011622/s_3300011622.jpg
思考，快与慢,2012-07-01 00:00:00,个人成长-认知思维,诺贝尔经济学奖得主丹尼尔·卡尼曼经典之作，彻底颠覆你对思考的看法！横扫全球各大畅销书排行榜，《经济学人》年度十佳图书，巴曙松、何帆、王福重等知名经济学家高度评价。卡尼曼认为，我们的大脑有快与慢两种作决定的方式，常用的无意识的“系统1”和有意识的“系统2”。他还介绍了很多经典有趣的行为实验，指出我们在什么情况下可以相信自己的直觉，什么时候不能相信；指导我们如何在商场、职场和个人生活中作出更好的选择，以及如何运用不同技巧来避免那些常使我们陷入麻烦的思维失误。,10,774,0,18,https://wfqqreader-1252317822.image.myqcloud.com/cover/975/573975/s_573975.jpg
终身成长（全新修订版）,2017-11-01 00:00:00,个人成长-认知思维,在对成功的数十年研究后，斯坦福大学心理学家卡罗尔·德韦克发现了思维模式的力量。她在《终身成长》中表明，我们获得的成功并不是能力和天赋决定的，更受到我们在追求目标的过程中展现的思维模式的影响。她介绍了两种思维模式：固定型与成长型，它们体现了应对成功与失败、成绩与挑战时的两种基本心态。你认为才智和努力哪个重要，能力能否通过努力改变，决定了你是会满足于既有成果还是会积极探索新知。只有用正确的思维模式看待问题，才能更好地达成人生和职业目标。德韦克揭示的成功法则已被很多具有发展眼光的父母、老师、运动员和管理者应用，并在实践中得到了验证。通过了解自己的思维模式并做出改变，人们能以最简单的方式培养对学习的热情，和在任何领域内取得成功都需要的抗压力。,18,785,0,24.99,https://wfqqreader-1252317822.image.myqcloud.com/cover/642/915642/s_915642.jpg
直击本质：洞察事物底层逻辑的思考方法,2020-01-01 00:00:00,个人成长-认知思维,这是一本专注于“思考的方法”的书。随书附赠独创开放式思维导图。上半部分聚焦于本质思考，这种思考方法能够帮你看透问题本质，并高效地解决复杂问题，让你成为只需半秒就看透事物本质的人，而不是一辈子也看不清事物本质的人。下半部分则跳脱出思维的框架，站在更高、更广的层面去思考，运用迁移思考、升维思考以及逆向思考的方法，让很多看似无解的人生难题得到了解答。,11,820,0,30.99,https://wfqqreader-1252317822.image.myqcloud.com/cover/575/30914575/s_30914575.jpg
认知天性：让学习轻而易举的心理学规律,2018-09-01 00:00:00,个人成长-认知思维,不管是朋友圈里年入百万的斜杠青年，还是、喜马拉雅上的大师专家，无一不在刺激着在积极上进的年轻灵魂。有没有一种科学的，符合每个人思维规律的学习方法，可以让自己瞬间提升职场竞争力和商业生存力，以此走上财务自由、精神独立的人生。在《认知天性：让学习轻而易举的心理学规律》这本书中，你将掌握学习领域的规律：为什么说天性懒惰孕育了认知规律和心智模型/只需1次自测，一周后回忆率从28跃迁为39/知识是平面的，复合型知识是立体的/哪些“良性干扰”能提习效果/别在无法克服的学习困难上浪费时间/如何打造适合自己的心智模型/掌握几个适合自己的记忆技巧事半功倍……本书案例丰富，论点，是一本不容错过的认知科普读物。总的来说，《认知天性》这本书，可以看作是认知科学目前在“如何更地学习”这个课题上取得的所有成果总结。读者能从中获取的，不仅是切实的学习方法，而且会对人脑的工作机制有更深的了解。,11,762,0,34.8,https://wfqqreader-1252317822.image.myqcloud.com/cover/547/23665547/s_23665547.jpg
深度思维：透过复杂直抵本质的跨越式成长方法论,2018-09-01 00:00:00,个人成长-认知思维,精英的最大共通点，并非优异的才能，而是深刻的底层思维。在人类的发展史上，决定个体强大的关键因素在不断变化，原始时代是体力，后来是知识，现在则逐渐转化为思维能力。思维不是天生的，而是通过学习和训练可以掌握的思维工具。所掌握思维工具的数量多少、层次高低以及效用如何，决定了你是否能成为人生赢家。在复杂的世界里，我们该如何运筹帷幄？我们是否具备精细的思维技术，以解决日常生活、工作中的问题？我们是否拥有宏大的思维格局，以在关键时刻做出精妙的战略选择？归根到底，我们的大脑有足够的武器来应对复杂的世界吗？大脑最好的武器，莫过于深度思维方法。普通的浅度思维逻辑链条短，分析视角局限，处理复杂信息效率低下，并且无法在宏观战略层面上认知事物。而深度思维则是一套完善的体系，可以从根本上解决问题，让你：快速切换思考问题的视角；探索问题的根本原因及长远发展；有效应对信息流繁杂、事务琐碎的挑战；站在更高层面，以系统、宏观的视角认知和解决问题。深度思维的方法，既来源于多学科的思想精华，也经过了大量的商业、职场实践，被证实是解决问题、提升格局的利器。对普通人而言，无论是对领导布置的项目进行深度逻辑分析，对用户的需求痛点进行多角度换位思考，还是在职业发展规划或进行投资决策时做出巧妙的战略选择，深度思维方法都能使你有所裨益。,5,802,0,26.99,https://wfqqreader-1252317822.image.myqcloud.com/cover/116/23549116/s_23549116.jpg
学会提问（原书第11版）,2019-01-01 00:00:00,个人成长-认知思维,很多人不知道怎样切实有效地提出一些判断性问题，希望我们能提供较为详尽的指导，鉴于此，我们专门撰写了这本书，以满足大家的需求。本书最新版依然致力于培养学生一整套提问的技能，并且可以广泛应用于各个领域。这些技能的训练都是在轻松自然的讨论中展开的。本书特别适合在以下几个领域中应用。普通教育学课程、语言类课程的说明文写作，以及专门用来培养学生的评判性阅读和思考的技能的课程。另外，它还是提高沟通效率，实现关键沟通的一本难得的精品之作。,37,767,0,25,https://wfqqreader-1252317822.image.myqcloud.com/cover/397/25614397/s_25614397.jpg
结构化思维,2019-12-01 00:00:00,个人成长-认知思维,学会结构化思维，让人生从此提效。《结构化思维》可以帮助我们在陈述问题、表达核心观点的时候，能少说废话，将复杂问题简单化，清晰准确地表达观点，建构条理清晰的思考模式。学会有结构、有规律地整理复杂信息，让人生从此提效。拯救无效努力，成为你想成为的自己。有些人看起来很努力，但是却不出成果。高效的思考力并非天生，而是长期自我训练的结果。系统化的思维方式，让深陷思维泥沼的人走出思维误区，达到事半功倍的效果。全书干货满满，是一本比较实用的思维进阶实修课。万事万物，皆有结构，皆成框架，皆成系统。本书在搭建结构化思维关键方法的基础上，介绍了八种升级版的思维结构，具体方法配合落地训练，每个人都能从中找到适合自己的思维模式。,12,737,0,19.92,https://wfqqreader-1252317822.image.myqcloud.com/cover/26/27329026/s_27329026.jpg
谁动了我的奶酪,2014-05-01 00:00:00,个人成长-认知思维,人生犹如“迷宫”，每个人都在其中寻找各自的“奶酪”——稳定的工作、身心的健康、和谐的人际关系、甜蜜美满的爱情，或是令人充满想象的财富……那么，你是否正在享受你的奶酪呢?如果是的，恭喜你，你只需要阅读一下书中的小故事即可，因为它会时刻提醒你，你的奶酪是否已经变质；如果不是，欢迎你，请你把这本书从头到尾阅读一下，希望你能够从中受到启发，尽快享受你的奶酪。自《谁动了我的奶酪?(纪念版)》出版以来，已经有众多读者从奶酪的故事中得到启发，从而改善了自己的事业、婚姻和生活，同时也引起了广泛的讨论。变化总在时时发生，我们每个人都要认真思考，究竟是谁动了我的“奶酪”，我们又该如何发现新的“奶酪”?,9,824,0,15,https://wfqqreader-1252317822.image.myqcloud.com/cover/948/635948/s_635948.jpg
成为可怕的自律人,2021-11-09 00:00:00,个人成长-认知思维,为什么每次计划要去学习都忍不住玩手机？为什么每次减肥都忍不住要吃零食？为什么每次说早睡都非要熬到半夜？为什么我们给自己制订了计划，却总完不成？拖延、焦虑、悔恨！为什么我们的行为和理想总是背道而驰？怎样才能成为理想中的自己？马歇尔·古德史密斯博士发现，是环境让我们做出本不想做的行为，失败的不是你，而是方法。只要向自己提出积极的问题，就能让拖延症瞬间变得超级自律！它能帮助你在想改变自己的时候，就能轻松地改变；想减肥的时候，就能立马瘦下去；想学习外语的时候，就能立马掌握；想早睡的时候，就能立马放下手机去睡觉。换句话说，这本书能帮助你掌控自己的人生。快翻开本书，瞬间成为可怕的自律人！,8,755,0,45.99,https://wfqqreader-1252317822.image.myqcloud.com/cover/688/41414688/s_41414688.jpg
好好思考,2019-10-01 00:00:00,个人成长-认知思维,全面解析查理·芒格思维模型，打破学科思考界限，拓展思维模式的格局和边界，写给终身学习自我超越的你。本书试图回答这样一个问题：如果说太阳底下没有新鲜事，那么最高效的学习方法是什么？与人们通常认为的学习的关键是努力掌握更多的知识不同，作者认为如果我们能够看到事物之间的相似性，那么我们只需要学习各学科最杰出的思想，去抓最关键的要害，就可以解决绝大多数的问题。因此，作者把学习知识的基本单位定义为“思维模型”。思维模型有四个层次：经验技巧型、方法流程型、学科原理型、哲学视角型。查理·芒格所说的掌握“重要学科的重要原理”，即为本书中定义的“学科原理型”思维模型。那我们如何从思维模型入手，构建一个全新的学习思考体系，进而练就超强学习力？作者将结合自己10多年的研究经验，从基本原理、搭建知识体系、演示实战方法等多个角度系统讲解论述。思考让我们看见不同。,11,806,0,28,https://wfqqreader-1252317822.image.myqcloud.com/cover/431/26640431/s_26640431.jpg
超级记忆力训练法（畅销升级版）,2017-09-01 00:00:00,个人成长-认知思维,《超级记忆力训练法》作者刘志华老师是大脑潜能思维开发培训专家，多年来一直致力于提升记忆力和思维能力的培训与研究。在本书中，他向读者分享了快速提升记忆力的方法。全书一共9章，第1章主要是了解我们的大脑，找出记忆力不好的原因；第2章讲述开启记忆之门必须掌握的诀窍；第3章主要是提升训练思维能力，打破固有的思维定式；第4~8章分别介绍了链式记忆法、数字记忆法、信箱记忆法、缩编记忆法和英语单词记忆的方法和诀窍；第9章主要是成果检测。按照本书中的方法，练习21天后，每个人都能提升记忆力和思维能力5~20倍。,17,735,0,13.99,https://wfqqreader-1252317822.image.myqcloud.com/cover/994/22673994/s_22673994.jpg
专注力：心流的惊人力量,2020-01-01 00:00:00,个人成长-认知思维,本书是“高效率研究”领域的全新之作。作者从心理学、行为学、脑科学等方面出发，提出了“高度专注模式”（心流模式），并给读者提供了大量可运用的方法，利用书中的方法，可以帮你摆脱分心，帮你赶走疲惫，在短时间内激发高效率。为什么我们要创造心流模式（高度专注模式）？因为一旦进入心流模式，就可以激活你的大脑潜能，帮助你创造体验！普通模式工作1小时，不如心流状态下工作15分钟；并且在心流状态下模式下，你永远都不会感到疲惫。进入心流状态后，你的大脑潜能会立刻被激活。你会发现， 一个小时飞逝而过，却感觉只过了15分钟；更加神奇的是，每个小时你竟然可以完成相当于几个小时的任务。李开复诚意推荐！“克里斯·贝利的这部著作，是注意力管理的不错指南。他描述的这些方法，将帮助我们更有效地专注于目标、提升创造力。他的著作不只是阐述理论，还是一个装满详细而实用的操作方法的神奇工具箱。我迫不及待地要试试这些方法。”——李开复，“谷歌中国”创始人、“创新工场”CEO,21,730,0,19.92,https://wfqqreader-1252317822.image.myqcloud.com/cover/794/27371794/s_27371794.jpg
快速阅读,2015-07-01 00:00:00,个人成长-认知思维,《快速阅读》作者格吕宁认为，阅读能力低是导致这些问题出现的根本原因。真正的阅读高手，可以在“一目十行”的同时，深刻理解和记忆书中的知识点，并将其运用到日常生活、学习和工作中。成功要从掌握学习技巧开始，眼球运动是阅读的关键。《快速阅读》一书中提出了“快速阅读进阶法”，用实用练习、趣味测试、知识普及和“视觉卡片”等阅读辅助工具，帮助我们从分行阅读到逐段阅读，再到整篇文章阅读以及整本书阅读，逐步学会调动五种感官、集中注意力、培养理解力、增强记忆力、提高阅读速度，轻轻松松成为阅读高手。不再为准备考试而发愁，不再为没时间读书而烦恼，即使是资质普通的读者，只要方法正确，就能让自己的阅读速度提高3倍。,5,746,0,23.4,https://wfqqreader-1252317822.image.myqcloud.com/cover/72/921072/s_921072.jpg
如何度过一天的24小时,2015-12-01 00:00:00,个人成长-认知思维,时间都去哪儿了？如果你也有类似的焦虑，那就看看这本书吧！随着工业革命的发展，每周工作五天，每天工作八小时成了生活常态。本书的作者阿诺德·贝内特为朝九晚五的“生存者”提供了一些时间管理的实用建议，把每天的24小时变为一种“生活”的奇迹。此书并非老生常谈的说教，而是以简明幽默的风格助你珍惜时间、提升生活质量。,6,506,0,3,https://wfqqreader-1252317822.image.myqcloud.com/cover/850/34153850/s_34153850.jpg
65种微习惯：轻松掌控你的行为、思维和情绪,2022-01-01 00:00:00,个人成长-认知思维,一个人有什么样的习惯，会有什么样的人生。养成好习惯需要进行持久的积极性改变。在这一过程中，你要依靠的不是意志力和自控力，而是不用思考直接去做的下意识行为。《65种微习惯：轻松掌控你的行为、思维和情绪》提出了“习惯冰山模型”理论，认为在看得见的行为习惯下面还潜藏着思维习惯和情绪习惯，只有改变了“海面”下的隐性习惯才能改变行为习惯，进而改变我们的人生。作者总结了其多年来进行习惯塑造指导的实践经验，归纳了轻松调整习惯的65种方法，通过鲜活的案例阐明了如何解决生活中的“坚持不下去”“不能付诸行动”“戒不掉”“改不了”等习惯难题。优秀不是行为，而是一种习惯。《65种微习惯：轻松掌控你的行为、思维和情绪》适合想养成好习惯却始终找不到科学方法的人，教会他们用习惯重塑自我。,17,724,0,32.9,https://wfqqreader-1252317822.image.myqcloud.com/cover/95/43348095/s_43348095.jpg
哈佛女孩气质课,2017-11-01 00:00:00,个人成长-认知思维,"    本书运用哈佛的理念，从内涵、才情、品位、智慧、仪容、气韵、心态、自信、性格等方面，多方面多角度指导女孩由内而外提升自己的气质，以真实生动的案例帮助女孩认识自我、完善人格、提升魅力，掌握诸多打造气质的方法，以睿智风趣的笔触，教会女孩如何打造优雅之美、气韵之美、成熟之美、情调之美。本书的观点和思想是深刻的，同时也是实用的，每个女孩都能在本书中找到切实可行的人生指导和精神启迪，精心雕琢内在与外表，修炼足以倾倒众生的气质，自在从容地释放属于自己的独特风采，具有一定的出版价值。
",12,776,0,7.99,https://wfqqreader-1252317822.image.myqcloud.com/cover/178/26188178/s_26188178.jpg
世界顶级思维,2017-02-01 00:00:00,个人成长-认知思维,《世界顶级思维》遴选了世界上最有价值的近100个思维定律、效应和法则，划分为素养、目标、计划、统御、沟通、选拔、协调、参谋、决策、信息、创新、竞争、财富等18个大类别，结合中外经典案例，详尽解析和探讨了每一种思维定律、效应和法则和内涵及其应用之道，让你一书在手，通览世界顶级思维的精义和奥妙，掌握开启人类思维大门的钥匙，控寻世界思维殿堂中的无穷宝藏。,20,712,0,6.99,https://wfqqreader-1252317822.image.myqcloud.com/cover/755/849755/s_849755.jpg
如何学习,2017-07-01 00:00:00,个人成长-认知思维,学习时是固定一处好还是变换环境好？是需要安静还是可以放点音乐？如果考试近在眼前，怎么安排复习方案最有效？适时休息才是获得灵感的诀窍？睡眠怎么助力学习？……揭秘大脑学习原理，探寻记忆存储真相，10种颠覆常识的学习方法，让你在同样的时间，学得更快，记得更牢！给你一套很爽的高效学习法，不论你是需要记住化学公式、决心学一门外语，还是要为下一场考试备战，亦或是掌握一门乐器甚至练好投篮技术，也不论你是十几岁的学生还是早已身陷职场，这本书都能让你如获至宝，成就你的终身学习力。成绩最好的不是最用功的学生，而是最会学的学生，比起“刻意练习”，更重要的是“科学练习”。清华大学副校长诚意推荐阅读，众多专家学者、知识管理达人、学习社群联袂推荐。,8,727,0,9.99,https://wfqqreader-1252317822.image.myqcloud.com/cover/291/23691291/s_23691291.jpg
超级快速阅读,2015-08-01 00:00:00,个人成长-认知思维,《超级快速阅读》是《快速阅读》作者克里斯蒂安·格吕宁的成名之作。他在临近大学毕业时准备德国司法考试期间，因为不能像其他同学一样有充足的时间复习备考，便在参考众多学习方法类书籍的基础上独辟蹊径，创造出一套风靡全球的阅读方法。在书中，这套方法具体表现为“学习流程的四个阶段”：拓宽视野，快速阅读；快速阅读进阶训练；五感并用，超级记忆；《超级快速阅读》告诉我们，只要确定好目标，制订高效的学习和工作计划，掌握科学的读书法、记忆法、笔记法、复习法和时间管理法，学习、考试、阅读、工作、生活都将有条不紊，自然远离压力和焦虑。,6,739,0,23.4,https://wfqqreader-1252317822.image.myqcloud.com/cover/890/920890/s_920890.jpg
人性的弱点全集（经典珍藏版）,2011-09-01 00:00:00,个人成长-认知思维,本书是成功学家卡耐基的思想精华，他以对人性的深刻洞见，利用大量普通人不断努力取得成功的故事，激励人们取得辉煌的成功。,38,865,0,4.99,https://wfqqreader-1252317822.image.myqcloud.com/cover/667/842667/s_842667.jpg
起床后的黄金1小时,2021-01-01 00:00:00,个人成长-认知思维,坚持早起26年、风靡日本的“早起计划”发起人池田千惠，倾囊相授自己的1小时习惯改造法。不仅讲述了如何早起——早起的心理准备、早起的4 个步骤、5 个早起小技巧；还以图文并茂的形式，分步骤指导你如何养成习惯，提升工作效率——制订计划、确定优先顺序、切割工作内容、细化工作、付诸行动，从而让你扫除精进路上的障碍，有效增加可支配时间，增强行动力，改变人生！本书还针对不同人生阶段——工作上升期、结婚生子、副业和自由职业，制订不同的工作计划，明确对自己来说重要的事是什么，从而朝着理想努力践行。,11,309,0,28,https://wfqqreader-1252317822.image.myqcloud.com/cover/771/36721771/s_36721771.jpg
