title,publishTime,category,intro,maxFreeChapter,newRating,free,price,cover
你的时间80%都用错了,2016-01-01 00:00:00,个人成长-认知思维,这是一本非常全面的关于时间管理的书，教会读者一套完整的使用时间的方法。让读者在短时间内领悟人生与时间的关系，并学会正确支配自己的时间，在同样的时间里取得更多的效果。作者从事时间和精力管理多年，总结了一套完整的方法，共分为五个核心技术——计划为先、做好分配、保持自律、克服拖延和化零为整，这五个核心技术能够确保你的时间用在正确的地方，让你成为世界上效能最高但却始终能保持工作与生活平衡的人。,34,621,0,12.45,https://wfqqreader-1252317822.image.myqcloud.com/cover/220/855220/s_855220.jpg
思维力：思路决定出路，观念决定行动,2013-11-01 00:00:00,个人成长-认知思维,"    本书从思维、定位、心态、规划、职业、人际、财富、创新等方面，为广大读者搭建了一个解放观念、引爆思维的交流平台，提供一些实用而富有创意的忠告和建议，帮助读者拓宽眼界，开阔思维，突破思维定式，提高处理、解决问题的能力，把握机遇，能为人之不能为，敢为人之不敢为，从而开启成功之门。
",19,742,0,7.99,https://wfqqreader-1252317822.image.myqcloud.com/cover/569/925569/s_925569.jpg
如何成为一个会读书的人,2022-06-01 00:00:00,个人成长-认知思维,"阅读，大致可以分为两种。一种是想要理解作者的想法，从第一页的第一行到最后一页的最后一行，一字不落地直线式阅读。而另一种是为了自己而阅读，想从书中找出对自己的人生和日常生活有用的东西，哪怕只有一篇文章或一段文字有帮助，就算完成了阅读。
这本书提倡的正是第二种阅读方法。不需要全部阅读，不需要给自己太大的压力，只要找到有用的内容，哪怕只有一行也可以。斜读也好，跳读也好，或者找关键词阅读也好，都是可以的。每天哪怕只花三分钟去阅读也可以。你可以反复地多读几遍，多重复几遍。只要是能获得对自己有帮助的知识，就说明你的阅读是值得的。
当然，本书也给了一些高效阅读的方法，比如用手指做辅助的阅读法、关键词阅读法、正负阅读法、提问式阅读法等，帮助读者更快更好地阅读一本书。",5,500,0,35.99,https://weread-1258476243.file.myqcloud.com/weread/cover/23/3300017523/s_3300017523.jpg
成功人士的七个习惯,2011-05-01 00:00:00,个人成长-认知思维,"这是一本走向成功的最佳读本。习惯对我们的生活有绝大的影响，因为它是一贯的。在不知不觉中，经年累月影响着我们的品德，暴露出我们的本性，左右着我们的成败。在现代社会，要想做一名成功人士，创造卓越的成就，就必须从培养良好的个人习惯入手。本书阐释了成功人士的七个习惯，相信这七个习惯对一个有志于成功的人一定有很大的帮助，它将会使你从小事做起，从最基本处做起，最终业有所成。
",2,738,0,1.49,https://wfqqreader-1252317822.image.myqcloud.com/cover/520/810520/s_810520.jpg
哈佛大学推荐的20个快乐习惯,2016-07-01 00:00:00,个人成长-认知思维,美国心理学之父、曾任教于哈佛大学的心理学家威廉?詹姆斯曾说过一句流传甚广的话：“播下一个行动，收获一种习惯；播下一种习惯，收获一种性格；播下一种性格，收获一种命运！”可见，好习惯是多么重要，它不但能决定我们的性格，甚到能改变我们的命运。快乐是每个人一生追求的目标，人活着就应该快快乐乐，而快乐的生活源于快乐的习惯。本书向读者详细介绍了哈佛大学推荐的20个快乐习惯，文字通俗易懂，语言清新流畅，观点新颖独到，案例生动有趣，是一本能够有效帮助读者培养快乐习惯的读本。《哈佛大学推荐的20个快乐习惯》适合所有期待养成快乐习惯的读者阅读。,11,682,0,15.6,https://wfqqreader-1252317822.image.myqcloud.com/cover/30/22691030/s_22691030.jpg
低智商社会,2010-04-19 00:00:00,个人成长-认知思维,时代的发展似乎并没有相应提高人们的智商，反而使得人们的智商在逐渐衰退，你看：时下的年轻人只关心自己半径三米以内的事情；虽然人们在网上跟人无话不谈，但在现实生活中，却不懂与人面对面敞开心扉；没有成功的追求、学习能力低下但丝毫不以为然；看到电视中的广告就会马上冲动购买；总有毫不脸红的读错字的官员出现；遇到困难，懒于思考就立即放弃；人云亦云，做什么事总愿意随大流……在更加发达的今天。为什么还会产生这种集体智商衰退的现象？人类真的是一代不如一代？,6,551,0,7.99,https://wfqqreader-1252317822.image.myqcloud.com/cover/695/621695/s_621695.jpg
不被洗脑的100个思维习惯,2022-03-01 00:00:00,个人成长-认知思维,热搜、热评10万+、直播、短视频、大数据…… 信息爆炸时代，是谁在左右我们的最终选择？面对外界繁杂信息的干扰，普通人可能会照单全收，而聪明人选择先思考再下结论。日本教育专家斋藤孝，将40年经验总结为100个批判型思维习惯，从整理信息、高效沟通、深度阅读潜能激发等方面，告诉我们如何运用正 确的思维方式解决工作和生活中遇到的问题；如何让头脑时刻保持清醒、独立思考，在关键时刻做出正确的决策。,5,483,0,37.99,https://weread-1258476243.file.myqcloud.com/weread/cover/85/3300012585/s_3300012585.jpg
右脑训练图典,2013-03-01 00:00:00,个人成长-认知思维,右脑是一个人的“创意恼”，像一位万能的博士，善于找出解决问题的办法，许多高级思维的功能取决于右脑。本书主要以图画的形式来对孩子的右脑进行科学系统的训练，主要包括对孩子进行心像训练、视觉记忆、瞬间记忆、空间想象、情景想象的训练。全书介绍了28大训练方法，提供了二百多幅高清训练图片，图文并茂，方法与理念融合一体，是一本名副其实的训练图典。,9,712,0,11.4,https://wfqqreader-1252317822.image.myqcloud.com/cover/390/929390/s_929390.jpg
自律：创建高品质人生的操作系统,2020-05-05 00:00:00,个人成长-认知思维,本书详细地介绍了养成自律的方法，包括认真执行健身计划、尝试间歇性禁食以及强化自我认知等，这些方法都具有很强的规律性和可操作性，可以帮助你有效地养成好的人生习惯，从而培养可持久的自律。如果你在前进的道路上遇到了难以克服的困难，并且觉得缺乏继续走下去的勇气和毅力，那这本书对你来说真的刚刚好，犹如一盏明灯。,4,604,0,23.95,https://wfqqreader-1252317822.image.myqcloud.com/cover/854/33091854/s_33091854.jpg
目标法则：大师的积极思维课,2022-01-01 00:00:00,个人成长-认知思维,本书扎根于拿破仑·希尔的原理、术语和概念，重点阐释拿破仑·希尔成功学的核心理念——目标法则，并结合作者所亲历数十个鲜活案例加以解读，从而更好地帮助读者理解、掌握拿破仑·希尔的哲学精华。本书帮助读者认识到首要目标的重要性，内容包括：如何确定你真正想要的是什么，目标是否足够好，如何打磨你的目标，如何智慧坚持，如果目标落空应该怎么办。本书特别强调希尔的理念中与21世纪读者关联更强的那些部分，比如说失败后的重振，或是在必要时修改首要目标。每一章都包含了一个以上模块化的“行动步骤”——一些锻炼你的精神或情绪肌肉的额外练习，让你更全面地应用作者探索的那些理念。如果你无法全然领悟目标法则这个理念，希尔的其他课程（或任何其他相似的动机学课程）可能都不会太管用。拥有一个绝对首要目标会对你大有裨益，无论是在赚钱，或是用艺术表达自我，或是在你的领域成为一名领导者。通往伟大的大门仅向某一类人打开，这类人拥有一个特别的、包罗一切的焦点——那就是绝对首要目标。让我们一起找寻你的目标吧。,17,577,0,41.3,https://wfqqreader-1252317822.image.myqcloud.com/cover/282/41868282/s_41868282.jpg
焦虑型人格自救手册,2019-07-01 00:00:00,个人成长-认知思维,在这本书中，安娜以患者和治疗师的双重身份，记录了自己十几年间应对焦虑情绪的经验和体会。从识别焦虑的症状，到应对失眠或社交焦虑，安娜都一步一步地提供了切实和直接的指导，给出了多种处理方案，帮助焦虑型读者逐渐克服焦虑，建立自信。每一章的最后，临床心理学家瑞塔•纽厄尔博士也为读者提供了易于操作、切实可行的专家指导，帮助大家正确看待焦虑，找回从容的生活。,27,648,0,28.99,https://wfqqreader-1252317822.image.myqcloud.com/cover/130/26473130/s_26473130.jpg
读懂中国经济：格局、周期与趋势,2022-01-01 00:00:00,个人成长-认知思维,近年来，中国经济正发生着显著而深刻的变化，中国经济发展已经站在了一个新的历史方位上。系统全面地解读中国经济，有助于我们更好地理解、认识并展望中国经济的“过去”“现在”以及“未来”。 本书共分为三个部分： 第一篇从经济格局角度，通过对主要经济指标的解读，系统性地认识中国经济的基本面以及国民经济循环的基本状况，总结新冠肺炎疫情前后中国经济的突出变化和主要特征。 第二篇从经济周期角度，基于常见的经济周期类型，介绍中国经济周期性波动的表现、成因以及影响，分析当前中国经济运行所处的周期位置，展望“十四五”时期中国经济的增长前景。 第三篇从长期趋势角度，根据各国经济增长的历史经验，分析中国长期经济增长的变化以及经济结构的变迁规律，勾勒出2035年远景目标下的中国经济增长趋势。,9,0,0,104.3,https://weread-1258476243.file.myqcloud.com/weread/cover/93/3300014093/s_3300014093.jpg
胡雪岩谋略大全,2010-03-01 00:00:00,个人成长-认知思维,胡雪岩是清朝末期—位很了不起的商人，他头脑灵活，能言善辩，眼光独到，出手豪阔，肯济人之急。他深知“世界上的事是人办成的”，善于利用利益机制笼络人心，周旋于官场、商场、洋场和江湖各方面势力间，在动荡不安的社会环境里呼风唤雨，名利双收。他开钱庄，办典当，设药局，开丝行，贩运粮食、军火，凭借其卓有成效的经营艺术和精明的商业眼光，逐步成为富可敌国的一代商业巨擘。他捐输赈灾，参与洋务，筹集粮械，襄助左宗棠西征，热心公益事业，融商业活动于国家大事之中，获朝廷特赐二品顶戴，显赫一时。研究胡雪岩成功的“秘诀”，探讨其“商经”和“处世经”，在今天仍不乏现实意义。本书以胡雪岩商务活动的具体过程为经，以其在经营过程中所运用的手段、技巧和遵循的原则为纬，以现代商务知识为背景，对胡雪岩商政谋略中可借鉴的部分进行深入发掘。全书共分三篇。“生平传略”篇概述胡雪岩传奇般的身世、万花筒般的生平，展示其点石成金的能力及处变不惊、战胜困难的魄力和手腕。“商政谋略”篇详述胡雪岩创业的过程、关系网的组建、经商绝学、用人心法、为人之道、处世谋略等，具体展现其眼光和气魄、计谋和手段，这一部分除了可作为生意人的范本，也是一部经世致用的“处世宝典”，值得人们细细品味。“珍闻轶事”篇收录有关胡雪岩的外传、秘史、故老传闻等，重点展现其多方面的性格特征。,19,760,0,8.05,https://wfqqreader-1252317822.image.myqcloud.com/cover/912/817912/s_817912.jpg
终结拖延症,2015-06-01 00:00:00,个人成长-认知思维,在这本书中，威廉·克瑙斯以其专业素养，让原本看起来错综复杂的拖延过程变得简洁清晰，通过清晰易行的步骤，让你学会自我调节；亲身实践这些方法，你将学会为生命负责，并重建你的力量感和目标感。苏格兰有一句谚语：“什么时候都能做的事，往往什么时候都不去做。”所以，这次可别再拖延啦！开始阅读这本书吧，把其中的智慧运用到你的工作和生活当中。现在，终结你的拖延症！,9,524,0,16,https://wfqqreader-1252317822.image.myqcloud.com/cover/738/34979738/s_34979738.jpg
受益一生的脑力训练,2012-09-01 00:00:00,个人成长-认知思维,"　　《受益一生的脑力训练》共分10大部分，汇集了100个名人智慧故事以及100个脑力训练游戏，分别对青少年的发散思维、记忆力、推理力、创造力、想象力、策略思维、分析力、整合力、观察力和数学思维进行了充分训练，同时作者还提供了大量训练技巧，帮助读者打破固有的思维定势，寻找思考问题的新角度，在潜移默化中提升思维能力。
　　《受益一生的脑力训练》对那些渴望提高思维能力、喜好思维游戏的人大有裨益，尤其适合青少年阅读。",46,750,0,10,https://wfqqreader-1252317822.image.myqcloud.com/cover/370/731370/s_731370.jpg
记忆宫殿：130小时成就超级记忆力,2019-06-01 00:00:00,个人成长-认知思维,《记忆宫殿：130小时成就超级记忆力》为你提高记忆力提供了一套最全面最详实的方案，只要你完成30小时的记忆宫殿理论学习，并坚持练习100个小时，你一定会拥有持久精准快速的记忆力。在理论部分，作者讲解了记忆术的基础，以及记忆术在学习生活工作中的具体应用，时不时打岔的接地气语言提醒你深入灵活地掌握记忆术。在训练部分，作者提供了多种类型的训练材料，帮助你将前面学习过的记忆术刻意练习，内化成自己的思维习惯。没有任何一种能力能够轻松为人掌握，但掌握方法能让你事半功倍，本书帮助你在130小时成就超级记忆力。石伟华脑力开发系列丛书作家，中国全脑培训金牌讲师，国家注册心理咨询师，魔术师，催眠师，体验式拓展培训教练。从事全脑培训近十年，帮助近万名学员实现了自己考学考证的梦想。由于其风趣、幽默、神秘、既虐心又烧脑的讲课风格，被学员称为“最能一本正经地胡说八道的脑力开发相声课”。已经出版《超好用的宫殿记忆法：从入门到精通》《一学就会的经典魔术》《我怎么没想到：提高逻辑推理能力的思维名题》等十几部作品，深受国内脑力运动爱好者的喜爱。,42,667,0,35.2,https://wfqqreader-1252317822.image.myqcloud.com/cover/770/32012770/s_32012770.jpg
博弈论的诡计全集,2010-05-01 00:00:00,个人成长-认知思维,"    本书摒弃了市面上大部分博弈书那种枯燥的说理和说教，通过精彩的故事和深刻的剖析来讲述那些能够带你走出迷津的博弈论的“诡计”，告诉读者怎样与他人相处、怎样适应并利用世界上的种种规则、怎样在这个过程中确立自己的人格和世界观，并因此改变对社会和生活的看法，使读者以理性的视角和思路看待问题和解决问题，从而在事业和人生的大博弈中取得真正的成功。阅读本书，我们不仅可以了解到那些令人叹服的社会真实轨迹，还可以学到如何运用这些博弈论的“诡计”成为生活中的策略高手。
",8,633,0,0.99,https://wfqqreader-1252317822.image.myqcloud.com/cover/189/798189/s_798189.jpg
终身写作：让人生有更多可能,2021-07-01 00:00:00,个人成长-认知思维,本书系统阐述了有关写作的理念、思维和方法论，内容包括写作认知、观点打磨、框架思维、内容填充、故事能力、写稿改稿、刻意练习、写作变现、终身写作。书中运用了大量案例来解读写作的每一个环节，因此这既是一本写作入门手册，也是一本写作实战书，可助力读者养成终身写作习惯，通过写作大幅度提升自己的职场核心竞争力。 本书适合想要系统提升写作能力，通过写作培养核心竞争力，打造个人品牌的职场人士（特别是教育培训人员、新媒体从业人员）、创业者、在校学生等读者群体。读者根据书中内容，系统学习和训练，一定能够提升写作综合能力，创造出更多优质内容。,10,0,0,48.3,https://weread-1258476243.file.myqcloud.com/weread/cover/1/3300013601/s_3300013601.jpg
思考的力量,2017-06-01 00:00:00,个人成长-认知思维,"    人和人本质的区别是思考的区别。面对同样的事物，不同的人的思考大相径庭，从而导致他们的行动和结果也千差万别。乔布斯预料到了个人电脑的繁盛前景，从而创立了苹果公司；马云判断电子商务将成为不可阻挡的趋势，从而创立了阿里巴巴；马斯克预见了电动汽车的趋势，从而投资了特斯拉公司……
",20,627,0,11.94,https://wfqqreader-1252317822.image.myqcloud.com/cover/5/908005/s_908005.jpg
思维导图（彩图精装）,2014-08-01 00:00:00,个人成长-认知思维,运用思维导图，“画”出完美人生！全球革命性思维工具，全面激发大脑无限潜能！教你快速掌握提高思维能力的高效方法，让学习更轻松、成功更容易！白虹编著的《思维导图》融科学性、实用性、系统性、可读性于一体，以思维导图的形式介入人们的生活、工作中，用简明易懂的讲解和实用易学的心智图挖掘其创造潜能、思维潜能、精神潜能、记忆潜能、身体潜能就、感觉潜能、计算潜能和文字表达潜能……解决各类疑难问题。,9,607,0,5.96,https://wfqqreader-1252317822.image.myqcloud.com/cover/405/813405/s_813405.jpg
人性的弱点全集,2008-01-01 00:00:00,个人成长-认知思维,"    《人性的弱点全集》的作者戴尔·卡耐基，美国“成人教育之父”。20世纪早期，美国经济陷入萧条，战争和贫困导致人们失去了对美好生活的愿望，而卡耐基独辟蹊径地开创了一套融演讲、推销、为人处世、智能开发于一体的教育方式，他运用社会学和心理学知识，对人性进行了深刻的探讨和分析。《人性的弱点全集》讲述的许多普通人通过奋斗获得成功的真实故事，激励了无数陷和迷茫和困境的人，帮助他们重新找到了自己的人生。接受卡耐基教育的有社会各界人士，其中不乏军政要员，甚至包括几位美国总结。千千万万的人从卡耐基的教育中获益匪浅。
",4,854,0,1.99,https://wfqqreader-1252317822.image.myqcloud.com/cover/783/624783/s_624783.jpg
学会自学,2021-03-01 00:00:00,个人成长-认知思维,进入一个全新的领域，没办法快速入门？工作特别忙，不知道怎样规划自己的学习?为什么我们明明一直在学，却总是一看就会，一用就废？原因很可能是我们缺乏自学的能力。学习是一种主动行为，有了输入之后，必须将学到的知识自行消化、整理、再输出，大脑才会将其视为“重要情报”，转换成长期记忆储存，活用在现实生活中。自学能力强的人，可以快速地学习、掌握新的知识和技能，不论进入任何领域，都能在短时间内成为行家里手。作者台湾科技大学纪坪博士总结最新研究成果，结合其他超级学习者的经验，加上自己的亲身经历，归纳出独创的四维学习法，帮助我们科学地对抗懒惰，养成自主学习的习惯，举一反三，无师自通。,14,469,0,31.99,https://wfqqreader-1252317822.image.myqcloud.com/cover/97/37441097/s_37441097.jpg
目标,2021-05-01 00:00:00,个人成长-认知思维,目标是人和企业最重要的驱动力。纵观绝大部分的成功人士和企业，没有一个不具备极为强烈的目标意识！只有无惧困难、用饱满的热情克服诸多障碍，才可能打开能量与潜力的阀门，走出卓越之路。《目标》这本书的重要目标，就是将带领我们发掘自己的核心目标，走出属于自己的卓越之路。它从目标的重要性谈起，告诉我们如何发现个人目标、如何高效做事、如何激励团队、如何让目标落地为成果。在这个过程中，你能重新定义自我价值、激发内在动力、学会激励他人、赢得团队信任，怀着热情和使命感去建立成功的事业！,13,593,0,28,https://wfqqreader-1252317822.image.myqcloud.com/cover/387/40643387/s_40643387.jpg
超强大脑训练：超级记忆、思维导图与快速阅读,2017-03-01 00:00:00,个人成长-认知思维,本书是集超级记忆、思维导图和快速阅读于一体的学习与训练书籍。内容包含了对大脑的认识、记忆方法、记忆技巧、思维技巧、工作导图、头脑风暴及快速阅读训练方法等内容。作者结合多年的教学经验，以读者兼学兼体验的方式，讲述了记忆、思维、阅读的核心内容。,11,762,0,18,https://wfqqreader-1252317822.image.myqcloud.com/cover/71/924071/s_924071.jpg
副业思维,2020-06-01 00:00:00,个人成长-认知思维,副业不只是业余时间的一份工作，更是人们追求自我、设计自己人生、实现人生梦想非常重要的一个渠道。掌握副业思维的意义在于，激烈的竞争要求我们每一个人都必须具备副业思维，而且在人人都有创业梦的当下，副业是低风险的创业。 通过副业实现财务自由或单纯成为一名斜杠青年已经是当下越来越多人的选择。副业思维的背后，其实是一系列重要能力的组合。本书从认知突围、营销心法、产品生态、运营法则、副业管理5个方面深入讲解了如何启动副业并通过持续经营达到副业赚钱的目的，帮助人们培养副业思维。,10,679,0,29.4,https://wfqqreader-1252317822.image.myqcloud.com/cover/27/31934027/s_31934027.jpg
改变人生的88个好习惯,2007-02-01 00:00:00,个人成长-认知思维,养成好习惯，改掉坏习惯 好习惯能够造就人，坏习惯可以摧毁人。好习惯与坏习惯没有明显的界限，就看每种习惯产生后果的好坏。 莎士比亚说得好：“习惯若不是最好的仆人，它便是最坏的主人。” 这句话很有意思，如果真的让坏习惯主宰了自己的生活，它就是你“最坏的主人”。坏习惯摧毁人，好习惯成就人。因此，要想做一个成功的人，就请从养成良好习惯或者说从改变坏习惯开始。本书分十章，分别从健康、学习、时间管理、礼节等多个角度入手，以通俗易懂的语言，并配以动听的故事，娓娓道出良好习惯的重要性。,4,676,0,1.99,https://wfqqreader-1252317822.image.myqcloud.com/cover/916/415916/s_415916.jpg
四型生理时钟,2017-05-01 00:00:00,个人成长-认知思维,几百年来，电灯被发明、互联网出现、生活形态发生巨变，可你的基因几千年来从未改变，基因里的生理时钟决定了你一天的能量曲线。美国著名医学专家、超级运动员的专属顾问迈克尔·布劳斯博士，在书中分享了时间生物学的突破性研究成果和他独创的四型生理时钟分类法。,5,579,0,17.99,https://wfqqreader-1252317822.image.myqcloud.com/cover/480/928480/s_928480.jpg
如何养成好习惯,2019-11-01 00:00:00,个人成长-认知思维,新年的计划和愿望，总是以失败告终：计划阅读30本书，但最终只读了2本；发誓要戒掉晚睡，但还是不到深夜舍不得放下手机；饮食依然不规律，很难保持正常的体重；健身卡只用了几次；拖延症更严重了，只能在焦虑中度过每一天……调查显示，人们能够达的新年目标的可能性仅为8%。剩下的92%的人，都失败了！都为什么养成好习惯如此困难呢？因为我们的方法用错了！我们误以为，养成好习惯是一件很难的事情，必须靠坚持和忍耐，所以很容易半途而废。事实上，要做好自我管理，千万不要只靠意志力。百万级畅销书作家、自我管理大师佐佐木典士，在本书中提供了50个极易操作的小步骤。通过这些步骤，你只需要每天做出一点点细微的改变，就能慢慢地建立更好的生活和工作模式。你会发现，养成好习惯是一件很轻松的事情。,31,653,0,18,https://wfqqreader-1252317822.image.myqcloud.com/cover/885/26998885/s_26998885.jpg
