title,publishTime,category,intro,maxFreeChapter,newRating,free,price,cover
毛泽东传（全6卷）,2012-04-01 00:00:00,人物传记-军政领袖,本书的主要依据是中央档案馆保存的毛泽东同志的文稿、电报、书信、讲话记录和他所参加会议的大量记录；同时，参考了同毛泽东同志有过直接接触的同志的访问记录、回忆录和当时的报刊资料。力求根据丰富而可靠的第一手资料，写出比较翔实的信史。,32,912,0,60,https://wfqqreader-1252317822.image.myqcloud.com/cover/906/23640906/s_23640906.jpg
邓小平时代,2012-11-01 00:00:00,人物传记-军政领袖,美国哈佛大学傅高义教授倾十年心力完成的权威巨著《邓小平时代》，是对邓小平跌宕起伏的一生以及中国惊险崎岖的改革开放之路的全景式描述。作者对邓小平个人性格及执政风格进行了深层分析，并对中国改革开放史进行了完整而独到的阐释。书中涵盖丰富的中外档案资料和研究成果，以及为数众多的作者独家访谈。对中美建交、华国 锋历史评估、改革开放的幕后曲折、邓小平和诸多当时关键人物之关系、香港问题、邓小平南巡等重大议题均有详述及剖析。本书既具学院研究的严谨专精，又对中国现实政治与事理人情有透彻把握，被誉为邓小平研究“纪念碑式”的著作。,9,903,0,52.8,https://wfqqreader-1252317822.image.myqcloud.com/cover/48/674048/s_674048.jpg
毛泽东传：名著珍藏版（插图本）,2010-08-01 00:00:00,人物传记-军政领袖,美国著名学者兼记者、作家罗斯·特里尔的名著《毛泽东传》，是西方数百种毛泽东传记中最受推崇、最畅销的作品之一。自登陆中国以来，已累积畅销近两百万册，在国内引起了巨大的反响。该书不仅体现出作者对于历史事件高度的敏感性，而且也渗透着政治学视角的理论穿透力，对于人物的情景分析更是出神入化，引导读者体味“故事”背后的时代困惑。本次推出的珍藏版，对原著进行了更为细致和忠实的再现，并增加了二十多幅精美珍贵的照片。它必将推动国内当下的毛泽东研究热潮的继续深化，使人们看到一个从这种独特的角度描述和阐释的毛泽东，从而开阔视野，受到启发，并以自己个人的眼光、经历、立场出发，重新去理解、认识和评价毛泽东。,8,772,0,41,https://wfqqreader-1252317822.image.myqcloud.com/cover/910/785910/s_785910.jpg
乾隆皇帝（全集）,2009-09-01 00:00:00,人物传记-军政领袖,清帝小说鼻祖”二月河重磅力作。时年二十五岁的乾隆继位。他胸怀大志，一心开创大清盛世。他坚持推行“以宽为政”的施政方略，革除前朝苛政。重视直臣能吏，简拔新秀，整顿吏治，对贪官污吏严加惩处。他励精图治，蠲免赋税，使民休养生息，并不断微服私访，体察民情，派能吏赈灾济民，杜塞乱源。先后进军大小金川、西域和台湾，平息叛乱。让纪昀主修《四库全书》，以收束笼络天下士子之心。乾隆朝逐步走向生业滋繁的隆盛之世。但与此同时，土地兼并矛盾愈演愈烈，官场贪贿荒淫糜烂不堪，且边患不已，危机四伏，树大中空，加上晚年乾隆好大喜功，多有失政，又任用和珅等佞臣，黜退贤良，国势逐渐江河日下。,69,823,0,29.99,https://wfqqreader-1252317822.image.myqcloud.com/cover/247/843247/s_843247.jpg
我的前半生（全本）,2021-01-22 00:00:00,人物传记-军政领袖,他名为皇帝，却无家无国；他坐拥九重宫苑，但这宫苑并不属于他；他有自己的新娘，却没有自己的家。他是爱新觉罗·溥仪，中国最后一个皇帝。从登上帝位的那一天起，他的人生注定与众不同。由帝王沦为傀儡，由战犯转为平民，他的一生沧桑巨变，历经荣辱浮沉。帝国黄昏，满宫残照，斯人已去，一切尽归平淡。翻开本书，让我们走进末代皇帝的内心世界，感受时代洪流下个人的命运浮沉。,25,795,0,49,https://wfqqreader-1252317822.image.myqcloud.com/cover/971/35992971/s_35992971.jpg
普京传,2017-01-01 00:00:00,人物传记-军政领袖,"在人们的眼中，普京是世界上富有魅力的总统。他精通柔道功夫，酷爱枪法，会开飞机，喜欢搭乘潜艇，上天入地，劈波斩浪，纵横驰骋……他从叶利钦身边的红人一跃到自己入主克里姆林宫；在走下总统宝座后又一次王者归来……他也是俄罗斯历史上经历传奇的领袖人物，他那机智、坚定而且强势的性格令无数人为他折服，他曾在公开场合不止一次地说：“给我20年，还你一个奇迹般的俄罗斯。”他是俄罗斯民众口中的“上帝派来拯救俄罗斯的伟大使者”。普京以他非凡的能力和超强的魅力赢得了无数俄罗斯人的支持和崇拜。《普京传》是一部对普京个人经历及其执政生涯的全面记录，它将告诉你关于普京的一切。
",27,721,0,11.99,https://wfqqreader-1252317822.image.myqcloud.com/cover/771/931771/s_931771.jpg
中国皇帝全传（超值白金版）,2011-11-01 00:00:00,人物传记-军政领袖,本书汇集了四百余位皇帝的全传，上起秦始皇，下至溥仪，大体反映了历代封建王朝帝王的概貌。本书图文并茂，可读性强，可以让读者便捷、轻松地了解每一个皇帝的生平故事。,18,719,0,5.99,https://wfqqreader-1252317822.image.myqcloud.com/cover/693/842693/s_842693.jpg
为什么是毛泽东,2019-05-01 00:00:00,人物传记-军政领袖,《为什么是毛泽东》以时间为线索，讲述了毛泽东的开蒙、求学过程，以及他经历的一系列重大事件，直至建立了一个伟大的共和国。作者没有将更多的笔墨着眼于对诸多历史事件的细致描述或是揭示秘闻上，而是将重点放在分析毛泽东为什么能够获得成功上，试图探讨他诸多重大决策背后的深意。弄清了这些问题，也就不难明白，为什么中国的最高领袖会是毛泽东，而不是有钱有枪的蒋介石，也不是那些拥有更高学历、更大声望的人，比如周恩来，比如陈独秀。历史无法重演，伟人更加无法复制，但我们仍不会放弃学习他，研究他，因为哪怕我们从他身上只学到了一点皮毛，就足以让我们游刃于战场、商场、名利场。毕竟，站在巨人的肩膀上思考，也许能让我们离成功更近一点。,10,888,0,35.99,https://wfqqreader-1252317822.image.myqcloud.com/cover/557/424557/s_424557.jpg
蒋介石与现代中国,2012-07-01 00:00:00,人物传记-军政领袖,前美驻华外交官、哈佛学者、《蒋经国传》作者陶涵力作，完整引用蒋介石日记的传记。杨天石作序，史景迁推荐。一九四九年两岸分治，此后蒋介石的历史评价始终摆脱不掉“丢掉中国的人”。其专制性格，加上白色恐怖的印象，也似乎掩盖了他的复杂功过。然而蒋介石是唯一在中国大陆与台湾都曾掌权的政治领袖，终其一生不断参与具世界影响力的政治事件，且其时间长度近代少有人能及。蒋介石的一生牵动着现代中国的挣扎以及世界局势的复杂变换。,10,749,0,5.99,https://wfqqreader-1252317822.image.myqcloud.com/cover/671/635671/s_635671.jpg
苏东坡传（图文典藏版）,2018-02-01 00:00:00,人物传记-军政领袖,苏东坡虽文章闻名天下，仕途却历尽艰辛，屡遭迫害，但他终不改乐观的天性。他一生融儒、释、道于一体，诗、文、词、书、画俱在才俊辈出的宋代登峰造极。他政绩卓著，爱民如子，文韬武略兼备，发展慈善事业，创办公立医院，堪比和煦春阳，带给世界无尽生机和温暖。他襟怀苍生，却无奈生活寄于风雨，岁月失于道路，命运困于党争。他波澜壮阔的一生早已没入历史的尘埃，而他所表现出的伟大人格与社会良心，直至今天仍熠熠生辉。林语堂笔下的苏东坡，性格鲜明，形象饱满，可亲可敬，堪称人世间完美的理想人格。,10,814,0,33.99,https://wfqqreader-1252317822.image.myqcloud.com/cover/112/927112/s_927112.jpg
戴笠：黑暗时代里最黑暗的人,2017-11-01 00:00:00,人物传记-军政领袖,1936年西安事变，炮火声中，戴笠与张学良的一番隐秘长谈，最后令蒋介石逃出生天。1937年淞沪会战，戴笠夜入杜公馆，与杜月笙在谈笑间，拉起了一支上万人的抗日武装。1941年12月8日，军统提前破译了日袭珍珠港的密电。但这份宝贵情报，为何没有改变美军的命运？从来没有一个人像戴笠那样神秘，留下如此多的不解之谜。他纵横于隐形战场，神出鬼没，每一次行动都在无声无息间改变历史的走向，令真相变得更加扑朔迷离。揭开戴笠的神秘面纱，看一个时代背后的惊心动魄。,87,790,0,88.99,https://wfqqreader-1252317822.image.myqcloud.com/cover/309/24069309/s_24069309.jpg
富兰克林自传,2012-12-01 00:00:00,人物传记-军政领袖,《富兰克林自传》是美国迄今为止最重要、读者最多的自传作品之一，无论从自传的角度还是从美国思想史的角度来看，都具有划时代的意义。富兰克林以拉家常的方式，把自己成功的经验和失败的教训娓娓道来，整部自传在通俗易懂的叙述中不时会有睿智和哲理的火花，开创了美国传记文学的优良传统，使自传成为一种新的文学体裁。《富兰克林自传》是在读者如饥似渴的等待中出版的，一经问世被一抢而光。世界各地的青年人都希望学习富兰克林成功的秘诀，他们把这部书当成“人生指导”读物。,4,798,0,19.99,https://wfqqreader-1252317822.image.myqcloud.com/cover/847/906847/s_906847.jpg
我的伯父周恩来,2020-02-01 00:00:00,人物传记-军政领袖,"    周恩来，这是一个光荣的名字，这是一个不朽的名字。周恩来总理的革命生涯，是同中国共产党的建立、发展、壮大，同我国新民主主义革命的胜利，同我国社会主义革命和建设的历史进程紧密联系在一起的，他身上集中体现了中国共产党人的高风亮节，其独特的人格魅力得到世界各国人民的拥戴，在全世界人民心中矗立起一座不朽的丰碑，《我的伯父周恩来》作为第一部亲人回忆周恩来总理的作品，力求把那些不为人知的历史、把关于伟人的真实情形原原本本地告诉读者。
",13,948,0,39.99,https://wfqqreader-1252317822.image.myqcloud.com/cover/923/28276923/s_28276923.jpg
我的前半生（九项奥斯卡大奖电影《末代皇帝》原著）,2018-08-01 00:00:00,人物传记-军政领袖,九项奥斯卡金像奖电影《末代皇帝》原著，唯一为自己做传的中国最后一位皇帝。根据此书改编的电影《末代皇帝》荣获最佳影片、导演、摄影、剧本等全部九项奥斯卡大奖，成为当之无愧的影史经典。该片由意大利、英国、中国合拍，意大利著名导演贝纳尔多·贝托鲁奇执导，尊龙、陈冲、邬君梅、彼得·奥图尔、英若诚、坂本龙一、陈凯歌等人主演，是第一部被允许在紫禁城拍摄的影片。《我的前半生》（全本）是爱新觉罗·溥仪的自传，他是秦始皇确立皇帝制度以来的最后一位君主，是清朝的亡国之君，1912年2月，他跌下统治地位的时候年仅六岁。溥仪从自己的家族背景写起，回顾了他在入宫做了皇帝、遭遇辛亥革命、满清皇帝退位、中华民国成立、北洋军阀混战、出宫、客寓天津，做伪满洲国皇帝、逃亡、直至解放后接受改造，成为普通公民的全部经历。,29,766,0,34.99,https://wfqqreader-1252317822.image.myqcloud.com/cover/818/24973818/s_24973818.jpg
马克思传,2017-08-01 00:00:00,人物传记-军政领袖,全书从马克思诞生一直写到他去世，从他幼年时的成长，青少年时的求学、恋爱，到他唯物主义辩证法思想的形成和发展，他对于当时的社会状况、人民生活的观察和思考，直至创立伟大的马克思主义学说，以及在异常艰苦的环境中为全世界无产阶级奔走、奋斗。,26,892,0,19.99,https://wfqqreader-1252317822.image.myqcloud.com/cover/572/22910572/s_22910572.jpg
我的情报与外交生涯,2019-04-01 00:00:00,人物传记-军政领袖,熊向晖同志在晚年撰写了大量回忆文章，生动翔实地记载了他在中国共产党第一代领导核心的领导下，在隐蔽战线从事地下情报工作十二载，以及新中国成立后，在周恩来亲自领导下从事外交工作的丰富经历。这些鲜为人知的史实让读者领略到毛泽东、周恩来等老一辈无产阶级革命家的领导作风和斗争艺术，以及熊向晖同志的传奇人生和传奇经历。,10,889,0,43.2,https://wfqqreader-1252317822.image.myqcloud.com/cover/563/25369563/s_25369563.jpg
普京传：硬汉普京和他的权力世界,2016-10-01 00:00:00,人物传记-军政领袖,普京以诚挚而平易的态度，讲述六十年过往人生历程，娓娓道来，毫无隐瞒，字里行间洋溢其对人生奋斗的执著、对政治抱负的追求、对俄罗斯民众的崇高使命、以及这位铁血硬汉一步步走上权力巅峰背后鲜为人知的故事。本书自普京的出生着笔，从一名苏联海军的儿子到毕业于圣彼得堡国立大学，拥有经济学博士学位；从完成克格勃的训练，加入情报机关机要部门，到投身地方政府，就任圣彼得堡第一副市长；从经由同乡丘拜斯的推荐，加入俄罗斯总统事务管理局，到三年后，在叶利钦的支持下，高票当选俄罗斯总统。,8,682,0,6.99,https://wfqqreader-1252317822.image.myqcloud.com/cover/220/845220/s_845220.jpg
周恩来传,2019-08-01 00:00:00,人物传记-军政领袖,迪克•威尔逊先生自1960年第一次与周恩来见面后，便开始搜集该书的写作材料，其中包括周恩来的同事们的广泛回忆及国内外可供查寻的文献资料。他以翔实的资料为基础，再现了周恩来传奇性的一生，分析了他给新中国成立和发展带来的巨大影响，是一部全面、深刻又不失独特见解的著作。,3,790,0,39.99,https://rescdn.qqmail.com/weread/cover/550/3300006550/s_3300006550.jpg
毛泽东传,2019-08-01 00:00:00,人物传记-军政领袖,完整地、准确地、生动地再现毛泽东这位历史人物的本来面貌并对其功过是非作出令人信服的评说，无疑是一项相当艰巨浩繁的工程。来自英国的当代中国问题研究专家迪克•威尔逊先生以严谨的学者态度从事毛泽东研究，在本书的结构安排上采取了以毛泽东的政治生涯为主线，兼顾他在其他领域中活动，同时穿插其个人生活的写法。这种有主有次、有详有略的全方位考察，也在一定程度上有助于再现毛泽东极富特色的个人风貌，使本书具有可读性。,3,791,0,39.99,https://rescdn.qqmail.com/weread/cover/549/3300006549/s_3300006549.jpg
战神粟裕,2014-06-01 00:00:00,人物传记-军政领袖,"    大将粟裕对战场有种天才般的敏锐感知，善于指挥大兵团作战，堪称一代战神。他运兵奇巧、用势奇险、胃口奇大、胆识奇绝，达到兵家""""上兵若水""""的最高境界。在抗日战争和解放战争中，立下了赫赫战功。
",5,799,0,11.7,https://wfqqreader-1252317822.image.myqcloud.com/cover/8/710008/s_710008.jpg
尼克松回忆录（全集）,2019-05-01 00:00:00,人物传记-军政领袖,本书是尼克松唯一的回忆录，内含大量第一手资料，尤其是尼克松的笔记、口授日记记录，对会议、谈话或事件的口授录音，“根据这些录音带提出的报道，比过去的一切报道都更为完整”。从事件中心者的视角进入这本书，你会发现一个更全面、更复杂的尼克松，进而了解美国的对外政策思想脉络、总结冷战时期的国际政治历史、认识其后的世界发展趋势。从草根之子到美国总统，从顽固的“反共分子”到“中国人民的老朋友”，尼克松缓解美苏关系、中美关系，结束越战，推行废除种族隔离政策，直到水门事件，成为美国有史以来第一个因弹劾而辞职的总统。作为跨越整个冷战时期的政治人物，他的一生跌宕传奇，是美国历史上最富争议的总统之一。,13,792,0,38,https://wfqqreader-1252317822.image.myqcloud.com/cover/606/25309606/s_25309606.jpg
周恩来传（1）,2011-01-01 00:00:00,人物传记-军政领袖,编写周恩来同志的传记，是中共中央文献研究室承担的一项重要任务。邓小平同志为本书题写了书名。本书（共四册）介绍革命家、政治家周恩来曲折坎坷、光辉的一生。并配有大量图片，内容详实、全面，是一部了解伟人的好教材，值得一读。本书的主要资料依据是中央档案馆保存的周恩来同志数万件文稿、电报、书信、讲话记录和大量会义记录，还有原由邓颖超同志保存的周恩来同志青年时代日记、作文和书信等。同时，广泛参考了当时各种报刊和许多同周恩来同志有过直接接触的人员的访问记录、回忆录等。力求根据丰富的第一手资料，写出比较翔实的信史。,8,894,0,10.56,https://wfqqreader-1252317822.image.myqcloud.com/cover/83/24181083/s_24181083.jpg
唐玄宗,2022-04-01 00:00:00,人物传记-军政领袖,"唐玄宗——大唐盛世的形象代言人。  
他天资英武，雄才大略，一手开创了大唐王朝的黄金时代——开元盛世，然而，这个声名显赫的伟大帝国，又在他的统治下遭遇了唐朝历大的一次劫难——安史之乱。 
他风流多情，多才多艺，与杨贵妃演绎了一曲千古爱情神话，但他也眼睁睁地看着心爱的女人香消玉殒。 
这个带领着古代中国冲上历史的皇帝，究竟有着怎样的雄才伟略？他的一生，又为中国历史书写了怎样的传奇？
隋唐史学者蒙曼，引经据典，讲述大唐王朝盛衰交迭的国运和唐玄宗大起大落的人生。",23,860,0,46.8,https://wfqqreader-1252317822.image.myqcloud.com/cover/360/43958360/s_43958360.jpg
实录毛泽东（1-4）（新版套装1893年-1976年）,2018-01-01 00:00:00,人物传记-军政领袖,《实录毛泽东》精选了毛泽东的老师、同学、战友、身边工作人员、亲属以及外国领导人、驻华大使等273人的回忆，全面、客观、翔实地记录了毛泽东的一生。本书对各个时期的重大历史事件都有详细深刻的记录，从历史背景、内中原委、事实真相，以及当事人的亲身感受等方面作了客观生动的写照，细节回忆，寓意深远。,13,835,0,62.4,https://wfqqreader-1252317822.image.myqcloud.com/cover/784/928784/s_928784.jpg
曾国藩领导力十二讲,2019-08-01 00:00:00,人物传记-军政领袖,曾国藩是中国历史上有较大影响力的人物之一，他的领导力，可以说是中国式领导力的典范，用“仰之弥高”来形容一点也不为过。宫玉振教授以深厚的学术底蕴，从领导力的角度，将曾国藩总结出来的为人处世之道提炼为“重、耐、浑、明、辣、慎、勤、实、暇、裕、恕、强”十二个字，并结合相关事例及现代管理实践展开论述，揭示了曾国藩对于中国情境下领导行为的启发意义。这十二个字，其实就是在中国文化和社会环境中，一个成功的领导者应该遵循的十二条基本原则。通过这十二个字，可以学习传统文化中儒家的理想与追求、法家的清醒与现实，以及道家的成熟与灵活，从而提升自己的领导力，达到真正圆通无碍的境界。,18,922,0,54.4,https://wfqqreader-1252317822.image.myqcloud.com/cover/146/26833146/s_26833146.jpg
异见时刻：“声名狼藉”的金斯伯格大法官,2018-09-01 00:00:00,人物传记-军政领袖,大多数人因为看见才相信，只有少数人因为相信会看见。美国联邦最高法院大法官鲁思·巴德·金斯伯格一生淡泊名利——她只是试着去让这个世界变得更好一点、更自由一点。她是美国联邦高院“九人”之一，是犹太女性大法官，也是“全球100位影响力人物”之一。一路走来，这位女权主义先驱的强烈异见和坚强力量鼓舞了数百万人，也因不畏强权，敢于异议而被冠以“声名狼藉”这个形容词。她曾四次打败癌症，为保持身体健康长期坚持健身，甚至在80岁生日之前还能连续做20个俯卧撑。2020年9月18日，金斯伯格在进行胰腺癌治疗时因并发症去世，享年87岁，希拉里发表悼词称：“金斯伯格大法官为包括我在内的许多女性铺平了道路，再也不会有像她一样的人了。”,11,864,0,38.99,https://wfqqreader-1252317822.image.myqcloud.com/cover/220/34405220/s_34405220.jpg
汉密尔顿传,2018-04-01 00:00:00,人物传记-军政领袖,美国二百年国运的真正缔造者：我们只能坚持美国优先政策。10元美钞上的美国国父。汉密尔顿对美国的影响，比绝大多数美国总统都要深远。他是美国开国元勋之一、美国《宪法》之父、美国首任财政部长、美国中央银行之父、美国货币之父、美国财政系统之父、美国国家信用体系之父、美国联邦制之父、美国两党制之父、美国税务之父、美国常备军之父，主要由他执笔的《联邦党人文集》是美国宪法精神的经典栓释。普利策奖获得者罗恩·彻诺得意力作，同名音乐剧斩获11项托尼奖。翻开本书，了解美国崛起的思想及制度根源。,14,867,0,99,https://wfqqreader-1252317822.image.myqcloud.com/cover/609/934609/s_934609.jpg
乾隆：政治、爱情与性格,2018-02-01 00:00:00,人物传记-军政领袖,中国历史最复杂的皇帝的政治、后宫与人生。读懂了这个人，你就读懂了中国历史，读懂了中国政治。他是人类历史上实际统治时间最长的皇帝，也是人类历史上寿命最长的君主之一。他身高一米六六左右，有81.25%的满族血统，6.25%的蒙古族血统和12.5%的汉族血统。他风度翩翩，举止优雅，武功骑射功夫出众，又文采风流。他是一个重情又长情的男人，与皇后举案齐眉，伉俪情深；但又一生宠爱无数，后宫收藏了天下各地的美女。他是父亲雍正最器重的儿子，然而登基后马上推翻了父亲的政策。他是仁慈的皇帝，也曾残酷无比，杀人如麻。他一生拥有多重角色——既是政治家，又是学者，同时还是诗人、旅行家和猎人。本名弘历，姓爱新觉罗，1711年八月十三日，出生于北京，属兔。九岁到二十五岁，是皇家私塾一名品学兼优的学生。十七岁，与出身名门的富察氏结为夫妇，伉俪情深；后又陆续添置配偶二十八人，育有子女二十四人，其中十六子，八女。二十五岁登基，正式开始皇帝事业——给父亲雍正的政敌们平反，豁免了全国的农业税，博得宽大仁慈的美名。四十九岁，平定新疆，威名远播，达到其个人职业生涯的巅峰。工作六十年之后，八十五岁，为了不超越其祖父康熙工龄六十一年之数，办理了离休手续，在他禅位后第二年，华盛顿宣布拒绝担任第三任总统。八十九岁去世，最后一个职务是太上皇。去世四十一年后，当年曾受过他接见的英国人小斯当东推动英国议会通过了发动鸦片战争的提案，掀开了中国百年耻辱史的序幕。,5,862,0,24.99,https://wfqqreader-1252317822.image.myqcloud.com/cover/879/36685879/s_36685879.jpg
成吉思汗：意志征服世界,2015-05-01 00:00:00,人物传记-军政领袖,"    这是成吉思汗征服世界的历史，更是一部成吉思汗的个人征服史。成吉思汗及其子孙打下的蒙古帝国地跨欧亚，是世界历史上最庞大的帝国，极盛时期版图东到太平洋，北抵北冰洋，西达黑海沿岸，南至南海。今天的匈牙利、波兰、俄罗斯、韩国都曾是大蒙古帝国的一部分。成吉思汗凭借他惊人的意志，顶住了一次次失败的打击，每次都能在短时间内迅速榨取敌人的经验、力量，以更强大的自我卷土重来，创建了世界上最庞大的帝国——蒙古帝国。“体力坚强，只能战胜独夫；意志坚强，才能战胜万众。” 成吉思汗对他的孙子忽必烈说。翻开本书，在热血沸腾的世界征战中，领悟一代世界征服者最朴实的征服之道。
",4,775,0,19.9,https://wfqqreader-1252317822.image.myqcloud.com/cover/683/593683/s_593683.jpg
毛泽东传（全两册 插图本）,2015-08-01 00:00:00,人物传记-军政领袖,《毛泽东传》以翔实的史料（其中多为第一手史料）为依据，评述了毛泽东的一生，立论客观。该书不同于海内外其他传记的特点是使用了大量俄罗斯档案，进而在毛泽东与共产国际、苏共、苏联和斯大林等苏联领导人的关系方面颇有新说。阐述这种关系也是该书的一个中心内容。,11,856,0,82,https://wfqqreader-1252317822.image.myqcloud.com/cover/964/40766964/s_40766964.jpg
