title,publishTime,category,intro,maxFreeChapter,newRating,free,price,cover
叶剑英风采（老一辈革命家风采）,2020-02-25 00:00:00,人物传记-军政领袖,叶剑英（1897—1986），是坚定的马克思主义者，伟大的无产阶级革命家、政治家、军事家，中国人民解放军的缔造者之一，中华人民共和国的开国元勋。叶剑英的一生经历了旧民主主义革命、新民主主义革命、社会主义革命和建设、改革开放新四个时期。本书旨在通过讲述一个个故事，鲜活地反映叶剑英的革命经历、政治智慧、品格风范、人格魅力，以及家风家教和生活情趣。 依据史实，以文学传记的笔触，选取了叶剑英元帅人生经历的不同侧面和重要阶段，探索他成长足迹、心路历程、情感轨迹以及不同时期重要关头所起到的决定性作用入手，带领读者回顾并领略中国人民解放军创建人、领导人，军事家，中华人民共和国元帅波澜壮阔的一生。,16,693,0,14.99,https://wfqqreader-1252317822.image.myqcloud.com/cover/331/29718331/s_29718331.jpg
莱因哈德·海德里希传,2015-12-01 00:00:00,人物传记-军政领袖,海德里希是纳粹德国党卫队重要成员之一，曾有望成为希特勒的接班人。他一方面是杀伐果决、冰冷残酷的侩子手，一方面又是温柔可靠的丈夫，高大慈爱的父亲。从海军失业人员，到身兼帝国中央保安局局长、安全警察总监、党卫队全国副总指挥、波西米亚及摩拉维亚保护国总督及国际刑警组织主席，一路青云直上，却在通往权力巅峰的途中突遭暗杀。在第三帝国，海德里希究竟扮演着怎样的角色，又是如何一步步走向灭亡？,10,622,0,15.99,https://wfqqreader-1252317822.image.myqcloud.com/cover/228/818228/s_818228.jpg
梦回万里 卫黄保华：漫忆父亲刘少奇与国防、军事、军队,2018-08-01 00:00:00,人物传记-军政领袖,刘少奇是伟大的马克思主义者，无产阶级革命家、政治家和理论家。人们熟知他对党的理论、组织和政权建设方面的巨大贡献，但他漫长的军事生涯却鲜为人知。本书围绕刘少奇在国防、军事和军队建设方面的丰功伟绩，从子女、军队领导的独特角度，以简洁、浓情且富有个性化的语言，对党史上的若干重大事件，以及刘少奇同毛泽东、彭德怀、何葆贞、胡志明等老战友的关系，作了精彩梳理。其中不乏独家掌握的史料及补白新解，并以独立视角来评析提问。为激发青年一代尤其是当代军人对历史的感悟，在文风上努力做出新尝试，融历史文化和当代词话于字里行间而精练浓缩讲述，或许可为严肃的史学园地增添一抹清新隽永的芳香。更值得推荐的是，书中强调人民群众和领导群体的决定性历史作用，可谓追忆先辈著述中绽放一朵亮眼动人的奇花。,6,727,0,16.99,https://wfqqreader-1252317822.image.myqcloud.com/cover/626/24951626/s_24951626.jpg
毛泽东影响中国的88个关键词,2016-01-01 00:00:00,人物传记-军政领袖,毛泽东是语言大师。“枪杆子里面出政权”，一句话，惊醒了党人，改写了历史；“人不犯我，我不犯人，人若犯我，我必犯人”，挟雷带电兼风雨，充满豪情与霸气；“百花齐放”，“夹紧尾巴做人”，“搬起石头砸自己的脚”，“打老虎”，深入浅出，点石成金……在现当代中国，能够创造化用如此众多且影响广泛，持久的“魅力词语”的人。本书作者从在各个时期创造化用的词语中，精选其对中国乃至世界产生重大影响的88个关键词，一一旁征博引，究其幽微，考察来龙去脉，评说前世今生，描画出一幅别开生面的毛泽东“语言地图”，从而领略毛泽东以笔墨作刀枪，遣字成军，开天辟地，破旧立新的巨人风采。,28,786,0,29.72,https://wfqqreader-1252317822.image.myqcloud.com/cover/966/23734966/s_23734966.jpg
毛泽东风采（老一辈革命家风采）,2020-02-25 00:00:00,人物传记-军政领袖,中国中共文献研究会编的《毛泽东风采》是伟大的无产阶级革命家、战略家、理论家毛泽东同志的传记，毛泽东同志是党的中央领导集体的核心，是领导中国人民彻底改变自己命运和国家面貌的一代伟人。他对马克思列宁主义的发展、军事理论的贡献以及对共产党的理论贡献被称为毛泽东思想。毛泽东被视为现代世界历史中重要的人物之一。,16,818,0,14.99,https://wfqqreader-1252317822.image.myqcloud.com/cover/342/29718342/s_29718342.jpg
王安石全传,2012-03-01 00:00:00,人物传记-军政领袖,王安石，以其非凡的才识和魄力，受命于北宋王朝的衰败之际，决心力挽狂澜，掀起了一场轰轰烈烈的熙宁变法。对于传统的封建思想和制度，王安石无疑进行了猛烈地抨击。他整饬朝纲、巩固边防等一系列措施却也让北宋王朝出现了短暂的生机。从这一点来说，他的功绩又是难以磨灭的。非凡的少年之路如何成就了王安石，平民出身的他又是如何在官场中独占鳌头进行改革的？历经变法失败和丧子之痛的他又是如何潜心向佛、抚慰伤痛的？对于这些问题本书将做详细的解答。,3,690,0,1,https://wfqqreader-1252317822.image.myqcloud.com/cover/11/316011/s_316011.jpg
叶挺传：骁将的坎坷,2001-07-01 00:00:00,人物传记-军政领袖,本书介绍了叶挺的主要事迹、曲折人生以及自身的人格魅力。叶挺一生充满了胜利与挫折，他的情思交织着渴望与失望。本书从感情、军事、人格等方面深刻剖析了叶挺的深沉思想。也许读过本书，你会为他所震撼。,8,727,0,11.2,https://wfqqreader-1252317822.image.myqcloud.com/cover/566/23729566/s_23729566.jpg
雪域丹心：第七批援藏干部人才的心路故事,2016-05-01 00:00:00,人物传记-军政领袖,本书生动详细地描绘了第七批援藏干部在西藏开展工作的真实画面，他们中有干部，也有普通医生、教师；有经验丰富的老党员，也有初出茅庐的80后；这些各行各业不同经历的人来到西藏都为了一个目的：做好新时期的援藏工作，到2020年，确保实现全面建设小康社会的奋斗目标。,23,0,0,38.72,https://wfqqreader-1252317822.image.myqcloud.com/cover/31/23735031/s_23735031.jpg
大汉天威：刘邦的草根哲学,2007-11-01 00:00:00,人物传记-军政领袖,汉高祖刘邦以一介布衣提三尽宝剑崛起于乱世，南征北战，东伐西讨，席卷天下。其间艰苦卓绝难以尽说，其中成败成失耐人寻味。《大汉天威：刘邦的草根哲学》对刘邦的权谋与智慧的评说。 ,3,557,0,2.98,https://wfqqreader-1252317822.image.myqcloud.com/cover/221/183221/s_183221.jpg
周恩来的四个昼夜,2014-12-01 00:00:00,人物传记-军政领袖,《周恩来的四个昼夜》是一部正在热播电影的同名图书。影片由河北省委宣传部、河北省广播电影电视局、河北影视集团等单位联合摄制，河北电影制片厂领衔出品。影片上映后中组部、中宣部、中央党的群众路线教育实践活动领导小组办公室、国家新闻出版广电总局联合发出通知，要求各级党组织在开展教育实践活动中组织广大党员干部观看，引起了强烈反响。本书严格依据此影片改编而成。,19,905,0,10.8,https://wfqqreader-1252317822.image.myqcloud.com/cover/734/23749734/s_23749734.jpg
生死风云张灵甫,2015-10-01 00:00:00,人物传记-军政领袖,在上将云集的国民党军中，张灵甫的军衔并不高，只是一名中将；在历次大的抗日会战中，张灵甫从来没有成为会战的总指挥，他只是会战中的一名棋子；在职务上，张灵甫最高也就做到74军军长，而且不久后就因部队改编，而又变回了师长。如果仅从这些来看，张灵甫仅仅是一名普通的国民党军将领，他本应该像许多普通国民党军将领一样，被淹没在滚滚的历史洪流中。但几十年后的今天，海峡两岸依然有一大批人关注着、谈论着这位逝去已久的国民党军将领。张灵甫能够引起如此大的关注，与其说与《红日》《南征北战》这些文学影视作品有关，不如说和张灵甫本人有关，他的传奇一生。,32,0,0,19.99,https://wfqqreader-1252317822.image.myqcloud.com/cover/204/41978204/s_41978204.jpg
中华宦官故事,2012-03-15 00:00:00,人物传记-军政领袖,在中国漫长的奴隶制与封建制社会中，宦官是一个特殊的阶层。它大约产生于夏代，春秋战国时期，其上层头面人物步入政治舞台，随后在历朝历代都扮演了重要的角色。直到辛亥革命推翻封建专制制度，这个阶层才渐渐消亡。全书共写了68个宦官的事迹，通过具体人和具体事，真实地客观地展示宦官这一“陋习”，以便让人们了解它产生的原因，祸乱的情状，以及造成的后果（当然对于正直善良的宦官应另当别论），进而认识和批判早已成为陈迹的那个专制时代、专制制度。,21,0,0,8,https://wfqqreader-1252317822.image.myqcloud.com/cover/739/810739/s_810739.jpg
不死老兵：麦克阿瑟,2014-08-01 00:00:00,人物传记-军政领袖,本书在大量考证历史资料和细节的基础之上，以全新的视角，叙述了麦克阿瑟的成长道路和心路历程。,4,0,0,8.94,https://wfqqreader-1252317822.image.myqcloud.com/cover/1/41198001/s_41198001.jpg
叶卡特琳娜女皇,1996-11-01 00:00:00,人物传记-军政领袖,本书以轻快的笔法、跳跃性故事情节，以情节曲折、用入情入理、深入细致的生活描写、鲜明的人物对比，给读者留下深刻印象和艺术享受。,3,0,0,23.99,https://wfqqreader-1252317822.image.myqcloud.com/cover/296/41978296/s_41978296.jpg
艾森豪威尔（名人传奇故事丛书）,2003-05-01 00:00:00,人物传记-军政领袖,"    德怀特·戴维·艾森豪威尔，美国五星上将，第二次世界大战十大名将之一，美国第34任总统。在美国历史上，一共有过10名五星上将，艾森豪威尔是其中之一；他是美国历史上惟一一个当上总统的五星上将。“艾森豪威尔造就了战争，战争造就了艾森豪威尔。”这是美国《时代》杂志对艾森豪威尔的评价。
",6,740,0,3.38,https://wfqqreader-1252317822.image.myqcloud.com/cover/673/506673/s_506673.jpg
张之洞：中国现代工业践行者,2014-10-01 00:00:00,人物传记-军政领袖,清朝末年，中国饱受内忧外患，以慈禧外代表的守旧势力面对国家的衰落，不仅不想方设法及时补救，反而盲目自大、阻碍进步。张之洞是慈禧钦点的探花，慈禧对他有知遇之恩，他一心要效忠慈禧，但是国家的苦难局面让他深知慈禧的治国理念必将误国。在当京官期间，他一身正气，维护国家利益，深受慈禧欣赏；担任封疆大吏后，他转而全力进行现代工业建设，尤其是在武汉期间，他建起了在当时亚洲首屈一指的工业基础。他的努力，对于缩小中国工业与世界工业的差距有着积极意义。本书以全新的视角，着眼于张之洞的工业建设成就，体现“实业救国”的理念。,8,700,0,7.2,https://wfqqreader-1252317822.image.myqcloud.com/cover/421/776421/s_776421.jpg
俾斯麦（名人传记丛书）,2012-10-01 00:00:00,人物传记-军政领袖,从纨绔子弟到铁血宰相，他狡猾诓骗欧洲20余载；他凭借铁血暴力三次战争一统德国，震荡欧洲格局；他独裁守旧，镇压工人运动，却又建立了世界上最早的社会保险制度；他骄傲、自负，不分敌友，却是德国近代史上最杰出的政治家和外交家。,2,598,0,3.4,https://wfqqreader-1252317822.image.myqcloud.com/cover/755/693755/s_693755.jpg
当改革遇见王安石,2018-07-28 00:00:00,人物传记-军政领袖,王安石变法以财经改革为核心，兼顾军事与科举改革。王安石借鉴了桑弘羊的国家干预主义思想，强化了政府对商业的干预，并试图开创借助金融资本扩大农业生产、增加财政收入的改革之路，实现国家利益与民生的双赢。王安石变法取得了阶段性成效，但并未实现富国强兵、制服“两蕃”的最终目标，神宗去世、司马光等保守派上台后，变法归于失败。变法虽然失败，但王安石没有失败。王安石超前的财经改革思想，令他与同时代的政治人物拉开了距离。王安石“矫世变俗”的抱负，“天变不足畏”“祖宗不足法”“人言不足恤”的勇气，清廉自守的品格，寄情山林的本色，以及卓著的文学成就、经学造诣，令他与历代政治人物拉开了距离。,16,826,0,31.2,https://wfqqreader-1252317822.image.myqcloud.com/cover/556/24172556/s_24172556.jpg
海德里希传：从音乐家之子到希特勒的刽子手,2020-04-01 00:00:00,人物传记-军政领袖,莱因哈德·海德里希，屠杀数百万欧洲犹太人的幕后操纵者，他是天生的恶魔吗？在这部兼具学术严谨性和叙事可读性的经典传记中，罗伯特·格瓦特试图为这一令人困惑的人性问题给出逻辑一致的解释。通过对海德里希一生的剥丝抽茧式分析，格瓦特揭示了一个典型纳粹党徒的邪恶心路历程。海德里希出生于德国中上阶级家庭，他的父亲是当地一位颇有名气的音乐家。他从小就接受了良好的音乐教育，是一名具有专业水准的小提琴手。他还酷爱运动，有着卓越的运动技能。海德里希高中毕业后加入了德国海军，但在1931年春天，因私生活处理不当而被海军遣散。离开海军之后，陷入迷惘的海德里希深受其未婚妻一家的影响，开始拥抱纳粹主义，并经友人介绍结识了纳粹党卫军☆高长官希姆莱。希姆莱让他负责党卫军的情报工作。海德里希熟谙并充分利用了纳粹政权官僚体系的丛林法则，在帮助希姆莱攫取更大权力的过程中，自身的权力野心也随之膨胀并得以实现，官至波希米亚和摩拉维亚保护国代理总督，直至1942年5月在布拉格遇刺不治身亡。,10,0,0,52.99,https://wfqqreader-1252317822.image.myqcloud.com/cover/170/38818170/s_38818170.jpg
武田信玄,2017-11-07 00:00:00,人物传记-军政领袖,狂飙的日本战国时代，20岁的少年英豪武田信玄，在家老和百姓的支持下，兵不血刃地放逐了暴虐无道的父亲。年轻的脉搏，充满欲望与野心。自立为甲斐国主的他，随即以雷霆万钧之势进攻信浓。他努力开疆阔土，往复争战。他的军旗上写着孙子的名言：“疾如风，徐如林，侵略如火，不动如山。”旌旗所指，战无不胜。,15,0,0,27,https://wfqqreader-1252317822.image.myqcloud.com/cover/121/38605121/s_38605121.jpg
秦始皇嬴政传,2016-06-01 00:00:00,人物传记-军政领袖,在我国，帝王是皇帝和君王统称，是封建王朝最高的统治者，拥有至高无上的权力。在周朝之前，“帝”与“王”字义相近。而在秦朝以前，帝王是至尊君主，等同“天子”。自秦嬴政称“皇帝”后，“王”与“皇”有了区别，“王”成为地位仅次天子而掌控一方之诸侯的称呼了。在我国历史上，“皇帝”这个名称是由秦嬴政最先确定的，也是他最先使用的。“皇帝”取“德兼三皇、功盖五帝”之意。秦始皇创建了皇帝制度，并自称第一个皇帝，称为“始皇帝”。皇帝拥有法律制定权、行政决策权和军事指挥权。自此，我国开始了长达两千多年的封建皇帝制度。,2,0,0,3.99,https://wfqqreader-1252317822.image.myqcloud.com/cover/762/22160762/s_22160762.jpg
林肯传,2016-05-01 00:00:00,人物传记-军政领袖,"林肯是美国第十六任总统，著名的演说家、律师。这位“伟大的解放者”领导了针对南方奴隶制度的南北战争，颁布了《解放黑人奴隶宣言》，维护了联邦的统一，为美国在19世纪末跃居世界头号工业强国开辟了道路。本书是成功学大师戴尔·卡耐基的扛鼎之作，也是他一生中撰写的唯一一部传记。作者以其感人至深的笔触，生动再现了一个内心忧郁、富于理想、愈挫愈勇、满怀仁慈之心的林肯形象。林肯的从政之路充满坎坷和失败，但追求平等的政治理想却一直支撑着他屡败屡战，直至最终入主白宫。这位平民总统富于传奇色彩的一生，相信会让每一位读者唏嘘不已。
",8,691,0,19.99,https://wfqqreader-1252317822.image.myqcloud.com/cover/83/853083/s_853083.jpg
金戈铁马功盖世：中国历代名将沉浮（全2册）,2018-07-01 00:00:00,人物传记-军政领袖,本书详实、全面地记录了历代知名的将军、名帅，通过讲述他们的人生经历，窥视各个朝代的兴亡 通过讲述他们鲜为人知的故事，让读者更深刻地认识他们。本书的编写，以史实为主，其材料基本来源于正史，有少量兼采别史的记载，每位人物独立成章，即带有浓厚的传记色彩，又不乏神奇的趣闻以及生动的情节。,6,0,0,29.4,https://weread-1258476243.file.myqcloud.com/weread/cover/91/3300015491/s_3300015491.jpg
实录毛泽东2：崛起挽狂澜1927—1945（新版）,2018-01-01 00:00:00,人物传记-军政领袖,《实录毛泽东》精选了毛泽东的老师、同学、战友、身边工作人员、亲属以及外国领导人、驻华大使等273人的回忆，全面、客观、翔实地记录了毛泽东的一生。本书对各个时期的重大历史事件都有详细深刻的记录，从历史背景、内中原委、事实真相，以及当事人的亲身感受等方面作了客观生动的写照，细节回忆，寓意深远。本卷为第2卷，由胡乔木、谭震林、习仲勋、杨成武、程子华、徐海东、何长工、埃德加斯诺讲述1927—1945年毛泽东领导秋收起义、首创农村根据地、指挥反“围剿”、来自“左”的排斥、引领长征、延安整风等事件。,5,800,0,15.6,https://wfqqreader-1252317822.image.myqcloud.com/cover/785/928785/s_928785.jpg
黄金荣全传,2022-07-28 00:00:00,人物传记-军政领袖,黄金荣是近代中国最大的流氓首领之一，他先是依仗殖民者的势力，由一个地位卑下的瘪三流氓而成为租界警探，并由此起家，脚跨黑白两道，跃为法租界巡捕房的督察长。这是他人生重要的转折点，是他发迹的开端，却也是他罪恶的开始。,4,0,0,25,https://weread-1258476243.file.myqcloud.com/weread/cover/86/3300023286/s_3300023286.jpg
五四新文化运动先驱者：李大钊,2015-11-18 00:00:00,人物传记-军政领袖,全书共分10部分，借助大量资料，从思想文化的视角，简明生动地阐释了李大钊为中国革命英勇奋斗、光辉灿烂的一生，重点介绍李大钊在五四新文化运动前后的革命事迹，尤其是传播马克思主义、创建中国共产党等所作出的伟大贡献。,13,0,0,19.6,https://wfqqreader-1252317822.image.myqcloud.com/cover/619/31189619/s_31189619.jpg
风流少帅张学良,1998-10-01 00:00:00,人物传记-军政领袖,张学良（1901—2001），中国现代史上的关键人物。早年英俊潇洒，风流倜傥，其父张作霖被日本人炸死后，就任东三省保安死灵，年仅27岁，被誉为“少帅”。1928年12月宣布易帜，拥护南京国民政府，中国实现统一，曾任陆海空军副总司令。“九一八”事变时，奉行蒋介石“不抵抗”政策，致使东北沦陷，痛遭国斥。1935年与杨虎城率部围剿红军，连遭败绩，内心苦闷，开始接受中共的抗日主张。1936年12月12日，与杨虎城一起发动西安事变，逼蒋抗日，震惊中外。后送蒋介石回南京，遭软禁，至1990年解禁，前后达54年之久。,2,0,0,3.99,https://wfqqreader-1252317822.image.myqcloud.com/cover/956/26457956/s_26457956.jpg
实录毛泽东3：重整旧山河1945—1957（新版）,2018-01-01 00:00:00,人物传记-军政领袖,《实录毛泽东》精选了毛泽东的老师、同学、战友、身边工作人员、亲属以及外国领导人、驻华大使等273人的回忆，全面、客观、翔实地记录了毛泽东的一生。本书对各个时期的重大历史事件都有详细深刻的记录，从历史背景、内中原委、事实真相，以及当事人的亲身感受等方面作了客观生动的写照，细节回忆，寓意深远。本卷为第3卷，由刘伯承、徐向前、聂荣臻、粟裕、陈赓、杨尚昆、薄一波、伍修权、李银桥、师哲等人讲述1945—1956年毛泽东到重庆谈判、统筹解放战争、建立新中国、出访前苏联、调整工商业、发起“三反”“五反”、发起农业改革等事件。,5,750,0,15.6,https://wfqqreader-1252317822.image.myqcloud.com/cover/786/928786/s_928786.jpg
能臣与英雄：曹操大传（全2册）,2020-01-01 00:00:00,人物传记-军政领袖,曹操内奉天子，外伐诸侯，东联孙吴，西敌蜀汉，北征乌桓，一生征战，识人有慧，用人以才，群贤聚集，建功立业，匡扶济世。曹操年轻时放荡不羁，性格粗犷莽撞，有一颗匡扶天下的雄心；曹操文能出口成章，豪情万丈、才华横溢，武能征战四方天下，平董卓，战官渡，征乌桓，与刘备、孙权争天下，终成一代霸主；曹操用人不拘一格，唯才是举，麾下能人辈出，众多文臣武将齐聚左右。曹操是了不起的政治家、军事家，也是一个了不起的诗人……曹操统一中国北方，创立魏国。曹操改革了东汉许多恶政，抑制豪强，发展生产，实行屯田，督促开荒，推行法治，提倡节俭，使遭受大破坏的社会得到恢复发展。曹操传奇的一生，对现代社会、生活，仍然具有广泛的借鉴意义。,8,0,0,34.99,https://wfqqreader-1252317822.image.myqcloud.com/cover/39/30000039/s_30000039.jpg
王安石传,2010-02-01 00:00:00,人物传记-军政领袖,干百年来，王安石被骂作集一切乱臣贼子之大成的元凶。其实，他是数千年中华文明史上少见的完人。其德量汪然若干顷之陂，其气节岳然若万仞之壁，其学术集九流之粹，其文章起八代之衰，其所设施之事功，适应于时代之要求而救其弊，其良法美意，往往传诸今日莫之能废。,9,663,0,2,https://wfqqreader-1252317822.image.myqcloud.com/cover/368/151368/s_151368.jpg
拿破仑传（中小学生必读丛书）,2009-08-01 00:00:00,人物传记-军政领袖,法国近代史上著名的军事家和政治家，人称“奇迹创造者”：法兰西第一共和国第一执政，法兰西第一帝国皇帝，兼任意大利国王、莱茵联邦的保护人、瑞士联邦的仲裁者：曾经占领过西欧和中欧的大部分领土，使法国资产阶级革俞的思想得到了更为广泛的传播。,14,704,0,0.9,https://wfqqreader-1252317822.image.myqcloud.com/cover/649/166649/s_166649.jpg
帝国骑士：二战时期德国最高战功勋章获得者全卷（第4卷）,2014-03-01 00:00:00,人物传记-军政领袖,《帝国骑士：二战时期德国最高战功勋章获得者全传》（第4卷）为全书收尾之卷，讲述第二十一至第二十七位钻石骑士勋章获得者的传奇经历：二战期间创下121架夜战击坠世界纪录、被敌友双方尊为“里希特霍芬式的传奇人物”的夜战飞行员施瑙费尔少校；既被称为“二战期间击沉击伤敌方战舰最多的军人”，又被后人视作“U艇艇长高估战果的最典型代表”的布兰迪海军中校；两次大战期间均获最高战功勋章，既有“死忠纳粹的魔鬼将军”之称，同时又是作风彪悍的防御名将的舍尔纳元帅；二战期间凭借出色的战功，三年内从中校营长跃升为装甲兵将军和装甲集团军指挥官，被李德.哈特称为“卓越的装甲兵领袖”、“机动与突袭艺术的大师”的曼陀菲尔；不到36岁就成为德国陆军历史上最年轻的中将，二战期间先后负伤14次，因其惊人的勇敢而被称作“疯子托尔斯多夫”的托尔斯多夫中将；二战期间先后随第20摩托化步兵师，第10、第4和第7装甲师东征西伐，因屡立战功获颁钻石骑士勋章，左腿被截肢后仍然坚持指挥作战的牙医博士毛斯中将；先后担任第4装甲师师长、第39装甲军和“大德意志”装甲军军长、第2集团军和“东普鲁士”集团军指挥官，二战欧洲战场停火的当日被邓尼茨授予最后一枚钻石骑士勋章，拒绝搭乘飞机撤离，坚持与官兵们一起步入苏军战俘营的装甲战术家绍肯。,5,813,0,15.99,https://wfqqreader-1252317822.image.myqcloud.com/cover/137/818137/s_818137.jpg
二战名将传记（套装共六册）,2016-09-01 00:00:00,人物传记-军政领袖,本套书包括《蒙哥马利传》、《巴顿传》、《古德里安传》、《山本五十六传》、《朱可夫传》、《隆美尔传》六本书，写了诸位将领从童年时代到二战指挥的各场重大战役等众多读者感兴趣的内容，其中不乏许多鲜为人知的励志故事，还有对二战局势的重大转折。,10,717,0,14.99,https://wfqqreader-1252317822.image.myqcloud.com/cover/971/23549971/s_23549971.jpg
