title,publishTime,category,intro,maxFreeChapter,newRating,free,price,cover
基辛格：理想主义者,2018-04-01 00:00:00,人物传记-军政领袖,100多箱私人文件，全球111个档案馆的材料，8000余种、合计近40000页的资料……在基辛格的委托下，哈佛大学教授、历史学家尼尔·弗格森研究了海量此前从未公开的历史资料，向人们展示了1969年以前的基辛格——美国历史上至关重要的外交政策理论家。基辛格的思想资本有两个基础：历史研究和理想主义哲学研究。这是一位知识分子的传记，但又不仅仅是一部知识分子的传记，因为在基辛格的思想演变过程中，研究和经验极为紧密地联系在一起，相互影响。这是一部成长小说——既有哲理又带感情的教育故事。基辛格所受的教育分为五个阶段：一，他经历德国暴政，领略美国民主，后来以美国士兵身份回到德国；二，他在哈佛初步接触哲学上的理想主义和历史知识，并成为核战略领域的公共知识分子；第三阶段的他成为纳尔逊·洛克菲勒和肯尼迪总统的顾问，从华盛顿特区的政治现实中吸取了惨痛的教训；第四阶段的他三赴越南，意识到美国无法成为越战的赢家；第五阶段的他在巴黎学会了什么是外交欺骗，直到后来完全出乎意料地接到尼克松总统的任命，成为政府官员。弗格森以为，年轻的基辛格志存高远，的确是一位理想主义者。,8,734,0,118.8,https://wfqqreader-1252317822.image.myqcloud.com/cover/453/934453/s_934453.jpg
司马懿：谁结束了三国？,2013-03-01 00:00:00,人物传记-军政领袖,当孙、曹、刘冢木早拱，诸葛武侯身随秋风，谁来结束三国？他善于审时度势，面对明主如曹操、曹丕，便尽心竭力成为治世能臣，而对幼主庸臣，便默默积蓄力量，努力独揽大权；他度量深沉，面对强敌宁愿受辱装病，也不贸然出击；他又老谋深算，静如处子，动若脱兔，一旦出招就必然成功。他可怕，因为他几乎算无遗策，心狠手辣；他可敬，因为他能忍人所不能忍，成人所不能成；他又会让人觉得有些可悲，因为他一辈子钩心斗角，活得太累。或许政治就是如此残酷，只有司马懿这样又可敬、又可怕、又可悲的人物才能拒诸葛、御孙吴，同时又掏空了曹魏的大权，奠定了结束三国乱世的基础。,8,791,0,19.2,https://wfqqreader-1252317822.image.myqcloud.com/cover/598/24275598/s_24275598.jpg
世界伟人传记丛书：永乐大帝朱棣,2008-08-01 00:00:00,人物传记-军政领袖,"    永乐大帝朱棣是中国历史上一位十分重要的人物。在明朝诸帝中，其丰功伟绩恐怕无人能与之匹敌：韬光养晦，卧薪尝胆，借镇边扫北之机，在为国立功的同时，私蓄日后能为自己夺取皇位拼死效力的文臣武将。征漠北、平安南、通西洋、修大典、建北京，缔造了一个“永乐盛世”。人必有是非功过，他凶杀成性、冷酷无情，成为历史上颇有争议的皇帝。本书以精练的语言为读者朋友逐层揭开了永乐大帝神秘传奇的一生。
",6,638,0,4.99,https://wfqqreader-1252317822.image.myqcloud.com/cover/855/699855/s_699855.jpg
历史的风范：毛泽东的人格魅力,2013-08-01 00:00:00,人物传记-军政领袖,本文以真实的笔触记述了伟大领袖的个人性格和由这些性格所产生的巨大魅力。通过这些既普通、又独具魅力的性格，使人们能够深切感受到在他身上所展现出来的伟大精神、胆略、胸怀、情操、神采和风范。阅读本书，对增强人们的爱国主义情操、促进社会主义的和谐建设都将具有十分积极的现实意义。,7,784,0,15,https://wfqqreader-1252317822.image.myqcloud.com/cover/798/25029798/s_25029798.jpg
武岭梦残：蒋介石在大陆的最后日子,2016-01-01 00:00:00,人物传记-军政领袖,本书以1949年4月25日蒋介石离开故乡登上泰康号兵舰前的情景为引子，记叙蒋介石在大陆最后的日子。全书选取1949年蒋介石第三次下野、回溪口进谱寻祖、陈仪下台、与李宗仁明争暗斗、逃到成都、最后一次舟山普陀行等一系列历史事件中富有典型性的精彩片段。在忠实于真实记录历史的基础上，通过大量心理描写和细腻刻画，记录了蒋介石在大陆最后日子的政治活动和内心活动。,15,813,0,15.99,https://wfqqreader-1252317822.image.myqcloud.com/cover/268/22167268/s_22167268.jpg
奥巴马传,2012-11-01 00:00:00,人物传记-军政领袖,奥巴马竞选成功，继任美国总统，再次成为全世界关注的焦点，本书从奥巴马的身世、幼年、成长乃至成功，揭露了这位美国现任总统诸多不为人知的秘密。,18,638,0,3.99,https://wfqqreader-1252317822.image.myqcloud.com/cover/149/176149/s_176149.jpg
特朗普传：激情创造梦想,2016-01-01 00:00:00,人物传记-军政领袖,本书中，唐纳德·特朗普结合自身跌宕起伏的经历，通过大量案例和东山再起、逆市飞扬的真实故事，从独特的视角分析和看待自身成功的秘密——胸怀大志、敢想敢干，唯其如此，方能努力创造波澜壮阔的人生。,9,703,0,7.96,https://wfqqreader-1252317822.image.myqcloud.com/cover/431/22694431/s_22694431.jpg
乾隆王朝,2020-01-01 00:00:00,人物传记-军政领袖,乾隆王朝，到底是一个时代的巅峰还是“饥饿的盛世”？本书将乾隆时代中国的真实情况进行了中立客观的评述，既有朝堂博弈的分析，也有民间社会的观察；深入解读乾隆帝的施政手腕与清帝国的军政风云；从人性化的视角触探乾隆帝心理世界的变化，并阐述由此而给清帝国带来的深远影响；对乾隆帝“十大武功”的军事和政治成就进行详尽而客观的讲述，引人深思。对乾隆朝的历史人物有着细节丰富的刻画和去脸谱化的还原。,60,750,0,34.99,https://wfqqreader-1252317822.image.myqcloud.com/cover/347/32073347/s_32073347.jpg
彭德怀入朝作战纪实,2018-11-01 00:00:00,人物传记-军政领袖,本书依靠文献资料的支撑和历史老人的口述细节，叙述了彭德怀率领志愿军从鸭绿江南岸一直打到三七线，最后固定在三八线、险中取胜的故事。,49,738,0,44.99,https://wfqqreader-1252317822.image.myqcloud.com/cover/400/25060400/s_25060400.jpg
朱元璋全传,2020-03-01 00:00:00,人物传记-军政领袖,朱元璋经典传记讲述朱元璋从乞丐到皇帝的谋略细节。此书以1949年新中国书局版吴晗定本为底本全新修订。公元1344年，安徽淮河流域，旱灾、蝗灾、瘟疫爆发，16岁的农家少年朱元璋，家破人亡，为了混口饭吃，当了和尚，每天扫地上香、烧饭洗衣，还经常受到老和尚的痛骂，不久沦为乞丐……短短25年后，41岁的朱元璋登基称帝，开创大明王朝，此后独掌中国30年，史称“洪武之治”，深刻改写历史走向，影响延绵至今。朱元璋究竟是怎样从和尚一步步登上帝位？坐龙椅统治中国30年，朱元璋的人生又发生了什么？千百年来众说纷纭，有人指其为权力野兽，有人称之为一代雄主。直到史学大家吴晗，二十年中四易其稿，捧出这部被誉为“朱元璋复活之作”的《朱元璋全传》，讲透朱元璋从乞丐到皇帝的全部谋略与细节，朱元璋的真实面目，终于再无任何遮掩，完全坦露在世人面前。,9,871,0,12.99,https://wfqqreader-1252317822.image.myqcloud.com/cover/225/31266225/s_31266225.jpg
朱元璋传（图文典藏版·新版）,2018-02-01 00:00:00,人物传记-军政领袖,本书由吴晗先生在1948年写定。当时作者思想自由，文思活泼，语言生动，正当盛年。在他笔下，一个历经艰辛磨难、乞讨度日的小流氓，一个英勇睿智、气度恢宏的统帅，一个勤政爱民、夙兴夜寐又猜忌心极重、杀戮成性的帝王，这些复杂矛盾的形象活灵活现，共同构成了朱元璋的多面人生。,8,655,0,32.99,https://wfqqreader-1252317822.image.myqcloud.com/cover/128/927128/s_927128.jpg
毛泽东年谱：1893～1949（上卷）（修订本）,2013-12-01 00:00:00,人物传记-军政领袖,这部年谱记述了一代伟人毛泽东一八九三至一九四九年的生平、经历和实践活动，反映了他对中国革命的丰功伟绩，特别是多侧面多角度地体现了他的科学思想体系，包括他的理论观点、战略思想、政策和策略以及关于思想方法和工作方法的论述等，展示了他的思想发展轨迹，反映了他作为中国共产党第一代领导集体的核心把马克思主义的普遍原理同中国革命的具体实践相结合的具体过程，并尽可能地表现他的胸怀、情操、气度和风貌。这部年谱从一个极其重要的方面反映了中国共产党领导新民主主义革命走过的艰难曲折的道路和光辉历程，走到取得全国胜利。,23,899,0,13.2,https://wfqqreader-1252317822.image.myqcloud.com/cover/922/23640922/s_23640922.jpg
莽莽昆仑：粟裕大将征战轶事,2017-07-01 00:00:00,人物传记-军政领袖,粟裕是一位在军事领域占有重要地位和对中国革命做出独特贡献的重要人物。书中，作者生动、客观地刻画了粟裕从山村少年投身革命、井冈红旗转战万里，中原逐鹿捷报频传，率军过江转折历史，战略分歧无端受屈，总参岁月推陈出新的辉煌、曲折、痛苦的一生。作者从小在粟裕身边长大，因而将敬重、感恩、愤怒等情感都融于书稿。作者花费数年时间，走访粟裕当年战斗、工作过的地方，寻访当地的百姓和粟裕的战友，查阅大量的文献资料，用细腻的笔触、丰富的案例，栩栩如生地刻画粟裕勇猛善战、机智果敢的指挥艺术和军事谋略，描述了粟裕威震华夏、无坚不摧的赫赫战功，叙述了粟裕在新中国的国防和军队现代化建设中做出的开拓性贡献以及受委屈后不斤斤计较、仍任劳任怨为党工作的伟大情操，表现了粟裕虚怀若谷、对党忠心耿耿的胸怀，由此，将粟裕的形象衬托得更加性格鲜明。,7,777,0,15,https://wfqqreader-1252317822.image.myqcloud.com/cover/880/32282880/s_32282880.jpg
康熙：君临天下六十年,2012-12-01 00:00:00,人物传记-军政领袖,本书以康熙的一生经历为脉络，从不同的角度来认识康熙，力图还原历史上真实的康熙，为读者朋友们呈现一个复杂、多元的康熙皇帝。,14,651,0,6.99,https://wfqqreader-1252317822.image.myqcloud.com/cover/425/541425/s_541425.jpg
刘少奇（开国领袖画传系列）,2016-01-01 00:00:00,人物传记-军政领袖,刘少奇同志是伟大的马克思主义者，伟大的无产阶级革命家、政治家和理论家，是以*同志为核心的党的*代领导集体的重要成员，党和国家久经考验的卓越的领导人。刘少奇同志为中国人民的解放和新中国的建设，在政治、经济、军事、外交、文化教育和党的建设等领域，都建立了卓著的功勋。他对*思想的形成和发展作出了重要的贡献。刘少奇光辉战斗的一生，同我们党和国家的历史紧密相连。他受到全党、全军和全国各族人民的爱戴，他的名字永垂史册。,22,885,0,22.8,https://wfqqreader-1252317822.image.myqcloud.com/cover/839/25791839/s_25791839.jpg
陈云传（3）,2005-06-01 00:00:00,人物传记-军政领袖,"为纪念陈云同志100周年诞辰，本书以丰富翔实的文献资料，生动细腻地叙述了陈云同志为实现中华民族和中国人民的解放，实现中国的统一、独立、富强,为在中国建立社会主义制度，建设有中国特色社会主义事业而奋斗的波澜壮阔的一生；全面反映了他在参加领导革命斗争、经济建设和党的建设中所表现出的远见卓识和多谋善断的领导才能，以及他坚持真理、实事求是的科学态度和注重调查研究、关心人民群众的工作作风。本书的主要依据是，中央档案馆和中央文献研究室保存的陈云文稿、电报、书信和讲话谈话记录；中共中央文件和有关会议记录；与陈云有过直接接触的同志的回忆录或他们的采访记录；当时的报纸、杂志以及有关的资料和书籍。",4,864,0,18,https://wfqqreader-1252317822.image.myqcloud.com/cover/113/24181113/s_24181113.jpg
伊丽莎白女王传,2018-05-01 00:00:00,人物传记-军政领袖,在《伊丽莎白女王传》中，作家史密斯生动讲述了伊丽莎白二世这位迷人又神秘的女性的传奇人生。她10岁成为王储，因为“爱江山更爱美人”的伯父，成年后立誓此生永保王室的尊严；她在13岁对丈夫一见钟情，结婚后相濡以沫，持之至今；她25岁时登基，从那时起，就经历了异常严苛的评判、动荡不安的岁月；即位多年后，她对戴安娜王妃的态度，差点让四分之一的英国民众呼吁废除君主制；2012年，她打破惯例，在和平年代出席了英国内阁会议……但是，在荣耀和流言的重重迷雾中，她以永恒不变的镇定、智慧和优雅，领导她的国家和英联邦走过了战争和动荡，带领英国王室走过了一个又一个艰难的时刻。对我们而言，在一个剧变的时代，一个不变的女王，或许就是一个传奇。,8,780,0,49.88,https://wfqqreader-1252317822.image.myqcloud.com/cover/434/29106434/s_29106434.jpg
大梦无疆：勇气、想象和现代以色列的建立,2019-09-01 00:00:00,人物传记-军政领袖,二十世纪杰出政治家、以色列前任总理和总统、诺贝尔和平奖得主西蒙·佩雷斯自传；写给下一代以色列和全球领导人的必读书；献给年轻人和内心依旧年轻的人们。西蒙·佩雷斯（Shimon Peres，1923-2016），以色列开国元勋，接连作为财政部部长、国防部部长、外交部部长、总理和总统服务于国家。他是以色列建国一代的最后一人，公职生涯长达66年，亲历并领导了现代以色列从无到有、从弱至强、从一穷二白到创新科技领先世界的全过程，同时也是中东乃至全球重大事件的决策人物。佩雷斯的前半生为维护以色列国家安全和利益付出一切，此后四十余年则为推动中东和平倾尽全力。1994年，由于他为以色列和巴勒斯坦人民之间的和平做出了非凡努力，被授予诺贝尔和平奖。1996年，他成立了开创性的佩雷斯和平与创新中心，专注在全球范围内开发、执行和平构建的项目，赋予年轻一代创新的力量和广阔的视野。西蒙·佩雷斯在完成本书的几周后于2016年9月去世，享年93岁。,10,855,0,39.99,https://wfqqreader-1252317822.image.myqcloud.com/cover/973/26357973/s_26357973.jpg
强人治国：普京传,2012-06-01 00:00:00,人物传记-军政领袖,本书是一部对普京个人经历及其执政生涯的全面记录。本书作者安古斯·洛克斯伯格是英国著名的新闻记者，曾在英国广播公司监听部任职，冷战时期在担任《星期日泰晤士报》驻莫斯科记者期间，曾被俄政府作为间谍驱逐出境。2006年，阴差阳错地成为普京政府的新闻顾问，并得以用三年时间，近距离地观察普京及其统治下的俄罗斯。,10,531,0,6,https://wfqqreader-1252317822.image.myqcloud.com/cover/97/182097/s_182097.jpg
开国领袖画传系列·毛泽东,2018-05-01 00:00:00,人物传记-军政领袖,书稿以精炼的语言、大量珍贵的历史照片，全面地记述了毛泽东从青少年时即投身革命，参加创建中国共产党、人民军队，领导中国革命事业，最终成为伟大的无产阶级革命家的历程，真实地再现了为中国人民的解放事业、社会主义革命和建设事业不懈奋斗、艰辛探索的光辉的一生，以及建立的历史功勋。,22,920,0,30,https://wfqqreader-1252317822.image.myqcloud.com/cover/948/34223948/s_34223948.jpg
格萨尔王传（中文版）,2010-12-01 00:00:00,人物传记-军政领袖,《格萨尔王传》主人公格萨尔一生不畏强暴、不怕艰难险阻，以惊人的毅力和神奇的力量征战四方的英雄故事，热情讴歌了正义战胜邪恶、光明战胜黑暗的斗争。表现了藏族民族英雄格萨尔大王的传奇故事，是中国藏族人民集体创作的一部伟大的英雄史诗。它以藏族的神话、传说、民间故事、民歌和谚语为基础，具有很高的学术价值、美学价值和欣赏价值，是研究古代藏族社会的一部百科全书，被誉为“东方的伊利亚特”与世界上其他一些著名的英雄史诗相比，本书有两个显著特点：第一，它世代相传，至今在藏族群众、尤其是农牧民当中广泛流传，是一部活形态的英雄史诗。一部典型的非物质文化遗产。第二，它是世界上最长的一部英雄史诗，有120多部、100多万诗行、2000多万字。仅就篇幅来讲，堪称世界史诗之最。,7,780,0,14.4,https://wfqqreader-1252317822.image.myqcloud.com/cover/16/23875016/s_23875016.jpg
我忆邓小平,2018-12-01 00:00:00,人物传记-军政领袖,邓小平身边理论智囊，于光远先生遗作，回顾了国务院政治研究室和作者本人在邓小平领导下工作的一段经历，记录了邓小平复出后在思想上拨乱反正、在经济上推行改革开放的这段历史，揭示了一些重大决定和重要文件的出台背景，再现了邓小平在历史重要关头挺身而出、力挽狂澜的政治智慧和非凡气魄。,8,833,0,48,https://wfqqreader-1252317822.image.myqcloud.com/cover/765/24173765/s_24173765.jpg
左宗棠全传,2012-03-01 00:00:00,人物传记-军政领袖,"    左宗棠(1812年11月10日-1885年9月5日)，汉族，字季高，一字朴存，号湘上农人。晚清重臣，军事家，政治家，著名湘军将领，洋务派首领。左宗棠少时屡试不第，转而留意农事，遍读群书，钻研舆地、兵法。后竞因此成为清朝晚期著名大臣，官至东阁大学士、军机大臣，封二等恪靖侯。一生经历了湘军平定太平天国运动，洋务运动，镇压陕甘回变和收复新疆等重要历史事件。
",9,629,0,1.99,https://wfqqreader-1252317822.image.myqcloud.com/cover/879/316879/s_316879.jpg
实录毛泽东4：最后二十年1957—1976（新版）,2018-01-01 00:00:00,人物传记-军政领袖,《实录毛泽东》精选了毛泽东的老师、同学、战友、身边工作人员、亲属以及外国领导人、驻华大使等273人的回忆，全面、客观、翔实地记录了毛泽东的一生。本书对各个时期的重大历史事件都有详细深刻的记录，从历史背景、内中原委、事实真相，以及当事人的亲身感受等方面作了客观生动的写照，细节回忆，寓意深远。本卷为第4卷，由陈云、彭德怀、李锐、张玉凤、赫鲁晓夫、米丘诺维奇等人讲述1956—1976年毛泽东开展整风、反右、发动“大跃进”、召开庐山会议、与前苏联决裂、重提阶级斗争、发动“文革”、与尼克松握手、重病的日子等事件。,5,757,0,15.6,https://wfqqreader-1252317822.image.myqcloud.com/cover/787/928787/s_928787.jpg
毛泽东年谱：1893～1949（中卷）（修订本）,2013-12-01 00:00:00,人物传记-军政领袖,这部年谱记述了一代伟人毛泽东一八九三至一九四九年的生平、经历和实践活动，反映了他对中国革命的丰功伟绩，特别是多侧面多角度地体现了他的科学思想体系，包括他的理论观点、战略思想、政策和策略以及关于思想方法和工作方法的论述等，展示了他的思想发展轨迹，反映了他作为中国共产党第一代领导集体的核心把马克思主义的普遍原理同中国革命的具体实践相结合的具体过程，并尽可能地表现他的胸怀、情操、气度和风貌。这部年谱从一个极其重要的方面反映了中国共产党领导新民主主义革命走过的艰难曲折的道路和光辉历程，走到取得全国胜利。,4,897,0,13.2,https://wfqqreader-1252317822.image.myqcloud.com/cover/924/23640924/s_23640924.jpg
阎锡山全传,2022-07-01 00:00:00,人物传记-军政领袖,"阎锡山字百川(伯川)，号龙池，1883年10月10日(清光绪九年九月初八)，出生于山西省五台县河边村(今定襄县河边镇)一个以经商为主的小地主家庭。九岁入私塾，读过《三字经》等启蒙读物与部分四书五经。14岁辍学，随父阎书堂(字子明)到五台县城内自家开设的吉庆长钱铺学商，参与放债收息及金融投机。1900年在一次投机中惨败，负债两千吊，父子二人被迫逃往太原躲债。
1902年，在太原当店员的阎锡山，考上了山西武备学堂学军。1904年被保送到日本留学，先入东京振武学校，毕业后入日本陆军士官学校第六期。在资产阶级民主革命的影响下，他于1905年10月加入同盟会，曾会见孙中山并参与制订了同盟会的“南响北应”的战略决策，即同盟会在“南部各省起义时，须在晋省遥应”。从此，阎锡山登上了政治舞台。
阎锡山作为一个重要的历史人物在中国近代史上，特别是山西历史上，有着极为重大的作用和影响，这是难以否认的。关于阎锡山，80年代前的学术界基本是以价值性认识取代了考实性认识，在教条化了的政治思维模式的约束下，“反动”的东西是一定要被打倒的，阎锡山一旦被界定为反动军阀，显然就没有生路了。可是，阎锡山毕竟被称为“山西王”，在20世纪的战乱时期，是辛亥革命的推力将他拥上了政治舞台的前沿，统治山西长达38年。
阎锡山政治思想最显著的特点，是贯穿其一生的、以“存在即是真理，需要即是合法”为指要的实用政治理念，这类实用政治理念一般体现在他的统治行为、制度、政策及思想观念之中。",6,0,0,25,https://weread-1258476243.file.myqcloud.com/weread/cover/16/3300023016/s_3300023016.jpg
普京：为俄罗斯而生的万人迷,2015-05-01 00:00:00,人物传记-军政领袖,普京，迄今为止，三届俄罗斯总统，两届俄罗斯总理。他是一个硬汉，更是一个智者；他是俄罗斯复兴的灵魂。本书以时间为脉络，以史实为依据，真实客观地呈现了普京的人生轨迹，包括他的童年生活、爱情婚姻，以及他在克格勃的特工训练和之后在东德的特工职业的经历，尤其重点讲述了他执政后对俄罗斯政治、经济、军事、外交等领域的影响以及他的政治手腕等，力求展现给读者一个鲜活、果敢、智慧、具有独特的个人魅力的普京，让读者了解他之所以深受俄罗斯民众的爱戴，被人们誉为俄罗斯政坛的一代“男神”原因。,5,696,0,2,https://wfqqreader-1252317822.image.myqcloud.com/cover/781/832781/s_832781.jpg
陈云传（4）,2005-06-01 00:00:00,人物传记-军政领袖,"为纪念陈云同志100周年诞辰，本书以丰富翔实的文献资料，生动细腻地叙述了陈云同志为实现中华民族和中国人民的解放，实现中国的统一、独立、富强,为在中国建立社会主义制度，建设有中国特色社会主义事业而奋斗的波澜壮阔的一生；全面反映了他在参加领导革命斗争、经济建设和党的建设中所表现出的远见卓识和多谋善断的领导才能，以及他坚持真理、实事求是的科学态度和注重调查研究、关心人民群众的工作作风。本书的主要依据是，中央档案馆和中央文献研究室保存的陈云文稿、电报、书信和讲话谈话记录；中共中央文件和有关会议记录；与陈云有过直接接触的同志的回忆录或他们的采访记录；当时的报纸、杂志以及有关的资料和书籍。",4,835,0,18,https://wfqqreader-1252317822.image.myqcloud.com/cover/116/24181116/s_24181116.jpg
希特勒,2016-06-01 00:00:00,人物传记-军政领袖,本书以全新的角度——从人性的角度刻画希特勒，把这个战争狂人的一生与二战的恐怖展现得淋漓尽致。,2,596,0,5.99,https://wfqqreader-1252317822.image.myqcloud.com/cover/710/33589710/s_33589710.jpg
至暗时刻：力挽狂澜的丘吉尔,2019-07-01 00:00:00,人物传记-军政领袖,2018年世界影坛口碑之作《至暗时刻》历史传记原著，奥斯卡最佳影片《波西米亚狂想曲》金牌编剧安东尼·麦卡滕唯一出版成书的作品。一九四〇年五月十日，在战场和政坛上均“不靠谱”的温斯顿·丘吉尔意外升为首相。时希特勒大军横扫欧洲大陆，英国远征军危在旦夕，英伦之岛或将须臾遭受入侵。丘吉尔相位未稳，其组建的战时内阁矛盾重重，主张与纳粹媾和的声音不绝于耳；丘吉尔本人似也有了动摇，陷入深忧与自疑——是要不计代价主张和平抑或不惜代价赢得胜利？这是历史上的至暗时刻，也是丘吉尔自己的至暗时刻。在《至暗时刻：力挽狂澜的丘吉尔》中，作者安东尼·麦卡滕把丘吉尔复原为一个不完美的、有血有肉的人，聚焦丘吉尔和他的战时内阁，展现他在危急时刻的领袖品质，讲述了1940年5月7日挪威辩论至1940年6月4日敦刻尔克撤退完成的一段激荡历史。,4,704,0,34.99,https://wfqqreader-1252317822.image.myqcloud.com/cover/845/25890845/s_25890845.jpg
