title,publishTime,category,intro,maxFreeChapter,newRating,free,price,cover
反思史学与史学反思,2016-05-01 00:00:00,历史-历史文化,《反思史学与史学反思》是著名历史人类学家王明珂的新作，其内容是《华夏边缘》《羌在汉藏之间》《英雄祖先与弟兄民族》《游牧者的抉择》等著作的知识论基础。作者通过人类生态、本相／表相、认同／记忆、文本／情境等概念，提出一种由表相（文本、图像、电影、社会事件等等）认识社会现实本相的分析法。这是一种结合多种社会科学的历史学研究，作者称之为 “反思史学”。同时也是作者作为历史学家对史学的反思。作者希望读者／研究者能因此练就如孙悟空的火眼金睛，能看透被典范知识蒙敝的真实世界及其历史变化过程，对外在世界有真实体认，以及反思与反应。,17,882,0,25,https://wfqqreader-1252317822.image.myqcloud.com/cover/444/24019444/s_24019444.jpg
甲午战争史,2014-04-01 00:00:00,历史-历史文化,在中国近代史上，甲午战争史是具有决定性、全局性和深远性影响的一场重要战争，在一定程度上决定了中日两国在近代的走势。《甲午战争史》是海内外公认的“甲午战争研究第1人”戚其章先生的代表作。在《甲午战争史》中作者以数十年扎实研究为基础，以极为严谨的态度，广采中日及英文资料、档案及已有的研究成果，对战争的背景、过程和影响进行了全面展示，其中揭示的诸多细节和重要结论都成为该领域广为接受的公论，是甲午战争研究领域重要的一部著作。《甲午战争史》史料渊富，考订精严，书中史识不凡，多独到之笔。作者把自己的智慧与心血都灌进了书里，这是他奉献给读者宝贵而真挚的贡品。一一中央民族大学教授，郭毅生　本书引用的一手史料，为数甚多，达一百二十佘种，为其一大特色。对于中日甲午战争发生经过之叙述也十分详尽，可以说是了解战争如何发生的好参考资料。——台北政治大学教授，吴圳义　众所周知，戚其章先生是甲午战争史研究之第1人。……戚其章先生的成果，可以说不仅提高了甲午战争史研究的水平，而且在这个领域的研究方面奠定了一个基础。——日本拓殖大学教授，龟谷隆行,9,826,0,26.5,https://wfqqreader-1252317822.image.myqcloud.com/cover/249/31422249/s_31422249.jpg
极简世界史,2017-04-01 00:00:00,历史-历史文化,《极简世界史》是英国著名作家乔治·威尔斯撰述的一部世界历史，它被称之为“通俗世界史的扛鼎之作”，它像小说一样好看、迷人，一定会让你忍不住一口气读完。威尔斯一生创作过许多作品，涉及文学、科学、历史、社会、政治、哲学等多个领域，而《极简世界史》是他的代表作，也是世界历史书籍的经典著作。在这本书中，作者以无比开阔的视野、轻快简洁的笔调，将物种起源以来的人类历史有条不紊地展现出来，写作角度不拘泥考据，给读者提供一个宏伟、宽广的视野，不仅是一部历史著作，也是一部优秀的科普读物。,22,0,0,18.99,https://wfqqreader-1252317822.image.myqcloud.com/cover/129/25631129/s_25631129.jpg
宗子维城：从考古材料的角度看公元前1000至前250年的中国社会,2017-06-05 00:00:00,历史-历史文化,本书以历史分析的方法来看待中国青铜时代的考古材料，观点新颖，视角独特，论证有力，读后使人耳目一新，可谓近年来关于中国青铜时代研究的典范之作。该书集中体现了如何以日新月异的考古资料为证据，从社会人类学的观点来阐述中国青铜时代晚期的社会结构和社会变化过程这一重要的历史命题。,8,829,0,63.99,https://wfqqreader-1252317822.image.myqcloud.com/cover/547/26675547/s_26675547.jpg
京都中国通史,2022-06-01 00:00:00,历史-历史文化,"本书是由日本历史学家内藤湖南及其弟子冈崎文夫写就的一部中国通史。 
中国历史的发展，本质上是文化的发展。
根据各时代文化发展的不同内容及形式，作者将中国历史划分为上古、中世、近世三个时期，除全面介绍每个时期的重要事件与典型人物之外，还着重阐明了各个时期的制度和文化对中国历史进程的深远影响。
这种影响是通过文化扩散的波动来实现的——中国文化从中原向四周扩散，与临近的少数民族乃至周边国家持续发生碰撞和交融，这一过程贯穿了整个中国历史。 
这种基于文化史观的历史分期理论，为我们重新审视中国历史提供了一种崭新的视角和思考方法。",9,0,0,93,https://weread-1258476243.file.myqcloud.com/weread/cover/18/3300023818/s_3300023818.jpg
历史学与社会理论（第2版）,2019-11-01 00:00:00,历史-历史文化,　　社会理论对历史学家来说有什么用？历史学对社会理论家又有什么用？作为一位杰出的文化史学家，伯克在此书中对这两个乍看简单的问题作了清晰有力、影响深远的回答。这个经典文本的第2版作了修改和更新，伯克重新检讨了历史和社会科学这两个领域的关系以及它们在最近几十年间的初步交汇。《历史学与社会理论》的第2版将会通过挑战对历史学和社会科学之角色的当下定位，继续激励学生和学者跨越学科边界。,15,841,0,42,https://wfqqreader-1252317822.image.myqcloud.com/cover/254/31422254/s_31422254.jpg
能源传：一部人类生存危机史,2020-06-01 00:00:00,历史-历史文化,能源问题是人类社会的根本问题，读懂了能源史，也就读懂了人类史。能源可能引发战争，也能促成国际合作；能源催生工业革命，也会引发经济危机；能源推动科技发展，也能造成环境破坏……普利策奖、美国国家图书奖、美国国家书评人协会奖得主，核能专家理查德·罗兹力作！翻开本书，看能源如何从政治、经济、科技等方面主宰人类社会。煤炭、石油、电力等能源加速了工业化、城市化的进程，也造成了过度开发、能源枯竭、煤炭污染、温室效应，核泄漏……知识专业，文本通俗易懂，还有109幅精美插图，被《科克斯书评》称为“专业的历史”、“通俗科学的杰作”！,8,667,0,39.99,https://wfqqreader-1252317822.image.myqcloud.com/cover/205/31702205/s_31702205.jpg
九品官人法研究：科举前史,2020-06-01 00:00:00,历史-历史文化,本书是宫崎市定的代表作。宫崎市定通过搜集分散于史籍本传中的实例，努力找出乡品与官品之间的对应关系，以突破传统的研究模式，准确描摹了九品官人法这一贯穿魏晋南北朝、下迄隋唐的选官制度在300多年间的发展、演变，并以此为线索，将魏晋南北朝的选官制度、职官制度与贵族制度整合在一起，深刻揭示了魏晋南北朝政治制度与中世门阀贵族沉浮兴衰的脉络，为中世选举制度的研究打开了全新的局面，甚至可以说为当时的研究划出了一条分水岭。本书面世以后，即获得学界好评，荣获了日本最高学术大奖“学士院奖”，成为研究中国魏晋南北朝隋唐史的必读经典之作。,29,932,0,48,https://wfqqreader-1252317822.image.myqcloud.com/cover/381/34141381/s_34141381.jpg
中共中央在延安十三年纪实,2019-04-01 00:00:00,历史-历史文化,本书以中共中央在延安时期的基本情况和时间线索为框架，以中共创建组织机构和出台路线方针为基础，以中国共产党形成优良的思想作风和执政经验为重点，运用说理议论和分析概括的写作方法，清晰地勾画出了中共中央在延安十三年的发展轮廓，全面系统的理出了中国共产党在延安时期发展、壮大、成熟、走向胜利的思想源泉和动力源泉。,25,750,0,13.8,https://wfqqreader-1252317822.image.myqcloud.com/cover/8/25450008/s_25450008.jpg
资本之都：21世纪德里的美好与野蛮,2018-08-01 00:00:00,历史-历史文化,"　　全球资本市场为德里带来转变、机会、创新、希望，但也带来被金钱主宰的房地产市场和医疗体制、层出不穷的暴力犯罪、遭滥用污染自然与环境、失能的行政体系与贪污腐败，再加上印巴分治以来一直存在的种族问题，21世纪的德里居民面临了愈发严峻的挑战。无论富人、中产阶级、拾荒者，还是罪犯，无人能置外于这场毁坏与创造的矛盾。作为一个从印度移往英国的二代移民，达斯古普塔以一种既亲切又好奇的心情重新回到自己先祖的土地上，通过自己的观察和对德里居民的采访，以小说家的生花妙笔将德里的历史与当下交织成篇，为城市发展大潮下的疏离与残酷留下客观的纪录——在资本主义和全球化席卷世界的今日，被金钱资本淹没的德里既是许多城市共同的过去，也是许多城市无可避免的未来。
",9,759,0,66,https://wfqqreader-1252317822.image.myqcloud.com/cover/492/29348492/s_29348492.jpg
海南岛传：一座岛屿的前世今生,2020-11-01 00:00:00,历史-历史文化,《海南岛传：一座岛屿的前世今生》是“丝路百城传”丛书中唯一一部以整个岛屿（省）为地理单元的作品。海南岛的自然之魅，已经为无数的眼睛所领受。然而，作为人类生活的一个特殊现场，这里曾经风起云涌、撕心裂肺的一切，却杳然沉入历史的深幽与冰凉。本书以随笔的话语，叙述了这座海岛隐秘而传奇的身世，打捞出沉船一般斑驳的人物与事物，在复活再现的同时并加以辗转演绎，从中榨取出丰盈而令人惊讶的意义与滋味——这恰恰是海南岛最令人神往的所在。,9,773,0,32.99,https://wfqqreader-1252317822.image.myqcloud.com/cover/958/34854958/s_34854958.jpg
西域简史,2017-08-01 00:00:00,历史-历史文化,"西域为汉代以来玉门关、阳关以西地区的总称。在丝绸之路影响下，西域特指汉、唐两代所管辖的今中国新疆大部分及中亚部分地区，位于欧亚大陆中心，是丝绸之路的重要组成部分，是沟通中西的走廊。西域从汉武帝刘彻时起属于汉朝，最初有三十六国。这些古国有着迷离传奇的历史：曾经兴盛的楼兰文明，又谜一样地悄然消逝；汉朝、匈奴和西域诸国的世代恩仇，惊心动魄；张赛、班超经营西域的丰功伟绩，令人景仰……这里有着丰富的物产，有闻名于世的汗血宝马，有汉代才传播到中原的葡萄、石榴……《西域简史》以通俗生动的笔墨，梳理西域三十六国的前生后世，讲述一段扑朔迷离的西域往事。

",22,441,0,7.99,https://wfqqreader-1252317822.image.myqcloud.com/cover/370/918370/s_918370.jpg
花舞大唐春：解读何家村遗宝,2018-07-20 00:00:00,历史-历史文化,书稿原在《广州日报》上以“解密何家村”为题连载。主要围绕1970年西安碑林出土的金银器窖藏展开。何家村窖藏共出土1000多件，分别藏在2个大陶瓮和1个银罐中，材质包括金、银、玉、陶等，做工精细，造型美轮美奂，艺术价值极高，多为唐皇室的日常用品。2004年5月，何家村遗宝中的65件（组）精品在北大首次集中亮相，其中包括杨贵妃佩戴的“香囊”、风流天子唐玄宗的舞马、神秘的“金开元通宝”等。对于何家村遗宝的埋藏之谜、65件（组）器物背后隐藏的故事，齐东方以“解谜”的语气，一一道来。,31,805,0,49,https://wfqqreader-1252317822.image.myqcloud.com/cover/478/29793478/s_29793478.jpg
找寻真实的蒋介石：蒋介石日记解读2,2018-08-01 00:00:00,历史-历史文化,《找寻真实的蒋介石：蒋介石日记解读2》是著名历史学者杨天石研究蒋介石生平及思想的专著。由一系列解读蒋介石日记的论文汇集而成，内容包括国共合作及分裂，抗战期间对日策略，二战期间中国与欧洲各大国之间的关系，蒋介石败走台湾后的反省以及蒋介石的家庭，等等。在书中，杨天石采取从蒋介石的日记入手的独特角度，根据海内外档案、资料馆所存的蒋介石日记的多种版本以及相关史料，经仔细阅读、对照，谨慎地考订和充分解读，深入挖掘了蒋介石的生平经历、思想演变和真实心理，以生动的文笔揭示出蒋介石在历史事件中诸多决策和行为的根源。,29,783,0,20.4,https://wfqqreader-1252317822.image.myqcloud.com/cover/743/27325743/s_27325743.jpg
元代白莲教研究,2017-08-15 00:00:00,历史-历史文化,对元代白莲教进行深入简练的研究，并与吴晗等先生进行商榷。,9,784,0,19,https://wfqqreader-1252317822.image.myqcloud.com/cover/465/29793465/s_29793465.jpg
洛阳伽蓝记,2020-09-01 00:00:00,历史-历史文化,“都城风物”选取中国古代著名都城长安、洛阳、开封、杭州相关的名著四种：包括骆天骧《类编长安志》，记录从西周、汉唐到宋元的长安古迹，以及相关史事；杨衒之《洛阳伽蓝记》，记述北魏时代洛阳城市建制和佛寺建筑，以及相关政治、文化、风俗、人物、艺文、中外交往等；北宋孟元老《东京梦华录》，记述北宋开封的皇城建筑、城内各坊、民众的饮食起居、岁时节令，囊括汴京生活的方方面面；南宋周密《武林旧事》，追忆南宋都城临安城市风貌，详述朝廷典礼﹑山川风俗﹑市肆经纪﹑四时节物﹑教坊乐部等情况。,8,919,0,46.8,https://wfqqreader-1252317822.image.myqcloud.com/cover/144/34868144/s_34868144.jpg
汉民族史记（1-9卷）,2022-02-22 00:00:00,历史-历史文化,本书是中国国内第一部全面记述汉民族发展历史的丛书，继承了司马迁开创的史学传统，运用传统结构模式，创造性地打破了历代王朝的框架，按照民族自身发展的规律，将汉民族历史的呈现分为发展史、区域史、族群史、文化史、风俗史和海外移民史六个层面，宏观而又严谨，大气而又细致，创新中透出对传统的继承，论述中显出学术视野的高远。编著者徐杰舜统领徐桂兰、陈华文、彭清深、韦东超、刘冰清、罗彩娟、杨军、万建中、罗树杰、陈顺宣、周耀明、韦小鹏、丁苏安等专家学者共同完成，本书的撰写，将历史文本与实际调查相结合，从第一卷到第九卷，以翔实丰富的资料，全面、完整、系统、生动地展现了世界上历史连绵不绝的汉民族，五千多年来，从一个原生民族的形成，经族群、文化和风俗的内涵发展，又几经凤凰涅槃，不断重生，直到海外移民，走向世界，以一个高凝聚度且伟岸无比的民族形象，屹立于世界民族之林。,46,0,0,599.99,https://wfqqreader-1252317822.image.myqcloud.com/cover/180/43366180/s_43366180.jpg
远去的都市：1950年代的上海（近世中国）,2015-04-01 00:00:00,历史-历史文化,老上海是否曾消失得无踪影？上海的地方性是否延续？国家“入场”与都市“在场”怎样互动？……如同问题的发掘难以穷尽，几乎每一个问题都大有文章可做，且大有引发新问题的余地。本书仅从“劳动人民”“知识人与文化人”以及“小市民”三个研究主体出发，对1950年代的上海社会文化作一次重访，以期将历史巨变中那个远去的都市拉回到历史的真实中来。,14,897,0,23.7,https://wfqqreader-1252317822.image.myqcloud.com/cover/537/23667537/s_23667537.jpg
中国考古学·两周卷,2011-12-01 00:00:00,历史-历史文化,自公元前1046年武王伐纣建立周王朝，至公元前221年秦始皇建立秦王朝，史称周代。这一时期周武王、周平王分别建都西安与洛阳，由此，史家又以西周、东周称之。《中国考古学·两周卷》介绍了我国考古工作者在20世纪中对两周遗址进行的一系列考古发掘及其研究成果。这些发现在许多方面不仅填补了文献的空白，也从不同视角阐述了周朝八百余年间，创造的比商代更高的历史文明，洞察到东周时期出现社会变革并向封建制度转化的必然趋势。两周是我国青铜时代的巅峰时期。青铜制品中有不少惊世之作，还出现了人工冶铁业。读者可从本卷对两周时期的都城遗址规模、布局与出土物的介绍，了解到当时的社会政治与经济状况；看到周公所制的“礼制”及走向“礼崩乐坏”的过程，感受到古代先民在农业，手工业与艺术文化方面的卓越创造力。进而意识到两周时期的文明成果对后世的文明发展产生巨大而深远的影响。本卷引用资料丰富，涉及内容广泛，对从事考古学、历史学、民族学、艺术史、文物与博物馆等相关学科的研究工作者，都有极高的参考价值。,27,780,0,190,https://wfqqreader-1252317822.image.myqcloud.com/cover/618/709618/s_709618.jpg
公共卫生史,2021-08-01 00:00:00,历史-历史文化,从流行病学的古老源头，到职业健康、母婴保健、营养学的兴起，从人口统计的诞生，到第一次国民健康调查、第一套地方卫生行政体系、第一个国际卫生组织的破土，卫生学泰斗、医学社会史先驱乔治·罗森细数公共卫生史上的重大里程碑，展现政治、经济、科学、思想背景下的卫生大历史，讲述一个关于挫折与前进、迷茫与奋战的故事。《公共卫生史》联结过去与现在，试图从历史中找到公共卫生获得进步的必要条件，以此指明未来的方向。,10,828,0,52.99,https://wfqqreader-1252317822.image.myqcloud.com/cover/386/40131386/s_40131386.jpg
南京城市史,2015-10-01 00:00:00,历史-历史文化,分上、下两编。上编主要回溯古代南京城市成长、变迁历程，对已有定论的内容，叙述从简；提出不同材料或不同看法之处则力求严谨。下编关注的是现代规划出现之后的一百年中，人们面对历史造就的文化名城，如何进行再度建设的问题。,6,900,0,39,https://wfqqreader-1252317822.image.myqcloud.com/cover/264/32915264/s_32915264.jpg
读懂中国青铜器：文化、形式、功能与图案,2016-08-01 00:00:00,历史-历史文化,《读懂中国青铜器》是戴克成对中国青铜器研究的综述。其中可见中国青铜器发展简史，作者对器型的研究，功能的研究，花纹的研究，青铜器演变在中国文化史上的地位，青铜伪器的概况等等。全书图文并茂，图片器物绝大部分均为海外收藏，因此它既可以作为中国青铜器研究收藏的入门教材，读者也可以从中欣赏到海外藏中国青铜的精华。,11,644,0,20,https://wfqqreader-1252317822.image.myqcloud.com/cover/755/909755/s_909755.jpg
考古寻踪：穿越人类历史之旅,2019-06-01 00:00:00,历史-历史文化,这是一部普及型著作，向广大读者介绍考古学和考古研究成果。书中按照人类历史发展的顺序，比较系统地概括了世界范围内各国考古工作者，尤其着重介绍了德国考古工作者所取得的最新重大考古发现和研究成果，是对英、法、美等国家同类著作的重要补充。《考古寻踪：穿越人类历史之旅》语言生动、通俗易懂，概括了人类从旧石器时代猿人几百万年的生理进化和物质文化的漫长发展，经过新石器时代的农耕、畜牧和定居生活，以及青铜器和铁器时代在冶炼加工金属的基础上逐渐出现劳动分工和贫富分化，最终产生社会阶层，出现世界文明古国，一直描述到包括第二次世界大战在内的近现代历史。作者恰到好处地抓住了人类各个历史时期的特点，简明扼要地介绍了人类社会的演变发展进程，同时突出了考古学在研究各历史时期的卓越贡献。,5,727,0,34,https://wfqqreader-1252317822.image.myqcloud.com/cover/748/25949748/s_25949748.jpg
神奇圣人王阳明,2012-06-01 00:00:00,历史-历史文化,王阳明是明朝最杰出的政治家、军事家和哲学家，也是中国历史上极为罕见的立德、立功、立言三不朽的伟人。王阳明的一生都是传奇，他曾是叛逆少年行事乖张，后来怎样潜心向学，终成大器？走上仕途，官场险恶，王阳明如何化险为夷，举重若轻？身为一介书生，王阳明为什么能料敌制胜，用兵如神，只用十四天平定宁王叛乱？目睹政治黑暗，民生疾苦，王阳明如何集儒释道三家之大成，创立阳明心学？在五百年后的今天，神州大地为何掀起王阳明热，将阳明心学视为最后的一剂心灵解药？雾满拦江运用史料，以幽默有趣的笔调为你解密王阳明的传奇一生，从中理清阳明心学的脉络，解读成大事业者必备的终极智慧。,57,651,0,20,https://wfqqreader-1252317822.image.myqcloud.com/cover/644/928644/s_928644.jpg
大宋革新,2016-09-01 00:00:00,历史-历史文化,赵匡胤黄袍加身，柳永流连青楼吟晓风残月。狄天使横冲直撞，包公端坐开封府铁面无私。辽、金、西夏，强敌四起虎视眈眈，汴梁城、临安府，蹴鞠、相扑，依旧歌舞升平。大宋活出了自己的新味道，绝对不同以往。知名学者易中天所著“中华史”最新卷，围绕“革新”这一主题，梳理唐宋变革之际的历史走向，分析宋代不同以往的诸多面向：新生活、新经济、新政权、新形势、新战略，宋是全新、不同以往的，革新的成败得失也值得今人检讨。易中天独有的“易氏品读”风格，又把原本枯燥的历史争斗娓娓道来，风趣易懂，却不乏深刻。本书从大历史观的角度和全局视野观察宋代，分析宋代开国以降的战略部署和决策，又着眼小处，从具体事例和历史人物中发掘大历史的深层脉络。黄袍加身是怎么回事？《清明上河图》里隐藏着哪些历史细节？包拯究竟是谁？狄青因何而死？《大宋革新》回答了这些问题，而且不仅给出答案，更揭示了三千七百年中国文明史里内在的脉络和逻辑。学者易中天，颠覆传统史学著作的写作方法，以优美诗意的语言、独特创新的全球视角，将用五年时间写作六部共三十二卷巨著《易中天中华史》：第一部《先秦》，第二部《秦汉魏晋南北朝》，第三部《隋唐》，第四部《宋元》，第五部《明清》，第六部《近现代》，现已出版前十七卷，进入第四部。跟随《易中天中华史》，我们将进行一场历史寻根之旅，体验夏的质朴、商的绚烂、周的儒雅、汉的强悍、唐的四海为家八方来朝，品味宋的纤细、元的空灵，直至明的世俗，清的官腔。由此解开诸多历史的疑惑：夏商周是王朝吗？先秦诸子都是谁？魏晋风度长什么样？盛唐之音你听过吗？当旅程结束时，我们或将明白：什么是中华根、中华梦、中华魂。,9,787,0,14,https://wfqqreader-1252317822.image.myqcloud.com/cover/198/840198/s_840198.jpg
牛津通识读本：历史之源（中文版）,2013-01-01 00:00:00,历史-历史文化,历史学家是在重建真相，还是在讲述故事？从古希腊历史学家的奇闻逸事到现代历史学家的各种研究方法，《牛津通识读本：历史之源》向我们阐述了我们与历史的关系，以及“历史”作为一门学科是如何演变的。通过一系列史例，作者阿诺德为我们揭示了研究历史和理解历史的方法。我们读完后定会无比兴奋，因为我们不仅能从中发掘过去，还能发掘自己。,6,714,0,10,https://wfqqreader-1252317822.image.myqcloud.com/cover/524/846524/s_846524.jpg
追迹三代,2015-06-01 00:00:00,历史-历史文化,本书由十篇文章构成，以顾颉刚“古史辨”为开端，对夏、商、周考古学发展历程中的重大问题、代表性学者均有细致入微的分析，同时作者秉持客观原则，“述而不论，点到为止”，不对各家观点的优劣进行评骘。,17,804,0,63.99,https://wfqqreader-1252317822.image.myqcloud.com/cover/545/26675545/s_26675545.jpg
欧洲文学史（全2册）,2015-04-02 00:00:00,历史-历史文化,本书概括地叙述了从古希腊开始到一九一七年俄国革命为止的欧洲文学发展的历史，向广大读者，尤其在校大学生，提供一些基本知识。全书分为八章，每章叙述一个时期欧洲文学的轮廓，并紧密联系当时的历史与思潮：每章又分别叙述这一时期若干国家的文学发展，着重论述有代表性的作家和作品，从而构成本书作为文学史的特色。,18,800,0,18,https://wfqqreader-1252317822.image.myqcloud.com/cover/808/31283808/s_31283808.jpg
