title,publishTime,category,intro,maxFreeChapter,newRating,free,price,cover
华夏宝库 耀世华章：陕西历史博物馆,2020-05-01 00:00:00,历史-历史文化,本书精选160多幅图片，图文并茂地介绍了陕西历史博物馆的发展沿革、建筑特点，史前、西周、秦、汉、唐和宋元明清的陕西古代文明，以及馆藏青铜器、陶俑、唐代金银器和唐墓壁画等精品系列品文物，展现了中国历史的悠久灿烂和中国古代文明的博大精深。走进陕西历史博物馆，感受周礼秦制的厚重积淀、汉风唐韵的千年回响、宋元明清的文脉绵长，坚信中华文明的源远流长，会让你读懂西安、读懂陕西、读懂古代中国，增强文化自信。,24,0,0,64.99,https://wfqqreader-1252317822.image.myqcloud.com/cover/378/41448378/s_41448378.jpg
大清皇陵之隐密的容妃陵,2021-06-01 00:00:00,历史-历史文化,《大清皇陵之隐秘的容妃陵》书稿以电脑复原香妃头骨为起因，通过介绍葬有“香妃”的园寝和发现盗口，以及历史上曾有的香妃画像，打开了民间的香妃与清宫容妃的关系，以此为线索介绍了容妃地宫的开启、清理和研究过程。同时，作者利用自身独特的环境，以清宫档案为依据，清晰、完整地介绍了清朝后妃的丧葬制度及其陵寝的规制特点。书稿中收录100多张珍贵图片，作者利用自身独特的环境优势，以清宫档案为依据，清晰、完整地介绍了清朝后妃的丧葬制度及陵寝的规制特点。,11,0,0,46.4,https://wfqqreader-1252317822.image.myqcloud.com/cover/716/43280716/s_43280716.jpg
武汉学研究（2019年第2期/总第2期）,2020-10-01 00:00:00,历史-历史文化,《武汉学研究》集刊以贴近武汉、研究武汉、服务武汉为基本宗旨，坚持学术性与应用性并重、专业性与实效性并举的办刊思路，坚持严谨求实的学风、首发原创的刊风，积极发挥理论创新、舆论引导、咨政建言、服务社会的基本功能，为地方学、城市学研究探索创新的理论和方法，为提升武汉城市文化软实力作贡献，为建设现代化国际化生态化大武汉、全面开启复兴大武汉新征程提供智力支持与精神支撑。,26,0,0,93.84,https://wfqqreader-1252317822.image.myqcloud.com/cover/265/37567265/s_37567265.jpg
石话实说,2011-12-01 00:00:00,历史-历史文化,"“告诉您最想知道的石家庄一百个故事”，一直是我们的愿望，随着大型系列文化节目《石话实说》的播出和结集出版，今天终于如愿以偿了。三十万年前，石家庄人的先祖就在太行山下、滹沱河畔点燃文明火种，直到今天，演进为拥有千万人口的繁华都市。这条波澜壮阔、星光璀璨的历史长河属于中国，属于世界。全景记述这亘古的传奇是石家庄广播电视台应当具有的文化自觉与文化担当。
",30,0,0,1.99,https://wfqqreader-1252317822.image.myqcloud.com/cover/80/228080/s_228080.jpg
京华通览：北京皇家坛庙,2018-08-01 00:00:00,历史-历史文化,本书是《京华通览》的一个分册。北京的园林源远流长，远在春秋战国时期的燕都蓟城，即开始有了北京最早的园林。本书详细讲述了一直以皇家宫苑建设为主线不断发展的古代园林和与其相随的坛庙园林、陵园、宅园、寺观园林等。,10,0,0,19.99,https://wfqqreader-1252317822.image.myqcloud.com/cover/836/25802836/s_25802836.jpg
隋唐墓志婉辞研究,2020-05-01 00:00:00,历史-历史文化,石刻语料“从传统金石学走向系统科学研究，要完成的任务十分繁重”。本书尝试在墓志精细研究背景下，做出一定程度综合探讨。如对比南北朝墓志用词，总结出隋唐墓志的消亡婉词93个，唐墓志新出婉词35例。又，利用隋唐墓志双音词语料，将相关辞书中21个词语的首出例证有所提前，并对其中14个缺失义项和四类词例进行补充。同时通过集中关注占隋唐墓志总量四分之一的隋唐女性墓志文，初步说明中古与近代之初女性墓志的用语差异。另，适应汉语语篇特点，首次以出土文献为语料，归纳出中古墓志语篇衔接的四个因素。本书的硏究，方法上综合语言各要素探索墓志语料价值。内容上，婉辞反映了婚丧等礼俗变迁及评判用语的结构方式；有助于相关工具书的完善；涉及墓志行文所载唐人文献、墓志引经词语等，也是对墓志材料本体研究角度的扩展。,13,0,0,89.99,https://wfqqreader-1252317822.image.myqcloud.com/cover/332/34867332/s_34867332.jpg
宋代石刻功能的多元透视与文学个案分析,2020-03-01 00:00:00,历史-历史文化,宋代石刻已经成为一种重要的政治、文化与文学传播媒介。本书上编从传播学角度入手，深入分析了宋代石刻的政治、文化、文学创作与文学传播功能。宋代石刻通过政治影响到宋代文学兴衰变迁的大趋向，石刻与宋代文化精神形成了有力的双向互动，石刻通过文化影响到宋代文学的本质与风貌，强化了宋代文学重道明理的本质性特征。石刻的庄严性、持久性契合了宋人文以载道、立言不朽的创作心理，刻石对创作是一种有力的召唤与促进，人们通过刻石树立起典范，引导文风，促进创作。石刻传播是一种双信道多层面的综合传播方式，它集中了口传、抄写、结集镂印等传播方式的部分优点，是单篇作品最有力的传播方式。本书下编分别以苏轼石刻作品、溪石刻及《醉翁亭记》石刻为对象进行个案研究，通过对宋代石刻与作家作品关系的细部剖析，探索从石刻与刻石活动入手，进行石刻与文学研究的有效方法。,12,0,0,99.99,https://wfqqreader-1252317822.image.myqcloud.com/cover/391/34867391/s_34867391.jpg
追寻三星堆：探访长江流域的青铜文明,2021-09-01 00:00:00,历史-历史文化,《追寻三星堆》以三星堆遗址为出发点和核心，对长江流域的青铜文明诸遗址进行了踏访和追寻，由此带领我们走进三星堆和它的时代。分上下两部分，上篇“最美三星堆”以三星堆为轴，讲述与它有关的古蜀国神话传说、葛维汉的研究史、宝墩遗址和金沙遗址，重点介绍了2020—2021年新发掘的三至八号坑的考古发现；下篇由三星堆延展至长江流域的青铜文明，对盘龙城、汉中、炭河里、新干大洋洲等遗址进行了采访书中汇集了记者的探访采编，对李伯谦、孙华、施劲松等学者的访问，对所涉遗址背景资料的介绍，从记者、学者的不同角度，对三星堆和它的时代进行了全方位的揭示。,7,0,0,52.8,https://wfqqreader-1252317822.image.myqcloud.com/cover/134/43389134/s_43389134.jpg
王天有史学论集,2018-10-01 00:00:00,历史-历史文化,本书收录了作者生前撰写的史学论文、札记、序、评等三十余篇，主题集中于明清政治史，对于明代历史中的“大问题”、热点问题，如明代的历史地位、郑和下西洋、东林党议等，多有涉及。如《晚明东林党议》一篇，详细论述了东林党的起源、流变、在明代晚期所发挥的作用等，并给予了详切公允的评价，曾以专书形式发表，至今仍是该领域具有代表性的重要著作。其他如《有关明史地位的四个问题》《明代政制论纲》《试论明代的科道官》《试论穆宗大阅与俺答封贡》等，从不同角度对明代政治史进行了深入阐述，饶具参考意义。,13,0,0,68,https://wfqqreader-1252317822.image.myqcloud.com/cover/324/26833324/s_26833324.jpg
发现燕然山铭,2018-08-01 00:00:00,历史-历史文化,"东汉永元元年（89年），车骑将军窦宪联合南单于、东乌桓等势力一起攻打北匈奴，一直打到燕然山，大获全胜，几乎全歼北匈奴的主力。这一战役在历史上非常著名，当时随军出征的班固撰写了这篇流传千古的《燕然山铭》。
二〇一七年七八月间，中蒙联合考察队实地踏勘，确定了蒙古国杭爱山一带的一处摩崖石刻系东汉史学家班固所作《燕然山铭》。这一发现，引起了社会公众的广泛关注。北京大学历史系辛德勇教授认为，“学术界有责任和义务做出应有的说明和认识”，陆续撰写了“《燕然山铭》漫笔”系列文章，遂成《发现燕然山铭》一书。该书对《燕然山铭》拓本真赝、铭文布局、铭文核校、刻者其谁、燕然山战役，等等，都做了详细而深入的考证。",14,752,0,29.4,https://wfqqreader-1252317822.image.myqcloud.com/cover/815/23358815/s_23358815.jpg
乾坤寥廓日月长：天津市和平区政协历年文史资料精编,2019-09-01 00:00:00,历史-历史文化,今年是新中国和人民政协成立70周年，本书特为此纪念而编辑。近些年，天津市和平区政协本着“存史、资政、团结、育人”的方针，征集出版了一批文史资料图书，本书就是由2007年至2019年出版的这些图书精编而成。本书共选编了69篇文章，分为10个栏目，涉及天津著名的地界如紫竹林、海光寺、小白楼，天津的老字号、老银行、老学校、老餐饮，天津的百年航运、文化名人、抗战历史，等等，旨在讲好天津故事，传承历史文化，助推文化旅游发展。,34,0,0,29.4,https://wfqqreader-1252317822.image.myqcloud.com/cover/519/33066519/s_33066519.jpg
隋唐辽宋金元史论丛（第五辑）,2015-06-01 00:00:00,历史-历史文化,本论丛集中展示中国社会科学院历史所隋唐辽宋金元史重点学科研究室研究人员的研究成果，每期并邀约业界知名人士撰写专稿，内容集隋唐、宋、辽、金元史为一体，举凡政治、经济、宗教、考古、艺术等领域均有专论，以大历史、大视野的角度对中国古代史进行全面考察，以重视史料、不尚空言，关注问题、鼓励创新为特色。,18,0,0,44,https://wfqqreader-1252317822.image.myqcloud.com/cover/495/26675495/s_26675495.jpg
职贡图：古代中国人眼中的域外世界,2017-08-01 00:00:00,历史-历史文化,清朝时期关于外国见闻的文献主要是《皇清职贡图》和《万国来朝图》，从两种文献的名称不难看出，有清一代，当局及王朝精英的世界观仍沿袭中国自古而来的天下观，同时以夷夏之限判分文明与野蛮之界。中国周边的朝鲜、安南、暹罗、苏禄、缅甸、南掌、汶莱、吕宋等国，自清之前就被纳入环绕中华文明的“朝贡秩序”，关外来的清朝统治者除了继承和强化这种安排外，也无法做出自己的创新。从《职贡图》可以看出，清朝统治者无疑对周边各国更为熟悉，而且更习惯以东亚文明中心自居，居高临下地对周边各国的历史、现状和社会生活给予评判。,16,435,0,9.9,https://wfqqreader-1252317822.image.myqcloud.com/cover/276/26607276/s_26607276.jpg
京华通览：香山静宜园,2018-08-01 00:00:00,历史-历史文化,本书是《京华通览》的一个分册。静宜园位于北京西北郊的香山，是清代的一座以山地为基址而建成的行宫御苑。全园分为三部分，即内垣、外垣、别垣。内垣在东南部的半山坡的山麓地段，有宫廷区和古刹香山寺、洪光寺两座大型寺庙，其间散布着璎珞岩等自然景观。外垣是香山的高山区，大多为欣赏自然风光之最佳处和因景而构的小园林建筑。本书文字优美典雅、史料坚实，可供广大读者参考。,17,0,0,19.99,https://wfqqreader-1252317822.image.myqcloud.com/cover/827/25802827/s_25802827.jpg
中层理论：东西方思想会通下的中国史研究（增订本）,2015-11-01 00:00:00,历史-历史文化,"    中层理论的建构对于中国史研究的意义至少可表现在两个方面：一是尽量可使我们摆脱宏大叙事的纠缠。目前许多历史著作行文叙述总是宏阔而不细致，概论式的判断比比皆是，本质主义式的断语草草形成，里边唯独看不到日常生活状态下人的踪迹，人变成了冷冰冰的趋势与规律的符号表征。二是讨论如何改变史界只拉车不看路式的工匠型治史方式。作者新刊长序，收入其近十年的反思，趋向更加圆融的历史叙事。
",11,0,0,19.2,https://wfqqreader-1252317822.image.myqcloud.com/cover/784/26346784/s_26346784.jpg
清代西藏史研究,2014-12-01 00:00:00,历史-历史文化,本书从政治、宗教、社会、改革等多方面探讨了清代西藏的历史，以作者独有的视角，揭示了西藏是中国神圣领土不可分割的一部分，在学术上具有创新价值，在政治上亦有现实意义，对百年来的清代西藏史研究进行了全方位的梳理，尤其给人以借鉴和启发。,12,0,0,22.5,https://wfqqreader-1252317822.image.myqcloud.com/cover/735/23509735/s_23509735.jpg
说不尽的大槐树：祖先记忆、家园象征与族群历史,2018-03-01 00:00:00,历史-历史文化,"    山西洪洞大槐树移民的问题，是个真正雅俗共赏、妇孺皆知的话题。即使是在历史上，它也是个士绅和民众都非常关注，并且为之付出许多努力的问题。对于理解历史上文化之共享与互动，了解山西以至华北历史，这是个很好的切入点。更值得探讨的是，大槐树移民传说和广东的南雄珠玑巷移民传说、客家的石壁村移民传说等等传说，所反映的地方历史变迁的过程。这个问题牵扯到历史时期区域开发的问题、宗族的问题、信仰的问题、士绅的问题、族群的问题，特别是军事制度的问题。惟有如此，才能真正或者比较准确地理解这类传说的产生和流布。这一步步深入的过程，也正体现了作者关于区域社会史或者历史人类学的方法论意义的思考和阐述。
",5,721,0,15.6,https://wfqqreader-1252317822.image.myqcloud.com/cover/725/26346725/s_26346725.jpg
海南历史文化（第三卷）,2013-05-01 00:00:00,历史-历史文化,《海南历史文化》是海南省人文社科基地——海南省海南历史文化研究基地的机关刊物。本期为“第三卷”，共收录取论文19篇，分属于“名家特稿”“海南移民史”“南洋文化研究”“海南非物质文化遗产研究”“域外文评”等不同版块。本期突出专题研究的特色，在围绕海南历史研究和南海文化研究这一共同主题之下，既保持内在联系，又相互区别，所收论文各具特点。本期尝试从历史走向文化，在海南传统历史研究的基础上，侧重对海南地方文化的抒写，尤其是在“大文化”概念下的研究，兼顾理论性和实证性、地方性和全国性，集中展现出关于海南历史文化研究的最新动向。,7,0,0,14.7,https://wfqqreader-1252317822.image.myqcloud.com/cover/171/23510171/s_23510171.jpg
彝文古籍与西南边疆历史,2013-01-01 00:00:00,历史-历史文化,本书是通过彝文古籍，对西南边疆的历史、文化、风俗、军事等方面进行的研究。本书以秦汉时期滇东北、川南、黔西北地区所用的彝文原著译本为主要研究对象，结合考古学、民族学、语言学、文献学等多学科，以“彝人、彝语”的崭新视角重新审视西南边疆档案史料中存在的疑难问题。首次将我国少数民族古籍中的彝文史料做了系统的开创性研究，有理有据、观点鲜明，不乏鲜为人知的第一手史料，对丰富西南民族史、地方史，保护文化的多样性具有重要意义。,18,0,0,28.8,https://wfqqreader-1252317822.image.myqcloud.com/cover/495/23510495/s_23510495.jpg
春秋逸谭：平凉历史掌故选（全2册）,2018-04-30 00:00:00,历史-历史文化,“人文平凉”丛书一套5本（暂定名《平凉诗词》《崆峒诗词》《平凉游踪》《平凉掌故》《平凉金石》），编者姓名：茹坚、李世恩、魏柏树、李业辉等。前两册精选古代至民国历代诗人所写崆峒山及平凉其他地方的各类诗词曲赋，略作简注。第三册精选历代作者所写平凉山川名胜、风土人情的游记。第四册精选有关掌故。第五册精选当地重要金石碑刻。,25,0,0,34,https://wfqqreader-1252317822.image.myqcloud.com/cover/100/23562100/s_23562100.jpg
不可不知的古代地中海文明史,2019-09-01 00:00:00,历史-历史文化,古典文明是现代西方文明的源头与摇篮，故而它也是地中海文明史上不可或缺也是为重要的一环。地中海的帝国时代则可谓是文明的“一体化”时期，它是地中海地区人类早期文明为辉煌的时代。本书主要介绍了从公元前四千纪到公元476年西罗马帝国灭亡这一漫长历史时期在地中海沿岸所出现的古代文明，其中包括古代两河流域文明、古代埃及文明、古代叙利亚文明、古代安纳托利亚文明、古代希腊和古代罗马文明等内容，层层揭开地中海古老而神秘的文明面纱，探索人类早期文明史。,10,0,0,17.5,https://wfqqreader-1252317822.image.myqcloud.com/cover/128/33276128/s_33276128.jpg
从疾病到人心：中古医疗社会史再探,2020-06-27 00:00:00,历史-历史文化,古人如何面对瘟疫？瘴气是真实存在抑或只是出自人心的幻想？古时候的医患关系是怎样的，他们也有医患矛盾吗？于赓哲教授长期致力于中国中古时期医疗社会史的研究，认为“疾病比很多因素更能长远影响人类历史”，“在摸索人与社会甚至人性的基本规律的时候，医疗与疾病是一个绝佳的窗口”，本书通过对海内外大量史料的爬梳整理，剖析实际案例，探索疾病与人心、医疗与社会、中医与西医之间的关系，尝试发掘文字背后隐藏的史实，并提供一种思路，试图将传统医学从“科学还是迷信”的窠臼中拉回来，还原中国古代医学本来面貌。其切入点既有医学史研究的回顾与展望、医者形象的模塑、医患关系的探讨，亦有对古代的卫生体系、瘟疫致与治的思维模式、性病对青楼文化的影响、宋代墓葬壁画背后的医药文化等问题的思考。,12,850,0,40.8,https://wfqqreader-1252317822.image.myqcloud.com/cover/77/33230077/s_33230077.jpg
镜像中的历史,2018-01-01 00:00:00,历史-历史文化,历史写作是将不在场的事物呈现给读者，是一种代理表象行为，因此，书写者需要时刻叩问自身的有限性。本书收录了作者近15年22篇长短文，展示了从社会史、心性史（记忆研究）、概念史三个角度切入历史的可能性，既是作者实践其“全球本土化”（glocalization）叙事的实录，也是了解当代新史学的一面镜子。,9,0,0,19.2,https://wfqqreader-1252317822.image.myqcloud.com/cover/668/26346668/s_26346668.jpg
普洱史话（中国史话·社会系列）,2014-12-01 00:00:00,历史-历史文化,《普洱史话》以历史沿革为线索，以历史事件和历史人物为节点，把发生在普洱大地几千年的历史，用简明扼要的形式加以叙述，从商周到现代、从文化到产业、从自然到景观、从传说到现实。这里有上苍撒落在人间伊甸园的生动故事，也有民族民间的美丽传说；有各族人民抗击外来侵略的爱国激情，也有保护陆地最大的绿洲的强烈意识。,14,0,0,7.5,https://wfqqreader-1252317822.image.myqcloud.com/cover/214/23668214/s_23668214.jpg
三千年冤狱,2016-03-10 00:00:00,历史-历史文化,本书用丰富的史料和简洁的语言，系统梳理了各朝各代所发生的一系列冤假错案，如春秋血亲冤杀骨肉相残、秦朝李斯被污谋反案、明朝时期的空印案与郭桓贪污案、清朝顺治时期丁酉乡试案中的冤滥等。在历述历代冤案的同时，作者对中国传统社会“法治”的整体发展历程也进行了详细的论述，从夏商周诸刑、战国变法到大清会典的完成，试图从中挖掘冤狱频繁的深层次原因，以期对中国的法制现代化建设提供有关的历史借鉴。,4,0,0,19.99,https://weread-1258476243.file.myqcloud.com/weread/cover/11/3300010411/s_3300010411.jpg
史潮与学风（天下文丛）,2014-03-01 00:00:00,历史-历史文化,学者治学离不开他生活的时代。时代对学者治学的影响主要表现了两个方面：一是学术潮流，一是学术风气。本书以“史潮与学风”为题，不仅是因为它们是治学大环境的主要要素，而且更因为它们在当今的中国具有特别重要的意义。作者从过去十多年发表的相关文章、讲话和采访中，选出18篇，结为这本集子，分为“史潮”与“学风”两编，每编各有三组文章，分别讨论一个专题；“学风编”有一篇关于大学应该培养什么样的人才的附录。这些文章结集出版时，仅作了个别的改动。希望读者采取“各取所需”的态度，从中获取对自己有用的东西。倘若能够对读者在治学（特别是治史）方面有所帮助，那么本书的目的也就达到了。,4,0,0,19.2,https://wfqqreader-1252317822.image.myqcloud.com/cover/685/26244685/s_26244685.jpg
府谷县志（1990～2010）,2020-08-01 00:00:00,历史-历史文化,《府谷县志（1990～2010）是以马列主义、毛泽东思想、邓小平理论、“三个代表”重要思想、科学发展观和新时代中国特色社会主义思想为指导，坚持“依法修志、实事求是、质量第一”的原则，力求打造精品良作，起到“以史鉴今、启迪后人”和“存史、资政、育人”的作用。本志记述辖区1990年至2010年府谷县全县经济、政治、文化、社会和生态建设状况，由综述、大事记、分编以及附录等部分组成。其中，本志书为了集中展现府谷县地域特色，特设煤炭、乡镇企业、府谷二人台等三编颇具地方特色的内容。,41,0,0,286.4,https://wfqqreader-1252317822.image.myqcloud.com/cover/21/37327021/s_37327021.jpg
秦文字研究,2021-02-01 00:00:00,历史-历史文化,本书涉及历史上社会控制的诸多理论，探讨了个人、司法组织和医疗系统在规范人类行为方面的方法和细节；用大量丰富的事例来阐明社会控制的形成和发展；研究了中央集权制度、种族分化、监控系统的使用、郡县制的普及以及社会信仰等社会控制问题。本书通过对秦社会控制措施的观照，展现秦时期的政治制度及社会风貌，同时对于当前社会具有指导和借鉴意义。,9,0,0,188,https://weread-1258476243.file.myqcloud.com/weread/cover/72/3300008772/s_3300008772.jpg
洛阳史话（中国史话·社会系列）,2017-04-01 00:00:00,历史-历史文化,洛阳从夏至宋三千年间，作为千年帝都，曾经演绎出一幕幕辉煌壮丽的历史画卷。北宋伊始，随着政治中心东移，失去国都地位的洛阳走过了近千年的沉寂之夜。新中国成立后洛阳逐渐崛起，已经成为中国著名的工业基地、旅游胜地，并且正朝着中原最佳人居城市与国际历史文化名城的目标奋进。本书从“天造洛阳”“名都沿革”“科教文艺”“名城崛起”“京洛故事”五个方面记述了洛阳的历史、文化与发展。,11,0,0,12.5,https://wfqqreader-1252317822.image.myqcloud.com/cover/411/23668411/s_23668411.jpg
红楼梦成书传世之谜,2017-08-02 00:00:00,历史-历史文化,《红楼梦》是中国古典文学的最高峰，它写了一个富贵家族的兴盛与衰亡，《红楼梦》被认为是一部现实主义的杰作，作者应该有一定的生活体验，或者是他亲身经历的，或者是他自己见闻过的，才能写出这样的作品。有不少学者认为，《红楼梦》是曹雪芹的自传，写的就是他家自己的事情。那么，这本书真地写的是曹雪芹的家事吗？《红楼梦》从完成到传世也很不容易，几经波折，险些就被毁掉和失传了，我们今天还能看到这书，是因为有很多爱书的人冒着种种风险保护它，而作者曹雪芹也为这书付出了很大代价。因为《红楼梦》是在清代文字狱最盛的时代经过千难万险幸存下来的，那么在这本书的完成过程中，又有哪些未解的谜团呢？,4,586,0,19.44,https://wfqqreader-1252317822.image.myqcloud.com/cover/246/25915246/s_25915246.jpg
中国古钱币赏鉴：崇宁通宝版式详解,2020-11-01 00:00:00,历史-历史文化,崇宁通宝，是宋徽宗赵佶在崇宁年间（1102—1106年）铸行的年号钱。本书汇总了500多个版式的崇宁通宝，并辅以约700幅高清彩色照片，对各个版式进行了详细介绍。第一章介绍了崇宁通宝版式术语，第二章介绍了崇宁通宝小平钱版式，第三章至第七章介绍了崇宁通宝折十钱各类版式。本书对崇宁通宝的介绍系统、全面，有条理，讲解细致，广大钱币爱好者仔细阅读后，不但能认识版式，而且能触类旁通地自行判定崇宁通宝的版式及市场价值。,26,0,0,63.99,https://wfqqreader-1252317822.image.myqcloud.com/cover/644/41807644/s_41807644.jpg
