title,publishTime,category,intro,maxFreeChapter,newRating,free,price,cover
柏杨白话版资治通鉴（全72册）,2020-04-23 00:00:00,历史-历史文化,以史为鉴，知兴替，明得失。柏杨耗时十年，将《资治通鉴》译成现代语言，让一部原本只供帝王将相阅读的史书，飞入寻常百姓家。全书超过1500张地图及宫城图，让读者从图上读懂历史。柏杨查阅史书，增补历朝历代历史名家对相关事件的点评，又以现代人的观点独立撰述“柏杨曰”，使古今对话，思辨激撞，多方面、多角度解读历史事件。随文夹注历史典故、文化常识，标注今地名，帮助读者零基础读懂浩瀚巨著。中国当代文学研究会副会长、北京大学中文系主任陈晓明、中央电视台著名主持人白岩松、著名历史学家唐德刚诚意推荐。,25,877,0,2200,https://wfqqreader-1252317822.image.myqcloud.com/cover/684/31485684/s_31485684.jpg
三国志,2017-01-17 00:00:00,历史-历史文化,《三国志》为西晋陈寿所撰，共六十五卷，其中《魏书》三十卷、《蜀书》十五卷、《吴书》二十卷，主要叙述三国时期的历史，与《史记》、《汉书》、《后汉书》并称“前四史”。南朝宋裴松为之注，引魏晋时人著述两百多种，丰富了陈寿《三国志》文本本身。,21,900,0,44,https://wfqqreader-1252317822.image.myqcloud.com/cover/518/29793518/s_29793518.jpg
血酬定律：中国历史中的生存游戏,2009-04-01 00:00:00,历史-历史文化,本书探讨了不同朝代的性命价格、平民百姓的反抗策略、土匪绑票勒赎的利害逻辑、商贾巨富的抗害手段等主题，深入浅出地为读者说明影响中国历史的终极法则以及社会的形塑原理。作者开创性地提出了“血酬”概念，即流血拼命所得的酬报，及“血酬定律”的三大要点：一、血酬就是以生命为代价从事暴力掠夺的收益。二、当血酬大于成本时，暴力掠夺发生。三、暴力掠夺不创造财富。在暴力掠夺发生时，人类必定权衡成本和收益。成本至少有四类：1、良心。同情心和正义感。2、机会成本。在权衡中，与卖命并列的还有卖力、卖身和卖东西等选项，人们会比较血、汗、身、财的付出与收益。3、人工和物资的消耗。4、暴力对抗带来的风险。无论是暴力镇压，暴力反抗，还是暴力掠夺者之间的竞争，暴力掠夺都要面临一定的伤亡风险。以上四类成本与收益的权衡，每类都能演义出一串历史故事。根据第三个要点，暴力掠夺不创造财富，只能转移财富，这就会引出暴力掠夺者与财富创造者互动的漫长故事。作者吴思为著名历史学者、《炎黄春秋》杂志社原总编辑，代表作有《潜规则：中国历史中的真实游戏》，《血酬定律：中国历史中的生存游戏》、位居近30年来对国人影响最大的图书之列，是了解中国史、中国人和中国社会的必读之书。,8,858,0,7.88,https://wfqqreader-1252317822.image.myqcloud.com/cover/535/823535/s_823535.jpg
国史大纲（全2册）,2011-07-01 00:00:00,历史-历史文化,《国史大纲》是一部中国通史，力求简要，举其大纲，删其琐节。在不到1000页的篇幅里，其人物之详、事业之备，又显示了作者驾驭繁复历史的伟力，整书纲举目张，简繁得当。《国史大纲》纵论中华传统学术思想、政治制度、社会风气之演变发展，兼及中外形势，以求我国家历史之通贯一体，明其治乱盛衰之所由，阐其一脉相承之统系，指陈吾民族生命精神之所寄。钱穆先生著述本书于抗战期间，在国家危亡中，读书人以笔为戎，以“历史最完备之国家”为著述之深厚根基，洋洋洒洒近80万言，荡气回肠，以激扬国人之民族精神，因应现实，更作为抗战建国之镜鉴。,22,897,0,39.99,https://wfqqreader-1252317822.image.myqcloud.com/cover/74/23523074/s_23523074.jpg
中国考古探秘纪实丛书（全11册）,2021-09-01 00:00:00,历史-历史文化,“中国考古探秘纪实丛书”是作家岳南等先后在二十年间写成的叙述中国近年来重大考古与发现的探秘纪实系列作品集，作者采用纪实文学的手法，将发掘全程分层铺开，在考古发掘过程融合大量相关的重要历史背景，人物事件之间自如切换，情节生动，引人入胜。还原考古真相，探秘寻幽纪实，带你走进真实的古墓，为读者展现了风云变幻的历史画卷。全套丛书共计11本，分别为：、《风雪定陵——明定陵地下玄宫洞开记》、《复活的军团——秦始皇陵兵马俑发现记》、《越国之殇——广州南越王墓发掘记》、《万世法门——法门寺地宫佛骨现世记》（商成勇、岳南著）、《天赐王国——三星堆与金沙遗址惊世记》、《寻找祖先——“北京人”头盖骨化石失踪记》、《西汉孤魂——长沙马王堆汉墓发掘记》、《日暮皇陵——清东陵地宫珍宝被盗记》、《千古学案——夏商周断代工程解密记》、《旷世绝响——擂鼓墩曾侯乙墓发掘记》、《绝代兵圣——银雀山破译记》。,126,806,0,313.99,https://wfqqreader-1252317822.image.myqcloud.com/cover/643/41159643/s_41159643.jpg
唐朝穿越指南：长安及各地人民生活手册（新版）,2017-08-01 00:00:00,历史-历史文化,如果有一天，您一睁眼发现自己穿越到了唐朝——不要惊慌，来，拿起这本《唐朝穿越指南：长安及各地人民生活手册》：先过了语言关，学几句中古汉语、唐朝国骂；再混进官府食堂开开小灶，品茶喝酒。记住，像穿越小说中那样大大咧咧走在街上，随手拿出纹银几两是会悲剧的，户口本、暂住证一个也不能少。可随旅行团游览长安城最热门的五大景点，顺便逛逛青楼，看看马球，带上豹子去户外狩猎。更可入乡随俗，像个唐朝人一样过端午、春节、七夕情人节。想洋气一点也没问题，圣诞节唐朝就已有！运气好的话，还能受邀去别人家里做个客，唱K、跳舞，乐不思蜀，最后买套占地十亩限价房。如果您是女士，这本指南能使您掌握长安最潮时尚衣饰。万一落地生根，嫁给唐朝人，也能了解婚礼细节，及婚后各种斗小三秘籍。如果您有心混入政界，本书也提供唐朝公务员薪资、法律和政治制度以供参考；无论您想做文官，做武将，还是想穿越成外国来的留学生，攻略都已为您备好。穿越无限好，乐活在唐朝。,13,754,0,16.99,https://wfqqreader-1252317822.image.myqcloud.com/cover/332/918332/s_918332.jpg
彩图全解资治通鉴（彩图精装）,2013-09-01 00:00:00,历史-历史文化,《资治通鉴》是我国北宋时期著名史学家司马光主持编撰的一部规模空前的史学巨著，由宋神宗取意“鉴于往事，有资于治道”而亲赐名。无论是在史学史，还是在文学史上，它都占有举足轻重的地位，和司马迁的《史记》并称“史学双璧”。全书卷帙浩繁，共294卷，300余万字，记载了上自周威烈王二十三年（公元前403年），下至后周世宗显德六年（公元959年），共1362年的历史，内容以政治、民事和民族关系方面的重要史实为主，兼及经济、文化和历史人物评价，博大精深，通古今之变，有“网罗宏富、体大思精，为前古之所未有”的美誉，备受历代统治者及文人学士的青睐，视之为必读之书。,15,818,0,5.96,https://wfqqreader-1252317822.image.myqcloud.com/cover/293/813293/s_813293.jpg
中国国民性演变史,2020-05-01 00:00:00,历史-历史文化,本书旨在探讨中国国民性格的演变历程。作者认为，国民性并不是一成不变的，从春秋到唐宋，再到明清，中国人的性格如同瀑布一样，飞流直下，越来越恶化。是落后的制度造成了中国人的劣根性。站在空间与时间的双重视角中，本书可说是一部另类的中国通史，也为中国未来的改造和发展寻找真正的出路。,7,733,0,24.99,https://wfqqreader-1252317822.image.myqcloud.com/cover/961/34845961/s_34845961.jpg
中国通史简编,2020-05-01 00:00:00,历史-历史文化,本书由原始公社一直写到鸦片战争，从浩如烟海的历史典籍中选择出真实材料，完整勾勒出古代人民的生活百态，全景概括了工农生产和赋税制度背后的经济问题，精准剖析了古代政治和军事的得失，清楚厘清了学术思想和宗教哲学的交锋与传承，此外还对文学、艺术、外交等方面的发展做出了独到精辟的分析。本书旁征博引、深入浅出、有趣好读，带领读者看清中国历朝历代文治武功成败兴衰的根源，透视古代社会发展的基本法则，为现代社会发展注入鲜活的智慧。,10,784,0,39.99,https://wfqqreader-1252317822.image.myqcloud.com/cover/918/30883918/s_30883918.jpg
左传（全二册）,2015-07-01 00:00:00,历史-历史文化,《春秋左氏传》多以史实解释《春秋》，起自鲁隐公元年（前722年），终于鲁悼公十四年（前454年），比《春秋》增多27年，以记事为主，兼载言论，全面反映了当时的社会历史面貌，既是重要的儒家经典，又是中国第一部完整的编年体史书，在文学上亦有很高的成就。,10,899,0,41,https://wfqqreader-1252317822.image.myqcloud.com/cover/565/29793565/s_29793565.jpg
故宫六百年,2020-04-01 00:00:00,历史-历史文化,故宫无与伦比的宫殿气象，历经六百年风霜，依旧熠熠生辉。故宫的建筑、藏品、人物三者以及其他元素的互动、演绎，成为故宫六百年的历史。本书共100讲，分6个章节，精选200余幅图片，以时间为线索，将明清600多年历史从头细细捋来，分别讲述明代故宫、清代故宫、民国故宫和新中国故宫四个时期的历史，从明永乐十八年（1420年），一直到2020年，再现了故宫整六百年的风云变幻。,17,777,0,138,https://wfqqreader-1252317822.image.myqcloud.com/cover/851/37176851/s_37176851.jpg
治史三书（增订版）,2016-06-01 00:00:00,历史-历史文化,钱穆的得意门生、“中国史学界的朴实楷模”、台湾“中研院”院士严耕望毕生经验倾囊相授。两岸三地历史院系公认治史入门必读，内容涉及历史学研究的基本方法、具体规律、论题选择、论著标准、论文体式、引用材料与注释方式、论文撰写及改订，以及努力途径与生活修养等诸多问题。纪念严耕望诞辰100周年增订版；新增2万字《钱穆传》大陆首发。行销35年经典升级•特约导读•专名索引。《治史三书》是历史学家严耕望先生以个人治学心得为基础，融合梁启超、陈寅恪、傅斯年、钱穆等几代史学大家的治史经验著述而成的一部史学方法论著作，被认为是“金针度人”的治学入门书，语言质朴流畅，诚挚亲切，务求实用，可谓金针度人，功在学林。,11,923,0,30,https://wfqqreader-1252317822.image.myqcloud.com/cover/793/22247793/s_22247793.jpg
春秋大义：中国传统语境下的皇权与学术,2019-03-01 00:00:00,历史-历史文化,《春秋》在中国古代长期被尊为政治哲学的至高圣典，并被认为是唯一由孔子亲手编撰的儒家经典。但《春秋》以微言大义暗藏褒贬，是非常费解的，尤其是经过历代经学家的解读变得越来越芜杂。那么《春秋》以及相关经典是如何在两千年专制社会中发挥实际作用，甚至呼风唤雨的？一贯被当作中国精神的春秋大义，到底是怎样的一种存在？熊逸从唐朝一桩谋杀案讲起，通过大量生动的历史案例，运用翔实考据和缜密逻辑，一层层揭示了上溯至春秋时代的中国经典文化，包括《春秋》“一经三传”、《论语》《老子》等，是如何在皇权政治下被扭曲成了权力的工具的。熊逸对数千年的史实和典籍信手拈来，并让帝王、圣贤、权贵、武将、文士等不同时代的人隔空对话，他也在其中嬉笑怒骂，行文充满真知灼见，文风轻松幽默。当读者沉浸在他的文字世界时，一根绵延两千多年的线索逐渐纤毫毕现。,14,806,0,39.99,https://wfqqreader-1252317822.image.myqcloud.com/cover/912/25670912/s_25670912.jpg
信息简史,2013-12-01 00:00:00,历史-历史文化,人类与信息遭遇的历史由来已久。詹姆斯·格雷克笔下的这段历史出人意料地从非洲的鼓语讲起。非洲土著部落在尚未直接跨越到移动电话之前，曾用鼓声来传递讯息，但他们是如何做到的呢？后续章节进而讲述了这段历史上几个影响深远的关键事件，包括文字的发明、罗伯特·考德里的第一本英语词典、查尔斯·巴贝奇的差分机与爱达·拜伦的程序、沙普兄弟的信号塔与摩尔斯电码。但人类开始自觉地理解和利用信息始于克劳德·香农在1948年创立的信息论。香农的信息论不仅推动了信息技术的发展，也引发了许多学科的信息转向，改变了人们对于诸如麦克斯韦妖、生命的编码、模因、随机性、量子信息论等的理解。部分科学家甚至认为，构成世界的基础不是物质，不是能量，而是信息。正如物理学家约翰·惠勒所说，“万物源自比特”。现如今，信息如洪流般淹没了我们，使我们深陷信息焦虑、信息过载、信息疲劳的困扰。但回顾历史，这并不是件新鲜事，人们也总是能想出应对手段。维基百科、Google便是我们的应对之一。无论对于信息的未来持何态度，有一点是确定无疑的，即我们人类是信息的造物。,12,826,0,39.99,https://wfqqreader-1252317822.image.myqcloud.com/cover/768/907768/s_907768.jpg
中华史纲,2019-06-01 00:00:00,历史-历史文化,《中华史纲》是当代华文世界公认的中国通史杰作。作者李定一教授倾力三十年，初衷是想创作一部可以让读者快速、清晰地了解本民族国史的通俗历史读物。本书从中华世界的形成以至壮大，再历尽波涛汹涌、兴衰起伏，其间有光辉灿烂、耀烁千古的时代，也有暗晦腐蚀、堕落恣戾的时代；有血泪交织、可歌可泣的故事，也不乏卑劣残鄙、糜烂贱污的秽事。无论我们从哪一个角度去批判与评估它的价值，也无论这些批判与评估的内容如何分歧繁复，但有一点我们是可以确定的，即它自成一文化体系，独立发展，与古代的印度、近世的西洋文化，同为人类文化三大类型，均有迥然迥异的贡献。,34,846,0,19.99,https://wfqqreader-1252317822.image.myqcloud.com/cover/927/25205927/s_25205927.jpg
大师讲历史(套装共26册),2020-06-01 00:00:00,历史-历史文化,这是一部宏大的人类简史，读之能让你感叹、激动、掩卷长思；这是一出有血有肉的历史大剧，你能俯瞰历史之河的奔腾不息，也能凝神观察每朵浪花的奇妙瑰丽。本套书共包括《极简中国史》《中国通史简编》《给大家看的中国通史》《给大家看的全球通史》《中国近代史：1840~1937》《中国哲学小史》《草原帝国》《中国近代史》《蒙古帝国的世界征服》《朱元璋传》《明史简述》《历史的镜子》《读史札记》《匈奴帝国七百年》《给大家看的印度通史》《给大家看的日本通史》《南北史演义(上下册)》《唐史演义》《五代史演义》《宋史演义》《元史演义》《明史演义》《清史演义》《民国演义(上下册) 》。,134,811,0,299,https://wfqqreader-1252317822.image.myqcloud.com/cover/944/33500944/s_33500944.jpg
中国历史精神,2012-02-01 00:00:00,历史-历史文化,本书系由钱穆先生讲述之史学精神和史学方法、中国历史上的政治、国防、教育、地理与人物、道德精神七题，经先生亲自修润而成。钱穆先生以渊博之史学涵养、敏锐之剖析能力，使读者得窥中国历史文化之堂奥。,7,787,0,19.99,https://wfqqreader-1252317822.image.myqcloud.com/cover/78/23523078/s_23523078.jpg
跟着文物穿越历史：30件文物里的中国,2021-08-01 00:00:00,历史-历史文化,你知道吗？秦朝的小朋友们就会背九九乘法表了。五代十国的《韩熙载夜宴图》实际上是千年前的“监控录像”。明朝贵妇们也信“包治百病”，黄金打造的高定包包，秒杀现代奢侈品。从夏朝至唐宋明清，古人给我们留下了无数的宝贵文物。文物是中华千年浩瀚历史的物证，通过它们，我们得以看见不同时期的历史文化、人文风俗，近距离感受当时人们的生活细节。《跟着文物穿越历史》跨越五千年，用文物梳理文明。阅读本书，您将踏上一场跨越时空隧道的探险寻秘之旅，感受中华民族灿烂的文化源头，复刻我们每个人内心深处的家国记忆。,5,807,0,45.99,https://wfqqreader-1252317822.image.myqcloud.com/cover/493/40133493/s_40133493.jpg
在故宫寻找苏东坡,2020-06-29 00:00:00,历史-历史文化,本书将故宫收藏的宋元明三个主要朝代的艺术藏品，由书画及人，将苏东坡不同人生阶段的不同生命际遇联系起来，时代的洪流与人物的细节在书中相互交融，不仅仅呈现了苏东坡一生的所有轨迹，更书写了整个宋代的精神文化风貌。,31,866,0,48,https://wfqqreader-1252317822.image.myqcloud.com/cover/10/32880010/s_32880010.jpg
另一半中国史,2015-09-07 00:00:00,历史-历史文化,该书是民族史话的代表作。出版以来双效俱佳。此次我社拿到了专有版权。国家民委、文化部、公安部、国土资源部、新疆维吾尔自治区、贵州省、四川省、江苏省等把该书列为了重点推荐图书。被中组部党员教育中心、国家新闻出版总署出版司、国家图书馆评为全国党员教育创新教材。先后获得山东省社会科学普及十大优秀作品、中国出版集团优秀常销书、出版商务周报风云历史书、中国宝石文学奖。2012年中国广播文艺专家奖一等奖。,9,847,0,23,https://wfqqreader-1252317822.image.myqcloud.com/cover/61/31284061/s_31284061.jpg
忍不住的“关怀”：1949年前后的书生与政治（增订版）,2013-05-01 00:00:00,历史-历史文化,1949年前后的书生与政治。对于20世纪中国的知识分子来说，一个最大的历史悲剧就是，他们是最早投身于救国救民的一群人，自认为最了解政治大势，最后却在政治场中最不知所措、动辄得咎、受人轻视。本书讨论的三人，一位是燕京大学哲学教授张东荪，长期浸淫于政治活动之中，1949年后曾官居政务院委员；一位是报人王芸生，擅长政治评论，多年担任《大公报》主笔；一位是清华教授潘光旦，理科出身，对政治外行却一样曾积极想要为中国政治建言。三人在1949年以前都曾经在不同领域有过出色表现，1949年以后却先后遭遇滑铁卢，人生事业从此一蹶不振。,11,850,0,28.8,https://wfqqreader-1252317822.image.myqcloud.com/cover/823/857823/s_857823.jpg
朱元璋传,2020-05-01 00:00:00,历史-历史文化,在这里，你会看到一个草根的励志神话：16岁时，他因瘟疫而家破人亡，靠着行乞才勉强活下去；28岁时，他从一介草头兵逐步成长为红巾军大帅，成为一方抗元领袖；41岁时，他正式宣告大明王朝诞生，“克复中华”的伟业历经数百年终于实现！朱元璋的每一段传奇，都是坚韧不拔的意志力的胜利！在这里，你还会看到一个完全超乎想象的多面帝王：孤身投军、南征北战，支撑他建立不朽功勋的是咬定青山不放松的意志力！猜忌多疑，专制残暴，为何一个人民的英雄会蜕变为喜怒无常的暴君？看一代明史大师为你还原一个你从未读到过的朱元璋！,8,721,0,20.99,https://wfqqreader-1252317822.image.myqcloud.com/cover/910/33500910/s_33500910.jpg
两晋：风流总被雨打风吹去,2017-05-01 00:00:00,历史-历史文化,"《大清盐商》编剧、《小话西游》作者刘勃全新力作《两晋：风流总被雨打风吹去》，讲述了魏晋南北朝是中国历史的一个岔路口，很多问题都面临着至关重要的抉择：统一还是分裂；贵族政治还是官僚政治；农耕民族还是游牧民族。作者用细腻诙谐的笔触，鲜明形象的人物，非为说史，而是咏怀，再现烽火连天的乱世争霸。
",7,660,0,5.99,https://wfqqreader-1252317822.image.myqcloud.com/cover/18/926018/s_926018.jpg
国家宝藏：100件文物讲述中华文明史,2018-11-01 00:00:00,历史-历史文化,入选百道好书榜！让国宝说话，是我们的宗旨，是我们编辑出版这本书的指路明灯！让国宝说话，讲述中华文化、中华智慧、民族精神、文明发展的伟大历程！让国宝说话，让国宝走出博物馆，走进每一个普通中国人的书斋，走进每一个中国人的内心。让国宝说话，感受历史，放眼未来，让我们为悠久的从未断裂的中华文明而骄傲而自豪！,33,754,0,29.99,https://wfqqreader-1252317822.image.myqcloud.com/cover/870/25351870/s_25351870.jpg
聊聊考古那些事儿,2022-06-01 00:00:00,历史-历史文化,考古人员的日常生活是怎样的？常常灰头土脸，偶尔惊天动地。考古队员们编了顺口溜自我调侃：“远看像逃难的，近看像要饭的，仔细一问是社科院的，原来是文物调查勘探的。” 考古人关心普通百姓的生活起居，一些生活细节，比如他们吃什么、用什么、扔什么。从某种意义上来说，考古学就是一门关于垃圾的学问。我们的发掘对象往往是废墟和垃圾堆，但是我们能从其中探出许多宝物来。考古有啥用？人的历史至少有两三百万年，如果把这两三百万年假设为24小时的话，那么到半夜11点57分之后，才进入有文字的历史。而这之外的漫长人类发展史，要想搞清它的过程，复原它的轨迹，回答诸如我们是谁、我们是怎么来的这类问题，只能依靠考古学了。,4,704,0,68,https://weread-1258476243.file.myqcloud.com/weread/cover/92/3300018892/s_3300018892.jpg
中国文明起源新探,2019-09-30 00:00:00,历史-历史文化,苏秉琦作为中国考古学泰斗之一，其主要学术贡献集中在三本书之中。除了《苏秉琦考古学论述选集》和《华人·中国人·龙的传人》之外，《中国文明起源新探》是他生前最后一部专著，是他在探索中华文化、中华文明和中华传统起源过程中的回顾和心得，也是集一生学术研究之大成的书，还是一本写给对考古学感兴趣的知识大众的通俗读物。书中包含了苏秉琦先生一生的主要学术成就，如中国六大文化区系类型理论，“古文化古城古国”“中国古代国家起源三部曲”和“发展模式三类型”等具有影响力的学术理论；以及90年代初提出世界性的中国考古学。对于今天的考古学研究仍然具有指导性意义。,8,951,0,46.8,https://wfqqreader-1252317822.image.myqcloud.com/cover/377/32959377/s_32959377.jpg
唐浩明评点曾国藩日记,2017-09-01 00:00:00,历史-历史文化,"拂去历史的尘埃，解密遗落的档案。芳香的书页里，有修身的“青云梯”，有齐家的“规矩”，有治国的“利器”，有平天下的“他山之石“。踵武前贤，敦勉后学，思想在路上……作者从曾国藩传世的大量日记中挑选出三百来篇，分为“修身”、“悟道”、“读书”、“国事”、“家事”、“写字”、“品鉴”、“梦境”八个大类，每大类前以一篇总评开始，对所选日记逐一加以评点。其最大特色是篇幅短小、笔调轻松，由表及里地探索曾氏的内心世界，发表作者的读史领悟。通过一个个活生生的具体事例，让读者体会到曾国藩一生之人生智慧与政治智慧，同时感受到清朝末年政治的跌宕起伏风云变幻。
",91,828,0,19.99,https://wfqqreader-1252317822.image.myqcloud.com/cover/229/927229/s_927229.jpg
