title,publishTime,category,intro,maxFreeChapter,newRating,free,price,cover
中国诗歌史通论,2013-03-01 00:00:00,历史-历史文化,赵敏俐、吴思敬主编的《中国诗歌通史》包括：先秦卷、汉代卷、魏晋南北朝卷、隋唐五代卷、宋代卷、辽金元卷、明代卷、清代卷、现代卷、当代卷、少数民族卷。 本书是《中国诗歌通史》的精萃版，通过对中国各时期诗歌的梳理、撰史，确立新的中国诗歌史观，把丰富多彩的中国诗歌现象与近百年来中国诗歌研究方面的成果完整地反映出来。,19,0,0,23.4,https://wfqqreader-1252317822.image.myqcloud.com/cover/933/31283933/s_31283933.jpg
沈腰潘鬓：中国古代文人的风仪与襟抱,2016-10-01 00:00:00,历史-历史文化,这是一部一趣味为路标的很特殊的诗歌审美史，从一个个诗人的境况、生活态度来论及其诗歌的审美，从一个有意思的角度剖析三千年诗人的生活史。,6,0,0,29.4,https://wfqqreader-1252317822.image.myqcloud.com/cover/336/24979336/s_24979336.jpg
历史文化名城名镇名村系列：镇江,2017-11-01 00:00:00,历史-历史文化,习近平总书记曾经指出，要让人“望得见山、看得见水、记得住乡愁”。历史文化名城名镇名村承载着厚重而丰富的历史记忆和文化传统，是“乡愁”的重要载体。保护好江苏历史文化名城名镇名村的特色，就能为我们的家园情怀留下栖息之所——只有留住“乡愁”，才能“记得住乡愁”。2016年底，江苏省文化厅开始组织编写“精彩江苏”丛书，内容涵盖历史文化名城名镇名村、地方戏曲、书画艺术、红色文化等多个方面，这既是江苏优秀传统文化的集中展示，也是延展千年文脉、推动文化建设、凝聚精神力量的创新实践。“精彩江苏”丛书第一辑“历史文化名城名镇名村系列”首批图书正式出版，第一批推出24本。本系列共50本，涵盖我省50座国家级历史文化名城名镇名村，兼具文学性与史学性，展现了江苏历史演变中岁月累积的文化智慧与古物风貌，彰显了江苏人民的文化自信与自觉。丛书采用“口袋本”的形式，深入浅出，图文并茂，装帧精美，便携易读。一卷在手，令读者观尽江苏名城名镇名村之无限精彩。,10,0,0,15,https://wfqqreader-1252317822.image.myqcloud.com/cover/864/27443864/s_27443864.jpg
日本的历史底盘与精神世界（共3册）,2022-07-01 00:00:00,历史-历史文化,"一套书读懂日本史，套装共3册，分别为《简读日本史》《日本论》《世界历史很有趣：袁腾飞讲日本史》
《简读日本史》：日本是一个特别的国家，文化内核超稳定而外表却极易变化，让世人捉摸不定。理解了日本历史的独特性与日本人的精神世界，才能理解日本对东亚、乃至世界历史走向的影响。 
本书从四个维度为读者呈现了一部立体而丰富的日本历史。第一部分从日本人独特的性观念切入，分析日本历史和文化的独特性；第二部分按时间顺序，简述从绳纹时代到明治维新的历史，重点是分析日本为什么进行大化改新，以及大化改新何以失败，对比日本历史轨迹与中国的相似之处；第三部分分析日本人的世界观念以及历史上的中日关系；第四部分则总结日本国民性的成因及特点。 
《日本论》：戴季陶曾留学日本多年，与日本各阶层有过深入的交往，因此对日本有着通透的认识。在本书中，他纵论日本从皇权、国礼、信仰、宗教到武士、财阀、政党、国民的方方面面，用理性的态度对中日两国国民性进行了深刻剖析，用扎实的证据披露了近代中日关系中大量鲜为人知的历史事实。虽已成书近一个世纪，《日本论》仍是中国人了解日本的经典之作。 
本书另附爱尔兰裔日本作家小泉八云所著《日本与日本人》，以帮助读者从心理、哲学角度了解日本人的内心世界和国民特性。
《世界历史很有趣：袁腾飞讲日本史》：此书为系列开山之作;由袁腾飞参考上百本日本史书籍精心创作而成;资料新颖;权威可信;图文结合;有趣、有味、有料;一本书让你读懂从神武天皇到第二次世界大战的日本历史！",18,0,0,74,https://weread-1258476243.file.myqcloud.com/weread/cover/22/3300023822/s_3300023822.jpg
五凉史探,1996-06-01 00:00:00,历史-历史文化,五凉指公元301年-439年在河西走廊存在过的五个地方政权，具体说是前凉、后凉、南凉、西凉、北凉。它们由汉、氐、鲜卑、匈奴等五个民族建立。五凉时期是河西开发的重要时期。这一时期无论在社会经济的发展程度上，在文化教育的繁荣程度上，或是在民族融合的进程上，河西都可与中原地区相媲美。本书是“西北史研究丛书”之《五凉史探》，该书对五凉的政治、经济、文化诸方面进行了全方位探讨，总结其成就，评判其得失，为当时西北史、甘肃史的研究提供了信史。它可供从事相关工作的人员作为参考用书使用。,15,617,0,0.99,https://wfqqreader-1252317822.image.myqcloud.com/cover/176/821176/s_821176.jpg
老北京记忆,2017-03-01 00:00:00,历史-历史文化,这里有原汁原味的北京民俗；这里有地道的京腔京韵；这里有浓厚的北京情结；这里是北京，有一种难以忘却的老北京记忆。北京是一座有着3000多年建城史和800多年建都史的历史文化名城，它与西安、洛阳、南京并称为“中国四大古都”，它拥有7项世界级遗产，是世界上拥有世界文化遗产最多的城市之一，因此北京是您选择文化旅游最合适不过的城市了。那么你真正的了解北京吗？你知道北京在历史上到底有多少个称谓？前门楼真的有九丈九高吗？故宫、天安门的设计又是出自何人之手？老北京四合院为何没有东南角？老北京人是如何过春节的？,12,617,0,9.95,https://wfqqreader-1252317822.image.myqcloud.com/cover/499/22845499/s_22845499.jpg
历史文化名城名镇名村系列：无锡,2017-11-01 00:00:00,历史-历史文化,习近平总书记曾经指出，要让人“望得见山、看得见水、记得住乡愁”。历史文化名城名镇名村承载着厚重而丰富的历史记忆和文化传统，是“乡愁”的重要载体。保护好江苏历史文化名城名镇名村的特色，就能为我们的家园情怀留下栖息之所——只有留住“乡愁”，才能“记得住乡愁”。2016年底，江苏省文化厅开始组织编写“精彩江苏”丛书，内容涵盖历史文化名城名镇名村、地方戏曲、书画艺术、红色文化等多个方面，这既是江苏优秀传统文化的集中展示，也是延展千年文脉、推动文化建设、凝聚精神力量的创新实践。“精彩江苏”丛书第一辑“历史文化名城名镇名村系列”首批图书正式出版，第一批推出24本。本系列共50本，涵盖我省50座国家级历史文化名城名镇名村，兼具文学性与史学性，展现了江苏历史演变中岁月累积的文化智慧与古物风貌，彰显了江苏人民的文化自信与自觉。丛书采用“口袋本”的形式，深入浅出，图文并茂，装帧精美，便携易读。一卷在手，令读者观尽江苏名城名镇名村之无限精彩。,11,0,0,15,https://wfqqreader-1252317822.image.myqcloud.com/cover/868/27443868/s_27443868.jpg
考古所见古代新疆地区的东西方文明交流,2020-06-01 00:00:00,历史-历史文化,近百年来的考古学研究成果显示，古代新疆（或西域）虽是亚欧各大文明的边缘地区，但独特的地理位置使其成为东西方文明交流的汇聚之地。亚欧各大文明与西域本土文明相互碰撞、交融后，塑造出多元的文化面貌，造就了此地独特的发展。本书收录了与新疆地区考古学研究相关的论文13篇，旨在展现新疆作为东西方交流、沟通的桥梁地位，加深世人对古代新疆多元文化的认识。世界各国文明各不相同，各有所长，平等交流、开放包容才能推动人类文明的进步与世界和平发展。,6,0,0,74.99,https://wfqqreader-1252317822.image.myqcloud.com/cover/260/34867260/s_34867260.jpg
税收史话（中国史话·经济系列）,2014-12-01 00:00:00,历史-历史文化,本书以漫笔形式叙述了中国四千多年的税收史实，根据“以时为经，以事为纬；经不断时代脉络，纬不缺税事要项”的原则，对夏、商、西周、春秋战国、秦、汉、三国、两晋、南北朝、隋、唐、五代十国、宋、辽，西夏、金、元、明、清、中华民国、中华人民共和国等各个历史时期的税收史实，分设章节，一一介绍，内容丰实，条理清晰，彰显了各个时期税收制度的特点，昭示了历朝历代治国理税的得失，语言生动有趣，篇章布局自成一体，值得品读存忆。,12,0,0,7.5,https://wfqqreader-1252317822.image.myqcloud.com/cover/366/23668366/s_23668366.jpg
历史与记忆,2021-02-01 00:00:00,历史-历史文化,近年来，“记忆”已成为历史研究领域的核心概念。“记忆”一词既代表着一个新的、独特的研究领域，又代表着一种崭新的途径，借之可以将历史概念化，成为更普遍的探索领域。本书针对关于记忆的各种探讨和理论，提供了容易进入又发人深思的引介，所涉及的主题凝聚着历史学家的普遍关切。全书关注记忆在所谓历史过程中的角色，考察了个体与集体之间、作为遗存的记忆与作为重构的记忆之间，以及记忆与历史作为各种回顾性知识形式之间的关联。,9,0,0,35.99,https://wfqqreader-1252317822.image.myqcloud.com/cover/102/36610102/s_36610102.jpg
世界考古未解之谜　中国考古未解之谜（彩图精装）,2014-06-01 00:00:00,历史-历史文化,文娟主编的这本《世界考古未解之谜中国考古未解之谜》以一种全新的视角来研究与探索世界和中国历史文化，编者在参考了大量历史文献、考古资料的基础上，结合**研究成果，从古代遗址、璀璨文明、墓葬等方面入手，深入开掘掩藏于神秘表象背后的历史与文化玄机，引领读者进入精彩玄妙的未知世界。,42,0,0,5.96,https://wfqqreader-1252317822.image.myqcloud.com/cover/393/813393/s_813393.jpg
源平合战：日本武士的崛起,2020-09-01 00:00:00,历史-历史文化,本书为战争特典系列丛书之一，内容自“承平天庆之乱”起始，介绍平安时代庄园制度崛起的大背景下，武士家族是如何崛起于朝野，走上历史舞台，在走上历史舞台之后，源氏、平氏二家武士大族又是因何对立交战，最终逐鹿天下。 伊势早苗，自幼喜爱日本文化以及日本史，留学海外后，数年来研究日本中世纪史，研读数十部日本史相关一手资料和史籍著作。在网野善彦、上杉和彦等学者著作的启迪下，对日本中世纪史拥有独到的看法与见解，在对日本中世纪历史的普及以及误区的纠正方面有一定的成绩。,25,0,0,39,https://wfqqreader-1252317822.image.myqcloud.com/cover/976/37326976/s_37326976.jpg
晚清女权史,2017-08-01 00:00:00,历史-历史文化,当今国内外有关近代妇女运动的史专著颇多，不少仅是论文的汇编，并非按年代编写的真正史著。有的虽是史著，由于近代包括民国时期，晩清内容受压缩。且妇女运动含有农民，如太平天国、义和团中的妇女问题，也有工人中的女工问题，而非女权问题，所以这些妇运史著作中论述女权史内容进一步受圧缩。本书是目前国际上唯一一本晩清女权史专著。,19,0,0,29.4,https://wfqqreader-1252317822.image.myqcloud.com/cover/60/25171060/s_25171060.jpg
六朝史学与文学,2018-06-01 00:00:00,历史-历史文化,本文旨在深入探讨六朝史学和文学之间的复杂关系。六朝时期虽然南北对峙，朝代更迭，战乱频仍，却是古代学术发展兴盛的重要时期，其中文学和史学各自走向独立和自觉，二者之间往往呈现出交互影响、难分彼此的状态。其间离合异同，错综复杂，颇多交涉，故有可深论者。本文先从目录学出发，调查六朝史籍之存佚情况，充分利用现存史籍和辑佚材料，建立起比较坚实的文献基础。然后择取六朝时期最有特色的一些史学门类及其代表性著作，联系时代背景，就其与六朝文学之关系进行细致和深入的辨析。,9,0,0,46.4,https://wfqqreader-1252317822.image.myqcloud.com/cover/104/26833104/s_26833104.jpg
汉台区志,2018-06-01 00:00:00,历史-历史文化,《汉中市汉台区志（1990—2010）》由汉中市汉台区地方志编纂委员会负责编纂，这部志书既是《汉中市志》的续志，也是汉台区设区以来的首部志书。这部志书横陈百业，纵述史实，编纂工作历经五年，内容涵盖汉中市汉台区自然、经济、政治、军事、文化、社会等诸多领域，较为详备地记述了汉中市汉台区自1990年至2010年这二十年来社会的发展变化情况，旨在见证历史、以史为鉴、启迪后人，是一部较为全面、翔实的资料性科学志书。,61,0,0,144,https://wfqqreader-1252317822.image.myqcloud.com/cover/61/32771061/s_32771061.jpg
江州司马白居易,2014-12-15 00:00:00,历史-历史文化,本书以评传的形式记述了白居易被贬江州的前因后果。作者跟随白居易的足迹，走完了其被贬江州时所走过的路线，还原了白居易被贬五年间的心境变化、创作风格演变。作者将传记与诗文巧妙结合，在记述事情发展的同时，让人清楚诗文创作的背景，也对诗文做了大量评述。,10,0,0,19.99,https://weread-1258476243.file.myqcloud.com/weread/cover/22/3300010422/s_3300010422.jpg
魏晋南北朝唐宋考古文稿辑丛,2020-05-27 00:00:00,历史-历史文化,宿白先生在中国考古学界是位开创范式、建立体系的大家。这本《魏晋南北朝唐宋考古文稿辑丛》收入宿先生三十九篇文章，是历史时期考古学的代表作品，呈现了宿白先生对这一历史阶段考古充分而缜密的思考。全书通过古城沿革发展、墓葬形制变化、寺院遗迹布局等多个角度，对魏晋南北朝唐宋时期的典型考古素材进行了科学的整理——从“古今重叠型城市”长安与洛阳、到宣化辽墓中张家的兴衰史，再到西藏大昭寺的银瓶、青州龙兴寺的窖藏、山西永乐宫的壁画，乃至日本奈良法隆寺的玉虫厨子。宿白先生用一以贯之的考古实践与历史、文献互证的方法，为大量零散考古素材搭建了一个分类、分期明晰的体系，提出了许多有分量的观点，尤其是“城市考古”概念与方法的问世，影响并指导了大批之后的考古工作者。,9,0,0,94.8,https://wfqqreader-1252317822.image.myqcloud.com/cover/654/35035654/s_35035654.jpg
让历史有“实践”：历史人类学思想之旅,2019-01-01 00:00:00,历史-历史文化,“历史人类学”源于20世纪70年代法国年鉴学派的第三代学者，它是汲取人类学等学科的理论方法进行历史研究的跨学科领域，并在90年代进入中国，影响了华南地域社会的历史研究。本书梳理了历史人类学的理论方法及其在华南研究中的部分理论贡献，归纳了历史的实质论、主体论、过程论、实践论的理论框架，并尝试以人类学“实践理论”的视角来思考历史研究。本书内容涉及历史的能动者及其能动实践，历史建构中的资本与象征实践，以及“文治复兴”的共主体实践等。,17,0,0,47.6,https://wfqqreader-1252317822.image.myqcloud.com/cover/514/31794514/s_31794514.jpg
追寻“我们”的根源：中国历史上的民族与国家意识（文史新论）,2018-01-01 00:00:00,历史-历史文化,这是一部论文集，是作者长期理论思考并结合相关史料的研究成果选编，是近年来中国民族史研究难得的佳作。内容共分为四组：第一组凡七篇，泛论中国历史上的族群认同、国家认同以及二者之间的相互关系。第二组的五篇，主要聚焦于如何认识历史上的各少数民族对中国历史与文化的积极贡献。第三组由五篇构成，以蒙古帝国、元朝，以及它们之间的关系为讨论主题。纳入最后一组的四篇论文，则分别考察族群认同在回族、满族的形成和鲜卑拓跋部早期历史的书写之中的作用问题。,7,778,0,48.3,https://wfqqreader-1252317822.image.myqcloud.com/cover/643/23734643/s_23734643.jpg
食物简史,2021-05-01 00:00:00,历史-历史文化,这是一场美食文化之旅，这里展现了文明的成就与进程，从史前到现在，再到未来，作者从美食文化的进程讲起，对关于人类饮食习惯的多个问题做了精妙的解读。一万年前的人类吃什么？火、耕种与畜牧是如何诞生的？古罗马皇帝的餐桌上有什么？中国皇帝呢？他们的人民又吃什么？当总人口超过100亿后会出现食物危机吗？在本书中，作者带领我们通过食物的角度，了解人类的进化史。他讲述的是饥饿是如何塑造文明，食物是怎样促进科技大步前进。它展示了当你坐下用餐时，又有多少文化、社会、经济的因素包含其中。从食物的角度来理解历史，理解社会演进的脉络及历程。风云变幻，当下餐桌食材的背后还有更多过去和未来——这就是食物简史。,40,520,0,44.99,https://wfqqreader-1252317822.image.myqcloud.com/cover/983/38084983/s_38084983.jpg
犹太文化史(第二版),2015-09-01 00:00:00,历史-历史文化,本书以历史为线索，系统描述犹太文化形成的过程，其所包含的基本思想和对世界文明产生的具体影响。本书从犹太文化的形成直至20世纪犹太文化逐渐发展光大进行了全景式的描述，并以一位中国学者的思想视野对犹太文化的深层次内涵做出了带有理论性的理论界说。,25,0,0,38.4,https://wfqqreader-1252317822.image.myqcloud.com/cover/262/24275262/s_24275262.jpg
文史通义,2015-07-01 00:00:00,历史-历史文化,章学诚所撰《文史通义》是一部开风气之先的著作，书中主张借古通今，所论涉及史学、文学、校雠学等多种领域，颇多创获，其中“经世致用”、“六经皆史”、““史德”等著名论断，影响尤为深远。《文史通》〉与竭虑各幾的《史通》一起被视作中国古代史学理论的双璧。,37,929,0,16,https://wfqqreader-1252317822.image.myqcloud.com/cover/569/29793569/s_29793569.jpg
左传·吕氏春秋·战国策,2019-09-01 00:00:00,历史-历史文化,"    《左传》是一部编年体历史著作，讲述了公元前722年至前468年间各诸侯国的政治、经济、军事、外交等方面的历史，着重点在诸侯列国之间的矛盾与斗争。它还开创了历史文学的先河，对后世传记文学，如《史记》等有很大影响。《吕氏春秋》是百家九流学说的集成，融儒家、道家、墨家、法家、兵家等众家之长，形成包括政治、经济、哲学、道德、军事等方面的理论体系。作者吕不韦的用意是总结历史经验教训，为秦王朝提供治国理政方略。《战国策》是一部国别体史书，按东周、西周、秦国、齐国、楚国、赵国、魏国、韩国、燕国、宋国、卫国、中山国等次第编写，记述了战国时期纵横家的政治主张与策略，展现了战国时代的历史特点与社会风貌，是研究战国历史的重要典籍。
",32,0,0,22.99,https://wfqqreader-1252317822.image.myqcloud.com/cover/561/27561561/s_27561561.jpg
汉台聚珍 大汉源脉：汉中市博物馆,2020-05-01 00:00:00,历史-历史文化,汉台聚珍 大汉源脉：汉中市博物馆，本书包括天汉古韵——汉中历史文物展、古道沧桑——褒斜道石门及其摩崖石刻、龙兴之地——西汉三遗址三章，选取近百幅照片，以时为经，以事为纬，采用图说文述的方式，讲述了文物背后的故事，串起了汉中几千年的发展历程。走进汉中市博物馆，领略中华珍宝背后的悠悠历史，感受南北融汇独特的汉水文明。,7,0,0,34.99,https://wfqqreader-1252317822.image.myqcloud.com/cover/380/41448380/s_41448380.jpg
秦礼仪研究,2021-02-01 00:00:00,历史-历史文化,本书将地理范围锁定在关中地区，利用碑刻资料、地方志中的祠庙志、文集笔记以及民俗学的调查资料，选择有代表性的民间信仰现象作为案例，阐述秦神祀系统的发展及完善。通过对秦神祀体系的研究，阐述秦在建立中央集权的政治制度过程中采取的信仰措施，以便能更有效地支配全国各地，中央王朝通过制定祭祀政策对各地民间信仰现象进行干预、指导，加强了正统意识形态向民间社会的渗透。,6,0,0,110,https://weread-1258476243.file.myqcloud.com/weread/cover/78/3300008778/s_3300008778.jpg
学习考古,2018-02-01 00:00:00,历史-历史文化,本书汇集了作者在教学和科研中的思考，他站在一名考古学老师的立场上，为对考古学感兴趣的、想要投入考古学研究的和正在学习考古学的青年学生、工作者提供了知识背景，包括学科史、学习方法和理论、相关专业书籍等，并对考古教育提出了意见和看法。所写内容，从考古出发，与文学、哲学、科学甚至生活细节相结合，用考古学的方法和视角，探讨大众的事儿。“隔行不隔理”，其视角独特，旁征博引。如爱情考古、从当今时尚看石器的类型划分和考古学文化的风格，从《舌尖上的中国》看考古学研究中的“透物见人”等。对于初入此专业的学生，以及对考古学感兴趣的大众来说，这本书无疑提供了准确的知识体系，更加难得的是，提供了正确的价值观。,22,864,0,23.8,https://wfqqreader-1252317822.image.myqcloud.com/cover/643/23552643/s_23552643.jpg
稽古至治：司马光与《资治通鉴》,2019-11-01 00:00:00,历史-历史文化,《资治通鉴》被称为“皇帝教科书”，这是一部浓缩了中国古代政治运作、权力法则的史学巨著，也是古代帝王鉴于往事、有资于治道的必读之书。那么一千年后的我们，应该如何读懂《资治通鉴》？著名历史学者姜鹏，倡导用思想史的方法来解构、理解《资治通鉴》，钩沉隐性的史料价值，参悟个中三昧，发现历史现象背后蕴藏的哲思。,6,778,0,16.99,https://wfqqreader-1252317822.image.myqcloud.com/cover/196/31422196/s_31422196.jpg
《竹书纪年》与夏商周年代研究,2013-10-01 00:00:00,历史-历史文化,本稿从流传至今的《竹书纪年》今本和古本入手，梳理两个版本的传播过程，探讨两者的成书、原貌和相互关系，提出了今本形成于唐代开元的观点，并肯定今本对复原古本的价值。进而逐一具体推求了《竹书纪年》的西周、商、夏的年代，并编撰了校订后的《竹书纪年》夏、商、西周大事年表，同时就夏、商、周断代工程阶段成果的一些结论提出质疑，并在附录中就有关的利簋铭文诠释、《国语》天象记载、金文历谱等作专题讨论。,14,0,0,28.8,https://wfqqreader-1252317822.image.myqcloud.com/cover/754/25719754/s_25719754.jpg
历史的底稿：晚近中国的另类观察Ⅱ,2006-05-01 00:00:00,历史-历史文化,继《历史的坏脾气》之后，推出了第二本《历史的底稿》。两本书的观察怎样另类，有何特别，用张鸣的话概括，可以是四个字“不合时宜”。《历史的底稿》的序言里，他说出了“不合时宜”的原因：在社会生活里，一个稍有个性的人，常常会感到窒息。打破这种窒息，对我来说，就是时不时地发一点不合时宜的怪论。其实也不怪，都是些用常识的理性判断出来的常识而已。张鸣写晚近中国的两本书，引述的不是什么大事件和大话题，都是些逸闻趣事中的人情世故。《历史的底稿》里，牙刷、辫子、人头像章文人的舌头以及义和团的药方都被作者拿来当题目，乍一看都是些鸡毛蒜皮的小事，上不了历史这本大书的，却又能被作者扯出不简单的命题来。,2,681,0,0.99,https://wfqqreader-1252317822.image.myqcloud.com/cover/795/221795/s_221795.jpg
《竹书纪年》与出土文献研究之一：《竹书纪年》考（全三册）,2013-12-01 00:00:00,历史-历史文化,汲冢所出《竹书纪年》是记载五帝夏商周历史的视为中国古代第一部编年体通史。《竹书纪年考》是研究《竹书纪年》的出土、整理、考正、版本、流传、真伪、性质与价值等方面的专著。本书为《竹书纪年》的资料库，是研究《竹书纪年》集大成者。作者总结了晋以来《竹书纪年》的研究史，探讨了古本《竹书纪年》的结构与价值，揭示了今本《竹书纪年》的来源与伪缪。,28,0,0,234,https://wfqqreader-1252317822.image.myqcloud.com/cover/791/25789791/s_25789791.jpg
