title,publishTime,category,intro,maxFreeChapter,newRating,free,price,cover
律师文书样式、制作与范例,2016-09-01 00:00:00,社会文化-法律,法律文书制作是律师业务的基础，是一名合格律师的必备技能。本书从律师业务实际出发，汇总了常用的法律文书，包括：（1）民事诉讼法律文书（2）刑事诉讼法律文书（3）行政诉讼法律文书（4）海事诉讼法律文书 （5）仲裁法律文书（6）知识产权类文书（7）婚姻家庭类文书（8）投资创业类文书（9）法律服务类文书,40,813,0,43.99,https://wfqqreader-1252317822.image.myqcloud.com/cover/833/26700833/s_26700833.jpg
李建伟讲民法,2018-12-01 00:00:00,社会文化-法律,《李建伟讲民法/2018年国家统一法律职业资格考试专题讲座系列》是对国家统一法律职业资格考试中的民法进行系统讲解。书中不仅对民法总则中的基础知识点进行重点讲解，对民法分则中的知识点也进行全面系统的介绍。《李建伟讲民法/2018年国家统一法律职业资格考试专题讲座系列》对民法知识的讲解，有助于广大考生系统学习民法，掌握民法基本知识。,19,0,0,29.33,https://wfqqreader-1252317822.image.myqcloud.com/cover/187/30412187/s_30412187.jpg
知识产权法学(第5版),2011-08-01 00:00:00,社会文化-法律,《知识产权法学(第5版)》讲述了：依法成立的著作权集体管理组织，根据著作权人的书面授权，以自己的名义提起诉讼，人民法院应当受理。关于这种授权的性质，与普通的著作权许可使用不同，也与著作权转让不同。正如上一章所述，通过许可使用合同获得使用权的被许可人唯一享有的权利是按照许可使用合同约定的使用方式，在约定的期间和地域范围内，使用约定的作品，无权就该作品向第三人发放分许可或再许可，更不得以自己的名义对第三人侵权行为进行诉讼，为作为许可人的著作权人或者与著作权有关的权利人主张权利。,14,887,0,26.64,https://wfqqreader-1252317822.image.myqcloud.com/cover/236/24275236/s_24275236.jpg
最高人民法院新劳动争议司法解释（一）理解与适用,2021-07-01 00:00:00,社会文化-法律,为贯彻落实习近平总书记在中共中央政治局第二十次集体学习时的重要讲话精神，以清理涉及《民法典》相关司法解释为契机，在人民法院颁布施行的原有4个劳动争议司法解释基础上，根据《民法典》《劳动法》《劳动合同法》《民事诉讼法》《劳动争议调解仲裁法》以及《劳动合同法实施条例》等法律法规，对涉及劳动争议的司法解释作清理整合。经反复研究论证，《人民法院关于审理劳动争议案件适用法律问题的解释(一)》(以下简称本解释)由人民法院审判委员会第l825次会议审议通过，于2021年1月1日起施行。,12,0,0,105,https://rescdn.qqmail.com/weread/cover/241/3300003241/s_3300003241.jpg
中华人民共和国民法典侵权责任编理解与适用,2020-07-01 00:00:00,社会文化-法律,《中华人民共和国民法典》已于2020年5月28日公布，将于2021年1月1日起施行。民法典颁布后，做好民法典的贯彻实施工作，是人民法院今后一个时期的重大任务。特别是民法典施行后，婚姻法、继承法、民法通则、收养法、担保法、合同法、物权...,9,0,0,110.6,https://rescdn.qqmail.com/weread/cover/523/3300003523/s_3300003523.jpg
行政法与行政诉讼法(第4版),2011-05-01 00:00:00,社会文化-法律,《行政法与行政诉讼法(第4版)》是根据教育部高等学校法学学科教学指导委员会的要求，为高校法学专业14门核心课程编写的专门教材之一。《行政法与行政诉讼法(第4版)》全面、系统、深入地阐释了行政法与行政诉讼法的基本理论和基本知识，研究的范围主要包括行政法的一般原理、原则及行政法、行政法学的历史发展；行政法主体的一般理论及行政主体的职责、职权、管理手段与行政相对人的权利、义务；行政行为的一般理论及行政行为的性质、特征、构成要件、合法要件与各种类别行政行为的运作程序；行政救济的一般理论及行政复议、行政诉讼的性质、功能、行政复议和行政诉讼的受案范围、管辖、程序与裁判标准；行政赔偿的一般理论及行政赔偿责任构成要件、归责原则、赔偿范围、方式、标准与程序等。《行政法与行政诉讼法(第4版)》主要以我国行政法治实践和行政法学说为基本研究素材，同时吸收、借鉴了国外行政法学研究的大量成果。《行政法与行政诉讼法(第4版)》在继承、批判和扬弃国外行政法学的控权论、管理论、行政权力本位论、相对人权利本位论等各种学术流派的基础上，初步形成和建立了有中国特色的行政法学理论体系框架。,46,863,0,36.55,https://wfqqreader-1252317822.image.myqcloud.com/cover/52/24275052/s_24275052.jpg
不可不知的1388个法律常识（实用问答版·增订4版）,2014-10-01 00:00:00,社会文化-法律,"本书内容涉及人权保障、人身利益、生老病死、婚姻家庭、生活消费、交通出行、财产保护、合同权益、劳动就业、教育培训、社会保险、商业保险、创业投资、知识产权、违法犯罪、行政利益、诉讼等领域，比较全面完整地涵盖了人们在生活中常见的法律问题。
",24,757,0,23.99,https://wfqqreader-1252317822.image.myqcloud.com/cover/211/911211/s_911211.jpg
中华人民共和国刑法典：注释法典（2018年版）,2018-01-03 00:00:00,社会文化-法律,“中华人民共和国注释法典”丛书是我社集数年法规编撰经验，创新出版的大型实用法律工具书。本套工具书不仅全面反映中国特色社会主义法律体系形成成果，而且秉承权威、实用的理念，相信能够成为广大读者理解、掌握、适用法律的工具书。本套工具书以中国特色社会主义法律体系为主线，结合日常司法实践领域确定分册。本书为刑法分册，收录刑法及相关法律、行政法规、部门规章及司法解释。,75,0,0,40.99,https://wfqqreader-1252317822.image.myqcloud.com/cover/242/40457242/s_40457242.jpg
不懂营销的律师不是好律师,2018-08-01 00:00:00,社会文化-法律,《不懂营销的律师不是好律师》是一本关于律师如何进行自我营销、拓展业务、增加案源的营销实战指导书，也是一部新律师入门和老律师自我提高的案头必备读物。《不懂营销的律师不是好律师》结合新媒体营销和传统营销、顾问营销等各种不同的营销方式和各自的优劣特点，阐述了律师怎样做好营销，如何增加案源、如何树立个人品牌、如何维护客户、如何对客户进行分类、如果使用互联网营销手段、如何塑造专业形象、如何进行律所定位和品牌包装等律师在实际工作都能遇到的问题。同时，《不懂营销的律师不是好律师》书中还配有丰富的案例和详细的分析，深入浅出、贴合时代，能更好地帮助到新手律师及有志于从事律师行业的相关人员。,23,638,0,14.99,https://wfqqreader-1252317822.image.myqcloud.com/cover/660/22947660/s_22947660.jpg
《中华人民共和国土地管理法》释义与典型案例分析,2019-12-02 00:00:00,社会文化-法律,本书结合最新修改的土地管理法修改规定，对其法条内容规定和案例作了普及适用解读。,45,0,0,238.8,https://wfqqreader-1252317822.image.myqcloud.com/cover/284/33602284/s_33602284.jpg
IPO法律实务：关注事项与解决之道,2019-06-01 00:00:00,社会文化-法律,本书以2016年至今中国证监会发审会审核的IPO项目为标本，通过分析、归纳各个IPO项目的共性和特性法律问题，并加以作者十多年IPO法律服务的实务经验和见解，阐述企业IPO常见法律问题及其影响，以期企业在筹备上市时建立框架性的认知和了解，从而减少法律缺陷。,13,722,0,38.99,https://wfqqreader-1252317822.image.myqcloud.com/cover/197/26246197/s_26246197.jpg
中华人民共和国治安管理处罚法（实用版）（2017年版）,2017-03-10 00:00:00,社会文化-法律,本书收录了2005年8月28日第十届全国人民代表大会常务委员会第十七次会议通过，根据2012年10月26日第十一届全国人民代表大会常务委员会第二十九次会议《关于修改的决定》修正的《治安管理处罚法》，就重点条文进行权威注释，并附录有相关重要法律法规司法解释等配套文件，是学习适用治安管理相关法律制度的实用图书。,8,0,0,8.99,https://wfqqreader-1252317822.image.myqcloud.com/cover/614/40456614/s_40456614.jpg
警察日记,2019-07-01 00:00:00,社会文化-法律,当前社会瞬息万变，派出所警察所面临的执法环境和社会挑战均不容小觑，而老百姓对打交道较多的派出所警察却不甚理解。特别是近年来一些负面舆论甚嚣尘上，更是抹黑了派出所警察的形象，恶化了派出所警察的执法环境，损害了曾经和谐美好的警民关系。社会转型期的诸多阵痛系于警察一身，成为其不能承受之重，如何让老百姓更懂派出所警察，更理解和支持派出所警察，正是本书的写作初衷。派出所是我国社会执法机构的基层细胞，是观察社会的瞭望所，通过这个“万花筒”能看到形形色色的世间百态。派出所也是老百姓和政府近距离接触的关卡和窗口，老百姓从警察的执法和服务工作中得出对政府的直观评价，同时对社会治安环境作出感性判断；违法犯罪分子在这里得到应有的惩处。作者长期在基层派出所工作，积累了大量生动的一手素材，本书主要分三块：警察办案故事、警民互动故事、警营生活趣事，将这些“珍珠”用线串起来，就还原出极其真实、生动的派出所警察。本书通过一个个真实生动的警察执法办案故事、一件件温暖细腻的警民互动故事、一桩桩活泼向上的警营生活趣事向读者展示真实的派出所警察的积极良好风貌，展现他们的辛酸苦辣、喜怒哀乐。这些活生生、热辣辣的警察故事，才是真正原汁原味的中国警察故事。生活比电视剧更精彩。,22,697,0,31.2,https://wfqqreader-1252317822.image.myqcloud.com/cover/541/26833541/s_26833541.jpg
被误解的民主,2016-01-01 00:00:00,社会文化-法律,本书作者为复旦大学青年学者包刚升，本书是其关于民主与民主转型、国家治理、中国改革的思想评论合集，文章多曾发表于报刊上。,9,889,0,18,https://wfqqreader-1252317822.image.myqcloud.com/cover/992/32321992/s_32321992.jpg
劳动争议案件35个胜诉策略及实务解析,2020-09-01 00:00:00,社会文化-法律,"劳动争议案件是用人单位和劳动者发生激烈矛盾的聚焦点。
本书作者致力于研究劳动法并积累丰富的实务经验：曾作为法官审判劳动争议案件，作为仲裁员审理劳动争议案件，现作为权威律师成功办理多起劳动争议案件。本书精选作者在实战中的十余起典型案件，并全面剖析如何步步为赢、圆满解决劳动争议，而且还以对手的角度精心复盘，对案件涉及的劳动法疑点、热点、难点和痛点进行全面的解读和分析。本书既可作为律师办案的枕头书，也可作为企业防范劳动法律风险的参考；既可以作为法官和仲裁员办理劳动争议案件的参考和借鉴，也可以作为高校的实务教材，还可以作为劳动者维护自身合法权益的指南。",10,0,0,43.99,https://weread-1258476243.file.myqcloud.com/weread/cover/7/3300019607/s_3300019607.jpg
风险投资合同起草审查指南,2020-03-01 00:00:00,社会文化-法律,本书能够对风险投资业务的参与者提供实践操作层面的指引与参考，可使初次接触风险投资的创业者对这一类交易的投资条款设置、优先权安排等有一个基本而全面的认识。特别地，针对那些准备引入风投机构的创业者而言，如果对于投资人提供的投资条款一筹莫展，本书应当是一份不错的指南。,20,0,0,35,https://wfqqreader-1252317822.image.myqcloud.com/cover/741/40907741/s_40907741.jpg
行政法学（第四版）,2016-06-01 00:00:00,社会文化-法律,本次修订是在第三版的基础上，根据近年来我国新修订的行政诉讼法等法律、法规进行，并将相关领域的学术研究成果及时反映到新版教材中来。本书可作为高等教育法学专业的核心课程教材，也可供相关专业学生或其他读者作为学习参考用书。,5,875,0,54.4,https://wfqqreader-1252317822.image.myqcloud.com/cover/167/25665167/s_25665167.jpg
宪法学讲义,2011-09-01 00:00:00,社会文化-法律,《宪法学讲义》尝试将世界宪政的普遍原理和中国宪政的具体实践相结合，以中国和西方宪政国家的重要宪法判例为主线，系统讲解宪法学原理。《宪法学讲义》共24讲，涉及宪法学的基本理论和方法、宪法的制定与修改、宪法的实施与解释、基本人权的宪法保障、选举和政党制度、政府组织结构、中央和地方关系等内容。在方法上，《宪法学讲义》奉行“问题中心主义”——以实在和具体的宪法问题为中心，通过个案阐述宪法学的基本原理和知识。在形式上，《宪法学讲义》以各国经典判例为主线，采取叙述、议论和实例相结合的多样化方式，力求做到生动而不失准确。全书内容翔实、体例新颖、深入浅出、博采众长，适合作为大学生宪法学教材或教学参考书。,39,889,0,34.69,https://wfqqreader-1252317822.image.myqcloud.com/cover/446/24274446/s_24274446.jpg
中华人民共和国民法典总则编理解与适用（下）,2020-07-01 00:00:00,社会文化-法律,《中华人民共和国民法典》已于2020年5月28日公布，将于2021年1月1日起施行。民法典颁布后，做好民法典的贯彻实施工作，是人民法院今后一个时期的重大任务。特别是民法典施行后，婚姻法、继承法、民法通则、收养法、担保法、合同法、物权...,5,0,0,180.6,https://rescdn.qqmail.com/weread/cover/524/3300003524/s_3300003524.jpg
英文合同阅读与分析技巧,2007-09-01 00:00:00,社会文化-法律,本书详细介绍了英文合同中常见的制式结构、制式语言以及英文合同字里行间所潜藏的法律风险。,6,0,0,26.55,https://wfqqreader-1252317822.image.myqcloud.com/cover/745/32319745/s_32319745.jpg
刑事辩护的中国经验：田文昌、陈瑞华对话录(增订本),2019-04-01 00:00:00,社会文化-法律,本书在2012年5月出版，首印6000册，目前已无库存。本书在刑事诉讼实务界获得了广泛的好评。鉴于新刑事诉讼法将于2013年1月1日正式实施，目前两高三部委正在抓紧制定实施细则。我们拟邀请两位作者就实施细则再进行一次谈话，增补到书稿中去。同时鉴于对首印的装帧设计不很满意，我们准备再版更换封面设计和装帧形式，力争把本书打造成一本可以长销的律师必读书。,43,837,0,62.4,https://wfqqreader-1252317822.image.myqcloud.com/cover/891/26831891/s_26831891.jpg
公安民警执法办案常用手册（第十一版）,2018-12-01 00:00:00,社会文化-法律,全面、系统涵盖公安民警最高常用的法律法规司法解释，便于基层民警日常执法办案工作中随身携带和随时查询使用。既是公安民警法律学习的培训教材，也是基层民警执法办案的好帮手。第十一版根据《中华人民共和国刑事诉讼法》《最高人民法院、最高人民检察院、公安部等印发的通知》《公安机关办理刑事案件证人保护工作规定》《公安机关执法公开规定》等最高法律法规司法解释修订。本书的修订，保持了实用性强的特点，仍选取基层所、队民警在执法办案中最高常用、最高基本的法律、法规、解释、规章及规范性文件，并加大具体执法行为操作性规范的比重，增加了一些公安民警应知应会的常用法规和规范，以使本书更贴近办案实践。本书将根据国家法律法规和相关部门规章、规范性文件的公布情况实时修订。,4,958,0,27.99,https://wfqqreader-1252317822.image.myqcloud.com/cover/476/26245476/s_26245476.jpg
婚姻法律宝典：你必须知道的婚姻法55个热点疑难问题,2019-05-01 00:00:00,社会文化-法律,《婚姻法律宝典：你必须知道的婚姻法55个热点疑难问题》 （第二版）全面升级，针对大家对婚姻家庭法律关切的问题，作者根据多年的办案经验和办理的上百个婚姻案件，提炼出55个问题进行重点解读、案例解惑、律师提醒等，深入浅出，通俗易懂。通过了解这些问题，缠绕在你身边的一些疑惑将迎刃而解。掌握了这55个问题，可以说就掌握了关于婚姻、家庭中重要的法律问题。,17,829,0,24.99,https://wfqqreader-1252317822.image.myqcloud.com/cover/819/26245819/s_26245819.jpg
刑法总论精释（第三版)上,2016-02-01 00:00:00,社会文化-法律,随着《刑法修正案（九）》的实施，《刑法总论精释》第三版正式与读者见面。从《刑法修正案（八）》到《刑法修正案（九）》，间隔了不到五年时间，而我国的刑事法治建设和刑法理论都取得了长足的进展，这是令人欣慰的。《刑法总论精释》一...,7,0,0,110.6,https://rescdn.qqmail.com/weread/cover/738/3300006738/s_3300006738.jpg
中华人民共和国民法典合同编理解与适用（三）,2020-07-01 00:00:00,社会文化-法律,《中华人民共和国民法典》已于2020年5月28日公布，将于2021年1月1日起施行。民法典颁布后，做好民法典的贯彻实施工作，是人民法院今后一个时期的重大任务。特别是民法典施行后，婚姻法、继承法、民法通则、收养法、担保法、合同法、物权...,4,0,0,460.6,https://rescdn.qqmail.com/weread/cover/529/3300003529/s_3300003529.jpg
不良资产处置与资产管理公司实务精要,2019-03-01 00:00:00,社会文化-法律,本书以不良资产收购处置业务所涉及的基本概念、政策法律法规为切入点，紧密联系资产管理公司的日常经营业务实践，通过理论对现实业务中遇到的问题予以分类整理、流程梳理与分析解答，对资产管理公司的监督管理、业务模式、盈利模式进行详细介绍。本书重点介绍了转让处置、债务重组、债转股、不良资产证券化等资产管理公司典型业务模式，不仅汇总了现阶段不良资产行业的第一手政策法规与业务实践材料，观点鲜明突出且具备说服力；阐述的模式更是完全来源于资产管理公司的业务实际，具备极强的可操作性，能够为业务人员与管理人员提供详实的学习、研究及参考资料。此外，本书还结合监管部门发布的最新监管政策，阐述了新监管业态下资产管理公司与不良资产产业链面临的法律问题及解决路径。,6,0,0,39,https://wfqqreader-1252317822.image.myqcloud.com/cover/86/40909086/s_40909086.jpg
快速读懂民法典·婚姻家庭编：如何让家更幸福,2021-04-21 00:00:00,社会文化-法律,民法典作为社会生活的百科全书，与我们的日常生活息息相关。衣食住行、婚丧嫁娶、生老病死、生产经营等都离不开民法典的规范，为加强民法典的宣传教育，我们组织编写了这套《快速读懂民法典》系列，帮助大众轻松读懂民法典，让民法典走到大众身边、走进大众心里。本册主要讲述了“婚姻家庭编”的基本内容，通过通俗易懂、贴近生活的故事案例来阐释法律条文。对于新法适用问题进行亮点解读，帮助读者快速掌握法律适用要点，帮助大众学会依法处理婚姻家庭纠纷，是广大人民群众依法维护合法权益的必备工具书。,17,0,0,21.71,https://wfqqreader-1252317822.image.myqcloud.com/cover/862/40126862/s_40126862.jpg
最高人民法院第三巡回法庭新型民商事案件理解与适用,2019-04-01 00:00:00,社会文化-法律,最高人民法院第三巡回法庭结合所辖地区案件类型与特征，精心挑选一批在法律适用上具有代表意义及社会普遍关注的案件编撰成书，既是对辖区法院进行统一裁判指导，也是为了进一步加强案例指导研究，推动案例指导制度更好发展。本书选取的案例均为最高人民法院第三巡回法庭成立两年以来审结的民商事案件，总体具有以下几个特点：一是人民群众反映强烈或社会普遍关注。二是具有典型的法律适用意义。三是案件新颖或疑难复杂。四是案件大多经过主审法官会议讨论。本书选取的案例大多是最高人民法院第三巡回法庭全体主审法官集体智慧的结晶，具有高度的权威性和公信力，对于统一裁判尺度、规范法律适用有着重要的参考意义。,18,963,0,69.99,https://wfqqreader-1252317822.image.myqcloud.com/cover/953/26245953/s_26245953.jpg
斑马线上的中国,2015-01-01 00:00:00,社会文化-法律,从测谎仪到摄像头，从安检到城管，从公捕公判到因言获罪，法治十年观察，备感路程艰辛。法治是一种许诺，“走在斑马线上是安全的”。可是，若不能真诚落实法治，斑马线将成为死亡线，死因则是对制度的信赖。这是国家和国民最不能承受的。在本书冷静而富有感情的文字里，相信读者自会发现，法治还在艰难前行，法律人一直在为法治的启蒙而呐喊。,26,827,0,17.55,https://wfqqreader-1252317822.image.myqcloud.com/cover/689/32321689/s_32321689.jpg
中国刑事审判指导案例01卷（增订第3版）：刑法总则,2017-06-01 00:00:00,社会文化-法律,本书是最高人民法院刑事审判第一至五庭主办的刑事审判业务指导和研究性刊物——《刑事审判参考》的合订分解集成本。本次出版的增订第3版在2012年出版的《中国刑事审判指导案例》(增补版)的基础上，进行全新编排，根据案例所涉的核心法律问题，按照刑法总则、刑法分则各章罪名和刑事诉讼法体系重新分类编排；增补了《刑事审判参考》2011年至2016年卷刊载的指导案例、审判业务研讨文章；此外，收录了截至2016年底发布的相关刑事司法解释、司法解释性文件及其理解与适用。,10,0,0,79.2,https://wfqqreader-1252317822.image.myqcloud.com/cover/802/32322802/s_32322802.jpg
一看就懂的法律常识大全集（漫画版）,2017-01-01 00:00:00,社会文化-法律,“一看就懂系列”普法图书用生动形象的漫画，再现生活中的真实案例，让您轻松学法，快乐学法!用通俗的语言，专业的法律知识，解答生活中常见的法律问题，使法律贴近实际、贴近生活！本套丛书具有以下特点：第一，既全面又实用。本套丛书法律知识丰富全面，应有尽有。书中内容来源于现实生活中的常见场景，并且多是现实中真实的案例，较为贴近生活。第二，即形象又生动。本套丛书配以生动形象的漫画，供读者参考、思索，可以说是“看图学法”，相信一定能给读者带来阅读和学法上的乐趣。第三，既专业又通俗。在案例讲解方面，我们均以专业律师的角度和水准对案例作出了详细而全面的解答，并且，所给出的结论也是法院通行的判决结果，具有相当的专业性与权威性。此外，我们在编写此书的时候，避开了法言法语，采用了通俗易懂的大众语言，秉承了普法不忘通俗的理念和初衷。,6,793,0,23.99,https://wfqqreader-1252317822.image.myqcloud.com/cover/203/23567203/s_23567203.jpg
国际法(第四版),2014-01-01 00:00:00,社会文化-法律,本次改版根据近三年来国际法领域的立法实践和理论发展，对诸多章节进行了修改补充和完善，体现了国际法领域的最新视野。,14,860,0,39.2,https://wfqqreader-1252317822.image.myqcloud.com/cover/174/24275174/s_24275174.jpg
证据法学：原则、规则、案例,2017-11-01 00:00:00,社会文化-法律,证据法学：原则规则案例》是以规则论—原理论—应用论为逻辑主线，以他国制度为参照，以相关案例为补充，并辅以简洁直观的插图、表格、拓展阅读等多元化教学元素，对证据法的基本原理、具体制度和适用程序进行分析与阐释的证据法学教科书。紧密贴合教学实际，不同于我国传统证据法学教科书，《证据法学：原则规则案例》通过知识点与案例的有效解释，实现规则讲解、原理讲授与实践应用融于一书，是学习证据法学的教科书。,14,0,0,36,https://wfqqreader-1252317822.image.myqcloud.com/cover/297/32323297/s_32323297.jpg
