title,publishTime,category,intro,maxFreeChapter,newRating,free,price,cover
圆圈正义：作为自由前提的信念,2019-08-07 00:00:00,社会文化-法律,《圆圈正义》一书共收录作者的49篇随笔文章，分为“圆圈正义”“何谓榜样”“道德谴责的打开方式”“身负权力各自珍重”“法律人的理智和多数人的情感”“生命的尊严”“心怀永恒活在当下”七大部分，作者在本书中运用特有的坦诚、自省而尖锐的笔调，探讨了法律、正义、道德、权力的理念与现实、分析了如张扣扣案、莫某纵火案等社会热点案件、分享了自身求学经验和对人生的思考。本书不仅启蒙读者法律意识和法治观念，更在于帮助读者理解法律背后更深层次的价值基础。,15,925,0,22.99,https://wfqqreader-1252317822.image.myqcloud.com/cover/732/40457732/s_40457732.jpg
法治的细节,2021-11-01 00:00:00,社会文化-法律,"《法治的细节》是中国政法大学法学教授罗翔全新的法学随笔，面向大众读者，从热点案件解读、法学理念科普、经典名著讲解等6大板块，普及法律常识与法治观念。内容包括辛普森案、电车难题、性同意制度等法律基本常识，或N号房、张玉环案等时事热点的案件，多维度培育法律思维，助力法治社会的构建，点亮每个人心中的法治之光。
此外，本书还收录了罗翔在爆红后的心路历程，分享其求学成长经历，袒露其心境的变化与成熟，与读者一起通过阅读与思辨，走出生活中的迷茫时刻，在现实中共同完善法治的细节。",6,944,0,42,https://weread-1258476243.file.myqcloud.com/weread/cover/40/3300012940/s_3300012940.jpg
中华人民共和国民法典,2020-05-01 00:00:00,社会文化-法律,为加强法制宣传，迅速普及法律知识，服务于我国民主法制建设，多年来，中国民主法制出版社根据全国人大常委会每年定期审议通过、修订的法律，全品种、大规模的出版了全国人民代表大会常务委员会公报版的系列法律单行本。该套法律单行本经过最高立法机关即全国人民代表大会常务委员会的权威审定，法条内容准确无误，文本格式规范合理，多年来受到了社会各界广泛关注与好评。《中华人民共和国民法典》被称为&quot;社会生活百科全书&quot;，是民事权利的宣言书和保障书，如果说宪法重在限制公权力，那么民法典就重在保护私权利，几乎所有的民事活动大到合同签订、公司设立，小到缴纳物业费、离婚，都能在民法典中找到依据。民法典共7编，依次为总则编、物权编、合同编、人格权编、婚姻家庭编、继承编、侵权责任编，以及附则，共1260条。,12,935,0,13.2,https://wfqqreader-1252317822.image.myqcloud.com/cover/313/32444313/s_32444313.jpg
刑法学讲义（法律男神罗翔的刑法普及课）,2020-07-01 00:00:00,社会文化-法律,全网爆红的“法律男神”罗翔教授为每一位普通读者写的刑法普及讲义。刑法与每个人的生活都密不可分，家庭、校园、职场、人际关系、经济活动处处都有违法犯罪行为，相应地，每个人都需要学习刑法。罗翔让本来枯燥专业的刑法课变得“津津有味”，读者直呼上头，“根本停不下来”。刑法常识结合法理精神，兼具法律与人文的力量。本书为读者提供了相对完整的刑法学习体系，涵盖刑法演变、犯罪论、刑罚论，以及具体罪名的定罪量刑。全书通过分析真实刑法案件、张三的犯罪行为，激发读者用独立、睿智的法学思维去看待生活，提高法律感知能力。最后，每一位读者都能带着法学思维回归到工作、生活中去。,35,925,0,58,https://wfqqreader-1252317822.image.myqcloud.com/cover/295/32746295/s_32746295.jpg
罗翔说刑法系列（全3册）,2021-01-01 00:00:00,社会文化-法律,全网爆红的“法律男神”罗翔教授为每一位普通读者写的刑法普及讲义。刑法与每个人的生活都密不可分，家庭、校园、职场、人际关系、经济活动处处都有违法犯罪行为，相应地，每个人都需要学习刑法。,28,909,0,139,https://wfqqreader-1252317822.image.myqcloud.com/cover/107/35458107/s_35458107.jpg
你不可不知的法律常识,2017-05-01 00:00:00,社会文化-法律,酒后出事，同席者承担多大责任？样品误当新品卖，是否构成消费欺诈？车借给朋友出了事故，责任由谁承担？是不是所有的合同都可以采用电子签名？“小三”有权分得遗产吗？夫妻购买的小产权房，离婚时如何分割？父债子还，天经地义吗？借款人跑了，如何讨债？如何约定民间借贷的利息才合法？购买学区房，卖房人不迁走户口怎么办？老赖的住房不会被执行吗？这些问题都是生活中大家非常关注的，也是常常厘不清的。《你不可不知的法律常识》从生活与消费，夫与妻关系、父母与子女、资产与理财、企业经营与管理、诉讼与仲裁、犯罪与刑罚这7个方面入手，选取了与日常生活密切相关的100个问题，用非常接地气的语言，生动而严谨地进行点对点的讲解，非常适合大家查阅式阅读。,33,720,0,12,https://wfqqreader-1252317822.image.myqcloud.com/cover/643/859643/s_859643.jpg
中华人民共和国劳动法·中华人民共和国劳动合同法,2019-01-01 00:00:00,社会文化-法律,单行法规二合一。收录中华人民共和国劳动合同法及最新修正的中华人民共和国劳动法，并附相关司法解释。法律出版社法规中心是法律出版社旗下的专业法规编纂机构。法规中心以国家法律、法规、司法解释等规范性文件为主要内容，分析研究立法主旨和读者需求，策划编纂适合办案实务、教学研究和一般大众实际需要的各类法律用书。,8,939,0,3.6,https://wfqqreader-1252317822.image.myqcloud.com/cover/334/32324334/s_32324334.jpg
尸检报告：一个殡葬师的手记,2019-08-01 00:00:00,社会文化-法律,卡拉·瓦伦丁为死者工作。在成为世界上“超恐怖”的巴斯病理学博物馆（就是BBC剧集《神探夏洛克》里福尔摩斯做实验和跳楼的那座博物馆）的馆长之前，她做了多年的尸检工作，完成了大约5000次尸检。在这本书中，她以尸检过程为叙事主线，分享了她的专业知识。从尸体的第一个切口开始，我们将跟随作者，着手进行尸体的外部检查，随后依次进入尸体内部，解剖单独的器官，直至最后的尸体缝合。在每一个阶段，我们都会随着作者的笔触，了解尸检的过程和知识，了解人类生与死之间的历史和不断变化的文化关系，了解生命究竟是什么。她对我们的身体最终会发生什么，有生动的洞察。书中的每一章除详细描绘尸检的其中一个环节，也描述了作者生活和工作的细节，纠正了我们从综艺节目、剧集上看到的关于尸检的错误认知。她的文字触及了我们对死亡的感受中一些更具争议的方面，比如性和死亡的关系，比如我们对人体组织收集、器官捐赠等的态度。,5,759,0,34.8,https://wfqqreader-1252317822.image.myqcloud.com/cover/935/26242935/s_26242935.jpg
民法典与百姓生活100问,2021-01-01 00:00:00,社会文化-法律,2020年5月28日，第十三届全国人大三次会议以98.5%的高票表决通过《中华人民共和国民法典》，这是新中国成立以来第一部以“法典”命名的法律，其意义注定非凡。《中华人民共和国民法典》即将在2021年1月1日起施行。在此背景下，《民法典与百姓生活100问》一书的推出，展示了《民法典》是如何作为社会生活百科全书，为人民群众实现美好生活保驾护航。书稿依据《民法典》的篇章体例分为七篇，分别是总则编14问、物权编18问、合同编20问、人格权编10问、婚姻家庭编10问、继承编12问、侵权责任编16问，总共100问，共计9万余字。写作风格方面，书稿以案例故事加图文解说的趣味方式将《民法典》送到人民群众的身边，走进人民群众的心里。,33,930,0,29.9,https://wfqqreader-1252317822.image.myqcloud.com/cover/125/36941125/s_36941125.jpg
是非与曲直：个案中的法理,2019-08-01 00:00:00,社会文化-法律,该书以“药家鑫案”“许霆案”“黄碟案”等曾引发社会广泛争议的案例为研究“标本”，以法学家的理性、敏锐和洞察力，从那些被人们、甚至法律人有意遗忘、主动省略或懒得验证的但却至关重要的情节和事实入手，提出了与众不同的思考和结论，极具启发意义。作者认为，中国法理研究应当坚持的进路是：摆事实、讲道理（法理）、断是非。三者的顺序也不能乱。只有针对普通人确实能经验感知的事实，才能展开可分享的说理，虽然由于对相关因素的评价不同，甚至因为自我利益的驱动，各自得出的判断并不一致。这正是本书的追求。这是一种更生动也更开放的案例分析。虽然这些案件都已尘埃落定，但它们留给人们的思考空间仍然很大，作者提出的问题以及有关的讨论本身，仍有意思，仍值得我们深思。,23,839,0,54.4,https://wfqqreader-1252317822.image.myqcloud.com/cover/576/26833576/s_26833576.jpg
辩论： 美国制宪会议记录,2014-07-01 00:00:00,社会文化-法律,1787年费城55位代表127天辩论，亲历人类首部成文宪法诞生63万字笔记487条注释1页附录，见证原则背后更有妥协隐忍翻译家尹宣先生遗作暌违十年校订新版法政学者何帆作序推荐《辩论：美国制宪会议记录》是美国宪法缔造者詹姆斯·麦迪逊所记录的1787年美国制宪会议全过程，由著名翻译家尹宣先生翻译整理，深具学术价值。全书按麦迪逊在制宪会议期间的原始手稿排印，保留历史原貌，还原美国建国之父们设计联邦政府的关键历程。麦迪逊的记录自始至终、一天不缺，写法类似连续剧，记下了历史人物（代表们）在特定场景（每天不断深入的辩论）上的台词（发言）。,15,954,0,39,https://wfqqreader-1252317822.image.myqcloud.com/cover/92/856092/s_856092.jpg
学点法律，避点坑：有趣有料的法律科普,2018-09-01 00:00:00,社会文化-法律,本书是一本“不一样”的法律科普读物，不同于其他传统的普法读物，本书用平实的语言和鲜活的例子把晦涩的法律条文“翻译”出来，幽默的行文是本书的“增味剂”，力求让你在轻松愉悦中学会法律知识，本书还汇集了许多大家生活中经常碰到但又束手无策的法律难题，比如怎么让渣男净身出户？遭遇职场性骚扰怎么处理？碰到老赖不还钱该怎么办？针对每一个问题，书中都给出详细的“法律操作指南”，手把手地教你维权。 除此之外，本书还选择了多个大家非常关心，但又不明就里的法律“漏洞”，比如精神病、幼童杀人为何不处罚？人贩子为什么不一律死刑？这些令人不解的疑问后，都有着深层次的原因，书中将一一揭示这些法律秘密。,25,752,0,29.25,https://wfqqreader-1252317822.image.myqcloud.com/cover/480/26793480/s_26793480.jpg
合同审查思维体系与实务技能,2017-11-01 00:00:00,社会文化-法律,本书从合同审查思维与技能两个角度入手，全方位讲解合同审查法律实务。全书分三篇：上篇“合同审查的整体思维”包括合同审查的两个目的、三个前提、四个步骤、五个标准、六个提升合同的途径等内容，系从整体思维角度阐述合同审查的要领;中篇“合同审查的基本技能”讲解了合同审查的主要方法和不同合同条款的审查技能，属于合同审查思维和方法的具体应用;下篇“常用合同审查要点解析”，总结了常用合同的审查要点及注意事项，并提供了合同审查范例，供读者参考借鉴。,37,842,0,29.99,https://wfqqreader-1252317822.image.myqcloud.com/cover/988/26540988/s_26540988.jpg
中华人民共和国宪法,2018-03-09 00:00:00,社会文化-法律,为加强法制宣传，迅速普及法律知识，服务于我国民主法制建设，多年来，中国民主法制出版社根据全国人大常委会每年定期审议通过、修订的法律，全品种、大规模的出版了全国人民代表大会常务委员会公报版的系列法律单行本。,2,938,0,4.32,https://wfqqreader-1252317822.image.myqcloud.com/cover/214/25915214/s_25915214.jpg
公司法学（上）,2017-09-01 00:00:00,社会文化-法律,中国法学的落后集中反映在教材上。内容空洞无物、语言枯燥乏味的法学教材耽误了一代又一代的莘莘学子，浪费了他们的时间和精力，扼杀了他们的兴趣和热情。本来，教材的编写要以现有的科研成果为基础，从中系统地吸收养料。可是学风浮夸，制度低效，法学界尤甚。发表出来的所谓成果和论文大都是无用的垃圾。教材的编写者们即使是巧妇也难为无米之炊。教材上不去，年轻一代的基础打不扎实，科研就没有后劲，反过来又制约教材质量的提高。要突破这个恶性循环的局面，写出与国际接轨的教材来，必须跳出学术界，向两个方面寻求素材：第一是实践部门，主要是我国法院的判例以及工商、税务等部门的实务；第二是国外的判例、规则和学术讨论。除此之外别无他路。本书正是在这两个方向上努力的。,21,1000,0,62.86,https://wfqqreader-1252317822.image.myqcloud.com/cover/508/26943508/s_26943508.jpg
民法总论（第二版）,2016-04-01 00:00:00,社会文化-法律,本书在第一版的基础上继续完善相关内容，增加最新的学术进展内容，力争保持该书在民法相关教材销售领域的领先地位。该书为民法总论研究领域的最新力作。既有理论研究的深度，又有研究视野的广度，为读者展示了德系民法人扎实的研究功底、严谨的治学态度和高水准的研究能力。本书为民法领域深入学习和研究不可多得的高水准学习参考用书。,9,943,0,60,https://wfqqreader-1252317822.image.myqcloud.com/cover/148/25665148/s_25665148.jpg
中华人民共和国民法典释义及适用指南,2020-07-07 00:00:00,社会文化-法律,民法被称之为社会生活的大百科，直接影响着每一个人的生活。党的十八大以来，以习近平同志为核心的党中央推动党和国家事业发生了历史性变革、取得了历史性成就，中国特色社会主义步入新时代。在这一背景下，党的十八届四中全会作出编纂民法典的重大决策正当其时，具有重大而深远的意义。本书对民法典进行逐条释义，观点权威有利于社会大众对民法典各条内容的理解。,15,944,0,192,https://wfqqreader-1252317822.image.myqcloud.com/cover/349/35562349/s_35562349.jpg
论犯罪与刑罚,2017-08-01 00:00:00,社会文化-法律,《论犯罪与刑罚》这部著作篇幅不大，但影响却极为深远，被誉为刑法学乃至法学领域里最重要的经典著作之一。本书原著初版于1764年，是人类历史上第一部对刑罪原则进行系统阐述的著作。全书洋溢着伟大的人道主义气息，对刑讯逼供和死刑进行了愤怒的谴责，鼓吹刑法改革，力倡罪刑相适应的近代量刑原则。本书问世后立即给作者带来了极大声誉，被翻译为多种文字，它对于俄国、普鲁士以及奥地利等国的刑法改革具有重大的影响。该书被誉为刑法领域里的重要的经典著作之一。自1993年由黄风教授第一次翻译成中文以来，本书已经被列为中国刑法学研习者的必读书目。,14,915,0,9.5,https://wfqqreader-1252317822.image.myqcloud.com/cover/597/24905597/s_24905597.jpg
刑法中的同意制度：从性侵犯罪谈起,2021-01-01 00:00:00,社会文化-法律,有的男性认为女性穿着暴露、与男性单独共处一室、在男性面前喝醉酒、双方有亲密肢体接触等等行为就是女性暗示与男性发生性行为。但这些“我以为”真的意味着“她同意”吗？同意问题是性侵犯罪的核心，对“性同意”的讨论，不止于性行为发生需要得到许可，还包括围绕着“性”的性别、权力、道德和文化的重新审视，性同意年龄、厌女情节、社会风俗、完美受害者、亲密关系、婚内强奸……清楚认知法律中的同意制度，对男女双方都是纠偏的过程。正确表达不同意，是每位女性自我保护的关键；尊重她人的“不”，也是每位男性行为自由的边界。世界并不完美，但法律可以持守正义，坚守善道，让人心在浊世中有对良善的信心与盼望。,8,928,0,45,https://wfqqreader-1252317822.image.myqcloud.com/cover/113/35458113/s_35458113.jpg
要件审判九步法,2010-09-01 00:00:00,社会文化-法律,本书理论和实践相结合，详细介绍了“要件审判九步法”的具体内容，着眼于提高法官的逻辑思维能力和法律适用能力，对法官审理案件和制作裁判文书具有很好的指导意义。,24,968,0,16.2,https://wfqqreader-1252317822.image.myqcloud.com/cover/369/32320369/s_32320369.jpg
宪法学讲义（第三版）,2018-09-01 00:00:00,社会文化-法律,本书原为林来梵教授讲授本科“宪法学”（国家精品课程）的全套课堂讲义实录，是近年来我国书肆中最为畅销的宪法学读物之一，有书评誉之为“宪法学教科书中的典范”。 全书基于“规范宪法学”的独特方法，对宪法学的内容进行了体系化的阐述，间中不时针对国内各种宪法学理论做批判性的学术分析，并就一些具有争议性的议题提出了个人独特的学术见解。书中的语言表述也保留了课堂讲授的原有风格，深入浅出，寓庄于谐，颇有“临场感”。 此度第三版以2018年修宪为契机，对原书的内容做了较大的修订和发展。,9,952,0,51.35,https://wfqqreader-1252317822.image.myqcloud.com/cover/623/26793623/s_26793623.jpg
实习律师指南,2014-03-01 00:00:00,社会文化-法律,本书分为20节，即讲20个方面内容。本书没有空话、套话，也没有貌似深奥的名词术语及各种舶来的理论，有的是一个老师傅对学徒的谆谆教诲和手把手的指导。从最初的会见当事人，到签订委托合同；从调查取证，到提交证据；从庭前准备，到法庭辩论。律师实践中的每一个细节，都在本书中有经验的描述。本书的内容其实是法学院系选修课“律师实务”中的内容，但写本书时，作者摒弃了教材式语言的呆板正经，力图使文字更通俗，使人读起来更轻松。,56,859,0,17.1,https://wfqqreader-1252317822.image.myqcloud.com/cover/282/32321282/s_32321282.jpg
送法下乡：中国基层司法制度研究,2019-04-01 00:00:00,社会文化-法律,《送法下乡》是苏力的代表作，也是当代中国法学界极具影响的重要著作，面世十年畅销不衰。本书按照制度、知识、法律人以及研究方法分为四编。集中论述了中国当代基层司法制度、中国基层法官的技术和知识、有关法官以及乡土社会中的其他法律人和作者在田野调查中发现的问题。本书2000年在政法大学出版社出版。现苏力对其中部分内容做了修正，重新出版。本书版权问题已经解决。,30,875,0,47.2,https://wfqqreader-1252317822.image.myqcloud.com/cover/786/26831786/s_26831786.jpg
诉讼可视化,2017-12-01 00:00:00,社会文化-法律,天同律师通过不断地梳理实践经验，总结出了“用图表说话”的基本规律，这种直观、简洁、生动的信息表达方式，可以更好地说服法官、更好地保证办案质量，也更好地获得客户理解。作为一本完全以“诉讼可视化”为主题的图书，全彩印刷，用真实的案例、翔实的图表，手把手讲述画好一张诉讼图表的步骤要点，剖析不同案件中不同图表类型的选择和应用，做你随时随地可用可查的工具书。这是一本写给法律人的图表书，《诉讼可视化》重点阐述了图表制作的方法论，即诉讼可视化应该怎么做，如何将复杂的案头材料转化成简单明了的图表，并且在书中实列典型纠纷类型、实战案例的可视化应用。《诉讼可视化》由三个主要部分组成：第一章至第四章为图表制作方法论，旨在告诉大家，如何将纷繁复杂的案卷材料转化成简单明了的图表；第五章悉数典型纠纷类型的可视化应用；第六章由图表的实战案例组成。,11,790,0,44.1,https://wfqqreader-1252317822.image.myqcloud.com/cover/407/32323407/s_32323407.jpg
法的门前,2012-07-01 00:00:00,社会文化-法律,《法的门前》是美国经典法理学教材《法律之门》的作者之一彼得·德恩里科与原书中文译者邓子滨在原作的基础上，专为中国读者改编而成。原书在美国畅销30多年，历经8版，被誉为英美法的微型百科全书。《法的门前》既汲取了原书的精华，又特别为中国读者考虑，删繁就简，精心筛选和编撰了适合中国读者的素材和内容，尤其适合法学院的学生以及希望了解和思考美国司法模式的读者作为基础读物。,7,784,0,17.5,https://wfqqreader-1252317822.image.myqcloud.com/cover/372/651372/s_651372.jpg
检察官日记,2019-07-01 00:00:00,社会文化-法律,本书是从东部反贪一线的检察官的视角为读者呈送的原汁原味、热气腾腾的“法律大餐”。全书分体会篇和故事篇：体会篇是作者在多年的反贪污贿赂职务犯罪工作中，对于检察、反贪及相关的一些名词、现象的体会和感受，如“反贪局与纪委”“隐性福利”“刑讯逼供”等，在表达个人切身感受的同时，释明部分普通民众的误解，吐露基层反贪干警的心声，折射基层执法者对于当今反腐败工作的思考和忧虑；故事篇则是以第一人称的口吻，讲述了日常反贪工作中亲身经历或者所知晓的20余个职务犯罪案件或故事，作者摒弃了刻板的说教、冠冕的辞藻，用简单直白又蕴含规则的话语，揭示涉案者和办案者不同的视物角度、行事方式以及不同选择下的迥然结果，反映出我国贪污贿赂者以及反贪污贿赂执法者不同的价值观。本书作者是百万基层公务员、数万反贪干警中的普通一员，没有深厚的背景，也没有突出的智慧，但有朴实中的思考，平凡中的坚持：用心灵去感知民心民意，用热血去践行检情检魂，用忠诚去捍卫国法国威，肩负惩治和预防腐败重任，维护公平和正义。本书撷取其学习、工作和生活片段，真实再现了一个反贪检察官的成长历程，细腻地刻画了一个办案能手、预防骨干的心路历程和实践足迹。既坚决惩治腐败、侦查办案，又立足教育，挽救和感化罪犯；既深刻剖析腐败犯罪的根本原因，又深入挖掘腐败犯罪的深刻教训。,16,785,0,28.8,https://wfqqreader-1252317822.image.myqcloud.com/cover/643/33706643/s_33706643.jpg
民法（第七版）,2017-08-01 00:00:00,社会文化-法律,本书以我国《民法通则》《物权法》《合同法》《继承法》《侵权责任法》（婚姻法》等现行民事法律法规为依据，紧密结合最高人民法院的司法解释，借鉴外国与我国台湾地区的民事立法与司法实践，吸收国内外民法学研究的新成果，理论联系实际，系统论述了民法的基本理论、基本制度和基本知识。在内容上力求对现行民事理发作全面准确的阐释，在理论与体系上力求适应新世纪发展的需要。第七版结合了最新出台的《民法总则》，对书稿作了相应的修改与补充，体现了最新立法及理论水准。,9,886,0,55.2,https://wfqqreader-1252317822.image.myqcloud.com/cover/386/25665386/s_25665386.jpg
法务之道：成为精英法务的八堂课,2019-09-01 00:00:00,社会文化-法律,本书作者尝试“模拟”一名法务成长历程，从该法务踏进法务之门，历经法务理念的碰撞与技能的提升，法务沟通技巧的运用以及法务管理风格的选择，到最终成为一名总法律顾问，乃至进行转型、跳出法务之门这样一个“法务全生命周期”视角，整理出法务工作所需的知识和技能，归纳出法务成长所需的理论和方法。通过本书，读者可了解到法务学习的大致方向，掌握法务学习的一般方法，特别的，还额外可得到法务的“行动清单”和“资源列表”。总的来说，法务学习不仅要学习法律知识，更重要的是要学习行业知识、管理知识、财务知识。法务学习的方法，不仅是法律所要求的逻辑推演法，更重要的是管理所要求的归纳总结法；不仅是法律所推崇的程序至上法，更重要的是管理所希望的结果为重法。,15,740,0,28.99,https://wfqqreader-1252317822.image.myqcloud.com/cover/59/34550059/s_34550059.jpg
