title,publishTime,category,intro,maxFreeChapter,newRating,free,price,cover
中国政法大学法学专业考研笔记1：法理学,2017-09-01 00:00:00,社会文化-法律,《中国政法大学法学专业研考笔记》主要是针对考中国政法大学法学研究生的考生，套书包括5个分册，分别为法理学、宪法学、民法学、刑法学、民事诉讼法学。每本书都是对相应考研教材的提炼和综合整理，解析重点和难点，紧扣考点，能够有效地提高考生的学习效率和效果。,10,0,0,15.99,https://wfqqreader-1252317822.image.myqcloud.com/cover/356/26701356/s_26701356.jpg
中华人民共和国劳动法 中华人民共和国劳动合同法（附司法解释一、二、三、四）（2019年版）,2019-01-02 00:00:00,社会文化-法律,根据2018年12月全国人民代表大会常务委员会通过的《关于修改等七部法律的决定》，对其中涉及修改的《中华人民共和国劳动法》，根据修改决定的内容予以修订。收录修改决定及修改后的文本、劳动合同法及相关的司法解释，无加工内容。,10,0,0,3.99,https://wfqqreader-1252317822.image.myqcloud.com/cover/556/40457556/s_40457556.jpg
民事诉讼实务：思维·策略·技巧,2020-09-01 00:00:00,社会文化-法律,本书紧紧围绕民事诉讼实务，从多维度论述解决案件的思路，总结归纳出各种技巧、方法及常用答辩、抗辩意见，并结合具体案例说明，告诉读者每一个案件从起诉、应诉、庭前准备、答辩、质证该如何思考、如何操作，并具体对合同类、侵权类案件的民事诉讼技巧进行梳理、归纳。,11,0,0,49,https://wfqqreader-1252317822.image.myqcloud.com/cover/181/40908181/s_40908181.jpg
古律寻义：中国法律文化漫笔（修订3版）,2019-07-01 00:00:00,社会文化-法律,法学小品文章生动有趣，历史掌故趣闻信手拈来，法科入门学子人手必备，启蒙法律思想法制观念。本书以有趣的历史掌故、法律判决、民间传说、文学段子为引，阐发出为今日可借鉴之深意。本书是著名法律文化学者刘星所著《西窗法西》的姊妹篇。《西窗法西》是讲西方法律文化，《古律寻义》则是读中国法律文化。这股轻松的法学阅读之风定能使您开卷有益。,16,0,0,19.99,https://wfqqreader-1252317822.image.myqcloud.com/cover/909/34549909/s_34549909.jpg
代码2.0：网络空间中的法律（修订版）,2018-10-01 00:00:00,社会文化-法律,在众多以网络为主题的书籍中，这是一本问世多年却没有过时的书！于是，它成了经典之作，荣膺学术名著和畅销读物两项桂冠。本书在西方发达国家已成为法律学、公共管理学、商学、传播学、政治学和信息科学技术专业的必读书。对于政府管理者、法律执业者、ICT企业管理者、创意产业从业者和广大信息工程技术人员来说，这是一本能够启迪思维的难得之作。,13,650,0,51.87,https://wfqqreader-1252317822.image.myqcloud.com/cover/468/26793468/s_26793468.jpg
劳动合同法：释义与实务操作,2007-09-01 00:00:00,社会文化-法律,劳动争议范围不断扩大，是出台《劳动合同法》的直接原因。在《劳动法》颁布的1994年，全国5000万国有企业职工均有固定的身份，“单位”一词依旧盛行。1998年，国企开始大量裁员，5000万名国企职工的绝大多数被推向市场，劳动关系的内涵已经发生了天翻地覆的变化。如今，不仅国企职工的劳动关系走向了市场，另有至少1.2亿农民工加入其中，个体经济组织、私营企业、三资企业空前壮大，这一系列的新劳动关系，都需要用新的《劳动合同法》来调节。根据测算，目前已有九成以上的劳动关系在按市场法则行事。而这些关系，需要新的法律调整和规范。 ,4,773,0,1.99,https://wfqqreader-1252317822.image.myqcloud.com/cover/801/311801/s_311801.jpg
物权法（第六版）,2016-08-01 00:00:00,社会文化-法律,本书因袭现行法的体例，分为总论、所有权、用益物权、担保物权以及占有五编，对物权法的内容做了全景式的阐述，并加以客观独到的评析。本次新版，作者充分汲取最新立法、司法解释、审判实务和理论研究的新成果，尤其是最 高人民法院就物权法实施中具体适用《物权法》相关问题所作的三个解释，并注入了域外物权法修订后的最新内容，以期为读者提供准确、全面、系统、新鲜的物权法理论和知识。全书概念明晰、阐述透彻、考据周延，理论深度把握得当，既考虑到本科教学的系统性要求，又为读者进一步研究物权法提供了参考思路。,27,952,0,18.9,https://wfqqreader-1252317822.image.myqcloud.com/cover/478/32322478/s_32322478.jpg
旧邦新造（第二版）,2016-08-01 00:00:00,社会文化-法律,《旧邦新造》是一本以中国1911-1917年间的大转型为研究对象的法律史著作，探讨了中国在多民族王朝国家瓦解、帝国主义列强环峙、政治精英高度分化的恶劣环境中艰难的建设历程，并试图重构20世纪中国政治法律史的叙事。本书第一版出版以来，受到了学术界的广泛关注，并引发了深度的讨论。作者根据近几年的研究对全书进行了全新修订，并增补了&quot;国体、精英吸纳和荣典制度&quot;等多篇内容，深度剖析了1911-1917年大转型的法理基础。,15,923,0,36,https://wfqqreader-1252317822.image.myqcloud.com/cover/193/25665193/s_25665193.jpg
法律文书写作（2018年版）,2018-12-01 00:00:00,社会文化-法律,本书是全国高等教育自学考试法律专业的指定教材，是参加自考的学生必读图书。书中由法律文书写作自学考试大纲和法律文书写作自学考试教材两部分构成。大纲是自学考试范围的指导性文件，教材根据大纲的要求及自考学生的学习特点，对法律文书写作的基本原理和相关的法律法规及制度进行了系统而全面地阐述，结构合理而清晰介绍，同时在书中还为参加考试的考生准备了自学考试模拟试卷，以供考生准备考试时参考使用。法律文书是司法机关、公证机关、仲裁组织等依法处理诉讼案件和非诉讼案件所做出的表明裁决结果或律师提供法律服务过程中所使用的特定书面形式的文书，是从事法律工作者必会的知识。,25,719,0,32.8,https://wfqqreader-1252317822.image.myqcloud.com/cover/27/26833027/s_26833027.jpg
你办的不是案子，而是别人的人生,2019-10-01 00:00:00,社会文化-法律,本书是作者在一线办案的思考与总结，紧密结合当下的司法改革实践，与最前沿的司法理念接轨。本书也是《检察再出发》一书的续篇。作者坚持不忘初心，面向未来，代表了最新一代检察官的人文情怀与法治信念。能够引领关于“检察再出发”的新一轮思考。,10,719,0,41.86,https://wfqqreader-1252317822.image.myqcloud.com/cover/785/27111785/s_27111785.jpg
中华人民共和国招标投标法（最新修正本）,2018-01-03 00:00:00,社会文化-法律,为加强法制宣传，迅速普及法律知识，服务于我国民主法制建设，多年来，中国民主法制出版社根据全国人大常委会每年定期审议通过、修订的法律，全品种、大规模的出版了全国人民代表大会常务委员会公报版的系列法律单行本。,2,892,0,3.24,https://wfqqreader-1252317822.image.myqcloud.com/cover/416/25915416/s_25915416.jpg
公司法论,2014-12-01 00:00:00,社会文化-法律,本书以对中国公司法自身的关注和讨论为基本定位和终极目的；注重引进国外成熟的理论和制度以及司法经验并在比较法的意义上使之原理化；再将之与中国具体公司实践相结合，使之“本土化”；意图在借鉴国外公司理论与制度的基础上构建中国公司法的基本原理。,28,0,0,29.7,https://wfqqreader-1252317822.image.myqcloud.com/cover/579/32321579/s_32321579.jpg
反不正当竞争法新原理·原论,2019-03-01 00:00:00,社会文化-法律,2016年国务院有关部门正式启动《反不正当竞争法》修订工作以后，为配合和参与法律的修订，廓清对于反不正当竞争法的认识，作者先后撰写了有关反不正当竞争法的历史由来、发展节点和现代精神的文章。在这些文章的基础上，经整合、扩张并增加新资料，尤其是结合新修订法律和新近裁判，形成了本书。本书结合《民法总则》和新修订《反不正当竞争法》的有关规定，紧密结合司法实践，就两法之间的一般关系、反不正当竞争法在法益保护、行为判断方式等方面与民事制度的连接点进行了探讨，对于反不正当竞争法的现代定位、竞争法取向以及判断范式等进行了专题研究。,13,0,0,38.7,https://wfqqreader-1252317822.image.myqcloud.com/cover/321/32324321/s_32324321.jpg
民事诉讼法（第二版）,2017-09-01 00:00:00,社会文化-法律,本教材吸收和借鉴既有民事诉讼法教材编写经验，在内容上注重对我国民事诉讼法学界前沿理念和问题的介绍，以及民事诉讼法法规及司法解释的理解和适用。该教材在全面系统的介绍我国民事诉讼法理基础上，更为注重学生对民事诉讼程序规定的掌握和运用，为此在教材的体例设置上，每章分设六个部分：本章需要掌握知识要点、正文、案例精选、思考问题、法条链接以及扩展阅读，这样更有利于教学使用。本次改版在第一版的基础上，根据最新的司法解释及相关法规，对全书进行了修订补充，并且删除了第一版中的非重点问题，使本书更加适合教学使用,7,833,0,71.2,https://wfqqreader-1252317822.image.myqcloud.com/cover/871/26832871/s_26832871.jpg
《中华人民共和国刑法》释解与适用（下）,2021-03-31 00:00:00,社会文化-法律,《最新<中华人民共和国刑法>释解与适用》对修订后的刑法进行逐条深入解读，每条后附关联法律，司法解释。具有较高的权威性，实用性。全书共分2编15章：第一编总则，第一章刑法的任务、基本原则和适用范围，第二章犯罪，第三章刑罚，第四...,4,0,0,180.6,https://rescdn.qqmail.com/weread/cover/247/3300003247/s_3300003247.jpg
法理学导论：实践的思维演绎（修订本）,2016-11-10 00:00:00,社会文化-法律,本书的特点是先具体、再抽象，以真实新闻报道、文学作品等具体案例引出理论，逐步走向对法理学知识的讲述，并展开法理逻辑思维的演绎。包括法律是什么、法律有什么效力、法的起源、法律如何发展、法律怎样实现等内容，将法理学可能涉及的一些思路、甚至可能富有争议的思路展示出来，提示读者自我思考，并提升逻辑能力。作者行文逻辑缜密，语言简洁易懂，专业但不枯燥，本书既有学习研究价值，又有阅读趣味和启发性。本版由作者亲自进行了修订，内容更加完善。,6,783,0,27.99,https://wfqqreader-1252317822.image.myqcloud.com/cover/743/26702743/s_26702743.jpg
民事诉讼法学教程（第五版）,2018-01-01 00:00:00,社会文化-法律,本书为北京大学法学院本科学生相关课程的指定教科书。本教材以诉权与审判权的关系为主线，分别对民事诉讼基本理论、基本原则、基本制度、辅助和保障性制度以及诉讼程序、非讼程序、执行程序、涉外民事诉讼程序等进行了理论、规范和实践三个层面的阐释，在对民事程序基本原理和一般规律进行揭示的基础上，本教材着重对程序与程序之间、制度与制度之间、程序与制度之间的关系进行了较为系统的梳理，并结合民事诉讼法学的理论和实践发展对教材的内容进行了全面的更新，对新增型、修正型、删除型内容给予了专门解析，从而保障了本教材的体系性、前沿性和完整性深受全国其他高校的法律院系师生的垂青和关爱，成为该领域的经典教材。,17,818,0,39.2,https://wfqqreader-1252317822.image.myqcloud.com/cover/475/25665475/s_25665475.jpg
刑事审判参考 2021年第1辑 总第125辑,2020-12-01 00:00:00,社会文化-法律,"丛书自1999年4月创办以来，秉承立足实践、突出实用、重在指导、体现权威的编辑宗旨，在编辑委员会成员、作者和读者的共同努力下，密切联系刑事司法实践,为刑事司法人员提供了有针对性和权威性的业务指导和参考，受到刑事司法工作人员和刑事法律教学、研究人员的广泛欢迎。丛书主要收录指导案例、刑事司法规范及其理解与适用、刑事政策及其解读、理论前沿、实务探讨、编辑部答疑、经验交流、疑案争鸣等内容。2021年，作者将对丛书的体例、栏目设置及相关内容等进行完善和提升，力求以全新的面貌将更权威、实用的内容展现给读者。",10,0,0,47.6,https://rescdn.qqmail.com/weread/cover/375/3300003375/s_3300003375.jpg
证据法要义,2009-06-01 00:00:00,社会文化-法律,《证据法要义》讲述了：“法学名师讲堂”汇集中国顶尖法学学者联手撰写经典教材。名师倾毕生所研精妙于一书，传道授业，引领学子进入法学世界自在修为，一册在手，受益终生。,9,774,0,24.16,https://wfqqreader-1252317822.image.myqcloud.com/cover/871/24273871/s_24273871.jpg
中华人民共和国行政处罚法 中华人民共和国行政许可法 中华人民共和国行政强制法 中华人民共和国行政复议法 中华人民共和国行政诉讼法,2021-01-01 00:00:00,社会文化-法律,为加强法制宣传，迅速普及法律知识，服务于我国民主法制建设，多年来，中国民主法制出版社根据全国人大常委会每年定期审议通过、修订的法律，全品种、大规模地出版了各类法律单行本。本书将中华人民共和国行政诉讼法、中华人民共和国行政处罚法、中华人民共和国行政复议法、中华人民共和国行政许可法、中华人民共和国行政强制法合集成册。以大开本、大字体的形式出版，是合适行政部门的工作人员方便查询的案头工具书。,6,0,0,12.8,https://wfqqreader-1252317822.image.myqcloud.com/cover/23/43778023/s_43778023.jpg
中华人民共和国消费者权益保护法（实用版）（2018年版）,2018-08-15 00:00:00,社会文化-法律,现行消费者权益保护法于1993年10月31日通过，于1994年1月1日起实施。2013年曾进行过修正。现行消费者权益保护法实施以来，对保护消费者权益，发挥了重要作用。但是，随着经济社会的不断发展，我国的消费方式、消费结构和消费理念发生了很大变化，在消费者权益保护方面出现了很多新情况、新问题，有必要适时修改这部法律，以完善消费者保护的法律制度。本书以消费者权益保护法为主体法，辅以注释、案例等，帮助广大读者学法用法。,22,0,0,8.99,https://wfqqreader-1252317822.image.myqcloud.com/cover/433/40457433/s_40457433.jpg
中华人民共和国合伙企业法（实用版）（2018年版）,2018-08-29 00:00:00,社会文化-法律,本书收录合伙企业法及相关配套法律法规文件，对合伙企业法的重点、难点法条进行条文注释，提供关联法规链接及相关典型案例，帮助读者理解和把握法律规定的精髓；书后还附录相关文书等内容，为读者解决相关法律纠纷提供最密切、最直接的条文规定，是学习适用我国合伙企业法相关法律制度的实用指导用书。,37,0,0,7.99,https://wfqqreader-1252317822.image.myqcloud.com/cover/469/40457469/s_40457469.jpg
法律的精神：法律格言智慧警句精选,2016-01-01 00:00:00,社会文化-法律,"法律名言，作为人类共同的财富，不仅是前辈智慧的结晶，更是中外古今法律发展史的有效见证。了解一个时期的法律文明，完全可以从该时期的法律名言中找到缩影。法律名言，不仅总结出法律文明的真谛，更抽象出人们心中对法的渴望和见解。博览古今中外，法律名言如星斗一般，数目甚多，所跨领域也甚为宽广。在此，我们汇编整理了一些中外古今的法律名言，与志同道合的您一起分享。为了方便大家阅读，我们在汇编时进行了十七个分类，分别为：宪政与法治的力量；法律的本质；法律的运行；暴力与权利；平等、民主与自由；公平正义；道德、习惯与宗教；刑罚的正义；私法的规则；行政权力的制约；经济利益的掌控；程序公正的价值；法律与社会……
",6,806,0,14.99,https://wfqqreader-1252317822.image.myqcloud.com/cover/201/911201/s_911201.jpg
股权投融资交易结构：设计要点与体系化考量,2020-11-01 00:00:00,社会文化-法律,交易结构是股权投资的核心，是交易各方谈判和博弈的主阵地，一项合理的股权交易结构，不仅能够节约交易成本，也在合规性、交易效率等方面考虑周全。本书作者梳理整合了股权投融资项目的交易结构核心问题，结合实操经验将交易结构的核心要素进行了提炼和详细分析，并相对完整地搭建了交易结构的理论和知识体系，可以作为股权投融资项目在实际操作时的参考和指引。全书包含十二章，对构成交易结构的十项核心要素进行了逐一剖析，列出了实务要点、问题聚焦，并结合大量具体案例进行了深入分析。最后一章提供了交易结构落地所需要的核心法律文本，供读者参考。,67,0,0,63.99,https://wfqqreader-1252317822.image.myqcloud.com/cover/49/40908049/s_40908049.jpg
网络攻防实战研究：漏洞利用与提权,2018-03-01 00:00:00,社会文化-法律,本书主要讨论目前常见的漏洞利用与提权技术，分别从攻击和防御的角度介绍渗透过程中相对最难，同时又是渗透境界的部分——如何获取服务器乃至整个网络的权限。本书共分9章，由浅入深，按照读者容易理解的方式对内容进行分类，每一节介绍一个典型应用，同时结合案例进行讲解，并给出一些经典的总结。本书的目的是介绍漏洞利用与提权技术，结合一些案例来探讨网络安全，从而远离黑客的威胁。通过本书的学习，读者可以快速了解和掌握主流的漏洞利用与提权技术，加固自己的服务器。,41,773,0,76.8,https://wfqqreader-1252317822.image.myqcloud.com/cover/578/23914578/s_23914578.jpg
企业法律顾问实战业务手记（增订版）,2018-01-01 00:00:00,社会文化-法律,选录诉讼与非诉业务涉及的多种类型法律文书，包括起诉应诉答辩状、代理词、合同范本、非诉案件法律意见。总结各专题案件法律风险和处理关键，记录资深律师办理业务的思维方式、逻辑出发点，为办理类似案件提供可行的突破思路。,7,0,0,55.99,https://wfqqreader-1252317822.image.myqcloud.com/cover/959/26540959/s_26540959.jpg
中国物权法总论,2014-06-01 00:00:00,社会文化-法律,物权法作为构建社会基本秩序的法律，它的贯彻实施对于促进社会稳定与繁荣具有重大意义。但是该法的贯彻实施还是需要法理和实践的跟进。近年来中国民法的学术和实践都有很大进步。本书第三版在强化了物权法学中的民权思想和科学原理方面做出了进一步的努力。本书是一本物权法学原理性的著作，而不是《物权法》条文的释义。本书的基本定位是以物权法学基础理论探讨为主。本书修订之后连同绪论所呈现的十章，在全书自身逻辑下，每一章也可以作为独立的专题讨论来看待。为方便一些读者对感兴趣的专题研讨的阅读，本书对每一个专题下的法理都进行了细致的展开。从物权、物权法基本范畴、物权变动的基本概念的科学性探讨开始，本书展现了物权从“定分止争”、保障交易安全到物权保护的系统性理论问题。读者既可以全书通读，也可以选择感兴趣的章节阅读。本书含有许多案例，这些案例都是来源于中国实践的真实例子。这样，读者可以从这些案例中自己体会到将法理应用于实践的乐趣，相信不同专业知识层次的读者都会读懂本书。为了加强对于一些问题的理解，尤其是不太方便在本题中展开的思路，本书新设“问题讨论”这个栏目，附在每一节基本理论阐述之后，就本节没有展开或者无法展开的理论与现实问题进行了讨论，希望能够达到促进思考的效果。,10,0,0,33.75,https://wfqqreader-1252317822.image.myqcloud.com/cover/495/32321495/s_32321495.jpg
与手枪的不幸相遇,2017-03-01 00:00:00,社会文化-法律,中国成文法律很多从日本习得，但目前国内专门介绍日本司法的图书却很少。本书试图弥补这方面的空白。本书汇集了日本自明治维新以来发生的十二个里程碑案例，包括著名的大津案、帝银事件、松川事件、八海事件等，将日本近百年来的司法历程娓娓道来。本书的作者是在日本享有盛誉的小说家，作者通过自己特有的细腻笔触和幽默的写作手法，将枯燥、专业的法律案件，写成生动的、非常具有可读性的图书。本书不仅适合法律专业读者阅读，也非常适合普通大众读者阅读。,23,895,0,39.2,https://wfqqreader-1252317822.image.myqcloud.com/cover/148/31232148/s_31232148.jpg
诉讼方法论：知识产权律师执业思维与办案逻辑,2020-02-17 00:00:00,社会文化-法律,本书详细阐述了知识产权律师的职业特点和执业素养，创新总结了律师的法律营销思维和客户体验提升，专门介绍了律师必备的法律、案例和文献检索等三大检索技能，系统阐述了知识产权诉讼方案的设计思路；并从客户会见、立案准备、庭审准备、开庭前后和结案前后等角度，全面梳理了从收案到结案各个环节的实务操作、执业方法和策略考量。以详实、务实的角度，打造了一本法科学生的实战教科书，一本青年律师的入门进阶书，一本成功律师的新人培训参考书，一本企业法务的诉讼管理参考书！,18,0,0,48.3,https://wfqqreader-1252317822.image.myqcloud.com/cover/519/34752519/s_34752519.jpg
中华人民共和国婚姻法（实用版）（2018年版）,2018-08-31 00:00:00,社会文化-法律,本书收录了1980年9月10日第五届全国人民代表大会常务委员会第三次会议通过，2001年4月28日第九届全国人民代表大会常务委员会第二十一次会议最新修正的《中华人民共和国婚姻法》全文，就重点条文添加理解与适用、相关条文链接、典型案例索引等注释。其后还附录了与我国婚姻家事制度相关的重要法律、行政法规、部门规章、司法解释等配套文件，是学习适用我国家事相关法律制度的实用指导用书。,17,0,0,10.99,https://wfqqreader-1252317822.image.myqcloud.com/cover/465/40457465/s_40457465.jpg
行政诉讼法（第二版）,2016-03-01 00:00:00,社会文化-法律,《行政诉讼法》（何海波 著）是关于行政诉讼法非常有特色的体系性专著。特点有三：问题全面：从行政诉讼透视行政法，其中占据篇幅最多的是司法审查的标准。内容翔实：援引大量法律、法规以及数百个案例，几乎穷尽最高法院相关司法解释。编排清晰：本书从回应行政诉讼的现实问题出发编排，案例叙述重新归纳，力求明白、精炼，可读性强。第二版根据2014年《行政诉讼法》的重大修改，以及最高法院发布的最新司法解释，过去几年中各地法院产生的众多有新颖性和代表性的案例，最高法院发布的若干指导性案例，将内容做了较大幅度的增删，数据做了更新，书中的文字也从头至尾翻修一遍。全书的体系结构基本不变，部分章节做了调整。,24,0,0,39.6,https://wfqqreader-1252317822.image.myqcloud.com/cover/110/32322110/s_32322110.jpg
最高人民法院关于买卖合同司法解释理解与适用（条文·释义·理由·案例）,2016-02-01 00:00:00,社会文化-法律,本书由最高人民法院参与买卖合同司法解释起草工作并具备多年审判工作经验的法官以买卖合同司法解释的条文规定为主线结合司法实务中买卖合同纠纷处理积累的实践经验进行编写。全书通过条文主旨、背景依据、条文理解、审判实务等内容逐条对...,11,0,0,68.6,https://weread-1258476243.file.myqcloud.com/weread/cover/32/3300011232/s_3300011232.jpg
