title,publishTime,category,intro,maxFreeChapter,newRating,free,price,cover
劳动法疑难问题实务指南,2019-08-01 00:00:00,社会文化-法律,本书由大成律师事务所劳动法执业律师根据一线执业实务经验撰写，所涉及的都是前沿的有代表性的实务中的疑难问题，涵盖劳动关系的认定、劳动合同的订立与履行、劳动合同的解除与终止、劳动报酬与工时休假、社会保险、规章制度、保密与竞业限制、劳务派遣、劳动争议处理等诸多方面内容，有着极强的实务指导作用。不仅传授劳动争议解决技巧，更呈现解决劳资纠纷的艺术。,22,0,0,38.99,https://wfqqreader-1252317822.image.myqcloud.com/cover/6/34550006/s_34550006.jpg
全国法律硕士专业学位研究生入学联考考试指南（第十九版）,2018-10-01 00:00:00,社会文化-法律,由全国法律专业学位教育指导委员会组织编写，全国法律硕士联考经典辅导教材。 含刑法学、民法学、宪法学、法理学、法制史5科。 每个科目均有详细的基本知识的讲解。 其中，刑法学含总论和分论共10多个章节。民法共16个章节。宪法学、法理学和法制史也有多个章节的讲述。,70,913,0,94.8,https://wfqqreader-1252317822.image.myqcloud.com/cover/405/26398405/s_26398405.jpg
西方法学史纲（第三版）,2016-07-01 00:00:00,社会文化-法律,中国近现代法学，是一个舶来品，它源自西方。那么，西方法学是何时产生？产生后又是如何发展，其学术风貌又是如何？本书依次对古代希腊的法学思想、罗马法学的形成与发展、中世纪欧洲法学的风貌，以及法国、德国、英国、美国和日本等主要西方国家法学的形成与发展做了详实的介绍和评述。最后，本书以基础法学如法理学、法史学、法社会学和比较法学为线索，对第二次世界大战以后至今西方法学的发展进行了总结。,18,0,0,26,https://wfqqreader-1252317822.image.myqcloud.com/cover/938/24905938/s_24905938.jpg
中华人民共和国食品安全法（2019年版）,2018-12-31 00:00:00,社会文化-法律,根据2018年12月全国人民代表大会常务委员会关于修改中华人民共和国产品质量法等17部法律的决定，对其中涉及修改的中华人民共和国食品安全法，根据修改决定的内容予以修订出版，收录修改决定及改后正文，无加工内容。,7,0,0,3.99,https://wfqqreader-1252317822.image.myqcloud.com/cover/232/40457232/s_40457232.jpg
法律人如何思考：法律人的逻辑艺术,2016-01-01 00:00:00,社会文化-法律,"什么是逻辑艺术呢？我们经常听到诸如“领导艺术”“思维艺术”“战争艺术”等词组。不难体会到，这些词组中的后缀词“艺术”都与某些方法、技术、技巧或本领紧密相关，然而它本身并不等同于方法、技能。反过来说，方法本身不是艺术，熟练地掌握方法、自如地运用方法、对方法中的要素进行巧妙剪裁，这才是艺术，即方法的巧妙运用或应用才是我们这里所讲的“艺术”。将逻辑艺术创造性地应用到公、检、法、司以及公民维权、社会的行政执法（如城管、审计等）等政法实践的各个环节中，让逻辑艺术走进我们的法治社会之中，我们就开辟了将逻辑与政法实践紧密结合的应用逻辑新领域，就能孕育出许许多多具有特色的解决法律疑难问题的逻辑技术手段。
",15,643,0,11.99,https://wfqqreader-1252317822.image.myqcloud.com/cover/200/911200/s_911200.jpg
人力资源法律风险管控及实务操作方案,2015-05-01 00:00:00,社会文化-法律,《人力资源法律风险管控及实务操作方案》特点：实用性契合企业人力资源管理和劳动争议律师办案实际，专家提示助您规避劳动用工风险；权威性专业律师倾情打造，数十期业内培训，法律法规均为现行有效；全面性一册在手，管理无忧，全面涵盖企业人力资源管理和劳动争议处理各个环节；工具性以劳动用工法律关键点展开，分类清晰，针对性强，精准定位，快速查找。,13,0,0,24.99,https://wfqqreader-1252317822.image.myqcloud.com/cover/255/23567255/s_23567255.jpg
物业管理条例新解读（第四版）,2017-01-01 00:00:00,社会文化-法律,"“法律法规新解读”丛书作为一套实用型法规汇编，历经三版，以其权威、实用、易懂的优点，赢得了广大读者的认可，真正成为“遇事找法者”运用法律维护权利和利益的利器。本丛书选取与日常生活密切相关的法律领域，将各领域的核心法规作为“主体法”，并且将与主体法相关联的法律法规分类汇编。《物业管理条例》是根据《国务院关于修改的决定》修订的，为的是规范物业管理活动，维护业主和物业服务企业的合法权益，改善人民群众的生活和工作环境而制定的。由国务院于2007年8月26日发布，自2007年10月1日开始施行。共7章70条。《国务院关于修改部分行政法规的决定》国务院令第666号,已经2016年1月13日国务院第119次常务会议通过，现予公布，自公布之日起2016年3月1日施行。根据决定第三十五条之规定，删去《物业管理条例》第三十三条、第六十一条。",33,0,0,12.99,https://wfqqreader-1252317822.image.myqcloud.com/cover/329/23567329/s_23567329.jpg
企业合同审查法律实务（第二版）,2014-06-01 00:00:00,社会文化-法律,本书的作者团队包括了律师、法官、教研人员，他们运用鲜活的教学思维来总结归纳丰富的实务经验，即通过“内容概述”、“问题条款”、“修改分析”、“示范条款” 等形式来对企业常用合同进行细节分析，辅之“注意事项”、“以案说法”、“修改对照”、“法律意见书”等形式来阐述企业合同审查的实务技巧。,29,833,0,29.99,https://wfqqreader-1252317822.image.myqcloud.com/cover/482/26245482/s_26245482.jpg
公司法裁判规则解读,2018-08-01 00:00:00,社会文化-法律,精选近五百个典型案例，汇总百余个争议性问题，全面解读创新性实践中的公司法1.精选最高人民法院、各省高级人民法院审理的具代表性和典型性的公司法案例，体现案例权威性。将案情高度浓缩，节约读者时间，极大提升阅读效率和阅读体验。2.体例上包括裁判要旨、案情简介、败诉原因、败诉教训与经验总结、相关法律规定、本案链接、延伸阅读七个部分，深入剖析败诉原因，重点总结实务经验教训并出法律建议。3.部分重点案例后附有“延伸阅读”部分，或对与该案例相关的地方性规定或地方高院的指导意见加以总结，或对与该案例案情相近似的案例加以总结，以帮助读者综观司法实践全貌。,31,826,0,67.99,https://wfqqreader-1252317822.image.myqcloud.com/cover/532/26245532/s_26245532.jpg
新编法经济学：原理·图解·案例,2018-03-01 00:00:00,社会文化-法律,本书介绍了法经济学的基本原理和方法论，主要介绍了法经济学的一系列基本假设、范畴、定理、价值、方法，讨论和分析诸如法律的成本效益理论、法律市场理论、法律供求理论、法律均衡理论等相关原理，将法律经济学这一新颖理论体系与中国法治实践相结合，既深入探究其本体内涵、结构关系，又将法经济学应用到各个部门法和立法、司法、执法、守法等法治环节之中。,23,0,0,40,https://wfqqreader-1252317822.image.myqcloud.com/cover/560/40909560/s_40909560.jpg
培训管理全流程实战方案,2019-02-01 00:00:00,社会文化-法律,培训很贵，不培训更贵。理念认知、课程研发、制度流程和费用预算等问题都困扰着企业人力资源发展和企业自身的发展。如何打造系统高效的培训操作程序？如何跟得上科技创新带来的培训发展的新增长极？本书坚持“流程步骤 工具方法 案例分析”的体例逻辑，让读者先了解培训管理的操作程序，然后施予方法和工具，最后用大量的实操案例和图表强化实务操作流程，也同时展现其他企业有较强参考性的实践。,10,548,0,29.99,https://wfqqreader-1252317822.image.myqcloud.com/cover/767/26245767/s_26245767.jpg
誓言：白宫与最高法院,2019-08-01 00:00:00,社会文化-法律,《九人》姊妹篇，《纽约客》非虚构写作标杆，接续《九人》的叙述，详细回顾了在奥巴马第一个总统任期内，美国联邦最高法院的重要判决、人员变动以及与白宫、国会之间的关系等。最高法院与白宫的关系为何变得紧张，新上任的两名女大法官将带来哪些改变，最高法院的意识形态对立会如何影响美国社会……这些宏大抽象的问题经图宾之笔变得生动风趣，过目难忘。本书是对近年来美国社会焦点议题的一次全景扫描，既涉及控枪、堕胎、竞选资金等长期存在的问题，也涉及民粹主义兴起、社会阶层分化、两党分歧加深等与当下息息相关的问题，这些社会矛盾最终都将转化为司法问题，呈现在联邦最高法院。读者能从本书中找到特朗普上台的线索，也能明白为何美国社会撕裂加剧，由此理解美国内政外交政策在未来将如何转变。,8,733,0,52.99,https://wfqqreader-1252317822.image.myqcloud.com/cover/366/25957366/s_25957366.jpg
中国法院2019年度案例：保险纠纷,2019-05-01 00:00:00,社会文化-法律,本书是《中国法院2019年度案例系列》（全23册）的一个分册。内容包含财产保险、人身保险代位求偿权等案件。所选案例均是国家法官学院从各地2018年上报的典型案例中挑选出来的精品案例，全面涵盖该领域常见纠纷内容。案情凝练，并由主审法官精心撰写裁判要旨与法官后语，可读性、适用性强，能帮助读者最大限度地节约查找和阅读案例的时间，获得真正有用的信息，为法官、检察官、执法人员、律师、法律顾问办理相关案件以及案件当事人处理纠纷必备参考书。,5,918,0,28.99,https://wfqqreader-1252317822.image.myqcloud.com/cover/997/26245997/s_26245997.jpg
2020年法律硕士（非法学）联考重要主观题背诵（含关键词）,2019-04-01 00:00:00,社会文化-法律,主要内容为法律硕士联考专业课考试中，5个学科即刑法学、民法学、中国宪法学、法理学和中国法制史的讲座，每个学科分数十个专题，每个专题选取学科中的重要知识点，以点带面，讲深讲透，中间穿插例题和案例，实用性强，能够解决考试复习的实际问题，帮助考生获取高分。,6,857,0,29.94,https://wfqqreader-1252317822.image.myqcloud.com/cover/553/26398553/s_26398553.jpg
刑法分则专题研究,2013-05-01 00:00:00,社会文化-法律,本书将刑法分则中最为重要的28个罪名进行学术上的解读，对故意伤害罪、绑架罪、抢劫罪等，按照四要件的理论基础，对各犯罪进行分解，并通过典型的案例来说明各罪名的发展和疑难点，对于研究人员进行分则的科学研究具有重要的指导作用。,35,850,0,58.8,https://wfqqreader-1252317822.image.myqcloud.com/cover/401/26243401/s_26243401.jpg
征地拆迁焦点问题实务指引及案例解析,2019-06-01 00:00:00,社会文化-法律,本书中以《国有土地上房屋征收与补偿条例》为主轴展开，一并融合集体土地征收的有关规定，选取办理相关征收拆迁案件重要节点，对不动产征收实务的重点难点问题进行梳理，使本书对不动产征收有个系统性的介绍。同时，书中还收录了实务中的典型案例进行专业评述，链接关联法规，以期能对厘清不动产征收中的模糊认识有所助益。,10,0,0,23.99,https://wfqqreader-1252317822.image.myqcloud.com/cover/217/26246217/s_26246217.jpg
中华人民共和国民法典·婚姻家庭,2020-06-01 00:00:00,社会文化-法律,《中华人民共和国民法典》被称为“社会生活百科全书”，是民事权利的宣言书和保障书，如果说宪法重在限制公权力，那么民法典就重在保护私权利，几乎所有的民事活动大到合同签订、公司设立，小到缴纳物业费、离婚，都能在民法典中找到依据。民法典共7编，依次为总则编、物权编、合同编、人格权编、婚姻家庭编、继承编、侵权责任编，以及附则，共1260条。,2,839,0,1.89,https://wfqqreader-1252317822.image.myqcloud.com/cover/650/34779650/s_34779650.jpg
中华人民共和国民法典·总则,2020-06-01 00:00:00,社会文化-法律,《中华人民共和国民法典》被称为“社会生活百科全书”，是民事权利的宣言书和保障书，如果说宪法重在限制公权力，那么民法典就重在保护私权利，几乎所有的民事活动大到合同签订、公司设立，小到缴纳物业费、离婚，都能在民法典中找到依据。民法典共7编，依次为总则编、物权编、合同编、人格权编、婚姻家庭编、继承编、侵权责任编，以及附则，共1260条。,2,0,0,1.89,https://wfqqreader-1252317822.image.myqcloud.com/cover/641/34779641/s_34779641.jpg
像律师一样思考,2020-06-01 00:00:00,社会文化-法律,如何像律师一样思考？本书作者立足于实务研究，瞄准律师实务工作中最核心的要素——律师思维、案件事实的认定和分析、证据规则与证明、法律论证以及这些要素之间的相互关系。作者从律师执业方法论的角度对律师思维、律师工作进行分析，并援引多个知名案例，向有志于成为律师或已在律师事务所工作的各位读者清晰地展现律师应有的思维模式。,7,0,0,27.99,https://weread-1258476243.file.myqcloud.com/weread/cover/79/3300022679/s_3300022679.jpg
公安机关办理行政案件程序规定（2018年版）,2018-12-14 00:00:00,社会文化-法律,《公安机关办理行政案件程序规定》为了规范公安机关办理行政案件程序，保障公安机关在办理行政案件中正确履行职责，保护公民、法人和其他组织的合法权益，根据《中华人民共和国行政处罚法》、《中华人民共和国行政强制法》、《中华人民共和国治安管理处罚法》等有关法律、行政法规制定的部门规章。2018年11月25日公布的《公安部关于修改〈公安机关办理行政案件程序规定〉的决定》共49条，增加了“快速办理”、“办案协作”等内容。,10,0,0,5.99,https://wfqqreader-1252317822.image.myqcloud.com/cover/554/40457554/s_40457554.jpg
物权法研究（第四版）（上、下卷）,2016-10-10 00:00:00,社会文化-法律,"    《物权法研究》（第三版）分为上、下两卷，全书以我国《物权法》为依据，密切结合我国有关物权的理论与司法实践，针对《物权法》起草过程及颁行之后提出的各种理论和实务问题，并值鉴国外物权立法的先进经验及最新学术研究成果，对我国物权法的理论体系、基本原则，以及各项基本制度和规范进行了较为全面、详尽的研究。在上卷中，作者详尽分析了物权法的各项基本原则，认为物权的请求权是一种特殊的请求权类型；对于物权变动，作者认为，我国《物权法》并未采纳物权行为理论，而是采纳了债权意思表示加登记或交付的模式；在所有权编中，作者对所有权的一般原理、所有权的取得、所有权的类型进行了较为深入的研究。
",9,952,0,178.8,https://wfqqreader-1252317822.image.myqcloud.com/cover/350/26923350/s_26923350.jpg
婚姻家庭继承法学（第四版）,2019-03-01 00:00:00,社会文化-法律,本书是在我国婚姻家庭继承法制建设不断发展的形势下，为了适应高等法学教育需要，由北京大学法学院教授、中国婚姻家庭法学研究会副会长马忆南编写的。书中对学科体系结构和内容都作了新的设计，吸取了《物权法》《侵权责任法》《民法总则》等最新的立法、司法及学术研究成果。在系统描述婚姻家庭继承法知识的基础上突出了三点：第一，精阐原理；第二，结合实践；第三，关注前沿。各章附有复习思考题，书后附有相关法律、法规和司法解释以及阅读参考文献目录。可供各种高等教育法学专业本科生、研究生、专科生使用，也可供立法、司法和法律实务工作者参考。,25,759,0,47.2,https://wfqqreader-1252317822.image.myqcloud.com/cover/370/26833370/s_26833370.jpg
中华人民共和国法律=The Laws of the Peoples Republic of China(2014)：英文,2017-03-01 00:00:00,社会文化-法律,本书是全国人大及其常委会2014年公布的法律及相关法律性文件的官方中文译本，由全国人大常委会官方翻译，文本权威，内容准确，是向外界展示我国立法成果的资料，也是对外沟通交流的工具。全国人大常委会法制工作委员会是我国立法机关的专门委员会，受全国人大常委会委员长会议委托，主要从事立法，修法，废止法律等方面研究工作和常委会安排的其他工作。,10,0,0,180,https://wfqqreader-1252317822.image.myqcloud.com/cover/411/32323411/s_32323411.jpg
网络舆情分析技术,2018-02-01 00:00:00,社会文化-法律,随着互联网技术的快速发展和广泛应用，网络媒体已经成为重要的信息传播和交流平台，同时也是网络舆情形成和传播的主要载体。网络舆情通常由突发社会公共事件触发，反映了人们对某一公共事件所表达的认知、态度、情感和倾向性，具有虚拟化、快捷化、多元化、开放性、匿名性及互动性等特点。随着网络舆论影响力的增强，网络舆情已经成为各级政府了解社情民意的重要窗口。随着网络舆论对社会和公众影响的不断增大，出现了网络炒作、造谣传谣等不良的现象，损害了网络媒体公信力，扰乱了网络正常传播秩序，产生了错误的舆论导向，极易引发社会群体性事件。因此，加强互联网管理和舆论治理非常重要和必要。国家大力推进网络舆情监控体系建设，加强对网络舆情监测和引导。网络舆情监测系统在互联网舆情监测中发挥了重要的作用，其系统核心技术就是网络舆情分析技术。网络舆情分析技术主要涉及网络信息采集技术、网络舆情传播机制、话题检测与跟踪技术、文本分割技术、文本情感分析技术等。,11,0,0,41.4,https://wfqqreader-1252317822.image.myqcloud.com/cover/572/23914572/s_23914572.jpg
宪法学(第4版),2010-06-01 00:00:00,社会文化-法律,《宪法学(第4版)》以传统的、成熟的宪法学体系为基础，强化了基本理论部分的内容，使重点更加突出，结构更加合理，体系更趋完整。广泛吸收国，内外最新的研究成果，全面反映了我国2004年宪法修正案的精神，准确、简明地阐释了宪法学的基本概念、理论和知识。以中国当下的宪法规范及问题为言说对象，同时注意与西方宪法的比较、对中国宪法史的借鉴和对宪政实践的考察。秉持国家尊重和保障人权的宪法理念，描述国家的基本制度构成，解说国家权力的配置方式，呈现有中国特色的宪法学教程。教材为法学专业本科生量身打造，也可作为双学士、法律硕士和研究生班学员学习宪法的参考书。,17,0,0,18.58,https://wfqqreader-1252317822.image.myqcloud.com/cover/633/24274633/s_24274633.jpg
农村土地不可不知200问,2014-03-01 00:00:00,社会文化-法律,生活离不开法律，懂得一点法律常识对于维护自身的合法权益，防范生活法律风险十分必要。法律的目的不仅仅是惩罚违法犯罪行为，更多的是维护社会基本的政治、经济、文化秩序，保障人民群众的生命财产安全，促进经济社会的繁荣发展。诸如与生活息息相关的劳动就业、工伤保险、恋爱结婚、买房租房、抚养继承，都需要在法律规定的框架下进行。因此，本着为读者服务和以解决问题为中心的理念，我们策划推出了《法律生活常识全知道》系列丛书。,66,0,0,14.4,https://wfqqreader-1252317822.image.myqcloud.com/cover/290/32321290/s_32321290.jpg
人民法院大讲堂民法典重点问题解读,2021-02-01 00:00:00,社会文化-法律,2020年6月以来，为全面贯彻落实习近平总书记关于“切实实施民法典”重大决策和最高人民法院党组书记、院长周强关于“坚持以人民为中心的发展思想，扎实做好民法典学习贯彻实施工作”的重要部署，最高人民法院政治部以学习贯彻民法典为主...,10,0,0,124.6,https://weread-1258476243.file.myqcloud.com/weread/cover/94/3300011194/s_3300011194.jpg
刑事大案要案中的法治理性,2019-06-01 00:00:00,社会文化-法律,本书精选了2011年至2016年间我国发生的30余起具有重大社会影响的刑事大案要案，并对其进行法理评析。对刑事大案要案的选择主要把握了以下特点：一是案件的影响较大，二是案件的意义重要；除此之外，对这些刑事大案要案的处理还具有深远社会意义，有利于促进我国社会和谐、社会管理水平提高和相关社会制度的发展。,40,0,0,18.66,https://wfqqreader-1252317822.image.myqcloud.com/cover/265/38658265/s_38658265.jpg
美国司法系列,2020-12-01 00:00:00,社会文化-法律,《美国司法系列》套装共4本，包括《弹劾》《无罪之罚》《告密：美国司法黑洞》《制衡：罗伯茨法院里的法律与政治》。《弹劾》以美国首席大法官厄尔·沃伦、美国总统尼克松、总统里根、克林顿、乔治·布什等10余位政治家、大法官的弹劾案件为例，分析了美国宪法有关文官弹劾权的设计机理。班克罗夫特奖获得者及历史学家戴维·凯卫格记述了弹劾文化自20世纪60年代以来的发展，这一发展远远不止围绕总统理查德·尼克松（水门事件）和比尔·克林顿展开的丑闻，而且极大程度上改变了美国政治的面貌。《无罪之罚》——对于轻罪刑罚而言，判决既不是开始，也不是结束，无论是罚款、缓刑、还是监禁等正式的法庭判决，都只不过是人们真正所承受的一部分经历。 其实，一旦公民个人陷入了轻罪程序，他所受到的一系列惩罚性对待可能会超过任何法律判决。他将被逮捕和监禁，罚款和监管，他的行为将被告诉家人和雇主，并且留下犯罪记录。而且他还可能失去工作、信贷、福利，移民身份或者住房——所有这些经历都将成为他难以承受的巨大负担。与大多数重罪不同，这些负担可能会比判决本身更糟糕。无论这个人的行为是罪有应得，还是仅仅应该被谴责，轻罪制度都能发挥作用。这就是“无罪之罚”。《告密》首次对美国刑事司法中的线人告密行为进行了全面分析，告密交易制造了不可靠的证据，放纵了真正的罪犯，危及了无辜者的自由。告密行为还破坏了非裔社区的邻里关系，加剧了警方与贫民之间的对立。尽管公众几乎看不到告密行为，但其已如黑洞一般侵蚀了美国的司法公正。亚历山德拉·纳塔波夫教授通过数十个真实的案例，揭露了告密交易对高犯罪率非裔社区造成的社会破坏。从缉毒战争到嘻哈音乐，从黑手党线人到白领犯罪，本书全面展示了告密交易在法律、政治、经济和文化层面的可怕影响。此外，她还解释了现有司法制度如何真正发挥作用，并提出了新的改革建议。本书打开了美国司法制度真正运作方式的潘多拉魔盒，向读者们展示了线人活动的秘密世界。《制衡》分为前言和七章主要内容，以及后记，向大众介绍了美国最高法院内部有关法律与政治的种种情况。从约翰·罗伯茨被任命为美国最高法院大法官时声称其未来的角色就是一名裁判员这一事件，开始了对罗伯茨法院裁决情况细致入微的考量与分析。对美国最高法院案例判决中的一系列冲突，以及其中保守主义大法官和自由主义大法官之间的争衡所产生的风险进行了阐述。囊括了贯穿于《平价医疗法案》《选举权利法案》和《婚姻保护法案》等重大案例相关决定中的法律哲学、最高法院任命背后的政治结构，以及约翰·罗伯茨与埃琳娜·卡根为了在最高法院一较长短而展开的对峙等内容。分析了在立场上深度分裂的9名大法官的若干裁决是如何将最高法院，乃至整个国家的未来置于一种平衡状态中。,12,0,0,150,https://wfqqreader-1252317822.image.myqcloud.com/cover/887/35991887/s_35991887.jpg
