title,publishTime,category,intro,maxFreeChapter,newRating,free,price,cover
毛泽东选集（全四卷）,1991-06-01 00:00:00,政治军事-政治,这部选集，包括了毛泽东同志在中国革命各个时期中的重要著作。几年前各地方曾经出过几种不同版本的《毛泽东选集》，都是没有经过著者审查的，体例颇为杂乱，文字亦有错讹，有些重要的著作又没有收进去。现在的这部选集，是按照中国共产党成立后所经历的各个历史时期并且按照著作年月次序而编辑的。这部选集尽可能地搜集了一些为各地方过去印行的集子还没有包括在内的重要著作。选集中的各篇著人，都经著者校阅过，其中有些地方著者曾作了一些文字上的修正，也有个别的文章曾作了一些内容上的补充和修改。,16,970,0,48,https://weread-1258476243.file.myqcloud.com/weread/cover/84/3300024284/s_3300024284.jpg
为什么是中国,2020-06-01 00:00:00,政治军事-政治,金一南将军全新著作，以广阔全面的视野、一以贯之的犀利文笔、磅礴激昂的气势，向读者生动客观地阐述了中国从百年沧桑到民族复兴的辉煌道路。全书以历史为脉络，将从甲午中日战争至21世纪世界新格局形成之间的历史事件为研究材料，寻道问路，深入分析近现代初期破碎山河中的世道人心、岐路惶恐间的挣扎徘徊，解读阐释共产党人的伟大历史自觉、抗战胜利的能量密码，鸟瞰钩沉中国崛起征途中的较量，理性瞻望改革强军的挑战与机遇、世界格局的未来走向。,11,929,0,49.99,https://wfqqreader-1252317822.image.myqcloud.com/cover/991/37335991/s_37335991.jpg
可能性的艺术：比较政治学30讲,2022-04-01 00:00:00,政治军事-政治,"一个和平“爆发”的年代？
历史“终结论”的终结？
国家能力从何而来？
文明的冲突是一个过时的预言？
……
面对林林总总的政治问题，作者带领我们以一种比较的视角，在民主问责和国家能力两个政治比较的核心维度下，建立起观察的参照系，将不同体制、不同经济发展水平的国家纳入比较的视野，去分析我们的时代背景和全球化进程，讨论不同国家的政治转型与国家能力，以及文化和经济对政治变迁的影响。
“政治是可能性的艺术。”当我们将面对的政治现实当作一万种可能性之一来对待时，就能从此时此地抽离，获得一种俯瞰的视角，进而再聚焦定位现实，在浩瀚的可能性中理解我们自身。",6,923,0,57.4,https://weread-1258476243.file.myqcloud.com/weread/cover/46/3300016646/s_3300016646.jpg
论中国,2015-07-01 00:00:00,政治军事-政治,《论中国》是美国前国务卿亨利·基辛格唯一一部中国问题专著。他以一位资深外交家和思想家的独特视角，分析和梳理了中国自鸦片战争以来的外交传统，从围棋文化与孙子兵法中探寻中国人的战略思维模式，特别是试图揭示新中国成立以来，中国外交战略的制定和决策机制，以及对“一边倒”的外交政策、抗美援朝、中美建交、三次台海危机等等重大外交事件来龙去脉的深度解读。作为历史的亲历者，基辛格博士还在书中记录了自己与毛泽东、邓小平等几代中国领导人的交往。本书用世界视角国际眼光，重新解读中国的过去和未来，凝结了基辛格博士的战略理论以及对中国问题数十年的研究成果，注定将成为让世界认识中国、让中国重新认识自己的一部重量级作品！,16,835,0,40.8,https://wfqqreader-1252317822.image.myqcloud.com/cover/582/914582/s_914582.jpg
台湾问题与中美关系,2009-08-01 00:00:00,政治军事-政治,台湾问题是中美关系中的重要问题。《台湾问题与中美关系》从历史到现实，梳理了自18世纪末到21世纪初美国与台湾长期、特殊关系的逐步演进；回顾了1949年后两岸关系从隔绝对抗到如今交流密切、往来频繁的曲折发展；阐述了近60年来中美之间围绕台湾问题既有斗争又有合作的复杂进程。《台湾问题与中美关系》还分析了美国政府对台政策的内容及原因；评述了中共四代领导人关于台湾问题思路、策略不断发展的成果；梳理了在蒋介石、蒋经国、李登辉、陈水扁主政的时期台湾当局大陆政策的调整变化。《台湾问题与中美关系》作为大学本科生的教材，是阐述台湾问题与中美关系基本知识的学术性读物，有助于读者深入了解台湾问题的来龙去脉，客观把握其中的是非曲直，增强完成祖国统一大业的信心，适合专业读者和大专院校学生阅读。,13,842,0,22.3,https://wfqqreader-1252317822.image.myqcloud.com/cover/472/24273472/s_24273472.jpg
李光耀观天下（精装版）,2018-02-01 00:00:00,政治军事-政治,出生于1923年的新加坡前总理李光耀，一生密切地参与国际事务。从毛泽东到习近平，他见过中国每一位主要领导人，从林登·约翰逊到奥巴马等美国总统也与他有密切交往。2015年3月23日李光耀与世长辞，使得本书成为这位世界著名政治家的绝笔书。在这本书中，李光耀凭借其丰富经验和深刻洞察力，对今天世界的形势和20年后世界可能展现的面貌提出看法。这本书绝不是枯燥的地缘政治论述，也不是全球事务迂回曲折发展的专题报告。相反，在横跨美国、中国、亚洲和欧洲的广博叙述中，他剖析了它们的社会、探究其人民的心理，并提出了有关这些国家未来的结论。李光耀在书中表达的坦率且往往令人惊讶的观点，使本书成为一本新鲜生动又引人入胜的读物。为使本书完整，李光耀也探讨了他长久以来最关切的新加坡的未来，并让读者一窥他的私人生活和他对死亡的观点。本书每章中还穿插了他接受《海峡时报》访谈的问答录，有助于读者进一步理解他的观点。,3,924,0,62.4,https://wfqqreader-1252317822.image.myqcloud.com/cover/802/31231802/s_31231802.jpg
《实践论》《矛盾论》导读（增订版）,2017-09-29 00:00:00,政治军事-政治,《实践论》《矛盾论》是毛泽东关于马克思主义认识论的代表著作。作者借用马克思主义的认识论观点揭露党内的教条主义和经验主义，特别是教条主义的主观主义错误。运用唯物辩证法总结了中国共产党领导中国革命斗争的实践经验，深刻地阐述了对立统一规律。由中国民主法制出版社、研究出版社联合出版的《〈实践论〉〈矛盾论〉导读》，在附原文的基础上，以经典原著的写作背景、成书过程、结构内容和观点及其历史影响和现实意义为脉络，对《实践论》《矛盾论》进行了细致入微的解读，同时对其中暗含的哲理给予了充分扩展，突出当代价值与时代特色，利于广大党员干部和青年学生深入理解和掌握马克思主义的原理，也有助于理解现代资本主义社会制度缺陷和社会主义制度的优越性所在。,3,897,0,19.44,https://wfqqreader-1252317822.image.myqcloud.com/cover/318/25915318/s_25915318.jpg
政治学通识,2019-04-01 00:00:00,政治军事-政治,《政治的常识》是作者在复旦大学政治学课程讲义的基础上修改润色而成的。本书力求成为一部通俗易懂、深入浅出的政治学普及入门读物。这部书正是为那些对政治和公共事务感兴趣的读者朋友们而写的。通过本书，作者希望能够帮助读者加深对中国政治与世界政治的认知，帮助读者理解政治学领域的重大议题、主要理论与基本方法，帮助读者养成健全与系统的政治思考能力。,39,861,0,39.2,https://wfqqreader-1252317822.image.myqcloud.com/cover/777/24275777/s_24275777.jpg
看懂世界格局的第一本书1：大国博弈,2016-07-01 00:00:00,政治军事-政治,了解当前国际环境、中美国家安全战略、国内政策法规的必读书！热点新闻背后的大国博弈！美国如何通过“货币战争”操纵国际汇率、打压人民币？中国为什么要建造属于自己的航母？,19,776,0,16.99,https://wfqqreader-1252317822.image.myqcloud.com/cover/291/907291/s_907291.jpg
胜者思维,2017-04-01 00:00:00,政治军事-政治,关于胜利：成吉思汗说：越不可越之山，则登其巅；渡不可渡之河，则达彼岸。毛泽东说：红军不怕远征难，万水千山只等闲。任正非说：除了胜利，我们已经无路可走。这就是胜者思维。即便在最黑暗、最失败、最无望的时刻，他们内心也有一杆胜利的旗帜呼拉拉飘扬。本书为高层智囊金一南以“胜者”为出发点，结合历史大格局，所研究得出最终制胜新理念的文章合集。作者以极其广阔的视野、一以贯之的犀利文笔、磅礴的气势，生动客观地阐述了领导者应当具备的各种能力，里面引用了中国以及全球其他领导者在不同时期、不同地点的不同事件中不同的处理方式所带来的不同结果，用以大见小的事例，可以帮助领导位置的人掌握更好的危机处理方式以及提升管理能力。,15,937,0,44.99,https://wfqqreader-1252317822.image.myqcloud.com/cover/989/37335989/s_37335989.jpg
东晋门阀政治,2019-05-01 00:00:00,政治军事-政治,本书以丰富的史料和周密的考证分析，对中国中古政治中的门阀政治问题作了深入探索，认为严格意义上的门阀政治，仅存东晋一朝；门阀政治即门阀士族与皇权共治，是皇权政治在特定历史条件下出现的变态，具有暂时性与过渡性。本书以江左几家侨性士族与司马皇权结合的历史兴衰为线索，从政治史角度对我国中古政治史中“东晋门阀政治”这一重要问题进行了独特考察。,13,931,0,55.2,https://wfqqreader-1252317822.image.myqcloud.com/cover/432/24275432/s_24275432.jpg
习近平的七年知青岁月,2017-08-01 00:00:00,政治军事-政治,《习近平的七年知青岁月》，书中选用了76幅珍贵图片，其中大部分为首次公开发表。习近平总书记是第一位出生和成长在新中国的中国共产党总书记。他有过曲折的少年时代，有过奋斗的青年时代。从农村大队党支部书记到党的总书记，从普通公民到国家主席，从普通军官到军委主席，党和国家各个领导层级他都干过。党的十八大以来，习近平总书记之所以能够带领党和人民披荆斩棘、攻坚克难，全面开创中国特色社会主义事业新局面，很大程度上来自习近平总书记扎实的实践基础、深厚的经验积累和由此而来的深邃理论思考。,7,0,1,0,https://wfqqreader-1252317822.image.myqcloud.com/cover/446/24988446/s_24988446.jpg
公正：该如何做是好？,2013-06-17 00:00:00,政治军事-政治,《公正》是哈佛大学有史以来最受学生欢迎的课程，youtube上最受欢迎讲座，在全球掀起学习政治哲学的狂潮！钱颖一、邓正来、闾丘露薇推荐阅读！当我们遇到生死抉择的时候，为什么我们常常违背利益最大化的原则而尊重人的基本权利？可是，当我们口口声声说生命至上时，为什么像福特汽车这样的企业却会给生命贴上价格标签？如果我们尊重个体的权利，但为什么大多数人又会反对同性恋婚姻？我们认为法律必须保护合同的有效性，但为什么一些双方自愿签订的合同却被法院推翻？我们的社会、我们的思潮、我们的正义观，正陷入尴尬的两难选择当中。我们清醒的理性和人类的良知，会促发我们去寻找有关“公正”的“出路”。这条道路既能体现我们社会规范的人性，又能体现客观性。而这正是“世界最受欢迎的老师之一”的迈克尔·桑德尔教授寻找的有关公正的第三条进路：培养我们每个人的德性，作出我们应该作的、公正的选择。,33,869,0,7.99,https://wfqqreader-1252317822.image.myqcloud.com/cover/838/635838/s_635838.jpg
文明的冲突与世界秩序的重建,2018-08-01 00:00:00,政治军事-政治,"作者认为，冷战后，世界格局的决定因素表现为七大或八大文明，即中华文明、日本文明、印度文明、伊斯兰文明、西方文明、东正教文明、拉美文明，还有可能存在的非洲文明。冷战后的世界，冲突的基本根源不再是意识形态，而是文化方面的差异，主宰全球的将是“文明的冲突”。
《文明的冲突与世界秩序的重建》所持观点及其论述开始颇有争议，但作为一部具有深刻预见性和洞察力的经典著作，预言的一一验证和书中对现今世界各种文明的研究和剖析，将会持续带给我们深入的思考和启迪。同时也为我们提供了一幅新“国际地缘政治地图”。",7,863,0,29.99,https://weread-1258476243.file.myqcloud.com/weread/cover/14/3300014714/s_3300014714.jpg
习近平谈治国理政(第一卷),2018-01-01 00:00:00,政治军事-政治,中共十九大把习近平新时代中国特色社会主义思想确立为中国共产党必须长期坚持的指导思想，实现了中国共产党指导思想又一次与时俱进，为决胜全面建成小康社会、开启全面建设社会主义现代化国家新征程、实现中华民族伟大复兴提供了行动指南。习近平是新时代中国特色社会主义思想的主要创立者。《习近平谈治国理政》2014 年9 月出版以来，以中、英、法、俄、阿、西、葡、德、日等多语种版面向海内外发行，受到广泛关注和好评，为广大干部群众学习领会习近平新时代中国特色社会主义思想发挥了重要作用，为国际社会了解当代中国和中国共产党提供了重要文献。中共十九大后，为帮助国内外读者系统了解掌握习近平新时代中国特色社会主义思想的精神实质和丰富内涵，2017 年11 月《 习近平谈治国理政》第二卷出版发行。《习近平谈治国理政》第一卷、第二卷是有机统一的整体，集中反映了习近平新时代中国特色社会主义思想的发展脉络和主要内容，生动记录了以习近平同志为核心的中共中央团结带领全党全国各族人民在新时代坚持和发展中国特色社会主义的伟大实践，充分体现了中国共产党为推动构建人类命运共同体、促进人类和平与发展崇高事业贡献的中国智慧和中国方案，是国内外读者学习掌握习近平新时代中国特色社会主义思想和中共十九大精神的权威读本。应广大读者需要，对本卷进行再版。,31,0,1,0,https://wfqqreader-1252317822.image.myqcloud.com/cover/329/25078329/s_25078329.jpg
县乡中国：县域治理现代化,2022-04-12 00:00:00,政治军事-政治,本书是作者基于十多年来对基层治理的研究，结合最近两三年最新的调查资料写出来的关于县乡治理逻辑与实践的力作，对基层治理的体制机制做了深度分析，并提出了建设性的意见。具体而言，本书内容包括：县域体制优势转化为治理效能的机制安排、基层治理体制机制问题、基层领导和基层普通干部自主性、县乡政府落实国家政策的制度设计及其效率与效果、基层工作人员的激励与发展等。书稿通过通俗的语言对县乡治理现象进行了深描和刻画，对个案给予了呈现和剖析，抓住事物本质而又生动形象，尝试学理分析而又深入浅出。书中的理论透视，有助于读者深度理解我国县域治理体制的优势，又有利于推动基层创新治理机制、提高基层工作能力，形成干事创业的积极氛围。该书既有分析的深度，又有可读性，特别适合普通大众阅读。,7,881,0,41.4,https://weread-1258476243.file.myqcloud.com/weread/cover/66/3300021466/s_3300021466.jpg
毛泽东读书笔记精讲（全四册）,2017-01-01 00:00:00,政治军事-政治,毛泽东同志一生纵横天下，波澜壮阔，得益于他书剑双修，学用兼擅。研究专家陈晋及其团队，集二十年之功，搜辑梳理一生的读书笔记，编为战略卷、哲学卷、文学卷、历史·附录卷，并结合对每本书的创造性运用情况，做客观解读。本书不仅文献史料丰富，更反映出读书和实践的关系，是领导干部提升学习力领导力的生动教材，也是广大普通读者提升素养，以达学以致用的经典读本。,34,922,0,199,https://wfqqreader-1252317822.image.myqcloud.com/cover/173/42835173/s_42835173.jpg
看懂世界格局的第一本书,2018-12-01 00:00:00,政治军事-政治,本书用大开大合的笔法将复杂多变的世界全景呈现出来，并从政治经济和地缘政治的角度对以上这段历史加以回顾和剖析，将其中所隐含的背后规律一一展现，使读者能够了解当今世界格局形成的由来以及未来的走向。更重要的是，我们可以在这一过程中，为未来的中国找出一些启示。正如江晓原先生所说：“理解今日的世界格局，是为了开创明日属于中国的新格局。”,3,759,0,17.99,https://wfqqreader-1252317822.image.myqcloud.com/cover/140/629140/s_629140.jpg
看懂世界格局的第一本书2：大国之略,2016-07-01 00:00:00,政治军事-政治,大学生、公务员、企业管理者、普通老百姓了解当前世界格局趋势、国家安全战略的必读书目朝鲜半岛核危机、叙利亚内战、货币战争，当今世界的真相是什么？2016～2020，中国国家安全战略如何调整？,23,792,0,16.99,https://wfqqreader-1252317822.image.myqcloud.com/cover/292/907292/s_907292.jpg
君主论,2014-11-01 00:00:00,政治军事-政治,"    本书论述了君主应该怎样进行统治和维持，认为军队是一切国家的主要基础，君主要拥有自己的军队，并应靠残暴和讹诈取胜。认为君主在统治之时要以实力原则，不择手段去实现自己的目的，同时要效法狐狸与狮子，有狐狸的狡猾，狮子的勇猛。
",18,757,0,12.99,https://wfqqreader-1252317822.image.myqcloud.com/cover/196/847196/s_847196.jpg
大棋局,2007-01-01 00:00:00,政治军事-政治,《大棋局》作者布热津斯基是美国当代著名战略理论家、地缘政治学家，曾任美国民主党总统国家安全顾问，本书是他的代表作之一。布热津斯基写作本书的目的是为美国提供一套可供选择的全球战略构想。他将欧亚大陆看作关键地区，并罗列出几个关键性的欧亚大陆地缘战略国家和地缘支轴国家，对它们在欧亚大陆的地位、发展前景、政策走向以及同美国的利害关系作出分析判断。《大棋局》在论述美国当前和长远的欧亚战略的同时，也着重分析了美国的霸权或世界首要地位的特征、范围和深度。布热津斯基在论述各国与美国相互之间就各自利益如何相互周旋时，有关中国的评述篇幅较大，对中美关系时而发生磨擦的原因和后果做了阐述，并站在美国人的立场，讲述了美国对待中国的立场。本书权威地讲述了冷战后的世界格局中，欧亚各国与美国的战略利益纠葛，其中的分析发人深省，对于热衷于国际问题分析的实践者和研究者，这是一本不可不读的书。,6,787,0,19.99,https://wfqqreader-1252317822.image.myqcloud.com/cover/996/32282996/s_32282996.jpg
中国共产党历史简明读本：1921-2016,2017-05-01 00:00:00,政治军事-政治,"学习党的历史，总结党在推进马克思主义中国化进程中的经验教训，把马克思主义中国化的伟大事业不断推向前进，可以为中国特色社会主义事业的发展提供更加有力的理论支撑，可以为实现中华民族伟大复兴的中国梦提供更加牢固的精神支柱。本书完整系统地回顾了从20世纪初至今的党的历史，重点解读了党的历史各个阶段的重大会议、重要事件和重要人物，力图向读者全面展现党从萌芽到壮大的全图景。
",21,814,0,5.99,https://wfqqreader-1252317822.image.myqcloud.com/cover/580/915580/s_915580.jpg
注定一战：中美能避免修昔底德陷阱吗？,2019-01-01 00:00:00,政治军事-政治,“修昔底德陷阱”这一概念自提出以来，就引发各界的广泛关注和讨论。这一概念源自何处？崛起国与守成国是否必会发生冲突？作者格雷厄姆·艾利森在《注定一战：中美能避免修昔底德陷阱吗？》系统地回答和解释了上述问题。艾利森从雅典和斯巴达的战争历史出发，对历史上发生的16个崛起国与守成国进行全球竞争的案例进行分析，指出中美之间的冲突是可以避免的。这16个案例包括成功避免陷入战争泥淖的4个案例和以战争收尾的12个案例。同时，作者在书中还提出了12个通往和平的方法。在本书最后，艾利森将对其观点的质疑提炼为“七个稻草人”（对曲解对方论点的比喻），并直截了当地回应了这七种质疑，他明确指出“修昔底德陷阱并没有宣称战争是不可避免的”。艾利森作为美国前助理国防部长，他的这本《注定一战：中美能避免修昔底德陷阱吗？》为中国读者打开了一窥美国战略设想的一扇窗。,8,728,0,45,https://wfqqreader-1252317822.image.myqcloud.com/cover/351/29313351/s_29313351.jpg
邓小平实录1904—1997（改革开放40周年纪念版全四册）,2018-09-01 00:00:00,政治军事-政治,《邓小平实录》由中央文献研究室专家倾力创作，在体例上按时间顺序编排，共分四卷十编，每一编又分为历程、交往、珍闻三个部分，从多角度翔实地记述了邓小平从出生、成长到参加革命、参与和领导国家建设的各个时期的经历，全面再现了一代伟人光辉而曲折的一生。,9,844,0,81.44,https://wfqqreader-1252317822.image.myqcloud.com/cover/674/23330674/s_23330674.jpg
论法的精神,2017-08-01 00:00:00,政治军事-政治,《论法的精神》是一部综合性的政治学著作。该书阐述了自然法理论、法和法律定义，法律与政体关系，以及政体分类、各种政体的性质和原则等问题；阐述了政治自由和三权分立学说，并以英国为例提出了君主立宪制的政治主张。论述了自然条件同政治法律的关系，认为自然地理环境对社会政治法律制度具有重大的制约性；论述了法律和工业、商业、货币、贸易、人口及宗教等关系，主张兴办工商业，发展贸易，反对横征暴敛，促进国际交往和世界和平；论述了罗马继承法和法国民法的起源和变革。强调了严格区分各种法律规定的范围和制定法律应遵循的原则及其应注意的问题。,13,849,0,29.99,https://wfqqreader-1252317822.image.myqcloud.com/cover/888/22670888/s_22670888.jpg
中共党史珍闻录,2012-01-01 00:00:00,政治军事-政治,中国共产党的诞生，改变了近现代中国历史的走向，也影响了整个世界。这样的一个政党革命、改革与建设的历史，堪称人类历史上的思想宝库，它传递出的智慧与感悟必将是厚重而深刻的。白云涛编著的这本《中共党史珍闻录》完整系统地回顾了党的历史，全书主要包括：中共中央从上海秘迁瑞金始末；瞿秋白与《多余的话》风波；新中国成立前夕国共两党争夺人才的较量；中共“理论家”陈伯达政治沉浮记等内容。《中共党史珍闻录》从框架结构设计到内容材料选取再到语言表达，群众都竭力突出简洁明了、通俗易懂的特点，是当前鲜见的广大党员“愿意学、学得懂、用得上、用得好”的最基本、最权威的党史读物。,4,802,0,1.99,https://wfqqreader-1252317822.image.myqcloud.com/cover/69/243069/s_243069.jpg
社会契约论,2011-08-01 00:00:00,政治军事-政治,《社会契约论·论人类不平等的起源》是西方政治文化传统的重要组成部分，它不但源远流长，而且已经完全融入了西方思想文化的血液，成为西方政治思想中一个历久弥新的源泉（晚近西方社会政治哲学以契约论的形式复兴就是一个明证）。书中主要讨论了国家与人民、国家与法律、自由与平等、国家与社会等问题。《论人类不平等的起源》被誉为法国大革命的灵魂。在《社会契约论·论人类不平等的起源》中，卢梭指出人类每向前发展一步，不平等的程度就加深一步。《社会契约论·论人类不平等的起源》阐发了卢梭的政治哲学思想，为《社会契约论》奠定了基础，同时也是他整个政治学说的导言。,15,804,0,1.99,https://wfqqreader-1252317822.image.myqcloud.com/cover/277/151277/s_151277.jpg
