title,publishTime,category,intro,maxFreeChapter,newRating,free,price,cover
苏联真相：对101个重要问题的思考,2021-04-01 00:00:00,政治军事-政治,"《苏联真相：对101个重要问题的思考》的一个重要内容是对苏联模式进行了客观的评析，指出它在苏联建国初期曾起过重要的作用，但后来由于思想僵化，对马克思主义采取教条主义态度，不能与时俱进，不能根据客观变化了的情况进行适时的改革，使得高度集中的政治经济体制成为妨碍社会经济发展的一个重要因素。
《苏联真相：对101个重要问题的思考》在分析苏联剧变的根本原因这一重要问题时，以邓小平“制度问题带有根本性、全局性、稳定性和长期性”这一理论观点为指导，明确指出，苏联剧变的根本原因是斯大林模式的社会主义制度及体现这一模式的体制问题，并进一步指出，党的问题也只有从制度中去考察才能把握问题的本质，因为党的问题本身就是政治制度的一个重要内容。可以认为，以制度与体现制度的体制作为分析苏联剧变的根本原因，这就抓住了问题的实质。",17,0,0,129.99,https://weread-1258476243.file.myqcloud.com/weread/cover/50/3300015150/s_3300015150.jpg
习近平在浙江,2021-12-01 00:00:00,政治军事-政治,习近平2002年10月任浙江省委副书记、代省长，2002年11月到2007年3月任浙江省委书记、省人大常委会主任。进入新世纪，浙江处在经济大发展、社会大转型的关键时期，习近平紧密结合浙江实际创造性贯彻落实党的理论和路线方针政策，在全面深入调研基础上提出并实施了作为浙江省域治理总方略的“八八战略”，对浙江发展作出了全面规划和顶层设计，为浙江转型发展和长远发展奠定了坚实基础，也成为习近平新时代中国特色社会主义思想形成的重要理论准备和实践准备。习近平作为省委书记全面领导了浙江工作。采访实录《习近平在浙江》一书，通过对当年浙江省委和省政府领导同志、省直部门和地市领导干部、基层干部和企业家、专家学者和记者等的访谈，对习近平领导浙江转变经济发展方式、提高对内对外开放水平、统筹城乡发展和区域发展、创建生态省、建设法治浙江和平安浙江、建设文化大省、推进民生实事、加强党的建设等方面的思考和实践做了具体呈现。这部采访实录，不仅集中展现了习近平高超的思想理论水平和战略决策水平、突出的政治领导能力和组织协调能力，也充分展现了他真挚朴实的为民情怀和深入务实的工作作风，为领导干部在新时代新征程上深入学习领会习近平新时代中国特色社会主义思想，胸怀“国之大者”，提高政治判断力、政治领悟力、政治执行力，提高领导能力和领导水平提供了生动教材。,12,0,1,0,https://wfqqreader-1252317822.image.myqcloud.com/cover/508/44071508/s_44071508.jpg
政治学,2022-02-01 00:00:00,政治军事-政治,亚里士多德认为政治学是人类至高的学问，因为它研究的是国家之善的问题，即如何组织和安排人类社会生活的问题。他提出，人是社会性的动物。人的本性就是要过社会（群体）生活。故而，人类社会生活怎样安排与组织才是公平合理的，即所谓“正义”？便是政治学研究的根本问题。政治学虽然是许多学科中较为晦涩难懂的学科，但也是普通人应该了解的一门重要学科。《政治学》一共分为八卷，在书中，作者系统地提出了人类社会中的基本政治问题，并进行深刻阐述与解析。如论述国家（城邦）的目的、起源、产生、衰败及保全的原因，政体的分类、变革和维持，理想城邦及其构建，公民的教育等。本书是首部全面、系统地论述政治问题的著作，是西方政治学研究的开山之作，被视为政治研究体系的典范。,2,0,0,22.99,https://wfqqreader-1252317822.image.myqcloud.com/cover/454/43370454/s_43370454.jpg
让世界听懂中国,2021-04-01 00:00:00,政治军事-政治,世界各国之间的舆论博弈赛日益激烈，闻现场就是没有硝烟的战场。西方媒体对中国的围追堵截，作者驻美八年对此了然于胸。所谓知己知彼百战不殆，为此，作者结合八年驻美报道经历和大量政治人物专访经验，定量分析了数百篇西方媒体涉华报道，解构西方媒体的话语体系，揭示了西方塑造和抹黑中国的手法，并通过回顾与西方专家“南海辩论”现场，分享专访基辛格、克里、赖斯的幕后细节等闻现场，让者感受媒体现场的短兵相接、唇枪舌剑，窥见西方叙事的虚伪与偏见。作者对于中国的发声方式，以及对抗西方话语、构建中国话术等方面，提出了建议和思考，比如用西方熟悉的表达技巧，讲述中国故事。通过本书，者可以了解中国和西方的对话常态，并且能够举一反三，感受世界各国之间的话语权较量。,10,905,0,29.99,https://wfqqreader-1252317822.image.myqcloud.com/cover/164/40882164/s_40882164.jpg
“地缘政治三部曲”系列,2020-07-01 00:00:00,政治军事-政治,历史是在北纬20°与北纬60°之间创造出来的”一说有何依据？斯拜克曼为何在60年前就能准确预见中国的崛起？同为金砖国家，中国比巴西更有成为世界性大国的发展潜力，是地理位置决定的？中国在向中亚心脏地带施加影响的同时，对大陆边缘地带的东南亚和东北亚产生了怎样影响？为何说海洋是自由主义和西方民主扎根的自然条件？陆权代表苏联在与海权代表美国的终极对决中，为何败下阵来？崛起中的中国和印度格外推崇马汉的海权论是否受此启发？麦金德准确预见了北约与苏联的对抗以及苏联的解体？德国的中心地理位置及其内在文化态度将怎样决定欧洲的走向？美国还将统治世界100年的底气何在？麦金德的“心脏地带”理论如何影响了美苏冷战？马汉的“海权论”对美国海洋霸权的形成产生了怎样的影响？面对不断扩大的贫富差距、巨额政府负债、结构化转型的阵痛，中国如何才能跳出曾经的“日本陷阱”？乌克兰危机对俄罗斯产生了怎样深远的影响？面对土耳其等国家的挑衅，普京手中的杀手锏——天然气管道阀门是否显得力不从心？未来世界局势将如何演变？大国之间的冲突是否无法避免？中国的全面民族复兴将从何处寻找突破口？美国将在21世纪后半叶迎来黄金时期？更为重要的是，本书全景透明呈现未来100年世界地缘格局演变和全球发展演进路线，进一步解读各国的外交政策，从而找到更深层和更强大的方式来看待世界，帮助读者精准掌控21世纪世界发展脉搏！,15,696,0,129,https://wfqqreader-1252317822.image.myqcloud.com/cover/441/37477441/s_37477441.jpg
习近平新时代中国特色社会主义思想学习问答,2021-02-01 00:00:00,政治军事-政治,本书是按照中央要求，组织专家学者对习近平新时代中国特色社会主义思想所涉及的深层次理论与实践问题，以及党员干部群众关心的热点难题问题，作出深入浅出的权威回答。全书共100个问题，文风生动活泼，准确系统展现了习近平新时代中国特色社会主义思想的核心要义、精神实质、丰富内涵、实践要求，深刻阐明了这一思想的时代意义、理论意义、实践意义、世界意义。在中国共产党成立100周年之际，本书以问答的形式出版，是推动党的创新理论“飞入寻常百姓家”的一项创举，必将进一步推动这一思想通俗化、大众化，进一步推动这一思想入脑入心，更好凝聚起新时代新征程强大的奋进力量。,33,0,1,0,https://wfqqreader-1252317822.image.myqcloud.com/cover/153/40683153/s_40683153.jpg
全球海盗史：从维京人到索马里海盗,2022-01-01 00:00:00,政治军事-政治,"海盗为什么会出现？又为什么屡禁不止？三大海盗集团——大西洋沿岸、地中海和中国东海沿岸的海盗有什么相似和不同？
海盗有两种，一种是横行四海的海上强盗，一种是持照经营、“奉旨”抢劫的私掠团伙，但在纷繁复杂的海上航道，海盗的两种身份是可以随意切换的，在合法与非法之间，开辟出一片灰色地带。曾经强大的海洋帝国在这片灰色地带，利用海盗这一绝佳的刺客、间谍和随时可以丢弃的棋子，以极低的成本攫取着巨大的利益。
本书抛开对海盗的浪漫化想象，从中世纪的维京人一直讲到现代的索马里海盗，深入地探讨了海盗的劫掠动机和发展过程——在历史上，海盗不仅是烧杀抢掠的私人团伙，还是各个时代海洋帝国之间相互博弈、对抗的工具和棋子。海盗屡禁不绝的背后，是区域性地缘政",9,500,0,17.99,https://weread-1258476243.file.myqcloud.com/weread/cover/29/3300010429/s_3300010429.jpg
中国共产党纪律处分条例（2018年版）,2018-08-28 00:00:00,政治军事-政治,本书收录了中共中央政治局最新审议通过的《中国共产党纪律处分条例》。条例全面贯彻习近平新时代中国特色社会主义思想和党的十九大精神，以党章为根本遵循，把坚决维护以习近平同志为核心的党中央权威和集中统一领导作为出发点和落脚点，把党章和新形势下党内政治生活若干准则等党内法规的要求细化具体化，坚持问题导向，针对管党治党存在的突出问题，扎紧制度笼子，实现制度与时俱进。,5,0,0,2.99,https://wfqqreader-1252317822.image.myqcloud.com/cover/475/40457475/s_40457475.jpg
习近平在福州,2020-07-01 00:00:00,政治军事-政治,《习近平在福州》一书于2020年7月出版。本书是《习近平的七年知青岁月》《习近平在正定》《习近平在厦门》《习近平在宁德》的续篇，是反映习近平总书记成长历程采访实录的第五部。本书同样以讲述者口述记录的形式，再现习近平同志成长历程中的一个阶段。1990年4月，习近平同志从闽东的宁德地委书记调任省会城市福州的市委书记，在这里工作了整整六年。他在广泛深入调研的基础上对福州发展作出顶层设计，主持编制被称为“3820”工程的《福州市20年经济社会发展战略设想》并坚持不懈抓好实施。他坚持“请进来”“走出去”，坚持“以侨引侨、以侨引台”，狠抓招商引资，着力建设“闽江口金三角经济圈”“海上福州”“国际化大都市”，推动福州实现跨越式发展。他保护城市文脉，推动旧城改造，抗击台风洪水，持续关注民生，创设“下基层接访”制度，倡导“马上就办、真抓实干”作风，强化机关效能，使福州焕发蓬勃生机活力。 本书真实还原了习近平同志在福州工作期间着眼长远、胸怀全局的战略思维，大刀阔斧、科学决策的改革思路，脚踏实地、严谨务实的工作作风，心系人民、情暖民心的赤诚情怀。历史记录着福州的沧桑巨变，也记录着习近平同志开拓担当、执政为民的领导风范。本书是新时代党员干部锤炼党性、坚持为民情怀的生动读本，是深入学习贯彻习近平新时代中国特色社会主义思想的重要学习读物，是讲好习近平总书记的故事的生动教材，更是广大读者了解习近平总书记治国理政思想的重要学习读物。,7,0,1,0,https://wfqqreader-1252317822.image.myqcloud.com/cover/93/40683093/s_40683093.jpg
断剑：解密乌克兰变局中的军事力量,2014-12-01 00:00:00,政治军事-政治,乌克兰政局动荡，引发了克里米亚危机，使得原本已经回暖的俄乌关系再次急转直下，陷入严峻的对峙局面。与此同时，欧盟和美国等西方国家也与以往对待乌克兰政局的态度不同，更为深入地卷入了这次危机，对俄罗斯增兵克里米亚的行动，以及普京批准克里米亚加入俄罗斯的决议进行制裁。这引发了是否会爆发新冷战的担忧。本书介绍了苏联解体后俄罗斯与乌克兰在各个方面的斗争与博弈，以便读者全面了解这两个国家长期如此纠结的历史与根源。,12,750,0,7.5,https://wfqqreader-1252317822.image.myqcloud.com/cover/258/25030258/s_25030258.jpg
大国运势2050,2021-06-01 00:00:00,政治军事-政治,进入21世纪，美国这个当前世界大国的表现不断令人跌破眼镜。作者从马克思所说的“世界历史”起始，立足数百年的时间坐标，提炼出了有关现代大国兴衰演进的深层次规律，并将其应用于美国这一当前国际体系的主导国，旨在系统分析21世纪中叶以前的美国运势。作者从经济角度观察了美国的实力地位和前途命运，从政治角度探寻了美国国家治理体系的基因缺陷和体制短板，从社会角度探寻了美国内在不稳定的机理及其对美国运势的影响，进而得出：当前世界正处于新一轮危机之中，各种矛盾会集中爆发，美国的主导地位会越来越不稳固，国际体系的深刻重塑与主导国的新老更替，很可能在未来几十年内发生。中国作为后发大国，值此百年变局加速展开、中美博弈日渐升级之际，只有对美国的前途命运及其对世界变局的影响进行长时段、前瞻性的思考，才能更深刻地体会世界现代化的演进规律，进而认清中国的历史使命和努力方向。,10,724,0,48.3,https://wfqqreader-1252317822.image.myqcloud.com/cover/943/39481943/s_39481943.jpg
习近平新时代中国特色社会主义思想学习丛书（全12册）,2019-03-01 00:00:00,政治军事-政治,该丛书共12本，300多万字，分别为《开辟当代马克思主义哲学新境界》《深入推进新时代党的建设新的伟大工程》《坚持以人民为中心的新发展理念》《构建新时代中国特色社会主义政治经济学》《全面依法治国 建设法治中国》《建设新时代社会主义文化强国》《实现新时代中国特色社会主义文艺的历史使命》《生态文明建设的理论构建与实践探索》《走中国特色社会主义乡村振兴道路》《习近平新时代中国特色社会主义外交思想研究》《习近平新时代治国理政的历史观》《全面从严治党永远在路上》。丛书从12个专题阐释习近平新时代中国特色社会主义思想的重大意义、主要观点、精神实质，阐明这一思想为发展马克思主义作出了中国的原创性贡献，分析这一思想蕴含的马克思主义立场观点方法，呈现其当代中国马克思主义、21世纪马克思主义的理论形态及其伟大意义。,194,0,1,0,https://wfqqreader-1252317822.image.myqcloud.com/cover/78/25663078/s_25663078.jpg
政治是什么？,2015-10-01 00:00:00,政治军事-政治,面对两个候选人：一个主张优先发展经济，一个主张优先保护环境。手中的那张选票，该支持谁？面对一场战争：一边是美国总统布什，一边是独裁领袖萨达姆；一边是背井离乡的美国大兵，一边是无辜被戮的伊拉克平民。其中的是是非非，该如何评断？面对一些争论：一边是民主，一边是独裁；一边是金钱政治，一边是权贵当家；一边是现代的文明病，一边是原始的野蛮生活……其中的好坏优劣，该如何分析？面对一些纠结：当生态问题突破国界，当战略资源宣告枯竭，当非政府组织指责你的祖国，当有人说，民族国家主权即将终结……你会不会感到迷惑？,10,701,0,9.99,https://wfqqreader-1252317822.image.myqcloud.com/cover/293/842293/s_842293.jpg
未来已来：全球领袖论天下,2021-03-01 00:00:00,政治军事-政治,本书是全球政治、经济、金融、企业等方面的领袖人物在清华大学五道口金融学院和国家金融研究院主办的“未来已来——全球领袖论天下”系列讲座的演讲和现场对话专集。演讲者包括桥水基金创始人瑞·达利欧，黑石集团董事长苏世民，美国前财政部长劳伦斯·萨默斯，红十字国际委员会主席兼首席外交官彼得·毛雷尔，摩根大通董事局主席雅各布·弗兰克尔，标准普尔公司全球总裁兼首席执行官道格拉斯·彼得森，国际货币基金组织首席经济学家吉塔·戈皮纳特，欧洲复兴开发银行原行长苏马·查克拉巴蒂，高盛前总裁兼联席首席运营官哈维·施瓦茨，小米科技创始人、董事长兼首席执行官雷军，资生堂全球总裁兼首席执行官鱼谷雅彦，微软全球资深副总裁洪小文，奇绩创坛创始人兼首席执行官陆奇和哈佛大学肯尼迪政治学院首任院长格雷厄姆·艾利森。演讲者都是各自领域的改革者、推动者、创造者、思想者和实践者，他们站在世界制高点观看全球，又从身边发生的真实故事引出细节，从不同角度、不同层面阐述对未来的理解，展望世界发展的前沿趋势。,6,871,0,47.6,https://wfqqreader-1252317822.image.myqcloud.com/cover/483/37446483/s_37446483.jpg
群众与权力,2020-06-01 00:00:00,政治军事-政治,本书探讨了群众与群体的动态关系，以及群众如何、为什么服从统治者的权力。20世纪的人类历史充斥着集体迫害、群体狂热、世界大战等毁灭性灾难，促使卡内蒂思考群众与权力之间的关系。“指令”和“蛰刺”是卡内蒂解释群众与权力关系的两个核心概念，卡内蒂认为，权力的本质是“指令”对人的伤害（即“蛰刺”）。追溯指令最原始的形式，是动物遇到死亡威胁时的逃亡，因此“每一道命令都隐含着残忍可怕的死刑判决”。,33,814,0,66.75,https://wfqqreader-1252317822.image.myqcloud.com/cover/455/32279455/s_32279455.jpg
政府论,2011-06-01 00:00:00,政治军事-政治,本书分为上下两篇。上篇通过论证“天赋自由和平等”，驳斥了“君权神授”和“王位世袭”论；下篇从自然状态、社会契约论、政治社会和政府的组建等方面正面阐述政府理论。,9,823,0,2.99,https://wfqqreader-1252317822.image.myqcloud.com/cover/278/151278/s_151278.jpg
没有宽恕就没有未来,2014-09-01 00:00:00,政治军事-政治,面对历史的血泪，我们是一头扎进以血还血的漩涡，还是卸下包袱、一起修复未来？南非曾是一片种族隔离和种族压迫最为深重的土地，幸运的是，南非不仅有曼德拉这样的伟人，还有改变了南非甚至也改变了世界的“南非真相与和解委员会”。作为真相与和解委员会的主席，德斯蒙德·图图大主教以他的深邃智慧和无畏的精神，向世界解答了南非在社会转型的关键时刻，何以在“纽伦堡审判”和“全民遗忘”之外，选择了第三条道路，即以赦免换取罪恶真相的完全披露，实现加害者与受害者的和解，走出以血还血的漩涡，走出撕裂的历史。书中有诸多怵目惊心的悲惨故事，以及因种族隔离制度造成的无处不在的不平等，但在揭露加害者的邪恶、凶残、麻木的同时，也展现了震撼人心的人性的闪光。,8,734,0,34.8,https://wfqqreader-1252317822.image.myqcloud.com/cover/798/857798/s_857798.jpg
李光耀谈治国、管理和人生,2018-08-01 00:00:00,政治军事-政治,本书为最新编纂出版的新加坡前总理、内阁资政、亚洲著名政治家李光耀（1923-2015）的思想观点摘录集，编者从李光耀生前的演讲、声明、访谈、文章和回忆录中萃取精炼文字近三百条，分治国、管理、人生三大主题，梳理李光耀的执政思路、管理策略和生活态度，呈现李光耀作为一国的政治家和管理者、作为一个家庭中的丈夫和父亲的思想精华和经验之谈。,6,672,0,29.99,https://wfqqreader-1252317822.image.myqcloud.com/cover/350/23796350/s_23796350.jpg
思维的法则,2018-04-28 00:00:00,政治军事-政治,领导干部研读马克思主义经典著作，是份内之事，也是难事。在繁忙的工作之余，面对汗牛充栋的经典文本，各级领导干部共同面对的两大基本问题是：读哪些，如何读？读哪些，就是要精挑细选那些能够有助于领导干部认识、分析、解决当代中国重大理论问题和现实问题的文本；如何读，就是要找到这些文本与当代中国现实的结合点，达到提升领导干部理论素养的目标。鉴于此，本丛书立足于领导干部在当前中国特色社会主义建设中遇到的重大理论与现实问题的困惑，选择了马克思、恩格斯、列宁、毛泽东的十篇文献，不求全面梳理，只求精华解读，力求以小语言、美语言写出大思想、重思想，保证此系列丛书真正成为领导干部爱读、能读、好读的经典小书。以五大主题来为经典著作划分、坚守现实的问题导向、塑造小品文的写作风格、清新悦目的装帧设计与幽默风趣的手绘漫画均是此丛书相对于同类丛书的优势。本丛书已列入中共广东省委党校“经典著作如是读”课程教材教辅书目，是省委党校向全省其他各级党校“经典著作如是读”课程推荐使用书目。本书是经典悦读系列丛书的一种，作者围绕毛泽东的《矛盾论》展开论述，语言精练通俗，可读性强，配以十幅精美的手绘漫画。,12,833,0,3.9,https://wfqqreader-1252317822.image.myqcloud.com/cover/276/34063276/s_34063276.jpg
政治学基础(第三版),2018-04-01 00:00:00,政治军事-政治,本书对政治的含义即政治分析的逻辑起点进行了再思考，对政治权利、政治统治和政治管理进行了新的理论论述。同时，以发展的眼光对书中的重要理论观点进行了新阐述，以此力图构成具有科学性、实践性、时代性和富有解释力政治学理论。本次修订，作者新加入了国际政治有关方面的新内容。,10,767,0,36,https://wfqqreader-1252317822.image.myqcloud.com/cover/933/26831933/s_26831933.jpg
我也有一个梦想：近距离看美国之三,2013-07-01 00:00:00,政治军事-政治,本书通过精彩动人的故事，展示了与美国种族问题相关联的社会意识和法律演进史。介绍了在契约社会里，立法的民众基础、法律对人性的思考、法律的变化与社会进步的关系等问题。通过作者的叙述，读者能够看到：在法治国家里，民众、尤其是弱势人群怎样运用法律，经过长期抗争，取得自身权益，并由此推动全社会认识的深化，使整个国家在消除不公正的历史进程中取得稳定的进步。,5,860,0,21.6,https://wfqqreader-1252317822.image.myqcloud.com/cover/164/933164/s_933164.jpg
申论,2012-10-01 00:00:00,政治军事-政治,本书既可以作为广大考生复习备考的指导方略，也希望可以成为广大申论教研同行教学、研发的辅助资料。,10,839,0,26.6,https://wfqqreader-1252317822.image.myqcloud.com/cover/348/23912348/s_23912348.jpg
论美国的民主,2011-08-01 00:00:00,政治军事-政治,本书是法国政治学家、社会学家托克维尔在美国进行长期考察后写出的一部举世公认的世界名著。本书前半部分包括美国的种族状况、英裔移民带到北美的影响、美国联邦制的优点以及与其他国家联邦制的比较、联邦政府与各州政府的关系、政党产生的原因、政治社团的作用、舆论的作用等方面；中心思想是阐明美国的民主、自由、平等是如何在政治生活和社会生活中体现的。下半部分是以美国的民主思想和美国的民情为背景分析了美国人的哲学观念、宗教思想、科学理论、文学、艺术、社会心理、民族性格等方面。,9,724,0,1,https://wfqqreader-1252317822.image.myqcloud.com/cover/275/151275/s_151275.jpg
