title,publishTime,category,intro,maxFreeChapter,newRating,free,price,cover
邓小平实录1：1904—1945（改革开放40周年纪念版）,2018-09-01 00:00:00,政治军事-政治,《邓小平实录》由中央文献研究室专家倾力创作，收录了邓小平的秘书、同事、战友等身边人的一手资料，真实还原了领袖人物之间的交往、关系，以及重大事件的策划、发生始末，深度披露了邓小平在历次战争、革命、运动中起落的真相，全景式描述了邓小平的改革心路与实践历程，以及中国建设、外交大战略的形成。本卷为第一卷，讲述了1904—1945年邓小平出生成长、赴法留学、参加红军、进行长征、奔赴抗日战场、出任太行分局书记、领导根据地建设等经历，同时记录了邓小平与毛泽东、周恩来、彭德怀、刘伯承、卓琳、邓发等人的交往与真情，以及邓小平第一次远洋、用南瓜瓤看病、血战梅花圩、巧斗阎锡山、做红娘等逸闻趣事。,25,759,0,19.92,https://wfqqreader-1252317822.image.myqcloud.com/cover/471/23070471/s_23070471.jpg
入党培训教材（2020年最新图文案例版）,2020-05-01 00:00:00,政治军事-政治,本书紧扣《中国共产党党员教育管理工作条例》、《2019—2023年全国党员教育培训工作规划》、《中国共产党纪律处分条例》、十九届四中全会最新精神等文件和会议精神，严格遵循党章，深入贯彻习近平新时代中国特色社会主义思想，内容新颖，体例清晰，案例丰富，分为知识、拓展、流程、文书四个模块，详细介绍了党的光辉历程，党的性质和根本宗旨，党的基本理论、基本路线、基本方略，党的组织和纪律，党员的条件、义务和权利，入党程序和手续等内容，全书不仅设置了测试题，还在教材的最后收录了入党常用文书写法及范文，内容涉及入党申请书、思想汇报、入党志愿书、转正申请书、发展党员程序等各个方面。本书既可作为党组织对入党积极分子进行培训的教材，也可作为入党积极分子的自学读物。,20,0,0,3.99,https://wfqqreader-1252317822.image.myqcloud.com/cover/259/32679259/s_32679259.jpg
马克思主义为什么“行”,2020-03-01 00:00:00,政治军事-政治,全书由精心设计的70个问答组成，并按内容分为了“溯源·溯本”“问道·明道”“实践·实证”“辩诘·辨析”四个部分。第一章“溯源·溯本”回到马克思主义创立的源头，用11个问题澄清了一些现实中在对马克思主义常识性理解和把握上存在的偏见和误会。第二章“问道·明道”阐明了马克思主义之所以“行”，归根结底在于马克思主义是科学的理论、人民的理论、实践的理论，不断发展的开放的理论。第三章“实践·实证”结合马克思主义的中国化、时代化、大众化情况，回答了马克思主义之所以“行”，正是因为中国共产党人始终以科学的态度对待马克思主义，坚持马克思主义基本原理与中国实际相结合，中国的成功实践充分检验了马克思主义的科学性和真理性。第四章“辩诘·辨析”回答了马克思主义为什么会成为我们立党立国的根本指导思想。,23,833,0,19,https://wfqqreader-1252317822.image.myqcloud.com/cover/213/33892213/s_33892213.jpg
消费商,2018-04-01 00:00:00,政治军事-政治,消费商模式正以燎原之势广泛而深刻地影响多个产业，并且陆续有众多企业引进这种经营策略，为大众创业致富提供一条更为广阔的发展道路。本书尝试全面系统地解读消费商的定义与内涵，简要梳理消费商从萌芽、产生到成长、壮大的发展历程，挖掘这种模式与这样一个庞大的消费群体在信息时代的商业价值。同时，对当前的消费商模式与典型案例做出分类总结，共九大消费商模式，包括直销、 O2O、 F2C、共享经济、微商、分享消费体验、消费返利、合伙人、股东股权等。更重要的是，本书教读者如何避开消费商实战中的陷阱，以实用的面貌呈现。翻开本书，可以掌握多家品牌的消费商实战故事、逻辑与方法，让读者都能共享消费商带给这个新时代的红利。本书适合企业家、中高层管理者、平台运营主管及执行人员、营销主管及执行者、电子商务运营主管及从业者，以及中小型企业负责人，同时还适合跟市场发展、监管相关的公务人员及所有有志于创业成功的普通消费者阅读、参考。,17,844,0,46.4,https://wfqqreader-1252317822.image.myqcloud.com/cover/51/26833051/s_26833051.jpg
马列主义经典著作选编学习导读,2011-06-01 00:00:00,政治军事-政治,《马列主义经典著作选编学习导读》，本书逐篇介绍了每部著作的写作背景、写作目的和撰写过程；概述了该篇著作的基本内容和主要观点；阐释了该篇著作的理论价值和现实意义。,9,0,0,4.99,https://wfqqreader-1252317822.image.myqcloud.com/cover/911/25028911/s_25028911.jpg
论政治（上卷）,2016-10-01 00:00:00,政治军事-政治,"《论政治（上卷）》讨论了从希波战争到欧洲宗教改革的西方政治历程，集中论述了柏拉图、亚里士多德、西塞罗、奥古斯丁、阿奎那、马基雅维利等早期西方思想家。这是西方政治传统的奠基时代，雅典之民主对波斯之集权，古罗马的共和对帝制，中世纪欧洲的王权对神权，这些历史冲突中暗藏的是深刻的政治理念与原则之争。
",6,823,0,40.8,https://wfqqreader-1252317822.image.myqcloud.com/cover/624/907624/s_907624.jpg
邓小平实录3：1966—1982（改革开放40周年纪念版）,2018-09-01 00:00:00,政治军事-政治,本书由中央文献研究室专家倾力创作，收录了邓小平的秘书、同事、战友等身边人的一手资料，真实还原了领袖人物之间的交往、关系，以及重大事件的策划、发生始末，深度披露了邓小平在历次战争、革命、运动中起落的真相，全景式描述了邓小平的改革心路与实践历程，以及中国建设、外交大战略的形成。本卷为第三卷，讲述了1966—1982年邓小平经历文化大革命、阐述“三个世界”理论、与“两个凡是”斗争、平反冤假错案、出访日本和美国、关注三峡工程等经历，同时记录了邓小平与刘少奇、叶剑英、尼克松、基辛格、丁肇中、金庸等人的交往与情谊，以及邓小平治理漓江、参观毛泽东旧居、救戏、开放414招待所、参观兵马俑等逸闻趣事。,17,779,0,20.8,https://wfqqreader-1252317822.image.myqcloud.com/cover/475/23070475/s_23070475.jpg
右派国家：美国为什么独一无二,2014-04-30 00:00:00,政治军事-政治,刘瑜推荐：“长期以来，我们习惯于将美国等同于西方、西方等同于美国，却没有意识到其实从文化上而言，美国在西方世界也是一个“另类”。美国“另类”在哪，这种“另类”所来何处，又对世界产生什么样的影响，《右派国家》对此做出了详尽而富有洞见的解答。”《右派国家》向我们介绍了形塑美国生活的一个关键因素——保守主义。美国在短短一代人的时间里急剧右转，以至于如今不论哪一党入主白宫，这个国家与欧洲相比——甚至与尼克松治下的美国相比——在许多重要方面都明显更保守了。,10,634,0,7.8,https://wfqqreader-1252317822.image.myqcloud.com/cover/29/636029/s_636029.jpg
中国乡村：19世纪的帝国控制,2018-02-01 00:00:00,政治军事-政治,《中国乡村：19世纪的帝国控制》是萧公权先生的学术代表作之一，考察了19世纪清王朝统治中国乡村的政治体系，包括理论基础、措施和效果。全书分为三大部分：第一部分介绍乡村地区自然的社会组织划分和基层行政体系，即村、集市、乡镇的划分，保甲和里甲的行政分配和结构特色；第二部分考察国家控制乡村的统治体系，涉及保甲监控、里甲税收、社仓等灾荒控制以及乡约等思想控制系统的设置情况；第三部分讨论乡村控制的合理性及其效果，以及乡村对它的回应。本书附录有关里甲、粮仓等制度的珍贵资料。,20,929,0,94.8,https://wfqqreader-1252317822.image.myqcloud.com/cover/56/36521056/s_36521056.jpg
青年毛泽东的思想转变之路：毛泽东是怎样成为马克思主义者的？,2015-04-01 00:00:00,政治军事-政治,作者以大量的资料展现青年毛泽东广泛吸收新知识、亲身参与和领导组织工农运动实践，并从当时中国的社会现状、发生的重大历史事件、毛泽东早期的重要论述以及其与师长、同学、朋友之间来往信件等多角度剖析毛泽东思想从改良主义转向社会主义的复杂、艰难的必然过程，表明毛泽东以及中国共产党、中国人民接受马克思主义并与中国实际相结合，作为中国的革命和建设的指导思想，是长期上下求索，在实践过程中反复比较鉴别得到的。,13,889,0,38.4,https://wfqqreader-1252317822.image.myqcloud.com/cover/400/23509400/s_23509400.jpg
精神交往论：马克思恩格斯的传播观（修订版）,2016-05-06 00:00:00,政治军事-政治,《精神交往论：马克思恩格斯的传播观》从信息传播的角度，系统展现了马克思和恩格斯开放的思想体系。全书论证了他们历史唯物主义的传播理论、世界交往的基本理念，详尽地阐述了他们所谈到的几乎所有涉及人类传播的各种现象和形态，诸如思维、语言、文字、印刷术、宗教、文艺、宣传、新闻、报刊等等。还论证了他们关于传播与法、传播心理、工人政党内部的精神交往、人类传播历经的三个发展形态等等观点。第2段作者写作此书历时十年，通读了马克思和恩格斯的全部著作，做了名目索引约1万条、卡片3000张和一本提要笔记。书中介绍的马克思和恩格斯的许多传播观点，是人们所不熟悉的，对于开阔思想很有教益。第3段本次修订，除订正个别讹误，新增两篇书评及作者的获奖感言。第4段一些大学新闻传播院系将该书列为研究生马克思主义新闻学基础理论书目。,32,0,0,39,https://wfqqreader-1252317822.image.myqcloud.com/cover/971/27340971/s_27340971.jpg
德意志帝国的大战略：德国与大战的来临,2016-03-01 00:00:00,政治军事-政治,1870年建立的德意志帝国在19世纪末和20世纪初堪称欧洲最强大和最繁荣的“崛起中”强国，但它在1914年走向了第一次世界大战并由此衰亡。德意志帝国为何会走向大战？其背后的主要战略考虑是什么？基于大量著述和档案材料，本书涵盖了德意志帝国的40余年历史，从国内政治、经济、军事思想、对外关系实践等多角度剖析了上述问题，强调了预防性战争思维的影响，也述及了当政者的政治性格的作用，对于一战前40年中欧洲国际关系的宏观进程和其他大国在其中的角色也多有展现。本书较好体现了对国际学术界相关研究成果的介绍、借鉴和辩析，并在多方面提供了有所新意或更中肯细致的看法。本书可被视为中国学者在一战前国际关系和一战起源问题上的代表性研究成果，可为当代中国对外实践提供某些借鉴，也适合作为国际关系史教学的基础读物。,4,864,0,79.2,https://wfqqreader-1252317822.image.myqcloud.com/cover/130/25665130/s_25665130.jpg
华中村治研究（2017年第2期/总第3期）：农民自杀问题研究,2018-03-01 00:00:00,政治军事-政治,本书以农民自杀问题研究为主题进行深入研究，“农村老年人自杀问题”通过代际关系、阶层分化、自杀秩序、价值迷失和城市化等角度对当前农村老年人自杀问题进行了研究；“农村青年人自杀问题”主要从农村社会转型的制度层面对当前农村未婚青年和妇女自杀情况做了分析；“农民自杀的理论研究”对当前农村自杀状况从不同视角进行了分析；“农民自杀的区域差异”则是通过农村自杀的区域差别寻找农村自杀的原因。,35,0,0,24,https://wfqqreader-1252317822.image.myqcloud.com/cover/945/23669945/s_23669945.jpg
脱稿讲话30技,2020-02-01 00:00:00,政治军事-政治,卡耐基曾说：一个人的成功，只有15%归功于他的专业知识，还有85%归功于他表达思想、领导他人及唤起他人热情的能力，即其驾驭语言的口语表达能力。那么，我们怎样才能熟练驾驭语言提高口头表达能力呢？即要做到胸有成竹才能出口成章，找准症结才能对症下药，源于实践才能指导实践。本书正是从理论和实战两个维度，通过30个技法，阐述了出口成章、脱稿讲话的方式方法，手中无稿但要心中有料，用最接地气的语言，既言之有物又言之有据，既言之有理又言之有效，既言之真切又言之中肯，既言之有味又言之有趣，是各级党政机关和企事业单位中层以上党员干部提升自身素养和理论水平、做好群众工作以凝聚起实现中华民族伟大复兴的磅礴力量的重要帮手和得力助手。通过30个技法的训练，让您会讲、敢讲、能讲、善讲。,16,680,0,32.99,https://wfqqreader-1252317822.image.myqcloud.com/cover/52/29533052/s_29533052.jpg
事实即颠覆：无以名之的十年的政治写作,2014-09-01 00:00:00,政治军事-政治,"本书是蒂莫西·加顿艾什最新一本融历史研究与新闻报道于一体的文集，收入作者2000—2009年发表在《纽约书评》、《卫报》等媒体上的文章。作者追踪世界大事，从东欧的“橙色革命”、英国与欧洲及欧盟关系的演变，到伊斯兰主义的兴起、“9·11”、美国大选及反恐，再到缅甸、伊朗等非西方国家的新动向，其足迹几乎遍及全球，深度挖掘各种事件的来龙去脉，给当下事件的报道以历史的深度，并赋予它们文学化的表达，同时探讨作家与事实的关系。本书集中体现了加顿艾什这种独特的写作风格。
",16,549,0,39.99,https://wfqqreader-1252317822.image.myqcloud.com/cover/736/921736/s_921736.jpg
中华人民共和国对外关系史概论(1949-2000),2010-05-01 00:00:00,政治军事-政治,《中华人民共和国对外关系史概论(1949-2000)》以中国对外政策为线索和依据，概括分析1949-2000年中国对外关系的发展过程和主要特点，以呈现这段时期中国对外关系的概貌。自1949年10月1日中华人民共和国宣告成立，中国对外关系开始了一个崭新的时代。由于不同历史时期面临的国际、国内环境不同，中国国家发展战略和安全战略不同，以及党和国家最高领导人对世界形势的认识和对外交目标的追求各有其特点、侧重和差别，决定了中国对外关系的发展呈现明显的阶段性。但是，中国对外关系始终都是围绕维护和扩展国家利益发展演变的。中国的对外关系是在对外政策的指导下展开的，对外政策是识别和理解一个国家外交思想和行为的主要线索和依据，外交领域的任何重大变动都可以从对外政策的变化中找到基本的原因和主要的根据。迄今为止，中华人民共和国对外关系以大致划分为前30年(1949-1978)和后30年(1979年至今)两大时期。,12,919,0,26.02,https://wfqqreader-1252317822.image.myqcloud.com/cover/209/24274209/s_24274209.jpg
社会工作之真善美,2018-12-01 00:00:00,政治军事-政治,作为独特的应用社会科学，社会工作同样关注真理、现实、人类福祉与社会进步，且致力于通过行动去实现人们的幸福和社会的发展。三十年来，作者参与社会工作实践的同时，亦通过笔尖及时回应我国社会工作事业发展中的问题，本书即其感性与理性之散文集合。书中文字涉及社会工作的发展道路和发展模式、社会工作专业化和本土化，以及社会工作介入相关服务的一些思考，既包括对相关政策的理解和反思，也包括对多种社会工作实践的评论和发展建议。总的来说，本书是作者紧密联系我国社会工作发展实际而进行的哲学思考，也是立足我国国情又具有一定前瞻性的、促进社会工作事业发展的理论实践，是他“将内心交给大家了”。,39,0,0,49.6,https://wfqqreader-1252317822.image.myqcloud.com/cover/932/31231932/s_31231932.jpg
中国共产党员党章党规学习手册,2017-10-20 00:00:00,政治军事-政治,党的十八大以来，以习近平同志为核心的党中央高度重视党的建设，把全面从严治党纳入“四个全面”战略布局，坚持思想建党与制度治党相结合、依规治党与以德治党相统一，不断扎紧扎密扎牢制度的笼子。从制定中央八项规定，到修订《中国共产党巡视工作条例》；从修订出台《中国共产党廉洁自律准则》和《中国共产党纪律处分条例》，到出台《中国共产党问责条例》……在近4年的时间里，中央出台或修订的党内法规超过50部，超过现行150多部中央党内法规的三分之一。这些重要的党内法规涉及党的纪律建设、廉政建设、组织建设、制度建设等多方面，具有极强的指导性、针对性、示范性和可操作性，是全面改进工作作风的基础。因此，本书拟收录党章及这些重要的党内法规文件，将其汇编成册，作为广大党员学习党规党纪的参考用书。以满足广大党员开展学习教育活动需要。,40,0,0,23.99,https://wfqqreader-1252317822.image.myqcloud.com/cover/939/40456939/s_40456939.jpg
党委工作方法60条,2018-12-01 00:00:00,政治军事-政治,科学的思想方法和工作方法是掌握工作制胜的看家本领。本书是作者结合自己40余年在党内政治生活和工作的实际经验，从基层党委工作情况出发，坚持党性这一首要原则，密切联系当前党的实际建设，而精心编写的实用手册。,100,0,0,19,https://wfqqreader-1252317822.image.myqcloud.com/cover/248/32598248/s_32598248.jpg
中国古代官僚政治,2015-09-01 00:00:00,政治军事-政治,《中国古代官僚政治》一书从起源发展、内部结构、运行机制、历史影响等几方面入手，系统揭示了中国延续了两千多年古代官僚政治的全貌，指出中国古代的政治体制并不是单纯的君主专制，其实质是君主专制的官僚政治。本书通过描绘历代官僚行政管理的各方面活动和运行情况，总结利弊得失，从而对古代官僚政治的认识达到了一个新的高度，不仅具有学术价值，也很有现实借鉴意义。,8,0,0,21.6,https://wfqqreader-1252317822.image.myqcloud.com/cover/724/25790724/s_25790724.jpg
深圳奇迹：深圳与中国改革开放四十年,2019-04-01 00:00:00,政治军事-政治,作者认为，在四十年的改革开放过程中，深圳在探索和完善建设社会主义市场经济体制当中是立了大功的。作者作为深圳改革开放的参与者，对深圳近四十年改革进程进行了系统梳理，对深圳取得的宝贵经验进行了全面总结，同时也对改革中存在的不足进行了反思，并对未来改革方向和重要领域的改革举措做了深入思考。,5,714,0,40.8,https://wfqqreader-1252317822.image.myqcloud.com/cover/411/25802411/s_25802411.jpg
大党伟力,2020-12-01 00:00:00,政治军事-政治,沧海横流显砥柱，万山磅礴看主峰。100年来，从一个50多人的小党成长为拥有9000多万党员、执政70多年的大党；从播下救亡图存革命火种的小小红船，到领航中华民族复兴伟业的巍巍巨轮，是什么力量让中国共产党由小变大、由弱变强，百折不挠、革故鼎新，成为始终走在时代前列、人民衷心拥护、勇于自我革命、经得起各种风浪考验、朝气蓬勃的马克思主义政党？这种“伟力”来自坚守初心的意志力，来自理想信念的精神力，来自人民至上的感召力，来自兴国之魂的文化力。这种力量，被美国记者斯诺在《红星照耀中国》一书中誉为“东方魔力”。那种精神，那种力量，那种欲望，那种热情……是人类历史本身的丰富而灿烂的精华，是“兴国之光”。,31,811,0,46.99,https://wfqqreader-1252317822.image.myqcloud.com/cover/956/35991956/s_35991956.jpg
正统与华夷：中国传统政治文化研究,2017-10-01 00:00:00,政治军事-政治,本书收集刘浦江教授以正统论、华夷观透视中国古代政治文化的系列论文，突破断代史的藩篱，抓住历代正统论、德运说、华夷观念等涉及中国古代政治文化变迁的核心问题，进行长时段的系统研究。本书眼光独到，论证精审，呈现出宽广的学术格局。本书还收入刘浦江教授的三篇四库学论文，皆是选取典型案例进行深度挖掘的文献学研究作品。,5,905,0,47.4,https://wfqqreader-1252317822.image.myqcloud.com/cover/999/25789999/s_25789999.jpg
常识,2017-08-01 00:00:00,政治军事-政治,"《常识》被认为是促使美国从不列颠帝国中独立出来的出版物。作者以超常的眼光，为北美人民分析了争取独立，在新的原则基础上构建政府的必要性和可行性，并指出英国不会真正维护北美的利益，北美不会有真正能够保护自己的政权，只有独立，才能使北美走上健康发展的道路，这在当时及大地鼓舞了人们谋求独立的士气。
",6,789,0,8.99,https://wfqqreader-1252317822.image.myqcloud.com/cover/496/918496/s_918496.jpg
漫长的20世纪,2011-01-01 00:00:00,政治军事-政治,本书实际上是一部世界资本主义发展史。作者将题目定为漫长的20世纪，其实漫长的20世纪（这是一个模糊的时间长度，前面延伸至19世纪，后面延伸至21世纪）只是书中描述的四个类似的世界资本主义体系结构发展中的一个特定阶段。资本主义从15世纪形成发展到今天已经有600年历史，分别经过了热那亚体系阶段、荷兰体系阶段、英国体系阶段和美国体系阶段。其中每一阶段的发展都或多或少继承了更前一轮阶段的特征。作者阿瑞基继承法国年鉴派衣钵，书中观点受到布罗代尔的很多启发。,7,0,0,19.5,https://wfqqreader-1252317822.image.myqcloud.com/cover/398/37353398/s_37353398.jpg
中国政治认识论,2021-05-12 00:00:00,政治军事-政治,如何认识中国政治，是一项极具挑战性的重大课题。本书提出“大十字视野”，即从纵向的中国大历史和横向的世界政治的维度，历史地分析中国政治是如何一路走过来的，以及中国治理成就在世界政治中的比较优势。在此前提下，本书尝试对当代中国政治逻辑进行民主话语的阐释：政治道路（国体）的人民民主——政治制度（政体）的民主集中制——政治过程的协商共识型民主——政治评价体系上的“可治理的民主”。这种“大十字视野”下的历史比较和国际比较以及对不同层次的中国政治的民主理论解释，是作者长期以来与西方学术界关于中国政治的观念和认知的对话性产物。,16,0,0,59,https://wfqqreader-1252317822.image.myqcloud.com/cover/248/40668248/s_40668248.jpg
读懂中国改革4：关键五年2016～2020,2016-03-01 00:00:00,政治军事-政治,"    《读懂中国改革4：关键五年2016-2020》，“十三五”权威解读读本。中纪委、中组部、中宣部推荐《读懂中国改革》系列之四，中国高层智囊、权威人士、精英学者把脉时局大势，明指决策投资应对之道。 十三五，未来最关键五年，我们该怎么办？中国经济的蓝图如何规划？2016—2020，全面建成小康社会的决胜阶段，“第一个百年目标”最后冲刺五年！ 当前中国经济面临下行压力，传统的增长点和增长主体对经济的拉动力逐渐减弱，中国经济遇到了前所未有的困难。诚如一再提及的，全面改革过程中，好吃的肉都吃完了，剩下的都是难啃的硬骨头。
",16,784,0,29.4,https://wfqqreader-1252317822.image.myqcloud.com/cover/589/840589/s_840589.jpg
蓝色战略2：南海篇,2018-12-01 00:00:00,政治军事-政治,“政治家”与“政客”的一个最大区别在于：在面对对外事务时，政治家往往是把一切分内之事都做好之后，再由军方去完成剩下的部分；而政客则必然是把一切都搞砸了以后，才把一个烂摊子丢给军人。菲律宾前领导人与越南在南海问题上的种种恶劣表现，可以说是对上面这句话最“完美”的诠释。媒体上很多学者、专家都在很认真地讨论中国与这两个国家之间到底出了什么问题，而其实真正出问题的不过是这两个国家的内部。,3,726,0,16.99,https://wfqqreader-1252317822.image.myqcloud.com/cover/375/23768375/s_23768375.jpg
