title,publishTime,category,intro,maxFreeChapter,newRating,free,price,cover
大众的反叛,2020-05-01 00:00:00,政治军事-政治,此书是被加缪称之为“尼采以后欧洲最伟大的作家”、大众社会理论的先驱奥尔特加·加塞特的经典社会学代表作。作者深刻地洞察到，在过去安守自己社会身份、悄无声息的平庸大众依靠民主与技术主义的红利大步流星地走到聚光灯下，想要统治文明社会。大众是否就有这样的资格呢？是否应该存在着一种克制的力量呢？作者在书中对此进行了全面地论述。同时作者基于大众的反叛这个论点生发出为什么这个时代产生不了学术大家等小论点也极其有独特的思考。,7,615,0,39,https://wfqqreader-1252317822.image.myqcloud.com/cover/360/31684360/s_31684360.jpg
历史的选择：中共早期领导人纪实,2015-06-01 00:00:00,政治军事-政治,从1921年党的一大到1935年遵义会议，中共先后产生了八位主要或实际领导人：陈独秀、瞿秋白、向忠发、李立三、王明、博古、张闻天和毛泽东。处于初创期的中共，尚未形成健全的领导人产生机制，中央领导集体不稳，领导人更替频繁。纵观中共早期领导人群体，履历和当选情况不一。从出身看，多数来自普通家庭，很少受家庭背景影响；从学历看，除向忠发以外，其他人都至少接受过中等以上的教育，陈独秀、瞿秋白、李立三、王明、博古和张闻天等人都还有过留学经历；从产生过程看，有在实践中自然形成的个人魅力型领袖，有共产国际推荐或扶持的领导人，有特殊时期的特殊领导人以及过渡时期的过渡型领导人。,6,804,0,10.61,https://wfqqreader-1252317822.image.myqcloud.com/cover/674/844674/s_844674.jpg
政府工作报告汇编（1954—2017）,2017-10-01 00:00:00,政治军事-政治,一、本书收录了1954年至2017年国务院总理在全国“两会”上所作的《政府工作报告》（其中，1961—1963年、1965—1974年、1976—1977年的特殊历史时期无《政府工作报告》发布；1964年公开发布的《政府工作报告》是摘要），共计49篇。二、本书稿件来源于中央人民政府官网，为保留历史原貌、文献原貌，编辑只对一些异体字、标点作了修正。三、本书具有史料价值、研究价值、参考价值和收藏价值，主要供党政机关工作人员、从事政策研究的专家学者参考使用。,13,857,0,100,https://wfqqreader-1252317822.image.myqcloud.com/cover/28/23590028/s_23590028.jpg
家国天下：现代中国的个人、国家与世界认同,2017-02-01 00:00:00,政治军事-政治,一百年来，中国知识界对“中国”的想象并非铁板一块，它随着运动、思潮在变化，它在欧风美雨的家族天下之间摇摆挣扎，国家机器本身，也在不断调整，以获求统治的正当性，而知识分子和国家机器对于“中国”的理解，也左右着我们普通人对国家、对个人的认同。 《家国天下》的意图，就是在思想史中，探寻中国近现代国家认同所受到的冲击和和转变。作者从传统的“天下观念”遭受现代性冲击入手，讨论了儒家、晚清立宪派与革命派、晚清的地方认同和个人认同、五四的“世界主义”、文明与富强之间的竞争、民族主义等等中国近现代思想革命中的尝试。最终，作者设计出“新天下主义”的认同模式，用来解决国家认同这个悬而未决的问题。,25,839,0,32,https://wfqqreader-1252317822.image.myqcloud.com/cover/434/24019434/s_24019434.jpg
战争论（译林人文精选）,2012-06-01 00:00:00,政治军事-政治,《战争论（译林人文精选）》是西方近代军事理论的经典之作，影响历史进程的100本书之一。毛泽东在战争时期曾读过此书，并写下读书笔记。克劳塞维茨总结研究1566—1815年期间的一百三十多次战争，留下遗著达十卷。《战争论》是其前三卷，共分8篇124章，自觉运用辩证法系统总结战争经验，在战争的概然性、战争与政治的关系、精神因素的作用、民众战争、集中兵力等许多方面有精辟论述，被誉为西方近代军事理论的经典之作。,7,795,0,8,https://wfqqreader-1252317822.image.myqcloud.com/cover/108/856108/s_856108.jpg
意识形态：当代中国的理论和实践,2018-04-01 00:00:00,政治军事-政治,"在当代中国社会及其所处国际环境的新的条件下，作为党和国家指导思想的马克思主义,能否掌握在社会生活中的话语主导权,真正成为支配社会经济、政治和文化生活的主流思想，遇到了新的挑战和考验。本书通过对当代中国意识形态理论和实践问题的研究，积极回应这一挑战。通过厘清意识形态的内涵和外延，为马克思主义的理论自尊和理论自信奠定意识形态基础；通过论述中国化马克思主义理论创新中所体现的党的指导思想与时俱进，表达中国道路形成发展的意识形态底蕴；通过论证社会主义核心价值观的凝练及其对社会思潮的引领，深究掌握马克思主义在社会生活中的话语主导权的理论问题，并探索其实践路径。",10,783,0,40.8,https://wfqqreader-1252317822.image.myqcloud.com/cover/931/26392931/s_26392931.jpg
人间正道是沧桑：世界社会主义五百年,2018-09-01 00:00:00,政治军事-政治,本书适合用作党政机关领导干部培训读本 高校师生理论学习辅助教材展现世界社会主义500年波澜壮阔的历程 揭示世界社会主义发展的内在规律 前瞻世界社会主义的未来进程 总结共产党执政规律、社会主义建设规律和人类社会发展规律社会主义是人类文明历史发展的产物，是人类对理想社会不懈追求的成果，凝聚着世世代代劳动人民及先进思想家力求摆脱奴役和依附、争取自由和解放的憧憬与渴望。在社会主义理想信念的鼓舞下，人类历史舞台上演出了一幕幕威武雄壮、经久不衰的社会历史的活剧。在社会主义旗帜的指引下，百年中国发生了深刻的历史性变化，从根本上改变了中国人民和中华民族的历史命运，不可逆转地结束了近代以来中国内忧外患、积贫积弱的前途命运，不可逆转地走上了中国特色社会主义道路，不可逆转地开启了中华民族走向伟大复兴的新的历史进程。本书既全面展示世界社会主义五百年发展的历史进程，又深入总结无产阶级革命、社会主义建设的经验教训，深刻揭示中国特色社会主义形成的合理性、发展的规律性和历史的必然性。,15,867,0,29.4,https://wfqqreader-1252317822.image.myqcloud.com/cover/666/26392666/s_26392666.jpg
城乡差别的中国政治,2019-06-01 00:00:00,政治军事-政治,本书从城乡差别的历史演进出发，以社会分层与政治关系、社会结构与权力体系、社会秩序与政治控制、社会意识与政治文化和社会矛盾与政治活动为主要内容，对古代、近代和当代中国城市与乡村政治社会的状况、特点、变迁及历史影响进行了系统的比较分析。作为第一部系统研究中国城市与乡村政治社会状况及历史变迁的著作，本书对于全面准确地认识中国的基本国情，特别是中国政治社会发展的基本状况及特点，有着独特的价值和魅力。,9,739,0,100.64,https://wfqqreader-1252317822.image.myqcloud.com/cover/505/26322505/s_26322505.jpg
秩序的沦陷：抗战初期的江南五城,2015-10-01 00:00:00,政治军事-政治,《秩序的沦陷》为著名汉学家卜正民教授近著，关注的是抗战初期的社会与人。作者选取江南五城（嘉定、镇江、南京、上海、崇明）为例，描述了日军残暴占领城市、试图重建基层机构的过程，并分析了地方头面人物与日伪政府的关系交织。“这里有通敌，有抵抗，但两者之外的其他行为要多得多。,13,647,0,17.5,https://wfqqreader-1252317822.image.myqcloud.com/cover/937/23723937/s_23723937.jpg
精神政治学,2019-03-01 00:00:00,政治军事-政治,当今世界已逐渐走向精神政治时代。数字技术正从单纯的监控向主动的操控过渡，人们凭感觉做出的所谓“自由决定”将很快被操控。无所不在的大数据和新自由主义伦理观造成了资本主义权力的转移和扩张，破坏了个体自由，压制了个体的空间和自主性。本书扣人心弦地描绘了新自由主义精神政治导致的种种危机。,4,719,0,21,https://wfqqreader-1252317822.image.myqcloud.com/cover/81/24987081/s_24987081.jpg
海外中国研究丛书合集：近代篇二（十一卷本）,2020-11-01 00:00:00,政治军事-政治,《中国的亚洲内陆边疆》对这个内陆边疆的四个地区（东北、新疆、内蒙古、西藏），从生态环境、民族、生产方式、社会形态、历史演进等方面进行了深入的考察，揭示了中国内地与上述四个地区边疆地区各自不同的互动依存关系，讨论了中国内陆边疆历史的丰富多样性。由此，它展现了各个边疆地区独特的历史价值，指出了中国多民族社会文化的整合特征。《话语的长城:文化中国探险记》：“文化中国”包括三个部分：历史上的中国国土本身（目前正经历不同的政治命运），海外华人社会（很多已经经历了几代人），以及有关中国的研究或写作。本书在这三个维度上，对“中国”的多重意义进行解读和分析。本书由几篇原本独立的论文构成，但在结集成书的时候，作者在逐渐清晰的共同问题意识下，作了相应改动。《文化、权力与国家》内容简介：《文化、权力与国家：1900—1942年的华北农村》一书是印裔美籍学者杜赞奇通过对资料：南满铁道株式会社调查部所编《中国惯行调查报告》、南开大学经济研究所的社会调查材料，以及中外学者已有的研究成果等的研究，以个案的方式对华北六个村庄进行详尽的分析，展现了在国家政权现代化建设的大背景下1900—1942年华北农村社会、政治、经济图景。作者从“大众文化”的角度，提出了“权力的文化网络”、“国家经纪”等概念，详细地论证了国家权力是如何通过种种渠道(诸如商业团体、婚姻圈、经纪人、庙会组织、宗教、神话及象征性资源等)深入乡村社会的，以及在这一过程中乡村社会又是如何作出回应的。《近代中国的知识分子与文明》：《近代中国的知识分子与文明》以从19世纪后半期到20世纪初约半个多世纪的中国为主要舞台，以这一时期知识分子的思想轨迹和精神世界为主要课题。在这半个多世纪中，中国的对外关系由朝贡体制转换为条约体制，而且面临着被瓜分的威胁。同时，这一时期也是中国的政治体制从王朝体制到共和体制转换的时期。这一时期中国的政治变动和社会变动，其规模之深广是不难想象的。生活在这种激荡的旋涡中的中国知识分子，他们是如何认识所处环境的变化以及他们想使中国如何变化，是《近代中国的知识分子与文明》所要解决的主题。《近代中国的知识分子与文明》以凝练的笔法、独特的视角，分别从“万国公法观的变化”、“法国革命观的变化”、“体制选择”这些不同的角度，来分析近代中国知识分子对世界认识的转换过程，以及他们各具特色的心路历程。《转变的中国》作为一部富于创意和挑战的探索性著作，本书在广泛汲取和甄选中西史学新成果的基础上，从经济变化、国家形成和社会抗争三方面入手，通过比较中国与西欧之长时段历史的异同，否定了长期盛行的各种西方中心主义研究框架，也展现了中西社会、经济、政治史的总体脉络和各自特点。《间谍王》叙述了一个非凡的秘密警察，一个阴影般的险恶幽灵——戴笠的一生。他的生活体现了20世纪中国所具有的、再封建式的多变个性与难以逾越的职业纪律之间的平衡。戴笠及其创建的国民党特务组织，是蒋介实反共反人民的忠实爪牙，在为蒋排除异己，维护国民党专制统治，以及保护蒋介实安全方面效尽犬马之劳，犯下了种种罪行。同时，抗日战争期间，在抵抗日寇、铲除汉奸方面也做过一些工作。戴笠来自于这样的一个背景：作为闭塞的“中等县城”里的精华，他克服了某种城乡之间的差别——再具有低头不见抬头见的个人关系的乡村世界与一个更加广阔、充满职业责任和冷冰冰的专业知识的领域之间的差距。《从民族国家拯救历史》：着重研究20世纪初期的中国，探讨了民族国家、民族主义与线性进化史之间的密切关系。《从民族国家拯救历史》分为两大部分：部分共两章，论述民族作为启蒙历史主体的理论问题；第二部分包括五个倚重文的个案研究，是杜赞奇撰写复线历史的一系列尝试的成果，目的是要在民族进化历史的范畴和框架笼罩的阴影下闪烁出一星亮光。《从民族国家拯救历史》视野宏阔而不失精深，既能以全球眼光审视近现代中国历史，又能从关键之点切入，洞察细微，把握要害，融世界与中国、历史与现实、思想文化与政治实践和政治制度筹诸多因素于一体，是自20世纪七八十年代国际学术界“语言学转向”和美国汉学界“在中国发现历史”思潮出现以来较具代表性的学术著作之一。《一江黑水》：以淮河流域的生态环境变化为切入点，主要论述了中国为经济高速发展付出的环境代价，介绍了中国环境保护所采取的政策措施和取得的突出成就，分析了中国面临的环境压力以及环境治理的艰巨任务，探讨了怎样让经济发展和环境保护更好地协调起来。《一江黑水》2005年被国际亚洲研究学者大会评为社科类最佳图书，2008年被剑桥大学评为关于可持续发展的50部著作之一。《假想的满大人》：《凤凰文库·海外中国研究系列·假想的“满大人”：同情、现代性与中国疼痛》通过对小说、医案、游记、照片、绘画的解读，揭示出西方同情与人道之间的内在关联，以及这种西方式对华“同情”的来龙去脉，并力图通过这些分析展现出关于“中国”的整体印象。作者在该书中的这种分析开启了思考西方过去与当今对华关系的新的可能性，而且通过对同情、受苦、经济交流以及再现式交换这四个术语的专门论述，进而建立起分析中国历史话语、同情与现代性的新网络。在结合了文化研究、亚洲研究、美国研究以及医疗史观念的基础上，作者为我们提供了一个关于中西方关系的独特视角。《城市里的陌生人》：中国的改革开放造就了人类历史上罕见的大规模人口流动，在三十年的时间里，超过两亿中国农民离开家乡，进入城市寻求务工、经商的机遇。这一现象深刻地影响了当代中国的政治经济结构以及文化再生产。本书所展示的，是人口流动所引发的空间、社会关系重构，以及跨区域联系网络的建立。通过展现一个典型的外地人口社区——北京丰台“浙江村”的发展、繁荣、拆除、重建，作者展现了后毛时代（post-Mao era）中国社会治理模式的转变以及私人社会空间对传统管理制度的挑战。本书挑战了“市场胜利、国家撤退”的简化论，强调要从更为复杂的日常实践和持续的变迁当中去理解当代中国的“国家-社会”关系。《两访中国茶乡》：英国植物学家福琼于第一次鸦片战争后来华，采集包括茶树在内的中国植物资源。回英国后，他写了几本颇具价值的著作，介绍其中国之行。本书对1843年和1848年的两次中国之行作了详细记录。书中对中国的茶树栽培和制茶方法详加阐述，对中国园艺、植物特性与分布、饮茶文化也多有着墨，但大部分描写的还是其在中国的奇妙经历及见闻感受。对部分中国文化，福琼表达了他的怀疑与偏见，但更多的时候，特别是随着其对中国了解的深入，福琼表达了他对中国自然景观与文化的惊奇及赞赏之情。福琼是传教士之外最早进入中国内陆的外国人之一，他对中国文化的观察提供了一个有别于传教士的独特视角。,23,0,0,474,https://wfqqreader-1252317822.image.myqcloud.com/cover/277/38658277/s_38658277.jpg
权力是靠不住的：美国政治文化探析,2016-08-01 00:00:00,政治军事-政治,本书用生动的笔触、鲜活的事例，从政治文化的视角揭示美国政治现象迷雾背后的逻辑，使读者对美国政治制度、政治运行机制有一个系统、全面而深刻的认识。与世界上其他国家相比，美国政治文化最大的特点就是，美国人对权力侵犯权利有着深刻的忧虑和高度的警惕，如果用一句话来概括美国政治文化的特点，那就是权力是靠不住的。,6,857,0,31.2,https://wfqqreader-1252317822.image.myqcloud.com/cover/989/26831989/s_26831989.jpg
大国竞合,2021-03-01 00:00:00,政治军事-政治,中美关系走向直接影响当今世界格局的稳定，决定着人类命运共同体的未来。 如何正确认识中美两国的异同？如何把握未来中美关系的走向？这本书从中美两国的历史和文化渊源出发，对中美两国在经济、教育、法治、民主形式、世界观、价值观、思维模式等方面的异同及根源进行了客观分析，指出中美两国的历史、文化和现实国情不同，存在认知偏差在所难免，因此要加强相互了解，超越认知藩篱，消弭理解赤字，寻求共同发展。,9,588,0,47.6,https://wfqqreader-1252317822.image.myqcloud.com/cover/818/38259818/s_38259818.jpg
中国妇女史研究读本,2011-04-01 00:00:00,政治军事-政治,中国妇女史研究是国内外学术研究的新领域，经过近十几年的研究历程，在理论建构和个案研究上都取得了相当的成就。本书收入了国际学术界研究中国妇女史的著名的篇章。,7,733,0,38.4,https://wfqqreader-1252317822.image.myqcloud.com/cover/297/24274297/s_24274297.jpg
牛津通识读本：政治的历史与边界（中文版）,2013-01-01 00:00:00,政治军事-政治,《牛津通识读本：政治的历史与边界》叙述周详而又引人入胜的著作中，肯尼思·米诺格探讨了从古代世界到20世纪的政治发展过程。作者力图引导读者去思考如下问题：政治体制为何演进不止？政治如何在我们的社会中生发权力、保障秩序？民主是否一直有利无弊？21世纪的政治又将有何变迁？,5,659,0,10,https://wfqqreader-1252317822.image.myqcloud.com/cover/511/846511/s_846511.jpg
蓝色战略（全集）,2018-12-01 00:00:00,政治军事-政治,学者王伟用大历史观的视野，从地缘的角度结合海洋热点，逐层剥离隐藏在南海、东海岛礁纷争背后的美国阴谋，将复杂多变的我国周边的海洋问题全景呈现出来，带我们了解其形成的由来以及未来走向。,4,777,0,48.99,https://wfqqreader-1252317822.image.myqcloud.com/cover/385/214385/s_214385.jpg
怎样当好基层党委书记,2018-08-01 00:00:00,政治军事-政治,本书共十章，对新时代怎样当好基层党委书记给予了系统完整的解答，注重突出新时代基层党组织带头人的各项任务、要求、准则等方面，尤其对新提法、新举措进行详细的解读，体现出鲜明的时代特色；书中既有对理论的权威阐释，又有对管理实务、工作方法的详细介绍，可以为基层党委书记工作提供切实帮助；同时，以生动活泼的语言风格娓娓道来，具有很强的趣味性，其中穿插历史典故、名人事迹、领导人语录、典型案例等板块，形式丰富多彩，更具特色，对广大基层党委书记特别是基层党务工作者更好地推进新时代基层党组织工作提供有益导引。,4,692,0,4,https://wfqqreader-1252317822.image.myqcloud.com/cover/654/23833654/s_23833654.jpg
王伟：全球政治势力全解析（套装共2册）,2022-03-01 00:00:00,政治军事-政治,用大开大合的笔法将复杂多变的世界全景呈现出来；并从政治经济和地缘政治的角度对以上这段历史加以回顾和剖析；将其中所隐含的背后规律一一展现；使读者能够了解当今世界格局形成的由来以及未来的走向。更重要的是；我们可以在这一过程中；为未来的中国找出一些启示。正如江晓原先生所说：“理解今日的世界格局；是为了开创明日属于中国的新格局。”,15,0,0,34.99,https://wfqqreader-1252317822.image.myqcloud.com/cover/819/43309819/s_43309819.jpg
中国社会治理,2018-09-01 00:00:00,政治军事-政治,童星教授的《中国社会治理》一书是一部聚焦社会治理、讲述中国故事、总结中国经验的精品力作，系统地回答了“中国在新的历史条件下应如何加强和创新社会治理、如何打造共建共治共享的社会治理格局”这一重大问题。 全书首先植根中国社会治理现实，提出当前加强和创新社会治理的四大重点领域：一是风险社会条件下人民群众的安全需求紧迫，应急、减灾、维稳模式亟待创新升级；二是开放社会条件下人民群众的融入需求强烈，户籍制度、单位制度亟待改革；三是多元社会条件下人民群众的公平公正需求强烈，整齐划一的要求和利益倾斜的政策亟待更新；四是虚拟社会条件下人民群众的表达和自我实现需求旺盛，网络管理的思路和方法亟待创新。在此基础上，本书提出了中国社会治理的三大目标，即保障公共安全、化解社会矛盾、培育自治社会，并强调实现上述目标必然要走“共建共治共享”之路。最后，本书剖析了当前中国社会治理的重点和难点，即做实决策风险评估，改革信访制度，优化治理结构。,15,889,0,46.8,https://wfqqreader-1252317822.image.myqcloud.com/cover/35/26393035/s_26393035.jpg
生命线：能打胜仗的政治指挥大计,2021-01-01 00:00:00,政治军事-政治,本书以纵深的历史感、权威丰富的史实、生动的笔触、史论结合讲述被人称为“生命线”的中国共产党军队政治工作100年的传奇历程，生动阐述孙中山、毛泽东、邓小平、江泽民、胡锦涛、习近平政治建军思想，挖掘我军政治工作原则、制度、重大事件、重要文献产生、发展的逻辑脉辂，寻根溯源弘扬政治工作的优良传统，正本清源重树政治工作威信，用故事的语言告诉人们：革命的政治工作犹如阳光、空气和水之于人的生命一样，是人民军队的生命线。生命线供给军人信仰、信念、纪律、血性，生命线激发军人荣誉、责任、使命、担当，生命线铸就、滋养了人民军队的苦难辉煌和浴血荣光。政治工作是中国人民解放军的看家本领，是人民军队的最大特色、最大优势。,4,0,0,88,https://wfqqreader-1252317822.image.myqcloud.com/cover/967/37176967/s_37176967.jpg
霸权之后,2012-01-01 00:00:00,政治军事-政治,《霸权之后》是一项对发达资本主义国家间合作现象的全面研究。在没有如第二次世界大战后美国那样的单个国家主导的情况下，合作能够持续下去吗？为回答这一紧迫问题，罗伯特·基欧汉分析了促进世界政治经济中合作的制度或“国际机制”，并描述了美国霸权受到削弱时这些机制的演变。基欧汉驳斥了霸权衰落使合作不可能发生的观点，将国际机制视为促进自利行为体之间非集中化合作的工具，而不是世界政府的弱势替代物。,6,0,0,19.99,https://weread-1258476243.file.myqcloud.com/weread/cover/39/3300023539/s_3300023539.jpg
中国智慧：十八大以来中国外交（“认识中国·了解中国”书系）,2017-07-01 00:00:00,政治军事-政治,党的十八大以来，面对错综复杂的国际环境，以习近平同志为核心的党中央开展了空前活跃和广泛的国际外交活动，提出了一系列重大的外交新思想新理念新战略。该书就是紧紧围绕海内外读者迫切需要了解中国外交新思想新理念新战略的实际需要，由知名国际问题研究专家金灿荣教授带领的学术团队完成的一部优秀著作。书名冠以“中国智慧”，表达了对于十八大以来中国外交的高度评价，同时秉持“讲好中国故事，传播好中国声音”的写作精神，全面系统地介绍中共十八大以来中国外交的成就。全书包括十八大以来中国外交的理论与实践、中国外交的表现和特点、中国积极维护大国关系、中国重视发展周边国家和地区关系、中国构建全球伙伴关系网络、中国大力推动全球治理以及对中国外交的再认识等专题。通过这些专题介绍和解读，可以有效地增进广大海内外读者对中国的了解、稳定国际社会对中国发展的预期。,13,742,0,28.8,https://wfqqreader-1252317822.image.myqcloud.com/cover/510/26392510/s_26392510.jpg
