title,publishTime,category,intro,maxFreeChapter,newRating,free,price,cover
心理抚养,2021-06-01 00:00:00,心理-发展心理学,心理抚养是一种全新的育儿理念。在养育孩子的过程中，父母往往特别重视孩子是否吃饱穿暖、身高体重如何、是否活泼健康，把这些当成爱的全部，却因为疏于了解、关注婴幼儿、青少年的心理健康，从而导致孩子在成长过程中产生了一些难以逆转的心理困境，特别是进入青春期后，会出现拒绝交流、出走、顶撞、不合群、学习困难等问题。对此，心理学专家李玫瑾在《心理抚养》一书中向父母传递了这样一种理念：养育孩子，心理抚养比物质抚养更加重要。作者认为，心理抚养主要包括情感、性格、观念、能力四个方面，父母必须参与心理抚养的全过程，通过陪伴与关爱获得孩子的依恋感，进而获得管教孩子、“立规矩”的资本。家长通过参与孩子成长，进行情感抚育，教他做人做事，这种心理抚养比满足孩子的物质需求更重要。“父母亲自陪伴孩子成长，比给孩子挣钱更有价值”，我们不能错过塑造孩子未来人生的最佳和最关键时期。,27,940,0,45.99,https://wfqqreader-1252317822.image.myqcloud.com/cover/909/41599909/s_41599909.jpg
原生家庭：如何修补自己的性格缺陷,2018-05-01 00:00:00,心理-发展心理学,美国知名心理治疗师苏珊·福沃德经典著作《中毒的父母》重新编辑，再度面世！告诉你如何打破原生家庭的束缚，治愈父母给你的伤害，扭转不良的生活状态。长期雄踞《纽约时报》图书排行榜榜首，全美销量超200万册！,7,760,0,25.99,https://wfqqreader-1252317822.image.myqcloud.com/cover/242/22620242/s_22620242.jpg
女性主义有什么用？（日常人文课）,2021-07-01 00:00:00,心理-发展心理学,这是一本写给女人，也写给男人的女性主义入门读物。40个问题直击女性生活痛点，从情感到工作，从个人到政治，全面涵盖性别议题的方方面面。120位挑战父权制的女性主义先驱，给你理解的温暖，也给你理论的武装。本书能令你觉醒，令你真正明白何为女性。苏格拉底曾说过：“未经反思的人生不值得过。”“日常人文课”系列共有五本，分别是《哲学有什么用？》《政治学有什么用？》《女性主义有什么用？》《经济学有什么用？》《心理分析有什么用？》。这套书想告诉你：人生无处不反思！哪怕是柴米油盐的日常疑惑，也能从古往今来的人文大师那里得到靠谱的解答和接地气的建议。哲学会帮助你升华灵魂。政治学会教你解读世界和社会格局。女性主义能让你看穿无处不在的性别歧视。经济学会赋予你理性经济人的思维模式。心理分析会使你更好地认识你自己。翻开这套书，你将学会过一种经过反思的生活。,8,902,0,33.99,https://wfqqreader-1252317822.image.myqcloud.com/cover/686/40764686/s_40764686.jpg
超实用儿童心理学：孩子心理和行为背后的真相,2019-07-01 00:00:00,心理-发展心理学,本书从儿童的语言和认知发展、个性发展、情绪发展、行为管理、社交能力以及父母自我修炼六个板块入手，向父母们全面介绍了0～6岁儿童发展的整个过程，希望能真正打通你育儿思维的“任督二脉”。,15,874,0,25,https://wfqqreader-1252317822.image.myqcloud.com/cover/912/25941912/s_25941912.jpg
被忽视的孩子：如何克服童年的情感忽视,2018-09-01 00:00:00,心理-发展心理学,本书是首部提出并深度解读“情感忽视”概念的心理自助书。情感忽视是一种来自童年的隐形力量，是你童年缺失的东西。它难以察觉，却对你的一生有深远影响。童年是房子的地基，成年人是整栋房子。由于儿时情感上没有得到足够的照料，和父母的情感连接有所缺失，许多成年人表面上看起来很正常，但在内心深处，那种与父母、其他人以及世界产生联结的情感根基缺失了，他们一直纠结在悲伤、焦虑或是生命的虚无感中。作者是童年情感忽视领域的开创者，拥有20年开展情感忽视咨询与研究的丰富经验。本书运用大量案例、练习和技巧，帮助你在自己的生活中看到童年的缺失和伤痕，了解情绪的价值，陪伴你进行重建自我的工作，逐步掌握童年未能培养起来的技能，走出空虚感，找到内心本来存在的对自己的善意和内在平静。本书也会帮助为人父母者避免将自己的童年情感忽视问题传递给孩子，变成一个知晓情绪的父母，抚育出能意识到情绪、能与他人有情绪共鸣的孩子。本书还有专门一章为咨询师提供了有效工具，帮助遭受过童年情感忽视的来访者。,8,831,0,25,https://wfqqreader-1252317822.image.myqcloud.com/cover/312/23721312/s_23721312.jpg
李玫瑾青少年心理教育：心理抚养&幽微的人性（套装共2册）,2021-06-01 00:00:00,心理-发展心理学,《心理抚养》是一种全新的育儿理念。在养育孩子的过程中，父母往往特别重视孩子是否吃饱穿暖、身高体重如何、是否活泼健康，把这些当成爱的全部，却因为疏于了解、关注婴幼儿、青少年的心理健康，从而导致孩子在成长过程中产生了一些难以逆转的心理困境，特别是进入青春期后，会出现拒绝交流、出走、顶撞、不合群、学习困难等问题。对此，心理学专家李玫瑾在《心理抚养》一书中向父母传递了这样一种理念：养育孩子，心理抚养比物质抚养更加重要。作者认为，心理抚养主要包括情感、性格、观念、能力四个方面，父母必须参与心理抚养的全过程，通过陪伴、关爱、获得孩子的依恋感，进而获得管教孩子、“立规矩”的资本。家长通过参与孩子成长，进行情感抚育，教他做人做事，这种心理抚养比满足孩子的物质需求更重要。“父母亲自陪伴孩子成长，比给孩子挣钱更有价值”，我们不能错过塑造孩子未来人生的Z佳和Z关键时期。《幽微的人性》取材自李玫瑾在电视谈话节目中的访谈内容。她在书中以通俗的语言介绍了犯罪心理画像理论，并通过近年来国内外轰动一时的恶性犯罪案件剖析了犯罪人的心理成因，阐释了犯罪心理学在预防和惩治犯罪方面的重要性，呼吁全社会关爱青少年尤其是留守儿童，重视他们的成长环境，对他们加强心理教育。,24,935,0,85.99,https://wfqqreader-1252317822.image.myqcloud.com/cover/597/43932597/s_43932597.jpg
女人这东西,2018-05-01 00:00:00,心理-发展心理学,渡边淳一作为一名熟知女性生理构造的医生以及一位通晓心理学的文学作家，将女性置于家庭、社会乃至整个世界的中心，对从青春期到更年期的女性的生理特征及其外化的表象即情感、心理、思维方式等特殊性进行了分析论述。通过这本书各个年龄段的女性都将更加了解自己。而男性则可以了解女性情感上的幻化不定，心理上的复杂多变，体会到女人不可思议的无穷魅力！,3,472,0,17.5,https://wfqqreader-1252317822.image.myqcloud.com/cover/505/32765505/s_32765505.jpg
叛逆不是孩子的错：不打、不骂、不动气的温暖教养术（原书第2版）,2017-08-01 00:00:00,心理-发展心理学,这本书起源于我在咨询实践中遭遇的情感痛苦和对其的超越。我开发的10天计划是建立在我本人25年的咨询经验基础上的。我作为儿童和家庭心理咨询师与困难儿童打了25年的交道，这些儿童轻则只是有点儿固执己见，重则极度叛逆！自从10年前第1版出版以来，我非常自豪的同时也万分感激来自世界各地的读者能分享这些经验，他们反馈了运用10天计划带来的成功故事。他们提供的一些卓有成效的反馈强有力地说明了这个计划真的非常棒！他们说这个计划提供了快捷的、富有同情心的、高度有效的方式来减少甚至消除他们与叛逆孩子之间的权力之争，而且改善了他们与叛逆孩子之间的亲子关系。阅读过本书的父母和监护人发现，如何改变他们自己的行为是至关重要的，他们目睹了自己行为的改变使叛逆孩子的叛逆行为得到了很大改变，而且孩子的行为举止变得越来越好了。,8,845,0,25,https://wfqqreader-1252317822.image.myqcloud.com/cover/274/23839274/s_23839274.jpg
与青春期和解：理解青少年思想行为的心理学指南,2019-08-01 00:00:00,心理-发展心理学,放松点！你听说过的许多关于青春期的现象不是一定发生的。孩子的成长之路是风雨交加的，事实上，心理问题、问题行为及家庭冲突在青春期并不比生命周期的其他阶段更普遍。青春期出现情绪是正常的，叛逆是成长过程中不可避免的部分。在本书中，作者将为我们展示一个真实的青春期。这里讲解了与青春期有关的脑科学、神经科学、心理学、社会学、教育学的研究成果，并且辅以几十个鲜活的青春期案例。为了帮助家长顺利地应对孩子的青春期，劳伦斯对青春期进行了创造性的划分——前青春期、青春期早期、青春期中期以及成年过渡期，把青春期的定义扩展到25岁，并且根据每个阶段的心理特点对青少年的行为进行了深入的研究，从应用心理学的角度为青春期孩子的家长提供切实的建议和科学的指导。这既是社交媒体时代的需要，也是时代发展的结果。本书可以帮助那些家有青春期子女的父母、初高中教师和心理学研究者了解青少年的心理发展状况，发现他们在这一时期的优势和危机，进而激励青少年成长为更好的自己。,18,833,0,45,https://wfqqreader-1252317822.image.myqcloud.com/cover/791/43442791/s_43442791.jpg
有限责任家庭,2019-11-01 00:00:00,心理-发展心理学,心理学者、畅销书作家李雪，继《当我遇见一个人》、《走出剧情》后，又一力作。继续深入挖掘母婴关系与亲密关系的内核，通过更加丰富与贴近生活的真实案例，揭示育儿过程中父母的行为对孩子的一生可能造成的影响。同时也指明，我们应该如何觉知并转换思维，解决自身已然存在的问题。“爱与自由”是李雪一以贯之的家庭教育理念，在关系中，也体现在界限感上。无论对孩子还是对自己，“守住界限”都是重要的觉知方向。我们每个人都需要对自己负责，也只能对自己负责，做一个清醒的“有限责任人”。整本书共分为六个版块，作者分别从母婴关系、家庭教育、自我觉知等角度，揭露了家庭中存在的诸多隐性或显性的问题，并提供了独树一帜的见解。,3,807,0,22.99,https://wfqqreader-1252317822.image.myqcloud.com/cover/568/26914568/s_26914568.jpg
儿童发展心理学,2020-05-01 00:00:00,心理-发展心理学,《儿童发展心理学》是美国威斯康星大学白水分校的知名心理学教授琼·库克与格雷格·库克合写的一本有关儿童发展的心理学图书。 这本书详细记录了个体从产前发育开始到青春期的发展进程，包括胎儿期、婴儿及学步儿期、童年早期、童年中期和青春期等阶段的发展特征，系统阐述了个体在每一个发展阶段的生理、认知、智力、情绪、语言、行为、社会性以及人格等方面的发展状态，以及家庭及社会等因素对儿童心理发展的影响。 本书全面展示了儿童心理发展领域的发展现状和未来的发展趋势，并将相关心理学研究成果与实际问题结合起来进行分析阐述。同时，本书还涉及儿童发展中负面因素的研究，包括先天缺陷、精神疾病、教养问题、各种形式的虐待等，旨在促进更多相关机构从事儿童心理学方面的研究，推动全社会重视儿童教养与儿童保护等工作，帮助孩子们提高其社会适应性与内在复原力，拥有健康的童年生活。,14,819,0,52.8,https://wfqqreader-1252317822.image.myqcloud.com/cover/381/30205381/s_30205381.jpg
女孩，你已足够好：如何帮助被“好”标准困住的女孩,2021-07-01 00:00:00,心理-发展心理学,学业压力、失败焦虑、社会比较、身材羞耻、完美主义、自我批评……“不惜一切代价获得成功”的社会文化正在裹挟和伤害我们的女孩，向女孩们传递一系列的有害信息，它们与女孩们独特心理中脆弱的部分发生冲突，破坏了女孩们的自信、真实自我的发展。享誉国际的教育专家西蒙斯基于20余年的年轻女性研究和对96个女孩一对一的采访的真实生动的案例向社会、父母、年轻女孩发出警告——从表面上看，女孩们可能显得特别好，但在内心深处，她们既焦虑又不知所措，觉得无论她们有多么努力，她们永远都不够好：不够聪明、不够成功、不够漂亮、不够苗条……西蒙斯在书中提出了切实可行的措施和方法，帮助女孩抛开荒谬的成功标准，提高适应力和自信心，从而过上健康、快乐、充实的生活。这些方法包括：用自我关怀取代自我批评；妥善管理过度思考的行为；抵制将自己与同龄人进行比较的持续冲动；勇敢承担合理的风险；避开社交媒体中的有害元素；把自我关爱放在首位；建立良好的人际关系，需要的时候寻求支持。,21,872,3,30,https://wfqqreader-1252317822.image.myqcloud.com/cover/293/40216293/s_40216293.jpg
执迷：学会正常地爱与被爱,2018-05-01 00:00:00,心理-发展心理学,美国知名心理治疗师苏珊·福沃德经典著作《强迫的爱》重新编辑，再度面世！她的作品曾被翻译成15种文字，在多国发行，给处于感情迷茫期、脆弱期的人们开出一剂良药！这本书是苏珊·福沃德博士写给所有被过度的激情控制、捆绑的人们，告诉他们如何不再被爱所伤，被情所困。,7,747,0,25.99,https://wfqqreader-1252317822.image.myqcloud.com/cover/240/22620240/s_22620240.jpg
依恋：为什么我们爱得如此卑微,2018-05-01 00:00:00,心理-发展心理学,美国知名心理治疗师苏珊·福沃德经典著作《为什么我们爱得如此困惑》重新编辑，再度面世！解开我们越爱越受伤的心理谜团。告诉我们如何摆脱情感暴力，重拾自我，重获幸福！曾雄踞《纽约时报》图书排行榜榜首长达44周！,9,720,0,25.99,https://wfqqreader-1252317822.image.myqcloud.com/cover/238/22620238/s_22620238.jpg
儿童心理学：0～8岁儿童的成长（原书第7版）,2021-01-01 00:00:00,心理-发展心理学,本书讲述了0~8岁儿童在发展过程中的特点，以及从胎儿期到8岁这一成长阶段重要的新知识。全书共分为六部分。第一部分是对儿童早期发展的概述，概括介绍了儿童早期相关的历史观点及其演化。第二部分探讨了在孩子诞生前，家庭在教育、社会文化和经济等方面的考虑。第三部分到第六部分追溯了婴儿期、１~３岁、４~５岁、６~８岁等四个阶段个体在知觉、动作、生理、情绪与社会性，以及认知、语言和阅读等方面的发展。本书为父母、心理学专业学生、幼教从业者提供了参照，帮助读者为儿童提供良好的成长环境。,27,871,0,79.5,https://wfqqreader-1252317822.image.myqcloud.com/cover/447/35626447/s_35626447.jpg
教出乐观的孩子：让孩子受用一生的幸福经典（珍藏版）,2017-05-01 00:00:00,心理-发展心理学,《教出乐观的孩子》是积极心理学之父马丁·塞利格曼集30年、千百个成人及儿童研究之精华著成的教育经典。大量研究表明，比起成功，乐观对孩子来说更具有意义、更具有价值。乐观的孩子更容易成功，更有创造力，更容易拥有幸福的生活，我们传统上追求的财富成功，都可以通过乐观获得。《教出乐观的孩子》一书目的在于让父母、老师及整个教育系统教会儿童习得乐观。这本书与其他育儿及自我提升类书籍不同的是，它不仅有理论与实验，还有一些关于育儿问题的重要建议。当下，一些自称专家的人，提出的很多轻率的意见令许多父母如获救命稻草，他们基于脆弱的证明、原理和临床的假设，来改变自己抚养孩子的方式。《教出乐观的孩子》彻底改变了这一点，特别反驳了纯粹的正向教育、纯粹的鼓励式教育和自尊教育，倡导用科学、理性的ABCDE法则教出乐观的孩子。,10,747,0,19.99,https://wfqqreader-1252317822.image.myqcloud.com/cover/260/860260/s_860260.jpg
女性心理学,2017-09-01 00:00:00,心理-发展心理学,本书从性别视角入手，以女性生涯角色分析与生涯发展阶段为主线，解析女性生涯发展中面临的常见压力与压力源，探讨女性生涯发展中压力与健康、压力与生活质量、压力与主观幸福感等主题，以突出以整合的、全面的生活方式调整来主动管理压力的理念。在具体的压力管理策略与技术方面，结合每一主题特点介绍相应的操作性的压力应对策略与技术，以提升女性在生涯发展中主动管理压力的能力。本书不仅是面向女性生涯教育的一本教科书，也是广大职业女性改善工作、生活质量，提升个人主观幸福感的重要读物。,13,681,0,13.6,https://wfqqreader-1252317822.image.myqcloud.com/cover/852/26875852/s_26875852.jpg
我想和你好好的：给年轻人的亲密关系成长课,2018-09-01 00:00:00,心理-发展心理学,本书在汲取发展心理学、精神分析、家庭治疗等领域最新研究成果的基础上，结合作者多年的咨询经验和理论研究，深入剖析了亲密关系各阶段可能出现的种种困惑和问题，让读者在亲密关系中建构新的思维方式，即从理性中看到关系的真相，从关系中看到真实的自己，学会接纳并尊重自己的欲望、幻想和创伤。,11,830,0,25,https://wfqqreader-1252317822.image.myqcloud.com/cover/906/23364906/s_23364906.jpg
知名心理学者李雪作品集（套装共3册）,2019-09-01 00:00:00,心理-发展心理学,该套装包括：《有限责任家庭》《走出剧情》《当我遇见一个人》。《有限责任家庭》讲的是：心理学者、畅销书作家李雪，继《当我遇见一个人》《走出剧情》后，又一力作。继续深入挖掘母婴关系与亲密关系的内核，通过更加丰富与贴近生活的真实案例，揭示育儿过程中父母的行为对孩子的一生可能造成的影响。同时也指明，我们应该如何觉知并转换思维，解决自身已然存在的问题。“爱与自由”是李雪一以贯之的家庭教育理念，在关系中，也体现在界限感上。无论对孩子还是对自己，“守住界限”都是重要的觉知方向。我们每个人都需要对自己负责，也只能对自己负责，做一个清醒的“有限责任人”。整本书共分为六个版块，作者分别从母婴关系、家庭教育、自我觉知等角度，揭露了家庭中存在的诸多隐性或显性的问题，并提供了独树一帜的见解。《走出剧情》讲的是：你敢不敢这样活着——对自己不再有任何要求。不再妄想自己应该成为什么样的人，停止所有的要求与内心戏码。只是去看，看真相是什么看“你是什么”，而非“你应该是什么”。当下的身心渴望，是你唯一的上师。不再定义好坏对错，允许自己“如你所是”，而非“如你所愿”。慢慢地向内观看，释放掉你所有的固守，你就会看见真正的自己、真正的伴侣、真正的孩子，以及所有真相。《当我遇见一个人》讲的是：任何事物，如果你觉得它美，那么它一定暗合了某种美的规律。家庭教育也一样，一个孩子从呱呱坠地到健康幸福地长大成人，他在成长过程中受到的呵护一定暗合了自然发展的规律。母婴关系决定人生的起点。孩子通过内化与父母的情感关系来学习成长，童年的关系模式与长大后的事业、婚恋、养育等，有着丝丝入扣的对应。,15,894,0,69.9,https://wfqqreader-1252317822.image.myqcloud.com/cover/610/33847610/s_33847610.jpg
依恋的修复：唤醒创伤儿童的爱（原书第3版）,2019-10-01 00:00:00,心理-发展心理学,在本书的开始，我想感谢遍布在缅因州及其他州的众多寄养家庭和养父母。在我努力去了解和帮助他们与他们的孩子时，他们曾经给予我挑战、教导和支持。我从他们那里学到很多东西，也常常受到他们的启发。我还要感谢很多人，包括治疗师、个案工作者和不同领域的专业人员，感谢他们的合作与创意。他们奉献自己，找寻方法协助没有依恋感的孩子全身心地融入他们所在的家庭及小区中。我要感谢两个心理学家和英国双向发展心理治疗社区的成员黛博拉·佩奇和金·戈尔丁，他们审阅了第3版的手稿，并就这一版本和过去的修订提供了宝贵的反馈意见，还包括秘鲁州立学院的马克·贝塞尔、密歇根州立大学的维多利亚·菲顿，圣路易斯大学的凯蒂·海登·罗茨，加州拉文大学的芭芭拉·尼科尔。直到现在，我们对孩子所呈现的种种问题，以及如何提供他们所需的帮助，尚无足够的专业了解。为这些孩子工作的专业人员，要面对他们的责任，必须以谦卑的心去奉献、关怀和创造，才能有不一样的结果。我知道有很多人正为此努力。在工作上，我们需要彼此支持，并意识到有许多人正在找寻各种有效的方法。,13,938,0,30,https://wfqqreader-1252317822.image.myqcloud.com/cover/682/26785682/s_26785682.jpg
儿童的人格教育,2021-05-01 00:00:00,心理-发展心理学,"个体心理学创始人阿德勒教育心理学代表作，世界儿童教育领域经久不衰的经典养育读本！深度探究教育本质，健全的人格决定孩子的一生。

《儿童的人格教育》一书中，作者阿尔弗雷德·阿德勒认为一个人的人格结构形成于童年期,要解决一个人的人格心理问题必须从他的童年着手。因此要帮助儿童形成正常的、健康的人格是教育儿童的首要和核心问题。阿德勒反复强调要用正确的方法帮助儿童培养和建立独立、自信、勇放、不惧困难的品质和积极与他人、集体合作的能力。",4,909,0,15.99,https://wfqqreader-1252317822.image.myqcloud.com/cover/101/38821101/s_38821101.jpg
儿童教育心理学,2015-01-01 00:00:00,心理-发展心理学,"    这本书是为家长和教师而作的，他们可以从书中对儿童教育的新的洞见中获益。阿德勒的这本儿童教育书出版70多年来，在欧洲特别是在美国产生了巨大影响。在当今的中国，对于为人父母者或者教师，或者所有关心或从事儿童教育工作的人们，它也具有振聋发聩的作用。本书的出版有益于从深层次提高我们对儿童教育的方法，培养更多有健全人格的人，更好地挽救问题儿童。
",5,720,0,1.99,https://wfqqreader-1252317822.image.myqcloud.com/cover/634/622634/s_622634.jpg
青春期的挑战：写给家长与老师的青少年教育指南,2022-03-01 00:00:00,心理-发展心理学,青春期是孩子从未成年到成年的关键过渡期，这几乎意味着人的“第二次诞生”。对于家长和老师来说，这个年龄段的孩子非常难沟通，他们可能会反抗规则、情绪化、拒绝交流，甚至产生成瘾问题，沉迷游戏，逃学逃家。实际上，青少年的这些“问题”是他们身心高速发展期或多或少都会出现的，他们希望靠自己的力量去解决问题，渴望摆脱对成人的依赖，但心智的不成熟又使得他们无法完全独立。这意味着青少年非常需要大人的引导与陪伴。成人应从管教者变成他们可以信赖、征询意见、倾诉感受、探讨困惑的朋友。本书由五位建树颇丰的心理、教育专业工作者联合打造，内容涵盖了青少年常见的心理与行为问题，包括青少年的人际关系问题、心理困惑、学习的本质以及如何做好家校配合等内容，为学校和家庭教育提供了有效参考。带领老师和家长走进孩子的内心世界，陪孩子成长成才，让孩子一步步蜕变成情绪稳定、积极融入社会、有知识有教养、有能力有担当、有笑对挫折的勇气与胸怀的成年人。,9,926,0,35.9,https://wfqqreader-1252317822.image.myqcloud.com/cover/935/43663935/s_43663935.jpg
