title,publishTime,category,intro,maxFreeChapter,newRating,free,price,cover
比青春期更关键,2021-11-01 00:00:00,心理-发展心理学,纵观整个动物王国，动物青少年都热衷铤而走险。死于交通意外的青少年比成年人更多。同样的，被汽车轧死的青少年动物也比成年动物更多。每一个青少年都是独特的存在，但是地球上所有物种中的青少年都面对着相同的长大成人的挑战：生存下去，取得成就，以及找到自我。“医学界的达尔文”芭芭拉·纳特森·霍罗威茨继“动物普通性“后提出了又一开创性概念：野蛮成长期。她提出了全新界定成年的基本要素，不以年龄为标准，而是成功完成4项任务，获得4种能力，才算完全长大成人。野蛮成长期这段人与动物共有的对其一生都至关重要又激情振奋的阶段，从未被如此深刻地分析过。这是一部跨学科的绝妙之作，涉及自然科学、心理学、社会学、遗传学、生物进化学及神经科学。行文大气，画面感十足，4个动物主角的生命故事特别引人入胜，在故事中透出一个科学家关于人与动物的全新思考。,10,815,0,60.68,https://wfqqreader-1252317822.image.myqcloud.com/cover/584/41819584/s_41819584.jpg
你有几个自己：探秘神奇的人格世界,2022-01-01 00:00:00,心理-发展心理学,"你的内心世界，存在着许多个自己，即，人格的不同侧面。
他们个性不同、喜好不同，时刻在你内心互动，让你鲜活为人。意象对话心理疗法将其称为“子人格”。
你了解、接纳自己多少？驾驭人生的能力有多强？最终取决于这一核心因素——是否看清自己的子人格并了解他们如何相处。
本书通过“拆人术”“心灵组织图”“子人格扑克”等多个方法，引领你逐步找到、熟识并学会驾驭自己的子人格。借助每一个子人格独特而强大的力量，以及彼此之间的神奇关系，让你将内心的冷漠变温暖，将排斥变接纳，将冲突变和谐，将心理疾病转为健康……
心灵实现不一般的净化、重组及新生，人生终将处处顺境、淋漓绽放。",6,786,0,48.3,https://rescdn.qqmail.com/weread/cover/344/3300004344/s_3300004344.jpg
女人交际心理学,2017-08-01 00:00:00,心理-发展心理学,"每个人都有与他人建立人际关系的需求和愿望，只不过有的人表现得明显，而有的人表现得不明显。从性别的角度出发，女性对于人际关系的需求表现得更为明显。女性情感丰富，渴求与珍惜友谊，在交际中讲究情投意合与心灵深处的共鸣；女人情感不稳定，容易在交际中用感情取代理智；女人天性敏感，在人际交往中容易遭受挫折感，更常表现出渴求交往和自我封闭的双重特征。
",25,722,0,13.6,https://wfqqreader-1252317822.image.myqcloud.com/cover/663/918663/s_918663.jpg
自知+你有几个自己+药树,2022-01-01 00:00:00,心理-发展心理学,本套装包含：《自知》《你有几个自己》《药树》3本书组成。作者是国内顶级心理学家，本土原创最具影响力的心理学“意象对话心理学”创始人朱建军教授，其30余年始终专注于意象对话疗法的研究和实践，被多位业内大咖赞誉，广受追随者及来访者好评。《自知》 作者一改自知心理学领域以往著作深奥、晦涩的表达，着重对其思想及治疗技术做了通俗易懂的介绍。从运用的步骤、对心理疾病治疗的关键点等方面做了详尽而生动的讲解，辅以多个案例故事，帮助读者对该疗法一看就懂、一学就会，能够切实地调整内心世界，改善心态，向好的方向转变，堪称自知心理学领域的里程碑式著作；《你有几个自己》为满足本书读者的自我探索需要，以及心理师的学习、研究需求，本书配有多个实用有效的小游戏、小方法，比如人格“成熟度”小测试、自我接纳度小测试、男女气质测试等等。 同时针对众多人格进行生动而形象化解读，比如死神、恶魔、鬼这类人格形象，多数和心理障碍有关， 狮子、龙等人格形象与力量、权利有关等等。帮助读者在对人格形象的生动趣味了解过程中，轻松认清自己；《药树》小说以一位心理师为濒临死亡的绝症女孩做咨询为主线，非常难得地呈现出完整详尽的个案治疗思路，将心理咨询的步骤、技术、重点和难点，以通俗易懂的方式一一揭示。作者作为国内顶级心理学家、最早及最知名的心理治疗师之一，首次将自己的治疗诀窍毫无保留而鲜活地融入小说中，是非常宝贵的心理治疗范本。,11,0,0,120,https://weread-1258476243.file.myqcloud.com/weread/cover/11/3300012111/s_3300012111.jpg
儿童心理治疗中的情绪,2020-05-01 00:00:00,心理-发展心理学,情绪是儿童心理治疗的基础，也是治疗师与儿童沟通的重要媒介。在本书中，肯尼思·巴里斯博士向我们呈现了一种与儿童及其家庭进行治疗性工作的整合性框架：将心理动力学观点的精华与近年来神经科学、依恋研究、认知行为疗法以及系统化视角的研究发现相整合。心理学和神经科学在情绪研究方面的最新进展为我们提供了更为广阔的视角，有助于我们理解儿童的情绪和情绪发展。在此基础上，巴里斯系统地阐述了如何聚焦于儿童的情绪开展治疗，其中包括积极情绪的促进和维持作用、如何用修正后的视角看待童年期的良性发展和病理性发展、对治疗过程不同阶段的新理解，以及解决一些长期存在的临床问题的有效策略。,25,926,0,30,https://wfqqreader-1252317822.image.myqcloud.com/cover/462/31608462/s_31608462.jpg
孩子的心事,2020-03-01 00:00:00,心理-发展心理学,教师或家长可能遇到的孩子的问题包括：欺负别人、被别人欺负、缄默不语、偷窃、喜欢家里蹲……这些教育问题在每个国家或多或少都存在。在这本书中，日本国民心理学家河合隼雄结合孩子的实际教育问题和现状，对学校中孩子的各种教育问题进行了解读，由此说明建设临床教育学这门学科的必要性，从而开创了一门新兴学科——临床教育学。作者结合教育中的实例，告诉读者如何理解孩子的心事，呼吁教师、父母亲临现场，从理解孩子而不是批判孩子的角度出发，帮助孩子跨过人生路上遇到的一道道坎儿。,9,759,0,25.87,https://wfqqreader-1252317822.image.myqcloud.com/cover/548/35566548/s_35566548.jpg
儿童行为心理学,2017-07-01 00:00:00,心理-发展心理学,"    儿童的心灵是世界上最纯净的水晶，也是蕴含着无穷宝藏的宝库。他们每种行为的背后都蕴含着特殊的心理密码，需要大人们去用心挖掘。《儿童行为心理学》通过对儿童爱哭、善变、冲动、不专注、独占欲强、爱钻牛角尖等一系列最具代表性、最为普遍的儿童行为案例的分析，为你一步步揭开隐藏在孩子行为背后的心理学秘密，同时从情绪掌控、人际关系培养、心理透视、自控力培养等八大方面入手，为家长如何应对孩子的各种异常行为，引导孩子心理健康成长提出了最中肯、实际的意见。
",4,638,0,5.99,https://wfqqreader-1252317822.image.myqcloud.com/cover/257/913257/s_913257.jpg
幸福的科学：积极心理学在教育中的应用,2018-04-01 00:00:00,心理-发展心理学,本书将积极教育所提倡的“非认知教育”与当代只关注“智力、知识、技能”的认知教育相结合，旨在将当代教育与积极心理学有序结合，帮助莘莘学子认识自我，丰富内心世界，感悟生命的美好，最终实现自我价值，拥有蓬勃发展的人生，同时帮助每位老师都体验到主观幸福感、生活满意感和事业成就感，从而使他们致力于积极创建积极和谐的校园，培养乐观、积极向上的好孩子。 本书作者是国内积极心理学领域中的领军人物——曾光、赵昱鲲等。本书适合所有想拥有蓬勃而幸福的人生的人士阅读。,12,838,0,26,https://wfqqreader-1252317822.image.myqcloud.com/cover/142/22692142/s_22692142.jpg
二孩妈妈要读的心理学,2019-06-01 00:00:00,心理-发展心理学,"    我国政府从2016年放开二胎政策之后，生育二胎的家庭越来越多。那么，对于二胎妈妈来说，在养育孩子的过程中要注意哪些事项呢？又要如何去做，才能更好地教育和引导孩子呢？《二孩妈妈要读的心理学》从家庭环境、儿童心理、妈妈心理的角度出发，分析了二胎家庭里的各种现象，也告诉那些因为生育二胎而感到迷惘的妈妈如何才能保证两个孩子健康快乐地成长，如何才能让自己成为一个更合格且优秀的好妈妈。
",27,462,0,15.92,https://wfqqreader-1252317822.image.myqcloud.com/cover/852/26297852/s_26297852.jpg
老年心理学,2019-08-01 00:00:00,心理-发展心理学,本书内容涉及老年心理学研究的对象与范围、老年心理学的形成与发展、我国老年心理学研究现状和老年心理学研究方法、退休与老年人心理变化、老年人的社会适应、老年人的自我概念和老年人的社会参与等问题，系统性强，有一定的学术价值。,20,0,0,32,https://wfqqreader-1252317822.image.myqcloud.com/cover/958/33705958/s_33705958.jpg
特殊儿童心理学,2011-05-01 00:00:00,心理-发展心理学,《特殊儿童心理学》内容简介：发展特殊教育（这里专指残疾人教育），首先要对特殊教育有一个认识。所谓特殊教育的特殊，是指这部分受教育者在生理上或者心理上有某种缺陷，阻碍着他的发展。特殊教育就是要帮助他排除阻碍他发展的障碍，使他得到与普通人一样的发展。残疾人并非所有智能都丧失，只是丧失一部分器官的功能。通过教育我们可以帮助他弥补缺陷，或者使他的损伤的器官功能得到部分的恢复，或者培养其他器官的功能来弥补某种器官功能的不足。因此，特殊教育的目的与普通教育的目的是一样的，就是要促进儿童身心健康的发展，只是他们需要更多的爱护和帮助。至于超常儿童教育则又是另一种特殊教育。超常儿童更应该在普通教育中发现和培养，不能简单地过早地确定哪个儿童是超常的。不能完全相信智力测验。这方面我没有什么经验，只是想说，现在许多家长都认为自己的孩子是天才，从小就超常地培养，结果弄巧成拙，拔苗助长，反而害了孩子。在特殊教育中倒是要重视自闭症儿童。我国特殊教育更多的是关注伤残儿童，不大关心自闭症儿童。其实他们非常需要采取特殊的方法来矫正自闭症，否则他们长大以后很难融入社会。自闭症不是完全可以治愈的。但早期的鉴别和干预对他们日后的发展很有帮助。国外很关注这些儿童，也有许多经验，值得我们借鉴。,17,0,0,19.2,https://wfqqreader-1252317822.image.myqcloud.com/cover/13/24275013/s_24275013.jpg
全职妈妈指南：点亮家庭与自我的完满人生,2021-01-01 00:00:00,心理-发展心理学,目前全国至少有9400万城镇全职妈妈，这个数字还会随着二孩家庭的增多而不断变大。虽然全职妈妈对家庭贡献巨大，但是她们承受着巨大的心理压力。本书作者曾为近千名妈妈提供咨询，在女性人生管理方面有超过10000小时的研究，她深知全职妈妈的“痛点”。本书使用真实的案例故事以及有效的心理学方法，旨在帮助全职妈妈做好情绪管理、处理好亲密关系、调整好自己的心态，在照顾好家庭的同时提升自我价值。,10,781,0,25,https://wfqqreader-1252317822.image.myqcloud.com/cover/875/36511875/s_36511875.jpg
兰花与蒲公英,2021-04-01 00:00:00,心理-发展心理学,《兰花与蒲公英》是托马斯·博伊斯博士编写的教育学笔记。全书十个章节，共计17万字。书中收录了他与妻子四十余载的儿童发展研究成果，对于预防和治疗青少年抑郁症、焦虑症、多动症等疾病有卓越贡献。《兰花与蒲公英》的书名源自于瑞典谚语中的“蒲公英儿童”。人们借用蒲公英的顽强、坚韧、百折不挠的生命里，比喻那些茁壮成长、不畏逆境的儿童。所谓的“蒲公英儿童”之所以不为逆境所困，是因为他们对周遭环境的变化并不敏感。由此，博伊斯创造出了另一个颇具诗意的术语——“兰花型儿童”，专门用来描述那些有着过人天赋，却对环境变化极度敏感，需要特殊呵护、教育、引导的孩子。,24,724,0,25.99,https://wfqqreader-1252317822.image.myqcloud.com/cover/477/38099477/s_38099477.jpg
儿童人格教育,2014-12-01 00:00:00,心理-发展心理学,"    本书可以让家长和教师更重视儿童的人格教育，让他们学会分析孩子出现问题的原因。并从中获益，以寻求正确的教育孩子的方法。具有良好人格的孩子，一定也是勇敢、自信、独立的孩子。
",5,735,0,0.99,https://wfqqreader-1252317822.image.myqcloud.com/cover/742/547742/s_547742.jpg
不可思议的青少年大脑,2020-11-01 00:00:00,心理-发展心理学,青少年的大脑是独一无二的，它给了我们一个不可思议的改变和发展的机会。青少年时期也是一个特别敏感和潜在脆弱的时期。如何有效地与青少年沟通，而不会对他们的自尊产生负面影响。如何说，该说什么，不该说什么，以及如何保持青少年日常生活中的最佳心态，都是家长和老师面临的问题。在这本书中，作者们从神经科学和心理学的最新研究、多年的临床专业知识和第一手育儿经历中汲取经验，引导你通过尝试和测试的策略来与青春期少年建立牢固的关系，并在青春期少年发展、学习和成长过程中改善与他们的沟通。本书通过各个章节丰富的案例和最新研究，通过五个步骤解决青少年成长中的烦恼和高敏感青春期的问题，开发青少年最大潜能，成为最好的自己！,8,840,0,28.32,https://wfqqreader-1252317822.image.myqcloud.com/cover/909/34657909/s_34657909.jpg
思维与语言,2010-11-01 00:00:00,心理-发展心理学,《思维与语言》研究心理学中最复杂的问题之一；思维和语言的相互关系，并总结了维果茨基在发展心理学、教育学和精神病理学等领域开展的一系列开创性研究。《思维与语言》深刻地展现了具有高度创造性和缜密思考的智力发展理论，为教育心理学和语言学提供了内部语言的最深刻分析，对后来的心理学家和语言学家产生过重大影响。,3,750,0,13.27,https://wfqqreader-1252317822.image.myqcloud.com/cover/905/591905/s_591905.jpg
聪明却孤单的孩子：利用“执行功能训练”提升孩子的社交能力,2022-01-01 00:00:00,心理-发展心理学,广受欢迎的育儿专家、儿童社交教练卡罗琳·马奎尔已经帮助成千上万个家庭应对孩子长期存在的社交问题，包括害羞、暴躁、多动症等各种各样的问题。什么是社交技能，为什么要进行社交技能训练，导致孩子痛苦挣扎或被忽视的社交行为模式有哪些，如何将这些行为科学理论转化为孩子和父母的实际能力，在这本具有开创性的书中，作者给出了具体的策略和技巧，帮助父母在家里成功参与和指导孩子的社会性发展，提升孩子社交方面的“执行功能”，克服社交尴尬、焦虑、同伴拒绝和霸凌。,10,0,0,40,https://wfqqreader-1252317822.image.myqcloud.com/cover/119/41787119/s_41787119.jpg
马云：路有多远就能走多远,2014-05-01 00:00:00,心理-发展心理学,这本书讲的是马云成功和失败的故事，他的传奇需要你来感受，他的经典需要你来总结。当然，他的神话也需要你的欣赏。他是个落榜少年，经过三次高考才进入中国一般的大学。毕业了，他成为杭州十佳青年教师。一切，似乎才刚刚起步。杭州英语第一人，前途无量。可是，他却毫不犹豫地辞去铁饭碗，下海创业十三年。风雨中，他打造了一个帝国、互联网上的电子商务帝国！　　,4,762,0,2,https://wfqqreader-1252317822.image.myqcloud.com/cover/794/832794/s_832794.jpg
青春期心理学：青少年的成长、发展和面临的问题（原书第14版）,2021-09-01 00:00:00,心理-发展心理学,青春期是困扰青少年、家长和老师的一个重要时期，对于他们来说，这一时期存在很多重大的挑战。青少年研究专家金·盖尔·多金多年来致力于青春期心理学的研究，总结了很多有关青春期的理论方法和应对策略。本书就是她多年研究之精华。本书包括六个部分：第一部分总体介绍了青少年的概况；第二部分讲述了青少年的成长，即青少年的身体变化和认知发展；第三部分讲述了青少年的自我发展；第四部分探讨了青少年的社会关系，即青少年与那些对他们产生影响的人之间的相互作用；第五部分介绍了青少年是如何为未来的成年生活做准备的；最后一部分探讨了青少年可能面临的心理、社会问题，如抑郁、饮食障碍、物质滥用和犯罪等问题。第14版新增内容：互联网和手机对青少年的潜在消极影响。影响青少年心理弹性的个人特质和外部资源。青少年认知发展的神经生理学研究。高中和大学里的学术作弊。过度养育和“直升机父母”。父母接纳与青少年自我表露。参与养育的祖父母对青少年可能产生的积极影响。父母对青少年的情感虐待。全球视野中的网络欺凌现象。女孩不选择科学相关职业的新解释。诱发男孩和女孩抑郁的事件。青少年非自杀性自伤行为的治疗……,45,0,0,49,https://wfqqreader-1252317822.image.myqcloud.com/cover/101/41787101/s_41787101.jpg
儿童教育心理学,2022-05-01 00:00:00,心理-发展心理学,孩子在成长过程总会遇到各种各样的问题，比如害羞孤僻、口吃尿床、打架说谎、逃学闹事……如何帮助孩子培养健全的人格，更顺利地成长？《儿童教育心理学》着眼于如何帮助儿童塑造健康的人格这一核心问题来展开，提出了一套全新的教育理念。从儿童的整体性、目的性、内驱力、社会感等角度解密儿童的发展。阿德勒在文中指出儿童的异常行为只是表象，背后有着深刻的心理动力，孩子种种的异常行为只是为了获得关注，追求优越。阿德勒主张要用正确的方法来培养孩子坚强、勇敢、自信的健全人格，提高孩子与他人合作的意识和能力。当孩子出现问题时，家长不能因为遇到一点挫折就放弃孩子，而应该竭尽所能地帮助孩子，让孩子重新获得面对生活的勇气和信念。《儿童教育心理学》是一部深度解析儿童行为动机的心理学佳作。,5,0,0,22.66,https://wfqqreader-1252317822.image.myqcloud.com/cover/286/44511286/s_44511286.jpg
从多元智能到综合思维,2022-03-01 00:00:00,心理-发展心理学,霍华德·加德纳提出的多元智能理论，堪称“心理学界哥白尼式的革命”。它打破了传统智力理论的基本假设，重新定义了“人类智能”，引起了世界的广泛关注。作为研究人类智能领域的权威，数十年来无数人向加德纳提出过相同的问题：他自身所拥有的智能强项是什么？加德纳在本书中给出了答案。本书是对加德纳学术生涯的回顾，追溯了他从一个有点书呆子气的孩子到渴求新知的大学生，从自由自在的研究生到哈佛教授的演变。纵观加德纳的整个学术生涯，他都在研究广泛意义上的人类智能。加德纳在本书中将目光转向了自己，回顾了其自身的思维发展过程，总结出他最擅长的智能强项是“综合思维”，并称之为21世纪颇具价值的思维方式。多元智能理论的创立及其对全球教育界的广泛影响，正是来源于加德纳的综合思维能力。加德纳在本书中介绍的综合思维的养成过程，对我国中小学教育要求逐渐树立学科融合理念，培养跨学科人才具有重要借鉴意义。,10,0,0,60.68,https://wfqqreader-1252317822.image.myqcloud.com/cover/205/43542205/s_43542205.jpg
独一无二：揭开人格差异之谜,2021-09-01 00:00:00,心理-发展心理学,乔治·米勒奖获奖者、《教养的迷思》的作者朱迪斯·哈里斯新作，史蒂芬·平克、查理·芒格、梁文道诚意推荐。为什么同一个家庭中长大的同卵双胞胎性格差异那么大？塑造人性格的，到底是先天的遗传还是后天的环境？《教养的迷思》作者朱迪斯·哈里斯重新检视学界过往的研究，观察双胞胎、自闭儿，以及猩猩和蚂蚁等生物，得出了自弗洛伊德以来第一个有关“个性”的完整理论：以演化心理学为基础，用关系系统、社会化系统和地位系统这三种心理机制，鞭辟入里地解开了人格差异与形成之谜。,6,0,0,44.99,https://wfqqreader-1252317822.image.myqcloud.com/cover/921/41408921/s_41408921.jpg
儿童逆反心理学,2018-06-01 00:00:00,心理-发展心理学,《儿童逆反心理学》通过一个个真实的、熟悉的、生动的案例故事和通俗易懂心理学知识，揭示了关于儿童逆反心理中的奥秘，破解孩子健康成长中的密码，帮助父母们正确处理孩子逆反心理中所反应的种种问题行为，使父母不再为孩子的说谎、撒泼、厌学、对抗、懒床、不睡觉、不吃饭、拖拉等而苦恼。希望父母们掌握了本书中的不打不骂的温暖教养方法，就能在家庭教育中如鱼得水，让孩子成长为一个有自信、有同情心、有安全感和创造力的优秀儿童。,20,750,0,12.99,https://wfqqreader-1252317822.image.myqcloud.com/cover/820/22661820/s_22661820.jpg
儿童情绪心理学,2017-11-01 00:00:00,心理-发展心理学,"当前，我国约有3000万儿童处于心理亚健康状态，其中约20%的孩子出现自私、抑郁、沟通障碍、心理承受能力差等症状。这不仅严重制约了孩子的健康成长，也带给老师和家长无尽的烦恼。
",6,594,0,9.95,https://wfqqreader-1252317822.image.myqcloud.com/cover/729/934729/s_934729.jpg
30天精通儿童心理学,2009-01-01 00:00:00,心理-发展心理学,本书融专业性、知识性、可读性和趣味性于一体，全面介绍了儿童心理学知识，书中援引了大量典型的故事和案例，贴近现实生活，将晦涩的专业知识寓于轻松的故事中，让你在轻松愉快的阅读中快速了解和掌握儿童心理。,15,605,0,3.03,https://wfqqreader-1252317822.image.myqcloud.com/cover/286/130286/s_130286.jpg
好懂好用的教育心理学：解决学生学习的10个困惑,2012-08-01 00:00:00,心理-发展心理学,    赵希斌专著的《大夏书系：好懂好用的教育心理学(解决学生学习的10个困惑)》用教育心理学的知识解释了如何激发学习动力、提高学习成绩、养成良好的学习与行为习惯、优化师生和亲子关系等问题，探讨了使教育和学习更有效的方法与途径。《大夏书系：好懂好用的教育心理学(解决学生学习的10个困惑)》中呈现的大量真实的教育教学案例将成为桥梁，帮助我们将身边的教育教学现象和教育心理学知识紧密联系起来，促进我们对教育心理学知识的理解，提高我们的教育教学水平。,2,766,0,1.99,https://wfqqreader-1252317822.image.myqcloud.com/cover/310/634310/s_634310.jpg
儿童教育心理学,2019-06-01 00:00:00,心理-发展心理学,阿德勒的《儿童教育心理学》是一本让全世界数千万儿童、父母和教师都终生受益的经典养育读本。本书以个体心理学理论为基础，以经过实践检验的教育方法为指导，从人格统一性、自卑感、卓越感、社会情感、学校教育、家庭氛围等几个贯穿始终的关键词出发，旨在破解儿童的心理行为密码，揭开儿童口吃、说谎、打架、孤僻、懒惰、尿床、暴躁等问题行为的根源，传授父母和教师高效简单的养育技巧，培养儿童拥有自信、独立、勇敢、坚韧、合作等健全的人格。世界上没有教不会的儿童，只有不会教的父母和教师。父母和教师在面对儿童时，要跳脱出固化传统的思维来反思自己的育儿理念，学会从孩子的角度来理解问题、看待世界。,21,757,0,18.9,https://wfqqreader-1252317822.image.myqcloud.com/cover/303/25315303/s_25315303.jpg
