title,publishTime,category,intro,maxFreeChapter,newRating,free,price,cover
女生要学会温柔,2020-04-01 00:00:00,心理-发展心理学,本书内容包括了有青春百分百：青春靓点：阳光女孩的美丽形象、成长指南：妙龄女生的青春发现、知心话儿：青春少女应了解的事、了解自己：生殖器官的处女膜、魅力无极限：魅力亮相：少女的全身魅力展示、特别测试：你的魅力在哪里、星光灿烂：尽显言谈修养的魅力、风采展台：一颦一笑的仪表魅力、温柔猫猫咪：心理塑造：做一个柔情似水的女孩、韵味展示：要有与众不同的味道、魅力修炼：要随时养成温柔习惯、独门秘籍：善用妩媚的女孩更温柔、美眉加油站：塑造自己：女孩的理想形象设计、成长仪式：少女胸脯挺起来等内容。,2,0,0,8.8,https://wfqqreader-1252317822.image.myqcloud.com/cover/503/37463503/s_37463503.jpg
唤醒内在的力量：老年人自处心理手册,2018-08-01 00:00:00,心理-发展心理学,"    本书写给已经步入老年，尚可自由选择生活的读者朋友。作者为《光明日报》社所属杂志《新天地》（原名《老年天地》）写了十多年的专栏文章，本书借此精心整理，细分六章，包括如何有尊严地度过晚年、老人如何保有自我、晚年如何跨跃代沟、如何妥善处理家事，以及晚年夫妻相处技巧、怎样面对再婚等。
",10,0,0,12.8,https://wfqqreader-1252317822.image.myqcloud.com/cover/220/26607220/s_26607220.jpg
拯救孩子拯救心：一位青少年心理专家的忠告,2012-11-01 00:00:00,心理-发展心理学,本书是一本指导家长和老师如何让孩子摆脱面临的各种压力的指导书，作者在书中指出当今的孩子面临着学习、身体、社会等各方面的压力，但最严重的压力还是来自心理方面。心理问题已经严重影响到孩子的成长，因此要培养孩子健全身心的重中之重是培养孩子拥有一个强大的内心，有了强大的内心才能轻松的面对一切压力。,15,0,0,1.99,https://wfqqreader-1252317822.image.myqcloud.com/cover/492/633492/s_633492.jpg
教育心理学,2020-08-24 00:00:00,心理-发展心理学,本教材主要面向师范院校的职前教师及参与在职培训的教师。主要介绍了个体心理过程如：注意、感知觉、记忆、思维、想象等活动的的基本规律；中学生心理发展基本规律，如认知发展规律、品德发展规律、人格发展规律等；学习心理的基本理论，心理健康教育等内容。,23,0,0,12,https://wfqqreader-1252317822.image.myqcloud.com/cover/762/34919762/s_34919762.jpg
孩子的情商是培养出来的,2021-11-01 00:00:00,心理-发展心理学,情商绝不只是“会说话”那么简单！情商其实是一个人能够处理好三种关系的能力：和自己的关系，和他人的关系，以及和社会的关系。孩子拥有高情商，懂得和自己相处，懂得和外界相处，就能够自己管好自己，变得自信、坚韧、懂沟通、有能力！儿童心理专家马紫月，总结孩子情商培养的5大路径和22种情商培养的实用方法，让孩子成为性格好、学习好、人缘好的高情商小达人！,7,0,0,24.9,https://wfqqreader-1252317822.image.myqcloud.com/cover/688/41923688/s_41923688.jpg
高职生心理素质教育与训练,2016-08-01 00:00:00,心理-发展心理学,本教材编者是从事高职大学生心理健康教育工作的一线老师，有着扎实的理论功底和心理学专业背景，同时又有丰富的心理咨询和心理健康教育的实践经验。编者以高职大学生的心理健康成长为主线，围绕高职大学生心理健康特点，设计了十章内容，涉及到高职大学生的心理健康、自我意识、人格发展、人际交往、学习、情绪管理、认识生命等方面内容。,16,0,0,10.5,https://wfqqreader-1252317822.image.myqcloud.com/cover/461/25170461/s_25170461.jpg
阿内特青少年心理学（第6版）,2021-10-01 00:00:00,心理-发展心理学,青少年心理学在心理学领域中是一门应用性很强的分支，因为其主要研究了人生中的重要阶段——青少年期。《阿内特青少年心理学（第6版）》作者为心理学家杰弗瑞·简森·阿内特，他为人熟知的研究成果莫过于“成年初显期”——它针对当下年轻人的成长特点，提出了一个既非青春期也非成年期和成年早期的过渡期。这个概念将贯穿全书，是本书重要的理论基础。《阿内特青少年心理学（第6版）》所包含的主题广泛，从认知基础、文化信仰、心理性别、自我、家庭关系、朋友和同伴、学校、工作等13个方面研究了这一特殊的人生阶段，内容既涉及过去各阶段的历史研究，也包含当下社会变化发展后青少年与初显期成人的新表现。希望《阿内特青少年心理学（第6版）》能够帮助青少年开启自我认识的旅程，并且让青少年周围的社会支持者们如家长、教师更了解当下青少年的特点。另外，本书的研究领域对于心理学从业者和爱好者来说也值得学习与参考。,21,0,0,75.9,https://wfqqreader-1252317822.image.myqcloud.com/cover/970/41413970/s_41413970.jpg
每天学点心理学：改变女人一生的20堂心理课,2015-07-01 00:00:00,心理-发展心理学,"    著名作家六六借电视剧《蜗居》说过：“他在外面有风有度，我在家里疲劳过度。”细数女人的一生，诸多不易，几许心酸。都说女人是水做的。女人的光阴也恰似那一眼涓涓潺潺的春水，挥刀不断、久滴石穿，内心柔软、精神强大，任凭山脉沟壑千回百转，却屡屡挣脱了束缚与阻隔。本书以主人公小米的故事为线索，分享女人的成长历程。配以女人心灵修行课和心理自助工具箱，让您在阅读故事的同时，掌握一定的心理技巧，成为内心强大的女人，获得幸福的人生。
",8,0,0,9.99,https://wfqqreader-1252317822.image.myqcloud.com/cover/197/833197/s_833197.jpg
活出生命的意义（青少年版）,2021-04-01 00:00:00,心理-发展心理学,《活出生命的意义》被美国国会图书馆称其为“美国十大最具影响力的书籍之一”；《纽约时报》称它是“一部经久不衰的生存文学作品”《奥普拉杂志》称赞它是“二十世纪最重要的书籍之一”目前已被翻译成五十多种语言，销量超过一千六百万册。《活出生命的意义》（青少年版）是在成人版的基础上补充了弗兰克尔的精选书信、演讲和生平年表及术语表，更适合12-18岁的青少年阅读。青少年时期是个体发展的“危机期”也是“黄金期”，是决定一个人未来成功和幸福的关键期，《活出生命的意义》（青少年版）帮助青少年从虚无、迷茫、抑郁中超拔出来，找到自己生命的张力，追寻自己生命的意义。,7,0,0,29.99,https://wfqqreader-1252317822.image.myqcloud.com/cover/587/39458587/s_39458587.jpg
儿童青少年沟通心理学,2020-12-01 00:00:00,心理-发展心理学,孩子的每个成长阶段，都会给父母带来不一样的困扰。其实父母可以通过与孩子进行良好的沟通来化解困扰，增进彼此的感情。但良好沟通的前提是，父母理解孩子的身心发展特点，能够与孩子建立共情，站在孩子的角度换位思考，用心倾听他们的表达。本书结合儿童青少年各个年龄阶段的身心发展特点，从非言语的沟通，家庭中的沟通，生活中的沟通，学习中的沟通，同伴中的沟通，手机、网络的沟通，挫折中的沟通这7个主题入手，分析孩子各个成长阶段的不同沟通特点，并辅以大量生活案例进行解读，意在传授家长简单有效的亲子沟通诀窍，帮助家长建立良好亲子沟通，收获亲密亲子关系。,4,0,0,12.9,https://wfqqreader-1252317822.image.myqcloud.com/cover/438/37683438/s_37683438.jpg
女性思维的流变,2014-06-01 00:00:00,心理-发展心理学,《女性思维的流变》分上中下三篇，采用了要素分析法、“性度”分析法，从认识论角度考察女性个体和群体思维。全书讲述了女性思维由传统走向现代的历史流变轨迹，重点分析了信息时代女性思维的流变轨迹，为扩大女性生存和发展空间提出了认识论的前提。,5,0,0,4.99,https://wfqqreader-1252317822.image.myqcloud.com/cover/102/803102/s_803102.jpg
聪明女人要懂得读心术,2010-10-01 00:00:00,心理-发展心理学,人的一举一动都在“泄漏天机”，无意识、下意识、潜意识，无不暴露内心真意识。交往中，如何才能瞬间识破人心？怎样才能看人不走眼？《聪明女人要懂得读心术》将心理学知识应用于日常工作、生活中，教你在与人交往过程中灵活运用心理学的方法，用眼睛洞察一切，“读”懂他人的微妙心思，并对之作出精准的判断，使自己成为人际关系的赢家，进而在事业上取得进一步的成就，赢得美好、幸福、成功的人生。,30,0,0,8.99,https://wfqqreader-1252317822.image.myqcloud.com/cover/802/22661802/s_22661802.jpg
读懂二孩心理：让小宝和大宝共同快乐成长,2020-01-01 00:00:00,心理-发展心理学,随着二胎政策放开，相应而来的二胎家庭心理辅导也开始备受关注，作者站在“大宝”的角度，从一个家庭开始准备“要二胎”，到孕中、“小宝”出生、“小宝”长大的时间顺序，为爸爸妈妈们展现家庭中的“大宝”的每个阶段的心理变化，告诉爸爸妈妈们应该如何及时发现“大宝”的心理变化并采取什么样的行为，避免伤害到我们可爱的“大宝”，并讲一讲如何让“大宝”顺利接受“小宝”的存在。,25,0,0,15.92,https://wfqqreader-1252317822.image.myqcloud.com/cover/786/32012786/s_32012786.jpg
女孩自我保护手册：一位心理咨询师的工作手记,2018-01-01 00:00:00,心理-发展心理学,作者在年幼时曾遭遇性骚扰，因为没人帮助自己，自己也不知道怎么走出心理阴影，致使长大后的生活充满了不幸，并因此遭到家暴，最终离婚。之后，她开始学习心理学，在学有所成的同时，也帮助自己走出了生活的阴暗面。她亲身感受过遭遇侵犯之后内心的苦楚，所以希望能用心理学的知识帮助有类似经历的人走出深渊。于是，她从自身经历出发，结合多年来在心理咨询过程中遇到的案例，在保护咨询者隐私的基础上，写成了这本工作手记。她帮助的人中，既有素昧平生的求助者，也有她的朋友、亲人和同事，她希望借此能帮助那些遭遇侵害的女孩走出心理阴影，并学会自愈和成长。,13,0,0,12.67,https://wfqqreader-1252317822.image.myqcloud.com/cover/836/26062836/s_26062836.jpg
走出中学生活心理误区,2015-12-01 00:00:00,心理-发展心理学,书稿内容来自作者近年心理咨询实践，以散文笔法解读心理奥秘，本着篇篇抓住读者所关注的心灵热点，处处针对读者有困惑的心理难题的准则，从中精选出最具代表性的中学生活的心理故事汇集成册。主要内容有：怎样让学业从心走向成功？怎样走过初春季节性心理的困扰？怎样为自己营造一份好人缘？怎样做自己情感的主人？怎样和自己好好相处？怎样让性格给自己营造好运？怎样化解中学生活中的异常心理？书稿以咨询手记的方式行文谋篇，全书风格突出体现为如下三点：有故事，有人物，有情节，突出可读性；有诊断，有分析，有答疑，确保科学性；有建议，有方法，有对策，讲究实用性。,13,0,0,16,https://wfqqreader-1252317822.image.myqcloud.com/cover/829/27362829/s_27362829.jpg
青少年与网络游戏：一种互联网心理学的视角,2018-01-01 00:00:00,心理-发展心理学,为什么有的青少年会喜欢网络游戏？为什么有的青少年会出现网络游戏成瘾？是因为网络游戏的原因，还是因为青少年自身的原因？玩网络游戏到底会对青少年的成长带来什么影响？对于网络游戏成瘾该如何预防呢？出现了网络游戏成瘾又该如何矫治呢？青少年喜欢的网络游戏能否真正带来积极的影响呢？……这些问题就是本书试图解答的问题。本书是团队合作的结晶，三位作者多年来都专注于互联网心理学的研究，是中国网络游戏与青少年心理研究领域的权威。该书从积极的研究视角，正视网络游戏对青少年成长的积极影响，引导读者和相关从业者正确认识与理解什么是真正的“网络成瘾”，整合中西方前沿治疗理论与实践，为正确矫治提供科学路径。,15,0,0,22.4,https://wfqqreader-1252317822.image.myqcloud.com/cover/859/26875859/s_26875859.jpg
女人气场心理学,2017-03-01 00:00:00,心理-发展心理学,"    气场强大的女人，在交际场中顺风顺水，魅力四射；在职场中受上司欣赏、客户喜欢、同事佩服；在情场中更是活跃分子，总能赢得男性的青睐。每个女人的气场都不同，你接近可以培养并掌控自己的独特气场。本书向广大女性朋友阐述了通过塑造强大的内心来营造强大气场的实用方法，帮助她们通过培养、提升、运用自己的气场，全面提高个人影响力，赢得美丽人生。
",20,0,0,9.99,https://wfqqreader-1252317822.image.myqcloud.com/cover/452/26188452/s_26188452.jpg
女性心理枕边书：洞察女性心理要掌握的200个常识,2006-06-01 00:00:00,心理-发展心理学,女人需要了解自己的内心世界，女人也如同宇宙中的万物一样永不停息地在成长，无论青春少女时代是多么的美妙，它都不可能永恒，静止、停滞的状态不健康的虚幻，一个成熟的女人的一生会是永不停留地螺旋式上升，心灵世界更是一层一层地升华，而自己是引导我们认识自己心灵世界的老师。毫无疑问，在女人的一生中，其实自己是促使自己成熟的最好的催化剂和最好的老师。男人需要了解女人的内心世界，每个女人都渴望一份至真至美的受，渴望一个可以依靠的宽大肩膀，在生活中给予她们保护、遮风挡雨；在事业中，给她们出谋划策，承担风险。即使一个看起来再独立、再坚强的女人，她内心的这种渴望都是丝毫不少于其他女人的。作为男人，要学会去了解女人，能够适时地给予她一些指点和支持，鼓励她去做新的尝试，那么一切对她来说，都是地是幸福的忙碌……,3,0,0,5.98,https://wfqqreader-1252317822.image.myqcloud.com/cover/24/305024/s_305024.jpg
嗨，中学的我：初中心理健康教育教材,2018-09-01 00:00:00,心理-发展心理学,本书为合肥市初级中心学心理健康教材。近几年，未成年人的心理健康的性格和心理机制，怎样正确的认识自我和周围。在引导学生自我认知的过程中，培养学生的核心素养，提高学生的综合素质，是这本教材的编写目的。,15,815,0,19,https://wfqqreader-1252317822.image.myqcloud.com/cover/538/23681538/s_23681538.jpg
如何让孩子自觉又主动实战指南,2021-06-01 00:00:00,心理-发展心理学,《如何让孩子自觉又主动》一对一实战练习手册，量身定制的开放式大脑培养指南，包含漫画+图解+答题练习+实用活动，手把手教你理解、反思和应用开放式大脑培养策略。这本指南不仅能帮助孩子也帮助父母塑造开放式大脑，形成开放式大脑的思维模式，引导他们以一种开放的、灵活的、主动的状态应对工作、学业、生活、养育。书中运用问答、表格、活动、插图等互动形式帮助父母学会：在真实情景中练习并强化开放式大脑的四大基本特质——平衡力、复原力、洞察力和共情力；识别孩子什么时候需要父母“推一把”走出舒适区，什么时候需要父母“拉一把”增强安全感与亲密感；运用策略减少孩子负面行为及消极心态，增强积极心态的能力。学会运用开放式大脑策略，帮助孩子解锁并释放与生俱来的坚韧、高情商及创造力，让孩子对一切挑战主动说Yes。,11,0,0,35.71,https://wfqqreader-1252317822.image.myqcloud.com/cover/902/41135902/s_41135902.jpg
解读儿童心理,2021-06-01 00:00:00,心理-发展心理学,父母是孩子的启蒙老师，是引导孩子获得良好品格、出众的学习能力和人人欢迎的社交能力的教练，想要教育好孩子，父母必须懂一些心理学。本书正是立足于儿童的教育问题，从心理学角度出发，从孩子的品质培养、习惯养成、情绪管理、学习问题、社会交往等方面出发讲解，为家长们给出了可操作的解决方案，成为家长朋友们教育儿童的实用手册。,26,0,0,15.92,https://wfqqreader-1252317822.image.myqcloud.com/cover/112/41600112/s_41600112.jpg
3-7岁儿童社交心理学,2021-10-01 00:00:00,心理-发展心理学,本书结合经典儿童心理学原理、有趣的心理小实验、具有很强代表性的生活案例，带家长朋友们走进孩子的社交世界，洞悉孩子在冲突中的真实感受与需求。通过完整的培养解决冲突能力体系，为孩子量身定制预防冲突的思维模式、日常的训练模式、当场引导方式、家园的合作模式，以幽默智慧的沟通和游戏让孩子突破心防，愉悦诚心地与伙伴合作。并为不同气质类型的孩子与不同养育类型的家长有针对性地提供引导方案，让家长朋友们在育儿过程中走出困惑，灵活指导孩子，使孩子健康成长。,12,0,0,19.92,https://wfqqreader-1252317822.image.myqcloud.com/cover/146/41600146/s_41600146.jpg
儿童自我控制的发展与促进,2017-05-01 00:00:00,心理-发展心理学,本书系国家自然科学基金课题“儿童自我延迟满足的发展及其影响因素的研究”、澳大利亚研究理事会课题“自我延迟满足的跨文化研究”全国高等学校博士学科点专项科研基金课题“儿童自我控制的结构及其发展机制的研究”“儿童自我发生发展特点及因果模型建立”等课题的系列研究成果。,20,0,0,39.2,https://wfqqreader-1252317822.image.myqcloud.com/cover/834/26875834/s_26875834.jpg
儿童情绪心理学,2020-09-01 00:00:00,心理-发展心理学,在家庭教育过程中，细心的父母能够很快捕捉孩子的情绪变化，但大多时候难以理解其原因。孩子的情绪随着年龄的增长不断发展，每个时期都有不同的表现特征和心理动因，父母要想在儿童期打好孩子人格和智力发展的基础，就必须对儿童情绪发展有一个详细的了解。本书从专业角度分析了0~14岁4个阶段儿童情绪的发展特点和心理成因，为父母提供了实用的调节策略，同时对儿童的基本情绪、复合情绪及应激情绪做了细致的心理解读，协助家长及时理解孩子各类情绪信号，轻松化解孩子的不良情绪，引导儿童正确表达和调节情绪，收获愉快的成长体验。,10,0,0,12.9,https://wfqqreader-1252317822.image.myqcloud.com/cover/452/37683452/s_37683452.jpg
儿童青少年社交心理学,2021-01-01 00:00:00,心理-发展心理学,这是一本实用性很强的“参考书”，将孩子在社交中遇到的各种问题加以呈现。作者是一个知识的整理者，将多年以来学习到的心理学家、教育学家的思想观点，整理、传递给家长，帮助家长从不同角度看问题，直击孩子社交问题的关键。作者还是一个分享者，将自己多年遇到的与孩子社交有关的事件描述、呈现给家长，把经验、感触与家长分享，让家长能够具体把握孩子的社交现状，以充足的准备应对孩子的社交难题，帮助孩子发挥性格优势，养成高效社交能力。,12,0,0,12.9,https://wfqqreader-1252317822.image.myqcloud.com/cover/444/37683444/s_37683444.jpg
儿童沟通心理学,2018-07-01 00:00:00,心理-发展心理学,父母是孩子的启蒙导师，是孩子人生的引路人。父母只有了解孩子的心理特征、内心需求，才能找到适合与孩子沟通的方式，才能使亲子沟通变得顺畅无阻。本书从心理学的角度出发，为广大家长提供了一套与孩子沟通的指导方法。相信通过阅读本书，家长们一定能够走进孩子的心里，获得孩子的信任和尊重，进而指导孩子健康成长。,21,0,0,14.72,https://wfqqreader-1252317822.image.myqcloud.com/cover/467/25559467/s_25559467.jpg
大学生心理健康教育,2012-12-01 00:00:00,心理-发展心理学,本书为有效开展大学生心理健康教育，提高课堂教学质量，开设好心理健康教育课程而编写。内容设计以教育部《普通高等学校学生心理健康教育课程教学基本要求》为依据，以科学性、主体性、体验性和针对性为原则，遵循大学生心理发展规律和当前的客观现实，集知识传授、心理体验与行为训练为一体，旨在使学生明确心理健康的标准及意义，增强自我心理保健意识和心理危机预防意识，掌握并应用心理健康知识，培养自我认知能力、人际沟通能力、自我调节能力，切实提高心理素质，促进学生全面发展。全书共十一章，分别涉及大学生心理适应与适应教育、大学生自我意识及自我完善、大学生人格特征及人格塑造、大学生学习及学习指导、大学生情绪体验及情绪管理、大学生人际交往及心理沟通、大学生择业心理及生涯规划、大学生恋爱心理及恋情疏导、大学生挫折心理及挫折应对、大学生心理危机及心理援助等问题，与大学生的学习、生活密切联系，可以为大学生提拱具体、适合的指导。,23,750,0,11,https://wfqqreader-1252317822.image.myqcloud.com/cover/807/640807/s_640807.jpg
儿童语言心理学（完全图解版）,2021-02-01 00:00:00,心理-发展心理学,良好的口才与清晰的语言表达能力不但能增强孩子的自信，还能让孩子们在成长过程中获得更多的机会。本书全面剖析了培训孩子语言技巧所需要的因素，教会孩子克服胆怯、提升自信，从而培养良好的人际关系。通过此书，孩子们可以增强语言表达能力，提升语言表达技巧，学会为人处世的技巧，在成长的路上时刻充满快乐。,21,0,0,15.99,https://wfqqreader-1252317822.image.myqcloud.com/cover/697/41718697/s_41718697.jpg
梅兰妮·克莱因儿童心理学：爱、罪疚与修复,2021-01-30 00:00:00,心理-发展心理学,本书是梅兰妮·克莱因的经典儿童心理学著作之一。用通俗易懂的语言向世人介绍了爱、恨、嫉妒、愤怒和自我谴责等情感背后的心理活动运作过程。作者通过对婴儿的观察，以及对儿童的心理治疗过程，总结出了诸多有关人的情感的起源和发展的潜意识规律。一个人只有确信自己拥有爱，才敢真正地表达恨意，才会有罪疚感以及愿意修复感情的裂痕。克莱因通过本书研究、总结有分析了人类的爱、罪疚与修复，指导我们了解儿童这一情感的心理，教导我们在与儿童相处时正确面对这些情感，从而建立良好的亲子关系。,4,0,0,19.99,https://wfqqreader-1252317822.image.myqcloud.com/cover/195/39577195/s_39577195.jpg
孩子的方式：儿童绘画心理分析与观察指南,2018-01-01 00:00:00,心理-发展心理学,作者杭海以一位自己孩子的父亲的眼光与经历来描述一个普通孩子的涂鸦所带来的问题、发现、喜悦以及某种程序的思考。太极拳的动作刚柔相济，变化莫测，五岁时杭大川以极简的笔法生动地表达了一个个太极拳的瞬间意象，面对太极拳一系列复杂而连贯的动作，儿童究竟看见了什么，记住了什么，又是如何将其心理意象转化为一个具有象征意义的、形意兼备的简化图形？这样的问题尚未有明确的答案，科勒（格式塔心理学的奠基人之一）曾说过，心理学还是一个娃娃。,6,733,0,47.6,https://wfqqreader-1252317822.image.myqcloud.com/cover/653/23734653/s_23734653.jpg
资深心理师育儿手记（3~7岁）,2021-07-01 00:00:00,心理-发展心理学,知名心理学家武志红、《爸爸去哪儿》制片人谢涤葵倾情推荐。教育的本质是让孩子成为自己。在孩子3~7岁时，给予孩子尝试的机会，陪伴孩子探索、冒险、学习新技能、全面地认识世界，是家庭教育的重要任务。在这个阶段，有力量的爸爸会提高自己的能力，让自己成为孩子的榜样，带领孩子体验新奇的事物、建立责任意识。厚重的父爱，是孩子社会化最坚强的后盾。胡慎之老师以自己的儿子为记录对象，让心理学理论寓于生动的儿童成长故事之中，将专业性与趣味性巧妙结合。通过阅读本书，父母不仅能了解3~7岁孩子的需要，也能帮助孩子学会自我负责、自我照顾，与世界、社会、他人和谐相处。,7,0,0,29.8,https://weread-1258476243.file.myqcloud.com/weread/cover/11/3300016511/s_3300016511.jpg
