title,publishTime,category,intro,maxFreeChapter,newRating,free,price,cover
和秋叶一起学职场技能,2016-07-01 00:00:00,心理-认知与行为,《和秋叶一起学职场技能》从初入职场的新人必然会遇到的问题谈起，选取典型的话题，按职场成长顺序，分为新人篇、提升篇、充电篇和规划篇4个单元。无论是思维上的解惑，还是实际行动上的方法论，本书都会一一涉及。《和秋叶一起学职场技能》这本书无论是对职场新人还是有一定工作经验的人，都会有所启发。,12,721,0,19.5,https://wfqqreader-1252317822.image.myqcloud.com/cover/355/24980355/s_24980355.jpg
像高手一样行动,2021-04-01 00:00:00,心理-认知与行为,"《一万小时天才理论》作者丹尼尔·科伊尔采访了商业、科技、体育、艺术、音乐、数学等众多领域的大量专家，发现并总结出很多可以提升技能的简单原则。通过亲自实践，从中精选出52条最具实用性的原则，集结成这本作品。亚里士多德说过：“重复的行为造就了我们。因此, 卓越不是一种行动，而是一种习惯。”按照书中提供的52条原则去塑造自己的习惯，读者就可以实现每周铭刻一个微习惯，每年精进一个新技能的美好愿望，最终成就卓越人生。",12,655,0,40.43,https://wfqqreader-1252317822.image.myqcloud.com/cover/684/37730684/s_37730684.jpg
安心正念课,2019-03-01 00:00:00,心理-认知与行为,全书分为１０章，以“正念”为核心理念，以“提高人生的掌控力”为终目标。１～２章介绍正念的基本概念及正念练习的态度。３～１０章以周为单位，分别从呼吸、专注、身心合一、情绪、头脑里的念头、与烦恼和平共处、处理人际关系、成为一个完整的人等８个方面，由内而外，逐步升华，讲解了正念练习的方法。同时每周设置“作业”与“答疑”环节，助力每位读者完成正念练习，聆听身体告诉我们的信息，使自己的内心变得更加快乐和平静，提升自己的创造力、专注力、抗压性和身心健康水平，实现破茧成蝶的蜕变。,26,765,0,29.9,https://wfqqreader-1252317822.image.myqcloud.com/cover/949/25941949/s_25941949.jpg
精进有道：想清楚、坚持住、有能力,2020-06-01 00:00:00,心理-认知与行为,优秀的人学习赢家的行动方法，卓越的人思考成功的底层逻辑。《精进有道：想清楚、坚持住、有能力》是百万册畅销书作者、中国知名企业家、拉卡拉集团董事长孙陶然的自我管理类作品。 孙陶然认为，不管世界如何变化，成功人生的底层逻辑都是不变的：想清楚，坚持住和有能力。而普通人和赢家能力的差距，往往体现在认知、决策和执行这三项“根能力”的修炼上。他在书中深度复盘自己求学、创业、管理和生活经验，从选择、认知、成长、干法和活法五大维度，亲授精进之道，帮助读者提升个人核心竞争力，以应对这个不确定的世界。书中既有做人做事的具体方法，又有跃迁精进的底层逻辑，是每一位年轻人的人生自我修炼手册。,12,696,0,35.4,https://wfqqreader-1252317822.image.myqcloud.com/cover/972/31170972/s_31170972.jpg
色彩心理学,2014-04-01 00:00:00,心理-认知与行为,"    本书重点讲述了色彩心理学在各个领域的知识和应用，比如在儿童的世界里、日常健康饮食、读心识人、人际交往、职场技巧、心理保健等方面，其中总有些领域是你感兴趣的。作者将带你走进一个由色彩构成的缤纷世界之中，带你领略色彩的魔力。如果你对色彩感兴趣，如果你对心理学也相当喜欢，那就翻开这本书吧！一起来探究色彩心理学的秘密。
",4,556,0,9.99,https://wfqqreader-1252317822.image.myqcloud.com/cover/986/736986/s_736986.jpg
成为自己的解梦师：朱建军解梦30讲,2021-08-01 00:00:00,心理-认知与行为,30年解梦技术精华，零门槛成为解梦达人。解梦，了解你不知道的自己。,5,0,0,28.8,https://weread-1258476243.file.myqcloud.com/weread/cover/8/3300016508/s_3300016508.jpg
人为什么会吵架：冲突背后的创伤触发,2022-04-01 00:00:00,心理-认知与行为,"你是否遇到过以下几种情况：
 1、与爱人争吵 
2、对孩子大发雷霆 
3、在会议中途离开 
4、开车时破口大骂 
5、做出非常不理智的决定 
…… 
以上这些表现，可能都是创伤被触发后的反抗行为。

这本书分为两大部分，第一部分教我们如何识别和处理触发反应。第二部分告诉我们如何在伴侣、亲子、朋友、同事等不同类型的关系中应用这些方法。 被遗忘的伤害、未被满足的需求、自我保护的性格习惯……发现并学会接受这些缺失的部分，或许能够帮助我们变得更加完整、更有力量。",5,581,0,35,https://weread-1258476243.file.myqcloud.com/weread/cover/62/3300015062/s_3300015062.jpg
善恶之源,2015-03-01 00:00:00,心理-认知与行为,婴儿有道德感吗？我们是如何成为有道德之人的？理性思考对道德决策来说无足轻重吗？保罗·布卢姆把心理学、行为经济学、进化生物学和哲学的深刻思想融为一炉，力图探索我们究竟如何超越先天道德的局限。与此同时，他还研究了黑猩猩、心理变态者和常春藤教授们的道德，探索了我们对性、政治、宗教和种族问题的令人困扰的道德感觉。作者引述了美国耶鲁大学的开创性研究，证明婴儿早在能开口讲话和行走之前，就有能力判断他人行为的好坏，就能产生共情和同情，就能产生原始的正义感。,24,711,0,20.99,https://wfqqreader-1252317822.image.myqcloud.com/cover/110/622110/s_622110.jpg
树木—人格投射测试,2017-09-01 00:00:00,心理-认知与行为,《树木—人格投射测试（第3版）》是一本跨文化心理咨询技术理论原创作品。作者吉沅洪教授，是拥有中国本土文化背景和日本心理学受训背景的跨文化心理治疗专家。全书以通俗的语言和具体的案例，系统而前沿地介绍用树木投射法进行人格测试的理论基础、最新研究进展、具体测试和治疗方法，并侧重于测试材料、提示语、测试系统的解释等测试的具体实施技法的介绍，通过典型案例的分析和大量图示，让读者详细地了解并熟练掌握这一技术。长期以来，我国心理学专著以大量引进欧美日理论专著为主，少有能够反哺国外的优秀理论作品。《树木—人格投射测试》是近年来不可多得的国内优秀原创心理学专著。该书曾于2007年、2011年由重庆出版社出版1版、2版，是一部经受了市场检验的心理学专著，其在心理治疗专业领域拥有无可撼动的地位。本书适用于心理咨询与治疗领域、人力资源管理领域从业人员及研究者、学生，对跨文化心理研究感兴趣的研究人员，也适合于对心理学感兴趣的大众读者。,13,838,0,19.8,https://wfqqreader-1252317822.image.myqcloud.com/cover/626/27093626/s_27093626.jpg
变态心理学：天才在左，疯子在右,2018-02-01 00:00:00,心理-认知与行为,"    变态心理学是心理学最有意思的分支，探究的是不同类型、不同程度的心理异常。本书是隋岩老师《变态心理学》系列图书第5部，与前面几部不同，本书更加关注人的命运。这本书里介绍的都是逝去的天才，也是众生眼中的疯子。有的人在艺术上自成一格，成了一代大师，如梵·高；有的人恣意妄为，以个人生命实践艺术理想，如王尔德；有的人走在时代之前，敢言他人不敢言，行他人不敢行，如波伏娃。这些人具有特殊的心理气质，像躁狂抑郁症、自恋型人格、双性恋……
",13,597,0,12,https://wfqqreader-1252317822.image.myqcloud.com/cover/242/932242/s_932242.jpg
心理韧性,2020-12-01 00:00:00,心理-认知与行为,压力是我们对大脑感知到的威胁或挑战产生的内在反应，而创伤是我们对感觉无能为力或缺乏动力的事情做出的反应。人人都会遭遇这两者构成的连续体。实际上，哪怕身处再凶险的环境，我们也可以通过训练发挥能动性，让任何因压力或创伤造成的不适行为或反应得到调节和治愈。通过培养心理韧性，我们能够训练自己做出明智的决定和选择，哪怕是在面临难以置信的压力、不确定性和变化的环境时。这部开创性的著作审视了妨碍人们建立心理韧性的文化范式，向我们解释了如何在压力下引导注意力并从创伤中恢复的科学原理。通过作者在美国军方、医疗机构和国会山等地开展MMFT（正念心理健康训练）的经验，以及介绍她本人及周围的人遭遇的压力和创伤及其疗愈过程，斯坦利博士为我们提供了可以亲身实践的承压和疗愈策略，并指明了一个全新的认知方向。,7,0,0,58.8,https://wfqqreader-1252317822.image.myqcloud.com/cover/746/35547746/s_35547746.jpg
梦的解析,,心理-认知与行为,本书是弗洛伊德的成名代表作，被认为是本世纪最富创见的、最伟大的著作之一，是了解精神分析学说和潜意识理论的必读书，读者可以从中发现很多令人兴奋的观察和大量与我们主题有关的饶有兴趣的材料。《梦的解析》已被视为精神分析学说的重要组成部分和三大理论支柱之一。美国前全国图书馆协会主席唐斯博士将这本书列入“改变世界历史面貌”的十六部巨著之一。,12,773,0,19.99,https://rescdn.qqmail.com/weread/cover/213/3300003213/s_3300003213.jpg
情绪心理学,2016-01-01 00:00:00,心理-认知与行为,情绪是基本心理过程之一，是心理学研究的重要对象，也是国内外学术研究的前沿和热点问题。本书主要内容包括情绪研究历史及情绪理论、情绪的主观体验及评价、情绪的外部表现及识别、情绪的生理激活及测量、情绪的生理学基础研究、情绪与认知、情绪与行为、情绪与健康、情绪智力、情绪发生与发展的研究等。,68,791,0,27.2,https://wfqqreader-1252317822.image.myqcloud.com/cover/815/839815/s_839815.jpg
生理心理学（第二版）,2007-03-01 00:00:00,心理-认知与行为,本书不仅从国内外生理心理学专著中，还从有关的临近学科如认知心理学、神经生理学、神经心理学、分子神经生物学和信息科学等许多领域中吸取了最新研究成果，分别用以讨论感觉、知觉、注意、学习、记忆、言语思维、本能动机、情绪情感、人格、运动与意志行为等心理活动的生理机制问题，并联系了失认症、失语症、遗忘症、儿童注意缺陷障碍、精神分裂症、情感性精神病、智能障碍和人格障碍等病理机制的新理论。书中还涉及了知觉、注意、学习、记忆和言语思维等有关的认知理论、人工智能和人工神经网络的理论概念。在导论中，作者论述了生理心理学的历史、当代发展趋势，并概括地介绍了必备的基础知识。书后还列出了国内可得到的中外文最新参考书目。本书可作为心理学、教育学、医学、神经生物学等专业的大学生教科书。亦可作为这些领域的理论研究者的基础知识更新的参考书。,10,806,0,8.85,https://wfqqreader-1252317822.image.myqcloud.com/cover/183/592183/s_592183.jpg
性格决定命运,2018-01-01 00:00:00,心理-认知与行为,本书从性格定义、性格特征、性格类型、影响性格的因素、性格对人的前途命运的影响等多个角度，对性格内涵做了深入挖掘，从理论和实践两方面，全面而深入地阐述性格对命运的决定关系，不仅在理论的层面对性格决定命运进行了科学的论证，而且对每种性格都做了较为透彻的分析，并着重于对性格的优势和缺陷的剖析，以期对读者了解性格的方方面面有所帮助。本书还从性格理论出发，从众多的性格类型中，列举了如自信、狭隘、懦弱、贪婪、刚毅、自满、自负、博大、谦虚、诚信、精细、勇敢、多疑、孤僻、乐观、自卑、进取、顽强、创新、任信、谨慎、傲慢、固执等性格特征来进行分析、阐述，不仅有正面的性格还有负面的性格，同时选取具有典型性格的历史人物，采取将历史和事件相结合的方式，通过具体历史事件对性格进行解释分析。,43,650,0,12.99,https://wfqqreader-1252317822.image.myqcloud.com/cover/135/26188135/s_26188135.jpg
让你在公司显得很能干的52种方法,2019-05-01 00:00:00,心理-认知与行为,本书作者罗斯·麦卡蒙曾是一个来自小地方的没背景、没资源的普通航空杂志社职员，当他跳槽到《时尚先生》时，他发现自己和周围同事格格不入。衣着不得体，不认识大人物，不懂商务午餐规则，甚至不会在酒吧点酒水。他不知道如何在这样的知名杂志社工作，也不知如何能在纽约生存下去。但在纽约工作几个月之后，他发现一个真相：原来身边的每个人都是冒牌货，都缺乏安全感，原来他仰慕的那些人，并不比他聪明和勤奋，他们只是更擅长“显得”比别人优秀。于是，他的整个职业生涯都用来痴迷地研究，在什么样的细节上做出改变（从汇报工作时的措辞到商务午餐的握手寒暄，从面试时的眼神交流，到走上演讲台的动作设计），就能让你摆脱职场透明人的尴尬，成为气场强大的精英。,6,370,0,25.2,https://wfqqreader-1252317822.image.myqcloud.com/cover/380/25802380/s_25802380.jpg
一个笔记本搞定你的拖延症,2018-12-01 00:00:00,心理-认知与行为,《一个笔记本搞定拖延症》是行动创新笔记。30秒！写下昨天做的事情……30秒！写下对这些事情的感想……60秒！写下为了实现目标，今天想要做的事情……60秒！写下今天在10秒钟之内就能做到的事情……你是否总是被工作、作业追赶，忙了一天才发现，重要、紧急的工作还没开始做？这一切都是因为你的工作方法不对！3分钟行动创新笔记术，让你在不知不觉中治好自己的拖延症。这本书将工作中的事务分为4类：紧急且重要的工作、重要非紧急的工作、紧急非重要的工作和非紧急非重要的工作，用“理论阐述+案例分析”的方式，手把手地指导你如何用一本笔记本改掉工作、生活中拖延的坏习惯。,6,587,0,27,https://wfqqreader-1252317822.image.myqcloud.com/cover/832/23934832/s_23934832.jpg
心理自愈术：做自己的心理医生,2014-07-01 00:00:00,心理-认知与行为,本书是法国心理学家埃米尔·库埃的旷世之作，它不仅系统的介绍了不同类型的心理障碍产生的原因，而且还告知读者如何使用相应的方法来治愈我们内心的疾病。这是一本能切实帮你重塑自我、安顿身心的实用心理学书籍，它能够打消你内心的忧虑，满足你内心深处的渴望。本书选取了生活中常见的自卑心理、自恋心理、抑郁心理、恐惧心理、焦虑心理、报复心理、强迫心理以及神经性设施障碍，分别从是什么、为什么、怎么样的方式，深入浅出地分析了心理障碍产生的原因以及自我治愈的方法，语言质朴平实，道理浅显易懂，方法简单易学，是不可多得的实用心理类书籍。,4,746,0,12.99,https://wfqqreader-1252317822.image.myqcloud.com/cover/42/832042/s_832042.jpg
儿童性格色彩心理学,2016-08-01 00:00:00,心理-认知与行为,作为父母常常有这样的困惑：自己的孩子自己却不了解，不知该如何教育，常常发生摩擦，甚至和自己像仇人般的敌视，这些问题让父母感到头疼。有没有一种简单的工具和理论，能让父母很快地了解孩子的性格？有没有一种相对针对性的，而不是放之四海皆准的方法，来教育自己的孩子，同时可以审视父母自己身上的问题？《儿童性格色彩心理学》这本书就为父母解决了这些问题。这是一本易于理解和操作的儿童性格分析的书，共分七篇，每篇分两章。,7,676,0,14.72,https://wfqqreader-1252317822.image.myqcloud.com/cover/966/846966/s_846966.jpg
你是自己的全世界,2018-12-01 00:00:00,心理-认知与行为,你身边肯定有一类人，或者你就是这样的人，总被人评价“这人挺好”，但其实你自己并不想这样。不好意思拒绝别人的请求，却经常让自己陷入两难的境地，心思敏感，不自觉地去猜测对方的想法，担心被别人讨厌……具备讨好型人格特征的人往往过得很累，明明自己也不愿意这样，但却总是下意识习惯性地去迎合对方、取悦别人。因而时常觉得自卑，甚至讨厌自己，造成极大的心理包袱和社交压力。,17,786,0,6,https://wfqqreader-1252317822.image.myqcloud.com/cover/363/25117363/s_25117363.jpg
勇敢而非完美,2019-07-01 00:00:00,心理-认知与行为,身为女性，我们从小接受的教育就是要小心翼翼、温文尔雅、安全第一。用心良苦的父母和老师会教育我们要优雅文静、彬彬有礼，并且要求我们凡事谨慎小心，宁可不做也不能冒险。但与此同时，他们却鼓励男孩们大胆尝试、无所畏惧。可见，我们教育男孩要勇敢，却教育女孩要完美，这会导致很多女性从小恐惧失败，并强迫自己事事做到，而且待她们成年后，这种情况也会愈加严重——当我们担心自己表现不佳、不够完美时；当我们担心自己会犯错，退缩不前时，我们就会压抑自己、局限自己，无法活出真实的自己。全美非营利性组织“编程女孩”创始人兼CEO、著名TED演讲人拉什玛·萨贾尼通过自己的个人经历，以及对数百名女孩和成年女性的采访，在本书中分享了自己和许多勇敢改变世界的优秀女性的故事，并且提出了很多具有可行性的实践方法，从而激励更多女孩摆脱完美的陷阱，勇敢地向前一步，重塑自我，追求更加精彩的人生。,6,750,0,29.4,https://wfqqreader-1252317822.image.myqcloud.com/cover/910/25890910/s_25890910.jpg
关系重建：如何修复有裂痕的关系,2022-05-01 00:00:00,心理-认知与行为,在关系中，无论是出于对安全感的需要，还是对美好关系或结局的期待，当你企图改变或控制对方时，权力争夺的游戏便开始了：从劝告、邀请，到建议、规则，再变成责备、义务，产生怨恨、报复，再转为冷漠、疏离，信任感被破坏，内疚和自责也开始产生。在这个过程中，你也会悄悄地扮演加害者、拯救者和受害者三个角色。 对权力的欲望是一种非常积极的力量，以至于会推动着关系发生各种各样的变化。 如果一段好的关系能放大我们最好的一面，让我们进化，那么一段过度拉锯的关系会让我们怀疑自己或对方，伤害我们的自尊，或让我们产生无法表达的愤怒。以至于有时我们在这种交流中不再认识自己。后来，我们会说“我怎么能和他做朋友，爱他，信任他”，等等。面对关系中的裂痕，如何才能慢慢修复，重建亲密与信任？     本书作者通过探讨关系中的角色变换，提供了识别沟通障碍的方法和修改沟通方式的工具。读罢你会发现：维系一段关系可以不需要激烈的磨合、斗争、较量；接纳与尊重，分享与认可，陪伴与信任，是有毒关系最好的解药。,9,0,0,35.9,https://weread-1258476243.file.myqcloud.com/weread/cover/72/3300019872/s_3300019872.jpg
终生成长,2019-11-29 00:00:00,心理-认知与行为,本书由DISC双证班社群组编、陈韵棋主编。DISC双证班社群源于DISC双证班课程，是由培训师和职业经理人李海峰老师与4000多名毕业生联合创办的有温度、强链接的学习型社群，也是一个纯口碑推荐、无代理商营销、纯义工运营、无全职工作人员的社群。其成员涵盖各个领域的精英，包括古典、秋叶、萧秋水、哈默、占隼、李忠秋、彭小六、SCALERS等知识型IP。李海峰拥有十多年DISC实战经验，3000多名毕业生遍布百余家世界500强企业及大型上市公司，广受好评。《人力资源》《中国培训》《创业周刊》《人力资源管理》等杂志封面人物，著有《我为什么看不懂你》《DISC职场人格测试学》《DISCover自我探索》等职场畅销书。陈韵棋是DISC双证班联合主讲、DISC双证班社群联合创始人。曾任职于奥美集团旗下4A广告公司、铂涛酒店集团等知名企业，具备丰富的培训管理及培训授课经验。10余年来长期致力于客户化的课程研发，并为客户提供了定制化高质量的培训服务。,8,0,0,39.9,https://wfqqreader-1252317822.image.myqcloud.com/cover/251/39132251/s_39132251.jpg
个人·精神·生活,2019-01-31 00:00:00,心理-认知与行为,随着成长，我们的性格和对人生的看法都会愈加成熟。在这一过程中，如果能够得到前人的一些经验教训，我们可能就会少走弯路。在圣经故事中，就蕴藏了诸多前人的教训。本书精选了圣经故事在这一方面的教导，从这些古代经典对个人的劝勉出发，论述了我们在心智成长中应该注意的问题，以及提出相应的建议。,6,821,0,13.99,https://wfqqreader-1252317822.image.myqcloud.com/cover/211/25684211/s_25684211.jpg
炼金术之梦（荣格精选集）,2019-11-01 00:00:00,心理-认知与行为,在分析心理学理论中，荣格一直将梦境与幻象作为理解人类集体无意识的重要线索，认为梦是人类灵魂的无意识投射。《炼金术之梦》选自荣格全集的第十二卷，集中节选了荣格对梦所做的心理学实验。在本书中，荣格对一个受过良好科学教育的年轻人所提供的近四百个梦境与幻象进行了分析研究，并重点向读者介绍了其中与“曼荼罗”这一关键要素相关的部分。通过大量的实例证据以及丰富多样的插图，荣格向读者们展示了众多常见于梦中的炼金术意象，同时也揭示了他关于梦之解析的冰山一角。,13,759,0,29.99,https://wfqqreader-1252317822.image.myqcloud.com/cover/492/27403492/s_27403492.jpg
梦的解析：全译本,2018-04-01 00:00:00,心理-认知与行为,在这本极具独创性的著作中，弗洛伊德主要分析了梦的压缩、移置、表现手段和继发性整合，解析了梦的材料和来源，得出“梦是遂愿”这一结论，提出了“潜意识”“自我”“本我”“超我”“俄狄浦斯情结”“原欲”等概念。《梦的解析》第一次告诉曾经无知和充满疑惑的人们：梦是一个人与自己内心的真实对话，是自己向自己学习的过程，是另外一次与自己息息相关的人生。在隐秘的梦境所看见、所感觉到的一切，呼吸、眼泪、痛苦以及欢乐，都并不是没有意义的。它从一个其他人从没探索过的领域对人们的心理、梦境进行了分析，并形成了一个相对完备的系统。书中包含许多对文学、教育等领域有启示性的观点，并引导了整个20世纪的人类文明。,12,784,0,13.99,https://wfqqreader-1252317822.image.myqcloud.com/cover/884/26187884/s_26187884.jpg
极简个性心理学：破解人格基因,2017-02-15 00:00:00,心理-认知与行为,诺贝尔生理学或医学奖获得者埃里克·坎德尔，美国精神病学会主席约翰·奥德汉姆，哈佛大学神经生物学教授史蒂文·海曼联袂推荐。深入浅出的识人科学体系，发现人内心深处最真实的一面，在人群中找到更适合自己的存在方式与相处方式。在大千世界中，我们会遇见形形色色的人，每个人都具有鲜明的个性特征、复杂的一面和独特性，能否充分了解他人的人格和个性非常重要。正确地运用认识他人的工具可以帮助我们快速而准确地发现自我、理解他人，让我们在人际交往中游刃有余。缺乏人格识别技能可能会：导致我们选错伴侣，入错行，或者误导我们的孩子；导致我们误解他人，产生不恰当的防御、抱怨或攻击行为；妨碍我们建立良好的人际关系；妨碍我们得体地避免冲突或制订反击计划，从而损害自己的利益。作者基于自己对心理学和精神病学几十年的研究，将思考人格的四种方式结合起来，提炼出快速、简单的识人工具，帮助你：为每个丰富且复杂的独特个体描绘出人格的清晰写照；完善对人的直觉，认识人的本来面目；解析塑造所有人格特征的两大因素——我们与生俱有的基因和成长的环境；认识人在性格上的优点与缺点，了解人为何会有种种表现；更明智地选择应该接近什么人、回避什么人。,16,667,0,27,https://wfqqreader-1252317822.image.myqcloud.com/cover/577/29636577/s_29636577.jpg
