title,publishTime,category,intro,maxFreeChapter,newRating,free,price,cover
梦的解析,2019-09-01 00:00:00,心理-认知与行为,本书是弗洛伊德的成名代表作，被认为是本世纪富创见的、伟大的著作之一，是了解精神分析学说和潜意识理论的必读书，读者可以从中发现很多令人兴奋的观察和大量与我们主题有关的饶有兴趣的材料。《梦的解析》已被视为精神分析学说的重要组成部分和三大理论支柱之一。美国前全国图书馆协会主席唐斯博士将这本书列入“改变世界历史面貌”的十六部巨著之一。,7,0,0,15.92,https://wfqqreader-1252317822.image.myqcloud.com/cover/460/38381460/s_38381460.jpg
人性能达到的境界,2010-02-01 00:00:00,心理-认知与行为,人是一个统一的、有组织的整体，人的绝大多数欲望和冲动都是互相关联的，驱使人类的是若干始终不变的、遗传的、本能的需要，它们是人类天性中真正的内在本质，文化不能扼杀它们，只能抑制它们。因此，人们的行为受生命需要的支配，这是生命和生存的本能需要，只有满足了这种需要，才有人的生命和人的生存。,3,0,0,1.99,https://wfqqreader-1252317822.image.myqcloud.com/cover/479/740479/s_740479.jpg
正能量心理学,2013-05-01 00:00:00,心理-认知与行为,"    本书从认知的改变、情绪的控制、意志的打造、思维的转换、自我的探索、事业的拼搏、拒绝负能量等十个方面，对如何培养正能量进行详细的阐释，使读者积蓄正能量，向积极生活进发。
",3,0,0,9.99,https://wfqqreader-1252317822.image.myqcloud.com/cover/778/640778/s_640778.jpg
一流疯狂：精英的人格都是重口味,2015-10-01 00:00:00,心理-认知与行为,"    国内首部心理学图书，全面解析精英不为人知的重口味性格。本书以名人实例的形式，介绍成功与精神困惑、人生困境的关系。我们所熟悉的成功特质：领导才能、创造力、独立的意志、清晰的奋斗目标、共情、冷静、偶像气质、自我潜能激发等，在这些名人身上竟然都与精神障碍和人生困境密不可分，这就是他们成功的秘密所在。如果你有书中提到的精神困惑，恭喜你，你离成功只差一步！如果你正在经历困境，坚持住，将来的你一定会感谢现在的决定。
",18,643,0,16,https://wfqqreader-1252317822.image.myqcloud.com/cover/997/738997/s_738997.jpg
梦的解析,2020-09-01 00:00:00,心理-认知与行为,《梦的解析》系统总结了弗洛伊德之前和同时代学者对于心理问题的各种研究，不仅局限于梦的研究，还有各种精神问题的研究，并开创性地提出了对人意识形成过程的系统研究，是了解心理学必读的一本书。,15,0,0,27.2,https://wfqqreader-1252317822.image.myqcloud.com/cover/113/38382113/s_38382113.jpg
网络平台治理与法律责任,2018-08-01 00:00:00,心理-认知与行为,本书主体部分共分为十章，第一章系从多视角对网络平台的基础理论进行阐述。第二章至第七章系对网络平台法律责任的国别研究。我们选取了美国法、德国法、英国法、日本法和韩国法作为研究对象。我们将网络平台的法律责任区分为三大类，即网络平台的民事责任、网络监管与行政责任，以及网络平台刑事责任。第八章对我国网络平台法律责任的现状进行了描述、分析和评论，第九章则就如何完善我国网络平台法律责任制度提出了一些建议。第十章是关于网络平台治理机制的论述，包括网络平台治理的含义、原则与规则体系。本书所做的研究与探讨，旨在探索各国网络法律制度在发展中形成的规律，从而为完善我国相关法律制度提供借鉴经验。,14,0,0,59.99,https://wfqqreader-1252317822.image.myqcloud.com/cover/307/26541307/s_26541307.jpg
重口味心理学（第一季）：错乱的精神轨迹,2018-08-01 00:00:00,心理-认知与行为,恋物癖、强迫症、抑郁症、自虐症……这些名词听起来离我们很遥远，但是类似的心理体验你可能遇到过。那么这些“不正常”行为的背后到底有怎样的心理机制，又有怎样的具体表现呢?本书运用通俗易懂的文字，结合丰富案例，从心理学的角度为你分析以上“不正常”行为的发生原因和表现形式，旨在帮助你认识它们，理解它们。,6,0,0,14.99,https://wfqqreader-1252317822.image.myqcloud.com/cover/309/26541309/s_26541309.jpg
超脑认知论：心灵的新哲学,2018-06-01 00:00:00,心理-认知与行为,认知科学诞生于20世纪50年代中期。经过尔后三十多年的发展，建立了以计算理论为基础的研究范式。迄今为止，这一范式仍然被认知科学界看作是认知研究的标准范式或主流范式，并在认知科学研究领域里占统治地位。然而，自计算认知论于20世纪80年代成熟之时起，就开始遇到新思潮的挑战。这些新思潮及其所带来的新思维、新概念、新范式、新方法，经过十几年的成长在本世纪初开始突破计算认知论的各种局限性，形成了重返人脑，重返人体，重返行为，重返环境，重返整体思维等学术潮流。其中每一个新潮流，都在挑战计算认知论的基本假设。为讨论方便，暂且将这些理论统称为“超脑认知论”。本书系统地探讨了与超脑认知论相关的重点问题。,8,0,0,39.99,https://wfqqreader-1252317822.image.myqcloud.com/cover/356/25060356/s_25060356.jpg
人人都能戒掉拖延症：战胜拖延症的行动指南,2018-03-01 00:00:00,心理-认知与行为,拖延症严格意义上来说不算是病，但是它却比很多急性病都容易要人命。为了让饱受拖延之害的拖延症患者能够彻底治愈，拥有高效型的生活和工作方式，作者潜心研究了独特的“APP疗法”。将拖延症与APP结合，你只需要一部手机，一个APP，就能彻底战胜拖延症！本书主要内容包括：拖延症这东西你真的了解吗？拖延症把你折磨得不轻吧，完美主义者的挽歌，对失败的恐惧，懒是你不愿行动的原因，改变习惯才能被治愈，重压之下效率低下如何解决？不懂目标管理你就快不起来，学会整理工作告别低效能，拖延症患者最渴望的时间管理魔法。,14,0,0,22.4,https://wfqqreader-1252317822.image.myqcloud.com/cover/686/26832686/s_26832686.jpg
别笑，我是色彩心理学,2015-01-01 00:00:00,心理-认知与行为,"    你知道性格与色彩有什么秘密吗？翻看《别笑，我是色彩心理学》，你将学会如何发现自己的天然力量，并不加压抑地充分展现出来，同时还可学会了解自己的局限，并知道它们是如何成为你个人发展的拦路虎；你将通过对每种性格内心的剖析，看到别人如何思考和行事，真正理解你与他人的差别；你将能够检查自己理解他人的方法是否正确，以便拥有你希望的健康的人际关系。最重要的是，你将知道自己是谁！
",6,0,0,3,https://wfqqreader-1252317822.image.myqcloud.com/cover/346/822346/s_822346.jpg
我们时代的神经症人格,2019-01-30 00:00:00,心理-认知与行为,本书采取项目式教学，共包含汽车故障诊断与检测基础知识、电控汽油发动机故障诊断与检测、汽车底盘故障诊断与检测、汽车电器典型故障诊断与检测四个学习单元。旨在培养学生专业知识和职业素质综合能力的同时，更加注重实践动手能力的培养。全书体系严密完整，资料翔实，涵盖面较广，语言平实流畅，侧重实践应用特别是汽车故障诊断与检测技术的实际操作能力，以便于学生顶岗实习和毕业后的工作岗位零距离对接。本书可作为高职院校相关专业的教材，也可作为有关工程技术人员自学使用。本书可作为高等学校相关专业的教学用书，也可供有关工程技术人员参考。,5,0,0,12.99,https://wfqqreader-1252317822.image.myqcloud.com/cover/190/32856190/s_32856190.jpg
完美沟通： 九型人格心灵洞悉法则,2016-10-01 00:00:00,心理-认知与行为,"    沟通不畅，在与他人相处时必然遇到障碍，应用“九型人格”沟通术，能够破除不必要的人际矛盾。洞察别人的内心世界，说来有如巫术般神秘，但基于九型人格学说的研究，分解透析他人的言行举止，越过表面的表现和伪装，他人的性情和思维就不再难解：“本我”是如何形成的？外在的性格表现是如何掩盖“本我”的？性格造就的言行特点有哪些？通过本书，我们可以了解性格的分类，更可以知道不同类型人的性格优势、变化和极限，使自己在与他人沟通时，减低彼此的误会和困扰，处理起人际关系来轻松自在，游刃有余。
",2,0,0,10.99,https://wfqqreader-1252317822.image.myqcloud.com/cover/244/26934244/s_26934244.jpg
好色：解析性格、时尚改造、疗愈身心,2021-09-01 00:00:00,心理-认知与行为,你知道吗？黄色、浅绿色车不易出车祸，不单单是因为明度高？掌控好“墙壁”的色调，居然能帮公司省下一笔冷气费？法国国旗中的“蓝”、“白”、“红”，比例其实是不一致的？色相、彩度、明度，一起构筑生活的种种色彩，食物、妆容、衣饰、建筑……哪一个没有颜色？，颜色影响个性？颜色影响健康？颜色还能改变未来？，每天与五颜六色打交道，怎么可以不懂“色彩心理学”！,89,0,0,18,https://wfqqreader-1252317822.image.myqcloud.com/cover/727/44629727/s_44629727.jpg
生活中的性格心理学系列（套装3册）,2019-12-01 00:00:00,心理-认知与行为,这是一份针对内向型高敏感者的幸福生活指南。你的性格类型塑造了你，但没有锁定你！本书作者西尔维亚·洛肯博士也是一个安静的内向者，说话总是细声细语，但她却凭借自己的努力成为知名的性格咨询师，登上《明镜周刊》封面故事，还荣获了德国2012年度最佳演说者的殊荣。洛肯博士发现，由于内向者的优势通常表现得低调安静，所以常常被忽略，其实它们可以在沟通中发挥巨大的影响力。“无论在交流中还是共同生活中，最重要的是要认清自己和他人的需求，之后尊重这些需求。”对于善于倾听、分析性思考、共情的内向者而言，天生就具有一种特殊的社交能力，会自然而然地去关注周遭的人们以及这些人的需求。,14,0,0,79.99,https://wfqqreader-1252317822.image.myqcloud.com/cover/349/27114349/s_27114349.jpg
《欧亚译丛》第三辑,2017-11-01 00:00:00,心理-认知与行为,本书是专门译介国外欧亚内陆史研究成果的学术刊物，目的是通过精通各类外语的专业译者的努力，为相关学者提供国际学术界在该领域所发表的重要文献和成果。,15,0,0,44,https://wfqqreader-1252317822.image.myqcloud.com/cover/630/33889630/s_33889630.jpg
怪癖心理学,2019-01-01 00:00:00,心理-认知与行为,本书是从心理学角度，全面揭示怪癖心理和怪异行为的故事集。全书共收集数十个真实典型的案例，包括抑郁症、躁郁症、妄想症、焦虑症，异装癖、受虐癖、恋物癖，偏执型人格、反社会型人格，有网瘾、酒瘾、烟瘾、股瘾……这些怪癖都是内心欲望的投射。本书详细生动地揭示了各种怪癖的真相，还介绍了许多有效的行为矫正和治愈方法，以帮助患者勇敢地正视这些怪癖，进行正确的心理疏导，从而走出心理阴霾，获得健康、美好的幸福人生！,4,0,0,12.9,https://wfqqreader-1252317822.image.myqcloud.com/cover/464/37683464/s_37683464.jpg
虐待心理学,2021-04-08 00:00:00,心理-认知与行为,本书将从全新的角度解读当下最重要的心理和生理课题：虐待。,5,0,0,12.99,https://wfqqreader-1252317822.image.myqcloud.com/cover/15/38334015/s_38334015.jpg
斯特林堡与凡·高,2021-01-28 00:00:00,心理-认知与行为,雅斯贝斯（KarlJaspers）德国是著名的精神病理学家、心理学家、哲学家，现代存在哲学创始人之一。他于1883年2月23日出生，1908年在海德堡大学获得医学博士学位，先后任海德堡大学心理学副教授，哲学教授，1948年迁居瑞士任巴塞尔大学哲学教授，1967年退还德国护照成为瑞士公民，1969年2月26日在巴塞尔去世。雅斯贝斯（KarlJaspers）出版于1922年的《斯特林堡与凡·高》一书既是一份匠心独具的精神病理学研究报告，又是一部探究艺术家生存气象的艺术家专论。作为雅斯贝斯在精神病理学－心理学时期出版的最后一部具有颇高学术价值的著作，它立足于精神分裂症艺术家的生存探源，通过对比分析斯特林堡（AugustStrindberg）、斯威登堡（EmanuelSwedenborg）与荷尔德林（H·lderlin）、凡·高（VanGogh）的病志与艺术家的世界观及其作品的风格变化，为破解精神分裂症艺术家的天才之谜提供了一种独具人文智慧的阐释视角，从中可以明显地看出雅斯贝斯由精神病理学－心理学领域向生存哲学领域过渡的消息。,13,0,0,34.5,https://wfqqreader-1252317822.image.myqcloud.com/cover/358/40667358/s_40667358.jpg
让你目瞪口呆的怪诞心理学,2015-03-01 00:00:00,心理-认知与行为,"    这里有生活中最常见却最不正常的心理问题；这里有围绕身边最多见却最荒诞的行为怪癖；这里揭秘不被人注意却普遍存在的人性的优点和弱点；这里介绍了千奇百怪、形形色色的各种心理学趣味现象与常识；这里为你指出了健康身心、平衡心态的多种实用简单的心理调适方法——《去梯言—让你目瞪口呆的怪诞心理学》基于人们对心理健康的需要，以生动贴切、具有代表性的心理故事，加以科学条理性的分析，讲述了各种生活和工作中最常见的异常心理、怪诞行为现象、神秘莫测的心理学常识等。这些心理学知识都是从我们生活出发，从自身出发，日常生活息息相关的各种心理及随之产生的种种行为看似荒诞神奇，却有着深刻的形成根源。
",3,720,0,1.99,https://wfqqreader-1252317822.image.myqcloud.com/cover/589/634589/s_634589.jpg
爱情魔法：九型人格解析幸福密码,2016-10-01 00:00:00,心理-认知与行为,"    适合自己的伴侣是谁？有没有爱上不该爱的人？这段感情能否长久？该如何提高稳定指数？通过本书了解自己和爱人的九型人格类型，就能将自己从恋爱中迷茫不安的状态里解脱出来，在两人世界中避开性格缺陷，减少摩擦，并发挥性格长处，培养默契。在感性的爱情生活中，找到理性的源泉，让爱情的种子长出美丽的花朵，结出美满的果实。
",4,0,0,11.99,https://wfqqreader-1252317822.image.myqcloud.com/cover/248/26934248/s_26934248.jpg
梦的解析,2018-03-01 00:00:00,心理-认知与行为,"《梦的解析》告诉无知和充满疑惑的人们:梦是一个人与自己内心的真实对话,是向自己学习的过程,是另外一次与自己息息相关的人生。在隐秘的梦境中所看见、所感觉到的一切,呼吸、眼泪、痛苦、死亡以及欢乐,都并不是没有意义的。该书不但为人类潜意思的学说奠定了稳固的基础,而且也建立了人类认识自己的新的里程碑,是了解精神分析学说和潜意识理论的必读书。",9,0,0,15.99,https://wfqqreader-1252317822.image.myqcloud.com/cover/595/26125595/s_26125595.jpg
隐形天赋：如何将差异变成绝对优势,2020-09-01 00:00:00,心理-认知与行为,所谓隐形天赋，就是你自身具备的某种特质，无关好与坏，有用或无用，只是你专享的，与他人不一样的地方，但它能促使你在某个领域深耕细作，成为稀缺人才。它让你具备了潜能和思维天赋，也带来了阻碍和伤害；外界对你充满期待，也心存质疑，面对巨大的落差，你宁可假装平庸也不想表现特殊。天赋怎样才不会被辜负？适宜的环境固然重要，但具备隐形天赋的你很需要的是不断地自我审视，充分体验自身的特质，借助思维工具突破进阶瓶颈，通过练习和训练建立情绪缓冲地带，把握外界赋予的机会，激发创造力，将天赋转化为成功、幸福。,14,591,0,16.9,https://wfqqreader-1252317822.image.myqcloud.com/cover/134/34740134/s_34740134.jpg
依恋效应：为什么我们总在关系中受挫,2021-11-01 00:00:00,心理-认知与行为,你是哪种依恋风格？安全型、焦虑型，还是回避型、混乱型？ 11则真实故事分享，10项依恋功课，36道依恋风格测试，带你从根源上改变生活中糟糕的关系  华中师范大学心理学教授、博导周宗奎 同济大学附属东方医院临床心理科主任医师 孟馥   倾情推荐 作家、知名媒体人 侯虹斌 依恋理论最早起源于婴儿和母亲之间的关系，亲子之间的互动方式直接影响孩子的依恋风格。如果母亲能够及时回应婴儿的需求，婴儿就会感到被爱，感受到安全感；反之，婴儿的安全感就得不到满足，就无法确认自己是否值得被爱。 成年之后，我们的依恋对象变成了爱人、朋友、孩子甚至工作，当我们与它们建立关系时，我们内心深处根植的依恋风格就会被再次激活，从而影响我们与它们的关系，用鲍尔比的话说，这种影响“从摇篮到坟墓”，会贯穿每个人的一生。 成人的依恋风格分为以下四种： 安全型依恋：愿意信任他人；具有较高的独立性；能够自信、坦率地向伴侣表达自己的爱意。 焦虑型依恋：需要经常得到伴侣的肯定；极度渴望亲密关系；有时会令伴侣感到无所适从。 回避型依恋：冷淡疏离；对情感上的亲密感到恐惧；在感到受伤或被他人拒绝时会主动撤退。 混乱型依恋：焦虑型和回避型依恋的综合，是最糟糕的依恋风格。有时渴望与伴侣亲近，有时又显得很冷酷。,5,0,0,41.4,https://weread-1258476243.file.myqcloud.com/weread/cover/64/3300024464/s_3300024464.jpg
意念的治愈力,2016-01-01 00:00:00,心理-认知与行为,作为美国著名的神经医学专家和作家，詹姆斯·约瑟夫·沃尔什认为，当下教育体系最大的一个弊端是将过多的时间与精力投入到训练大脑记忆与智力的层面上，而对意志的训练几乎没有任何关注，这使得许多人的意念能量根本没有得到充分的释放与发展。而事实上，对意念的训练极为重要，甚至超过积累知识的重要性。由于兼有作家与科学家的双重背景，沃尔什通过大量科学事实和生动的文笔，深入浅出地为读者分析了如何锻炼意念的力量，从而帮助人们完善人格、远离疾病，拥有健康的生活。,6,0,0,18,https://wfqqreader-1252317822.image.myqcloud.com/cover/349/26243349/s_26243349.jpg
精神病的隐秘世界,2021-06-01 00:00:00,心理-认知与行为,"　　我们总想窥探精神世界的光怪陆离：叫不醒的装睡之人，世界被替代的幻觉妄想，病情好转的自杀者……这些只有精神病医生知道的秘密让我们望而却步，却又充满好奇。
　　身与心真的可以彼此分离吗？精神病真的都是荒诞离奇、毫无缘由的吗？作者从精神病医生的角度出发，为我们讲述了七个不同的案例，试图将看不见、摸不着的精神病还原到大脑之上，沿着生物学、心理学和社会学的线索寻找合理的解释。幸运的是，神经科学的发展为我们提供了强有力的工具，配合以药物和特殊疗法，再棘手的精神病也有被治愈的可能。每个人的精神世界都会发生或大或小的扭曲，面对这些隐秘的角落，我们必须学会如何科学应对，才能抵御未知风险。",5,0,0,9.9,https://weread-1258476243.file.myqcloud.com/weread/cover/72/3300008872/s_3300008872.jpg
正思维心理学,2015-04-01 00:00:00,心理-认知与行为,"    本书实践正能量思维导图，是一本通俗的心理能量书，没有高深的理论，只有易懂的思想，通过对心态、行动、交际处事三大方面的正思维引导，告诉你快乐的秘诀，开启成功的大门，从而让你拥有积极向上、幸福完满的人生。
",4,654,0,4.79,https://wfqqreader-1252317822.image.myqcloud.com/cover/591/778591/s_778591.jpg
大忙人的趣味心理学,2014-12-01 00:00:00,心理-认知与行为,本套书精选了读者受众面最广的四门学科——心理学、经济学、管理学和博弈论，旨在通过简单有趣的方式，让读者在最快时间学习到有用的知识。本书是一本内容丰富的心理学通俗读物，涵盖社交心理、销售心理、职场心理、心理调控等多方面内容，能让读者通过阅读和实践，掌握心理学的原理和行为学知识，能够更好的解读人们行为背后的心理动机，让自己的工作和生活变得更顺畅。,13,0,0,11.94,https://wfqqreader-1252317822.image.myqcloud.com/cover/39/688039/s_688039.jpg
应对冲突的第三种思维,2021-05-01 00:00:00,心理-认知与行为,我们现在对大脑的工作原理有了足够的了解，能够设计出更合适的思维系统。特别是我们现在知道大脑的感知部分是一个自组织的信息处理系统，它与我们通常所知的“被动”的信息处理系统有很大的不同。由于以前缺乏这种了解，我们一直未能在这个重要的感知系统上着力，而只能聚焦在下游的逻辑（或数学）系统。由于逻辑（或数学）系统的运作是被感知系统限制的，所以我们的思维一直被局限。,7,0,0,30,https://wfqqreader-1252317822.image.myqcloud.com/cover/87/38507087/s_38507087.jpg
错误记忆,2019-10-01 00:00:00,心理-认知与行为,本书聚焦错误记忆这一当前记忆心理学的重要领域，系统地介绍了错误记忆的含义和类型、研究历史、主要研究范式、影响因素、个体差异、认知机制与神经基础，以及错误记忆的主要应用领域——目击者证词，并对错误记忆与真实记忆之间的关系、错误记忆的适应性价值等进行了阐述，指出了该领域的未来研究方向。本书是对错误记忆研究的一次全面而系统的梳理，适合对记忆研究，特别是错误记忆研究感兴趣的读者深入了解该领域。,26,0,0,21.6,https://wfqqreader-1252317822.image.myqcloud.com/cover/117/27020117/s_27020117.jpg
转机,2019-12-01 00:00:00,心理-认知与行为,《转机》的作者萨拉•罗布•奥黑根曾入选《快公司》“全球商业最具创意人物”榜单，被《福布斯》评为“体育界最具影响力的女性之一”。不过，正如她自己所说，她并不完美，同样遇到过很多职业瓶颈和不顺，而且还曾两次被公司扫地出门！但是，她牢牢把握住了几个关键的职业转机，从管培生候补队员，跳槽到维珍航空、进入耐克、逐步成为佳得乐全球总裁……在《转机》中，萨拉还介绍了许多卓越人士成功的真实经历，并从实际出发，分享了把握职业转机、取得职场大突破的10条经验，同时针对每一条经验给出了行动指南，比如：如何发掘你的特质、如何抵御打破常规的风险、如何学会说不、如何练习想象领导力，等等。,14,667,0,80.91,https://wfqqreader-1252317822.image.myqcloud.com/cover/562/27339562/s_27339562.jpg
脸谱心理学：每个人都有一张属于自己的脸谱,2013-03-01 00:00:00,心理-认知与行为,《脸谱心理学：每个人都有一张属于自己的脸谱》脸谱艺术是中国传统艺术中的瑰宝。《脸谱心理学：每个人都有一张属于自己的脸谱》以年代为序介绍了175张秘传手绘脸谱。书中不但有美轮美奂的脸谱，还有每一张脸谱相对应的剧目及背后的故事。而且还结合脸谱进行了心理学分析和微表情解说，有脸谱背后的故事和人生，是传统脸谱艺术与现代心理学的完美融合。,6,0,0,2.99,https://wfqqreader-1252317822.image.myqcloud.com/cover/262/855262/s_855262.jpg
