title,publishTime,category,intro,maxFreeChapter,newRating,free,price,cover
认知觉醒：开启自我改变的原动力,2020-06-01 00:00:00,心理-认知与行为,为什么我们做事总是急于求成、避难趋易？所谓有耐心，就是要“咬牙坚持、死磕到底”？如何不再用“三分钟热情”和“打鸡血”的方式做事？如何保持极度专注？如何消除焦虑？如何提高学习能力？这是一部可以穿透时间的个人成长方法论。7大底层概念，20个成长关键词，助你彻底走出焦虑与迷茫，拥有清醒的认知、清楚的目标、清晰的路径、清爽的情绪。通过“大脑构造、潜意识、元认知”等思维规律，你将真正看清自己；通过“深度学习、关联、反馈”等事物规律，你将真正看清世界，提升自控力、专注力、学习力……只有洞悉底层的内在规律，我们才能真正开启自我改变的原动力。,7,911,0,26.99,https://wfqqreader-1252317822.image.myqcloud.com/cover/204/33628204/s_33628204.jpg
认知驱动：做成一件对他人很有用的事,2021-08-01 00:00:00,心理-认知与行为,做成一件有价值的事，成为一个有价值的人；成长的根本是做成事情、创造价值。做到，是更高等级的成长。一个人的成长也是通过主动做成一件对他人很有用的事来实现的。但在现实生活中，很多人虽然内心强烈希望变好，行动也非常努力，却始终无法做成事情，这背后的原因通常是缺少价值意识、输出意识、创造意识、作品意识、利他意识……《认知驱动：做成一件对他人很有用的事》将通过“做成一件事”的心法和技法两部分内容，和大家一起探索如何通过创造个人价值获取人生的成功、幸福和意义。从“习惯养成”到“技能培养”，从“对内输入”到“对外输出”，从成为“更好的人”到成为“更有价值的人”，这些刻意的转变会让我们走出焦虑的怪圈。单纯依靠意志力的努力往往是盲目的，所以人们会反反复复地起念，又反反复复地失败。一个人只有了解做成一件事的来龙去脉、看清事情本质后，才能走出反复尝试却劳而无功的困境。学会用认知来驱动自己，我们才能更好地到达成长的彼岸——做成一件对他人很有用的事，成为一个有价值的人。,7,896,0,35.8,https://wfqqreader-1252317822.image.myqcloud.com/cover/986/40649986/s_40649986.jpg
拆掉思维里的墙（白金升级版）,2021-11-01 00:00:00,心理-认知与行为,新一代人生设计师古典倾情打造“人生开窍手册”：心理学、职业规划、人生哲学。你是否缺少安全感？你会经常觉得累？结婚一定要买房吗？你认为坚持就一定会成功？你总忍不住与别人比较？只有有钱才能够幸福？老板可以掌控吗？小人物就无法对抗不公平吗？不喜欢现在的工作却又不知道自己该干什么？对现在的生活不满意，但却因为父母、老婆或者孩子不得不这样过下去？每天都在混日子，却幻想有一天找到自己真正喜欢的事业就一定会全心投入？如果有一个回答是“YES”，那么这本书就是你想要的。也许，连我们自己也不曾意识到，那些困惑背后，往往藏着一堵堵思维里的墙，阻碍着我们，把我们与美好的生活隔开了。拆掉思维里的那些墙，你就可以获得成功、快乐、自信和幸福。从“IMPOSSIBLE”到“I’MPOSSIBLE”，只须一点改变，你的人生也许就此大不相同。,10,783,0,41.3,https://wfqqreader-1252317822.image.myqcloud.com/cover/374/41439374/s_41439374.jpg
不要挑战人性,2021-09-01 00:00:00,心理-认知与行为,"心理学是一门科学。
无数心理学家做了很多精妙的心理学实验，在严格设定自变量、因变量、控制变量的条件下，设置情境，洞察人性。 
本书将带你还原20个经典心理学实验现场，剖析实验中的每一个细节，找到洞悉人性、震撼心灵的每一个瞬间，通过对人性的抽丝剥茧，来检视心理学实验中反映人性的逻辑内核，提取其中温润心灵的每一个元素，看见心灵，照见自我。 
心理学是探测人性的科学工具，也是“认识自己、了解自己”的实用工具。",16,870,0,46.99,https://weread-1258476243.file.myqcloud.com/weread/cover/22/3300018022/s_3300018022.jpg
自卑与超越（完整全译本）,2017-01-03 00:00:00,心理-认知与行为,《自卑与超越》是人类心理学先驱阿弗雷德·阿德勒的巅峰著作，作者从探寻人生的意义出发，启迪我们去理解真实的生命意义。全书立足于个体心理学观点，从教育、家庭、婚姻、伦理、社交等多个领域，以大量的实例为论述基础，阐明了人生道路的方向和人生意义的真谛。帮助人们正确面对缺陷，正确对待职业，正确理解社会，理解生活，理解性，具有极深的哲理性和巨大的学术价值。,20,757,0,5.99,https://wfqqreader-1252317822.image.myqcloud.com/cover/750/29963750/s_29963750.jpg
我们时代的神经症人格,2013-09-01 00:00:00,心理-认知与行为,本书系统阐述了霍妮文化神经症理论的基本主张，详细论证了文化因素与神经症形成之间的关系，提出以文化决定论取代弗洛伊德的生物决定论。霍妮认为：“深入探讨有效地导致神经症的各种动力，就会发现，存在着一种一切神经症所共有的基本因素，这就是焦虑……无论神经症的结构多么复杂，这种焦虑始终都是引发神经症过程，并维持其运转的动力。”本书是霍妮对正统精神分析的彻底批判和修正，标志着其思想的形成，也标志着精神分析社会文化学派开始形成。本书以语言平实、清晰明了著称，在简单易懂中蕴涵深刻意义，在出版之初就受到学界的好评和重视，之后多次再版、重印，成为心理学界的畅销书。本书的重点在于强调神经症患者实际存在的冲突和他为解决这些冲突所付出的努力，以及神经患者实际存在的焦虑和他为对抗这些焦虑所建立起来的防御系统。这种对真实处境的强调，并不意味着我放弃关于神经症的形成是来自童年的早期经验这一观念。,6,846,0,27,https://wfqqreader-1252317822.image.myqcloud.com/cover/930/26391930/s_26391930.jpg
为什么爱会伤人：亲密关系中的自恋型人格障碍,2022-02-01 00:00:00,心理-认知与行为,"◎ 作者在油管拥有超百万粉丝、TED演讲播放量破百万。曾深入诊疗威尔·史密斯夫妇及家族背后的自恋情结，缓解kendall jenner社交焦虑等心理问题！研究项目获美国国立卫生研究院10年资助。

★ 让无数读者恍然大悟，找到勇气告别过去的一本书。
★ 比PUA更隐蔽的，是亲密关系中的自恋型人格。 
 
 • 你总以为只要给予更多包容，TA就会改变……
 • TA总是能嗅到你内心最敏感脆弱的部分，让你觉得一切都是自己的错……
 • 当你决定离开，他总是痛彻心扉地挽回，然而时间一长却变本加厉……
 • 怎样才能从这种令人折磨的关系中解脱出来? 

★ 这本书可以让读者快刀斩乱麻，理清思绪，快速明白，自恋者是不会改变的！他们只会变本加厉！ 
★ 自恋由于一些原因被这个社会“合理化”，甚至“光环化”；自恋者本身也应该在“道德公知”越来越普遍的情况下，适当收敛克制，而不是像以往那样为所欲为。",4,779,0,35,https://weread-1258476243.file.myqcloud.com/weread/cover/93/3300010693/s_3300010693.jpg
快乐的陷阱：40个让你痛苦和停滞不前的行为模式,2019-11-01 00:00:00,心理-认知与行为,每年有几百本生活自助类书籍出版发行，它们或隐或现都有一个共同的目的：让你快乐起来。如何成功致富，使你快乐；如何成功减肥，使你快乐；如何摆脱抑郁，使你快乐；如何觅得佳偶，使你快乐；如何排便通畅，使你快乐……,8,719,0,25,https://wfqqreader-1252317822.image.myqcloud.com/cover/523/26924523/s_26924523.jpg
如何想到又做到,2018-10-01 00:00:00,心理-认知与行为,《如何想到又做到》这本书要解决的问题是，大多数人都能够制定出一些计划，或者是想到要去采取某种行为，但是却缺乏足够的动力或者是有效的力量，把它坚持下来。有一种人，睡前想好千条路，早上起来走老路；有一种人，尽管心态积极向上，行动却宛如废物；有一种人，做了不少的努力，人生依旧不给力。为什么有些人总是想到做不到？而一些人无论做什么都能成功？是意志力不足、是缺乏动力、还是诱惑太多？全都错了！《如何想到又做到》将颠覆你对过去所有行为的认知，给出了你另外的一个解决思路，那就是：要想解决行为问题，先要准确地把行为进行分类，然后用对应的心理武器去攻克它。通过3种行为分类、7大武器组合，告诉你无需意志力，就可达成目标并实现成功的极简方法。这是一本媲美《影响力》的行为改变科学力作，作者集结15年的研究经验讲行为科学和心理学全新成果一网打尽，帮你量身打造行动方案，当你使用这套方法的时候，持久改变行为的可能性要高出3倍。,11,720,0,11.67,https://wfqqreader-1252317822.image.myqcloud.com/cover/233/23691233/s_23691233.jpg
走出人格陷阱,2020-04-01 00:00:00,心理-认知与行为,“人都在追求卓越。”这句话，你赞同吗？特别是，你觉得自己在追求卓越吗？相信问这个问题时，多数人会觉得：嗯，是啊，应该是这样。但其实，无数人的人格有各种陷阱，这些陷阱约束着他们追求卓越和强大。无论外在的条件多么优秀，漫漫人生长路上，人格才是核心竞争力。本书以“心灵成长的六个定律”和“七个心理寓言”为理论基础，详细说明了“人格”在我们成长中的重要作用，愿这本书能帮助你认识人格的魅力与陷阱，从而不断完善你的人格。,10,801,0,19.92,https://wfqqreader-1252317822.image.myqcloud.com/cover/638/29998638/s_29998638.jpg
认知行为疗法入门,2020-05-01 00:00:00,心理-认知与行为,直线经理从来都是企业的中坚力量，除了具备业务管理能力外，还要做好本部门人员的选拔、培育、激励等几方面的工作，带领员工完成本部门的任务。本书用八章内容来教授非人力资源部门的直线经理如何树立正确的人力资源管理观以提升管理技能，以及如何运用选、育、用、留的人力资源关键管理方法和工具来提升员工的工作效率。通过学习这些内容，直线经理可以提升管理能力和部门的核心竞争力。本书适合企业各层级管理者以及人力资源研究者和爱好者等阅读。,12,891,0,29.9,https://wfqqreader-1252317822.image.myqcloud.com/cover/38/30654038/s_30654038.jpg
大脑的故事,2019-04-01 00:00:00,心理-认知与行为,人体是一个复杂而精美的杰作，而大脑是其中神秘的存在。我们通过它在世界上来往穿梭、做决策，放飞想象力。 我们的美梦、清醒时的人生，都源自它飞速运动的数十亿细胞。我们历经悲喜、绚丽多彩的完整人生，都发生在这区区 1.4 千克重的东西里。而如此重要的大脑，一直像一个难解的谜题，困住了无数顶尖的科学家，也被我们所忽视。在《大脑的故事》中，享誉全球的脑科学家，《西部世界》科学顾问大卫·伊格曼，用一篇篇引人入胜的故事，为你展现脑科学领域的前沿成果，带你领略大脑宇宙的奇妙之处。在《大脑的故事》中，这些问题都将得到解答，你会看到大脑如何塑造了我们，我们如何依靠大脑感知世界，如何做出一个个影响我们人生的决策，以及未来人类将走向何方。没有一本书，比《大脑的故事》更适合作为脑科学的入门读物了。阅读这本书，不需要你具备任何专业知识，只需要带着好奇心和自我探索的欲望就够了！,7,806,0,47.43,https://wfqqreader-1252317822.image.myqcloud.com/cover/845/25178845/s_25178845.jpg
我们时代的神经症人格,2018-11-01 00:00:00,心理-认知与行为,本书是卡伦·霍妮的代表作之一，也是她的成名作。全书以平实的语言、清晰明了阐述了霍妮文化神经症理论的基本主张，详细论证了文化因素与神经症形成之间的关系，着重分析了敌意、控制、嫉妒、依赖、逃避、自虐等一系列神经症表征以及神经症病人对爱、财富、权力等病态追求背后的文化基础和根本动力，强调了神经症病人在面对现实冲突时的反应，以及为化解冲突病人所承受的痛苦和为此付出的巨大代价。是霍妮对正统精神分析的彻底批判和修正，标志着其思想的形成，也标志着精神分析社会文化学派开始形成。,7,766,0,23,https://wfqqreader-1252317822.image.myqcloud.com/cover/665/23647665/s_23647665.jpg
九型人格心理学,2017-07-01 00:00:00,心理-认知与行为,九型人格心理学这门应用性心理学知识，不仅能让我们更好地认识自己，也有助于我们加深对身边其他人的了解。本书从应用的角度出发，介绍了如何识别各个类型的人以及其精神内核、职场角色、情感模式、发展层级、整合方向、解离方向等知识，并分享了与每一种人格类型的互动技巧，同时还分析了他们对其他人的看法。通过这本书，你能更好地了解自己的发展方向，并且更加熟悉周围人的思维与作风。,6,719,0,11.7,https://wfqqreader-1252317822.image.myqcloud.com/cover/957/906957/s_906957.jpg
从拖延到自律：超级自控力训练计划,2019-08-01 00:00:00,心理-认知与行为,关于拖延，你也许已经喝下一百碗鸡汤文字了，然而并没有什么用，因为你需要的并不是说教和念叨，甚至不是鼓励知提醒，而是确实的方法和行动。《从拖延到自律：超级自控力训练计划》从环境、目标、行动、时间、思维等几个方面为你提供了丰富且有针对性的解决策略和训练方案，帮助你养成自律，终结拖延。在任何时间段、翻开任意一个章节，轻快的文字都可以让你实现独立阅读，并有所收获，非常适合我们现在的碎片化阅读习惯。舒娅，国家二级心理咨询师，长期致力于自我提升、心灵成长方面的研究。她坚信，当一个人把问题从外部世界转向内心的时候，就是成长与蜕变的开始；用心理学的眼光检视自己和周围，就找到了“我为什么是我”“现在为什么是这样”的答案。,16,700,0,17.12,https://wfqqreader-1252317822.image.myqcloud.com/cover/790/32012790/s_32012790.jpg
九型人格·珍藏版,2017-01-01 00:00:00,心理-认知与行为,"这是一个有关性格类型的革命性系统，改变我们对自己和生活中其他人的根本看法。了解各国元首的行为特质，老板、客户、竞争对手，恋人、配偶、意中情人。慧眼洞察你身边人的真实想法。九型人格是一种深层次了解人的方法和学问，它按照人们的思维、情绪和行为，将人分为九种：完美主义者、给予者、实干者、悲情浪漫者、观察者。怀疑者、享乐主义者、调停者。我们每个人都是独一无二的个体。九型人格论所描述的九种人格类型,并没有好坏之别,只不过不同类型的人回应世界的方式具有可被辨识的根本差异。这个世界上五十亿人口中,每个类型大概占了五亿。虽然如此,我们每个人还是很独特的,而且九型人格论也容许我们如此。纵使我们的人格类型是可被辨识的,然而我们的人格——经验、记忆、梦、抱负,以及我们的处理方式——却是自己的。",22,796,0,25.84,https://wfqqreader-1252317822.image.myqcloud.com/cover/98/29750098/s_29750098.jpg
鹿智者的法则,2021-05-01 00:00:00,心理-认知与行为,经常在面对各种问题时钻牛角尖怎么办？——参见平衡法则。经常在做出选择后又觉得后悔怎么办？——参见选择法则。经常因为目标太过遥远而就此止步怎么办？——参见过程法则。经常因过去感到悔恨或为未来焦虑怎么办？——参见存在法则。总是对自己或身边的人感到不满意怎么办？——参见共情法则。总是用不同的状态面对自己和他人怎么办？——参见诚实法则。总是怀疑自己完不成任务怎么办？——参见期望法则。总是觉得更好的时机还没有到怎么办？——参见行动法则。……在本书中，知名个人成长导师丹·米尔曼，将他多年探索心智的至理心得熔炼成12个简明的心灵法则，并用寓言的形式和优美的文字将其呈现出来，在林中鹿智者的带领下，读者将开启一次启迪生活智慧、释放内在力量的旅程。鹿智者所讲述的每一个法则都与生命的价值和生活的质量息息相关，能为生命带来美好的改变，能让你学会如何改善自己的人际关系、职业发展、生活状态与身体健康。,7,776,0,47.18,https://wfqqreader-1252317822.image.myqcloud.com/cover/725/39888725/s_39888725.jpg
强者的逻辑：你没有变强，是因为你一直待在舒适区,2017-03-01 00:00:00,心理-认知与行为,能力出众就一定能成功吗？事实上，一个人有能力的人如果追求安逸，在舒适的状态中自我陶醉，他也会逐渐变成一个懒惰的弱者。现实中，大部分人都具有强者的潜质，却选择了像弱者一样把舒适作为人生的追求。通过《强者的逻辑：你没有变强，是因为你一直待在舒适》这本书，作者希望人们可以发现一个简单的事实：任何只要让你感觉“不适”的事情都关乎到一个你是否能成为强者的逻辑——你之所以没有变强，正是因为你选择了“舒适”，而不是战胜了“不适”。与此同时，你也会在《强者的逻辑：你没有变强，是因为你一直待在舒适》中看到，所有的“不适”都是可以训练的，经过针对性的训练，我们可以将一件令自己不适的事物变成一种“自然而然的习惯”。然后你就会像一个成功的强者那样考虑问题，处理问题，你不会再觉得这些痛苦是毁掉人生幸福的凶手，而是把它们视为创造幸福的必经之路。在经历这些事物时，当你由“不适”变得“舒适”，你就养成了良好的成功者的习惯。,4,651,0,9.99,https://wfqqreader-1252317822.image.myqcloud.com/cover/513/911513/s_911513.jpg
性格的陷阱：如何修补童年形成的性格缺陷,2019-05-01 00:00:00,心理-认知与行为,本书提出了其中 11 种长期的、自我伤害的人格模式，书中将其称为“性格陷阱”。这本书把非常复杂的原材料变得简单易懂。读者将非常容易理解性格陷阱的概念，并能快速地辨别出自己身上的性格陷阱。作者从其真实的临床经验中提取的丰富案例材料，也有助于读者联系自己的实际情况，认清性格陷阱。此外，作者在书中展现的技术，对于帮助人们实现改变具有异乎寻常的力量。他们使用多元整合的方法，既保留了认知疗法实操性强、以解决问题为导向的特点，也融入了行为疗法、精神分析和体验性疗法的技术。,31,805,0,30,https://wfqqreader-1252317822.image.myqcloud.com/cover/529/25397529/s_25397529.jpg
人格心理学（第二版）,2018-12-01 00:00:00,心理-认知与行为,本书在《人格心理学》第一版的基础上增补学科领域最新的研究进展和成果，阐述人格的定义及内涵、人格理论的发展历程和人格的应用研究。全书既注重人格理论的系统性和科学性，更注重人格领域在实际中的应用，尤其是人格领域与现实的广泛结合，进一步借鉴国内外优秀人格教材的特点和优点，力图做到人格理论及其实证研究有机结合。,12,839,0,16.99,https://wfqqreader-1252317822.image.myqcloud.com/cover/911/27017911/s_27017911.jpg
变态心理实录：资深心理咨询师24则心理疗愈手记,2018-10-01 00:00:00,心理-认知与行为,本书是知名心理咨询师刁庆红老师十余年心理咨询经验的结晶。书中大部分个案，都是由咨询次数达到几十次、甚至上百次的真实案例改编，力求真实还原个案的发病原因、诊断过程及预后效果。本书通过24则心理案例，讲述了24位患者的故事。同时，对精神分裂症、人格障碍、抑郁症、躁郁症、焦虑症、恐惧症、强迫症、社交障碍等精神疾病进行深度剖析，让读者对精神疾病有更加深入的了解。从而有效摆脱精神疾病困扰，拥有健康的心理和阳光的心态。,8,894,0,12.9,https://wfqqreader-1252317822.image.myqcloud.com/cover/428/37683428/s_37683428.jpg
变态心理学,2006-05-01 00:00:00,心理-认知与行为,《变态心理学》在介绍变态心理学的历史，关于异常心理现象的理论模型的基础上，重点介绍了各种心理障碍的临床表现和关于病因的生物、心理和社会文化因素的解释及治疗和干预。书中许我章节均列举了国内外的相关案例，并汇集了许多最新的研究资料，突出了心理学对异常心理现象的研究、治疗方面的贡献，有助于读者学习和了解什么是变态心理学的精髓所在。书中每章的总结、思考题、推荐读物和全书的参考文献，也是《变态心理学》的重要组成部分。《变态心理学》可作为高等院校的心理学、精神医学专业师生的教材和参考书，对其他专业的人员也具有参考价值。,78,802,0,29.73,https://wfqqreader-1252317822.image.myqcloud.com/cover/236/24273236/s_24273236.jpg
不再害羞,2018-12-01 00:00:00,心理-认知与行为,《不再害羞：如何提高你的社会适应力》是由当代著名心理学大师菲利普·津巴多所著的经典之作。本书在大量研究的基础上，剖析了害羞的表现、导致害羞的各种原因，并提供了大量克服害羞的练习，用认知行为疗法帮你走出害羞，提高社会适应力。害羞是一种遗传的特质，一种后天养成的性格，还是特定情境下的反应？害羞是自我的牢笼，还是自我保护的外壳？父母和老师的某些行为是否会加剧儿童的害羞？外向和害羞是否是一对矛盾体？害羞的人应该如何更好地维护亲密关系？所有害羞的奥秘，本书为你一一解答。,8,695,0,22.9,https://wfqqreader-1252317822.image.myqcloud.com/cover/805/25023805/s_25023805.jpg
认知行为疗法进阶,2020-05-01 00:00:00,心理-认知与行为,《认知行为疗法进阶》是对《认知行为疗法入门》内容的深入与升级，目的是增强读者对认知行为疗法的理论素养和实务工作能力。  《认知行为疗法进阶》内容侧重于心理咨询师的职业素养，一方面，为了教导读者从认知行为疗法的角度分析来访者的心理问题，而详细讲解了认知行为疗法心理咨询中的概念化、结构化、认知评估和干预策略；另一方面，强调实务操作，深入讲解了自动思维阶段、中间信念阶段和核心信念阶段会用到的各种认知行为疗法的技术应用。另外，能够恰当处理与来访者之间的矛盾和冲突是心理咨询师成长必须经历的，本书还安排了咨询设置和咨询关系方面的内容来讨论这些问题。  希望读完本书，能够帮各位心理咨询师、认知行为疗法的初学者和爱好者以及有自助需求的朋友掌握认知行为疗法技术，在工作与生活中应用。,11,913,0,44.5,https://wfqqreader-1252317822.image.myqcloud.com/cover/43/30944043/s_30944043.jpg
作家榜经典：人性的弱点,2018-09-01 00:00:00,心理-认知与行为,《人性的弱点：如何赢得友谊并影响他人》自1936年问世以来，风靡全球80年，销量突破9000万册，千千万万的读者从中受益，获得前所未有的成功！本书全面涵盖家庭生活、商务谈判、公司管理、社会交往、情感交流等方方面面立竿见影的沟通技巧，被誉为“人际与社交圣经”、“提升情商的必读经典”、“能引导你走向成功的书”。阅读本书，你将迅速掌握人际关系的3大基本技巧、让人喜欢你的6种方式、赢得他人赞同的12种方法、更好说服他人的9种诀窍、让你家庭生活幸福快乐的7个法则。,14,807,0,9.99,https://wfqqreader-1252317822.image.myqcloud.com/cover/64/25169064/s_25169064.jpg
