title,publishTime,category,intro,maxFreeChapter,newRating,free,price,cover
能力迁移,2019-05-01 00:00:00,心理-认知与行为,普利策奖得主作家乔治·安德斯经过三年跨行业、多维度的调研证明：拥有五种“批判性思维”的人相较之下能获得更多、更棒的机会，也能走得更长远。它们分别是探索、洞察、制定规则、说服和连接的能力，这也是跨行业间能力迁移的核心技能。本书的一个主要观点是：你所学的专业不能限制你选择职业的能力。招聘市场需要能力迁移的人才，这些人才可以为公司担当各种类型的角色。获得学位并不能保证毕业后能找到一份好的工作，然而，练就行业间可迁移的技能，则可以确保你通向成功的未来。本书分为“发现你的特长”、“寻找合适的机会”、“志同道合的盟友”、“工具箱”四个大部分，有对自己特长的清醒认知、对好的职业策略的分析探讨、对社会现状的理性判断、对具体求职策略的现身说法等。书中的一个重要结论是，人与人之间的接触从没像今天这么重要过，即便软件正在吞噬世界，人与人之间的连接会变得更加重要。要正视这个社会现实，并努力使自己成为适应未来的能力迁移的人才。,9,509,0,59,https://wfqqreader-1252317822.image.myqcloud.com/cover/487/25623487/s_25623487.jpg
大潜能,2019-06-01 00:00:00,心理-认知与行为,《大潜能》告诉我们，成功取决于你和他人合作的能力。就像幸福具有传染性一样，人类潜能的各个方面——表现、智力、创造力、领导力、能力和健康——都会受到周围人的影响。那些专注于自我的人，只能发挥有限的“小潜能”；而与他人共同成长的人，往往能获得新能量，激活“大潜能”。作为哈佛心理学导师、知名潜能挖掘专家，作者肖恩·埃科尔总是擅长把高深的理论转化为可操作的行动步骤。这本书结合了神经科学、心理学和人际交往领域的新研究，为处于瓶颈期的个人和企业提供了指引。,8,660,0,29.4,https://wfqqreader-1252317822.image.myqcloud.com/cover/62/25731062/s_25731062.jpg
内向一点，不好吗？,2022-03-01 00:00:00,心理-认知与行为,我们对内向的人总是有许多误解，觉得他们不擅长社交，不合群，甚至不会有太大成就。在这个外向型的社会里，内向的人总是很难得到别人的认可，更难认可自己。 作者帕特里克·金曾经也因为内向、肥胖遭到嘲笑，还因为想改变自己的性格饱受焦虑的煎熬。然而，现在的他已经与自己和解，并且成为一位卓有成效的社交教练，他将自己的教学经验总结成本书，希望更多社交恐惧症和高敏感型的人能够和内心的自卑、怯弱温暖相拥，活得健康精彩。 在这本书中，作者从了解内向者的定义开始，逐步发掘内向者的性格优势，针对日常工作生活、亲戚朋友聚会、假期派对等社交场合所总结出闪电战对话、二十问游戏、精力支出行程表、4∶1提问等多项干货技巧。帮助内向的你实现按需社交的社交升级，感受到内向性格的温柔与强大。,7,0,0,39.99,https://weread-1258476243.file.myqcloud.com/weread/cover/11/3300013611/s_3300013611.jpg
基因社会：哈佛大学人性本能10讲,2020-08-01 00:00:00,心理-认知与行为,你的基因如何控制你的身体和生活？40多年前，理查德·道金斯出版了《自私的基因》，提出：人生来自私，跟其他生物一样，不过是基因的生存工具。然而，人类仍不清楚这些自私的基因是如何协作以构建生物体的。《基因社会》以丰富的新的研究为基础，为理解基因如何为了生存而合作及竞争提供了一种解释。人为什么会得癌症？假如不同人种的基因差别很小，为什么还会有战争？人类的语言从何而来？以太·亚奈（Itai Yanai）和马丁·莱凯尔（Martin Lercher）属于系统生物学这一新领域内的领军人物，两人提出了一个具有说服力的新理论框架，帮助人们理解人类基因组的进化过程。与道金斯的经典隐喻所暗含的意思所不同的是，构建基因组的并非是只关心自身生死存亡的个体基因。我们的基因组是由类似人类社会的基因社会所构成的，和人类社会一样，基因社会的成员们也会彼此联合或敌对。《基因社会》揭示了基因在各个生物学尺度上——从个体细胞到整个物种——的合作和竞争中所使用的遗传策略。本书描述了基因组在癌细胞、尼安德特人、有性生殖、生命起源中的运作方式，并一直强调着一点：给予基因间相互作用足够的重视，我们才能真正理解生命的规律。,18,734,0,39.99,https://wfqqreader-1252317822.image.myqcloud.com/cover/742/908742/s_908742.jpg
性心理学（下册）,2018-03-01 00:00:00,心理-认知与行为,《性心理学》是霭理士的巨著《研究录》（七部）的“普及本”，是一本关于性心理的百科全书，内容涉及性的生物学基础、性冲动的性质、求爱的生物学、青年期的性冲动、性的教育、性的歧变、婚姻与性、生育问题、恋爱的艺术、性的升华等方方面面。,8,762,0,26.99,https://wfqqreader-1252317822.image.myqcloud.com/cover/202/22395202/s_22395202.jpg
你为什么还不开始？像心理学家一样思考,2022-01-01 00:00:00,心理-认知与行为,几千年来，人类如何思考、为何思考、在思考什么，这些问题一直悬而未决却又引发深思。心理学旨在解释和预测人的思想、情绪和行为，在理解人类心智的过程中起到了重要作用，使我们可以有效地理解自己和他人。你为什么还不开始？人会无聊死吗？做白日梦是在浪费时间吗？……27个好玩的心理学议题构成了这本有趣的指南，帮助我们理解人们如何学习、如何解读世界、如何与他人互动以及我们自己是什么样的人。,27,0,0,42.9,https://weread-1258476243.file.myqcloud.com/weread/cover/84/3300019284/s_3300019284.jpg
关键一句顶十句：62个困难场景一句话启发解决,2022-01-01 00:00:00,心理-认知与行为,"不会说话的人，这样说话：
很真诚，掏心窝地说，但TA依然戒备；
很努力，热情地说，可TA依然消沉；
自己没把握，大着胆子说，TA报以沉默。
如何打破对话的墙，赢得对方信赖，燃起TA的信心？答案是启发教练式沟通。
作者基于20年教练对话经验撰写本书，将教练对话技术引进日本。它重新定义了对话，对话不再是教学、命令、辩论、咨询和谈判，从此，在家庭中、职场中和商场中，对话者之间是平等的、有启发的和相互促进的，是啦啦队和好伙伴的关系。
本书针对7大类62个常见对话困难场景，给出关键一句话句型，让对话双方关系融洽、信心倍增。从头到尾完整阅读本书，可掌握教练沟通方法，获得他人喜欢和信任，开启工作和生活新局面；任选一节学习，看图说话，能立刻掌握一个针对困难场景的对话新技巧。",3,440,0,19.9,https://weread-1258476243.file.myqcloud.com/weread/cover/83/3300011383/s_3300011383.jpg
图解色彩心理学,2017-11-01 00:00:00,心理-认知与行为,本书将色彩心理学与人们的生活实际相结合，通过大量的实例，指导人们如何用色彩认识世界、改变生活。同时，每一节内容都附有生动的插图，使人们能够在轻松的阅读氛围下，掌握开启色彩心理学之门的钥匙。希望本书能引领读者进入色彩心理学的世界，让读者在享受趣味阅读的同时，了解色彩心理学的理论，解析色彩所透露的性格密码，从而更了解他人，也更了解自己；让读者熟知和掌握色彩在生活、爱情、职场、社交中的运用法则，进而拥有更广阔、更多彩多姿的世界。,76,0,0,15.99,https://wfqqreader-1252317822.image.myqcloud.com/cover/228/26188228/s_26188228.jpg
在难熬的岁月里，做内心强大的自己,2020-04-01 00:00:00,心理-认知与行为,无论是为了生存还是为了竞争，都需要人的内心坚定有力。面对种种物质的诱惑、权位的争夺，人心时常是惊恐难安的，极容易让人沉溺于心灵的苦海而难以脱身。此时应当停下来，好好找找内心的力量。本书以哲学理念为出发点，结合贴近现实生活的实例，用精练、睿智的笔触对强大内心的多种方式加以解读和诠释，指引读者更好地发掘内心的力量，从而在强大而坚韧的内心带领下，穿越成败沉浮，从容应对复杂多变的世界。,29,913,0,15.92,https://wfqqreader-1252317822.image.myqcloud.com/cover/949/38381949/s_38381949.jpg
那一定是心理问题：科学识别身体和心理发出的求救信号,2022-02-01 00:00:00,心理-认知与行为,"我们的社会环境、日常生活琐碎和各种突发事件都会给我们的内心造成压力和,而当这些压力得不到缓解的时候，我们的身体就会以生病的方式表示抗议:我扛不住了，需要支持!我太累了，需要休息!
  我们的身体和心灵从来都是一对紧密相联的灵魂伴侣，它们每时每刻都在互相影响，共同进退。请倾听它们的需求、用心照顾好这对伴侣，我们的身心才能和谐健康。
  本书由四大部分组成，第一部分探讨身体与心理密不可分的关系,第二部分讲述心理问题和躯体症状之间的联系，第三部分则进一步说明如果患上心身疾病，该如何自我缓解，最后一部分将告诉读者如何寻求医生的帮助。
  书中丰富的临床咨询案例和实用的治疗方法，能让读者直观地了解心身障碍的根源，也希望让读过此书的患者不再感到困扰，及时找到合适自己的诊疗方案。",7,0,0,31,https://weread-1258476243.file.myqcloud.com/weread/cover/82/3300019982/s_3300019982.jpg
极简自律法：越自律越幸运,2019-04-01 00:00:00,心理-认知与行为,你是否觉得成功人士天生有某种能力？你是否认为机遇和好运从不会降临在自己身上？你是否害怕失败并因失败而一蹶不振？你是否整天浑浑噩噩，像无头苍蝇一样到处乱撞？你是否不愿与他人打交道，尤其是在工作中？在《极简自律法：越自律越幸运》一书中，作者根据自己多年从事积极心理学研究和培训的经历，通过对英国商界、体育界、娱乐界等六位成功人士的采访，采用简单易读的写作风格，总结出了成功人士在学习态度、自我定位、人生目标、人际交往、把握机遇等方面所拥有的思维和行为方式，帮助读者养成积极思考和行动的好习惯，做到极简自律，从而拥有更健康的生活目标和更融洽的人际关系。《极简自律法：越自律越幸运》适合那些希望通过自律改变自己的事业和生活的读者阅读，尤其适合那些对积极心理学感兴趣的读者阅读。,13,0,0,29.9,https://wfqqreader-1252317822.image.myqcloud.com/cover/488/41151488/s_41151488.jpg
职场密码：四大名著中的人生智慧,2017-10-01 00:00:00,心理-认知与行为,中国有“少不读《西游》、老不读《三国》”的俗语，实际上这句话告诉我们作品之中暗藏机锋，智谋无穷。紧箍咒的实际作用是什么？刘备是真的要摔死自己的孩子吗？宋江如何当上梁山大哥的？王熙凤设相思局是因为狠毒吗？四大名著的字里行间都潜含着人生的真谛，如果仔细思考，定有醍醐灌顶、脑洞大开之感。本书通过对“四大名著”文本的详细解读，用严谨的学术态度和通俗的叙述语言，条分缕析文字背后的言外之意，提炼出职场生存的“密码”，带给读者全新的阅读体验与人生经验。,10,0,0,37.13,https://wfqqreader-1252317822.image.myqcloud.com/cover/71/22469071/s_22469071.jpg
自我营销：个人价值实现研习手册,2021-04-01 00:00:00,心理-认知与行为,本书共分5章内容进行讲解。第一章主要讲述了如何坚持自我提升，包括列梦想清单、快速行动、寻找方向、学习提升等；第二章讲述了掌握怎样的硬核思维，包括价值思维、逆向思维、杠杆思维、社交思维、商业思维等；第三章讲述了如何打造业内影响力、夯实功底等内容；第四章讲述了如何升级个人品牌，包括品牌塑造、品牌包装、品牌展示这些软实力的内容；第五章讲述了启动财富飞轮，从低成本创业到引爆盈利最后通往财务自由，让营销确实地体现其价值。五个章节环环相扣，引人入胜。,7,0,0,55,https://wfqqreader-1252317822.image.myqcloud.com/cover/371/40778371/s_40778371.jpg
色彩心理学：破译色彩与性格的秘密,2013-11-01 00:00:00,心理-认知与行为,"    心理学对性格的解释是一个人在对现实的稳定的态度和习惯了的行为方式中表现出来的人格特征，它表现一个人的品德，受人的价值观、人生观、世界观的影响。心理学家们曾经以各自的标准和原则，对性格类型进行了分类。但纵观各种分类，共同的特点是学术味浓厚，直观性不强，难以让广大非心理学专业人士理解和接受，而时下流行的将复杂抽象的性格用简洁明了的色彩加以阐述的方式，颇受大众喜爱。色彩心理学的学术论著也屡见报端媒体，而《色彩心理学破译色彩与性格的秘密》一书以希波克拉底的四液学说为依据，把中国传统的五行学说，以及京剧中不同脸谱的人物所演绎的性格色彩等联系起来，将抽象的性格与形象的色彩巧妙结合，令人耳目一新。
",11,0,0,5.99,https://wfqqreader-1252317822.image.myqcloud.com/cover/375/822375/s_822375.jpg
我，无与伦比,2021-06-01 00:00:00,心理-认知与行为,美丽、智慧、迷人、独立，书中的这些女性，她们职业身份不同，无论是女企业家、女运动员、女艺人，还是普通平凡岗位上奋斗的女性，她们都活出了自我风采，展现着不同的女性魅力。在书中，她们敞开心扉，让我们看到光鲜背后的疲惫、痛苦中的挣扎，以及努力后的破茧重生。在这个高速前进的社会，她们以岁月历练出的坚韧与独特气质，应对世间的纷纷扰扰。每个人都有自己的人生“高光”时刻，也都曾经历低谷。在跌宕起伏的人生中，书中的每一位女性都用智慧体悟和掌舵着自己的选择与未来，在这起起落落中绽放出无与伦比的美丽。她们有乘风破浪的底气，也有风平浪静的心境。,7,0,0,34.8,https://wfqqreader-1252317822.image.myqcloud.com/cover/805/40107805/s_40107805.jpg
心理疏导疗法解读,2017-05-01 00:00:00,心理-认知与行为,本书分上下两篇，上篇为理论篇，主要介绍疏导疗法的基础理论；下篇为应用篇，分别介绍了示范性集体疏导治疗及强迫症、恐怖症、适应障碍和抑郁性疾病、性功能障碍、性偏离障碍、精神障碍恢复期等的疏导治疗。本书适合临床心理工作者参考，也适合各类心理障碍者阅读。,16,0,0,29,https://wfqqreader-1252317822.image.myqcloud.com/cover/454/32915454/s_32915454.jpg
刻意选择：学会用左手吃饭,2019-01-01 00:00:00,心理-认知与行为,人生的十字路口，充满了看似微小、实则关键的选择，刻意选择决定人生成败。 你应该已经喝饱了心灵鸡汤，听够了成功故事，《刻意选择》一书像是一副降噪耳机，已经帮你屏蔽了那些看似正确却没有一点实用价值的建议。 这是一本轻松好读的励志书，旨在引导读者突破惯性思维，从刻意选择与众不同的行为开始改变工作、生活和社交。 畅销书作家罗希特·巴尔加瓦在书中提供了15条简单、实用、易操作的人生算法，助你成功突围人生困局。 那么，要怎么开始呢？ 当然，让我们先学会用左手吃饭！,10,481,0,29.4,https://wfqqreader-1252317822.image.myqcloud.com/cover/632/23784632/s_23784632.jpg
理解大脑：细胞、行为和认知,2020-08-01 00:00:00,心理-认知与行为,哈佛大学教授专为哈佛新生课程“神奇的大脑”而著，带你探索不足1.6千克的大脑的奥秘。浓缩了脑与心智的知识精华，展示了神经科学领域的本质和研究活力。本书前半部分描述了理解大脑所必备的基本知识，介绍了大脑的一般结构、脑细胞之间如何相互沟通以使我们体验世界。后半部分涉及更高层次的概念，如视觉、感知、语言、记忆、情感和意识。书中配有精美的插图，优雅地揭示了人脑这个成就了人类独特性的神秘器官。,11,0,0,47.6,https://weread-1258476243.file.myqcloud.com/weread/cover/88/3300018588/s_3300018588.jpg
做你想做的人，过自己想过的生活,2020-03-01 00:00:00,心理-认知与行为,没有经历过风霜雨雪的花朵，无论如何也结不出丰硕的果实。失败、挫折并不可怕，正是它们给了我们经验与教训，让我们超越自我，不断进步。只有历经折磨，才能够历练出成熟与美丽，锻炼我们的意志，增强我们的韧性，让我们得以成长，并取得成功。或许我们所期待的明天，看起来遥不可及，而我们当下的每一个小努力，似乎都不值一提。但执着的人，注定会在岁月的淘洗下，雕琢内核，茁壮筋骨，将生活磨砺出微光。,16,0,0,15.92,https://wfqqreader-1252317822.image.myqcloud.com/cover/901/38381901/s_38381901.jpg
把生活过成你想要的样子,2019-08-01 00:00:00,心理-认知与行为,这个世界上有多种生活，其中总有一种适合你。当你感到不如意的时候，不妨叩问内心：我真正想要的是什么？《把生活过成你想要的样子》给予那些迷茫的人以指引，在你追逐理想生活的路途中，希望这些温情励志的故事会给你诸多启示，让你敞开心扉，改变自己，然后把生活过成你想要的样子。,15,0,0,15.92,https://wfqqreader-1252317822.image.myqcloud.com/cover/814/38381814/s_38381814.jpg
在不如意的人生里改变自己,2019-07-01 00:00:00,心理-认知与行为,懦弱、软弱，这是我们实现成功人生的最大阻碍，因为它们让我们学会了接受命运的安排，学会了随波逐流地过一生，然而，这样的人生是遗憾的，而突破现状的唯一方法就是改变自己。《在不如意的人生里改变自己》从心理学的角度，帮助读者朋友们直面当下的自己，直面内心的弱点，找到改变自己的最佳方法，从而赢得自己真正想要的人生。其实，改变自己并没有你想象得那么难，当你真正付诸行动时，一切就顺其自然了。,21,0,0,15.92,https://wfqqreader-1252317822.image.myqcloud.com/cover/806/38381806/s_38381806.jpg
西点军校送给男孩的最好礼物,2018-05-01 00:00:00,心理-认知与行为,两百多年来，美国西点军校一直被称为“美国将军的摇篮”，是培养顶级军官的地方。随着时代的发展，西点军校并不仅仅着眼于军官的培养，而是对于学生有着全面的发展定位，尤其着力于对学生性格、纪律、毅力等方面的塑造，因此西点培养的不仅是一名军人，而且是美国社会未来的精英。在西点军校两百多年的辉煌历程中，培养了众多的美国军事人才，其中有3700人成为将军，更有两届美国总统、五位五星上将、数以千计的世界五百强历任董事长！ 是什么使西点取得如此骄人的成绩？是什么使西点毕业生成为成功者的代名词？西点军校的荣光与辉煌印证了其教学原则的成功。作为全世界最著名的培养男子汉的殿堂，西点军校的准则和学员的成才经历，是送给当今社会小伙子们的最好礼物和企业培训青年员工的经典教材。,14,606,0,9.99,https://wfqqreader-1252317822.image.myqcloud.com/cover/300/24146300/s_24146300.jpg
富足思维：突破你的惯性思维模式,2021-04-01 00:00:00,心理-认知与行为,很多人希望通过在日常生活中实践简单易行的习惯过上理想的生活，美国传奇商业教练迪安·格拉齐奥西的这本书就是写给他们的。在几十年的商战和创富历程中，作者培养和坚持了富足思维和成功习惯，形成了一种创造容易上手的成功秘诀的独特能力。他在这本书中分享了这些成功秘诀，并借助诸多成功人士的精彩案例和他自己的人生故事介绍了如何养成这种富足思维和成功习惯，从而助你达到你所渴望的财富。为此，他创办了www.thebetterlife.com网站，提供了一项为期30天的挑战项目和诸多练习表格，以此帮助人们每天对惯有的思维模式做一些微小的改变，在30天内走上一条通往他们向往的富足生活的道路。作者在书中谈到的富足思维和成功习惯主要包括：倾听；有愿景，通过7层深度思考练习明确自己的人生目标；清除自己内心的“反派”，忽视唱反调者的声音；用创造无限可能的故事替代了限制性想法；充分认识自己；打造吸引力和说服力，让你的财富升级；关注售后服务；发自内心的快乐（10个快乐习惯）；摆脱困境，应对挑战；将更多时间用在赚钱上，竭尽全力，高效做事（6个高效习惯）……,16,0,0,32.2,https://wfqqreader-1252317822.image.myqcloud.com/cover/34/38088034/s_38088034.jpg
我的人生本可以：一张逆转人生的魔力支票,2018-04-01 00:00:00,心理-认知与行为,本书引导读者认识到自我内心力量的重要意义和强大潜力，帮助读者学习如何积极表达自我、树立自信、正视自我、提升自我、挑战自我、选择自我和付出自我。在了解上述知识并完成相应训练之后，读者将会逐步建立真正强大的内心，获得独立、积极坚定的人格，以及更加美好的生活视角和践行轨迹。本书属于大众类心理读物，适合不同年龄段、不同社会角色的读者阅读。,10,0,0,16.8,https://wfqqreader-1252317822.image.myqcloud.com/cover/620/24981620/s_24981620.jpg
内向性格的竞争力（青少版）,2019-01-01 00:00:00,心理-认知与行为,课堂提问时不爱举手，小组讨论时常常一声不吭，派对上时刻想着马上离开，演讲时恨不得原地消失……这是一群安安静静的内向孩子：他们喜欢独处，不喜欢热闹；他们观察敏锐、思维缜密，但不喜欢在公共场合放大自己的表情和声音。他们很容易被忽略，是否需要努力变得外向，来适应这个强调竞争、高调与张扬的社会？ 其实他们安静的生活态度里，一直潜藏着一种“超能力”，关键是需要去“看见”它，并学会如何恰当使用它。这本指南通过大量真实成长案例探讨他们“安静”融入不同生活场景的表现——从学校生活到社会交往，从追寻兴趣爱好到与家人相处。每一章后提炼实用交际技巧，书后附有给父母和老师的建议，配合《纽约客》漫画家对“安静”日常的趣味演绎，切实指导内向孩子发掘自己与生俱来的优势，以安静的方式令人刮目相看！,7,808,0,29.88,https://wfqqreader-1252317822.image.myqcloud.com/cover/999/25122999/s_25122999.jpg
卡耐基写给女人的幸福秘籍（全集）,2011-10-01 00:00:00,心理-认知与行为,在这本书里卡耐基以卓越的智慧总结了女性为人处世应当具备的基本技巧、分析了女性提高个人魅力、活得快乐的秘密所在；精彩地讲解了女性收服自己钟情的男人的技巧。在《卡耐基写给女人的幸福秘籍（全集）》里他以广博的爱心指导无数女性尽快成熟、全面提升自身魅力、成就辉煌的事业、留住恒久的幸福婚姻，开创崭新的人生。,19,0,0,10.9,https://wfqqreader-1252317822.image.myqcloud.com/cover/502/25505502/s_25505502.jpg
色彩心理学,2011-09-01 00:00:00,心理-认知与行为,色彩是我们认识世界的重要途径。色彩与人的听觉、视觉、味觉、触觉等息息相关。蓝色的天空，纯白的云朵，翠绿的树木，火红的花朵……没有色彩，世界不会这么绚丽，生活不会如此多彩。,37,448,0,3.99,https://wfqqreader-1252317822.image.myqcloud.com/cover/602/127602/s_127602.jpg
