title,publishTime,category,intro,maxFreeChapter,newRating,free,price,cover
群体性孤独：为什么我们对科技期待更多，对彼此却不能更亲密？,2014-03-01 00:00:00,社会文化-社科,《群体性孤独》将电子文化的两大趋势在过去15年中的新变化、新发展进行了新的阐释，将焦点集中在年轻的“电子土著”身上，这一代人的成长伴随着手机和智能电子玩具。如今的我们既缺乏安全感、却又渴望亲密关系，因此才求助于科技，以寻找一种既可以让我们处于某种人际关系中、又可以自我保护的方法。作者认为在互联网时代，如果我们既要享受信息技术带来的便利，又要摆脱信息技术导致的孤独，就必须找到一个两全其美的好办法：一方面，我们要学会独处，体会独处带给人们的好处；另一方面，朋友、亲人要更多地坐在一起，面对面谈话、讨论。你是否也熟悉这样的场景：家人在一起，不是交心，而是各自看电脑和手机；朋友聚会，不是叙旧，而是拼命刷新微博、微信；课堂上，老师在讲，学生在网上聊天；会议中，别人在报告，听众在收发信息。所有这些现象都可以归结为“群体性孤独”——我们似乎在一起，但实际上活在自己的“气泡”中。我们期待他人少，期待技术多。不间断的联系，是否让人类陷入了更深的孤独？麻省理工学院社会学教授雪莉·特克尔为了研究人与机器人之间的互动，15年来深入两家养老院，对200多人进行了实地研究；为了研究人们的网上互动，与7家中学合作，收集了450名中学生的一手研究资料。她通过研究发现，信息技术在给人们带来沟通便利的同时，也使人与人之间的关系弱化，有些人甚至因此而丧失了面对面交流的能力。特克尔认为，人们发短信、发邮件，上社交网站，玩电子游戏，从形式上看人们之间的联系似乎更轻松、更密切，但实际上却更焦虑、更孤单。,11,451,0,19.99,https://wfqqreader-1252317822.image.myqcloud.com/cover/368/713368/s_713368.jpg
网络舆情监测与研判,2021-07-01 00:00:00,社会文化-社科,本书共6章，介绍了网络舆情的研究与发展、规律与管理，着重讲解舆情监测预警和数据分析、舆情报告写作、舆情研判和应对、重大突发事件网络舆情管理等理论知识与应用技巧。本书以理论阐述舆情爆发、发酵、平息等方面的原理，以经典案例讲解各项理论在实际工作中的应用场景，理论与实际相结合，增进舆情管理的学习深度。本书既可作为应用型本科、高等职业院校新闻学、传播学等专业的网络舆情课程教材，也可作为培训机构的参考书。,9,0,0,23.5,https://wfqqreader-1252317822.image.myqcloud.com/cover/371/39336371/s_39336371.jpg
1840年以来的中国,2020-12-01 00:00:00,社会文化-社科,"1840年以来的中国近代史，无疑最具争议也最受人关注。

军事的视角、政治的视角、文化视角、社会视角与观念视角的近代史叙述，我们都已不陌生。

这本《1840年以来的中国》，为我们呈现的，则是一幅与众不同的近代史图景：法学视角。",4,0,0,89.6,https://weread-1258476243.file.myqcloud.com/weread/cover/39/3300017639/s_3300017639.jpg
社会学的基本概念,2020-06-01 00:00:00,社会文化-社科,本书是一部对社会学概念作出清晰阐释的社会学入门读物，原出自马克斯·韦伯的《关于理解社会学的若干范畴》，后独立成书出版。在本书中韦伯详尽地表达了他对社会学研究的任务、目标、方法和概念工具所持有的观点，同时也将他的理论思考能力发挥得淋漓尽致，是我们理解和研究马克斯·韦伯的社会学，甚至也是理解和研究他的政治思想的重要基础。,7,862,0,18.99,https://wfqqreader-1252317822.image.myqcloud.com/cover/26/33615026/s_33615026.jpg
人类的善意,2022-04-01 00:00:00,社会文化-社科,在《人类的善意》中，鲁特格尔·布雷格曼告诉我们，大约有97%的人认为我们生活在B星球上，然而真正的事实是，几乎在所有的情况下，我们都生活在A星球上。如果说有一种信念将左派和右派、心理学家和哲学家、古代思想家和现代思想家团结在一起，那就是人性本恶这一心知肚明的假设。这个概念驱动着报纸头条，指引着塑造我们生活的法则。从马基雅维利到霍布斯，从弗洛伊德到平克，这种信仰的根源深深扎根于西方思想中。我们被教导说，人类天生自私，主要受私利支配。但如果这不是真的呢？布雷格曼为过去20万年的人类历史提供了新的视角，旨在证明我们天生良善，更倾向于合作而不是竞争，更倾向于信任而不是不信任。事实上，这种本能有着坚实的进化基础，可以追溯到智人的起源。从现实的蝇王到战争后的团结，从津巴多的监狱实验到曼德拉孪生兄弟的故事，布雷格曼向我们展示了相信人类慷慨与合作的现实，慷慨与合作对社会运作会产生巨大的影响。当我们把人想得更坏的时候，政治和经济似乎也会变得更坏。但如果我们相信人类的善良和利他主义的现实，它将成为实现社会真正变革的基础。,30,853,0,114.68,https://wfqqreader-1252317822.image.myqcloud.com/cover/353/43676353/s_43676353.jpg
有序：关于心智效率的认知科学,2018-04-01 00:00:00,社会文化-社科,如今，泛滥的信息已将我们淹没——我们经常找不到车钥匙、误了约会、筋疲力尽却混乱低效。过量的信息输入，造成我们庞大的精神损耗和负担，不断抢夺我们的注意力，让人产生认知功能障碍，频频做出错误决策。一个“有序”的大脑，才可以帮助你做时间管理、人际管理，在家庭生活和公司行为上做出正确、合理的决策。书中既有理论，又分析了大量和我们生活相关的实例，读来鞭辟入理，趣味横生。,7,659,0,40.8,https://wfqqreader-1252317822.image.myqcloud.com/cover/473/934473/s_934473.jpg
刑事辩护人（译文纪实）,2022-04-01 00:00:00,社会文化-社科,年轻女律师龟石伦子接手了大阪地区一起盗窃案，原本以为是走过场的工作，却从当事人口中了解到警方为了掌控犯罪情报，未申请搜查令就擅自在嫌疑人车辆安装GPS、进行手机监控等情况。龟石察觉到其中存在侵犯公民个人隐私的危险，为此她组建起一支年轻的辩护团队，针对警方的越权行为上诉，直至最高法院。最终日本最高法院于2017年裁决警方“没有搜查令采用GPS监控市民的行为是违法的”。这一案件也成为平成年代具有里程碑意义的判例。,14,885,0,31.99,https://weread-1258476243.file.myqcloud.com/weread/cover/24/3300020424/s_3300020424.jpg
帝国的技艺：统治不可统治之地,2021-11-01 00:00:00,社会文化-社科,"帝国，作为一种主要的人类政治构造，航行在民族主义时代的风暴中。帝国的掌舵者们，并没有温柔地走进那个良夜。有些船搁浅了，有些船则被时代大潮打成了碎片。他们所遭遇的困难，现在仍然困扰着一些多民族国家，对我们而言，观察这些水手的举动（即使是他们在礁石上撞得粉碎的时候），仍然是有益的。
《帝国的技艺》想要探讨的，正是这样一些问题：近代帝国是如何统治其多民族属民的？在统治的时候，遇到了哪些内在的困难？它们的应对之道是什么？",5,762,0,55.3,https://weread-1258476243.file.myqcloud.com/weread/cover/17/3300012017/s_3300012017.jpg
帝国的失败：为什么会有美国,2021-11-01 00:00:00,社会文化-社科,美国革命是一次奇怪的革命。它没有直接的压迫原因，其爆发的缘由是复杂却又理性的。为什么英国当时的执政者不能保住自己的国家？为什么各殖民地最终会选择独立？《帝国的失败》描写了美国独立战争前英美双方的政治斟酌，指出美国独立战争其实是英帝国的一次内战，而内战的结果是英帝国的分裂。《帝国的失败》通过对北美殖民地的治理结构、大英帝国在七年战争之后的帝国改革运动所造成的危机的分析，全方位向读者展示了美国革命的独特性。,3,897,0,48.3,https://rescdn.qqmail.com/weread/cover/957/3300003957/s_3300003957.jpg
病毒来袭,2014-04-01 00:00:00,社会文化-社科,本书从物种进化的角度整体观测人与病毒的关系，尤其是病毒在动物和人之间的传播，包括艾滋病的灵长类动物起源；审视当今社会经济全球化、人的生活方式和行为模式的变迁对新发再发传染病流行的影响。作者适时地提出公众对加强公共卫生能够做出贡献，每个人都可以从小做起。书中作者还指出媒体报道对公共卫生事件的重要影响。媒体报道可保障公众的知情权，也能告知公众采取必要的自我防护。,5,770,0,13.99,https://wfqqreader-1252317822.image.myqcloud.com/cover/359/713359/s_713359.jpg
蚂蚁社会：一段引人入胜的历史,2021-07-01 00:00:00,社会文化-社科,"“人像蚂蚁”这个古老的比喻，就像“比喻”本身一样古老。从作家到政治学家、社会学家，人们渴望从蚂蚁身上寻找人类社会的最佳组织形式；从单一的个体到整体的社会，从君主制到民主社会，从霍布斯的“利维坦”式全能国家到《美丽新世界》中的集权乌托邦，再到原子化、网络化的后现代社会，蚂蚁的行为在任何时候都能被象征性的解读，并与人类历史上出现过的各种社会形态形成巧妙的一一对应。作者从社会学专著、小说文本，乃至电影文本出发，探索了这一类比的迷人历史。
在本书中，蚂蚁，成为了人类社会的绝对隐喻。人不是“像”蚂蚁，人就是蚂蚁。",15,716,0,23.4,https://weread-1258476243.file.myqcloud.com/weread/cover/31/3300010431/s_3300010431.jpg
广场与高塔,2020-01-01 00:00:00,社会文化-社科,文明史的显著特征之一，是随着不同文化因子的 混合而发生互通互融，而不是冲突。 ——尼尔•弗格森 21世纪被称为网络时代，但事实上，网络早已存在。从印刷术的诞生到网络社群爆发，在《广场与高塔》这本书中，弗格森通贯古今，以新奇的视角，为我们重铸了一个个有形的和无形的网络。从神秘的共济会、辉煌的罗斯柴尔德家族、复杂的萨克森—科堡—哥达邦联、举世闻名的剑桥使徒网络，到现在互联网时代下的推特和脸书，作者以一个个引入入胜的故事，激发我们重新观察这些网络的运作及其建构的世界，重新看待我们习惯已久的世界观和它潜在的不同面貌。 在社会网络兴起、衰落、再崛起的历史中，作者用丰富的图表与数据为我们阐释了网络、聚类等不同概念，帮助我们重新审视旧权力与新社交网络之间的冲突与融合，并通过对比，为读者提供有关网络演变史的另类省思。,10,667,0,58.8,https://wfqqreader-1252317822.image.myqcloud.com/cover/559/27571559/s_27571559.jpg
史蒂芬·平克“语言与人性”五部曲,2020-10-01 00:00:00,社会文化-社科,史蒂芬·平克对当前世界进行了全景式的评述，让读者了解人类状况的真相，人类面临怎样的挑战，以及该如何应对这些挑战。他呼吁我们避开惊悚的头条新闻和灰暗的末日预言，相反，用数据说话：通过75幅震撼的图表，平克论证人类的寿命、健康、食物、和平、知识、幸福等都呈向上趋势，这种趋势不仅限于西方，而是遍及全世界。这是启蒙运动的礼物——理性、科学和人文主义促进了人类的进步。,11,821,0,331.55,https://wfqqreader-1252317822.image.myqcloud.com/cover/932/34539932/s_34539932.jpg
中国新闻奖精品赏析（三）,2018-03-01 00:00:00,社会文化-社科,《中国新闻奖精品赏析》（三）一书，收入了23—27届“中国新闻奖”获奖作品共40篇，“赏析”文章共50篇，写作概要及相关文章共14篇，总计104篇。目的在于借以丰富我们的新闻写作基础理论知识，帮助记者（通讯员）、编辑及广大新闻写作爱好者提高新闻采写技能，以便采写出更多的新闻精品来奉献给受众，从而增强新闻的“传播力、引导力、影响力、公信力”。本书将获奖作品及“赏析”文章按体裁分为消息、通讯、评论、综合“赏析”共四大部分：消息部分共30篇；通讯部分共24篇；评论部分共26篇；综合“赏析”部分共10篇；附录与采访写作、新闻工作者修养有关的文章共18篇。按其发表时间由远及近进行排列。,7,882,0,14.4,https://wfqqreader-1252317822.image.myqcloud.com/cover/368/23233368/s_23233368.jpg
今天就开始极简生活,2020-05-01 00:00:00,社会文化-社科,一个典型的高富帅，掌管150家店铺，拿着7位数薪水，有一个美丽的妻子，20多岁就买了豪宅名车。他是工作狂，一周工作80小时，一年工作362天。但是，他每天需要服药才能入睡。直到母亲去世，妻子因得不到关怀提出离婚，他感到无比伤心挫败，他说：“过于追求物质，我不但没有得到幸福，反而失去了真正的幸福。”然后，他丢掉了家里90%的物品，他的生活里只剩288件物品。两年后，他成为畅销书作者。他说：“我丢掉了90%的东西，生活却幸福起来。”至美其实就是极简主义，这个世界大部分的事，大部分的人都和自己是无关的，我们一生做任何事，走过任何澎湃的人生，都会归于极简。让生活简单一点，把目光和思想从物质转移至内心，发现自己真正的需求，我们会更容易感受到平静与幸福。,18,653,0,19.2,https://wfqqreader-1252317822.image.myqcloud.com/cover/660/38381660/s_38381660.jpg
法医报告2：遗骨会说话,2021-08-01 00:00:00,社会文化-社科,人类的骨头是每个人生活的无声见证，有些故事深入骨髓，无法磨灭。凭借她多年的研究和丰富的从业经验，世界著名的法医人类学家苏·布莱克教授带领我们踏上了探索的旅程。从头骨到脚趾，脸部、脊柱、肋骨、手臂、手指、骨盆和腿，每一个部位都有自己的故事。我们吃过什么，去过何处，所做的一切都留下痕迹，一条有用的信息可能历经数月、数年，有时甚至是几个世纪，直到法医人类学家对其进行解密。有些秘密很容易被揭开，但有一些秘密则需要严格的科学论证。但是，发现证据并将其有效结合在一起，我们便能重建事实，发现真相。一根脚趾接着一根脚趾，一个案件接着一个案件，一些罪案，一些历史，一些不可思议的奇文怪谈–苏·布莱克以敏锐视角，用其职业的敏感与对人类命运的深切同情，为我们讲述那些被人类遗忘的故事。,6,970,0,41.6,https://wfqqreader-1252317822.image.myqcloud.com/cover/0/41176000/s_41176000.jpg
不要因为走得太远而忘记为什么出发：陈虻，我们听你讲,2013-01-01 00:00:00,社会文化-社科,陈虻，中央电视台新闻评论中心总监，《东方时空》创办人，《生活空间》创办人，《纪事》创办人。开启了中国纪实类纪录片的新风尚。陈虻于2008年去世。本书纪录了他在央视创办栏目期间的思想精华和关于纪录片创作的独特思考。,8,882,0,27,https://wfqqreader-1252317822.image.myqcloud.com/cover/144/26392144/s_26392144.jpg
未来社区：城市更新的全球理念与六个样本,2021-07-01 00:00:00,社会文化-社科,『社区是城市的基本单元，对未来社区的理解和试验，是探讨城市未来发展的重要课题』。城市化是人类发展到近现代工业化之后的必然进程。改革开放以来，中国城镇化率以年均1%的速率增长，2019年末中国城镇化率首次超过60%。在中国许多大城市，几乎每一寸土地都经过不止一次的开发。城市的建设者和研究者们需要重新思考未来的发展方式。社区是城市的基本单元，对未来社区的理解和试验，是探讨城市未来发展的重要课题。本书通过实地调研分析国内外多个国家的城市更新案例，梳理城乡规划学者、建筑设计师、社区经营者等群体的观点与洞察，寻找未来社区的中国模式。,5,552,0,41,https://wfqqreader-1252317822.image.myqcloud.com/cover/241/39888241/s_39888241.jpg
女权主义简史,2015-08-01 00:00:00,社会文化-社科,《女权主义简史》谁是最早的女权主义者？ 女权主义思潮到底真正改变了多少女性的生活？这种思潮在当今不同的文化背景下有何差异？在这本简史中，玛格丽特·沃特斯着眼女权主义的发展历程，追根溯源，探究妇女选举权，20世纪60年代的妇女解放运动以及女权主义思想在今天是否依然有其价值等重大问题。她从欧洲讲到美国，再讲到第三世界，通过分析全球妇女的现状，向我们展示了女权主义研究的最新成果。,7,714,0,10,https://weread-1258476243.file.myqcloud.com/weread/cover/83/3300012383/s_3300012383.jpg
不拖延的人生笔记术,2021-05-01 00:00:00,社会文化-社科,书在子弹笔记术的基础上进行了延伸，讲述了如何运用点阵本写属于自己的人生笔记。任何人只要学会基本的逻辑，都可以客制化自己的人生笔记。它结合待办列表、愿望列表、备忘录、涂鸦本和日记，只要一本笔记本和一只笔，藉由快速纪录、整理排程、编写索引等技巧，抓出哪些事情浪费了你的时间、专注在真正重要的事件、帮自己的梦想排程，就能让笔记术跃升成为人生整理术！,4,719,0,34.3,https://wfqqreader-1252317822.image.myqcloud.com/cover/798/38259798/s_38259798.jpg
南北中国：中国农村区域差异研究,2017-12-01 00:00:00,社会文化-社科,中国东中西部农村的发展差距早已进入学界与政策界的视野，并在政策上进行了诸多研讨与应对。南中北方农村的差异，经过贺雪峰等诸多学者以脚丈量和著书立说，日渐明晰并引发讨论。在本书中，作者将中国农村划分为南方团结型村庄、北方分裂型村庄和中部分散型村庄三种类型，构建出“农村区域差异”这一中层理论，并从家庭继替、分家模式、养老模式、面子观、人情、生育模式、社会治理等方面进行了阐释与检验。,4,719,0,29.5,https://wfqqreader-1252317822.image.myqcloud.com/cover/789/22649789/s_22649789.jpg
年轻人要知道的2000个社会常识,2012-01-01 00:00:00,社会文化-社科,20几岁，是决定整个人生格局的关键时期。对20几岁这一时期把握得好与坏，未来的人生境遇会有天壤之别。20几岁要懂的2000个社会常识，精彩揭示了做人与做事的深刻道理。2000个社会常识，荟萃名人经典，浓缩前人精华，让你的人生与众不同。一本改变你一生的智慧书，二十几岁不懂，三十岁后要悔。,16,634,0,3.99,https://wfqqreader-1252317822.image.myqcloud.com/cover/444/139444/s_139444.jpg
论文与治学,2018-05-01 00:00:00,社会文化-社科,作为一直从事社会学研究并在中国社会学界颇受尊重的前辈学者，郑也夫教授通过讲述个人的治学经历和经验心得，为我们开辟了一条道路，开启了一扇大门。什么是社会学？学习和研究社会学有什么用？如何学习社会学？如何写作社会学论文？如何将社会学研究与现实社会、个人生活相结合？如何在社会学领域关注、思考、改善社会与人生？本书作为一部课堂讲授记录，既有生动活泼的事实案例和语言风格，又有全面而系统的专业介绍和深刻阐述，更有颇具启发性的问题和方法指导，对于社会学专业领域的新生，以及想初步了解和进入社会学门径的读者来说，是一部简明清晰、难易适中的入门读物。,7,859,0,22.8,https://wfqqreader-1252317822.image.myqcloud.com/cover/860/22671860/s_22671860.jpg
紫砂壶收藏选购指南,2017-01-01 00:00:00,社会文化-社科,紫砂壶集制陶、金石、品茶等诸多文化于一身，具有使用、把玩、欣赏、收藏、投资等多种功用，吸引着越来越多的玩家。本书立足“通俗”“准确”“实用”，以紫砂壶收藏研究专家的角度剖析紫砂壶型制、泥料、工艺、选购、使用及保养要点，图文高度匹配，直观清晰地让藏友学到紫砂壶的鉴别、赏析及选购投资技巧。无论是资深紫砂壶玩家，还是初入门的紫砂壶收藏爱好者，都能从书中获取更多紫砂资讯，从而更全面地了解紫砂壶、收藏投资紫砂壶。,24,697,0,26.4,https://wfqqreader-1252317822.image.myqcloud.com/cover/651/25505651/s_25505651.jpg
江村经济,2018-08-01 00:00:00,社会文化-社科,《江村经济》是费孝通1938年在英国伦敦大学学习时撰写的博士论文，论文的依据是作者在江苏省吴江县开弦弓村（今属苏州市吴江区七都镇）的调查资料，最初以英文发表，题为《开弦弓，一个中国农村的经济生活》。1939年在英国出版，书名为《中国农民的生活》。作者将开弦弓取名为江村。作者对开弦弓村的地理环境、村民的家庭结构、经济生产方式、财产分配与继承等进行了详细的描述，旨在通过一种人类学的描绘展现我国传统农村社会的深层结构和功能。,31,840,0,19.99,https://wfqqreader-1252317822.image.myqcloud.com/cover/969/23437969/s_23437969.jpg
论语的管理精义,2015-01-01 00:00:00,社会文化-社科,《论语》作为经典中的经典，既具有丰富的管理思想，又蕴涵独特的管理模式。本书从管理视角出发，沿着管理之道、管理模式和管理者素质三个维度，逐篇逐章详细解读了《论语》所蕴藏的管理思想，系统阐发了其中由职业规范、管理公德、管理职责、管理公正、管理方法、管理评价、管理原则等要素构成的儒家管理体系。本书致力于还原《论语》原本就有的那个生动而贴近生活实际的管理侧面，以期让人们真正认识到《论语》所具有的管理价值，尤其是它对启迪当下、创造未来的现实意义。《论语》的管理解读，不仅不会妨碍《论语》的其他视角解读及其应有的价值，反而会让这座人类共同记忆的宝藏更加熠熠生辉、魅力无穷。&lt;br/&gt;《论语的管理精义》可供企业、政府和各类非营利组织的管理者阅读参考，也可作为MBA、EMBA、MPA及其他管理专业学习者的相关课程用书。,7,0,0,25,https://wfqqreader-1252317822.image.myqcloud.com/cover/251/25315251/s_25315251.jpg
社会学大纲,2017-06-01 00:00:00,社会文化-社科,《社会学大纲》是李达在国立北平大学法商学院任教授时所作，是中国马克思主义哲学目前具有里程碑意义的名著。全书由五篇组成，分别是：唯物辩证法；当作科学看的历史唯物论；社会的经济构造；社会的政治建筑；社会的意识形态。全书思想深刻，对认识社会，了解社会变迁中内在的动因，具有指导性意义。被誉为是“中国人自己写的靠前本马克思主义哲学教科书”。,8,875,0,17.7,https://wfqqreader-1252317822.image.myqcloud.com/cover/198/27773198/s_27773198.jpg
别睡，这里有蛇,2019-02-01 00:00:00,社会文化-社科,1977年，丹尼尔·埃弗里特携妻子和三个年幼的孩子来到亚马孙丛林中皮拉罕人的部落，他想要传教，改变皮拉罕人的宗教信仰。但他发现皮拉罕语违背了所有现存的语言理论，并反映出一种远离当代认识的生活方式。例如皮拉罕人没有记数系统，没有统一的颜色的称谓，没有战争和个人财产的概念，没有过去与未来，完全活在当下。埃弗里特开始痴迷于他们的语言、文化，并沉溺于他们的生活方式，久而久之，他最终失去了传教的信念。这本书是埃弗里特30多年客旅丛林的生活记录。在这30多年里，埃弗里特的妻儿差一点因疟疾病死他乡，埃弗里特也曾因触犯皮拉罕人的自由而被群起攻之，但更多的，埃弗里特分享了他与皮拉罕人共处时的种种幸福的点滴，打鱼、捕猎、修房子、教他们算数和制造独木舟……埃弗里特以放弃现代文明生活的代价换来书中与皮拉罕人一起生活的奇闻轶事。同时，这本书也是对现代语言和文化的质疑和探索。皮拉罕人让埃弗里特反思现代文明，并试图让我们思考，除了我们理解的生活方式外，人生还会有怎样的可能。,11,877,0,27.99,https://wfqqreader-1252317822.image.myqcloud.com/cover/451/37477451/s_37477451.jpg
