title,publishTime,category,intro,maxFreeChapter,newRating,free,price,cover
趋势2030：重塑未来世界的八大趋势,2022-03-01 00:00:00,社会文化-社科,作者通过七年的社会观察和调研，大量参考智库研究数据、学者观点、社会热点，分析预测了未来十年的全球发展趋势，其对经济、社会、文化产生的影响，以及由此带来的商业版图和生活方式的变化。作者构思了一个逻辑严密的认识论体系，描述了八大趋势及其相互关系：人口大逆转：全球人口的失衡与下一次工业革命；银发族引领新潮流：跟上科技浪潮的老年群体，以及“老年”与“青年”的未来；新兴市场的中产阶级：新旧中产阶级的碰撞与关注度之争；女性影响力增加：新百万富翁、企业家与未来领袖；城市成为变革引擎：气候变暖、城市生活方式、创意阶层；技术创新与未来：颠覆式创新、科技与伦理；共享与协同经济：共享骑行潮、网络效应和85亿人互联的力量；加密货币与区块链：印刷自己的钞票、区块链和现代银行业的终结。作者认为“部分趋势已初显”“在2030年前后会达到临界点”“我们需要为迎接机遇和挑战做好准备”他还提供了应对复杂变化的横向思维方式以及七个生存指南。,15,556,0,48.3,https://wfqqreader-1252317822.image.myqcloud.com/cover/913/43696913/s_43696913.jpg
身份政治：对尊严与认同的渴求,2021-10-01 00:00:00,社会文化-社科,在本书中，福山沿着三十年前《历史的终结？》一文开启的思考路径，围绕当今的身份政治为政治秩序带来的威胁，阐述了何为身份，以及我们该如何应对它导致的政治撕裂。他提出，身份不是当代政治催生的新鲜事物，它扎根于人类灵魂中的激情、对尊严的渴求与个体独有的生活体验，随着经济现代化与社会的快速变革而兴起，取代旧的社群形式，成为人们赖以争取承认的方式；它不是恒定之物，也并非必定导致社会的分裂。,5,787,0,47.6,https://weread-1258476243.file.myqcloud.com/weread/cover/99/3300012199/s_3300012199.jpg
东北游记,2017-01-01 00:00:00,社会文化-社科,生活在现代中国的人，都明白见证传统流失，老景翻新的感觉。在北京，也许你上周还在一条巷子里的小店吃面条，下周再去就发现那儿已经变成了一堆瓦砾。相比之下，东北的历史还不算那么遥远。你乘坐的火车可能行驶在以沙皇命名的铁路上；你漫步而过的建筑不是佛教古寺，而是洋葱圆顶的俄罗斯东正教教堂；你走过的大道两旁种着日本赤松；树木掩映之下，是殖民时期各国政府的办公楼，散发着浓浓的旧时代气息；你还可以去参观溥仪的“傀儡皇宫”，看看二战时期日本关押盟军战俘的地方；你站在朝鲜战争期间美军飞行员俯冲轰炸过的大桥上，就是站在中朝边境上，跨越了鸭绿江。17世纪早期，东北，开始比较频繁地出现在有记载的古代历史中。当时在世界的另一边，莎士比亚正在创作经典戏剧，英格兰的清教徒登陆普利茅斯岩，开始创建美国。也许你不知道这里曾经发生了什么故事，有什么样的过往。而在我眼里，这些恰恰就是历史的印记，记录了东北的兴衰荣辱，也浓缩了现代中国的起落沉浮。我很清楚，在东北，能够对中国的过去一探究竟。但没有料到，在荒地，我能一瞥这个国家的未来。,9,737,0,14.99,https://wfqqreader-1252317822.image.myqcloud.com/cover/36/925036/s_925036.jpg
恋爱心理必修课,2019-09-01 00:00:00,社会文化-社科,为什么童年经历会影响你对恋爱对象的选择？为什么男女恋爱时的行为差距这么大？为什么相爱容易相处难？《恋爱心理必修课》回答了人们对世间美好的感情的诸多疑问。《恋爱心理必修课》以众多心理学家就爱情的研究与成果为基础，讲解了什么是爱情、爱情是如何产生的、不同年龄阶段的恋爱特点、男女处理感情时的不同心理依据、如何谈好一段恋爱并使其成为一段更长远的亲密关系以及如何处理已不必挽回的感情等方面内容。希望阅读后，每一位想拥有高质量的亲密关系的读者，尤其是对爱情懵懵懂懂、莽莽撞撞的年轻人，都可以帮拿到爱情这门课的学分。,20,562,0,26.6,https://wfqqreader-1252317822.image.myqcloud.com/cover/470/27112470/s_27112470.jpg
我离婚了：帮你正确看待和面对离婚这件事,2019-05-16 00:00:00,社会文化-社科,一部关于21世纪中国离婚议题的现实作品讲述婚姻过程中的真实遭遇，唤起共鸣，反思离婚的经历，分析导致婚姻问题的各类因素，帮助离异人士正确看待和处理离婚这件事，疗愈创伤，重塑自我，重拾幸福的勇气本书聚焦于中国当下的离异群体，讲述了较有代表性的离异女性在婚姻生活中的真实遭遇，分析了导致婚姻问题的主要因素，希望帮助受离异困扰的人士正确看待和处理离婚问题，疗愈创伤，重塑自我。本书是一部具有现实指导意义的作品，对夫妻双方共同经营好婚姻也具有重要的借鉴作用。,6,718,0,22.9,https://wfqqreader-1252317822.image.myqcloud.com/cover/413/25614413/s_25614413.jpg
算法的力量：人类如何共同生存？,2022-02-01 00:00:00,社会文化-社科,"本书是一部面向21世纪的政治启蒙读物，从数字时代社会的特征、未来的权力形式，到未来的自由、民主、正义，为我们了解安排人类集体生活的未来的政治提供了独特思考。一如作者所言：本书主要写给希望更清楚地看懂未来的普通公民。

杰米·萨斯坎德认为，人工智能、虚拟现实等各种技术将彻底改变我们的公共和私人生活。他给我们描述了一个数字生活世界，在这个世界中，某些技术和平台以及控制它们的人拥有强大权力：有些技术会收集我们所有的数据，我们为此会避免做出那些被视为可耻、有罪或错误的行为；还有一些技术会过滤我们对世界的认知，选择我们能知道什么，塑造我们的想法，影响我们的感受，指导我们的行动；还有一些技术会迫使我们去做我们原本不会做或不愿意做的事情。久而久之，人类与机器、线上与线下、虚拟与真实等方面的区别，都会逐渐消失。

控制这些技术的人将越来越多地影响乃至决定我们的生活。他们将设定自由的界限，决定民主的兴衰和未来。他们的算法也将决定社会正义的方方面面，决定社会物品的分配，决定我们的身份和地位。我们该怎么办？是拒绝使用所有数字技术，回到过去，还是不顾一切地拥抱数字系统？",6,789,0,68.6,https://weread-1258476243.file.myqcloud.com/weread/cover/47/3300013547/s_3300013547.jpg
昨日之前的世界（第二版）,2022-01-01 00:00:00,社会文化-社科,传统社会对现代社会来说意味着什么？是充满冲突与混乱的蛮夷之地，还是尽享田园生活的世外桃源？但无论如何它离我们并不遥远，而且潜移默化地影响着现代社会人们的生活方式。传统部族社会的社会实践要比现代国家社会更久远，它在如何组织一个人类社会的问题上，已经进行了成千上万次自然的实验。在新几内亚部落生活了近50年的戴蒙德通过对部落社会生存环境、生活习俗、行事方式的观察、记录来剖析人类社会的演进，这本书就是他多年研究的结晶。作者从人类学、社会学、语言学等角度剖析区域划分、战争冲突、人际关系、养育孩子、对待老人、应对危机、宗教信仰、语言习得、健康膳食这9个方面，展现了传统社会最核心的生活方式。这9个代表传统社会的小切面也同样主宰着今日世界，因此，值得生活在现代社会的我们参考和借鉴。伴随着科技的高速发展，现代人往往在快节奏的生活中迷失了自我，人际关系疏远、社会分配不公、愤世情绪高涨、社会冲突不断、身体亚健康、盲目崇拜流行文化等问题已成为现代社会的桎梏，在这一背景下，我们应该回顾人类祖先的原始生活方式，追溯那些曾经帮助人类完善自我、建立文明与有序社会的良好根基，而这就是“昨日之前的世界”。,6,833,0,68.6,https://wfqqreader-1252317822.image.myqcloud.com/cover/300/42867300/s_42867300.jpg
黄河边的中国,2013-06-01 00:00:00,社会文化-社科,《黄河边的中国》，是学者曹锦清1996年5月-11月期间深入河南地区的田野调查，是一部当代中国少见的实证考察著作。《黄河边的中国》记录了正在转型中的中原乡村社会，涉及实行土地承包责任制后的农民与土地、与市场、与血缘人情网络、与地方政府关系的变化现状；涉及农村、农民、农业、收支、农民负担、计划生育等诸多方面；涉及日益庞大且凌驾于农村社会之上的地方政府与分散经营的农民为争食有限的农业剩余而引发的各种矛盾，涉及作为一种显示力量的传统文化与现代化努力之间的强大张力。作者在努力描述中原乡村社会事实的同时，着力反映社会转型过程中小农阶层的利益、情绪与态度。曹锦清，著名社会学家。1949年生，浙江兰溪人，现任华东理工大学文化研究所所长、社会学教授、博导。主要著作有《现代西方人生哲学》、《当代浙北乡村的社会文化变迁》、《中国单位现象研究》、《平等论》、《黄河边的中国》、《中国七问》等。其中《黄河边的中国》一书引起强烈社会反响，成为观察研究中国当下农村社会的最权威、最流行的作品，并荣获第五届“上海文学艺术奖”，2005年其英译本出版。,38,864,0,22,https://wfqqreader-1252317822.image.myqcloud.com/cover/57/26756057/s_26756057.jpg
城乡中国（上）,2013-08-01 00:00:00,社会文化-社科,中国虽然大，可以说只有两块地方：一是城市，一是乡村。中国的人口十几亿，也可以说只有两部分人：一部分叫城里人，另外一部分叫乡下人。城乡中国深刻的分野，促使费孝通先生在20世纪40年代就写出他著名的《乡土中国》。今天，虽然中国的经济飞速发展，可是城乡之间依然有着巨大的差距，甚至鸿沟越来越大，导致中国发展中的大多数重点难点，都在农村，都在城乡之间。,5,819,0,3.9,https://wfqqreader-1252317822.image.myqcloud.com/cover/686/237686/s_237686.jpg
知识分子的鸦片,2012-06-01 00:00:00,社会文化-社科,"《知识分子的鸦片》一书是雷蒙·阿隆在冷战初期，针对当时法国特别是法国知识界的情况而作的一本法国人反思法兰西病的著作。在《知识分子的鸦片》一书中，作者对偏爱走极端的法国知识分子本身进行了剖析和批判，是研究法国现代思想史的重要参考资料，也是知识社会学的名著。在许多情况下，深刻的思想往往采取片面的姿态，左派的作品是这样，右派的作品也是如此。所以，即使在时过几十年之后，我们再来阅读阿隆的这部著作，仍会为其间的清醒与尖利惊叹。
",4,810,0,18,https://wfqqreader-1252317822.image.myqcloud.com/cover/855/906855/s_906855.jpg
杀死一座城市,2022-07-01 00:00:00,社会文化-社科,"房租不断上涨、连锁品牌入驻、熟悉的面孔越来越少、在地文化逐渐消失——这就是缙绅化：旧社区在重建后因地价及租金上升，吸引高收入人群迁入，原有的低收入者不得不迁往条件相对较差、生活成本较低的地区生活。缙绅化的进程一再深入，未来的城市能否真正成为一个充满活力、公正合理的空间，仍是一个悬而未决的问题。
本书通过对美国四座大都市（新奥尔良、底特律、旧金山、纽约）重大变迁的回溯和分析，指出所谓缙绅化是在资本对利润的追求和政策倾斜的支持下，驱赶城市中的穷人，聚集更多精英富人，让贫富两极分化的一个过程。资本的大量流入，逼迫原生社区与文化妥协退让，群体驱逐之下，城市从充满回忆的故居变成精致而巨大的空洞。
谁是城市的掌权者？民众要如何争取自己应有的权益？彼得·莫斯科维茨的镜头巨细靡遗，带我们逐一拜访那些负担不起住房的困窘家庭，了解破坏性住宅政策如何在政商联合下被制定出来，揭露了推动大都市缙绅化背后环环相扣的庞大力量。",6,0,0,33.6,https://weread-1258476243.file.myqcloud.com/weread/cover/9/3300024309/s_3300024309.jpg
弱者的武器（人文与社会译丛）,2011-04-01 00:00:00,社会文化-社科,《弱者的武器》是一部卓越的农民运动研究著作，斯科特以其出色的工作展示了人种学报告不能也无法呈现的农民反抗外来侵犯的“全貌”，是对反抗霸权的日常形式的精彩理论和经验阐释。任何想要了解东南亚农民社会的人都不能错过此书。,9,778,0,16.8,https://wfqqreader-1252317822.image.myqcloud.com/cover/955/935955/s_935955.jpg
亲密关系管理：如何理性应对亲密关系中的冲突,2021-03-01 00:00:00,社会文化-社科,很多人都以为，只要有爱，就能一直幸福下去。可是，相爱容易相处难。为什么好不容易遇到了爱的人，而我们却留不住对方？问题的根本原因在于：大多数亲密关系问题，与爱本身无关，而跟懂不懂得管理亲密关系有关。爱是纯粹的，相处却是关系，但凡关系就是管理学的大问题。一个在亲密关系中拥有管理智慧的人，会向内管理好自己，向外管理好关系。不管你是单身、恋爱中或是已婚，管理亲密关系都是我们必须具备的一项爱的能力。陈历杰老师教你用管理学思维加心理学方法管理亲密关系，让相爱的人也能相守。,8,791,0,39.2,https://wfqqreader-1252317822.image.myqcloud.com/cover/418/36798418/s_36798418.jpg
第二座山,2020-11-01 00:00:00,社会文化-社科,戴维·布鲁克斯在本书中用令人意想不到的角度深入剖析我们的日常生活。作者提出了“双峰模式”，我们每个人都在攀登人生的两座山。如果说第一座山是关乎构建自我和定义自我的，那么第二座山则是关乎摆脱自我和舍弃自我的。如果说第一座山是关乎获取的，那么第二座山则是关乎奉献的。如果第一座山是精英式的独自攀登，那第二座山则是置身于有需要的人之间，并与他们手携手同行。作者认为，如何判断你是处在第一座山还是第二座山的关键是，你的终极诉求何在？是外在之物，还是自身名利？攀登第二座山的方式，不同于攀登第一座山的方式。征服第一座山后，辨认第二座山的峰顶，然后朝它前进。你已被你的第二座山征服了。你屈服于某些召唤，你竭尽所能，回应召唤，解决面临的问题或不公正。在第一座山上，你雄心勃勃，高瞻远瞩。到第二座山上时，你已倾向于亲密、无私和奉献。第二座山上的人，过着更宏大的生活，激活了内心深处，并承担了更广泛的责任。作者基于此，提出了本书的两个目的，以期能为读者有更多的帮助。,6,761,0,52.8,https://wfqqreader-1252317822.image.myqcloud.com/cover/725/34627725/s_34627725.jpg
20几岁要懂得的社会常识大全集II,2011-06-01 00:00:00,社会文化-社科,本书选取了最为基本、最为必要的社会常识，内容涉及与人相处、识人、社交心理学、人脉、办事、送礼等方面，为20几岁的年轻人提供一剂处世良方，一个智慧锦囊。,5,480,0,6.2,https://wfqqreader-1252317822.image.myqcloud.com/cover/12/828012/s_828012.jpg
宣传：观念、话语及其正当化,2020-01-01 00:00:00,社会文化-社科,本书是宣传概念的历史，也是宣传观念的历史。为了回答什么是宣传、它为什么会存在、大众为什么会容忍宣传等问题，追溯了第一次世界大战中宣传概念的产生、美国20世纪初宣传与民主的争论、俄国革命的宣传观念、第二次世界大战中的宣传观念、20世纪后期的新宣传等宣传观念发展的重要环节，并以此为背景，重点研究了中国宣传观念的产生、国民党和共产党宣传观念的建立、知识分子与宣传、1949年之后中国宣传观念的变迁等问题。详细描述了20世纪以来各种宣传观念和话语的交锋，展示了一幅国家与个人、控制与自由、思想与身体等观念相互冲突的全景图像。,4,926,0,31.2,https://wfqqreader-1252317822.image.myqcloud.com/cover/596/35092596/s_35092596.jpg
西方传播学术史手册,2019-05-01 00:00:00,社会文化-社科,本书具有工具书性质，分为导论与正文两部分。导论勾勒了西方传播研究的思想谱系，正文分词条介绍西方传播思想名家。本书契合读者需要，可作为传播学专业在校生教材和考研学生的重要参考书。作者学术功底深厚，多年来专注于研究西方传播思想，此书是这一研究的成果。,19,883,0,40,https://wfqqreader-1252317822.image.myqcloud.com/cover/957/26831957/s_26831957.jpg
初识传播学：在信息社会里正确认知自我、他人及世界,2016-06-01 00:00:00,社会文化-社科,本书是一本享誉全美的畅销经典教材，由著名传媒学者埃姆·格里芬根据在美国惠顿学院浸淫数十年的教学经验撰写而成，在多次更新版本的过程中，反复征求、汲取学界权威以及上百万名读者的反馈意见。为使读者在短时间内迅速掌握传播学的精髓，本书精心遴选32种传播理论进行讲解，对近年大热的理论前沿亦有所涉猎。与其他教材相比，本书最大特点在于强调读者体验，不但祛除了传播学理论的晦涩刻板，而且致力于将它们转换为普通人可以在生活中应用的工具。全书以深入浅出的方式，由信息、意义、语言、思维等最基本的概念入手，逐步过渡到如何认识与理解人际之间，乃至个人与群体、与社会及文化的纷纭复杂的关系。,8,864,0,52.8,https://wfqqreader-1252317822.image.myqcloud.com/cover/445/920445/s_920445.jpg
五维学习力,2020-07-01 00:00:00,社会文化-社科,这本书能够让你快速掌握学习技巧，有效提高自己的学习力。 作者王咏在多年的学习历程中提炼出“学习金字塔模型”，通过这个模型，他能够在有限的学习时间里聚焦⾃⼰的学习⽅向，时刻保持快速个⼈成长。从业20余年，王咏从普通的销售专员做到了上市公司总裁，从传统⾏业转型到IT互联⽹⾏业，并且出版了多部著作。在忙碌且成功的事业之外，他还兼顾⾃⼰的爱好，在书法和国画的学习上也⼩有成就。 目前，他正潜心利用更多空余时间踏⼊知识付费的领域。借助学习⾦字塔模型，他快速地完成了知识迭代，在短短不到⼀年的时间里，已打磨了三门在线课程，同步出版了两部著作，从⼀个知识付费的门外汉变成了半个专家。由此可见，学习⾦字塔模型的威⼒⾮常强⼤。 今天，作者把这个神奇的学习⾦字塔模型分享给大家，从学习辨识力、学习驱动力、学习策略力、学习创造力和学习持久力这五个维度梳理出学习中的常见问题，层层阐述，化繁为简。 通过使用书中提供的具体学习方法和工具，相信每位读者都能获得启发，达到快速提高学习力的目标。,10,727,0,35.4,https://wfqqreader-1252317822.image.myqcloud.com/cover/409/32042409/s_32042409.jpg
自由及其背叛,2011-03-01 00:00:00,社会文化-社科,"《自由及其背叛》原为以赛亚·伯林1952年在BBC第三套节目所做的系列讲演。他从自由主义的基本理念出发，讨论了近代著名思想家爱尔维修、卢梭、费希特、黑格尔、圣西门和迈斯特等人对自由以及人类历史的看法。在伯林看来，除了迈斯特是人类自由的公然反对者外，这些思想家都对人类的自由持肯定态度，但他们对自由的理解，却导致了反自由的历史后果。
",6,834,0,11.3,https://wfqqreader-1252317822.image.myqcloud.com/cover/522/849522/s_849522.jpg
医生的精进：从仁心仁术到追求卓越,2015-08-01 00:00:00,社会文化-社科,日益攀升的医患纠纷、说不清的诊疗性骚扰、棘手的医疗事故、高额的医疗费、不平等的收入……当新手医生阿图成为独当一面的葛文德医生，当医术已经远远无法解决问题，他与他的医者同伴如何面对？接下来还有哪些挑战等待着他？最真实的“医者仁心”故事正在上演。与专注于现象的第一部相比，第二部对医疗体系内的诸多问题及其可能性进行了更深入的思考。精湛医术只是进入医者殿堂的第一步，走进这一行，便要迎接外人所不知的考验。适合医疗界人士、政策制定者和普通大众阅读。 走出白色巨塔，医生一职要与社会各领域接驳，将面对无数道德困境，也要承担错误的后果。医术并非万能，更不能决定医患关系的对错得失。作者阿图·葛文德是哈佛医学院外科副教授，于2010年跻身《时代周刊》评选的“100位最具影响力人物”，他是白宫最年轻的健康政策顾问，全盘托出医疗体系中那些鲜为人知的真相。,9,842,0,20.56,https://wfqqreader-1252317822.image.myqcloud.com/cover/128/695128/s_695128.jpg
人人都该懂的脑科学,2020-09-01 00:00:00,社会文化-社科,我们的所有行为以及所思所想都是在脑的控制下产生的，脑就是理解人类行为的一把钥匙。从早期的颅相学用颅骨的隆起来评价他人，到如今的脑成像技术能够清楚地看到脑的各个部分；从还是一个胚胎时的渺小，到发展出脑复杂的世界；从意识、记忆、情绪、睡眠、运动、感觉等方面，到对永生的追求与推测，本书涵盖了有关脑科学的方方面面，用简单有趣的语言为你呈现了整个宏大的脑内宇宙。可以说，本书是一本绝佳的脑科学入门书。,7,787,0,59.31,https://wfqqreader-1252317822.image.myqcloud.com/cover/607/33808607/s_33808607.jpg
新闻业的救赎,2018-06-01 00:00:00,社会文化-社科,本书全面阐述新媒体生态下，新闻生产所受到的冲击、困境与对策。内容包括12个话题：1. 新闻专业主义的生与死。2. 新闻生产方式的改变。3. 再造新闻编辑部。4. 记者的五个角色。5. 内容何以为王。6. 新媒体时代的受众。7. 新媒体伦理困境。8. 新闻的盈利模式。9.媒体融合。10. 公众与公民新闻。11. 全球化与文化冲突。12. 新闻的未来。,7,786,0,29.88,https://wfqqreader-1252317822.image.myqcloud.com/cover/92/26398092/s_26398092.jpg
美国人的性格,2018-11-01 00:00:00,社会文化-社科,"    本书是著名学者费孝通的经典名作，包括了《美国人的性格》《初访美国》《访美掠影》三部分内容，是费孝通先生20世纪40年代在美国读书和考察及上世纪80年代重访美国的笔记和观感，着重对比了美国文化与欧洲文化、美国人与欧洲人的区别，美国文化与中国文化、东方文明与西方文明的差异。分析了美国人的性格及这种性格在推动美国走向繁荣富强道路上的作用，有利于加强我们对我国和平崛起及东方文明的重建的思考。
",8,838,0,19.99,https://wfqqreader-1252317822.image.myqcloud.com/cover/27/26298027/s_26298027.jpg
技术垄断：文化向技术投降,2019-04-01 00:00:00,社会文化-社科,本书与《童年的消逝》《娱乐至死》（中信，2015）并称尼尔·波斯曼的“媒介批评三部曲”，其一以贯之的主题是检讨技术对人类社会生活、文化、制度的负面影响。作者认为，技术和人的关系是亦敌亦友的关系，他之所以揭示技术的阴暗面，是为了避免技术对文化造成伤害。文化有三种形态：在工具使用文化阶段，技术服务、从属于社会和文化；在技术统治文化阶段，技术向文化发起攻击，并试图取而代之，但难以撼动文化；在技术垄断文化阶段，技术使信息泛滥成灾，使传统世界观消失得无影无踪，技术垄断就是极权主义的技术统治。本书揭示了技术垄断阶段各种“软”技术的欺骗作用，挞伐所谓社会“科学”，谴责唯科学主义；辨析自然科学、社会“科学”和文学之异同，并为传统符号的耗竭扼腕痛惜；号召人们以强烈的道德关怀和博爱之心抵抗技术垄断，坚决反对文化向技术投降。,7,705,0,34.8,https://wfqqreader-1252317822.image.myqcloud.com/cover/612/25369612/s_25369612.jpg
