title,publishTime,category,intro,maxFreeChapter,newRating,free,price,cover
乡土中国,2012-10-01 00:00:00,社会文化-社科,费孝通最知名的社会学著作之一，多年来深受学界和普通读者的一致推崇！如果说《江村经济》侧重讨论社会制度变革，那么《乡土中国》则在探讨与之相匹配的社会道德。这是费孝通对中国进行社会结构分析的尝试，他试图在理论上总结并开导实地研究，以构建中国社会特有的乡土伦理体系。沿着作者的思路，可以一窥中国的基层社会。虽然时移世易，但作者透视社会的眼光、观察社会的方法，在今天仍值得借鉴。,7,848,0,10.8,https://wfqqreader-1252317822.image.myqcloud.com/cover/366/651366/s_651366.jpg
厌女：日本的女性嫌恶,2019-06-01 00:00:00,社会文化-社科,《厌女》不是一部纯理论性著作，而是运用女性主义理论针对日本当代的各种社会现象的实践性分析。《厌女》处理了广泛的日本题材，其中既有文学性的，比如谈到小说家吉行淳之介、永井荷风、林真理子等，更多的则是社会性的。上野千鹤子谈到的许多现象，尤其是家庭的、婚姻的，在中国也有很类似的情况。知性的读者会从这些论述中获得强烈共鸣并得到理论上的指引。,11,889,0,38,https://weread-1258476243.file.myqcloud.com/weread/cover/74/3300017874/s_3300017874.jpg
娱乐至死,2015-05-01 00:00:00,社会文化-社科,"    《娱乐至死》初版于1985年，是尼尔·波兹曼的代表作之一。《娱乐至死》想告诉大家可能成为现实的，是赫胥黎的预言，不是奥威尔的预言；毁掉我们的，不是我们憎恨的东西，恰恰是我们热爱的东西！电视时代蒸蒸日上，电视改变了公众话语的内容和意义，政治、宗教、教育、体育、商业和任何其他公共领域的内容，都日渐以娱乐的方式出现，并成为一种文化精神，而人类无声无息地成为娱乐的附庸，毫无怨言，甚至心甘情愿，其结果是我们成了一个娱乐至死的物种。
",6,751,0,22.8,https://wfqqreader-1252317822.image.myqcloud.com/cover/833/855833/s_855833.jpg
枪炮、病菌与钢铁,2022-01-01 00:00:00,社会文化-社科,文明的先发与落后，社会的发展与倒退等问题，一直是人类关注的大议题。就此，西方社会普遍认为西方国家先进的技术、完善的社会阶层、百花齐放的文化成果，共同造就了西方文明优于其他，并决定了西方统治世界的地位，甚至认为究其根本是西方种族的优越性决定的。《枪炮、病菌与钢铁》告诉我们，答案并非如此。环境因素才是决定历史的车轮向西方倾斜倾，文明的进步的确助推了文化、技术和组织的先发，但同时也导致了细菌的侵袭和船坚利炮对文明的致命摧毁，也就是说，种族决定论和西方文明优势论都无法解释为什么西方国家可以统治世界百年之久。是环境与资源的优渥滋养了西方文明的发展。此外，戴蒙德从生物学、地理学、历史学、社会学、人类学等跨学科视角颠覆了很多人们习以为常的社会发展疑问，为我们理解人类历史提供了崭新的视角。从深耕专业领域的科学家，到关注人类社会与命运的思想者，戴蒙德从科学、历史、社会的交叉点探究地理、人类与未来，他在某种程度上代表了西方公共知识分子传统的转向——从专业性转向思想性，他依仗多学科的视角和丰富的游历经验，追思人类历史的发展路径，从中寻找经验与教训，试图为人类社会未来的发展提供建议。,6,891,0,62.3,https://wfqqreader-1252317822.image.myqcloud.com/cover/48/42766048/s_42766048.jpg
最好的告别：关于衰老与死亡，你必须知道的常识,2015-08-01 00:00:00,社会文化-社科,当独立、自助的生活不能再维持时，我们该怎么办？在生命临近终点的时刻，我们该和医生谈些什么？应该如何优雅地跨越生命的终点？对于这些问题，大多数人缺少清晰的观念，而只是把命运交由医学、技术和陌生人来掌控。影响世界的医生阿图·葛文德结合其多年的外科医生经验与流畅的文笔，讲述了一个个伤感而发人深省的故事，对在21世纪变老意味着什么进行了清醒、深入的探索。本书富有洞见、感人至深，并为我们提供了实用的路线图，告诉我们为了使生命最后的岁月有意义，我们可以做什么、应该做什么。 作者选择了常人往往不愿面对的话题——衰老与死亡，梳理了美国社会养老的方方面面和发展历程，以及医学界对末期病人的不当处置。书中不只讲述了死亡和医药的局限，也揭示了如何自主、快乐、拥有尊严地活到生命的终点。书中对“善终服务”“辅助生活”“生前预嘱”等一系列作者推崇的理念，都穿插在故事中作出了详尽的说明，相信会给老龄化日益加剧的中国社会以启迪。 众多专家、媒体推荐。创新工场CEO李开复：作为一名医生，阿图·葛文德关注的是医疗的局限以及人的尊严。作为凡人，我们都将面对人生的终点，《最好的告别》给我们重要的启示。《新知》杂志主编苗炜：希望大家有机会能看看阿图·葛文德医生的著作，他能帮助我们更好地理解医学，知道医学的局限和可能。畅销书作家马尔科姆·格拉德威尔：这是阿图·葛文德最有力，也最感人的一本书。《自然》杂志：难得读到这样一本发人深省的书。,8,861,0,4.99,https://wfqqreader-1252317822.image.myqcloud.com/cover/126/695126/s_695126.jpg
小镇喧嚣：一个乡镇政治运作的演绎与阐释,2018-02-01 00:00:00,社会文化-社科,释尽乡镇日常政治种种人事与结构交织碰撞的众声嘈杂,12,947,0,54.4,https://weread-1258476243.file.myqcloud.com/weread/cover/41/3300019741/s_3300019741.jpg
从零开始的女性主义,2021-09-01 00:00:00,社会文化-社科,女性主义是什么？为什么我们需要女性主义？如何用女性主义进行思考？围绕上述种种问题，日本著名学者上野千鹤子与知名漫画家田房永子，开始了一场从零开始的女性主义课堂。她们用幽默的语言、传神的漫画，回溯女性主义的发展历程，畅谈母女关系、性、工作、婚恋、育儿等日常生活中的议题，驳斥关于女性的刻板偏见。这堂课不仅开启了一趟全新的旅程，更告诉我们：女性主义，不仅仅关乎女性，更关乎每个人的日常生活。,8,904,0,29.99,https://rescdn.qqmail.com/weread/cover/399/3300004399/s_3300004399.jpg
自私的基因（40周年增订版）,2018-11-01 00:00:00,社会文化-社科,《自私的基因》以充满想象力的叙述回答了这些重要命题。道金斯在本书中提出大胆创见：我们生来是自私的，任何生物，包括我们自己，都只是求生的机器。这本书是实实在在的认知科学，复制、变异和淘汰这简单的三种机制可以演变出大千世界所有生命现象的林林总总。 《自私的基因》更为我们提供了一种新的世界观。道金斯在书中将进化论从基因层面升华至文化层面，创造了“觅母”（meme，即文化基因）这一新型的复制因子名词，特指人类社会发展中的文化进化，并提出：在这个世界上，只有我们，我们人类，能够反抗自私的复制因子的暴政。 《自私的基因》出版之后，在社会各界引发了重大争议。本书为40周年增订版，在30周年版的基础上，新增道金斯对于这些争议的回应，共计6万余字，主要探讨了人们在基因决定论、基因选择论，以及基因适应性上存在的普遍误解，进而从基因的视角正确理解生命及其意义，更加完善了道金斯对于“自私的基因”的经典论述，形成这本特别的“延伸的”40周年增订版《自私的基因》。,10,770,0,40.8,https://wfqqreader-1252317822.image.myqcloud.com/cover/518/23665518/s_23665518.jpg
把自己作为方法,2020-07-01 00:00:00,社会文化-社科,两代北大学人，跨越北京、牛津、温州、杭州、上海五地，历时三年完成了这场谈话。从项飙教授的个人经验切入，追索一系列超越自我的问题，其中涉及对中国社会半个世纪以来的变化、知识共同体、全球化与民粹主义、人类学方法论等题目的思考。这本书提供了一份对话实录，也给出了一种审视问题、思维操练的方法——在自我泛滥的潮流中，如何给自己定位，在全球化的年代，如何创造性地建设身边的小世界，在思想受困的社会，如何回答宏大的命题。,8,879,0,33.6,https://rescdn.qqmail.com/weread/cover/962/3300003962/s_3300003962.jpg
未来简史：从智人到智神,2017-01-10 00:00:00,社会文化-社科,进入21世纪后，曾经长期威胁人类生存、发展的饥荒和战争基本被攻克，智人面临着新的待办议题：永生不老、幸福快乐和成为具有“神性”的人类。在解决这些新问题的过程中，科学技术的发展将颠覆我们很多当下认为无需佐证的“常识”，比如人文主义所推崇的自由意志将面临严峻挑战，机器将会代替人类做出更明智的选择。 更重要的，当以大数据、人工智能为代表的科学技术发展的日益成熟，人类将面临着从进化到智人以来*的一次改变，绝大部分人将沦为“无价值的群体”，只有少部分人能进化成特质发生改变的“神人”。 未来，人类将面临着三大问题：生物本身就是算法，生命是不断处理数据的过程；意识与智能的分离；拥有大数据积累的外部环境将比我们自己更了解自己。如何看待这三大问题，以及如何采取应对措施，将直接影响着人类未来的发展。,3,832,0,40.8,https://wfqqreader-1252317822.image.myqcloud.com/cover/290/852290/s_852290.jpg
人体简史,2020-06-01 00:00:00,社会文化-社科,你的身体30亿岁了！一部从头讲到脚、从里讲到外、从30亿年前讲到今天的人体百科全书！翻开本书，从单细胞斑点讲起，看看30亿年来你的身体的进化史！全球销量超千万册的科普巨著《万物简史》作者比尔·布莱森重磅新作，被誉为“当今在世的最有趣的非虚构类作家”！人有几百万年前在树上睡觉的记忆，所以现在在床上睡觉也不会掉下来！只有人把空气和食物送往同一通道，所以生来容易被噎死！人的大脑比一万年前小了很多，但它30秒处理的信息比哈勃望远镜30年的还多！Y染色体可能在460万年后灭绝，但不用担心，男性并不会因此灭亡！癌症也是进化的代价，没有细胞的变异，人类就不会得癌症！《星期日泰晤士报》2019年度科普书！ 登顶《星期日泰晤士报》图书畅销榜！雄踞《纽约时报》图书畅销榜18周之久！提名《华盛顿邮报》2019年度图书！入围2019年爱德华·威尔逊科学写作奖长名单！翻开本书，从单细胞斑点讲起，看看30亿年来你的身体的进化史！,8,873,0,39.99,https://wfqqreader-1252317822.image.myqcloud.com/cover/714/32351714/s_32351714.jpg
别人怎么对你，都是你教的,2019-06-01 00:00:00,社会文化-社科,你是否常常陷入人际关系的泥淖？是否常常和家人、朋友、同事冲突不断？是否总是愤愤不平，觉得身边的人都很难相处？如果你的回答是肯定的，那么本书将帮助你打开心结，穿过屏障直抵问题的根源：别人怎么对你，都是你教的。这是心理学中的一句至理名言，适用于任何关系！比如说，男人怎样对你，是你从一开始就惯的、教他的；孩子不听话、软弱不敢承担责任，是你教育失当，从小宠的；朋友无视你、忽略你，也许是没有主见的你让人习惯性地忽视你；同事不够尊重你，拿你当软柿子捏，也许是你畏首畏尾的样子给了别人得寸进尺的机会……我们每个人都在无意识中教会了别人如何对待自己，有的人教会别人尊重自己，有的人教会别人如何爱自己，有的人则教会别人如何伤害自己。生活中的每个人都是你我的一面镜子，透过别人，我们看到的其实是真实的自己。这本书旨在帮助大家看清错综复杂的情感和情绪背后的真相，让大家跟自己和解、跟关系和解，然后走出心灵的困境，活出生命的美好。,11,765,0,40.8,https://wfqqreader-1252317822.image.myqcloud.com/cover/34/25731034/s_25731034.jpg
精英的傲慢：好的社会该如何定义成功？,2021-08-01 00:00:00,社会文化-社科,曾经，社会承诺人们“只要努力，就能成功”如果每个人能在同等机会下公平竞争，那么优胜者就应该获得奖赏。这是“美国梦”所代表的理想，也是大多数现代社会认同的优绩至上主义的伦理核心。然而桑德尔认为，昔日激励无数人奋斗的“美国梦”，恰恰是造成今日美国社会分裂的根源，这种看似公平的成功观造成精英的傲慢和底层民众的怨恨，使成功者深信其成功是自身努力的结果，忘记帮助他们的时机和运气，轻视比自己不幸和缺乏资格的人。这一现状阻碍了社会流动，助长阶级对立，侵蚀民主政治，蕞终导致民粹主义的兴起。面对优绩的霸权，桑德尔希望每位公民思考：不同阶层的人是否可以谋求一种公共利益？我们对彼此的责任是什么？他带领我们从以下三个方面进行思辨：教育的本质与目的，如何建立每一份工作的价值与尊严，重新反思成功的意义。同时，他提醒我们保持谦卑，珍惜所有人的付出，积极讨论更有利于社会公正的举措，走向一种少些怨恨、多些包容的公共生活。,9,822,0,55.3,https://wfqqreader-1252317822.image.myqcloud.com/cover/28/41176028/s_41176028.jpg
中国外卖,2022-07-01 00:00:00,社会文化-社科,本书是聚焦外卖小哥群体的长篇纪实文学。在数字生活已成日常的当今，外卖小哥、快递员等都成为一个个庞大的从业群体，他们是奋斗者，也是“美好生活的创造者”。本书作者先后采访近百位外卖小哥，用饱含温度的文字向读者呈现了鲜活的外卖小哥群像，记录他们艰难的生活和不懈的奋斗。他们渴望改变现在的生活，愿意为家人无私付出，对陌生人主动伸出援手，在疫情和危难中敢于担当，虽然是一个个平凡的普通人，身上却闪烁着温暖动人的人性光芒。本书肯定了外卖小哥作为平凡个体的辛勤努力，也褒奖了他们为实现共同富裕所贡献的群体价值。,7,706,0,34.99,https://weread-1258476243.file.myqcloud.com/weread/cover/37/3300022037/s_3300022037.jpg
父权制与资本主义,2020-03-01 00:00:00,社会文化-社科,"什么是父权制？当代女性又是如何遭到父权制压迫和剥削的？女性解放道路在何方？
本书是作者历经十年完成的重要作品，是其在第二波女性主义接近尾声，后现代女性主义思潮、酷儿理论兴起之初，对女权主义各个派别，特别是马克思主义女权主义的再次思考。近代社会在“资本主义”支配的“市场”和“父权制”支配的“家庭形态双重控制下，以无偿的女性劳务等为中心，形成了女性地位低下的历史根源。 作者对此进行了深刻批判，并就如何改善女性的社会地位提出了中肯的建议。
本书尽管论述的是日本女性的地位问题，但其观点在相当大程度上适用于当下中国的国情。因而对于任何思考女性地位与男女平等问题的人都有着莫大的启发。",15,927,0,27.9,https://weread-1258476243.file.myqcloud.com/weread/cover/35/3300018035/s_3300018035.jpg
应得的权利：男性特权如何伤害女性,2022-05-01 00:00:00,社会文化-社科,"《应得的权利》是康奈尔大学哲学系副教授凯特·曼恩的振聋发聩之作。在本书中，她融合女性主义、哲学、心理学、社会学等知识，犀利地剖析了近些年来引起高度关注的社会事件，案例涉及医疗系统、家务劳动、性暴力、公共事务等多方面，揭示了自由平等表象之下，处处可见的性别不正义现象。从中我们将看到，男性如何仅仅因为性别而获得系统性的优势和特权，从而打压女性应得的权利，并对女性造成伤害。
通过本书，凯特·曼恩不仅为我们理解厌女症提供了一个独特的框架，也为我们构建了一个世界愿景——在这个世界里，女性和男性一样有权得到关注和关心。",4,878,0,25.9,https://weread-1258476243.file.myqcloud.com/weread/cover/53/3300021853/s_3300021853.jpg
跨越边界的社区：北京“浙江村”的生活史,2018-03-01 00:00:00,社会文化-社科,“浙江村”，20世纪80年代起渐次于北京天安门以南5公里的南苑地区汇聚成形。30年来，其经济生产与社会再生产的特殊面貌、内部空间与外部环境的互动演变，已成为研究改革开放以来中国流动人口与城市社会经济发展，体制、权力与政策的鲜活样本。,33,937,0,40.8,https://wfqqreader-1252317822.image.myqcloud.com/cover/494/22391494/s_22391494.jpg
生育制度,2018-08-01 00:00:00,社会文化-社科,本书是一本关于家庭社会学的著作，曾在社会上产生广泛的影响。作者根据抗日战争时期自己在大学授课时的讲义整理、编写而成。书中主要论述了家庭所担负的有关生育子女的若干理论问题。但本书所论述的不止是生育，凡是与种族延续有关的一套活动体系都讨论到了。其中包括：配偶的选择、婚姻关系、家庭组织、双系抚育、父母的权力、世代的隔膜、社会继替、亲属的扩展等等。作者在书中对这些问题的剖析的提出的一些理论观点，对我们今天如何处理家庭婚姻问题、子女教育问题等仍然很有教育意义。,16,881,0,19.99,https://wfqqreader-1252317822.image.myqcloud.com/cover/971/23437971/s_23437971.jpg
后真相时代,2019-07-01 00:00:00,社会文化-社科,2016年英国公投脱离欧盟，特朗普当选美国总统，一时间，“后真相”成为全民讨论的热点，并被《牛津大辞典》选为年度词汇。所谓“后真相”，就是真相和逻辑在信息传播的过程中被忽视，而情感煽动主导舆论的情形。从投票选举到众筹诈骗，再到病毒营销，无论是在政治、传媒，还是商业领域，后真相的案例俯拾即是。显然，我们已经进入了后真相时代。在本书中，为世界顶尖企业提供商业咨询的说故事大师赫克托·麦克唐纳用生动的故事向我们展示出真相是如何被信息传达者肢解、扭曲和掩盖的。他在大量实例的基础上总结出误导者的惯用伎俩，同时告诉我们如何更有效率地利用竞争性真相来证明观点、凝聚人心。作为后真相时代的信息消费者，上当受骗有时在所难免。唯有洞悉真相的运作模式，我们才能更有智慧地处理信息，甚至通过改善真相的讲述方式达成目标。,42,721,0,29.88,https://wfqqreader-1252317822.image.myqcloud.com/cover/282/29189282/s_29189282.jpg
失控,2015-01-01 00:00:00,社会文化-社科,凯文·凯利（1952~），绰号KK，世界著名科技杂志《连线》创始主编，“网络文化”（Cyberculture）的发言人和观察者，第一届世界黑客大会发起者。1994年，其预言未来科技发展的传奇著作《失控》横空出世，十几年后，文中所指相继出现，2010年，《失控》中文版问世，即在中国互联网界和科技媒体引起轰动，从此，KK 的一言一行都成为互联网发展的“风向标”。在互联网创业大潮席卷各个领域的今天，当媒体聚焦在路演、IPO 以及科技公司市值时，KK 依旧冷静地游走在最新科技产品与人迹罕至的原始部落中，思考科技该如何发展以及人类将怎样依靠科技，从而更加幸福地生活。也许只有这样，才可以预见到那些能够真正改变我们生活的伟大发明。KK 让我们相信，科技带给我们的未来，终将是一个充满温暖、人性与自由的“进托邦（Protolia）”。,45,828,0,12,https://wfqqreader-1252317822.image.myqcloud.com/cover/972/536972/s_536972.jpg
乡土中国,2020-06-01 00:00:00,社会文化-社科,该书是费孝通先生的社会学名著，根据其1940年代后期在西南联大和云南大学所讲“乡村社会学”一课的讲义整理写成，收文14篇。是作者在社区研究的基础上，从宏观角度探讨中国社会结构的著作。分别从乡村社区、家族制度、道德观念、权力结构、社会规范等各方面分析、解剖了中国乡土社会的结构及其本色。是中国社会研究的一部比较成熟的作品。书前配有“导读”，书后附“知识链接”，以给青少年以必要阅读指引和知识的积累。,9,909,0,10,https://wfqqreader-1252317822.image.myqcloud.com/cover/355/33820355/s_33820355.jpg
半小时漫画青春期：生理篇,2021-07-30 00:00:00,社会文化-社科,从变声长痘到脸红心跳，笑着笑着解决青春期困扰！读爆笑漫画懂身体变化，全解青少年生理知识。通过手绘漫画的形式，陈磊（混子哥）及其半小时漫画团队为青少年读者讲解了青春期需要了解的健康知识和常见误区：大姨妈其实是卵子婚房的拆迁；乳房的长大是激素两姐妹的艰辛创业史；青春痘是雄激素引发的一场“惨案”，本来保护皮肤的皮脂变成了免疫战争的导火索；精子的成长需要经过的考核不比高考轻松；脸红心跳和懵懂的爱情其实是神经和激素的一场“游戏”……爆笑漫画讲清青春期健康知识，看透成长过程的生理变化，轻松长大没烦忧。,6,903,0,39.99,https://wfqqreader-1252317822.image.myqcloud.com/cover/590/39942590/s_39942590.jpg
今日简史：人类命运大议题,2018-07-13 00:00:00,社会文化-社科,当前人类社会面临着科技颠覆、生态崩溃和核战争三大挑战。“国家”这一身份认同已不足以应对今天的挑战，任何一个国家都无法独立解决全球性问题。人工智能和生物技术正在颠覆原有的社会结构和分配方式，数据成为最重要的资源。 当数据巨头比我们更了解自己，当“在线”成为一种生存方式，如何规范数据的所有权？能否建立起一个维护人类自由和平等的全球社群？人工智能和生物技术已使人类掌握了重塑和重新设计生命的能力。我们该如何运用这种能力，上演另一出全新大戏？ 在一个信息爆炸却多半无用的世界，清晰的见解就成了一种力量。对于关乎人类命运的种种议题，尤瓦尔•赫拉利在《今日简史》中没有简单给出答案，而是引发了我们进一步思考。,9,784,0,40.8,https://wfqqreader-1252317822.image.myqcloud.com/cover/166/22973166/s_22973166.jpg
远见：如何规划职业生涯3大阶段,2018-01-01 00:00:00,社会文化-社科,一堂来自奥美互动全球首席执行官的职业生涯规划课，30余年职场洞察的结晶。给朝着漫长、兴奋的职场迈出第1步的你；给在职业生涯中迷茫、困惑的你；给在职场不断拼搏、渴望进取的你；给在职业生涯中陷入迷茫的你，给所有想要获得成功的职业生涯的你。3大职场燃料，4大黄金问题，5个关键数字，100小时测试……带你打造理想的职业生涯。2017年Axiom商业图书奖获奖作品，2016年“商业:职场”类图书奖，荣登2017年国际图书榜单。58同城网CEO姚劲波，猎豹移动联合创始人兼CEO傅盛，think3group智立方品牌营销董事长杨石头，聚美优品高级副总裁刘惠璞，《非你莫属》节目制作人刘爽，知名自媒体warfalcon创始人、100天行动发起人、时间管理专家战隼，珩跃实业创始人、朝景投资联合创始人、知乎人力资源管理优秀答主李石等倾情推荐。樊登读书会、十点读书、馒头商学院、开智学堂、行动派社群、黑马读书会、今日头条、笔记侠、TalentGuide、《商学院》杂志、管理智慧、千禾会等联合推荐！湛庐文化出品。,9,696,0,9.99,https://wfqqreader-1252317822.image.myqcloud.com/cover/289/23691289/s_23691289.jpg
之江新语,2007-08-01 00:00:00,社会文化-社科,《之江新语》一书，收录了习近平在担任中共浙江省委书记期间为《浙江日报》“之江新语”栏目撰写的232篇短论。这些短论及时回答了现实生活中人民群众关心的一些问题，是坚持“从群众中来，到群众中去”这一科学的领导方法和工作方法的生动体现，是运用马克思主义的立场、观点和方法观察问题、分析问题、解决问题的光辉篇章。当前，按照中宣部、中组部的要求，全党正在掀起学习书记系列讲话精神的热潮。本书是深入学习领会书记系列讲话精神必不可少的重要著作，也是党员领导干部深入学习领会十八届三中全会精神、开展群众路线教育实践活动必读的重要著作。,70,0,1,0,https://wfqqreader-1252317822.image.myqcloud.com/cover/147/24988147/s_24988147.jpg
