title,publishTime,category,intro,maxFreeChapter,newRating,free,price,cover
如何做田野笔记,2012-06-01 00:00:00,社会文化-社科,近几年，许多人类学家开始强调写作的重要性。而众所周知，民族志写作的起点和基础是研究者的田野笔记。那么，如何做田野笔记呢？为此，三位具有丰富田野实践和教学经验的人类学家，给出了一系列实用而又指导性的建议。本书通过大量的正在撰写的、“未完成的”田野笔记实例，考察了田野研究者如何将亲身经历和观察写成田野笔记的过程，讨论如何运用田野笔记来讲述民族志故事的方法，以及帮助研究者基于田野笔记撰写民族志的关键步骤。本书致力于提出一套实用的田野笔记写作指导，以帮助社会学、人类学、民俗学、口述历史学、教育学等学科的本科生和研究生，因为田野研究和人类学方法在以上学科中都占有十分突出的地位；另一方面，对于政治学、商业管理、传播、社会福利及公共卫生等学科，田野研究和民族志也可以作为次一级的辅助研究方法。《如何做田野笔记》系美国当代知名人类学家罗伯特·埃默森等撰写的一部有关人类学研究专著。田野调查是当代文化人类学研究的重要环节，而其中的关键之处，就是如何作田野笔记。此书结集的数位人类学家的经验谈，对此项工作作了详尽、清晰的阐述，也是该学科基础方法的指导之作。,14,810,0,24.99,https://wfqqreader-1252317822.image.myqcloud.com/cover/499/25856499/s_25856499.jpg
我们都是食人族,2016-08-01 00:00:00,社会文化-社科,《我们都是食人族》为结构主义大师列维—斯特劳斯于1989年至2000年间，在意大利《共和报》所发表的16篇专栏集结，以及发表于1952年的《被处决的圣诞老人》一文。在这些文章里，列维—斯特劳斯立足当时社会热点，探讨了如圣诞为何“习俗”风靡全球、疯牛病蔓延广泛、女性割礼是否侵害人权、亲子关系应基于血缘还是亲缘等议题，用结构主义和人类学的眼光审视自己身处的时代和社会，反思科学与自然的关系，告诉我们“所谓复杂或先进的社会，与被误称为原始或古代的社会，两者之间的距离远较人们认知的小上许多。”就像出版于1955年的《忧郁的热带》一样，列维—斯特劳斯文章的写作时间并不标示它过期的时间。相反，他在这些文章中对当代社会的文化反思放到现在依然成立，且无比犀利，几近预言。,6,687,0,21,https://wfqqreader-1252317822.image.myqcloud.com/cover/424/24019424/s_24019424.jpg
黑猩猩的政治：猿类社会中的权力与性（睿文馆）,2014-01-01 00:00:00,社会文化-社科,《黑猩猩的政治》是一本畅销四分之一个世纪的跨学科的经典之作，它的科学发现不仅震撼了动物学界，而且它又是一本深受政治家、企业管理者、社会心理学工作者欢迎的人文读本，因为它以一种另类的方式，通过我们的近亲黑猩猩，洞悉了人类最基本的需求和行为。本书详尽叙述了黑猩猩群体之中围绕着权力和性行为所展开的竞争和联盟，得出了这种行为不是出于本能，而是智慧的惊人结论。我们从阿纳姆的黑猩猩的行为举止中，能读出马基雅维利的狡诈权谋，并领悟德瓦尔耐人寻味的结论：政治的起源比人类更古老。2007，本书年被哈佛大学100位教授共同推荐为人类历史上最具影响力的经典图书之一。,26,807,0,29.99,https://wfqqreader-1252317822.image.myqcloud.com/cover/967/25352967/s_25352967.jpg
技术陷阱：从工业革命到AI时代，技术创新下的资本、劳动与权力,2021-11-01 00:00:00,社会文化-社科,每一次重大的技术变革，都会给社会的主要工作形态带来深刻的影响。本书系统而全面地回顾了近几百年技术进步的历史，以及它如何从根本上改变了社会成员之间的经济和政治权力分配。本书作者将带领读者们遍览各个时代技术进步对人们工作形态的影响，揭示不同时代“打工人”的处境，并最终将目光转向未来，试图分析当前的AI革命将对我们的工作造成何种影响，以及我们该如何做出应对。作者力图说明，技术进步对收入造成何种影响，将决定人们对它的态度。工业革命是历史上的重大时刻，但当时几乎没有人意识到它的巨大后果。正如本书所表明的那样，工业革命从长远来看创造了前所未有的财富和繁荣，但机械化的直接后果对大量人口来说是毁灭性的。中等收入岗位减少，工资停滞不前，劳动收入占比下降，利润激增，经济不平等加剧。本书作者卡尔·贝内迪克特·弗雷证明，这些趋势大体上反映了我们现在这个始于计算机革命的自动化时代的趋势。正如工业革命最终为社会带来非同寻常的利益一样，人工智能系统也有潜力做到这一点。《技术陷阱》表明，在眼下这场新的技术革命中，过去的教训可以帮助我们更有效地面对现在的状况。,7,692,0,49.2,https://wfqqreader-1252317822.image.myqcloud.com/cover/274/41868274/s_41868274.jpg
公益向右 商业向左,2017-08-01 00:00:00,社会文化-社科,"    这正是一本从宏观上介绍中国的社会企业发展之路的书。它旨在帮助读者理解什么是社会企业，社会企业的模式有哪些，社会企业能否参与分红，为什么需要社会影响力投资，以及社会企业的未来在哪里。
",11,784,0,29.4,https://wfqqreader-1252317822.image.myqcloud.com/cover/803/912803/s_912803.jpg
故事绕口令100篇,2019-06-20 00:00:00,社会文化-社科,本书是原有少儿语言艺术系列教材的延伸产品，旨在通过练习绕口令，培养孩子语言表达的能力。本书的结构比较纯粹，由理论和训练两个部分组成。训练部分由100个绕口令和100个故事组成，通过故事记住绕口令，通过绕口令这样的语言游戏，让孩子爱上语言表达，培养孩子的自信。,15,792,0,14.99,https://wfqqreader-1252317822.image.myqcloud.com/cover/338/26435338/s_26435338.jpg
中国新材料产业发展报告（2020）,2020-12-01 00:00:00,社会文化-社科,本书是中国新材料产业发展年度系列报告的第16部。本期报告从国内外新材料产业竞争态势起笔，结合当前国家的大政方针，高屋建瓴地阐述新时期我国新材料产业发展的战略愿景；从重大公共卫生安全保障材料、先进基础材料、前沿新材料、关键战略新材料、“新基建”新材料支撑体系几个方面，分别介绍各领域新材料产业的发展态势、存在问题与解决方案。报告的编写人员都是来自材料科技和产业界第一线的专家、学者和产业界人士。通过报告内容，读者可以对我国当前新材料重点产业的现状和特点、关键技术、主要问题以及对策和建议有较全面的了解和掌握。本书可为从事新材料研发、产业化发展的科技工作者、产业界人士及其他人员提供参考。,34,0,0,122.99,https://wfqqreader-1252317822.image.myqcloud.com/cover/589/41807589/s_41807589.jpg
谣言：世界最古老的传媒,2018-01-01 00:00:00,社会文化-社科,《谣言》是传播学领域的一本名著，在对公共舆论的探讨上有重要的地位。作者经过数千次电话调查，搜集了无数各种各样的谣言分析研究的结果，阐明了人们只有掌握了谣言的规律，才能找出控制它或者反击它的办法。作者充分运用了“年鉴学派”的研究方法，生动地论述了谣言对人类社会的影响与作用。作者搜集了20世纪八九十年代在法国流行的种种谣言，阐述了他们的起源和流传路径、人们为什么会相信它们、人们是如何利用谣言来达到自己的目的。他还分析了谣言在明星制度、政治、金融、商业行为中的作用，不仅着眼于谣言本身，更对谣言背后所附带的文化与社会背景进行了深入的探讨。,9,662,0,26.99,https://wfqqreader-1252317822.image.myqcloud.com/cover/717/32282717/s_32282717.jpg
新闻：幻象的政治（第9版）,2018-03-01 00:00:00,社会文化-社科,《新闻：幻象的政治》在1983年首版时就成为政治传播研究的里程碑作品。从那时起，此书一直是政治传播学领域的经典之作。在每一版中，班尼特都把自己以及其他学者关于政治传播最新的研究成果融入书中。班尼特对于材料的论述也遵循实事求是的原则——新闻与政治的互动是复杂、混乱、充满惊奇和矛盾的。书中穿插了大量简洁的案例研究，并且每一版都会更新，这一切说明，班尼特的描述和分析是建立在真实世界的事件基础上的，而不是意识形态上的哲学推理。作者的结论是扎实的，但从来不是教条主义的。作为一个国家政治信息体系的核心，新闻如何发挥好为民主服务的功能？为了探讨这个重要问题，本书从两方面进行了审视：政治人物如何设法让自己想要传达的讯息成为新闻；记者和媒体如何报道新闻。新闻消费与生产方面发生的重大变化是新闻业新旧时代交替的推动者，在第九版，班尼特讨论、分析了这些变化。,26,757,0,52.8,https://wfqqreader-1252317822.image.myqcloud.com/cover/588/23600588/s_23600588.jpg
我们需要什么样的文明,2017-06-01 00:00:00,社会文化-社科,本书选编张汝伦教授演讲、随笔和论文。分为三编，各取象精神、国家、文明。上编：把握在思想中的时代；中编：现代性语境下的中国；下编：我们需要什么样的文明。在上编，作者立足一位哲学学者对古今中西哲人思想、哲学主题的探索；在中编，进入到对中国文明当下境况的反思；在下编，作者展现一位当代中国知识分子，对未来中国文明的理想与期望。,9,818,0,43,https://wfqqreader-1252317822.image.myqcloud.com/cover/903/23723903/s_23723903.jpg
文化、群体与认同：社会心理学的视角（新视角﹒新探索：文化与社会心理学丛书）,2016-11-01 00:00:00,社会文化-社科,随着现代化、城市化与全球化的推进，社会文化转型成为中国社会面临的现实问题，社会心理学可以从哪些角度表达自己对现实问题的关注？本书立足于“文化”与“群体”，从文化社会心理学及群际心理学两个学科视角出发，探讨“认同”这一机制的形成及其对人们生活的影响。本书第一部分聚焦于“文化、群体与认同”相关主题的理论探讨与思考；第二部分结合已有的实证研究，探讨中国社会中现实群体的形成及文化、群体与认同相互作用的过程。,7,714,0,20.7,https://wfqqreader-1252317822.image.myqcloud.com/cover/117/23669117/s_23669117.jpg
红皇后效应,2021-07-01 00:00:00,社会文化-社科,人类为什么不是雌雄同体？为什么年轻女人都有纤细的腰身？为什么富有的男人要娶美丽的女人？年轻就等于美丽吗？……我们或许有很多诸如此类的两性困惑，但很少有人会把性和人性联系到一起。英国知名科普作家马特·里德利借用“红皇后假说”（美国古生物学家瓦伦于1973年提出，其典故出自童话故事《爱丽丝镜中历险记》），从进化角度破解了性的起源，探讨了性选择是如何塑造物种多样性和人类心智的，两性博弈是如何塑造人性的，如此种种问题。所有的进步都是相对的。在《爱丽丝镜中历险记》中，爱丽丝和红皇后拼命向前奔跑，却仍停留在原地，因为周围的景观是和她们一起移动的。爱丽丝跑得越快，世界随之更新的速度也越快，她的进步也越小。生物进化也是如此。英国知名科普作家马特·里德利选取微生物、植物、昆虫、鱼类、鸟类以及人类等的案例，运用红皇后效应中的悖论展示了基因竞争是如何导致性别产生，性选择是如何塑造物种多样性和人类心智的，两性博弈是如何塑造人性的，如此种种。为什么人类既如此相同却又各具特色？不了解性的演变，便难以理解人性的进化。认识你自己吧，别总探索上帝！,36,0,0,39.9,https://wfqqreader-1252317822.image.myqcloud.com/cover/676/44277676/s_44277676.jpg
小趋势：决定未来大变革的潜藏力量,2019-02-01 00:00:00,社会文化-社科,率先提出“小趋势”概念的美国未来学家马克·佩恩经典之作，以全新的视角捕捉正在发生的变化，洞悉小趋势正在引发的大变革，帮你成为把握时代机遇的人。《变量》作者何帆作序强力推荐，罗振宇2018-2019跨年演讲主题。,30,640,0,34.4,https://wfqqreader-1252317822.image.myqcloud.com/cover/778/24051778/s_24051778.jpg
第一等人：一个江南家族的兴衰浮沉,2019-01-28 00:00:00,社会文化-社科,侯氏家族是嘉定明代中叶至明末的名门望族，忠烈之门。侯氏起始于一户普通的耕读人家，以读书科举起家，终达“一门三进士”的辉煌。“第一等人”，是侯氏家族中的首位进士侯尧封的人生追求和宏大理想，后来成为侯氏的家训。《第一等人：一个江南家族的兴衰浮沉》以侯氏家族的侯峒曾为中心人物，广泛搜罗前人未用、少用的史料，试图还原一段尘封的真实历史，用鲜活、珍贵的细节消解由来已久的模式化人物形象。时代的更迭带来了深重的苦难，也碰撞出无数令人唏嘘的细节，让今人感同身受。通过这个故事，读者也可以具象地窥见中国传统的思想、文化、生活。,13,735,0,34.8,https://wfqqreader-1252317822.image.myqcloud.com/cover/45/24191045/s_24191045.jpg
从缠足到美容手术：中国女性身体的建构,2017-06-01 00:00:00,社会文化-社科,　　该书描述了女性身体形象经历了哪些变化，对中国女性身体建构的时间性行了分析，探讨了背后的驱动因素，对中国女性身体管理和规训的技术行了分析，并对未来中国女性身体建构的可能性行了展望，包括中国女性身体建构的个性化，多元化以及动态化的趋势。本书旨在研究中国女性身体的建构历程，以及背后的驱动因素和自我生产的印刷，或者说社会结构与个体行动之间关系的相互作用是怎样的。该书描述了女性身体形象经历了哪些变化，对中国女性身体建构的时间性行了分析，探讨了背后的驱动因素，对中国女性身体管理和规训的技术行了分析，并对未来中国女性身体建构的可能性行了展望，包括中国女性身体建构的个性化，多元化以及动态化的趋势。,11,758,0,15,https://wfqqreader-1252317822.image.myqcloud.com/cover/104/32511104/s_32511104.jpg
计算社会学,2019-05-01 00:00:00,社会文化-社科,我们已经见证了社交媒体、智能手机以及其他科技奇迹的诞生与进化，这些科技工具让我们能够以前所未见的规模和深度采集并处理有关人类行为的数据，从而为研究人类社会提供了一个全新的路径。这本书是一部里程碑式的作品，它将彻底改变下一代社会科学家和数据科学家探索世界的方式。大数据的10个共同特征是什么？如何通过数据预测美国总统大选的结果？如何在短时间内对100万个星系进行分类？大规模数据采集面临着怎样的道德伦理困境？科技公司是否在监视我们的行为，数字时代是不是将我们带进了“全景监狱”呢？在计算社会学这一新兴领域，作者阐述了数字革命如何扭转了社会科学家和数据科学家观察行为、提出问题、开展实验和进行大规模协作的方式，详细描述了大批真实的案例，并且划定了面临伦理挑战时需要遵循的4项原则。这本书用全新的数据模式解锁了社会学。对社会科学家来说，它是一本跨界指南之书；对数据科学家来说，它是一本素养提升之作。,11,758,0,41.4,https://wfqqreader-1252317822.image.myqcloud.com/cover/711/25455711/s_25455711.jpg
高薪城市,2021-09-01 00:00:00,社会文化-社科,留在大城市还是去小地方定居？如何选择工作地点？怎么判断哪座城市有发展潜力？同一种工作，在不同城市的收入为何差距很大？为什么有的城市留不住人？大城市需不需要低端劳动力？为什么大城市的房价这么高？近年来为何各地上演“抢人大战”？老牌城市如何突破发展的瓶颈？在过去数十年中，地理位置的因素对于薪水、人口流动的作用越加重要，在面临找工作、迁徙等重要的人生抉择时，如何做出理性的判断？本书论述的内容涉及收入差距、房价、结构转型、产业发展、教育、移民等各个方面，无一不是关系到家庭与个人生活福祉、国家和地区繁荣的重要问题。与抓眼球的新闻报道不同的是，作者通过本书，引领我们去探究问题背后更为重要的长期趋势与深层次的原因。,11,701,0,27.5,https://wfqqreader-1252317822.image.myqcloud.com/cover/500/40740500/s_40740500.jpg
流动的家园：“攸县的哥村”社区传播与身份共同体研究,2014-03-01 00:00:00,社会文化-社科,本书是国内传播学界第一次对中国流动人口进行社区传播研究的专著。书中对石厦村这一流动人口大量聚集的社区进行了一次全方位的社区传播生态分析，以展示在全球化的网络社会形成过程中，中国的农民工群体以中低端媒介技术工具，按照自己的需求甚至创新，形成了独具特色的媒介化社会关系和传播实践。以此回应国际著名学者曼纽·卡斯特对于不同文化和制度下有可能产生不同网络社会结构、形态的理论假设。,12,897,0,26.7,https://wfqqreader-1252317822.image.myqcloud.com/cover/681/23509681/s_23509681.jpg
城中城：社会学家的街头发现,2016-01-01 00:00:00,社会文化-社科,1989年，印度裔的年轻学生文卡特斯进入芝加哥大学开始攻读社会学博士学位，并师从贫困问题研究专家从事城市贫民窟的社会调查项目。背着书包、拿着问卷，他走进了芝加哥最为著名的“城中城”贫民窟——罗伯特泰勒计划区。文卡斯特深入城中城，亲自体验街头生活，打入黑帮内部，曾冒着生命危险，周旋在由黑帮老大、打手、毒贩、军火贩子、牧师、警察、社工以及各色人等交织而成的地下社会交际网络之中，取得第一手的资料，写就了这本书。书中的多数人物姓名与身份都做了匿名化处理，但其中所有的人物、地址与机构都真实存在，绝非虚构。,6,782,0,7.99,https://wfqqreader-1252317822.image.myqcloud.com/cover/310/842310/s_842310.jpg
昨日之前的世界,2014-08-01 00:00:00,社会文化-社科,传统社会对现代社会来说意味着什么？是充满冲突与混乱的蛮夷之地，还是尽享田园生活的世外桃源？但无论如何它离我们并不遥远，而且潜移默化地影响着现代社会人们的生活方式。传统部族社会的社会实践要比现代国家社会更久远，它在如何组织一个人类社会的问题上，已经进行了成千上万次自然的实验。普利策奖得主贾雷德?戴蒙德在新书《昨日之前的世界》中就一探传统社会的生活方式能为现代社会带来哪些启示。在新几内亚部落生活了近50年的戴蒙德通过对部落社会生存环境、生活习俗、行事方式的观察、记录来剖析人类社会的演进，这本书就是他多年研究的结晶。戴蒙德在书中再次展现了他知识的广度与深度，从人类学、社会学、语言学、生理学、营养学和演化生物学等角度剖析区域划分、战争冲突、人际关系、养育孩子、对待老人、应对危机、宗教信仰、语言习得、健康膳食这9个方面，全面、生动地展现了传统社会最核心的生活方式。这9个代表传统社会的小切面也同样主宰着今日世界，因此，值得生活在现代社会的我们参考和借鉴。伴随着科技的高速发展，现代人往往在快节奏的生活中迷失了自我，人际关系疏远、社会分配不公、愤世情绪高涨、社会冲突不断、身体亚健康、盲目崇拜流行文化等问题已成为现代社会的桎梏，在这一背景下，我们应该回顾人类祖先的原始生活方式，追溯那些曾经帮助人类完善自我、建立文明与有序社会的良好根基，而这就是“昨日之前的世界”。相信每个想要关心人类社会演变历史和未来趋势的读者都不会错过《昨日之前的世界》。,13,723,0,27.6,https://wfqqreader-1252317822.image.myqcloud.com/cover/436/603436/s_603436.jpg
你的名字，不止是全职妈妈,2022-02-01 00:00:00,社会文化-社科,《你的名字，不止是全职妈妈》，是一位人类学学者对全职妈妈社群四五年持续参与、观察、记录和思考的纪实作品，也是社会学及人类学笔记，真实呈现全职妈妈的境遇，思索为什么会形成这样的困境。反思和探索女性价值多元的可能性，回应一位全职妈妈的小心质疑：“难道我们女的就只能接受生娃带娃养娃的命运？”回应她们流着眼泪发出的感慨：“这个社会怎么对全职妈妈这么不友好。”可能，我的这本书就要回答，女性可以身处更加包容的社会，可以拥有更多可能的选择，并不需要被某种命运绑缚。,26,677,0,47,https://wfqqreader-1252317822.image.myqcloud.com/cover/463/43210463/s_43210463.jpg
赋能领导力,2017-07-01 00:00:00,社会文化-社科,究竟什么是赋能领导力？5个关键词概括就是成长、授权、成就、套路和迭代。关注员工和领导者自身的成长，把团队状态和组织能力当做常抓不懈的大事；给精英员工足够的授权，让他们在工作中修炼成长并享受其中；成就下属，使他在工作中获得成就感，成就下属也是成就领导者自己；帮助下属掌握工作中的方法和套路，让下属成为有套路的人才；敏捷迭代，在迭代中业务本身、员工和领导者自身都要有成长。《赋能领导力》基于田俊国老师多年实践的 “赋能领导力” 精品课程，全书分为三个部分共9章内容，聚焦赋能领导力的三大业务关键：业务设计、引领变革、解决问题；赋能领导者最重要的三大工作：化解冲突、教练下属和团队学习；赋能领导者必需的三大能力：构筑人脉、传播思想和反思觉察。虽然每一章聚焦领导者面对的不同问题，但强化的却是同一套指数时代的领导理念和方法套路。这本书力图重新定义指数时代卓越领导者的特征和关键行为。《赋能领导力》是一套完整的赋能领导力路线图，全书9章内容的每一章都是一门独立的培训课程。介绍的每一个工具、每一套方法套路都经过不同优秀企业的实践检验，被证明是极为有效且好用的工具和方法。,7,808,0,24.99,https://wfqqreader-1252317822.image.myqcloud.com/cover/370/23691370/s_23691370.jpg
删除：大数据取舍之道,2013-01-01 00:00:00,社会文化-社科,"删除》讲述了遗忘的美德，为读者展现了大数据时代的取舍之道。
《删除》洞见了“被遗忘的权利”，回溯了人类追寻记忆的过程。如今，数字技术与全球网络正在瓦解我们天生的遗忘能力——过去正像刺青一样被刻在我们的数字皮肤上，遗忘已经变成了例外，而记忆却成了常态。
删除，大数据取舍之道，就是把有意义的留下来，把无意义的去掉。只有理解了在大数据中，需要的是什么，以及如何判断这种需要，才能举一反三地明白到底为什么要去掉那些不需要的。
《删除》开启了一场关于“遗忘”的热烈讨论，让我们始终记得遗忘的美德。这本书告诉我们，在大数据时代，面对海量信息人类该如何取舍，怎样才能构建一个积极而安全的未来。",5,513,0,30.86,https://wfqqreader-1252317822.image.myqcloud.com/cover/410/713410/s_713410.jpg
中国电视史：1958-2008,2018-01-01 00:00:00,社会文化-社科,本书是一部媒介史领域的专著，对中国电视业半个世纪（1958—2008）变迁与演进的历史展开了系统性的研究。作者采用传播政治经济学、媒介社会学与话语理论相结合的研究体系，在电视与社会现实、日常生活和权力结构之间的关系中，对这一强大而富庶的大众媒介与中华人民共和国历史之间的勾连与互动过程，进行了全面而深入的阐释。全书共六章，对中国电视业发展的不同时期进行了总结和分析。中国新闻史学会创始会长、中国新闻传播史学泰斗方汉奇教授和清华大学新闻与传播学院郭镇之教授作序。,13,0,0,63.2,https://wfqqreader-1252317822.image.myqcloud.com/cover/477/25665477/s_25665477.jpg
